IDREVIEW,HOTELID,REVIEW
179,678,"Oct 7 2006 	Good location at a fair price	Stayed in a standard double with my husband. Booked thru a name your price option but only received less than $20 off per night from the regular internet price. Stayed 4 nights 3rd week of September 2006.Pros: Very nice &amp; clean, HUGE bathroom with decent water pressure. Bathroom was almost as large as the sleeping area and appeared to be updated recently. Had a working heated towel rack, which was a nice luxury. Had all necessary items in room: safe, refrigerated mini-bar, ironing board, hairdryer &amp; trouser press. A/C worked well in unseasonably warm late summer. 24-hour business center made it easy to keep in touch back home. Staff friendly &amp; efficient. Charming location: clean, relatively quiet &amp; felt safe walking in this area at night. Within a couple of blocks of the St. James underground terminal. Several pubs &amp; restaurants nearby. However, since this is basically a business area, most places close early with some closing as early as 5:30pm on weekend nights. Buffet breakfast was a little spendy, but worth it if you require a big, quality meal in the morning. There are cheaper breakfast options nearby, but I found that with the cheaper options, the quality in the meats (bacon &amp; sausage for full English breakfast) didnt seem to taste as good  too salty. Also, if you were to add fruits, juices and other pastries to the breakfast, it would come out to be about the same. Good martinis in lounge and excellent to sip in courtyard when weather permits.Cons: Bed was not as comfortable as Im used to, but I seemed to sleep fine regardless. Extremely grimy &amp; sooty lampshades, which seemed odd because everything else was pretty clean. Usually, Im not one to notice something so minor as lampshades, but the condition of them were really quite horrendous. Since I did not stay in another hotel in the area during my stay, I cant really comment on the value, but it seemed fair enough especially given the location. The rooms seriously need updating and if done so even just a little, this would be an excellent choice. Would consider staying here again or at least recommend."
180,678,"Oct 7 2006	Disappointing.......	First impressions of this hotel are good, it has an impressive look from the outside as does the lobby. Check in was quick and polite but not particularly friendly, as we found with most the staff we encountered, although a couple were. The corridors however are in desperate need of a refurb lending a somewhat shabby appearance! The room itself was OK, the bed small, no way a queen size as was stated, more like a standard 4'6&quot; and really not what you would expect from a Crown Plaza. Also slightly surprised by the use of sheets and blankets - I thought hotels had moved on to duvets! The bathroom was nice though and the shower great. One word about room service - WAY OVERPRICED! Eat out instead - theres loads of choice in London! Would choose Kensington Forum next time - more convenient and modern!"
181,678,"Oct 4 2006 	Not as good as you might think...	I stayed here on a Friday and Saturday night in late September 2006 on business.Would I stay here again? Er, no.Why not? Well, at 179/night I thought that the carpets in the hallway really shouldn't be as tatty as they were (the foyer of course is spotless), that the elevators should actually work to save me lugging baggage and laptop up three flights of stairs, and that it ought to have some decent sound insulation between walls/windows, given that it's a 4 start hotel (allegedly). It does not.The man in the next room to me coughed, and I actually thought there was someone in the same room (I was in Room 315 in case you're interested). Noise travels down the hallways like you wouldn't believe, and if you're unfortunate enough (like me) to be situated on the front wall of the hotel facing the street, then you better pack earplugs if you plan on actually getting any sleep, because when the garbage men come round at whatever unearthly hour they did (on both nights that I stayed), you will get woken up when them empty 10,000 bottles (or what sounds like it) out of wherever it is they are emptying. A TraveLodge has better sound insulation.Oh, and my (male) business colleague and I shared a room - a delight (not). It was a twin, but the beds were close enough so that if he mistook me for his wife in the night, we'd have been in a lot of trouble."
182,678,Sep 28 2006 	Loved It. Would stay there again. Great location very clean nice staff.	We stayed from 9/21 to 9/26 and enjoyed everyday. The staff was excellent and so helpful. The rooms were some of the cleanest hotel rooms I have ever stayed in. The location is wonderful. On a scale of 1 to 10 I would rate this a 9. Next time we come to London we will stay here again and upgrade to a suite. Do not hesitate to stay at the Crowne Plaza you will not be disappointed.
183,678,"Aug 8 2006 	We Thought It Was Great	We had two rooms. Room 166 for my 13 yr old daughter and friend was a fabulous large room. Double bed, large bath, overlooked courtyard, clean and well decorated. My husband and I stayed in room 157, a bit smaller, double bed, overlooking courtyard, clean and with all amenities. We received good service from all employees, had tea out in the well maintained courtyard with great service. The hotel is in walking distance from Buckingham Palace and Westminster. We arrived at 10:00 and could not check in, but by 3:00 when we arrived back at the hotel after sight seeing, our bags were in the rooms. When we returned in the evening the girls room had been &quot;refreshed&quot; and the beds turned down. But for some reason our room did not get the same service. We did not eat breakfast in the hotel due to cost, but we found many coffee shops in the vicinity on our way to sights. I will definitely stay here again if I can get room 166. Only complaint...2 employee told us the cab ride to Gatwick was 30-45 minutes. It took one hour and 15 minutes so .....there was much nail biting the last 30 minutes of our trip."
184,678,"Jul 29 2006	What a Disappointment	Through priceline I booked Crowne Plaza London Saint James and though I was given a great deal--about half off the nearly $400/night room rate for this 4 star hotel. Once we were shown to our room, though, we were quite disappointed. Our room was a TINY corner room with a window that for the most part directly faced a brick wall. The bed was tiny--maybe a double bed but definately not a queen. The bathroom was nicely appointed (which was the only 4star aspect of this depressing little room). It is amazing that a place can get a 4 star rating when some of the rooms can be so much less than 4-star! We were in Paris just before London and stayed at this amazing 3 star hotel--so it was quite a contrast! If I had paid full price for this room, I would have been absolutely sick.Since we were only in London overnight, we wanted to make the most of our time by heading out as soon as we had checked in. We were told that our bags would be brought right up to our room so we waited and waited and waited. Finally we called to investigate where our bags were. They were finally delivered but we had to wait quite some time. Very frustrating.On the plus side, the hotel was in close proximity to the Victoria train station so we could quickly get there to catch the express to Gatwick. It was also within quick distance to the Eurostar."
185,678,"Jul 27 2006 	Great location but overpriced	I have stayed at this hotel several times, mainly because of its excellent location. Check in staff helpful, but a little stand offish. Standard room, but adequate. Nice and clean, and did not witness any of the &quot;dust&quot; described by other customers.Breakfast overpriced, would recommend using the little Italian cafe just outside the hotel. Great prices and quality and a -- sight cheaper than the hotel. (Turn left outside the hotel, about 50 metres down the road on the right had side).Overall, great location, but extremely expensive for what you get."
186,678,"Jul 20 2006 	Terrible place	We stayed in the room 422 for two days going from Europe back to USA. Try to avoid this room. It overlooks air conditioning duct, it is small and with the strong smell of mildew. Pity, I did not take the pictures, but I guess other will include them soon.When we complained about the smell they told us that they will come to refresh the room (which meant they sprayed it, but it did not change anything). Carpets in the halls were dirty and dusty, elevators very old. The only advantage: good location and decent breakfast. We had breakfast included in price - but if not it costs $36 per person. I wanted to access internet and had to pay $14 for 15 min. They sell the cards and it is not possible to use internet for 5 minutes.Summary: overpriced hotel in need of renovation or at least cleaning. Staff not very helpful. By the way, we were offered newspapers (usually complimentary), but then they included it on the bill. The first day we got it delivered, the second day they forgot it. Also they forgot to change towels in the bathroom. Fortunately, we stayed there only two days."
187,678,Jul 13 2006	FREEKIN DUST BOWL!!! DUMPY [---] PIECE...HORRIBLE!	If you are a fan of DUST then this is your Hotel.I think the Hotel was built around the 1700's and I think the dust has stayed there since then.I could barely breathe and the carpet was a wreck. 4 stars...ha ya right!It was a disaster. The lobby looks all amazing so you are thinking to yourself this place is gonna be awsome! NO!!! It is such a [---] hole. The elevator must have been the first one ever made. Its like a death trap and I was on the very top floor and I think Henry the VIII was my roommate. Such a dusty dump. If you are best friends with dust then this is your place. Have they never heard of a vacum...Does Mr. Hoover not sell in those parts? Would buying and replacing the carpet be so bad?The furniture has dents and scrapes in it from I am guessing the time Keith Richards stayed there in the 70's and the carpet had stains..stains galore.Please dont stay here...for the love of GOD!Two fingers up
188,678,"Jul 9 2006	Enjoyed very much!	We stayed here for 2 nights after a Med cruise out of Rome. Having operated on Euros for two weeks we were fairly enured to the dollar exchange rate, but... this hotel really had us going into laughter with room service rates ... $32 for a hamburger! An excellent place to eat was at the end of Buckingham Gate from the palace ... The Albert. We absolutely loved it. The hotel was extremely quiet due to the extremely heavy door to our room. Location was great and would definitely stay here again."
189,678,"Jun 8 2006	Second visit disappointing	I stayed at this Hotel at the end of December and had a lovely room and a very nice experience.I liked the location, room was very nice close to the underground and nice neighborhood. It was down the street from Buckingham Palace, yet it was on a quiet street.When I decided I would start my 2 week vacation in late May in London I booked 3 nights at the hotel in February.I am also a priority club member which entitles me to an upgrade if available.Our room was not ready so they brought us coffee, nice start except that when we inquired after an hour if it was ready we were told it was not. Later found out it was the person never bothered to check.I was told this was the only room I could get since I wanted non smoking. The entire floor is non smoking and this was the only room.... It was tiny long and narrow ...the view was a wall. The TV was so old and small and far away from the bed you could barely hear it at normal volume.The Concierge was rarely able to answer any questions.On the plus side we ate dinner at the restaurant our last night and the food was excellent as was the service ...nice atmosphere and quite busy."
190,678,"Jun 1 2006	A Week on Holiday	My wife and I just returned from a great week in London. We loved the Crowne Plaza Hotel London - St. James. The room was a good size and well decorated. Yes, some parts of the hotel are showing some wear, but you have to look past that fo find the real beauty of this hotel. I really call this hotel A-MAZE-ING as I felt like I was working my way through a maze as we found our way to our room, but then, that's part of this hotel's charm. First I list THE POSITIVES--LOCATION, LOCATION LOCATION! So close to Buckingham Pallace, the Palace Museum and the Royal Mews. Within walking distance of Westminster Abbey, Parliament, Big Ben, the London Eye, St. James Park, Trafalger Square and Piccadilly Circus. Just a few minutes from the St. James Park Tube Station, which gives you access to the whole of London. Then the staff is VERY friendly and helpful.Next I list THE NEGATIVES, which are few. The cost of eating in the hotel can put some real stress on your budget, and STAY away from the MINI BAR. 2.95 for a mini can of Pringles is outrageous as is for a full English breakfast. I suggest you go up to the corner of Petty France and BuckinghamGate to Bon Gustos Italian Resaurant. It's open for breakfast (an English breakfast for 3.95) and lunch only. For diggner try soem of the many local pubs. The Buckingham Arms or the Adam and Eve, both on Petty France. They both have GOOD food at reasonable prices. Another interesting pub is St Stephens Tavern just across the street from Big Ben where you can take your dring, go up stairs and think of the &quot;ghosts&quot; of members of Parliament who may have sat in that very spot plotting their plots.All in all,When we return to London we will certainly try to stay at the Crowne Plaza, St. James."
191,678,"May 21 2006	Loved the Crowne Plaza	My wife and I recently celebrated our 36th wedding anniversary at the Crowne Plaza Saint James in London. The location of this hotel is excellent (very close to major tourist attractions such as Buckinham Palace, Royal Mews, etc.), and it is situated very close to easy-to-access public transportation, i.e. bus and subway (tube). Our room was clean, spacious, and very comfortable. Throughout our stay, the hotel staff was very efficient and accommodating. The hotel is located in the heart of the government district of London, which meant that it became very quiet in the evenings and on weekends. Those searching for more &quot;night life&quot; would have to venture into the West End section, which is about a 15 minute walk.We booked this trip through American Airlines Vacations, which included a choice of hotels, as well as a variety of tours and amenitites. I tarvel often internationally on business, and I was very pleased with the choice of the Crowne Plaza. The room came with a full English breakfast each day, and we would highly recommend it. Although we did not eat any other meals in the hotel, there were several higher-end restaurants either in the hotel, or within easy walking distance. There are also several pubs within walking distance which served hearty &quot;pub grub&quot; at reasonable prices. All in all, a superb vacation at an excellent hotel."
192,678,"May 16 2006	Very nice hotel	Agree with the positive reviews here. My wife and I had a wonderful 4 night stay. They even allowed us to check in early (very early). Our room was 2nd floor on the back side of the hotel facing the schoolyard, which though at times was a little loud in the morning, it was also a quaint addition to a unique London experience. Room was clean, up-to-date, and roomy enough. We also liked the fact that the hotel was on a relatively quiet street and not situated next to countless other hotels. Yet, still just steps away from pubs, sights, etc."
193,678,"May 14 2006	A nice hotel	We recently stayed here for one night whilst seeing a show in the West End (15 minute walk). It is in a good location with a good chunk of your tourist spots in the very near vicinity - either by walking or through the nearby tube stations. I found all the staff i dealt with to be very proficient and helpful. Although the doorman seemed a little over keen to have my car key to valet park whilst i was trying to check in, (keener to get a tip i suspect) which was a little irratating. However, he was honest enough to find me a free parking space right outside the hotel (sat &amp; sun only), other wise the daily charge is 25 per day.The room we had was on the second floor, it was nice, clean and suited us just fine. It was bigger than some London hotel rooms i have been to before. Our view was of an office block, could have waved at the workers had it been midweek! We did notice occasional noise from the tube but it was otherwise very quite. The communal areas of the hotel were spotless and what i have come to expect from Crowne Plaza hotels.We didn't eat at the hotel, but the menus did look good. Although i would say the breakfast cost of 22 for a full english was ridiculously expensive. if you are not from the UK - this is extortionate!. Plenty of places nearby in Victoria where you can get brekkie for way less than 10.I have to pass comment like most others - THE MINI-BAR. I chuckle as i write this, that some one at the hotel could actually bring themselves to arrive at the prices they charged. (i did not use it). My favourites are the 1.50 for a packet of polo mints - 30 pence in the newsagents, 9.50 for a mini A-Z london map when written on the back is the shop price of 4.95!! All in all, a good value 4* hotel in a good location, just avoid the in-house charges"
194,678,"Apr 25 2006	Four fun days!!	Stayed here in January. This is a very nice hotel close to everything to see in London. It is about 4-5 blocks to Westminster Abby/Thames River &amp; only about 2 long blocks to Buckingham Palace. Walk across Princess Diana Park and you're in Piccadilly Circus. I recommend eating at a little cafe called Cafe Concerto(Piccadilly Circus). Not too expensive.The cheescake was excellent. We also ate at Aberdeen Steak House(Piccadilly)Semi-expensive about $60 U.S. similar to Black Angus.While staying at this hotel, walk 1/2 block down the street to Bon Gusto(blue awning?). The concierge all know it and eat there. Very reasonable compared to the hotel restaurant which is pricey. Be prepared, the bacon is a thick slice of ham and the beans are baked beans. As for the hotel: it's huge!We had a long walk through hallways to get to our room. Very spacious although bed was low to the ground and two beds made into one. There was a school outside the window and the boys were pretty loud first thing in the a.m. The view from our room was not good. Only other city buildings and the brick wall of the next hotel.The bathroom had heated towel racks, never saw one before, worked nicley too. Plush bath robes.The concierge service was top notch,honest, and helpful 24/7. If you're going to Harrod's remember it closes early off season. You'll need 3-4 hrs to see most of it. Big as a city block. Don't walk to Tower/London Bridge from here!! Take the tube."
195,678,"Apr 19 2006	Easter in London	If you read the past 50 reviews of this hotel, they are all over the board. We ended up choosing this hotel after narrowing it down to a few select ones and then checking our Eyewitness/DK London travel book which highlights a few good hotels in each location (as we do with all our vacations..that series of books has never steered us wrong). This one was listed for the Westminster area and being a member of the Hol. Inn Priority Club, we decided to go with it. Mainly I think the difference between the previous good and bad reviews is where your room is located and which set of staff members you had! Our room was on the 4th floor overlooking the courtyard and was a standard room. I would say it was an average European sized room with a smallish but very clean and well kept bathroom. Water flow was great as were towels (just the right size and thickness). My first thought was that the bed was low to the ground but it was surprisingly comfortable as were the pillows-and I'm pretty hard to please...but of course, to each his own. Mini bar prices were freaking outrageous...more outrageous than usual minibar charges, but either youre an eat-from-the-mini-bar-person or youre not, so whatever. The room and halls were very quiet and thats coming from a person with near-bionic ears. The location from St James' tube stop was about 3 mins but Victoria was much further. Buckingham Palace is just down the street as is St James' park.... Westminster/Big Ben/London Eye are all within a 10-15 minutes EASY walk. I found the location great. Afterall, one hotel can't be near everything....The staff was hit or miss depending on what shift it was....same with concierge...either very helpful or very snooty. Something to improve upon would be attention to detail...they forgot at least one item on our room service tray every day and had to go back and retrieve it, but did so very kindly. Afternoon tea in the lobby was missing the sandwiches and we had to ask for them...minor things like that. We ate at 2 of the restaurants and were very pleased with taste/service/value. We did use the spa for one service and although the massage was excellent, it seemed no one staffed the front desk or knew how to do &quot;intake&quot; of their appointments. Like I said, very minor things. One thing that I considered minor but really could have been a problem if I were here for business is that they failed to give me a wakeup call on one day. The wake-up call button on the phone did not work so I had to call down to the front desk on most days to personally ask for a call. The other thing that bugged me was that the room service people were knocking on your door after an hour trying to pick up your tray...for one, there is a note on the tray stating the ext. you should call when you wish your tray to be picked up. And also, they ask before they leave the room what time they should come back for the tray and I always said at least 2 hours...Overall, we tend to stay at 4 star properties. While this is not the Ritz, its nothing to sneeze at and was actually a very good value. I would stay here again."
196,678,"Apr 6 2006	Girlie weekend!	Hotel was fab, staff were friendly, food was good (but a bit pricey) room was huge! Had a great weekend! Used the jacuzzi/spa which was very relaxing, too! Highly recommended, especially for the price."
197,678,"Mar 27 2006	a nozzle for the hoover	We had looked for a quality hotel near to victoria station and handy for the Vauxhall area of London. Having stayed many times at the Holiday Inn chain we thought we would give ourselves a treat by staying at their sister hotel chain Inter-Continental Group. We had read with enthusiasim Trip Advisor's readers' reviews and took note to ask for a room overlooking the courtyard. We had booked well in advance and specifically asked for the courtyard room and paid for a deluxe room with king size bed. The receptionist although courteous spoken broken English but this is to be expected within the capital. We duly showed her our printed confirmation receipt detailing exactly our requirements. Unfortunately the courtyard room was not available only a smoking room. We could try Saturday and we could move. We proceeded to our room then the shock - the room was dreadful, small dismal overlooking a playground and what appeared to be a bottling plant or brewery as there were crates upon crates of empty bottles. The room was number 169 which definitely did not have a king size bed or neither was this a deluxe room. We immediately asked for a transfer. We were assured this would be a lovely room. Mmmmmm on the 4th floor room 424 yes king size bed, lovely room? I think not. Overlooking an enormous air conditioning duct with rooms also overlooking into each other. The toilet seat was broken, the roller blinds (I believe may have been once white) were now consumed by dust the carpets certainly had seen better days, and why oh why dont cleaners use the nozzle belonging to their vacuum cleaner and get all the dust and muck from between skirting boards and the carpet edge. The complimentary bottle of water was numbered 1 and no more. Unlike the holiday inns where these are replaced daily. The tea and coffee were placed in a butter dish minus the biscuits - none were ever given. Word of warning stay away from the mini bar 5 for a Toblerone bar of chocolate. 3.50 for a 69p packet of pringles. Why dont these hotels charge sensible prices and then they may sell some of these goods. I pity help the foreign traveller who may not be able to convert our money.Saturday morning we decided to take advantage of the 'well equiped gym'. The equipment was sadly in need of replacing or a good overhaul. Whilst there the fire alarm went into continuous mode no-one came to see if we were safe, the reception for the gym being up a flight of stairs. After several minutes of this alarm ringing I went to investigate. Not a sound of this alarm could be heard by the reception. 'Oh is it going off again was the response' However the instructor did proceed with me to investigate however once half way back to the gym the arlarm stopped. Heaven help people if it was a really fire you certainly would be on your own.We are regular visitors to London 6-8 times a year to visit family. We will not be doing a repeat visit to this hotel.It may have been a rather swish hotel in its heyday but sadly it is just an overpriced dismisal hotel in need of a really good housekeeper to clean it."
