IDREVIEW,HOTELID,REVIEW
10,1998,"Jun 25 2008 	Horrible Customer Service!! Horrible room!!	My wife and I arrived the evening of June 13th only to find a hole in the ceiling of our room with water dripping from it. I went to the front desk to inform them of this and request another room. I was told flat out in a very rude tone that no more rooms were available and if I didn't want that room I should go somewhere else. I was also told that, for the rate I was paying, what did I expect!! Unbelievable!! I told them that the room was totally unacceptable and, since it was late and we didn't know the area at all, I asked if they would help us find another room. I was immediately told a flat out NO and that we should leave in a very rude tone again. After a very brief shouting match concerning their totaly lack of customer service, we left. Fortunately, we found an excellent room at the Chelsea Inn just a couple of blocks from where we started. They had fantasic large rooms and unbelievable Customer Service at only a few dollars more than the dingy, dirty Alpha Inn and Suites. Finally, we ended up getting a refund thru AOL@Travelocity after they called the Alpha Inn and Suites to confirm our complaint...."
11,1998,"Jun 7 2008 	Terrible	What a horrible experience!The room was very smelly, there were spider webs on walls and a hole in the celling with dust falling from it, the bathroom wasn't clean...Futhermore, the owner is not reliable AT ALL!! We booked the room many months before the trip, for 7 nights, but we had to cancel one night in the week. We called a few weeks before the trip and the owner told us the cancellation for this night was ok. At the check in, he kept tolding us that the cancellation wasn't possible and that we had to pay for the night even if we weren't there (and even if we called before). And we can't argue with him because he can't speak in english !! So we had to pay for his lie, in addition of a bad stay at this hotel.Don't go there... even for the &quot;low price&quot;. Find something else, pay a little more or stay at home!"
12,1998,"Dec 11 2007	Bed bugs bed bugs bed bugs!!!!!	Honestly, I understand trying to find a good budget hotel in SF. This place has a good location, but DO NOT GO!!! By time I got home the following day I had over 50 bites on my body. After visits to the doctor, allergist &amp; dermatologist, they were confirmed o be bed bugs and I spent MONTHS taking pills and applying cream to make them go away!! The management did not respond wen I tried to report the situation via email. Go anywhere else!!!!"
13,1998,"Oct 22 2007 	Comfortable stay	We stayed at the Alpha Inn and Suites (previously Econo Lodge) for 3 nights, and overall it wasn't bad! The guy on the front desk was friendly and helpful (even if English wasn't his first language), and he gave us a huge room, from which you could see downtown, Golden Gate Bridge and Alcatraz.The main building is accessed via a locked gated door which you access using your keycard. The room was clean and had a comfortable bed, walk-in cupboard, bathroom, TV, telephone, fridge, microwave, table and chairs, 2 sofas, and coffee maker. It was about 4 times the size of the hotel room my husband stayed in last time he was in SF. The noise wasn't too noticeable considering we were on Lombard Street! The main negative for us was that there was no safe, despite the website saying 'safe in every room' and the keycard saying 'keep your valuables in the safe'.Some other things to note:&gt; There's no lift  so make sure you can carry your luggage up and down 3 flights of stairs!&gt; Breakfast consisted of 1 small chocolate muffin. However, there's a Walgreens right across the road, and a diner further up Lombard.&gt; If you're not a fan of thin towels, bring your own!The area seemed fairly safe, and the location is good  just walk down Divisadero and you end up at the marina district. If you're feeling energetic you can have a very pleasant walk 2 miles to the Golden Gate Bridge (turn left), or Pier 39 (turn right). Having researched SF hotels on Tripadvisor, we weren't expecting to get a lot for our money (especially on Fri/Sat, booking only a few days before our stay). While the whole place would undoubtedly benefit from a spruce-up, we had a comfortable stay. However, if you're the kind of person whose holiday is ruined by chipped furniture/mismatched decor, I would recommend looking elsewhere..."
14,1998,"Oct 5 2006 	Horrible and stinking. DO NOT STAY THERE !!!	I booked this hotel through the Econo Lodge website after reading the reviews poted here. This hotel was TERRIBLE !!! There is no lobby, the parking is VERY limited and it is rather difficult to find a place on the street.I reserved a suite for about $110 (US dollars) and got an absolute dump (see the photos I have taken).Upon entering the building a strong disinfectant odor attacked us. This smell was also in the so called &quot;suite&quot;. There was no elavator and our room was located on the 4th floor ! I had to carry 3 large suitcases up the stairs ! The corridors and stairs were filthy, and one of the stairs made sounds and wiggled like it was going to fall off.The room was filthy. The rugs were torn and stained. The disinfectant smell was everywhere. The sofa-bed in the living room part of the &quot;suite&quot; was broken and you couldn't sit on it or open it into a bed (see the photos).We immediately went down to the reception desk and asked for another room. The clerk was rude and refused. He said he had no other rooms available due to a convention of some sort... I cannot imagine a convention accommodating its participants in this dump...Please take my advice and do not stay there, no matter the price. I paid a lot of money and got nothing in return.DO NOT STAY IN THIS HOTEL !!!"
15,1998,"Aug 20 2006	Avoid at all costs!!	We called this hote at 5:30 pm and aksed if there were any rooms available. We were told there was one left at $139.00. We booked the room and gave the lady our credit card number. We told her we were driving into town and would be there around 8:00. After negotiating through downtown traffic, we arrived at the hotel at 8:20. We buzzed the door and an older man came to a small window. I gave him my name and said we had reservations for that night. He looked on a sheet of paper and said we were not on it and then turned around and walked back into the back room and would not come out again when I buzzed again. I returned to our car and my wife called the hotel. This same man answered the phone and told her that they had canceled our reservation because we were not there at 8:00. It was only 8:20!NEVER AGAI!!. People, read these reviews and heed the warning. This place is to be avoided."
16,1998,"Aug 10 2006 	Great Stay!	My husband and I stayed at this motel previously and had a good experience. This time was no different. We booked a king suite for one week. The room was very large and had a couch, arm chair, coffee table, small dining table and two chairs, microwave and refrigerator. The room also had cable TV and free high-speed internet. For summertime this place had the best price in the area and I booked several months ahead. It was clean, the staff was friendly, and the location is amazing. It is located about a 10 minute walk from the waterfront, 10 minute walk from the Palace of the Arts and 5 minute walk from the Presidio, 5 minute walk from Chestnut street restaurants and pubs and 5 minute walk to Union street shops. Parking does fill up quickly in the afternoon and most of the parking spaces are tiny but this was not a problem for us because we walked everywhere. A bus stop that is right in front of the motel will connect you to anywhere in the city. I dont have a single negative thing to say about the Econolodge, San Francisco."
17,1998,"May 29 2006	So much for service	Crappy service, rude employees, dirty musty broken down rooms and not enough parking. Can't get back any property accidently left, even if you ask them to send it postage due. Top it off with being overcharged. Don't stay here!"
18,1998,"Aug 23 2005	It was ok...	The room was good, big, big TV, high speed internet, very clean. I had to buy a Shampo, because they had a bad one. But for my next visit to SF (which I hope will happen soon) I'll go there again..."
19,1998,"Mar 8 2005	Basic	This is a budget hotel, make no bones about that. The pool was empty and had some work done recently. The room was clean and tidy and adequate for what I wanted. It is very near the 30 bus route to Fisherman's wharf and Downtown. In reach of the bay for walks along the Marina. Opoosite a 24 hr Walgreen's Drug Store for late night snacks!As an alternative there are plenty of other motel literally within 5 mins walk of this hotel. I should have tried them as an alternative.The traffic is quite noisy as Lombard St is en route to the Golden Gate Bridge"
20,1998,"Feb 16 2005	Does not Honour Online Booking	There is always a first time for everything -&gt; Refusal of Service.Arrived at 6:30PM at night, showed our web reservation printout and was asked for name three times before saying no reservation under the name. He takes a look at the web reservation sheet of ours and tells us that the rates are all wrong (too low). However, he was &quot;willing to accomodate&quot; and put us in a room although the hotel is &quot;full&quot;. Hands us a sheet with no explaination (apparently guest registration sheet), asked us to fill out information and sign first before he starts filling out the length of stay and room rates (which of course were higher than the web reservation). When I mentioned that the rates (only approx. 10 dollars more for two days in comparison to web reservation ) will not be accepted by us and that this is a problem he should take up with EconoLodge Headquarters, he said plain and simple &quot;...then go away, we don't serve you, you are rude, go away! Leave now!&quot; At no time were we rude. At no time did we agree to pay more regardless of the amount. We asked for the registration sheet to be torn up and he refused. Bottom Line:1. Poor Language Communication Skills (hard to understand his Enlish)2. Poor Attitude (at no time did he make a phone call/use a computer to verify the validity of our web reservation)3. Does not understand the concept of customer service Side Note: There are about 12 parking spots for &quot;big&quot; cars and about another 12 spots for compact cars (for compact cars, 2 inches from the mirror of each side for a Toyota Corolla is the space you are left with if you are confident enough to steer into that space)"
21,1998,"Dec 7 2004	Avoid	Was all set to say that this place is a good option for budget stay in SF, despite the central pool empty of water and filled with mud, crooked electrical outlets, and world's worst in-room coffee. Then, when I was checking out, I asked the owner if he could store my bags while I was out, and he refused to store them in the office. He said he could store them in the laundry room across the hotel complex. I asked him if he could show me where that was and he refused. When I said I was uncomfortable leaving the bags somewhere he would not show me, he tried to assure me that it was locked except when the employees were doing laundry (this did not seem all that secure). I asked again if he could store my bags in the office, and he refused, and then said, &quot;Now I won't store your bags at all.&quot; I said &quot;What?&quot; He said, &quot;Take your bags with you, I won't help you.&quot; We went back and forth like this a couple more times, until finally I had to beg him to take the bags, and even then, I had to lug the bag with my computer in it all around with me, since I decided only to leave my garment bag. In the end, the laundry room seemed semi-secure (although it was across the parking lot in the back, and it would have been easy for someone to take something out of a bag outside the sight of the manager or desk clerk). This owner does not understand that there is a minimum standard he has to provide; otherwise his hotel is all but useless to travelers."
22,1998,"Jul 4 2004	Location location location (Safe)	Stayed June '04 for 4 nights (2 Adults and 2 Teenagers). Never visited SF, LOCATION WAS THE KEY. AAA price $56 a night. We we able to park Free every night. Pool is being redone. Rooms clean, older but clean. Didn't spend much time in room, so this was ideal for a budget. Easy walk to Mel's Diner-A Must."
23,1998,"Apr 12 2004	Good for price but short on parking space	We stayed there on april of 2004. This is what we got for 48$us per night: King bed,mini fridge,coffee maker, fog horn noise from the Golden gate bridge, tight space or non-existent parking, and ghetto-like room neighbors. If you think about using the pool, DON'T. They should think about burrying it and putting more parking space over it. It was very dirty. The room was clean but had a strong smell of carpet deodorant floating around, but we vented it out quickly by opening the window. This is a good hotel for the budget-oriented traveller because of the cheap rates and because it's located in a good neighborhood (Cow's Hollow). You could access everything by using public transit, but much easier with a car.. Bring lots of quarters for metered parking when you visit the city!!!"
24,1998,Jul 24 2008	Bitte buchen Sie dieses Hotel unter keinen Umstnden!
1,1999,"Nov 9 2009 	Don't stay here	This place was horrible. It had a bad smell to it the paint was chipping in big clumps off the walls. There were spider webs in the room. Housekeeping does not do there job well. My tub still had hair in it from the last person and there was mold on the top of the tub. The next day I had to go get toliet paper and towels because they were not re-stocked. The manager acted like he could care less. My headboard was constently hitting the wall it was not nailed down. I complained but it wasen't fixed, and the best part is the toliet didn't flush well. The manager refused to give back any of my money and he still has money held on my card from check out. I wouldn't stay here again if somebody paid me to."
2,1999,"Oct 9 2009 	It's nothing special	Please get there at a decent time or you have to use some strange night check in window. It's a decent hotel for the price and it's close to Fisherman's Wharf and Golden Gate Bridge. We have stayed there everytime we travel to San Fran, only because other hotels can be pretty pricy."
3,1999,"Aug 28 2009 	Good but anonomous	This is one of many similar looking motels on Lombard street. It's convenient for the excellent MUNI public transport system, but please don't think you are near the famous &quot;Twisty&quot; bit of Lombard St. That's miles away.The service was good though with both the people I met on the front desk very helpful. Breakfast is machine coffee, machine juice and muffins. Think of it as a snack, not a way to start your day.Parking is first come first served but I never saw it full. I left mine parked there for 3 days to avoid parking fees elsewhere in city."
4,1999,"Aug 15 2009 	Good Value	Room was clean, staff was very friendly and helpful. No problem getting a late check-out. Location is decent for cruising the wharf- about 1.5 mile walk to the action, about 2 miles to Alcatraz Ferry. Never felt uncomfortable walking alone in the daytime, however I did not walk at night so don't know about that. I had a room close to Lombard so it was a bit noisy, but turning on the fan or AC effectively drowned that out. If you don't mind walking this is a great place to stay and save money by not renting a car."
5,1999,"Aug 7 2009 	Nice room cheap price great neighborhood	I went with my husband for 3 days, so we spent 2 nights there. The check-in was at 2pm, but we arrived from LA at 10am, so as we expected the room was not ready at all. The front desk employee offered us the laundry room to leave our luggage in order to take a walk in San Francisco. When we returned at 6pm after visiting Alcatraz jail, the room was ready. Not too big, but it had a king size, hot water, hairdryer, a TV. It was enough for us. The &quot;breakfast&quot; is very funny, you take the breakfast in the front desk area, next to the guests who are checking in or out. You only have coffee or tea and a few muffins. You take the breakfast stood up, no chairs, no table, nothing. However, the hotel is well ubicated. We took a tour and the tour bus passed through Lombard Street, we just went down in front of our hotel. Next to Lombard Street, it's Chestnut Ave. with a lot of restaurantes, cafes and shops."
6,1999,"Jul 27 2009 	Great Location - just watch for the shady character behind the desk	I made this reservation for my parents who were coming into town for just one night. One of the other reviews mentioned that the front-desk guy got angry about the price she paid on travelocity. I got a deal on priceline (all the other places nearby where going for $140 - high tourism season and we paid $100). This angered the man behind the counter and he made a big show of calling priceline, because he didn't want to honor the request. My folks are not easily upset and they let the guy get it out of his system and then asked for a nice, quiet room.I went into the room with them - very clean, nice, with a kitchenette. But it's in a section of town with a lot of night-life. Mom said the drunks stopped coming in around 4, and the travelers started leaving around 5.... not a lot of peaceful sleep for the folks. Not very quiet.Overall, the room was clean and comfortable for what they needed.... but there was almost no available parking (the Days Inn next door always seemed to have some spaces free - I'd recommend going there if you have a choice) - I had to park by my house, almost 7 blocks away.For single women - DO NOT travel here alone. That guy behind the desk is one weird dude."
7,1999,Jun 15 2009 	Terrible hotel! Very dirty!	I have never left a review before but I am doing so on this hotel. The hotel does not have complimentary parking or breakfast as advertised. The parking is first come first serve and the breakfast is a muffin and the most disgusting coffee I have ever tasted. I had to spit it out as soon as I tasted it! The bed linens were old and had not been washed in a very long time. They were full of hair and holes....I itched all night long. The beds were so uncomfortable I could not sleep. Please be aware that this hotel is not worth the discounted price. Pay a little more and be confident you are getting a cleaner room with amenities.
8,1999,"Apr 30 2009 	Friendly Staff Clean and Cheap...	I spent 3 nights here and it was a nice comfortable stay indeed. The first night was mediocre due to an issue with the bathroom, but once the manger was told he took care of it right away, and was very gracious and apologetic...one can't ask for more than that right? In fact the manager was extremely friendly and helpful to every guest with public transportation and sight-seeing tip, also he was great about helping me find late night parking when the hotel's on site lot was full...he awoke from his sleep when he heard me pull in late that night....now how nice was that? I would certainly stay here again above all other hotels in this price range, and have already referred a few others. Good luck and enjoy!"
9,1999,"Apr 29 2009 	Great Deal but avoid room 210	Just back from my stay in room 210. Nice room but the back wall (where your head sits on the pillow at bed time) sits right up against the outdoor seating for a bar called &quot;The Tipsy Pig&quot; that faces Chestnut Street. It is LOUD until about midnight or 1am. I just drank enough wine that sleep was easy. :) I would avoid 210 and probably 310 if that's the room above. The room was nice, the bed was VERY comfy and the staff was super helpful and pleasant. I would definitely stay here again. I did have one issue during my stay which was handled directly and immediately upon my reporting it. As for nearby things to do: Exit the hotel, and ignore the IHOP, and go north to Chestnut St. Plenty to eat, shop and do there. Also the bus to downtown, Little Italy and Chinatown stops here. To save a few bucks, pay the money for the microwave and refrigerator, then head to the Safeway in the Marina District (a nice walk thru the homes) and stock up on picnic supplies and breakfast items.) Grab a Muni pass at the Powell street cable car end of line and ride the cable cars and muni (bus and rail and street cars) to get around. Save TONS on cab fair and soak up some culture!"
10,1999,"Apr 19 2009 	Great Price and Location too much noise from outside though.....	Only paid $50 for 1 night, rooms was clean and great location, near the Golden Gate bridge ton of restaurants along Lombard St. and Fisherman's Dwarf. Our room faced the street side and you head every car that passed by as well as people talking in yhe car port.Overall great location and price."
11,1999,"Feb 22 2009 	good and not too expensive wonderful rooms on Lombard Street	we are from Germany and stayed here for 2 nights, the rooms are clean &amp; charming. There is a Bus stop to Fishermans Warf nearby and some good clubs and restarants around the corner. Thank You for the advice. The rates are low.For us a very good choise to stay some wonderful days in SF.[-]best regards Uli"
12,1999,Jan 5 2009 	First Rate Service	We had stayed at another hotel in this chain during our trip and was impressed. We found an America's Best Value Inn on our GPS and it looked to be in a good location and has off street parking. We made our reservation through America's Best Value Inn's main phone number. This one is within walking distance to The Presidio and MANY bars and restaurants. The rate was very low considering the location but what impressed us the most was the service. I have never received that level of service from a budget hotel/motel. Their staff will go to great lengths to make sure the guests are comfortable. I highly recommend this hotel for anyone staying in San Francisco.
13,1999,"Nov 15 2008 	Best quality for money in area	I travel from out of state to work in this part of town once a month and have tried most of the budget hotels in this area. This is my favorite and if I get a good deal I stay here (price between the hotels fluctuate -- Travel Lodge Presidio, Greenwich Inn are also fine options). Rooms clean, staff helpful and it's in good location. Only drawback is that Lombard can be loud so try and get a room beyond the main court yard as traffic and loud passers by can be loud."
14,1999,"Oct 21 2008 	Perfect for our Budget	This was the cheapest hotel we could find in the city for the weekend. We were a little hesitant because of the prior reviews, but we were pleasantly surprised. We were able to check in very early, and by the time we came back from a long day, we still had a place to park. Maybe we got lucky, but even if it was full, there are places to park within walking distance and the metered parking is free after 10 p.m. There are plenty of places to eat, shop and walk to and feel safe. There is even a Walgreens right down the street. The room had all the amenities we needed, including a refrigerator. The only thing..the shower was a little tricky. We couldn't figure out how to turn it on and had to call the front desk. The front desk crew was very helpful, and we would definitely stay there again."
15,1999,"Oct 10 2008 	Good quality and good hospitality	The room is simple but it has everything you need: Good shower, good TV, wireless internet connection. The representative Hitesh was very kind and gave nice tips about the neighborhood."
16,1999,"Sep 14 2008 	It was really fantastic!	The owner was very nice and offered us a nice room for a fantastic rate! We stayed for two nights and went to see a lot of interesting places, which the hotelowner pointed out for us on a map of San Fransisco.The room was also very clean. And the bed slept fantastic."
17,1999,Sep 1 2008 	woderful stay	Its wonderful stay. I reach there early but they check in me and the front desk guy is with kind nature and helpful with soft spoken behavior to all the guest who want directions or any kind of help. I can say because I'm woman and traveling alone in the city and if somebody helps you have to appreciate that. room was very good and clean they change the sheet and towels everyday and I like most the SMOKING POLICY of this hotel If you smoked in the room you got charge. Nice Very Nice. location is perfect.
18,1999,"Aug 27 2008	Bed Bugs	Following a single night stay here, we woke up to find bug bites on our bodies and bed bugs on the mattress. These bugs tend to infest the areas they live in and can easily hide inside luggage or clothes you bring with you. We checked out and asked for a refund, but were denied. After calling the corporate office, they asked us to submit a formal complaint, but still refused to issue a refund.I've submitted complaints to the city health department...but for now, DO NOT STAY AT THIS MOTEL, by any means."
19,1999,"Jul 31 2008 	Perfect place on a budget	This place was perfect for us- It was a girls vacation: My daughter, granddaughter and me. The Inn's front desk was helpful and nice. Our room was clean and perfect for our stay-we only needed a place to store our luggage, a clean bathroom-shower and bed to sleep in at night. Our room was close to the road but we heard nothing once we closed the door. The location is perfect for catching the bus to go to all the sights and places SF has to offer- the only way to travel in SF. It was close to all the shops, pubs, markets and resturants. I would recommend it to anyone and stay there again."
