IDREVIEW,HOTELID,REVIEW
120,708,Jun 27 2008	piccola ma  ok
121,708,Jun 24 2008 	Ottimo rapporto qualita prezzo e posizione
122,708,May 14 2008 	piccolo ma pratico
123,708,Jan 29 2008 	hotel veramente con camere piccolissime ma per piccole intendo stile loculo!
124,708,Dec 7 2007 	das zweite mal
125,708,Sep 25 2007 	buena relacin calidad/precio = easyhotel victoria london.
126,708,Jul 25 2007 	Fantstico alojamiento para viaje de bajo coste
1,709,Nov 19 2009 	would prefer to pay more	Small completely bare bones rooms. A swung cat would soon be brained. Have been pared down too far so even things like a shelf in the bathroom are missing and had to put toiletries on top of the radiator. Zero storage apart from a few hooks on the wall. Very little room to manoeuvre around the room if there are two of you. Can fit luggage at base of bed but then need to climb over each other to use the bathroom in the night. Has aircon but still hot so not a good night's sleep which was important before a long haul. Noisy fire doors can easily be heard. The one socket is inconveniently above the bed head. The lurid orange wall behind the bed is a very bad idea. Very handy for Paddington to Heathrow.
2,709,"Nov 6 2009 	Ok deal but then again it's London	I wanted the cheapest room avail with a good central location and cleanliness. This fits the bill. First of all, I read the reviews, so I knew the room would be a closet. There was only area around the bed to walk, no closet. The bathroom was tiny too; you could even wash your hand while still sitting on the toilet. Not that I would, that's just how small the bathroom was. They provide you with soap and shampoo from a dispenser. I preferred the toiletry I brought. The service was lackluster. I was told that the room would be 39 GBP per night, but it came out to like 50 something. The problem is that they just give you the total price and don't itemize the costs for you. So I assume that the VAT was not included in the advertised price...even so that's big increase...so there must have been some other fees. The front desk person was not helpful. They said that they could not pull up the info on their computer. I guess that's what keeps the cost down. Despite paying about 100 USD a night, this was still a great deal for this area. We paid extra to have internet...I don't remember...20ish GBP for 5 days or something. The area was great. This was a 3 min walk from the Paddington Tube Station, and had lots of convenience stores and restaurants around. About a 10-15 min walk to Hyde Park. Rooms are not cleaned while you're there...I think you pay extra 10 GBP for that. Bottom line: Don't expect much and you'll be satisfied. Great location, lackluster service."
3,709,"Oct 21 2009 	At the base rate of 25 it might be just about ok but don't pay more.	I understand the EasyHotel concept. It's ultra-basic in return for being ultra-cheap. I've stayed at Earls Court and Heathrow EasyHotels and been happy with both.But this was very poor. I got told off by a staff member for pressing the intercom button because I thought the door was locked (and the web site suggests it will be locked upon arrival) which didn't really create a very welcoming feeling. Then there was the room itself. The small size is to be expected but the room just seemed worn and uncared for, with a horrible floor (it looked like concrete with a layer of grey paint on it). But worst of all was probably the noise - the noise insultation is almost zero and I had a room next to the linen closet. Between that door banging shut, other room doors and sounds from the floor above I really don't think I slept more than an hour or two.Location-wise it's within easy walking of Paddington Station, but not as close as I was expecting.There are worse hotels than this and if you can get it for 25 and are a sound sleeper it might be worth it. But any more than 25 and it starts to feel very overpriced very quickly."
4,709,"Oct 19 2009	Tiny but perfect if you just need a bed for the night	Stayed two nights in a small ground floor double room, no window, with my 5 y.o. son while we were sightseeing in London.Is ideally positioned 5 minutes walk from Paddington Station so is great for either linking with the Heathrow Express or using the Underground to get around town. Plenty of food choices around, nothing fancy but youll get a satisfying feed (The Exchange near the local Laundromat is a kid friendly pub with good hospitality, and the food is tasty and cheap) Sainsburys and M&amp;S have express stores at the train station so you can get the basics at reasonable pricesCheck in process went without a hitch, and they even let us check in early without charging us extra. Reception is manned 24 hours and everyone we dealt with on there was friendly and tried to be helpful, including booking us hire car for our early departure.Now to the room. I knew it was going to be small, website has dimensions etc but was still taken aback at the lack of usable floor space for bags and moving around. Effectively good sized double bed surrounded by the walls on three sides with a little built in bedside table. My carry -on luggage took all the little bit of floor by the bedside table. That leaves the area between the door, bathroom and bed. About 6 feet long by two and bit feet wide my big case used most of that. I expected a small room, had read the reviews and basically its exactly what I thought itd be. If you dont mind stepping over your luggage you wont find it a problem.Bathroom tiny like onboard a ship, but very clean and functional. Must say bed was really comfortable too.Room has small LCD TV (you pay to get the remote which is worthwhile) and we had an air con unit so could control temp really well. Wi-Fi available and vending machines in receptionId stay here again  cheap, clean and good location. Not everyones cup of tea, but if all you need is a bed easyHotel is perfect"
5,709,"Oct 13 2009 	Cheap good location no frills whatsoever	This hotel knows its audience. In a city of VERY expensive hotels, the easyHotel is filling a void. The rooms are TINY but the website says as much, and there's no way in a city like London that you're going to spend any time in the hotel room anyway. Our room had its own bathroom - big plus - and a window. &quot;No window&quot; is an option but I wouldn't recommend it; that'd be like sleeping in a stuffy shoebox!One caution though...the shower doesn't have a &quot;lip&quot; on the bottom to catch water. I nearly flooded our entire hotel room! Don't use the shower full blast.The easyHotel Paddington is a five-minute walk from Paddington Station where you can catch regional trains (i.e. to Windor Castle) or the Tube to central London and all the touristy sites. London's tube is just the best public transportation system I've ever seen, so you don't even need to worry about the fact that this hotel isn't right in the middle of the action. It's surrounded by cheap little restaurants and pubs, too, so there's plenty of food options.I would stay here again. It was perfect for a couple of backpackers who wanted to experience London without going broke."
6,709,"Aug 30 2009 	Depends what you're after.	OK - first thing first, my 'real' score for this place is 2.5! I felt a 2 would be unfair, so I've had to bump it up to a somewhat generous 3. It's really a 50/50 call on this place and it depends of course on what your plans are and what you're looking for in your stay.Yes the hotel is quite close to Paddington - just a few minutes walk.Yes they will charge you to store luggage, but you probably know that already.Sure you will pay extra for a TV remote control, more towels, more pillows etc, but it's not like you'll want to spend much (any?) time in your room, apart from sleeping/showering, so the extra costs are not that bad really - just don't do it hey!Of course the room is small and basic, that's the point. That being said, it's not uncomfortably small - though we did have one of the larger rooms &quot;with window&quot; (overlooking a scuzzy courtyard)! I'm not sure what I would think of the smaller/window-less varieties on offer...What this place has going for it is that it's simple/straightforward to check-in and check-out, the rooms are clean, tidy and secure. These may sound like odd things to be complementing them on, but the amount of reviews you read for 'budget' London hotels where people say the bathrooms were filthy and mouldy, the window/door locks were broken (&quot;I had to sleep with a chair jammed against the door and one eye open.&quot;) etc, and you realise that yes they are very important!So if you're just looking for a bare-bones, but clean and tidy, place to sleep, shower and that's about it, then this could be your place.I notice that a lot of easyHotel critical reviews cite the wide range of &quot;better places for the same money in the area&quot; - but who knows what these places are...if anyone does, please let me know!PS, the room's not THAT orange..."
7,709,Aug 24 2009 	Bed bugs!	I stayed in room 110 for one night and came away with over 100 bed bug bites. Bed bugs are highly mobile and a building can become infested extremely quickly. I informed the management of the hotel so the room could be cleaned and other rooms could be checked for infestation but I have yet to receive a response. Very dissapointing for what is meant to be a world class brand operating in a world class city.
8,709,"Aug 13 2009 	Excellent Hotel and Really value for money	We stayed in this hotel last year in summer and we paid 109 for the same room..... this time we only paid 59 ..Some facilities were missing and there were some extra charges but we are happy and will be coming again in next summer.As before excellent staff, great location and just 20 mins to heathrow airport.We will highly recommend this hotel to everyone for short stay in London as we find this hotel safe and good location with always ready to help staff.."
9,709,"Aug 11 2009 	okay but probably won't return	The best thing that I can say about this hotel would be the location.The con's of this hotel would be the fact that they charge extra for commodities like 5 for a remote per night to watch television, which you could get for free in something like a 3 star hotel. If you were to pay for all the extra things that would come standard in a 3 star hotel it would cost around the same price as one anyway. The only thing you're paying for really is the location, which if your not that fussed on I really wouldn't recommend this hotel. The bathrooms can be a problem as the shower will cause flooding. The window in our room was pretty much broken, and wouldn't open properly. Also found some porn magazines under the mattress, so I would question whether they change the sheets at all. The wall between the corridor and the room is paper thin, so you can hear everything that goes on outside, especially the cleaner at 7 in the morning rumaging around in the cleaning cupboard, talking as loud as they like. The pro's, like I said before, is the location but to be honest it wasn't even worth that, also the reception staff were friendly and quite helpful."
10,709,"Aug 9 2009 	easily the worst hotel in london	I booked a double (with window) here months ago, and paid 55 pounds, mainly because of its proximity to the Heathrow Express. We arrived at about 11.30 pm and were checked into a room in the 'sub-basement.' The subterranean room was too small to fit two people and two small bags, it smelt like a used portaloo (a noxious mixture of chemicals and stale extretea), the 'window', which measured about 1 foot by 2, opened not to the outside, but to the cupboard where the cleaning fluids and dirty laundry are stored (which no doubt added to the noxious and persistent odour of the room). And its lights remained on all night - shining onto our faces.When I complained about the room/window/light/smell, the polite but ineffective receptionist said there was nothing he could do. As it was late, and we had pre-paid, we stayed. There weren't many alternatives. However, it was a terrible experience, and represents a massive and insulting rip-off. I have stayed in a couple of worse hotels, but they were in desperate situations in the third-world, and were a lot cheaper!In all, all I can say is DON'T STAY HERE, even if you are tempted by the convenient location and cheap price! It is not value for money, you may catch something, and you certainly won't have a good night's sleep. There are plenty of small, independent hotels in the area that offer much better value and a more comfortable stay. Indeed, this was such a bad experience, I will even avoid flying EasyJet , despite their attractive prices- I am now a very uneasy customer!"
11,709,"Jul 26 2009 	A single is not a double	Having booked the room long ahead, I got a decent rate; I think it is the best you can get there (GBP35). For a long time I had wanted to try one of these EasyHotels ... and I was very disappointed.OK, I agree, I booked a &quot;small room&quot;. But I wouldn't have expected that this implied a small bett on top. Effectively, the bed we got (even after changing rooms!) was clearly a single bed. Sorry, that's not what I booked.Even worse, on the first morning, we were woken up at 9 by the receptionist knocking at our door, saying &quot;I need to get in this room&quot;. Ten minutes later, the cleaning lady tried to enter the room, again. When we got to the reception half a hour later, we were told that we had to change rooms (again), because they had to do &quot;maintenance works&quot;. We accepted, because she offered us a room with a &quot;real&quot; double bed.Therefore we spent the second night in what was supposed to be top of the notch at EasyHotel. Still very small, no space for your luggage. The bathroom was very small (no problem with that) and I got the impression that the whole will get filthy quite soon.The positive side? As others mentioned, the location, very close to Paddinton station. That's it I guess. Thank you, EasyHotels. That was my first and last time."
12,709,"Jul 23 2009 	Tiny room but very practical and great value	If all you want to do in London is crash on a bed, take a quick shower and enjoy the city, this is the best place. I've stayed in B&amp;Bs in London before and most of them are old looking and quite tacky but quite expensive. Easy Hotel is simple, no beating by the bush: a double bed and a bathroom, that's all you need! Everything was very clean though they didn't clean our room during our stay. The location is very good, 2minutes walk to tube station, 5 min to Hyde Park, reachable by night bus. The main asset of this hotel is its price, 50 per night for 2 people."
13,709,"Jul 8 2009 	They just ignore my complain!	I was booking a No window small room for one night. It state there is a double bed inside the room from the website. However, there is a single bed inside the room when I check in. I try to complain it, but they just ignore me....."
14,709,"Jul 6 2009 	excellent	it was great stay with easy hotel paddington every thing was more than above in terms of customer services, cleaness and service though room was cozy but fine"
15,709,"Jul 4 2009 	Unhappy experience	My trip to London and Paris (4 June  17 June 2009) was first 5 nights at London, then 5 nights at Paris and then the last 3 nights at London again. The accommodation for all the 8 nights at London was booked for EasyHotel, Paddington. Due to rescheduling of my flight, for the last 3 nights, there were 2 bookings, one for the first 2 nights and the other for 1 night. All the 3 bookings (for all the 8 nights) were confirmed and paid before 24/4/2009 on-line. I paid for standard rooms with window for all the 8 nights. According to the website information, the size of the room should be 7.6  11.0 sq. metres, while the cheaper small room is with size of 6.0  7.5 sq. metres. When I arrived at EasyHotel (Paddington) at 10a.m. on 4 June, I asked for a bigger standard room (within the allowable range). The receptionist just told me that all the rooms are the same and gave me Room 109. When I entered the room, I found that there was only a narrow space of less than 2 feet between the 2 edges of the bed and the walls, with the other 2 sides of the bed abutting walls. I wondered what a small room would look like  with all the 4 sides of the bed abutting walls! When I got back to London on 14 June as an old guest, the receptionist was very kind and helpful. He managed to give me a bigger room (Room G1) which I knew is a special needs room and there was no booking for that room for the 3 nights. He gave me the room for the whole 3 nights (14-17 June). He did confirm that the room is for the whole 3 nights and just asked me to inform the reception on the 16 June morning as a courtesy. On 16 June, when I got to the reception at 10 a.m., I saw the receptionist arguing with a couple on the size of their room. She promised the couple to try her best to give them a bigger room and asked them to come back to her after lunch. Then I came to her and told her that I was at Room G1. When she heard that, she immediately told me that I need to change my room because someone else had booked my room. I explained to her the arrangement made by her colleague on 14 June and that I have already been occupying the room. She just rudely said the room is for special needs and her colleague had made a mistake. She then showed me on the computer terminal that no special needs room was available on-line on that day which meant that Room G1 was not available and therefore I needed to get out of the room within an hour. Then I asked her when the double booking was made, whether before or after the time when the room was allocated to me on 14 June morning. She just refused to check it out and insisted that I needed to change my room. I said that it was ridiculous. On 14 June, the receptionist knew that my bookings were for 3 nights and he did confirm that I can keep the same room for all the 3 nights. If I need to change the room, I would not take the room at the very beginning. It was just a nonsense to change the room for just one night. I also pointed out to her that the non-availability of Room G1 that she showed me on-line was misleading, since I have already occupied the room and that was why Room G1 was not available on-line. Then she told me that I could keep the room. Up to that moment, I knew that she was just cheating me all the way that there was a double booking for Room G1. If there was really a special needs booking, she wouldnt let me keep the room at the end. Otherwise, how could she manage to accommodate the special needs guest on that day."
16,709,"Jul 2 2009 	Really Small room ...	I stayed there for my budget. The location is very good. The room (White + orange) is really clean, but the room is soooooooooo small. My room has window, on the 1st floor. It's lucky, coz no escalator, we need not to bring our big luggage up and down its too narrow stair...our room is the first one near the stair, at night when we slept, too noisy I think. No service at all except paying money. The towels, bedsheets didn't changed for 4 nights. The room is so small and it's difficult to place 2 luggages as well. But I wi\ould say that it is really good for single traveller.Apart from these, the staff is nice too."
17,709,"Jun 21 2009 	Its a EASY hotel	the stairs are narrow and echo when a person uses them, if you have a room near the stairway, good luck. The bath was *really* tiny with no place for clothes except on the toilet seat. It was difficult to walk as we had to place our bags on the floor in lieu to tables. The TV could only be seen from one bed and my brother had to move to mine when he wanted to watch the telly. If I had known about the abundance of hotels in the area with similar prices and with free wifi, I would not have booked this hotel. The staff were either always checking their mail or watching vidoes online. When asked for food recommendations in the area there was nothing from the staff. Will be looking at other hotels for my next visit."
18,709,"Jun 19 2009 	Read their cancellation policy.	Read their cancellation policy. If you cancel, they don't refund your money, it stays in your account with them, for 1 year, applicable to other easyHotel bookings you make. There is no furniture other than the bed, the floor is the only other storage location. The bathroom is too small for a tall person, I have to stand outside it to reach the toilet paper. No phone, no water glass, no kleenex, no shower mat, no rugs, no luggage rack, no closet, my bathroom smelled, a train shakes the building during daylight hours, tv is an extra cost, and the miniature bathroom sink was slow to drain (couldn't leave the water running), shower curtain didn't keep the water from getting out. Wouldn't stay here again."
19,709,"Jun 15 2009 	Budget Hotel With Poor Service	My girlfriend and I traveled here and spent 5 nights in a room on the third floor with a decent view of London rooftops. Positives: The price tag of the hotel cannot be beat and is really economical. By staying here we were able to save a lot of money. However, due to the size of the room it would be more acceptable for a solo traveler. Our bathroom was also clean which was a nice surprise. Negatives: So small! We read reviews before we left and thought that we could handle it. We couldn't. My girlfriend and I are thin people and we still had problems sleeping on what is really a twin bed. Additionally, if you have a large suitcase it is very unlikely that it will fit in the room. When getting ready in the morning we must have ran into each other over 10 times. Another huge problem that I have with this hotel is the staff. We came early and paid the 5 pounds to leave our bags with the staff. The lady told us to come back after 3 and everything would be ready. We came back at 3:30 and found out that our room would not be ready until 4. Finally, when she told us the room was ready; the maid was still in there cleaning! Also, my girlfriend and I were willing to pay the extra 2 pounds for another pillow only the hotel did not have any! Worse than that, they did not bother to get any extra pillows for the duration of our stay. The comforter on our bed was also severely torn but I suppose that is normal at the easy hotel paddington."
20,709,"Jun 6 2009 	Cannot recommend this place	I've been staying at the easyHotel Paddington for three nights.Cleanliness &amp; Service:Let me start with the worst part: Bed Bugs (which I fortunately spotted in the first night). This is not necessarily a question of how the rooms are cleaned, but the staff at the reception seemed rather unconcerned. I was not offered another room but had to insist on it, and to actually get the room, I had to return early to make sure that not all other rooms were taken. At least the management seems to have taken care of the problem and my second room (on the same floor) was ok.Other than that, both rooms and their bathrooms were reasonably clean, but you have to be aware that rooms are only cleaned when guests change or for an additional fee.Rooms:The rooms themselves provide the absolute minimum you need. It's sufficient for a weekend in the city but not suited for a longer stay. Like their web page says: there are &quot;2 clothes hanging hooks provided&quot;, and there is hardly any room for luggage. There is no shelf or hook in the bathroom to put any toiletries.For the rooms with a window to the street, there's another downside. The hotel is in a sidestreet and there's not much traffic, but there's a noisy bus stop right in front of the hotel. Besides that, the sound insulation between the rooms is also rather bad. Location:The location is pretty good, with Paddington station and the underground around the corner and lots of pubs and affordable restaurants in the area."
21,709,"Jun 5 2009 	Small clean and affordable - much as you would expect it to be	My wife and I stayed for one night and we were somewhat pleasantly surprised. The floor is hard and lacks that comfy hotel room feeling, but you understand why it's like that - easier for the hotel to clean and it's no big deal, there were clean towels on the bed - something we didn't actually expect, there was a TV - something we didn't expect (although a remote would've been handy), there was Dove soap dispensers in the en-suite (more than we expected). We stayed in Lower Ground 3, we had a card entry system on the door handle, the room was tiny, but adequate, there were 2 pegs on the wall that we used to hang our clothes on. There was a window looking out to a small services courtyard (but at least it meant you got some natural light into the room and some venitlation. We travelled light (hand luggage) - we were only in London for 1 night, after going to a wedding and for what we needed, it was perfect. We could've stayed somewhere else cheaper, but there is comfort in knowing that there will be a standard of cleanliness from a brand like those associated with Stellios. Staff were pleasant and business like as you would expect.Good points: clean, affordable, air con, window, TV, en-suite.Bad points: small room, no wardrobe"
