IDREVIEW,HOTELID,REVIEW
123,2153,"Oct 27 2007 	Shameful shady bribery racket going on despite wonderful rooms	Despite a dreamy, marshmallow bed and room that meets all standards (you get what you pay for, this property aint' cheap!), I was truly disappointed with the shady operation that is blatantly going on with the employees that work there, and i want to bring this to your attention. Outside the hotel there is a taxi line for the airport. The valets will let you bypass the line and immediately you a taxi if you slip him $5 or $10. If you don't give him anything, he'll tell you to wait in line (which takes a long time). If this doesn't seem so bad yet, wait --- the TAXI DRIVER then has to surreptiously slip him $10 for the privilege of getting the long airport ride! These valets are raking in a cool $15-$20 per taxi customer, and given the high activity level of this Marriott, these guys are raking in $$$ per hour at while taking advantage of the customers and taxi drivers, all off the books.My colleague and I carefully watched this all unfold while we were outside: Valet in top hat greeting a customer, see him get a bill, and the valet &quot;pretends&quot; that this tipping customer has a &quot;reservation.&quot; A taxi will pull up, and the valet will say &quot;what's your name again?&quot; in front of all the poor people waiting in line, and then lead the customer into the taxi. The Valet leans into the Taxi driver's window to &quot;give directions&quot; and slyly gets his take. When we got in the taxi, the driver admitted that he paid the valet. We asked him why, and he said he had no choice. &quot;if I don't pay, they'll get the next taxi to pay up. We need the money and the long ride to the airport is important to our salary. The cops know about this bribery racket but haven't done anything about it.&quot; He also added that sometimes the price is $15 to get an airport ride.Now you may shrug at all this, but what does this have to do with your stay? Not much, maybe. But it says a lot about how this Marriott treats customers after they exit the property, after paying $350+ a night to stay there. It leaves a bad taste in my mouth."
124,2153,"Oct 26 2007 	Careful of the rate!	Stayed here in late October. Rooms were pretty nice, common areas not bad either. Room was booked for a conference rate of $199 plus tax ($48). At check out the rate charged was $349 plus tax! Desk clerk was very helpful attempting to resolve, but ultimately had to contact the manager on duty with the statement &quot;please come down to the front desk, we have another one&quot;. The manager attempted to convince us the rate was correct even though another couple we traveled with during the exact dates had the correct amount charged to their bill. He had difficulty getting his story straight regarding the timing of the reservation (he had nothing to say after we demonstrated that our reservation was made 3 days earlier than our traveling companions, after he had stated the other couple had received a better rate for an earlier reservation). Ultimately he refused to honor the rate and became exceeding rude until we decided to leave. Plenty of nice hotels in S.F. We'll stay somewhere else the next time we're in town!"
125,2153,"Oct 16 2007 	Brilliant Hotel!	Brilliant hotel in a brilliant location.We booked a double double room and it was very big with a large bathroom (by hotel standards), stylish decor and massive flatscreen TV.Beds were super-comfy and the we had a great view of downtown SF from our 16th floor room.The 39th floor view bar was also great with view over the whole city.When we were there the hotel was rennovating the ground floor but this made no difference to us (there was no noise or mess) and ALL the staff were incredibly helpful and friendly especially the concierge, doorman and receptionists.Great location just off Market St, a stones's throw from the major stores and very near to the Powell Street Cable Car terminus (just get there early!!)."
126,2153,Oct 13 2007 	Great location	We got a great room with a partial view of the bay bridge. This hotel is central to everything. Chinatown and Union Square are pretty close by. There were lots of restaurants nearby. Bring your nice and comfy shoes. I would give it a 5 if we got a great deal on the rates. We came in at conference season so most of the hotels were fully booked. I will definitely recommend if you get a good rate. Room: Bed and pillows were decent as expected from a Marriot. Bathroom was modern and clean. 35 &quot; plasma TV screen.
127,2153,"Oct 11 2007 	Excellent View	We booked this late, but were given a wonderful room with a view to die for. It was a very nice hotel. St. Patrick's Catholic Church SAN FRANCISCO'S #4 HISTORIC LANDMARKFOUNDED IN 1851 very close. The 2nd Sunday of every month they have a authentic Filipino breakfast in the basement of the church for $5.00--we thought it was very fun to get to attend. We parked in the public parking garage (underground) and came up right next to the church....very close to the hotel."
128,2153,"Oct 9 2007 	Great San Francisco Location	This is centrally located for Union Square; for the shopping, cable cars and the city. The rooms were very comfortable, there was a great flat screen TV. There is internet access. There is a newly refurbished gym and also a pool. The concierge was very informative. Its is a very busy hotel and there is the usual expensive car parking charge for being in this city. This hotel has it for the location. There is a upper level bar and you can enjoy a drink with views of the city from high!"
129,2153,"Oct 2 2007 	Great hotel and excellent location!	We stayed at the San Francisco Marriott between 25 Aug and 28 Aug.The lobby is currently being renovated and reception has been relocated to the second floor however there are lots of staff in the main lobby to tell you where to go. I had asked for a room on a high floor, with a view. I didn't exactly get that - ended up on the 14th floor with no view! However the room was huge, very clean, great bed and pillows and big flat screen TV so no complaints there.We ate in the hotel restaurant once for dinner and again for breakfast. On both occasions the staff were fantastic and couldn't do enough for us. Thought both meals were excellent value for money. We went up to The View bar, which on the hotel's website looks fantastic. I was quite disppointed, its a lot smaller than it looks and there are very few seats with a view. When we got there it was packed and we ended up with seats that had no view at all!Having never been to San Francisco before I was a little concerned about the location of the hotel, whether it would be a long way from places we wanted to visit etc. I shouldn't have worried - within minutes you can walk to Union Square and all the public transport options are so close. We hired our car from the Hertz desk that is in the hotel and again the guy who handled our reservation couldn't do enough for us.Overall we had a great stay in the San Francisco Marriott, thought it was excellent value for money in a terrific location."
130,2153,"Sep 27 2007 	Loved the Marriott	We stayed here from Sept 2nd -9th and had a wonderful week. Check-in was quick and effortless. We had added the last night onto our original reservation and although this constituted two separate reservations, we had no problems - just checked in and out twice - but we were able to keep our same room. The room was spacious and very comfortable. Comfy king sized bed, lots of pillows, large modern washroom with lots of towels, and each day everything was sparkling clean. Large closet and lots of drawer space. We were also happy that there was an in-room safe - I believe the hotel website says that safes are at the front desk. Staff were friendly and very knowledgeable and quite happy to help in any way. Lots of large and speedy elevators. Beautiful lobby. Market Street is around the corner with easy access to the F-Line street-cars. Walgreens is also around the corner on Market. Mel's Diner serves great American food and their milkshakes are to die for. Although a busy place, service is quick. The Metreon has an up-scale food court. Both are virtually outside the front door of the Marriott. Union Square is an easy walk. It was great having a Hertz outlet right in the hotel - we had rented a car for our second week and the convenience of having Hertz right there made the car rental very stress-free. We would certainly return to the Marriott again."
131,2153,"Sep 13 2007 	Great Hotel	We booked this hotel on Priceline for $105 a night which was an extremely excellent deal. We stayed on August 30 and September 1st. The hotel was clean, our room with a king size bed was spacious and had a great view from two sides of the room. The staff was organized and ready to please from the beginning. We asked if we could get a refrigerator for our room and they immediately delivered one free of charge. I would recommend this hotel to anyone in a heartbeat and would stay there again. I recommend the bar on the top floor of the hotel as well - it has a breathtaking view of the entire city being that this is one of the tallest builgings. It also has a nice laid back atmosphere and they make a great pomengranate martini."
132,2153,"Sep 12 2007 	Good location	Here is my review after staying three nights at the marriott, in August.( + / positives)* Excellent central location, on Market Street. From there, you can catch the cable car (beware of queues particularly at the terminus), buses and also the convenient streetcar going to the Ferry Building and various wharfs. Also very close to Union Square, and main department stores. A short walk from China Town. Many restaurants and diners around* Hotel is easily accessible using the BART train from SFO. Cost is only about $6, and will take 30 minutes. Station on Market Street only 3 min walk to the hotel* Good modern and clean room, with large LCD TV screen, excellent bed* Good breakfast buffet, but slighly expensive. Lots of choice* Indoor swimming pool and jacuzzi: Not fantastic but adequate and free. Pool is quite large, with lots of loungers and towels* Lots of lifts so no queues( - / negatives)* Mini bar/fridge cannot be used for storing own food or drinks. One of those models automatically charging when something is removed* Some refurbishing work is currently done at the hotel. Reception area has been moved to the first floor, and is quite small with long queues. Also, can get noisy during the day with the noise of sledge hammers and the likes. However, stops late afternoons not to inconvenience guests* Air conditioning can be noisy* Windows don't appear to be cleaned often: it was even difficult to tell the weather!* No robes, would be useful with the swimming pool* Quite old fashion/70's style hotel. Big and impersonal"
133,2153,"Sep 10 2007 	Wonderful Rooms But Expensive Add-On Charges	We stayed at the SF Marriott downtown in order to attend a convention nearby. We booked the room via priceline for $150 a night (about $175 with taxes and charges). We had a room on the 15th floor with a view of the surrounding downtown buildings. Overall, the room was very nice - it was large, clean and seemed newly remodled. The hotel overall was exceptionally large and laid out in an odd fashion (check-in is on a different floor than where you pull your car in etc). The main concern about the hotel were the add-on charges. Parking was $40. Items in the rooms (snacks etc) were also very expensive. The hotel also provides a number of services that it seemed were required (cab flagging service, luggage hold, bellman service and such) but that also require tipping. I was surprised at how much additional money was spent on tipping and parking for our one-night stay. Overall, it added about $75 to our nightly bill. The location is in the heart of downtown and walking distance to Union Square. It is a bit of a walk to the Emarcadero and there are closer hotels to that area if you seek it out. The rooms were quiet but given the sheer size of the hotel it was a pretty noisy place in the common areas. I'm not sure that I would stay here again even though the rooms were nice just because there are equal hotels that are cheaper with a better location in the city."
134,2153,"Sep 4 2007 	San Francisco Marriot- a great place to stay	Spent the Labor Day weekend at the Marriot. We had in tow two small children and found this hotel to be in the perfect location. It is one block from the Yerba Buena complex which has a children's museum, a playground and a carousel. it is one block from excellent shopping, from the F train old fashioned trolleys and the BART. The staff is super friendly, the buffet breakfasts were delicious and very fresh and the room was large and clean with very cofortable beds. We will stay here again when we are in town. We booked on expedia and everything went smoothy which is important when you are travelling with children. The only criticism is that the tile decking around the swimming pool was very slippery and so one had to be extra careful not to fall. All in all, we had a wonderful stay and look forward to a return visit."
135,2153,"Aug 30 2007 	Good Marriott Under Construction	The hotel was very nice and was located in a great place. It was within short walking distance to the bart and to the street cars. Union square is a couple of blocks away. Many restaraunts are close by, even a sports bar on the corner of the hotel (I can't remember the name of it.) The hotel was under construction. The normal front lobby was being renovated and all check ins were upstairs. The beds were awesome and I wanted to take one home. My beefs with the room are that it did not have a microwave or a fridge (you could get one from the front desk I believe.) Another beef is that the room has this &quot;snack thing&quot; that if you removed one of the snacks it would charge you.... $4 for a little chocolate bar! HA There's a Walgreens down the street for crying out loud! I don't understand how they can charge that for a candy bar. Becareful not to knock over the bottles of water on the &quot;snack thing&quot; because you'll get charged! There is a mini bar under the TV which is awful in price as well. The TV was nice and the view from the room was great. They were playing music in the park across the street and it was nice to listen to in the room. The church next to the hotel rang bells every once in a while. The staff were very friendly and assisted us with ease. We didn't get a chance to eat the hotel or go to the View floor or go to the pool....we were too busy seeing San Fran!"
136,2153,Aug 29 2007 	Parking Charge!!	Make sure you get an excellent room rate as you will pay through the nose for parking. I was charged $49.02 for one night.
137,2153,"Aug 26 2007 	San Francisco Marriott - great hotel	We stayed here for 3 nights in February 2007 over a long weekend. Our room was large and clean; and we had a nice view.We had access to the concierge lounge, which was wonderful. They had pop, bottled water, coffee, tea, and snacks out 24-hours a day. There was a computer with free Internet access and printing available. There had a nice buffet breakfast, hot snacks and desserts out in the evening in the concierge lounge.We took the subway/train from the airport to the hotel. The station was less than a 5 minute walk from the hotel. The hotel is also about a 5 minute walk to the street-car turn-a-round stop. There are quite a few malls and shopping areas around the hotel and it is about a 10 minute walk to Chinatown from the hotel.There are other Marriott hotels in the Fisherman's Wharf area, which I would suggest staying at if you have small children or don't enjoy walking around a lot, because that is where most of the tourist action is at. The San Francisco Marriott is probably more suited for business people or shoppers. However, we don't mind walking around to get where we are going, so it was a great location for us."
138,2153,"Aug 26 2007 	Good Location well maintained	This hotel was in a great location within walking distance of most of the attractions (or a short bus journey if tired). The hotel has a great bar at the top with fantastic views over the city.The only gripe is that (like many hotels on our trip) they were unable to confirm a room with two queen beds and we were given a sinlge King (for our family of four) on arrival. Fortunately they upgraded us to a King Suite when we complained so, although the kids were on camp beds, at least there was space to move.The breakfast buffet was very good and whilst not cheap for adults (c$20), was very good value for the children (c.$7.00)"
139,2153,"Aug 16 2007	Good Location and okay hotel	Good location on Market Street so you have convenient access to Fisherman's Wharf and shopping. But it's a big hotel so don't expect personalized service. That said, everything works very efficiently and we had no complaints as such."
140,2153,"Aug 12 2007 	An Uneventful Stay	I stayed in room 1020 at the Marriott for 5 nights on a recent business trip. There were no big problems, but nothing amazingly good either. The room was relatively clean, there were no bugs, no noise from other rooms, no HVAC problems, and no billing problems. There is a coffee maker in the room, along with an iron, a hair dryer, and a safe. The location is good for tourists who don't want to stay near Fisherman's Wharf, and it's 2 blocks from Moscone. There are restaurants everywhere. If someone told me that my next business trip would take me back to the Marriott, I'd be okay with it.However, the Marriott isn't one of those places where you wonder how everything is so perfect. The CD player on the clock radio didn't work and my call to get it fixed didn't help. The bathroom wasn't spotless, though by the second day, the unidentified stray hairs were gone. The minibar was empty. The plumbing growls and groans when the showers are in use, and it's something to hear at about 8AM. The lobby was always crowded with a mix of vacationers and people attending a convention. Getting a taxi was never quick.The staff was universally friendly, but in that distant and corporate way that is far from memorable. I don't remember if a man or woman handled my checkout and it was only 2 days ago. For a contrast, the Palomar across the street is quirky and memorable, in the fun way that seems to be a specialty of Kimpton's hotels, but I didn't stay there on this trip.The bar on the top floor is worth checking out, even if you don't drink. The view is really nice when the fog is out and when you can find a seat next to the windows. It's an expensive place to have a drink before dinner (4 of us each had a drink and the bill was over $50) but it's worth doing once.Sure, I'd go back without a complaint. But next time I'll probably stay somewhere else just for the variety."
141,2153,"Aug 6 2007 	Extremely clean and comfortable!!!!!	My husband and I just stayed here for our third anniversay this past weekend, and we just have all great things to say about this hotel!!!! It is super clean, spacious, comforatable, and central to downtown union square and close to the financial district! We loved it so much- we stayed in a corner room so the view was awesome- we could see the busy street w/ all the people and yet could barely hear a thing (and we were only on the 6th floor!) The bed was so nice too- the mattress was super comfy and the bedding was very clean and crisp and comfy! The TV was a large flat screen (which my husband loved) and the bathroom was very nice and modern with granite(?) type floors and large bath tub. Even the smell of the room was nice! The location is so great as well- it took us only 5 minutes to get to the Bart station off of Powell, and three minutes to get to a Walgreens for water or snacks. The location also feels very safe and within minutes to great shopping and places to eat. We didn't rent a car- all we did was walk and maybe catch a cab if we were to go to fishermans warf (only $13 BTW via cab) We actually walked to Fishermans warf from our hotel and it only took us about 20 minutes- we cut through the financial district and it was such a pretty walk. You should stay here - well worth it and the staff is also super friendly and helpful!"
142,2153,"Aug 5 2007	Fabulous	Our family had the BEST vacation we have EVER had! I used one of the best websites ever. It is called airfarewatchdog.com. They gather ALL search engines in one place. I receive a daily update on airfare prices. I happened to find a great flight out of Phoenix. The search engine with the best price was Travelocity. I then combined it with the hotel and they gave us a rate of $1800.00. This included 4 roundtrip tickets and with 2 rooms at this Marriott. We stayed for 5 nights. The rooms were quite large and our kids had an adjoining room. Marriott is always my first choice. This one hotel was the cream of the crop in terms of service, cleanliness and hospitality. We did have one night where a room near us was having a bachelorette party. Needless to say, the were LOUD. We complained and someone quickly warned them. They toned it down for about 5 minutes and revved it up again. We called again. Management came and pulled 16 people out of the room. Unfortunately, the few that remained managed to be loud again. We called again and all people were removed. Security and management were both involved. Our room was compt and the manager personally apologized. They were quite embarrassed and very apologetic. We were very satisfied even though we had lost a couple of hours of sleep due to this problem.Regardless, the room was clean with VERY comfortable beds. Those are my two priorities. Everyone we came in contact with was so kind and friendly. There's a Starbuck there, a nice restaurant and concierge desk that was helpful and friendly. They gave us great advise on places. It was also helpful to have a car rental place (Hertz) on site. We rented a car whenever we left San Francisco and it was cheaper to rent only when we needed one (daily) than parking the car. Great advise given by a hotel employee.The location of the hotel is also ideal. We were about 1 block away from a location where we could catch a street car. A Walgreen's close by, which helps when you forget as many things as we did. And of course, your in the middle of a shopping mecca.Honestly, I did not want to leave. This is the first time I really felt comfortable in a hotel. I can't wait to go back and I hope anyone else who stays there has the same wonderful experience we had with the exception of the bachelorette party."
143,2153,"Aug 3 2007 	Love this Marriott	The rooms are big and confortable, the views are superb, the staff is helpful; what else can you ask for?We booked trough Priceline and checked in late, at about 8:00pm; therefore, I though we were going to be given the &quot;left over &quot; room, but was surprised by he staff's treatment. They asked what type of bed and room (smoking or not) I wanted and gave us a room on the 16th floor with views of the Yerbabuena Gardens and the Metreon.Overall a great stay!!"
144,2153,"Jul 28 2007 	Great Choice	My family of four (including a 6 and 8 year old) stayed here for 5 days in late July. We had a very positive experience. The room was clean and service was efficient and unobtrusive. The gym is presently being redone, but all of the equipment is available in carpeted conference rooms on the 4th floor and this should be done in August. The pool was great for San Francisco hotels, with a large hot tub. The hotel atrium restaurant was actually a pleasant surprisethe service quick, food good and prices comparable to other local places. I found the location of the hotel to be good, mainly due to proximity to the excellent public transportation in the city. There is a Whole Foods supermarket that has prepared food 3 blocks away; the cable car and Union Square are equally close. I would strongly urge travellers to familiarize themselves with the public transportation before goingwe did not have a car and felt no need to have one. You can easily and cheaply get to all attractions with public transportation (including an inexpensive trip to the airport on BART with a station a half block from the hotel). For example, we took the trolly bus (# 30 or 46 both work) to a Giants game for $4 for the 4 of us. AT&amp;T Park is about 7 blocks from the hotel. A cab from the airport is $35 before tip. My only complaint is that some parts of the surrounding neighborhood is a little rough around the edges, with more homeless people than I am accustomed to similar areas in Philadelphia or New York. I never felt threatened, but this did come as a surprise to me. Overall, I would definitely return."
