IDREVIEW,HOTELID,REVIEW
11,1367,"Jul 5 2009 	Unsatisfactory Service And All-Night Partying At The Clarion Montreal	We recently stayed at the Clarion Hotel on Boulevard de Maissoneuve for three nights (June 25-28) and were very disappointed with the quality of service provided by this establishment. While we had a satisfactory stay at this location one year ago, we feel we must give this hotel an unsatisfactory rating on this occasion. A negative check-in experience on our first day in Montreal was followed the next day by the night from hell as we were subjected to all-night partying by underage teenagers. The hotel was ill-prepared to deal with this situation and should be very embarrassed about its reputation . While we did receive some compensation from the hotels front desk manager, we feel that we must comment on our experience at this hotel because there are customer service issues, security concerns and major concerns for guest safety that must be addressedUpon check-in on June 25 at 5:45 p.m., the gentleman checking us in was not successful in getting my American Express card to swipe through the electronic credit card reader. Two different machines were tried. It was a recently-activated card but Id already used the card twice to purchase gasoline in two different cities and it worked flawlessly. I asked the receptionist to call American Express to see if there was a problem with the card and he refused. I called American Express on my cellular telephone and they informed me that the card was valid and that the hotel should call their hotline (a 1-800 number) and ask for a verification code on the card. The receptionist refused to do this saying that if the card couldnt be swiped, it was no good. I then called the desk supervisor over and she also indicated that the hotel could not accept the card if it would not swipe. She also refused to call the credit card company to verify the card. The supervisor did try the card again and was successful in getting it to swipe after her second try.We certainly started out on the wrong foot at the Clarion and this hotel should be embarrassed to have such an incompetent staff manning the front desk. That a modern-day hotel would not have a way of manually entering a credit card number and verifying its validity is something that we find quite incredible and unacceptable. We used the credit card several times in Montreal at various restaurants and without problems or incidents during our stay.On Friday, June 26, we came back to our room (#412) at 4:00 p.m. and found sheets covering the hallway outside our room. We wondered what was going on as we hadnt been informed by the front desk that any maintenance work was being performed on this date. My wife, who is handicapped, uses a wheelchair and the sheets made it extremely difficult to manouvre the wheelchair in the hallway. At 9:00 p.m. (five hours later), I approached the receptionist at the front desk and asked why the sheets were there. She informed me that the carpets had been cleaned that day and that the sheets were there to protect the carpets. I asked if the sheets could be removed from the hall and was told that people would be called to remove the sheets shortly. At 10:30, I called down to the receptionist again and she indicated that the sheets would not be removed until the morning. Please note that at no time, either when our booking was made or upon checking in, were we informed of any maintenance work to be performed at the hotel. That the hotel would not have closed this floor off for this type of maintenance is unconscionable. I also checked on several other floors and observed that sheets had been placed on those floors as well. Later on that evening, we realized that the carpets had not been cleaned and that the sheets were, in fact, placed there to protect the carpets in the hallway from all-night underage partygoers.After 10:00 pm on June 25, we became aware that the Clarion on rue de Maissoneuve in Montreal, Quebec had been targeted for a noisy, all-night, teenage after-prom party. Several complaints to the front desk drew little and very ineffective responsive action. The front desk claimed to be dealing with the problem but seemed content to have their regular, law-abiding guests accept the chaotic situation.The following infractions of unacceptable conduct were observed: Partying in halls and rooms More guests in the rooms than allowed under the fire safety code Excessively loud music Youngsters banging on doors in the middle of the night Loud groups on balconies Smoking on non-smoking floors in rooms, balconies and in corridors and stairwells Shouting and loud swearing Underage drinking Beer and liquor bottles/cans left in the hallways, stairwells and elevators Condom box left on the floor of one of the elevators Hash/marijuana found in stairwell All-night noiseIt was blatantly apparent that this Clarion Hotel was understaffed during the night as our calls to the front desk went unanswered. The line to the front desk rang repeatedly for well over one-hundred rings following repeated tries and there was no response from anyone at the front desk when we tried to call hotel staff. In effect, the front desk could not respond to any safety concerns at night because the hotel is so short-staffed. My wife is handicapped and if the hotel was so ill-equipped to handle loud party-goers, we wonder how this establishment would handle a medical emergency or a fire emergency (perhaps from a teenager smoking in a bed). There is a major concern as the disabled room is located on the fourth floor. Should a fire occur, the elevator would be out of service and I would be unable to get my wife down to safety unaided. Note that, in fact, the elevator did appear to be out of service in the middle of the night. It is obvious that any emergency situation that might occur in this hotel would result in a disaster beyond anyones imagination.The morning following the partying, the corridors, stairwells and elevators resembled a war zone. This mess remained throughout the hotel for most of the day and the establishment only had one caretaking employee charged with cleaning the corridors for the entire building. Where the prom partying took place on Friday evening, the corridors were still not completely cleaned and no vacuuming had been done. This clearly highlights this hotels severe understaffing, once again and demonstrates that the hotel staff is ill prepared to deal with any type of emergency situation that might come along.I spoke with the front desk manager on Saturday, June 27. Many other guests had complained about the noise and rowdiness in the hotel during the night on Friday. This manager did agree to refund the cost of one nights stay to us. While we did appreciate this gesture, it was a very small one considering the unacceptable conduct of the teenage guests on Friday night and the unacceptable level of service the hotel provided (or did not provide) to deal with emergencies. The manager made excuses for the low level of service, blaming everything on staff cutbacks. When asked if there were security cameras in the hallways, he stated that cameras were only present in the front lobby area and none were present in the hallways because those were not allowed under Quebec law. We know, in fact, that cameras are allowed in hallways in Montreal because we checked with one of the competing popular hotel chains in the city and their facilities have cameras in all their corridors and in all public areas.Because security and safety are such a concern in this hotel, we are making the following recommendations: Increasing the number of front desk personnel (particularly at night). Currently, only one staff member is assigned to the night shift. Security card access for guests to use the elevators A night security guard dedicated to patrolling the hallways to ensure that order is maintained Security cameras installed in the all corridors, stairwells, front lobby and parking garage. These should be equipped with video recording devices Enforcing the legal numbers of guests allowed to occupy a roomWe do not believe that this establishment would pass a government inspection or a Canadian Automobile Association Inspection following our experience there over our brief stay. For that reason, we have launched complaints with Choice Hotels, The Quebec Government and the Canadian Automobile Association. Hopefully the hotel management will acknowledge the problems we have addressed and take some action."
12,1367,"May 25 2009 	never ever ever again!	This hotel is the worst hotel I have ever stayed at. The balcony door fell off the track and onto the balcony when I tried to open it. The concierge moved us to a suite, which was just a bigger version of our ugly old room. The bathrooms are extremely tiny with no room to move. The other people staying in the hotel were loud, rude, and slamming doors all night. The night concierge was EXTREMELY unhelpful. This hotel over -sold their parking garage, leaving my business partner and I stranded in montreal with nowhere to park our car at 1:30 in the morning. We complained only to be told &quot; there was nothing they could do&quot;Not finding parking until 3:30 in the morning was an awful end to an awful stay in the Clarion. I would not recommend this hotel to anybody."
13,1367,"Nov 19 2008 	Horrible experience	I stayed at this hotel with another couple. I WAS HORRIFIED WITH THE EXPERIENCE WE HAD.After we were refunded for our room because of our experience, THE MANAGER CHARGED MY CREDIT CARD THREE (3) TIMES OVER---WITHOUT MY PERMISSION.Our experience included:-dirty soiled underwear in the lobby washroom-45 minute wait for elevators-dirty bed sheets-a manager who said they would call me back, then dodged my calls for - going on three weeks now.-noise complaints-dirty hot tub-no parking-a general manager who wouldn't listen to our complaints and was more interested in charging my credit card illegally, ***DO NOT USE THIS HOTEL. YOU WILL NOT BE HAPPY!-It totally ruined our Montreal experience, and one month later I am still trying to get this sorted with lawyers my credit card company, and the GM who is a flake."
14,1367,"Oct 18 2008 	Very nice hotel	I cannot quite understand the many negative reviews this hotel has gotten, as we had a very pleasant experience here.We had not booked in advance but i had made a mental note in regards to the very competitive pricing, and checking in on a Thursday evening without reservations was not a problem, neither was extending our stay for Friday. The people at the front desk were friendly and knowledgeable about the area.Our room was on the 20th floor, fairly spacious and very clean, with a comfortable queen sized bed, a full kitchen with even a real stove and enough dishes, glassware and utensils to prepare a simple meal for two. We also had a terrace which offered a nice view over Mont Royal.Having read previous reviews I was prepared for a long wait at the elevators but during the 2 days of our stay we never had to wait longer than 2 minutes even during the morning check out rush and on most occasions an elevator arrived within 30 seconds. There was some wait at the front desk however, which with only two attendants and an excessively ringing phone seemed somewhat understaffed.We were charged a rate of $107 plus tax per night, which was a lot cheaper than downtown hotels closer to the center of town, which were asking for $200 and up. Parking cost extra (I believe it was $15 per day) and I do agree that the garage is small and it takes some maneuvering to get around, but we did not encounter any major problems with our mid-sized SUV.There are lots of restaurants, supermarkets and shopping centers close by, and the closest metro station lies only 2 blocks away.An overall very satisfying experience and I would stay here again without hesitation."
15,1367,"Oct 6 2008 	This hotel is awful - don't even consider staying here	This past weekend I had the misfortune of staying at the Clarion Hotel at 2100 de Maisonneuve Montreal, QC. My experience was so terrible I believe that it is important for other travellers to be aware of the horrible conditions I experienced and the incompetent staff I had to deal with during my stay.I had booked a room with two double beds for four travellers. Upon arrival, I discovered that I was given a room with one double bed. I complained to the clerk at front desk, who was unconcerned at first and told me that there was little he could and that I could lodge a formal complaint in the morning. I had to tell him that this was unacceptable and I demanded that I be given the room I reserved so that there would be enough space for everyone to sleep. He finally agreed to call the manager and asked us to wait in the current  but too small room.Unfortunately, when we were waiting we discovered that the room we were given was not only too small, but also did not have electricity. After calling front desk, someone from maintenance came to the room. We tried to explain the problem, but he could not speak either French or English. After flipping the light switches he mumbled no power me back, shrugged his shoulders. He left and didnt come back. We complained again, to no avail. After sitting in the dark for about an hour we were finally given a new room. This room did not have two double beds, but it had a bed and a sofa bed and was apparently the last room available in the hotel. Conceding that it was better than a single bed we agreed to take it for the night.When we arrived in the room it was filthy, musty, and stinky. The walls had grime on it, the floor had chip crumbs, the sheets had holes, there were no pillows, and the bathroom was mouldy and in disrepair. The sofa bed had no support and it was more comfortable to put the mattress on the floor. Since it was all that was available we made due and had an uncomfortable night.The next day, we complained again and changed to a new room that actually had two double beds, was fairly clean, and did not smell. Unfortunately it did not have face cloths, and when we asked for them they never came. We called three times to get face cloths, but our request was ignored. Finally, an hour and a half later, someone came with a bath towel. But they could not speak English or French and did not understand us when we said that it wasnt what we needed.When I checked out the next day, I had to wait an hour since the hotel staff was slow and did not have an automatic check out system like most major hotels use. Regardless, we needed to talk to the staff because there was a card in the room that stated that if we were not satisfied with our stay we were entitled to a free night stay. When I finally got to check out, I asked the clerk for the discount and he LAUGHED AT ME! We spoke to the manager, who didnt take our complaints seriously, but offered us $60 off our bill anyway. We were so upset we just took the small discount that was offered and left so that we could be rid of the horrible experience and bad treatment.The Clarion Hotel was by far the worst hotel Ive ever stayed at and I cannot in good conscience recommend that anyone stay at this hotel unless they want to ruin their stay in the beautiful city of Montreal."
16,1367,"Sep 18 2008 	Hated It	I've stayed at the Clarion between 09/15-09/18 and had some good and bad experiences.Good:Having your own kitchen is definitely a plus. Cooking a light meal and eat it at your leisure makes me feel like home. I stayed in the Junior suites and had plenty of room to place my luggages, bags etc...Bad:I think the clearning crew must've been very lazy or they get paid somewhat a low wage. Bathroom: It's cleaned everyday BUT there are rooms for improvement. I walked into the bathroom one day and noticed a price tag I threw away into the basket bin earlier in the morning is now in the toilet. The cleaning person obviously didn't flush the toilet or else he/she'd noticed there's a piece of paper in there.Bed: It's made everyday BUT I noticed they just threw the extra pillow on the cover. It looks like someone was in a hurry and didn't bother placing it in its proper place.Misc:I don't think they really clean everything in that room during my stay. I noticed there was a strind of hair on my bedside table and my lotion bottle was knocked down one day when I got back to the suite.Elevators:There are 2 elevetors in the building. I didn't have to wait for long to go up to my floor. BUT going down was a different story. Unless you leave the hotel at 7amish, you'll have to wait 5-10 mins for an elevator. I got so fed up during the rest of my stay that I just took the stairs and walked to the main floor.One night I was waiting for the elevators on the main floor. There was a cleaning person changing the bags in the garbage bins. I assumed the bag has a hole or maybe something fell out from the bin. The person sweared right there in front of me. Although he was swearing loudly in a different language but it just so happened that I understand what he was saying. I gave him a look and then quickly hopped into the elevator.Check Out:There was one person working at reception in the morning. Everyday I passed by the desk, I'd see a queue waiting to checkout. I had to wait 25 mins to check out at 7:45am. The management should know better to place more people at Reception. The lady who was serving didn't get help until 8:10am. She had to multi tasks between people checking out, answer telephone calls and people 'dropping by' to leave things for her. etc.. etc...Maybe I am a picky person. Hence I'm noticing all these little things. But overall i don't think I'll come back to this place again."
17,1367,"Sep 3 2008 	Great deal - Recommend it!	I was last minute making reservations, TripAdvisor was a big help but I ran into too many 'not availables' so I asked AAA to find something and they got me a reservation at the Clarion Hotel &amp; Suites. We had a great room - a suite for only $124 CAD / night - with queen size bed, living room with pull out sofa (my 16 year old son was travelling with me so that gave us each a little privacy), 2 TVs, decently equipped kitchen, bathroom, and kitchen table area. We were on the 15th floor which had awesome views from both the living room and the bedroom with windows that opened! I read in Trip Advisor that we may not get parking in the garage and that turned out to be true. We wanted to park indoors since my daughter's stuff had to stay in the car a few days so we parked at the Pepsi Forum only 2 blocks away. It worked out great! You could park right out front for 15 min. to unload/load. Parking is not good anywhere in Montreal in my experience - neither inexpensive, roomy, nor easy to access. I recommend the higher floors because of the elevators. We did have to wait for an elevator going up, but never going down, but we did pass by the lower floors where people couldn't get on because it was already full. My key needed to be replaced but that did not turn out to be much of an inconvenience at all. Only other downside, the internet service was not reliable.But if you are on a budget, not in a hurry, and want to enjoy Montreal, I highly recommend it! Its near shopping, movies, groceries, metro, and restaurants.In the last 4 years, this is the 3rd hotel I've stayed in downtown and my favorite so far!"
18,1367,"Sep 1 2008 	Great Experience	We booked the summer special, stay the first two nights, and the third night is half price and breakfasts are included. Breakfast is two eggs, your choice of sausage or bacon, toast, juice, coffee or tea. The room is upgraded to an executive suite and it was very clean and comfortable. Fully equipped kitchen, separate bedroom, great air conditioning, bathroom is a little dated, but again clean and comfortable. All the staff were great and very helpful. Two blocks to the subway, but you can walk anywhere. Grocery store around the corner, and good shopping on St. Catharine Street. The BEST restaurant was Enzo's on Crescent Street. The food was excellent, the prices were very reasonable, and the staff was amazing. They will make you things that are not even on the menu! If you are visiting Montreal, you must dine here!"
19,1367,"Aug 30 2008 	Stay away	We decided to stay at Clarion because it generally enjoys a good reputation and was close to many of the attrations we wanted to visit. Upon arrival, we found that they charged a $200 security deposit, that was not advertised on the webiste, also $16/night for parking that was not advertised. The parking was in an undergroud lot, that barely accommodated the size of our Jeep Liberty. There was not enough room to pass another car in the garage, so you just held your breath and hoped you would not meet another car on the way. Breakfast was not included in the price of the room, unless you bought a &quot;special package;&quot; then the breakdown of room charges showed $10 each for breakfast that included 2 small eggs, 2 undercooked strips of bacon or sausage, two pieces of toast and a tiny glass of orange juice. The room itself was relatively clean, but on the shelf in the coat closet, we found shirt that belonged to a former occupant, sitting on a few layers of dust. The bed was hard and they only had feather pillows, a nightmare for 2 people who suffer from allergies. Most hotels today include free local calls, so we made a few over the time we stayed and on checkout found that they charge $1 for every call--also not advertised. Two elevators for 26 floors meant a wait every time you wanted to use one. The front desk girls were less than helpful and barely spoke English, we had difficutly getting them to understand most of what we were saying. Overall, I would no go back here. There were many hotels all around, pick one of them."
20,1367,"Aug 27 2008 	Avoid this hotel if possible	The only good thing about this hotel is its location. Everything else is just bad:- There are only 2 elevators (not enough for 21-floor hotel) and they are slow, so there's a constant line-up, a few of times we had to wait for 10-15 minutes- Rooms are not clean. My gf have found a hair and some dirt on the wall of the bathtub, the carpets were dusty, and the bed cover was not washed probably for a year.- Receptionists are rude, and completely useless (don't even bother to ask them anything).- They save even on shampoo and soap: there were not enough supplies for 2 of us for the whole period, and they didn't bother to bring any more.- Hotel website says it has a &quot;spa tub&quot;. But in fact it's a small, smelly (chlorine plus stale water) and quite dirty pool of water, hotel employees are walking around it in their street shoes. I have never seen anyone use it.In short: stay away from this hotel, there're plenty of better places in Montreal"
21,1367,"Aug 22 2008 	Okay Stay at the Clarion	In my opinion, the reviews on this site are a bit harsh. I found the room to be clean and spacious- we had a suite. I thought the location was close to the subway-we were there for the Montreal Jazz Festival. The center of town is about a 20-30 min walk away which was great for us to stretch our legs.I will agree that the elevators were slow and should be updated. I would also agree that the parking garage is very dangerous and also needs to be updated. Overall, I think the hotel is fine for the money spent unless we just got lucky."
22,1367,"Aug 16 2008 	A little puzzled by some of the terrible reviews	My wife and I booked an executive suite through Expedia.ca for Aug. 14 and 15 and paid about $105 a night. For this we got a clean, fairly spacious one-bedroom apartment with a kitchen that had wine glasses, crockery, a few pots and pans -- enough to do some simple cooking. We also had a pretty good sized balcony.As others have noted, the small lobby and the two elevators are a bit of a problem, but we managed to get checked in and checked out without too much of a wait. The wifi was free, and worked fine.The Clarion is not exactly overflowing with staff (I think during our visit there was just one person at reception at all times. The woman who checked us in seemed to be juggling about seven things at once, but she did it exceedingly well, and service was courteous. We had to park about a block and a half down the street at a private lot, but that's because we didn't book parking in advance. The fee at the private lot was surprisingly modest -- $12 for both days.The only real glitch was that when we returned, exhausted, at the end of the second day, neither of our key cards worked. But the front desk fixed this immediately. The place seemed fairly busy, but we were not awakened at 2 a.m. by noisy drunks as we were a few weeks earlier at a more upscale Montreal hotel. All in all, I'd describe the Clarion as pretty good value for the money."
