IDREVIEW,HOTELID,REVIEW
59,1084,"Jul 16 2008 	great location decent accomodation	The Berkshire is one of few Radissons located quite centrally around Oxford Street, all quite close to each other. The location of this one is possibly the best, located practically on Oxford St., about a hundred meters from Bond Street station and a lot of excellent shopping locations. The lobby of the hotel is quite small, as was the room, which according to the receptionist was a deluxe room which we were &quot;upgraded&quot; to. I'm quite sure they didnt have any basic rooms left as I've heard of several stories where these Radissons have run out of rooms. anyway, I didnt mind the upgrade, the room was definately liveable and still certainly not the smallest in London.I was a bit worried about noise, so I was delighted to see a modern double window in our room which indirectly faced Oxford St. to my surprise though, the other of two windows was missing the additionalm thicker layer, meaning everything from the street was quite audible in the room. I'm not sure if the second window was broken or what, but it being the one next to the bed meant that earplugs came in handy.that was however the only complaint I have, otherwise I enjoyed the stay here and was more than happy with the location. well, only other thing I'd mention is the sliding glass door on the toilet, this fad many hotels seem to buy is just ridicilous. it benefits no one, really. the price I guess is what you need to pay in London, anything cheaper most of the time shows an obvious decline in quality as well,another option worth considering is the Radisson Sussex located behind Selfridges. perhaps a bit more spacious and slightly more slick."
60,1084,"Jul 11 2008 	Great location room could use help	I just spent 3 nights at this hotel and was somewhat disappointed, but gradually grew to like it. The negatives: I booked the Business package on the website which includes internet and breakfast and is supposed to be a deluxe room. I requested a room away from Oxford Street that was quiet. They put me in 217 which is a low floor as I arrived at noon rather than their check-in time of 2 pm and it overlooked Oxford Street. It was noisy and emergency vehicles could be heard. There is no air conditioning, yet it was summer and quite warm, but they did bring a fan which helped. The furnishings - especially the mattress are tired and should be replaced. The decor could use a fake plant or something to soften it.The positives: Some of the staff were quite helpful. One evening, I brought back a curry from a farmer's market and the young man at the front desk kindly heated it up for me and served it in my room with dinnerware. The location is awesome! If you have limited time in London and want to get in quick shopping and the theatre this is so convenient.Will I go back? Hmmm - depends on if I can afford something nicer. I would have preferred a boutique hotel, but if I want to save money and have limited time I would consider staying there again."
61,1084,"Jun 5 2008 	Great location	In general, we enjoyed our 4 -nights stay at this hotel. The location could not be better for transportation and shopping. Rooms are small, but confortable and very clean.Be aware when booking through the hotel's web site: it does not offer the choice &quot;smoking or non-smoking room&quot;. You have to ask for a non-smoking room as a special written request. As we are used to other web sites, where the choice appears in the first place, we did not made the request. When we arrived to the hotel, late in the evening, the clerck told us that &quot;as you did not ask for a non-smoking room, I have to give you the only room left&quot; and it was a little smoking room on the first floor. We felt cheated. If we had noticed that detail....!! We think the web site is prepared that way to give the hotel more flexibility, but that is not fair to the clients. Next day we got a non smoking room, but no discount or breakfast free; nothing apart of the apology of the clerk."
62,1084,"May 27 2008 	Rather disappointing...	Had a Sunday afternoon flight from Gatwick and decided to treat myself to a nice night out in London the evening before...booked my room at this hotel through Lastminute.com at a fairly hefty discount. If I'd paid the full rate, I'd have been fairly displeased with what I got, but even at the discounted price I'd have to say this place was nothing really special. The only things going for it were the superb location and the fact that I could smoke in my room - something I thought government Nazis had outlawed everywhere!. Aside from that, there was the empty shampoo packet left in the shower by a previous guest (something one doesn't expect in a 4 star hotel!)...the rather meagre tea and coffee supplies(if you want more than one container of milk in your hot drink, that's the only drink you'll get, because the hotel provides two containers of UHT milk and that's it!)...and the completely outrageous food prices (20 including tray charge for a continental breakfast, whereas a hotel of a similiar standard that I stayed in recently offers a full hot buffet AND Continental breakfast for two pounds less). The list thoughtfully provided to give guests costs of items in the room in case they decided to make off with them was really the final straw - next time I'm in London, I'll spend half what I spent last weekend and stay in a hotel that really knows the meaning of customer service!"
63,1084,"May 11 2008 	Excellent location to Oxford Street but terrible check-in	Stayed at this hotel as part of a theatre break weekend. The hotel's entrance is situated just off Oxford Street, the ocation cannot be beaten for access to the shops! Check-in was terrible, our room was not ready when we arrived (1pmi-sh) and was told it would be ready at 2:30pm - went for some lunch, returned and still not ready - this continued for the next hour, each time I spoke to someone different and was told only 10 more minutes........1 hour later someone finally took onus of the situation and we were finally let into our room!!Rooms were nice, lovely decor, quite spacious and had a lovely bathroom - not much of a view though. We received a complimentary newspaper each day and the breakfast was self-service and delicious. The staff at breakfast time were very attentive but staff at reception seemed a little vacant at times. They also had very little knowledge of the local area."
64,1084,"May 1 2008 	stolen	I stayed at this Hotel for 3 nights..early check-in was allowed without extra charge.. this was good~but when I check mini bar, there's some missing bottles..so I noticed to the front desk right away.. not to charge me.also house keeper took my cell phone charger away on last day. and my cell phone was running out of battery..( it was my business trip... )"
65,1084,Mar 26 2008 	Perfect Hotel for Weekend Getaway	Great location and a great hotel. Stayed in a deluxe room which was roomy and had an amazing bathroom. Would def stay again.
66,1084,"Jan 30 2008 	Good Location for Oxford Street Shopping	Stayed here for 4 nights in early January 2008. Booked a deluxe room through the hotel's web site. Daily breakfast and newspaper are included in the package but newspaper was delivered to my room only 2 out of the 4 nights. Although the address is 350 Oxford Street, hotel entrance is actually on a dead-end side street off Oxford Street and is not well lit at night. If returning to hotel by taxi, it involved a &quot;diversion/detour&quot; before it can get there or ask the driver to drop you off on Oxford Street o/s Debenham for a quick short walk. Checked in online in advance but it did not expedite the check in process on arrival. The lobby is small and no staff was on hand to assist with baggage. Hotel staff were otherwise friendly and helpful. Breakfast selections were okay but did not eat at the hotel otherwise for lunch or dinner. My room faces Oxford Street but the window noise insulation was quite good and was not bothersome except for the occasional emergency vehicle siren. The hotel is just off Oxford Street across from the Bond tube station. Excellent location for shopping and access to transportation. The overall condition of the hotel and my room are good except for the mattresses and sofa in my room were near the end of their useful life. Housekeeping was good."
67,1084,"Dec 4 2007	Style over substance	Stayed here about 18 months ago in a small room with a small bed so have avoided and tried to stay in hotels at a similar price where you can walk round the bed and get a bath. Was booked here last week and thought I'd try it again, specifically asking for a bath through the agent - when I got there spent 5 minutes whilst this request was considered, discussed with the other receptionist and then the manager. I was then told that they were graciously upgrading me to what I would get for the price at many other hotels in the area. The room was noisy as it was at the Oxford Street end, the bathroom noisier and the cold blast from the window over the bath unpleasant. A triumph of style over substance. Would go again if the only alternative was the Sussex!"
68,1084,Nov 27 2007 	What is there not to like? Its just great	This is now my favorite hotel in London. The location is great for shopping. There are a lot of little things that are to my liking. The bathrooms have plenty of shelves for cosmetics and they have Q-tips and cotton wool balls! There is wireless internet included and the breakfast was good. The staff were extremely helpful also.We had our 18 year old daughter and her boyfriend with us and both rooms were roomy and comfortable.We also had dinner in their restaurant and it was excellent.I will definetly stay there again.
69,1084,"Oct 7 2007 	Horrible hotel well situated	Horrible dark and dingy hotel with peeling wallpaper, scummy bathtubs, rotten carpets and an awful smell !! Two room changes. No difference.And I forgot the building works. Drilling from 8 in the morning.Absolutely shocking. I will never stay in a Radisson group hotel again."
70,1084,"Sep 22 2007 	Wonderful week	First the &quot;bad&quot;: The room itself was a culture shock. Extremely small for the price. Amenities are rather lacking and the bed was small by American standards.The &quot;good&quot; far outweighed the size of the room: The hotel is extremely well maintained and spotlessly clean. Service was excellent.The staff could give lessons to their counterparts in America.They are extremely polite, very helpful, and most importantly, very friendly. The concierge personnel went out of their way to help me navigate the city, explained the Tube system to me, and mapped out paths for me to follow to the various sites I wished to see. I walked most of London and when I'd return to the hotel, the lounge staff would make sure I was okay and then leave me alone until I raised an eyebrow or looked their way and then brought me a cup of tea or coffee. (If you are American, drink the tea. British coffee is terrible.)Just an aside, I asked the concierge about a particular restaurant and was told not to eat there because I wouldn't enjoy a &quot;British&quot; steak. Instead a Tuscan restaurant (almost everything is now Italian around Oxford street) named Caldesi was recommended. It is approximately 4-6 minutes from the hotel on foot. The food is superb and the cappuccino was the best coffee I had while in England.All in all, the staff of the hotel made my trip to London a very wonderful experience and was well worth the cost. I am ashamed to say I didn't write down the names of the staff. I can't say enough about what a wonderful experience they made my trip. I can only recall a young lady named Barbara who served in both the restaurant and lounge. Her attention to my needs was terrific.Finally, Londoners are a great people. Friendly and extremely willing to help you find your way about. Especially if you have a southern American accent. (tongue in cheek.)Richard Palmedo"
71,1084,"Sep 18 2007	Fantastic Location!	We stayed here for one night and were very pleased. The hotel is situated right on Oxford Street and is perfect for shopping! The hotel itself is spotless, the room was well furnished and had everying thing you would need for a comfortable stay. The only thing I would say is that the air con. is quite noisy at night. Breakfast was excellent with something for everyone. Only a stone's throw from two tube stations, and very reasonably priced - we would definitely return again due to its central location. The staff are very friendly and helpful. We were able to leave our bags at the hotel for a few hours after checking out with no charge."
72,1084,"Aug 30 2007 	Excellent Service	I won a 5 night trip to London and was placed here by the agency handling the arrangements. My family of 3 couldn't have been happier. We all agreed this hotel offered the best service of any hotel we've stayed in. The staff was very accommodating and kind. The room was lovely and although Oxford Street is bustling and we could see it from our window there was very little noise and had no problem sleeping. The beautiful marble bathroom was a nice size. We didn't eat in Ascots but did enjoy the bar menu. The included breakfast was also very nice and offered a wide variety. We were very, very pleased with our stay."
73,1084,"Aug 29 2007	Not Good	Not a great experience. I had a room you'd be hard pressed to swing half a cat in. The TV didn't work properly. Radio 4 was completely inaudible. Air con was loud. Thankfully, I wasn't paying, but if I had been then my complaints would have been long and loud.Staff were perfectly nice, but on my experience I'd avoid it if you can.David"
74,1084,"Aug 2 2007 	Perfect location for shopping!!	Every year I go on a mini break to London with my mum. This year we chose the Berkshire Hotel. What a find!!You really cannot find a better location for shopping on Oxford Street. Handy if you intend to purhcase alot as you can simply drop your bags off in your room and head out again.The breakfast was of a high quality with plenty of choice. The rooms were decorated to a high spec, very modern. Only downside was that we didn't have a bath, but did have a double shower. The staff were all very friendly and helpful.Security is good as you need to insert your room key to gain access to residental floor in the lift and stairs.All in all we had a wonderful 4 days staying at the Berksire Hotel in Oxford Street and would recommend it to anyone!"
75,1084,"Jun 28 2007 	excellent experience	I enjoyed the hospitality of the Radisson Berkshire for 4 nights in early May. Travelling solo I only needed a single room which , whilst on the small side provided a very comfortable double bed well appointed bathroom and a good quality televison. Staff were very welcoming at check in and check out. I greatly enjoyed a traditional english breakfast of the highest quality in the hotel's breakfast room which also had a lovely traditional ambience.Location is sensational , next door to debenhams and metres away from the Bond street tube entrance. However being right on Bond street you can hear the street noise if you are in a room close to the front of the building. Daily newspapers and free internet access in their computer room were welcome bonuses. highly recommended hotel."
76,1084,"Jun 15 2007 	great location	We stayed here last weekend for our fifth anniversary, and booked it though lastminute.com under 'top secret hotels' - what a great deal! The location is fabulous, you walk out of Bond Street tube station and the hotel is right in front of you.The decor is very stylish and comfortable. Rooms are on the small side, but if you are staying a long time in your room then shame on you - its London! We stayed on a room only basis so can't comment on the breakfast.Down side to the hotel is the noise, being right on Oxford Street you can hear the traffic and the beeping of the pedestrian crossing.Overall, if you're looking for a chic hotel that is a great base to explore London this is the right hotel for you."
77,1084,"Jun 13 2007 	Great location for shopping	If you intend to do some shopping, then this location is perfect. The rooms are small but so very comfy. There are computer terminals for free internet access (husband surfed the web, while I shopped). The bar is nice in the evening. I would only stay at the hotel if you have already been to London before or are there for several days. If you are only there for 1-4 days, I would pick a hotel closer to Westminster where all the tourist sights are. But don't think you'll get away from the tourists at this hotel either. Oxford Street is very busy. There are lots of side streets to explore. Many dining and bar choices as well all around. There are also a lot of pedestrian only streets for shopping and eating nearby.."
78,1084,Jun 2 2007 	Excellent location	Ideal location ....However the hotel isn't particularly good. Nothing to feel amused or let down. The service is ok....It is quite a small hotel...particularly the reception area without a lounge area.
79,1084,Apr 10 2007 	Smart Hotel close to shops 	Booked this hotel as going to see a show in the Palladium Threatre (7 mins walk away). Ideally close to Oxford Street - hotel entrance on side street right beside Debenhams which proved to be a good landmark when wanting to return to hotel. We had booked a twin-bed deluxe room which although not big was spotlessly clean with lovely bathroom. We overlooked Oxford Street (Room 519) which could have been noisy if you opened the windows but the air conditioning worked fine. Breakfast was a hot &amp; cold buffet and staff pleasant. We booked via the hotel chain online and had no problems with our booking - receiving a welcoming e-mail one week before travel. From previous experience of hotel chains in London you should always try to book the best room you can afford as the quality is always less in London. Have no complaints regarding this one. It is right beside Bond St tube station with easy links to other attractions. Staff helpful and kept our cases even after we had checked out so that we could go shopping.
80,1084,"Jan 2 2007 	Great service Convenient spot for shopping	We stayed at this hotel in December after Christmas with another couple. We had two rooms there on the same floor. Our stay in London was strictly a shopping trip during the big sale in London after xmas. The location is awesome. We mainly shop at Selfridges and along New and Old Bond Streets. All within walking distance from the hotel. The staff has been very helpful. They helped us arrange tables at nice restaurants, even at New Year's Eve. Very nice and modern decor in the rooms. Very good value for the money for a nice room in the center of West end London. We are definitely coming back in our next shopping trip to London."
81,1084,"Dec 21 2006	Noisy and cold - never again!	My boyfriend and I stayed here after my office Christmas party this week. The hotel is in a great location, right in the West End and hence I also understand that there will be a certain amount of noise from outside. However, I didn't bargain for the beeps of a pedestrian crossing going off approximately every 10 seconds from the first light of dawn. On closer inspection of the window, it was only half double glazed which would also explain the icy winds coming in on the coldest night of the year so far!Our mood wasn't improved by the breakfast delivered to our room - on time, but freezing cold and shrivelled up - totally inedible.I expected more from Radisson, having stayed at other hotels in their group and been pleased with the accommodation there. Never again for the Berkshire!"
82,1084,"Dec 13 2006 	Very disappointing	I had what I experienced as a nightmare of a stay at this hotel as from Dec 8th until Dec 11th.I booked by Internet, and was sent some welcoming reminders from the hotel with weather forecasts etc. before going. I had great expectations, and had a booked a &quot;Let Loose In London&quot; offer in a deluxe room, and I also had great memories of the hotel after staying there a couple of years ago.The offer was described as including the following:Accommodation Full English breakfast VAT at 17.5% Let Loose voucher booklet given upon arrival. Pass is full of exclusive London offers from The Comedy Store, Natural History Museum, Vinopolis City of Wine, Victoria and Albert Museum and many more The DeLuxe room was described as containing:Deluxe roomsKing or twin deluxe bedrooms are more spacious than standard bedrooms, with a king size bed or two single beds. Deluxe rooms also offer a seating area with a sofa or chaise lounge, turn down service and bathrobes and slippers.I was given a small and most standard and poor room, I never obtained any voucher booklet during my stay and I was even told in the breakfast room the first morning that breakfast was not included. When I asked a lady in the recpetion about this and told her that I was on the Let Loose In London offer, she reluctantly wrote in the system that I was supposed to have breakfast inclusive. (Nevertheless the breakfast appeared with a charge on my bill when I checked out, but I refused to pay it and it was deleted). Nothing else happened, and as I had not printed what the offer included I became uncertain of what was in the package and let go with the treatment they gave me.I will also mention the disappointment in finding the room undone when I returned in the afternoon (I had turned on the green light for &quot;Please clean the room&quot; when leaving in the morning), and that I had to ask them to refill the minibar after it had not been done for two following days.A most disappointing experience, and they broke all my expectations of a comfortable and nice London stay.Let me add that I have written a complaint to them after returning home and having found the scope of the offer, as well as a complaint to the chanin's customer service department. It will be interesting to see of they care enough to give me a response...."
83,1084,"Oct 29 2006 	Great Hotel	We stayed at this hotel for 1 night as part of a theatre break in London.Although it was a little small, the room was clean and very quiet. We had arrived earlier than the stated check in time and the hotel took our bags, so that we could go and enjoy the shopping delights of Oxford Street!Our rate didn't include breakfast, however this was available for an additional 16 each. Personally, I wouldn't bother, as there are several Starbucks or cafe's around within a few minutes walking distance.A great hotel in a fantastic location, especially if you would like to be close to all the shops and directly opposite the tube station (Bond Street).The only negative was the bathroom was very small (but clean), however, for a few nights stay ie a weekend trip, it is adequate enough.Would stay here again and reccomend it to others."
84,1084,"Jul 20 2006	Great Hotel	Just got back from staying at the Radisson Edwardian. Was a little apprehensive about staying here after reading the other reviews but was pleasantly surprised.The hotel is very stylish, staff very friendly, the room not too small (standard) but very upto the minute, clean and facing a side street so not too noisy. The bathroom is really modern. The bed and pillows are very very comfortable. The only slightly negative points are the lack of two bedside tables (there was one on one side) and clock, also the marble floor in the bathroom is very slippy went wet. Having said this, the location is perfect, the bar is trendy (but expensive) and the restaurant is worth a visit. Will stay here again the future."
85,1084,"Jul 12 2006 	London Hotel Surprising	Stayed for one night on business in June 2006.Nice enough hotel if very expensive. I expect less from London hotels than anywhere else in the country, as such this was a good hotel. Room was small but ideal for one person.Caters for tourists in my opinion rather than business.Great location as over road from the tube."
86,1084,"Jul 3 2006	Confirmed 	Our reservations were confirmed and PAID FOR two weeks ahead of time, but this didn't matter. The Radisson overbooked and then shuttled customers to other Radissons in the London area. There were no comps for this inconvenience, no coupons, nothing except a weak &quot;I apologize.&quot; The Radisson hailed a taxi to take us to the other hotel. The taxi driver told us he had been shuttling customers between the various London Radissons all day. Evidently this is a well know fact in the London area. DO NOT STAY AT THIS OR ANY OTHER RADISSON IN LONDON. They are all participating in this unethical, but not illegal activity. Forget that the customer selected a particular Radisson for it's location, or past experience, or a friend's recommendation. None of this matters to the Radisson organization. Remember when you book with Radisson in London, you know not where you will actually be staying. From a business view, I understand how this happend. I had booked a Saturday night only because we were traveling from Edinburgh to London and then flying home the following day. It was the Queen's birthday weekend, the weather was beautiful and there were other special activities in the city. I was knocked to the &quot;unimportant&quot; category because they had several reservations for Thursday-Saturday night. This is exactly why a person pays ahead and has a confirmed reservation.I have never written a review, but this situation was so unacceptable that I had to tell others."
