IDREVIEW,HOTELID,REVIEW
229,372,"Jan 19 2008 	Great Atomsphere	I've been to Las Vegas dozens of times, including about 20 trips in the past year. I'm a Diamond Total Rewards member and usually stay at Caesars, Paris or one of the other Harrahs establishments, but I've also stayed at Circus, Circus (one night . . . NEVER again), Stratosphere, Sahara, Venetian, Monte Carlo, Golden Nugget, and a few of the non-casino hotels.A year or so ago I went to Hooters to play blackjack. Although I left with a lot more money than I brought, I left with a bad impression. The parking lot was old and creepy, the casino seemed to be dark and smokey, the tables were packed too close together, and with a couple of exceptions, the dealers seemed unfriendly.I recently received an offer that I decided to use to add onto a trip I had planned at Paris for last week. I'm glad that I did. I had a great experience.First, the room was exceptional for a budget casino. My room was a suite, and althought it obviously wasn't as big or as nice as a suite at Caesars or Paris, it was nicely decorated, exceptionally clean, and the quality was much better than I expected. I wouldn't decorate my house the same way, but it had a casual and comforable warmth that was a uniqe change. I would easily choose that room over many of the rooms I've gotten at other hotels. I also had a strip view from the 19th floor, which was nicer than the view I've had at most Las Vegas hotels.But the most pleasant surprise was that the casino seemed to be warmer and friendlier than I experienced on my first trip. Either my first experience was exaggerated negatively, or they've made improvements that result in less crowded space, brighter lights, and less stuffiness. Most importantly, the dealers were a lot of fun. After playing blackjack at the stuffy Bally's and Paris casinos, the Hooters atmosphere was a refreshing change.The hotel check in was a breeze. The staff was efficient and there were no lines. I also never had a wait at the cashier's window.Although Hooters is at the end of the strip, it's an easy walk to the monorail and a reasonable walk to the middle of the strip.One of the nicest features is the proximity to the airport. I've had cab rides from Ceasar's and Paris that run as high as $25 and take a half hour due to long waits in traffic. From Hooters the fare was $7.10, or $10 with a tip, and took aboaut 5 minutes.We ate hamburgers at the Hooters restaurant and had ribs at Dan Marinos. Both experiences were great, both in terms of the quality of the food and the service.There were a couple of negatives. As pointed out in other reviews, the hallways need to be upgraded. The carpet is dull and worn, and the walls need help. They caused me to worry as I walked to my room.I also had to wait too long in the player's club line. The first wait was between 45 minutes and an hour, and the second was about a half hour.Overall, my stay at Hooters was one of the best experiences that I've had in Las Vegas, or in any other casino, for that matter. If you factor in the reasonable rates and the more casual, relaxed, fun atmosphere, you can't beat it."
230,372,"Jan 9 2008	Thanksgiving at Hooters	For the 9th year in a row, we headed to Vegas for Thanksgiving. We were a group of 10 - 12, depending what day it was. Most stayed at the Flamingo on the strip, however, my husband &amp; I decided to try Hooter's Hotel &amp; Casino. It's convenient location to the monorail and the great rates we received, Why Not?Check in was a breeze. We reserved a downstairs bungalow. The room was small, but cute &amp; had a slider door to a patio. We were there 5 days/4 nights &amp; everything was great. Good service on the casino floor &amp; we even won a little bit of moolah.We are planning a return trip in August for our nephews 21st birthday - Can't think of a better place to celebrate a 21st bday!"
231,372,"Jan 8 2008	Decent for the price!	Stayed at Hooters for 5 nights in December. This review is based on the fact that I paid 39/39/59/59/39 for each night. If I had paid a little bit more per night I would probably have an awful review to write, as it isn't worth much more than what we paid.The rooms were clean. You could tell that they did MINIMAL investing in the renovation. Covered things up rather than fixing them up. The HVAC was loud and rattling but it didn't bother us as we like a little white noise as we slept. The beds were definitely very comfortable and clean which was nice. We were given double beds instead of a king, but we didn't mind much. The hallways were definitely gross, the carpets were stained and they were dim and dank. The elevators were fine. We didn't eat at the hotel, but found the little gift shops to be ridiculously overpriced, go up the block to stock up on bottled water, gatorade, etc.The location is GREAT. Whoever is saying its a 10-15 minute walk to the strip is ridiculously slow. We clocked it at 4 minutes.The casino is fun. A completely different atmosphere than other Vegas casinos but we enjoyed it. I love that everything smells like sunscreen/the beach and that they play fun music.Again, if you can get a ridiculously cheap deal on this hotel, go for it. If you are looking at paying anything more than $70 a night, definitely not worth it in my opinion."
232,372,"Jan 7 2008 	I am always happy with Hooter's	This was the second time I have stayed at Hooter's since the remodel. The first time was literally the weekend after it opened, the rooms weren't finished but hey, it was a place to sleep. Our most recent visit we were originally put into a room with two full size beds.....so not comfortable. My husband asked if we could be relocated to a room with a king size bed.....the room was so much better! The bed was comfy....all in all I was very pleased. I love this casino because if you go with a group people are easy to find because the casino is so small. We never had a hard time getting drinks and the casino seemed to pay out for everyone in our party! The food on the other hand, not so good, same with the service. My husband loved the bacon at the Dam restaurant but they have closed this so now all the casino offers is Dan Marinos and Hooters. Dan Marinos is terrible, terribly slow service and rude employee's. The Hooter's, lets just say you pay for what you get! The girls are hot but lacking customer service...But I have to say I love this Hotel....I just don't eat here!"
233,372,"Jan 7 2008 	Not worth the money!	We decided to stay somewhere new in Las Vegas and did we make a mistake! We thought Hooters would be fun, but were we wrong! Besides the fact it was New Years and we paid $250.00 per night (In some cases more than MGM and New York New York) thinking it would be different. We were not greeted with cute little Hooters girls but quite the opposite. The only place you see the cute Hooters girls are in the restuarant in the back, the problem here is that the line is always long to get it. Then when you get in the service is not good.The casino is very smoky, and has people in it from somewhere else!Then our room was so plain, the air conditioner was broke and we were told the night we arrived (after the engineer had been up 4 times to check it) that it was not to be fixed until the next week. They did offer to move us the next day but fortunately it got colder outside plus I did not want to pack everything up again.We will never stay here again!!"
234,372,"Jan 3 2008 	Nice for the price	I booked Hooters Casino Hotel as a birthday present for my husband. It was a great deal - $25/night. The location is fine.. just slightly off the strip. The beds were very comfortable, but we booked a king and didn't get it until the last of our three nights. The hotel is still undergoing renovation. The rooms at this old San Remo Hotel look pretty good, but don't always have the right furniture. The first room we had didn't have any chairs, just the three barstools. The second room was better wth a desk chair and a nice bedside chair. There's also no coffeemaker meaning you have to go downstairs to the little bait shop to get a cup. That shop also has Krispy Kremes. The carpet needs replacing badly in the hallway. We got an odd set of towels - 3 large, 1 hand, and 2 wash clothes. There are few plugs. There is Internet, but we didn't try the connection because we didn't bring a laptop on vacation.Food: Donuts and coffee/juice are available at the bait shop at a reasonable price. We had breakfast at Dan Marino's restaurant because the hotel gave us a 2-for-1 deal. It was pretty good. Good service. We ate at the Hooters restaurant and I wasn't impressed with the food, but the service was good.Casino: Don't bother. The slots are really tight day and night. The promotion of $100 in free spins is an indication of how the casino isn't serious about keeping people playing. The money is used on $2 slots and gone in about a minute.We probably won't stay here again. I think paying an extra few bucks to be on the strip in a more central location or downtown would be worthwhile."
235,372,"Dec 31 2007 	have stayed 3 times	Great hotel my wife and I always stay here. We travel to Vegas 3-4 times a year and search for the best rate and hooters always comes out on top. To be honest, this is my favorite hotel in vegas. The last time we were there, the hotel has declined a bit. nothing noticeable to the first time visitors. Beds are most comfortable in vegas(based of apporx 12 beds i have stayed in, in vegas)easy accesses to the strip through trop or mgm. the dam restaurent is the absolute best 3 am food in the world.cant wait to go back"
236,372,"Dec 30 2007 	Reasonable inexpensive accommodations	I admit it--I stayed here only because of the price. I couldn't believe that I could get a reasonable room in Las Vegas for only $26 per night, but that's what I paid. What I got in return was a clean room with a comfortable bed. They have internet access in the room, but it's not free and it wasn't working most of the times that I tried to use it.The location is next to Tropicana, about a 5-10 minute walk to the Strip. MGM Grand is directly across the street.I visited many casinos during my stay in LV and the one at Hooters had more smoke and more noise than any other. There would occasionally be someone screaming out loud for no apparent reason. Maybe it happens elsewhere, but here the sound travels throughout the casino.I'm not dissatisfied with the hotel becuase I got what I paid for, a clean and quiet room. However, I doubt that I will stay here again."
237,372,"Dec 27 2007 	Won't be back...	It was a clean place to sleep... that's really it. Terribly rude staff in Dan Marino's (a man got up and left it was so bad) and poor service in Hooters (a pretty face in orange shorts doesn't make up for the lack of service, one customer was so disappointed with the service she made a big scene). Walls are thin. Another family on our floor had children, and you could hear every word they said. The Hooters Casino Hotel website said there were &quot;complimentary coffee stations&quot; in the rooms. Our room didn't have one, and when we inquired about it, they gave us a blank stare, and told use we would have to gamble in the casino if we wanted free coffee. All with an air of rudeness.Stay away from the Tahiti Village booth. The Tahiti Village staff make you think it's part of the Owl Rewards Club and you tell them which room you're in, etc. Turns out that Tahiti Village is not connected to Hooters, and they just have a booth in the hotel. Tahiti Village is a timeshare property, and they will give you tickets to a show if you go to a two hour presentation (and put a deposit on your tickets). We mistakenly thought it was part of the Rewards Club and gave them our room number. THEN they gave us the timeshare rundown, and we weren't interested. They called our room on three separate occasions and left somewhat harassing messages. This isn't necessarily something Hooters can help, but they do allow Tahiti Village to have a spot within their hotel and market to (i.e., harass) their customers. Because we felt like we had to continually avoid they Tahiti Village harassers, and because of the general rudeness of the staff, we spent little time in the Hooters casino... go across the street to MGM. It's much nicer, and the staff are a lot friendlier. The two stars are for the clean room and a decent location. We won't be back, and don't recommend this hotel."
238,372,"Dec 26 2007 	Not worth the savings!!!	My girlfriend and I travel to Vegas 5-6 times a year and have stayed at many many hotels, both on and off the strip. I am definately not one to complain, the hotel for me is only a place to sleep...especially in Las Vegas, but our five nights here were a bit ridiculous. Despite my reservation they put us in a room with two beds (didn't make much sense) but having spent alot of time traveling, this was not my first experience with the matter. They were holding a package for me, which took about 30 minutes to find, but again, I understand these things happen. What bothered me was the staff. As a whole they were unfriendly and rude, and I'm not talking about the dealers in the skimpy outfits. It was the front desk, the waitresses, the bartenders that really had an opportunity to make or break the stay for me and they failed miserably. My girlfriend was so taken aback by the general lack of courtesy and kindness that she asked to speak with a manager, only to be given a VIP host. Polite as he was, he merely directed her to fill out a comment card about the matter. The Dan Marino restaurant was nice enough, though I had to interupt the waitress and the hostess from side conversations with their boyfriends to get them to seat us and take our order. The food took about 45 minutes to bring out, strange because we ordered 20 hot wings and celery sticks, and we waited so long for a check we ended up guessing on the bill and left cash on the table. The clientele was slummy and for the most part belligernatly drunk after about 10:00. For the women reading this review, my girfriend wouldn't walk the casino floor or bar without me. For the men traveling with women, if drunk guys hitting on your significant other over and over and over again bother you...find another hotel. And for you gamblers out there, yes the reviews are true, the casino floor is about the size of a basement. All in all, the service is not worth the savings, pony out a few more bucks and don't let the hotel and casino ruin the vacation--"
239,372,"Dec 8 2007 	Of ribs and chicks	Stayed here on the Saturday after Thanksgiving for a night, and having been there the night before feasting on the all you can eat ribs at Dan Marino's and almost lost some money trying to pay for the meal, I decided to stay at the property. I just came in at 10 am and asked the front desk guy if there's any rooms available. He said yes and gave me a good rate ($59) for it without me having to show my AAA card or saying anything for it. Made the cash deposit, and he gave me the keys to one of the bay view rooms. The location wasnt that great (next to the stairs and view of Airport), but the beds were the best i've stayed in a hotel in a loong time, and the decor is pretty hilarious, orange everywhere, a mini bar stool and table, and a mini tree. Service was great, the krispy kreme bought at the hotel store was awesome, and the girls there were great to talk to, especially the one at the store. Would return here if i want something no frills to stay in vegas, and definitely recommend it to everyone. Try Dan Marino's restaurant too while you're there....good food for a decent price."
240,372,Dec 3 2007 	Had a blast a Hooters!	My bestfriend and I just met up last weekend in Hooters for my 30th birthday and we had an absolute blast. The room was nice and very clean. The casino was excellent and you could actually get a drink when you gambled. We arrived several hours early for check-in and they still let us check into our room! The room service was excellent as well as our 2 o'clock in the morning dinner in the resturant. Being girls we had read some of the reviews and were a little afraid we might get bombarded with midlife crisis perverts but this wasn't the case at all! I would and will stay here again!
241,372,"Nov 29 2007 	A Hoot at Hooters	Hooters is a nice hotel - rated as mid standard, there are good and bad points i will list below but overall the stay represented excellent value for money and would recommend this as a great hotel.Hooters is just off the strip ( about 10 minutes walk past the Tropicana) to get to the nice part of the strip with New York and Excalibur and MGM) It is over the road from the MGM and it has a monorail to get you around the whole strip.The location isnt brilliant and you can feel a little isolated in the hotel.The hotel has good facilities, it has an amazing restaurant, lovely pool and spa area, it has a good range of slots- but the main tables are closed more often than not.The rooms are nice and spacious, big TV, large bathroom, was clean and comfortable.The carpet does the hotel no favours there are drinks stains everywhere and the negative reviews on here mirror this, however this was the only issue I found that could be something to moan about.Reception were friendly and informal, Room Service was nice and the staff were always helpful and approachable.I would recommend this hotel for anybody - the girls are stunning and friendly so guys will love staying and eating here. It isnt too formal and isnt too enormous. I found there was a real range of guests from families, youngsters to older people.The location isnt bad but another 10 minutes away and it would be an issue.OVERALL a thumbs up to a very enjoyable stay"
242,372,"Nov 6 2007 	What a great place	We looked for a hotel just off the strip, close to the action. We came to see the various cirque de soleil shows, and wanted to be close to the vemiues. Hooters filled the bill perfectly W.e had a large, clean, updated room where everything worked. No noise, no bugs, no smell, the elevator arrived within seconds on most occasions. It certainly wasn't posh, but we weren't paying posh prices. Only fault was that there wasn't a dresser for clothes, and you had to pile your stuff in the bottom of the tv cabinet. Staff was friendly, adn after a while, got to know us..We were across the street from MGM, and thought &quot;great&quot;, we can stay at the Hooters, and use the facilities of a &quot;real&quot; vegas hotel. After a few days, we realized how much better it was at Hooters, and ended up using their facilities. At MGM and other large casino hotels, you walk for what seems like miles to get to the various restaurants, shops, the pools etc, and wait in line. Everythign at Hooters was convenient - the pool was right next to the elevators, several restuarants and bars within a few steps, there wasn't the &quot;zshoom&quot; of hundreds of people in the lobby, restaurants, etc.. The casino was small and uninspiring, the mega casinos seemed to be a lot more fun. But we didn't come to gamble - our daily limit was $1.00 - and we had fun visiting many of the different casinos, all of which were welcoming, despite our limited wagers.Perhaps others had bad luck during their stay at Hooters - ours was really good.."
243,372,"Nov 5 2007 	great place	I went out there for a my bachelor party with 11 of my buddies. We went out for 3 nights, it was $75 total for each person for 3 nights which was awesome. If your looking to gamble and drink, this is the place because the drink girls were so quick to bring back your beverage and the tables were not expensive. People have said that the casino is small which it is but not once did it get too crowded at a table, there were always seats at the blackjack tables. The hotel was right off of the strip, right across from mgm and tropicana. I would recommend this hotel and plan on going again, and the hooter girls were too bad to look at either"
244,372,"Oct 24 2007 	Just OK	Stayed at Hooters for 3 nights in one of the &quot;bungalow&quot; rooms outside the main building overlooking the swimming pool. Very good king bed and one chair but almost no other furniture. Loud music from poolside from 8 am to 10 pm or so. The rate ($43/night) made it hard to resist for 3 nights in midweek. I might stay again in the off-season, but not on weekends, when the price jumps to $200+ per night."
245,372,"Oct 22 2007 	Good Service....needs some improvements	First, let me say that I am not usually too picky. Although I have been fortunate to stay at some very nice hotels on the strip, I have also stayed at my share of lower end hotels. Clean and comfortable are all I really care about. The check in process was friendly, quick, and we got the rooms/locations we requested. Although we were there at 1:00 our room was already available which was nice. The rooms are remodeled and attractive. There were no bad smells which I have experienced in non-smoking rooms in other Vegas hotels. The beds were very comfortable. The comforter and pillows were pretty, however after looking closer at the matching decorative bed pillows, we noticed small stains that appeared to be blood on them. Yuck! A few stains on the carpet but not enough to make a big deal of. The bathroom - needs work. The toilet barely flushed half the time. We were scared it was going to overflow. The tubs appear old and the drainage is slow but all in all, it's adequate. The Dam Restaurant and Dan Marino Restaurant were both very good with great service. Nobody in our group won anything at the casino although it was a nice comfortable size and not too smokey. The two gift shops offer some great unique Hooters gifts and they stay open quite late to make it easier to shop after the night out. A group of younger guys would probably be perfectly happy at this hotel. I think most others would be satisfied enough even with the few problems. How often are you really in your room anyway? It's Vegas!"
246,372,Oct 19 2007 	Decent but not great	I stayed at this hotel from Oct.15-18. The hotel overall wasn't bad. The casino was a bit small &amp; ranked very low in my book when I compared it to the other casinos on or next to the strip. I would refer this hotel to the 20-35 age male traveling groups &amp; no one else. Its like a Holiday Inn Express with a Hooters restaurant inside.
247,372,"Oct 18 2007 	FUN PLACE!!!!	We stayed five nights at Hooters returning last night,i had to come on here and defend all the horrible reviews i have read.that place is GREAT!!! well that is if u are not prententious or snobby u will have a great time. we had an &quot;ocean view&quot; room which was overlooking the pool. our room was very clean...spacious, cable tv, our beds were made and towels restocked.the ONLY downfall to the whole hotel was the noisy a/c unit and the dim lighting in the bathroom, but who really cares?!?the casino was alot of fun, although kind of dead at times, it was alot more personal and faster service than the other large casinos on the strip.it was right across from MGM, in a safe convienent location. cab rides are 10 bucks to the airport, Palms hotel etc... dont take the monorail it is a waste of time, and take forever to get to the station at MGM, spend the extra money and take cabs! the staff was very nice and the pool was really enjoyable.i layed out everyday, on the weekends the pool bar was open. the pool was pretty warm, with a warterfall and hot tub also.we would watch the people laying out from our window overlooking the pool, lots of ppl seem to stay at the pool until late.the check in and out was very fast. if i do go back to Las Vegas (which i will!!!!) i would stay there again,...it is alot of fun..and i love the orange hooters lighting everywhere!!!! we stayed at the Wynn one night which was beautiful, but i dont like staying in the mega hotels, too many ppl, takes to long to walk anywhere...Hooters is def recommended by me!"
