IDREVIEW,HOTELID,REVIEW
9,1310,"Oct 7 2009 	Cheap But You Get What you Pay For Here!	I have stayed at Travelodges before so I knew what to expect, but this didn't even meet any of them. Arrived earlier than the 3:00pm check-in so wasn't expecting to have a room but was told we couldn't leave our luggage any where unless we paid 10 for early check-in, which we had to do as we weren't likely to return until late at night. When we got to the room it was very bare with no pictures on the walls, the carpets were dirty and the room had a musty smell. The bathroom was no better, the shower was dirty and I didn't need one of those ultra-violet lights to see the dirt on the toilet seat and bowl, as you could see the streaks all over it. We wont be staying here here again!"
10,1310,Oct 1 2009 	Cheap nice location	It was Cheap and in a good location although the hotel itself smelt quite stale. like it hadnt been cleaned in a while or it was cleaned with dirty equiptment.
11,1310,"Sep 29 2009 	Excellent Value!	I have just returned from a 2 night stay in Travelodge Liverpool Street in London. After reading some of the reviews on here, I was a bit nervous about my stay. How wrong I was. From the minute we arrived to the time we left, we had a very enjoyable stay.The staff were great, not intrusive, but helpful when you needed them. Check in took less than 2 minutes, and of course the lift was out of order and we got a room on the top floor! But, the advantage of this is it put me off going for a cigarette once i went to my room!The room was very clean, as was the bathroom. There was a flatscreen t.v , with decent channels too! The bed was very comfortable and although the room got a bit warm at night, you just kck off the duvet and hey presto! you cool down! I think that this is a simple hotel for people looking for a cheap comfortable stay in London. It's pretty central, less than a 10 minute walk to London Bridge, and Liverpool Street Station is a 2 minute walk and you can get anywhere from there!Don't let the cheap price put you off!! This is a great hotel!!"
12,1310,"Sep 18 2009 	ONLY AS A LAST RESORT!	We are used to Travelodge and usually know what to expect - basic but clean, with pleasant staff. Hmm....this Travelodge did not live up to expectations. It was very smelly (damp, dirt, cigarettes), it was quite run down and the staff not very bothered. On our arrival the lift was broken so we were moved to a room on a lower floor which was nice but on heading up the stairs were greeted with dirty linen being thrown down the stairwell be cleaning staff!!! Anyway, the room was ok. Again, quite run down. The area is a bit scary. I wouldn't have wanted to be out alone. It was probably only just worth the 19 we paid for the one night and I would only go back if there was no-where else to stay in London!"
13,1310,"Sep 15 2009 	Not as good as some other London Travelodges	I've stayed in a few London Travelodges - Covent Garden, Marylebone and two near Kings Cross - and this is the one I'm least likely to return to. It's easy enough to get to, but situated in dark, quiet streets just off Petticoat Lane - not the best area to wander around at night. The corridor smelt strongly of damp, there was litter in the lift in the morning, the room was a bit worn looking in places and the bathroom smelt of cigarette smoke. Not all of that is the hotel's fault though, and we only paid 19 for a surprisingly quiet double room which was terrific value."
14,1310,"Sep 10 2009 	Very disappointing!	Have used Travelodge a lot in recent years because you know what to expect - nothing fancy, but clean and comfortable. However, this one failed to live up to expectations. As other reviewers have said, the lift was out of order (and we were on the 5th floor); My husband and I had to share a towel the first night as there had been a problem with the delivery - new towels didn't arrive until the next day; Room very hot - so we had to leave the window open - which meant that we were woken at 5am both mornings by lorries outside the window and the sound of trolleys being loaded/unloaded. I don't think this was from the building works - but maybe it was the towels being delivered! We paid extra for breakfast and evening meal. Whilst there was a good selection (and quantity) of food for breakfast, the 'hot' food was left standing under heat lamps and was lukewarm at best. However, the main problem was with the evening meal. The first evening there was no one around to take our order. My husband went down to reception and eventually someone came up to take the order. We couldn't have what we wanted because the fryer was broken - so we opted for Steak &amp; Ale Pie. Fine - except there were no peas and no alternative veg - so we just had pie &amp; mash. I ordered Banoffee pie for pudding. When it arrived it was frozen solid. I took it back to the kitchen and complained (nicely|) that it had not been defrosted. I was told it was meant to be like that and that was how they were trained to serve it.. and they offered me a knife to cut it with!! The second night the menu was reduced even further to either pizza or curry! I wouldn't have bothered booking the meals had I known - they definitely were not value for money. The final straw was cold water on the last morning of our stay because the boiler had broken.Whilst you could say that the hotel staff can't help it if things break down -and if it was only one thing at a time it would be bearable - it didn't appear that a great deal of effort was going into resolving the issues. As someone else said, maintenance doesn't seem to be high on the list of priorities."
15,1310,"Sep 1 2009 	You get what you pay for!	When I arrived the first day there was a notice up saying the lift was broken. I didnt mind, I was aware from other reviews that it never worked!Woke up second day to see a notice saying that due to an accident there was a shortage of linen and towels for that day, but more would arrive later - and they did.Third day, yet another notice, this time saying that the hot water was broken and would be fixed shortly, if not we would be moved to another hotel - Thankfully it was fixed!Also, when we decided to try the restaurant, they had no food, except for curries!And the rooms were roasting, the window was kept open all week and the quilt was abandoned, using just a sheet instead!But these things didnt bother me or spoil the trip.. I just thought they were hilarrious!The staff were friendly, rooms were clean and food was good. Also, its really close to Liverpool St Station!And that's what matters... Right?"
16,1310,"Aug 25 2009 	An Underated Location; usual Travelodge (sub) standards	Right - I dislike Travelodge as some of you may know but I really couldn't complain about this one for 29 for the night (Sunday). I chose it because it is only a 20 minute night bus from Vauxhall (I was going clubbing) and it is dead close to Liverpool Street Station - on the Central line and just a couple of stops on the West End. It is literally a two minutes walk away from the station in a quiet street.It is also close to the gateway to the East End - Shoreditch, Brick Lane, Hoxton. Shabby chic personified just a stroll away.The hotel is as unpredictable as all the other Travelodges I've been to. The lift was out of order and there were several panes of smashed glass in public areas. In my rooom there was a huge dent where door had slammed open and there was a bedside cabinet missing with only the drill holes to show for it. None of this really bothered me but I'd expect more if I had paid more. That said the room was clean and quiet and had a flat screen telly and there was an occasional mechanical chugging noise but then I always carry ear plugs with me....as some of you may know already ;-)"
17,1310,"Aug 25 2009 	Would not stay again...	This travelodge is in a great location for tube stations and walking distance to most places...but it is situated down a dodgy looking lane from Bishopsgate, it seemed harmless enough after a few days of knowing where we were.The actual hotel itself was a disgrace though. We arrived at 2 am to no one on the reception desk (there never was anyone there unless you pressed the bell, and on one occasion the reception girl was very annoyed that we uncovered the bell, which she'd hid with a sign!) Anyway, we were told that we were on the 5th floor and that the lift was out of order, we asked for another room on a lower floor because I have asthma and was told no. After climbing the stairway, which was smelly and damp with cracked windows, all we wanted to do was sleep. Which we couldn't do because the building had no air conditioning at all and it was boiling. At 7:45 am we were awaken to the sound of the building works right outside our window, which no one had mentioned. This went on for the four days we were there. I tried to close the window for some peace and quiet to get my head together, but there was no handle on the window. When we woke up properly and had a good look around I was horrified. There were stains on the carpet (do not walk in bare feet!) spilt coffee or whatever on the walls, cigarette butts in the window frame, our quilt cover was torn, the lamps on either side of the bed were stained and thick with dust, one of the coffee cups was cracked, the bathroom tap was loose and dirty and every time the toilet was flushed upstairs there was a fowl smell coming from our toilet. There is no hair dryer or iron in any of the rooms, but if you ask for them at reception you will get one IF they are available and you have to give it back straight away due to the small amount they have. So to have a shower and dry my hair I had to run down five flights of stairs and back, get ready then run down five flights of stairs again. I complained about the lift and asked when the engineer would be out to fix it, I was told &quot;it doesn't look likely it'll be any time soon&quot;. On our third day there we came back to our room and no one had been in to empty the bins or give us fresh towels, although we had passed the cleaners earlier that day, who had left piles of dirty laundry lying on the corridor floor. I wasn't running down the stairs to complain, I just wanted to sleep. Not that the reception staff would have helped, they were the most unfriendly people I have ever met. When we were checking out the man on the desk was dealing with someone else and asked if we were checking out, I said yes to which he replied &quot;just leave your key there then&quot; and continued with his conversation. No goodbye or thank you. I know Travelodge is a budget hotel and you pay for what you get, but all I was expecting was a clean and working room and to be treated well. It doesn't cost much for cleanliness and to teach their staff about customer service.I have since emailed Travelodge to complain and explained everything that happened. Their response was that they have sent my complaint to the hotels manager and that he/she will be in touch personally. Will wait and see if I hear anything at all."
18,1310,"Aug 24 2009 	good value for money	Yes this little travelodge is not luxious but what do you expect for the money, however it was very clean and tidy. the staff were very helpful and polite.The breakfast was excellent value..the teenagers paid several visits to the breakfast bar!! It is in a good location foe visiting the city with excellent amnetites nearby..including a post office as part of the building, lots of bars nearby and backs onto Petticoat Lane and 10 minutes walk (if that ) from Old Spitalfields market. Yes there was a little noise from the tube station at Aldgate but you only heard this late at night because everywhere else was so quiet. This is a good base for the city and yes we would stop again."
19,1310,"Aug 14 2009 	A very noisy hotel	We went there to celebrate my daughters birthday, and although the travelodge was very close to the tube station and a tesco, it was very shabby and noisy. Our two rooms backed onto the stairs, and all night we could hear people going up and down the stairs. The rooms were also very hot, and there was very few fans. The windows would only open about 6 inches too. In the morning we were woken up early to hear the sound of lorries and gates. Also the lock on our bathroom door would not lock, and the lift didn't work as well. The hotel was amazing for getting around, but it was just not up to scratch."
20,1310,"Aug 11 2009 	Great location and great value	Stayed at the end of July 2009 for 4 nights in a family room on the 6th floor. The room was clean and spacious. The bathroom was also clean and adequate for our needs. There was building work going on in the surrounding area (which obviously the Travelodge does not have any control over). This started very early in the morning, but did not impact too much on our stay. All the staff were most courteous and we were able to check in promptly at 3pm. Great value for the 19 per night - could not have asked for better value.The hotel is in a great position close to Liverpool St station, but situated off a quiet square. We went to a couple of shows and came back late at night, but there was no problem as the businesses surrounding the hotel had nightwatchmen, so we did not feel vulnerable walking in the dark. There are plenty of food outlets a short (approx 3-5 mins) walk away and a Tesco metro opposite the station. We bought cereal and milk from here to eat in the room for breakfast. I can also recommend the Slug and Lettuce (virtually opposite) for a meal (50% off all food on a Monday night). All in all a good travelodge if you want to be close to all the London sights and very handy for the underground."
21,1310,"Aug 11 2009 	Shabby room high noise levels and lift out of order	Have stayed in Travelodge hotels previously and they have always been clean and tidy and this one although quite clean was very shabby, dirty carpet, pictures missing from wall and missing plaster from wall. It seems maintenance is not a priority in this hotel. There were very high noise levels throughout the night, people coming and going, chains and gates rattling from neighbouring buildings and the underground could be heard and felt even though we were on the top floor. For the 3 days we stayed here the lift was out of order, we did not return much as we had 6 flights of stairs to contend with and couldn't be moved as we had a family room of which there were only 2 available both on the top floor. The only benefit was the location of the hotel which was very close to both Liverpool Street and Aldgate tube stations."
22,1310,"Aug 6 2009 	Average	It took us forever to get checked in for reasons they didn't give us.The hotel is a good location for the underground, if your wanted to get out and about BUT the down side to it is you can hear the underground through the night which kept me up."
23,1310,"Jul 21 2009 	Excellent value hotel	We stayed here for 3 nights in march this year and it was perfect for our needs, clean decent sized room's, friendly staff and only 5 min's away from Liverpool street station for your sightseeing trip's.Overall great value hotel in a decent location."
24,1310,"Jul 11 2009 	Excellant Value and Stay Once Again	Another stay at the Travelodge Liverpool Street. What can I say. Super value, I paid 9 a night for four nights (currently on my 2nd night) and booked an early check in. Got to hotel at Noon, checked in with a very pleasant receptionist and given a nice room on the 5th floor..Very clean and tidy as have all my experiences over the years been at this hotel. Staff friendly and polite at all times. I cant understand why people moan so much about the showers: if you adjust the head the bathroom does not get flooded out...just be sensible. Always plenty of hot water; unlimited tea and coffee if you ask for more at reception. Same with towels; always at least two in the room (plus one spare on shelf in room), howmany does one need?? Whenever I stay in London, usually every 2 months I always stay here if I can get in, the location for both tubes, mainline rail and bus routes is excellant, central but just off the main strip in the city so you generally get a good nights sleep. The hotel cannot be held responsible for the odd drunk in the street..that the same anywhere. If the hotel had air con like the newer lodges in town it would be 100% but you have to remember this is the first and original TL in London, still superb value in my mind, the staff are always very helpful...I always find its the way you speak to people, just remember everyone is human and they all work on the minimum wage..just remember that fact!"
25,1310,"Jul 9 2009 	Purpose built perhaps not the best though.	To start, it was a bit out of the way from the station, not ideal for people on their own arriving late in the evening.On seeing that this hotel was purpose built, I expected it to be a similar quality of the Euston Travelodge, however I was wrong, it wasn't great and was very plain and boring. No art work on any of the walls, very narrow staircases and just simply cold and boring.The room was quite small, more spacious than the Euston one, but not as nice, would have preferred the Euston size for the quality. We saw the bathroom, and I was quite excited that there was a bath, however, it wasn't a bath, it was a 1/2 size bath. I'll draw you an image, me in the bath, torso in the bath, legs up the wall. Not comfortable!!!The service was typical of any Travelodge, so acceptable.. The views were not exciting and the window had a fixed curtain... Overall I found it to be acceptable, but wouldn't stay again. On the plus side the station was quite close, I ran and got a mcdonalds and brought it back for breakfast to eat in the room, it was considerably cheaper than the bowl of cereal they offered in the restaurant!"
26,1310,"Jul 6 2009 	Decent hotel for the price	We stayed at the Travelodge Liverpool Street for 5 nights and overall, found the hotel to be decent. The room was clean, the bed fairly comfortable and it is in a great location to catch the tube. There are several pubs, grocery stores as well as Spittalfield's and Petticoat Market all within walking distance.The staff in general were polite and helpful but 2 we encountered were neither. The shower leaked as there was only a shower curtain to hold in the spray and the shower stall is small and the shower head couldn't be adjusted. The in room wi-fi is a bit pricey (as you can see on their website) but they do have computers in the lobby where you can send off a quick email at 1 pound for 20 mins (apparently this was a special price and it's usually 1 pound for 10 mins). My only real complaint is their booking system which wouldn't allow me to book all nights together and still get their super-saver rate, so I booked our first 3 nights separately and we had to get our key re-programmed every morning. The area was pretty quiet on evenings and weekends but we did get woken up as some guests made their way home around 3 am a few nights."
27,1310,"Jul 6 2009 	Horrendous ! the hotel was hot smelly 	I booked to stay here with a friend as somewhere to use after going to a concert at Wembley. We paid an extra 10 to check into our room 2 hours early (1pm) our room was located on the 4th floor, we look the lift only to discover the button for the 4th floor didn't work so you had to get off at the 5th floor and walk down. When we arrived on the 4th floor the corridor was full of dirty laundry as the cleaners had left piles of dirty bedlinen and towels outside all the rooms!! this is not something you expect to see at 1pm in the afternoon, the smell was horrendous, also the corridor was really hot as the air con wasn't working. The carpets in the corridors are old and tatty and all the walls are marked from peoples bags, it just looked old and tired. When we arrived at our room it was basic which is what you expect for a Travelodge. My friend inspected the bed and when she pulled back the quilt we could see there was no mattress protector on the bed and stains on the mattress, we pulled the bottom sheet off for a closer inspection only to find the mattress was badly stained with the stain going through to the otherside and on the bedframe ! My friend went back to reception to complain. A member of staff came to inspect the bed and finally agreed to move us. Our next room again was on the 4th floor. This time the room was slightly cooler and thankfully the mattress has a mattress protector on, at this point we decided not to look under the mattress protector!! however we notice that the bottom sheet had a nice big hole in it, thankfully this was located on the side of the mattress rather where we would sleep. In the bathroom we discovered we'd only been given one bath towel and one hand towel between the two of us and the shower cubicle was full of mould. We left our room to head off to Wembley, we called the lift to take us to the ground floor. After returning from the concert in the early hours of Saturday morning, we had to swip our room card at the reception entrance to allow us back into the hotel. As soon as you walked through the reception doors the heat hit you ! we decided to get a snack from the machine in reception a packet of crisps where 1.60 !! When we finally got back to our room we discover that one of the bedside lamps didn't have a bulb in it. My friend was the first one to use the shower in the morning by the time she'd finished the bathroom floor was soaked, so by the time I'd had my shower the bathroom floor was more like a swimming pool ! it was just horrendous we had to put the hand towel on the floor to stand on to clean our teeth. When we checked out a we were asked to rate our stay between 1 and 10 we gave it minus 20 to which she was very shocked. We asked what we need to do to give an formal complaint, she wasn't very forthcoming and said we would receive an email following our stay where we could write our review, we insisted she took our numbers and that the manager should call us. I'm still waiting for the call.."
28,1310,"Jun 26 2009 	Unplesant!	Stayed one evening, first time in Travelodge. Person on front desk was helpful and welcoming, my room was on the second floor. The corridoor carpet was badly soiled and smelled terribly of dampness - I was later told this is due to the fact the bathrooms flood regularly! Room clean but basic as expected, took a very quick shower and bathroom floor was very wet. After going out to dinner returned to find place totally without electricity, power cuts apparently also regular, asked for emergency light to help find way to room. Lift also out of order obviously. Electricity restored about half an hour later, staff were helpful. Next morning room very hot, still no lift, bathroom flooded once again, went for breakfast which was nice but no air con and unbearably hot. Had to carry bags down stairs, heat unbearable and trouser bottoms soaked after collecting things from bathroom floor still soaked.All in all a very unpleasant stay - only positives, comfortable bed, nice breakfast and lovely staff."
29,1310,"Jun 21 2009 	A brake in London	Picked this hotel as it was central to Liverpool St Station and going on the reviews I got from Trip Adviser, also they were having a sale. I can only say that we enjoyed our stay there. The room was clean the staff were friendly. I will stay there again even having to pay full price."
30,1310,"Jun 19 2009 	Very good value for a short trip	If you want a great location (5 min walk to Liverpool St Station, where you can take trains, tube and buses) and if you don't mind a good &quot;low-cost&quot; hotel, this can be the one.We were aware we had to bring our own shampoo, bath gel and so on; we knew check-in would be only after 3 pm (but, at the reception, we were kindly informed 2.30 was ok enough); we knew also we had to pay a bit more for breakfast, so we knew what to expect.Breakfast was good (7 ou of 10), all you can eat buffet;The only thing we did not like was the fact they only had 1 set of towels for a double room, so we needed to ask for another set. Considereing pros and cons, i think this hotel is a very good value for a short trip to London, if you travel on a budget."
31,1310,"Jun 14 2009 	Fantastic value 	The location of this travelodge is brilliant, short walk from both Aldgate and Liverpool Street underground. Also literally one street away from Petticoat Lane Market. Room was spacious, clean &amp; tidy, bathroom was also nice and clean, girls just remember there are no hairdryers in the rooms! Breakfast was good value too. Considering we got the rooms on one of Travelodge's 19 a night offer we couldnt fault it."
