IDREVIEW,HOTELID,REVIEW
74,303,"Oct 6 2009 	going downhill	We`ve been to Caesars every year for the last twenty-odd years, so it pains me to write this but....It seems to me, that unless you`re part of a huge group, or willing to pay out for lots of extras, they`re not really interested anymore.For example, if you want to sit by the pool, there are plenty of sunbeds but they`re all behind the double beds and canopied beds that, of course, cost extra. Also, one afternoon, we went down for a swim at around 4.50 pm to be told that all the pools and the whole area was closing at 5pm for a private function.This has happened to us before and I urge you all to complain to the duty manager if it happens to you. We did and received 100 dollars to spend on food and drink as compensation, but it really isn`t good enough. There are 4 pools - why not just close one or two.Yes, the rooms are lovely (we stay in the Augustus Tower) and the location is great, but next year we`ll be looking at alternatives because we`re fed up of being treated as if we`re not important."
75,303,"Oct 4 2009 	Pools and Cabana Not What We Expected	Husband and I went to Caesars Palace for the experience of the new pools at the god of the gardens pool complex. What a joke ! The new pools, which were the only ones in the sun ( and it was very cool in the shade) were closed the whole time we were thereMonday thru Thursday. People were wrapped in towels at the pools in the shade hoping that the sun at some point would be over them.We paid $300.00 for a cabana that did not even have a thin rope to separate it from the public. People were sitting right on top of us. One woman tried to sit on one of our chairs. (because there were no chairs available at the five pool complex) So Disappointed !Thank God for the Spa ! We ended up spending most of our time there."
76,303,"Oct 4 2009 	Again - a wonderful time at Caesars	We were at Caesars from Sept.23 to 30th and stayed in the Palace Tower (room 2344)and had a wonderful time. The first night it was so overbooked that they had to put us in the Roman tower, which from all reviews had me worried. It was actually not a bad room at all - mind you it is smaller and a bit dated but the walls were thick enough that we heard no noise at all. The next day they moved us to the Palace Tower which we requested because it is so close to the swimming pools which makes it the best location for us. We had two bathrooms in our room and the room was large, overlooking the pool area. We had ample towels and no problems at all, other than the housecleaning staff was a bit slow and could be cleaning a bit better, but the bed sheets were clean, and towels where plenty. We asked and received a small fridge for our left overs from our meals, which the next day made great sandwiches for lunch. We also asked for an extra cot which arrived free of charge. Finally the pools are complete and the new cabanas and day beds add a nice look to all the pools. The water was clean and warm - I do agree that the beds are a bit too close to each other, but people do spread out. We ate twice at the Mesa Grill, and once at Bradley Ogden - both are excellent. We also enjoy the food around the pool. One night we went to the Hofbrauhaus for Octoberfest celebrations and had a really fun evening. The keg-meister that evening was Lance Burton and he was very friendly and approachable. The food there was good German down home cooking and their staff was very friendly and helpful with explaining all the dishes. Another evening we ate at the Rio, at their Indian restaurant, and the food was delicious. We left the ordering up to the waiter, and he did a great job of giving us a good cross selection of delectible dishes. If you like sea bass, they did this one dish that I thought was amazing! We went to see Penn &amp; Teller and I don't know if it was an off evening - but I didn't think they were all that good - Penn talked too much and talked very quickly and it was hard to understand him - I could have used less talking and more magic.In the end, everyone at Caesar's was curteous, friendly and professional. We go twice a year and have never had anything but the best - no complaints.They will see me again in April."
77,303,"Oct 4 2009 	Terrible Hotel Rooms and Customer Service	I stayed at Caesars Palace for three nights while attending a business conference. At first, I was assigned a room in the Centurion Tower. The room was clean, but very dated and the mattresses were VERY hard. I would have been better off sleeping on the floor! The room view was terrible and looked straight into the a/c units. This caused it to be very loud at night. I could not sleep at all so very late that night I got dressed and went to the reservation area to see if I could be moved to another room. The employee stated that they did not have any rooms other than suites available. First off, they were incredibly rude and obviously hated their jobs. Second, she said they could upgrade me to a suite for $200 more per night. At this point, I was traveling alone so there was obviously no need for a suite. I just wanted a quiet room with a comfortable bed. I then asked what was available the next night. I was able to upgrade my room for $50 more a night. The room I was upgraded to was nice and the bed was comfortable, but still not worth what they are charging for the room. In addition, I paid $14.99 for 24 hours of internet service that could only be used in my room. When I switched rooms, they tried to tell me that I would have to purchase the internet again. I was persistent and refused to pay for the service again when I still had 12 + hours I already paid for. They did adjust the bill for this issue, but were rather rude in the process. The amenities at this hotel are nice and the business conference area was very nice. Before the conference, my husband and I stayed at Treasure Island and had a very nice experience. In addition, the bill for three nights at Treasure Island was less than half the amount of the hotel bill for Caesars Palace. I hardly ever leave comments about hotels, but my experience at Caesars Palace was awful and I felt it needed to be shared so others do not have to go through a similar experience. The hotel's employees seem to forget that they are working in the hospitality industry. There are too many other options in Vegas and I will not return to Caesars Palace."
78,303,Oct 3 2009 	Nice big rooms	The room we had was with two queen size beds and still the extra space was more than enough to accomodate the five of us in the room. They also had a nice shower head where you can use as a hand held shower head or attach it on a small pole and move it up and down to fit you from head to toe.
79,303,"Oct 2 2009 	Wonderful Visit with beautiful room casino and grounds	Arrived Sept. 23 for a 5 night stay. Check-in and Registration person was great and pleasant. Stayed in an Augustus Tower Room. My room's location had great day and night views!!! of the Bellagio and the Fountain Show, Bally's, Paris' Eiffel Tower and their Balloon/Globe, Planet Hollywood, the newly almost completed City Center, and a distant view of the MGM Grand.My room had a King Bed, brown-velvet sofa with coffee table, a comfortable chair with ottoman, 36&quot; diameter wood table with 2 chairs, desk with chair, 2 LCD TVs (one in room and other in bath), 3 1/2' x 7' gold-framed mirror, 6' Wooden storage base with Refreshment Bar, a 10' x 14' well-appointed marble bath with coffiered ceiling, jetted? soaking tub, separate 3' x 4' glass-enclosed shower, a separate commode are with door, 6' Granite top Vanity with double sinks along with Twin Mirrors with 3 light Sconzes and many towel racks.After getting to my room, I noticed there was not a mini-fridge in the room. Before I called downstairs, the front-desk person who checked me in called my room phone to ask if I liked my room. I said everything was perfect, except I noticed there is no mini-fridge and I like to have one in a room. She immediately had one sent up to my room which was delivered (to my surprise) within 10 minutes after our phone conversation. Now that is what I call Great and Considerate Service!Housekeeping services appeared sufficient; always had fresh towels. However after the first couple of nights I had to leave a note requesting more soap which was a first-time experience as a guest. Housekeeping then left in the bathroom a plastic bag filled with a bunch of soap...LOL...all I wanted was a couple new bars.Pool area was nice, but chaises are too close to one another. Advise you get there about 9:30 a.m. for a spot.This establishment's grounds and facilities are beautifully done and maintained in my opinion. Huge wide-open rotunda in Registration area with center statutes. Convenient front-entrance taxi/shuttle services...no walking to some far and obscure area.I can't comment on Caesars Palace's dining establishments. I dined at my favorites. For you younger folks, there are a number of nightclubs/bars at this establishment...very active especially over the weekend...which seemed monitored by security personnel.Slots are very tight with little or smaller payouts than other casinos within Las Vegas; plentiful table games open.I saw Cher at Caesars Colosseum; great show and costumes though I was a bit surprised it only lasted an hour and fifty minutes. I hoped it would go over two hours long. Otherwise, very well put together and highly recommended. If you get to the Palazzo/Venetian, see Jersey Boys (based on Franki Vali and the Four Seasons) if you haven't yet seen it. The show is based on their life story and includes all their songs. However, see this show when Rick Faugno is performing (Friday's and Saturday's) as Franki Vali because his voice is much more spectacular (his vocals stand out more) than the other performer's voice.I really enjoyed my vacation stay here at Caesars Palace. The only negative I have is that I seemed to have better players luck at other establishments and very little or none at Caesars; maybe this experience here I was unlucky. Just seemed rather wierd. That's Vegas for you."
80,303,"Oct 2 2009 	Great Location but easiy not the best anymore!	Great Location on the strip,but I agree with a previous reviewer,you get what you pay for,it was somewhere to put your head,and lets face it you dont go to Las Vegas to sit in your room! and we stayed here mainly as we were seeing Bette Midler at the colosseum.The rooms arereasonably clean with okay service.nothing to shout about if you have stayed with other hotel brands around the world in my opinion it is very average and needs a lot of updating.Food prices are the usual rip off although it is possible to eat for a reasonable price if you look around.Las Vegas is great though for a few days though"
81,303,"Oct 1 2009 	An amazing hotel at the heart of Las Vegas!	We stayed in Caesar's Palace for two nights of our seven night trip and it was probably our favourite hotel. It is just as you imagine - great service in a very grand environment. The staff were all very friendly and helpful; the bathrooms were enormous with huge baths and seperate showers; the casino is massive and there are many events to see (we recommend Cher even as non fans she was amazing!).The Forum shops are part of the hotel and there are loads to choose from.There is loads to do at night including the shows, clubs, bars and the casinos.We highly recommend this hotel."
82,303,"Oct 1 2009 	Very big place	Stayed 3 nights for a family wedding and being late June it was very hot outside but nice and cool in the hotel.Have nothing but praise for our room in the Palace Tower but housekeeping were very slow in cleaning room service food trays and glasses from the corridor floors.The hotel is enormous and it takes an age to walk from reception to the Palace Tower. Both checking in and out were relatively quick operations. Had the breakfast buffet which is not cheap but good but did not eat in any of the other restaurants as we were too busy sightseeing outside of the hotel.The shopping mall was very big but quite expensive, really interesting decor on the ceiling/roof with some interesting moving statue shows. Ample free car paking in the hotel. Not impressed by the swimming pools - they are over detailed and intricate and the sun beds are jammed tight together, we prefer more natural free form swimming pools.Overall a good place although if we go again would like to try the Bellagio."
83,303,"Sep 30 2009 	What a brilliant holiday!!!!	I have just returned from a long weekend in Vegas with my husband and friends. It was a fantastic trip and could be rated as one of my best holidays! We stayed in Caesars Palace and after reading the reviews on here I was very worried as to what to expect. There were several reviews saying how grubby and run down it was????Not our experience - on arrival I asked for a complimentary upgrade and they said one had already been applied. The room was lovely, clean, modern and although our view was of the back of the hotel, it was still a view. We stayed in the palace tower and paid about 350 for 3 nights through a travel agents. The hotel has a really nice vibe, people are very friendly and it went on for miles! Being a bit of a self proclaimed snob, I found that being one of the pricier hotels attracted better clientel. After looking round the other hotels, I would suggest Caesars, The Venetian and The Bellagio. Drinks are really expensive at about $9 each, so make sure you make the best of free drinks when gambling.Places to visit - Caesars Palace - The cheesecake factory. Either eat a main or dessert, nnot sure you will manage both!The Venetian - The Gondola rides. Very expensive and short but worth a look at the indoor canals, beautiful!The Mirage - All you can eat champagne breakfast. Not posh but fab food and we didn't need to eat until 11pm that night! The exploding volcano, outside and explodes every hour from 8-12.The Parisian - Mon Ami Gabi. The best breakfast I have ever had, great service and bottomless drinks. I had the chocolate and bacon waffle which stunned me into silence, a real must-try.The MGM - Free lion attraction, great for kids and big kids alike. KA the show, pretty expensive but mind blowing and had us gasping for breath at the stunts.The Stratasphere - The rides at the top are great, do them in the dark for best effect. We also had dinner at the 'Top of the World ' restaurant. Great views, good service but really pricey. $300 for 4 of us for just mains and a bottle of wine. Try it as a treat if you dont go on a helicopter.The Bellagio - The fountain goes off through the day, but come alive at night! They go off every 15 mins and are fabulous, another freebie! The dress code in here was a bit more upmarket and most girls were in dresses.One last top tip - the taxi from the airport to caesars cost us $30 on the way to the hotel and $11 on our trip back.... done over as usual for being a tourist. Ask for the direct route and say that you have been before so they dont con you.p.s. everyone wants a tip and some will ask you for one. Dont be a woss and pay a taxi driver if he doesnt do a good job, we had one who wouldn't accept our payment until we added a tip - tell them where to go, you wont see them again!All in all, we would go back tomorrow. Fantastic!!!"
84,303,"Sep 30 2009 	Disappointing	The reception process was a brutal and bruising experience. We were not given the room that had been reserved on our behalf by our UK tour operator. The room that we were given was 633 in the Palace Tower, not the expected room in the Forum Tower. The furniture in 633 wasbattered and bruised, the paintwork was covered in a thick layer of dust. One of the wardrobe doors was hanging off. The coridor immediately outside our room was variously strewn with dirty plates empty beer bottles, and for a long time there was a &quot;Commode&quot; was left in the corridor. To get to the Palace Tower elevators outside the Palace Pool area, we constantly had to fight our through large groups of drunken men, intimidating guests going for the elevators. The House standards were disgraceful. This Hotel is so grossly overpriced for the service for the level of service displayed it is insulting to any visiting tourist.NEVER AGAIN"
85,303,"Sep 30 2009 	SHOCKED 	Booked for 7 nights the room we booked was totaly unexceptable, shower blocked then all this black junck coming up through the drains! no backs on the the draws so clothes just fell through to the next draw, the entrance door was not fitted well with a 2 inch gap at one end.We were then upgraded to a great room with extra cost incured by US.Upgrade was great untill we tried to sleep. The suite next door was party central for a least 4 of the 7 night stay with the music not loud but blaring.After the last complaint to reception the extra cost for the upgrade was wavered.At no time were we contacted by any staff member in any position to see if the situation could be resolved (The duty manger was even invited up to our room by us to wittnes the party going on next door, that was a no show.) At last checking out, the receptionist was not aware of the room waver and put it on our account after she was informed by me of the waver, she then had to contact whoever to sort this problem out WHAT A MESS. At no time were we asked by any staff member at Ceasers about our VERY VERY unsatifactory stay, o'h i lie a female valet attendant did ask us about our stay when she retrived our car.This was our third visit to vegas, and we did splash out to stay at Ceasers. &quot;NOT HAPPY JAN&quot;"
86,303,"Sep 29 2009 	Best Hotel anywhere	This hotel has everything you could possibly ask for. It's an amazing place and won't let you down. No pictures, movies or internet sites will do this hotel justice. Seeing is believing and it is a must for everyone. The location is perfect, the staff are brilliant, the casino is exceptional and the clubs are fantastic. I was blown over and still reeling now I'm home. If I'm lucky enough to get back to Vegas I will stay here."
87,303,Sep 28 2009 	You get what you pay for!	Staff was better than most. Room was great. Food was way expensive!!! $25.00 minimum table games?? Nice place to stay. Eat and gamble somewhere else!
88,303,"Sep 28 2009 	Horrible Customer Service...Will not reimburse unauthorized purchase	I returned from Caesar's palace and found that $75 was charged to my Visa from the snack bar snackus maximus even though I did not make any purchases there and wasn't even in Las Vegas the day these were charged to my Visa. I was extremely disappointed when I contacted Harrah's my only two options for filing a complaint were through email or via a voicemail. I have contacted them numerous times without a response. I will never again stay at a Harrah's property. I am lucky I was only $75 was stolen from my credit card. By the time I noticed it on my Visa it was two late to launch an investigation. If this is how they treat customers, imagine if how they will treat you if a more serious problem occurs."
89,303,"Sep 28 2009 	Not Safe Stay Away	Do no stay here, thats my advice. Its not a safe hotel. While asleep someone entered my room with a Hotel key and robbed me. The Hotel claim its not their fault, despite the fact a Hotel key was used. I had my key so the only answer is the Hotel the allowed someone gain access to my room. I have received no compensation in any form from the Hotel. The hotel claim I should have used the safe, but who uses a safe at night to put your wallet , purse and watches away while in the room? I was lucky I was asleep during the robbery if I woke up anything could have happened to me. If you stay here you may not be as lucky. Do not stay here"
90,303,"Sep 28 2009 	Great hotel fantastic location pity about the service	If you're staying in Vegas then Caesar's is probably in one of the best locations, roughly in the middle of the strip. While there is a bus service that stops at all of the casino's on the strip its often quicker to walk, which made Caesar's a winner in that regard.The rooms were well kept, even had a little TV in the bathroom! Very spacious and a massive bed. The pool was amazing, with a true Roman feel and plenty of places to just relax and unwind. The hotel itself is very grand and the internal architecture is quite impressive.However, you should forget about using the internet to check your emails etc unless you're happy to fork out $0.50/min.Unfortunately we found the service at Caesar's to be almost non-existant. If you want to speak to the concierge expect to wait on average 20 minutes, and in all instances but once they were far from helpful. How a hotel the size of Caesar's can only have 1 concierge is beyond me!After our room key malfuntioned it took approx 40mins to eventually get into the room after waiting at the front desk and then waiting for security - a process that would take most hotels no more than 10 mins...."
91,303,"Sep 26 2009 	Great pool but hotel is old and it's obvious--not the best in vegas!	My boyfriend and I stayed at Caesar's Palace while in town for my cousin's wedding. We were very excited to stay here, especially since the movie &quot;The Hangover&quot; and had just come out. Needless to say, the movie makes the hotel look a hell of a lot nicer than it is. Don't get me wrong, the lobby is pristine, the pool is immaculate and the forum shops are of course amazing. We spent almost every night dining at some of the fantastic restaurants in the forum shops, like Il Mulino, Boa Steakhouse, Sushi Roku and Spago. If not for the forum shops we would have been very disappointed.Our room was old and not kept well. It was a standard suite, and had a great view of the pool, but the bed was uncomfortable and had an old pink comforter like a motel. The bathroom was all marble and beautiful, except for one major problem---there was no door!!! Thankfully my boyfriend and I have been together long enough for this not to be a deal-breaker, but we were still uncomfortable with using the facilities with the other person in the same room and no door. Also, one afternoon water started pouring out of the ceiling vent above our toilet. We called down immediately and maintainence told us that it was from the room upstairs' tub overflowing. Obviously there was nothing they could have done to prevent this, but it still left a bad taste in our mouths. The spa there was amazing. It had several roman baths and jacuzzi's, and even had an arctic room which is set at 55 degrees and has fake snow! It was incredibly beautiful and relaxing.We were expecting a lot more from Caesar's Palace and unfortunately our expectations weren't met. The first night we arrived there was a group of housekeeping carts being stored on our floor right by our room. We called down to let them know and they said they would move them. The same thing happened the second night, only the carts were never moved. This happened every night of our 5 night stay and we complained several times. The casino was old and dreary. All of the dealers looked as if they had one foot in the grave (or wished they did) and the whole set up was very cheesy. The forum shops casino, however, was beautiful. The regular caesar's casino had very low ceilings and not a lot of things to do.The location of Caesar's was great--it's right in the middle of everything. But for the location, the Bellagio right next door was ten times as nice. My dad and his girlfriend were staying there and we wanted to be there all the time. The casino was beautiful and huge, the restaurants were yummy and trendy and it even had a better nightlife than Caesar's.We also visited the famous club Pure at Caesar's but it was not much to look at. It was extremely crowded and filled with really pretentious people. We are from Boca Raton, FL which is arguably one of the snobbiest places in the country, so we are definitely familiar with this crowd, but still had a hard time stomaching the one in Pure. Wouldn't recommend it but it was great for the awesome $90/night rate that we got. If you want luxury, stay at the Bellagio, Wynn, or even the new Palazzo."
