IDREVIEW,HOTELID,REVIEW
34,993,"Jun 21 2007 	Bad experience	My husband and I reserved a room for 7 nights at the Hotel New England in London after reading very favorable on-line reviews of this hotel. We liked the location, near Victoria Station, and the fact that the hotel was non smoking. We anticipated a small, attractive and clean hotel, with buffet breakfast. We found the hotel quite attractive on the outside but cramped and dirty on the inside. The carpets were in terrible shape, dirty and worn and stained, the beds were mediocre, the bedspreads were stained, and there was not a buffet breakfast, only toast and a choice of a fried egg with bacon or cornflakes, served in a small basement breakfast room. The cost was 89 pounds on a weekend night and 95 pounds during the week. The unpleasantness of the hotel negatively affected our impression of London, so after two days we decided to change hotels. We advised the hotel that we would be checking out the next day. The hotel penalized us for insufficient notice and charged us for one night that we did not stay in the hotel. I would not recommend this hotel."
35,993,"Jun 16 2007 	Nice London Hotel Good Price!	After reading the reviews on Trip Advisor, I felt like I had a pretty good handle on what to expect at the New England Hotel, and it was all very accurate. The staff is very friendly and helpful, especially Angie. She helped us decide what to do our first night there, recommending Picadilly Circus/Leicester Square to us, and it was good advice! We had a great time.The room was a little on the small size, but expected with a London hotel, especially in this price range. Four of us (two couples) stayed for 4 nights in a family room with 2 double beds for ?140 per night. It was a little bit of a squeeze, but very manageable. The hotel is very clean and the staff is very willing to give you fresh towels and things when you ask for them. Our window opened and we had a fan we could use, although the weather was a little on the cooler side and we didn't need it. The breakfast was just what we needed to get going in the morning- nothing heavy, but simple and delicious. We had our choice of cornflakes and toast or bacon, eggs and toast with juice and tea or coffee. As everyone has said, the location is fantasic. There are quite a few restaurants, shops and grocery stores nearby, and the Victoria train/tube station is only a 5-10 minute walk. We used the tube quite a bit with our Travelcards (highly recommended, by the way- the Travelcard- if you are spending any time in London at all) from Victoria, and it was the perfect location to be in. Overall, we were all very satisfied with our stay here. We felt safe at all times and enjoyed this hotel as our London base."
36,993,"Jun 15 2007 	Excellent stay	I needed to book a family room for my sister, my elderly dad and my young daughter. Booking a reservation through email was very easy andthe replies to all my queries were very efficiently dealt with. The hotel is security wise, not a problem. The entrance door is controlled from the reception counter and the hotel is monitored using CCTV. The room door used an electronic lock and the door is very secure. The room though simply furnished was in good order. The housekeeping was no problem at all. The staff, Jay and his sister Anjie are excellent. I found them very helpful and warm. They have been in the business for a long time and their advice always useful.The location of the hotel is very convenient; near the Victoria Underground and the Victoria Coach Station. Due to the location, travelling around Central London was not a problem for a first timer like me. I had no difficulties catching a cab near the hotel or directing them to the hotel. Coming from a very safe Singapore, I did not at any time feel unsafe in the surroundings of the hotel. There were many eateries nearby. I also did not have any difficulty obtaining groceries and other miscellaneous items from the nearby shops.Given that the hotel was suitable for an elderly man and a young girl of 5, I am sure families will not have a problem if they chose a room at New England."
37,993,"Apr 26 2007 	A fine establishment!	Everything was very nice at the New England Hotel. We heartily recommend the hotel to anyone who asks. Nice, clean, well kept, secure rooms at a reasonable London price. The elevator is a great plus, for those of us getting on in years multiple flights of stairs can be painful! Jay and Anjie are friendly helpful hosts.We really liked the location as well, and we so enjoyed the dinners we had just a couple of blocks down the street. The New Jomuna Indian restaurant and the Cyprus Turkish restaurant were very good and so convenient. Great memories."
38,993,"Apr 12 2007	Smiley faces make you feel like home:)	You want to stay in the center of London, but you want the hotel to be located in the safe and calm place? You want to get a delicious breakfast in the morning? You want a supermarket to be located nearby the hotel? You are not ready to walk more than 10 min to get the bus, coach or train? And the most important, every time you come back from the long walk you want to see the sincere smiley face making you feel so welcomed and long-expected? It means New England Hotel is really your place to stay in London:)"
39,993,"Dec 1 2006	Pleasant welcome clean warm and pretty breakfast room.	I recommend this little hotel, just 5mins walking distance to Victoria Coach and Train stn. Perfect for business trips - the hotel is clean (sounds obvious but...), warm, safe and practical. Family run B&amp;B hotel, where owners are polite and welcoming. Oh! And reasonably priced!H,Nov.06."
40,993,"Nov 23 2006 	Repeat customer.	As an mature female traveller who sometime needs &quot;affordable&quot; accomodation in central London between ventures I find this hotel meets all my needs. The location is good and safe even very early in the morning and late at night. The &quot;complimentary&quot; light breakfast offers a good start to the day. Dead easy walk to Victoria trains, tube and coach station. Many quaint little cafes and shops and even market stalls in surrounding streets. And of course not forgetting a large Sainsbury&quot;s just around the corner. There is also another smaller Sainsburys within Victoria Station complex. Remember we are talking central London, so even if the rooms are small the price is good for what you are getting and where else would you get a free breakfast thrown in for goodness sake."
41,993,"Nov 7 2006	A clean place to sleep	The hotel is a ten minutes walk from the underground and buses at Victoria Station. We had two rooms (one twin and one tripple) that were small but clean. The beds were comfortable but the pillows a little too hard and the blankets didn't look too clean.The breakfast was insufficient but quite okay. We would have liked a buffet, even though it's nice to be served.Since our stay was in November we had no problems with hot summer nights and our room had two mirrors (including the one in the bathroom).Overall we think that the New England Hotel is a good budget (?) alternative if you're looking for a clean place to sleep in the expensive city of London."
42,993,"Sep 30 2006	Great little hotel	Great little hotel for trying to find something affordable in London for the budget traveller. They had a hot breakfast which was okay, and its a good safe location near Victoria station. Rooms were small but nicely decorated and clean. Angie and Jay at the desk were really nice."
43,993,"Sep 29 2006 	Perfect location--Great stay	We just returned from this hotel and had a wonderful stay. It is a ten minute walk to Victoria station, Gatwick express, and Original Tour Bus through a quaint little neighborhood with local pubs and restaurants. The room was typically small and clean. Our day started off with a plentiful breakfast, and the staff, especially Angie was very helpful to us. We will be back again!"
44,993,"Sep 28 2006	Totally overpriced and its not even that expensive!!	We knew this was not going to be the most luxorious of hotels judging from the price and the photos we had seen. But this hotel really is not worth the price!There are other hotels in London that are the same price and are leagues better! If the New England were charging 65 a night I could not complain but I have got to know other hotels in London, in a similar location that are so much better. The plus side were the fluffy white towels, although these are not changed every day...we did ask for more and were provided with them straight away. There are no tea making facilities but again, we asked and the staff were polite, providing us with a kettle and 2 mugs. Carpets felt grubby and our room was tiny, hardly enough room to get around the beds.Breakfasts are really poor, just cornflakes or a cooked breaky which was average, no fruit or anything else. we didnt even bother on the second morning.You will be disappointed, its cheap (ish) but trust me, you'll find better!"
45,993,"Sep 20 2006	Good location; helpful owners/staff	We recently stayed at the New England Hotel for three days. It was our first trip to London. We were given a very pleasant greeting upon arrival and lots of local information and advice. Angela and Jay were always helpful as we departed and came back to our room each day. The room was very small, but I understand that this is common in London. It was clean, the TV worked well, and we had everything we needed. The simple breakfast also provided a good start to the day. The hotel has an excellent electronic key system and a lift to serve the higher floors. We found the location to be great for arrival and departure at Victoria Station, and for exploring London."
46,993,"Sep 5 2006 	Not Good	Great Location, only 10 mins from Victoria. We stayed here in August, and there was no Air Con- Very warm but we had fans supplied. The Bathroom was tiny, with a towel covering some kind of pipes near the floor- disgusting!Place needed a good hoover- very dusty.There was no mirrors at all in the bedroom, so after a shower you had to wait for the mirrors to de-mistfy- not grt when 3 girls are sharing!!Arriving back after a hard days shopping it wasn't great to find a black bag of rubbish ( from all the other bedrooms) in the middle of our room. We also noticed we had got 2 clean towels between the three of us. One of which we had to ask to be changed because it was dirty. When we asked at reception for sufficient towels, we got the reply; &quot; Oh, you want clean towels every morning?'- considering it was August, and we were taking at least 2 showers a day.....!?!?!?!Check out is at 10am- which sucks. Our phone rang at 10.05am- telling us to check out. When we left at 10.20am , the whole family- (Granny, Granddad, etc!!!) was standing outside our room- staring at us, big time.Would not recommend this place, nor would I ever stay here again!!R.S.D. - Ireland"
47,993,"Aug 30 2006 	Jay and Anjie Extraordinaire	Jay and Anjie were so helpful while we were in London staying in this family owned B&amp;B. We stayed here a week and they were always polite and helpful with travel advice, money exchange, and directions. The rooms were comfortable and clean. Location was great and close to grocery, Victoria Station and Coach station. Only wish breakfast was earlier as we started our day before it was served at 8:00-9:00. Would recommend to anyone staying in London and will return next visit."
48,993,Aug 2 2006	Convenient London Location	The New England Hotel is family owned and opperated. Located near Victoria Station it is convenient to shops and pubs. Our room was en suite and while it was very small it was clean. The breakfast was good and the staff were most accommodating. Jay and his family have owned the New England for 25 years and their pride showes in their care and service. The only points of concern are the noise and there is no air conditioning. (We visited in July and it was hot.) Bring ear plugs and hope for mild temps.
49,993,"Jul 24 2006	Central to Everything	Within walking distance of most of the major attractions. Victoria Station with its central line and District line offer direct access to those you cant walk to.The staff is friendly and helpful. The beds and bath are very clean.The only drawback (its a tradeoff for the great location) is the traffic noise from the street  its a very busy area. If you are used to street noise a first floor room will be fine, if you prefer a bit more quiet ask for a room higher up or on the Warwick Way side."
50,993,"Jun 20 2006	A Pleasant Stay	On our way home from Madeira, we stayed three nights in February at the New England Hotel. We chose it because the prices were reasonable and it was close to Victoria Station and the Gatwick Express. We were glad we did. We especially enjoyed the good service and friendly staff. We will make it a point to stay there again when we are in London."
51,993,Jun 16 2006	one night visit	I stayed at the New England Hotel with my teenage daughter for a theatre trip visit.We were very pleased with the room. It was very pleasantly decorated and clean and the beds were comfortable. The reception staff were most helpful.
52,993,Jun 12 2006	My London Home	The New England is a first class hotel with friendly and helful staff. The rooms are superbly clean and the food excelent. After three visits I never stay anywhere else when in London. Keep up the good work all at my London Home.
53,993,"Jun 9 2006 	Very nice hotel in superb location	For the last two months I have been staying in New England 3 times and enjoyed it very much. The location is superb, full of shopping centres, nice pubs, restauramts and cafes. Tube/coach/railway stations are in 5 minutes walk from the hotel. The staff is very helpful, flexible, friendly and open to the guests' feedback to make their staying more enjoyable. The hotel is cosy, clean and has sort of domestic environment. Very first time I stayed in New England I made a comment that it would be great to provide iron to the guests. Next time I arrived, Jay, Hotel Manger, took care of this and I was very pleased to find a new iron in my room. Third time the iron was provided in a 'it-goes-without-saying' way. In my opinion, this hotel is perfect for singles, tourists and travelling couples. Not sure if it would be that good if you are travelling with little kids. To the management team I would recommend to provide a bigger selection of food for breakfast, for example, to add vegetables to traditional English Breakfast or more pastry/yougurts for Continental Breakfast. Overall, I am personally planning to stay in this hotel in future and highly recommend this to other people travelling in London.PS Please bring your own shower supplies."
54,993,"Jun 8 2006	Looking for a great place to stay in London?!	June 8, 2006My wife and I have just returned from a 16 day stay at the New England Hotel, located at 20 Saint George's Drive, Victoria, London SW1V 4BN. The Location of this hotel is within easy walking distance of Victoria Station, espcially for travellers using Gatwick airport as our point of entry.Added to this, the room was priced well within our budget which included breakfast, and ensuite facilities, and very comfortable. The owners, Jay and Family were warm, welcoming and helpful. The establishment was clean, safe and secure. This is a facility that I will stay at again, whenever my travel plans include London as a point of destination. I have recommended this Hotel to several of my fellow employee at my office since my return. One of them is planning to visit London with his family this summer 2006. Date of my arrival: Wednesday May 17, 2006Date of my Departure: Friday June 2, 2006 This might not be &quot;The Ritz&quot;, but you get value for your money!"
55,993,"Jun 8 2006	great place to stay	We couldn't ask for a more friendly place. the front desk was great,and the behind the scenes staff made it feelmore like a home than a hotel.Loved it and would come back without a second thought"
56,993,"Jun 7 2006	Our Whole Family Loved It!	Our family, including my mother, brother, husband, and teenage daughters, all agree that we will be staying at the New England Hotel the next time we get to London. The staff is great. They made us feel like family while we were there. The rooms are clean and the location is very convenient. We even enjoyed making the reservations!"
57,993,"Jun 7 2006	Friendly Staff / Good Accommodation 	Overall, our stay has been very enjoyable. The staff was always gracious and helpful. Besides the dated furnishings, the hotel is very clean and efficient."
58,993,"Jun 6 2006	Ideal for our needs clean and friendly staff	We were in London to do and see as much as possible in a few days.The New England Hotel, being within walking distance of Victoria Station, was an excellent base.The hotel offered basic breakfast and accommodation, and it was very clean and tidy and the staff very friendly and helpful."
59,993,Jun 6 2006	Treated us like family	My family and I stayed here for the better part of a week and had a wonderful experience. We were warmly greeted and made to feel at home every time the staff saw us. The location is perfect for seeing the sights of London. We look forward to another visit.
60,993,"Jun 6 2006	Nice Hotel and staff	My wife and I stayed at the New England on a weekend. We thought the room was comfortable and the staff was very nice. They were certainly trying hard to please. The hotel is fairly close to Victoria station and buses which made it convenient. The morning breakfast was good, as well. It is only from 8 to 9 though so there isn't much room for fooling around. Thanks to Divina and Jay."
61,993,"Jun 6 2006	excellent hotel	we came from scotland to stay in london to celabrate my husbands brithday and take in a show. the hotel and its staff only added to our enjoyment and made it an enjoyable weekendi found the hotel to be very acessable, you could acess all areas of london from this locationthe staff were very friendly and went out of their way to help you it was easter weekend when we stayed and even though the hotel was busy you felt that due to the service you recieved you were the only guest there.Breakfast was excellent and well presented  i would certainly stay there again without hestiation when ever i am back in london"
62,993,"Jun 6 2006	Good Hotel	Very nice and helpful people inside, rooms are small but clean and welcoming, also it is in a very convenient location to start visiting London, highly recommended"
63,993,"Jun 5 2006	Great Location	Very nice hotel in a convenient location. The proprietor was very friendly and helpful.Rooms were small, but clean and comfortable. Good security."
64,993,"Jun 5 2006 	highly regarded	Overall rating above averageDefinitely exceptional in response level to all requirements/requests.Pleasantly surprised at the hotel's size; very clean, friendly and helpful staffOverall reviewPleasantly surprised after receiving such a poor recpetion at Hanover Hotel where I refused to stay on Health &amp; Safety grounds as floor had collapsed and contractors were still working on repairs yet they were still accepting bookings!St george's Drive is a very convenient location within walking distance of the Victoria Station, usefully placed to get to lots of places for work and leisure yet quiet at night.Service above level expected in a small establishment. Caring and responsive attitude to guests.Room - very pleasant. Bathroom well equipped. shower worked well. Water hot. Hair dryer to hand. Couldnt find tea/coffee things which would have been useful.Value - as a single guest prices don't compare with value.Cleanliness - very good in every wayBreakfast - requests dealt with cheerfullyRatings Room Above average; Service Above average; Value average; Cleanliness above average; Dining above average"
65,993,Jun 4 2006	Pleasant Place New England Hotel	Our stay at the New England Hotel was a very pleasant experience. Both the location and price point for London were good. The hotel staff was very helpful with any questions and requests we asked of them. The rooms were neat and clean and it was nice to have the elevator at the end of a long day of walking to see all the sights. We would recommend a stay with this hotel.
66,993,"Jun 3 2006	Very friendly and welcoming	I stayed in the New England Hotel for the second time. The staff is extremely friendly and helpful. The rooms are clean, but sometimes a bit small. Anyway, good value for money."
67,993,"Jun 3 2006	Location Locatin Location	This is an excellent choice for a budget category hotel especially if flying into Gatwick. No tube travel is necessary to arrive at the hotel, which is a big deal if you have to juggle luggage and crowded tube conditions. The hotel room and bath are very very clean, and the beds were really comfortable.You can set up tours from the front desk upon arrival, the process was very easy, and the tour was excellent. As a first time visitor to London, I felt very comfortable in the surrounding area. You are very near underground, train , and bus connections. Many major sites are within 2 tube stops or a brief walk."
68,993,"Jun 2 2006	A fabulous and welcoming hotel	I stayed at the Hotel for four days and the experience was wonderful. The aspects that impressed me most were how quiet the rooms were (and we had a room facing the busy street yet slept soundly due to the lack of noise), how convenient the elevator is for those of us who have heavy bags, how modern the shower was (hot water always available and the water pressure was strong as well), and best of all, the comfortable beds (the mattresses were as comfortable as ours at home). Not to mention the friendly and helpful staff who run this hotel as a warm, inviting, family business. I highly recommend this hotel to those who are planning a stay in London. The location is so convenient (one morning I was able to walk to Buckingham Palace down to Big Ben and Parliament and back; not to mention that Victoria coach station and the underground are just a few blocks away) and the facilities are quite up-to-date. While the rooms are not vastly spacious, ours was more than enough for two of us with four large pieces of luggage. As well, the room was very clean, the towels very large, and the atmosphere was very nice. I will not hesitate to stay at the New England again."
69,993,"Jun 2 2006	a grat hotel	this is a good hotel,it's very clean and confortable. if i return in london i woul like to stay in thi hotel again. the staff is friendly"
70,993,"Jun 1 2006	A Very Good Find	Besides the cleanliness, location and value, the staff makes or breaks a hotel. The New England was just right for us. Jay &amp; his staff made us feel welcome from the start.The rooms are neat and clean, small but typical of London size rooms.The elevator is great, especially after a busy day of touring. Excellent location, near lots of sights and Victoria Station. Breakfast is simple but adequate. Many places to shop and eat nearby. We booked on-line from the US, very easy to do business with the New England, would repeat if coming back."
71,993,"Jun 1 2006	Looking for a good value?	We found the New England to be a good value for a modestly priced hotel in London. Within walking distance of Victoria Station, it issituated in a nice, quiet neighborhood; cabs were also extremely accessible. Just down the street, we found a nice little family restauraunt where we ate several times and also a corner store for junk food.The staff was friendly and most accomodating. The rooms are not spacious but the beds were comfortable. If you want a clean, affordable place to stay and can accept function over fancy, the New England is a great value."
72,993,"Jun 1 2006	Very nice hotel very hospitable service	Very quiet, easy to access and attentive service. Nice hotel, very basic, clean and well tended. I would come to this hotel again - Good for a long stay!Personal service beyond my expectation, very convenient to all of London's sites and city events."
73,993,"Jun 1 2006	Terrific Location 	Excellent Location  close to tubes, good surrounding areas, can easily walk to many tourist attractions. There are very good restaurants + pubs closeby. Owners and staff are friendly + helpful. Rooms are clean, bright and well tended, but small. The breakfast is okay but not much variety if you stay for a week. Could have a few more selections. Overall for location, price quality and service I would recommend it, and would come back again. And I have personally recommended it to my friends as well."
74,993,"Jun 1 2006	A great location to start visiting London	I chose this hotel for the location (Victoria, London) and for the good rewies read on this site. I stayed with my parents 4 nights in room 38: a nice and clean room with 3 single bed and a bathroom.First of all I have to say that the elevator is big enough for 3 person with a suitcase though what I read in other rewies.The roads around the hotel are quiet so you can sleep without problems.The breakfast (tea or coffe, juice -orange or apple-, toasts butter marmalade, beacon or cornflakes) was enough for us.The best of this hotel is the attention to the guests. It's a family run hotel and the hospitality is great.From the hotel you can easly reach by feet coach, underground and rail Station, then following the Buckingham Palace Road you arrive in front of Buckingham Palace without paying for transports.Hi from Italy"
