IDREVIEW,HOTELID,REVIEW
114,407,"Jul 31 2009 	A fun hotel and casino with great food options.""	My wife and I stayed at NYNY and I really enjoyed it. I'd previously stayed at MGM Grand and TI (Treasure Island), and NYNY was equal to or better than those two (and I have nothing bad to say about either one!).We came for a wedding of 2 friends, and many of their other friends also stayed at NYNY, and this is how it really shined. It's many restaurants and bars offered us ample meeting places.ESPNZone became our de facto headquarters, and I enjoyed great food and drink at Nine Fine Irishmen. 24 Pour offered a good beer selection 24 hours a day, and the Bar at Times Square was a fun piano bar to hang out at.. Even the pizza we grabbed from a stand on the casino floor was excellent and we enjoyed a great late-night meal at &quot;America&quot;, its 24-hour restaurant. (I highly recommend the Mac &amp; Cheese)The casino staff seemed very friendly, particularly at the sports book, where they took the time to explain to us how the odds worked and to bet against the spread.Our room was attractive but unspectacular, but was comfortable and very clean. We had a view of the roller coaster and worried about noise. It was not an issue for us, though I speculate it may have been noisy for patrons further down our floor.The casino has a very nice fitness center attached to its spa. It's $20/day to use, comparable to or cheaper than the gyms at the other Vegas hotels I've been to. Discounted multi-day passes are available, and I believe it's included if you purchase spa treatments. Selection of fitness/weightlifting equipment was very good and the treadmill I used was nice. Temperature of the fitness center was a bit high for my personal comfort level.NY NY's only real drawback, in my opinion, is its location near far south end of the Strip. If you plan to spend most of your time at NY NY, Excalibur, MGM Grand, Luxor, Monte Carlo, and Mandalay Bay, it's perfect. Be prepared to hike or take cabs or the monorail from MGM if you prefer things in the middle or north end of the strip.Overall, we had a great experience with this hotel and casino, and I would definately consider it for future Vegas trips, especially if going as part of a larger group."
115,407,"Jul 30 2009 	Nice but at a price	Stayed here about 5 nights. Hard to fault it really - it has similar weaknesses to other resorts on the Strip I think.The room was well furnished with quality furniture and a nice comfy yet contemporary theme to it. The bathroom was decorated nicely. Housekeeping did a good job keeping the room clean.I did order room service a few times. The pricing is a little steep (no suprise there) but I guess my complaint would be the portions were too large. I'd have been happier if they charged me less and got less as a result.The two things I really didn't like though:Long queues at reception to either check in or out (although from what I hear this is common at most resorts on the Strip).No self-service laundry on siteNo good coffee to go (Starbucks is not good enough even with double shots of espresso!)The staff at the counter and the porters were professional - some more friendly than others. I regret not giving a bigger tip to the bellhop who helped me, had I known he was the exception. Sorry!"
116,407,"Jul 29 2009 	Loved it!	Stayed at New York New York with a friend and loved it. The rooms are very big. modern and exceptionally clean. Towels, sheets and amenities were all replaced daily. There are plenty of places to eat in the hotel but it's always best to venture out and try other hotels. Location wise, it is toward to south end of the strip but within easy walking distance of everything. The monorail also goes from MGM which is across the road.Can't wait to go back for another trip soon...."
117,407,"Jul 28 2009 	Great theming good room over crowded public areas of hotel	Decided to stay at the New York New York due to the interesting architecture, ambiance of the casino, and theme of the hotel. Further it was a reasonable price for the room (mid-pricing level for the strip). We stayed for 7 nights so I our experience was a bit longer than most. So first the good:Whoever said the walk from the parking deck was long must have been 90 and carrying an oxygen bottle. It was EXACTLY 100 paces from the vestibule of the parking deck (entrance to ENCLOSED walkway is on 3rd floor of parking deck) to the actual hotel and another 30 paces to the escalator which drops you right next to the registration desk. Registration was quick (Friday afternoon, approx. 3PM PST) and effortless. They had all the right information, including the rate and gave us a room on the 20th floor of the Century Tower (closest tower to the registration desk, I might add). Room 2077 was a bit far from the elevators, but they'd asked us what we wanted and I chose to be farther away from the noise of the elevators. And it was QUIET! The room (Park Avenue room) was no better/bigger than you would get at a Courtyard, but we also didn't pay more than you would at a Courtyard. Room was clean, smoke free (requested), appointments were appropriate and comfortable, and maid service was EXCELLENT! Despite not getting enough shampoo towards the end of my stay, they were quick, polite, and very courteous. We called for a 2nd blanket the first day and it was delivered within 10 minutes. I'd say that the &quot;hotel&quot; part of the property is fabulous! As for two restaurants worth mentioning, Greenberg's deli was great for lunch and Scirraco's pizza was awesome (even for a Chicagoan who loves his deep dish!).Dueling Pianos at Times Square was fun! Rollicking good time! I'd suggest paying the extra $$ to get preferred seating if you plan on being there a long time. Now for the bad:The other restaurants are overrated and have very odd hours (can't get a donut at Stadium Snacks until after 11AM??!?!?). Hotdog stand not open late to get a quick dog, nachos, or pretzel. The breakfast buffet at Chin Chin's was very VERY disappointing! Very small selections, no omelet bar, pastries were VERY stale; not a deal at $16 per. Il Fornaio (shop, not restaurant) was okay for something quick (bagel, croissant) but not great. ESPN Zone was terrible. No other way to describe it (if I wanted a microwaved hamburger, I'd have done it myself!). Chin Chin's (dinner) was a glorified (and expensive) Panda Express, and the waiter could have cared less whether we were there or not. America is adequate for breakfast, but pass for all other meals (soup was COLD!).The pool is SMALL!!! I MEAN SMALL!!! DID I MENTION THE POOL IS VERY SMALL???Other than the hottub, no other amenities at the pool except for a volleyball net spanning the middle, making it difficult for anyone to do laps. It's also mostly shaded, not much sun hitting the pool area. Note that they post that no outside food/beverages will be allowed, however I brought (4) small bottles of water in with us and nobody gave me any grief.The casino has nice atmosphere (open, high ceilings so you don't feel claustrophobic) and unique design. Sports TV's over each table is nice touch. Cocktail waitresses come by often when playing at the tables (not so much at the machines). Dealers, however, were quite rude, not caring whether you were there or not. Not fun (Excalibur Blackjack dealer-Jimmy....HE was fun!!!). Didn't tip too often (despite playing Pai Gow for about 6 hours one night).Shopping stinks unless you want Harley gear or cheap Vegas souvineirsOne word sums up the NYNY, however: CROWDED! &quot;Streets&quot;/aisles are too narrow to get around without bumping into EVERYONE! By day 5, couldn't take it anymore. (Why would you put a post for the roller coaster right in the middle of two popular food stands and on the way to the main bathrooms?!!??) Way too many people crowding into that place. Need to figure out some crowd control/traffic control.Overall: Hotel good. Casino: Overcrowded Restaurants: Poor"
118,407,"Jul 28 2009 	Nice Hotel - thin walls	Having stayed here once before, we figured we would do it again. The first time, we had a Park Ave room and this time we got a Broadway Deluxe room which is supposedly nicer than the other. One issue was the bedding. The bed was not as comfy as the one in the Park Ave room nor was the bedding. I just expected more but I guess because we paid a lower rate, we got a non-renovated room. Second issue was that we were about a 5 minute walk from the elevator...but that happens in Vegas sometimes. My biggest issue is the THIN walls. Some people next to us were having some sort of party - from what they were saying it was possibly an orgy. We couldn't believe what we were hearing. Then it got quiet so we went back to sleep. At 3:00 am it started back up and then got quiet again. Third time - 5:00 am - I finally called the desk and they sent someone up. It's not the hotel's fault that this goes on but it seems that the walls shouldn't be so thin as to hear EVERY word someone is saying in another room. I thought we were getting a better room than the Park Ave. We never had that sort of experience in the Park Ave. room so IF we ever stay here again, we will not ask for the B'Way Deluxe. I would probably still recommend the hotel but only in certain areas of the hotel. Other than the room the casino is great - we love it there - and Sirocco's Pizza is fabulous. They have all sorts of little eateries downstairs that won't break the bank and they have the easiest self-park of any other Vegas hotel I've stayed at. Plus they are at the end of the strip so you won't sit through too much traffic to get there."
119,407,"Jul 26 2009 	Hotel in good location on strip with Great Rooms and facilities	We had a whole group of people stay here in April 09. While we did not get rooms near each other and some were on different floors. We soon organised a central meeting place for when we were hanging out together. The rooms are fantastic!! Large, with everything you need. Every room seems to have a different view. We used the Deuce bus a lot for getting down the strip. While it was slow, we found that was sometimes helpful as we got talking with people and they gave us tips on what they liked and did not.Recommend - Sunset helicopter flight over Grand Canyon. Quicky Wedding Ceremony under Las Vegas sign. (was quick and painless)"
120,407,Jul 24 2009 	Fabulous	Fab hotel - must go on the roller coaster.central hotel on the main stripvisit the piano bar inside the hotel.Pay 1 dollar and the guy will play anything you want to listen to( drinks can be expensive but they do great cocktails).The apple bar is a great bar to visit inside the hotel with a live band playing..
121,407,"Jul 24 2009 	new york new york hotel las vegas	Stayed in the hotel for 3 nights and initially disappointed with the quietness down the bottom end of the strip, however, the hotel itself was full of fun loving happy people who were there to have a good time! Four of us travelled to Vegas and stayed in one room, which was big enough for all four girlies to get ready! The American Bar/Diner serves good food and is pretty cheap for beer compared to other places and has a happy hour. The Irish Bar inside was very quiet, expensive and even though most of the tables were empty we were told we couldn't sit down and had to stand at the bar with our drink! Apparently the tables are for diners only!! We went to the Grand Canyon for one night and then came back to Vegas and had 3 nights in the Bellagio, which I must say was in an excellent position in the middle of the strip but it lacked the fun of the New York New York and we all wished that we had stayed there!!!! Vegas is a must do trip but it's all hotel based and can get tedious walking from each of them. The roller coaster ride at the New York New York is expensive both you have to do it."
122,407,"Jul 23 2009 	Mixed Reviews. Casino Atmosphere A+  Rooms Subpar	Stayed at this Hotel twice. Both times they offered from upgrade to Park Avenue room. For some reason I always wound up with SMALLEST room on floor. Due to the shape of the facade on the outside the hotel has a weird shape inside. Also of note is that some rooms have a pink covering over the windows to distort your view. This to make the exterior look nice but not from the inside. Had to change my room twice because of issues. Overcharged my credit card and could not refund my money. Had to wait nearly a week before charge came off. Very small rooms.On the plus side the casino is very nice. Has a nice atmosphere and usally the play is very good. Nice places to eat such as Gonzalez Y Gonzalez and Nine Fine Irishman. You will be HARRASSED by Consolidated Resorts trying to sell you a time share at Tahiti Village. There freebies are bogus and they are relentless. They are all over NYNY, Monte Carlo and Tropicana. DO NOT GET SUCKERED in. I made that unfortunate error on my first visit to Vegas."
123,407,"Jul 22 2009 	Good Hotel	This was my first time at this hotel and I had a pleasant stay. I chose the Park Avenue room which is the level above the regular room. The room was spacious, clean, and the personnel was kind and helpful. It is a good value only if the price is below $100/night because better deal at better hotels are available if the price is above that level."
124,407,Jul 21 2009	worst hotel ever never stay here	Hi I just thought everyone should know never to stay at this hotel. It was the worst service I have ever experienced. We booked 3 rooms total. The first thing that happened was the quote that we booked this hotel at was wrong and it took forever to figure out so the first hour of our trip was spent at the front desk. When we finally got the keys the room that one of us went to was in the basement! All the windows were blacked out and it felt like a prison. So we went back up to trade rooms they gave us another room but when we got there it was dirty! So we went back down and they said that they would clean it but that it would take 2 hours. So we waited 2 hours and when we went back up it was still dirty! They did upgrade the room but we basically wasted a good amount of time dealing with this. The second thing that happened was in our room. We had gone to bed late but were awakened at 8am by drilling and hammering above our room. We tried to sleep through it but it was ridiculous so I called the front desk to ask them to stop because we were sleeping she told us she would take care of it. It stops and then starts again after 5 minutes. They didn't even give us a call to let us know what was happening! Long story short we got compensated one day and moved rooms. This would've been good but when we went down to pay for the rooms they charged us more for the rooms then they quoted like $30 more per day per room because they average the room rates. Also the third room we got did not lock properly and we also passed people in the hall whose room keys did not work and had to go down to front desk to have it fixed.If you want a comfortable relaxing vacation DO NOT STAY HERE!!!
125,407,"Jul 17 2009 	Great Hotel Great Location	I stayed at the New York New York for 3 nights and I was very impressed with the service and the room. We were given an upgrade (even though they 'don't give complimentary upgrades') because one of my friends was celebrating her new singlehood and the room was great. I was not pleased, however, with the lack of a coffee maker in the room. I have never heard of a hotel room without a coffee maker, but I guess the hotel wanted us to shell out $3 for a cup of coffee in the casino food court area. The location was perfect, and the club in the casino (Rok) put us on the list and gave us wrist bands for free drinks until 12:30 because we were celebrating. The hotel and its employees were not pretentious and overall we had a great time. However, the drink service in the casion was awful. We had to wave down a waitress every time, and they only came over to us 1 out of 5 times. One round of drinnks was great, but the second time our gin and tonics were pure tonic and were not worth the $4 tip we gave our waitress."
126,407,"Jul 13 2009	New York was great for us!	My daughter and I spent three nights at New York New York. We had a Park Avenue room on the 31st floor of the Century Tower. Our room was clean and bathroom was spotless. Each day our room was cleaned perfectly...they even arranged the shoes I had left on the floor in a nice row. We could hear the rollercoaster in the distance, but it stopped at midnight. It never bothered us at all. We ate Il Fornaio for breakfast two mornings...once at the restaurant and once at the take out. Both were great experiences. The coffee was strong and delicious. The service was excellent. We found the location to be handy. The Deuce bus stopped very nearby, and we used it quite a bit. We would certainly stay here again."
127,407,"Jul 12 2009 	Will Not stay again	My wife and I stayed there on our first ever trip to Las Vegas. Our room was $114.00 a night for small room and small/UNCLEAN bathroom. The towels were like sand paper. We had to pay a $3.00 a day phone charge for a phone I did not use one time I was there. So, for $114.00 a night we got a room and all there &quot;accomodations&quot;. Accomodations being this, a small pool, only 4 feet deep, just in the middle where there was a Volleyball game going on all the time so you could not get to it. So I had to swim in the 3 feet deep part of the pool. The pool and hot tubs were dirty. There were leaves in all of the hot tubs. The pool is only open from 9a.m. to 7 p.m. in June and July, only open to 7pm. Other accommodations, a work out room that you had to pay $25.00 a day to use or go with out. A casino, I would not call that accommodation. A Roller Coaster that is $14.00 a person for one 3 min ride. $14.00 a day to use the high speed internet in your room or go with out. There are no accommodations at the New York New York. You pay $114 a night for a small dirty room and a small dirty pool. We had drinks at the over priest casino bar, the bar stuff was very rude. They were not the only people of stuff there that were rude. I will never stay there again. There are so many nicer hotels on the strip to stay at in Vegas."
128,407,Jul 9 2009 	Good Hotel In Excellent Location	We stayed here in June 09 and stayed for 4 nights. We were upgraded to a suite as it was our Wedding Anniversary.We found the staff very helpful and the rooms were very good although a little dated when comparing with the newer hotels.Overall we would probably stay here again.
129,407,"Jul 9 2009 	Great hotel prices average accomodations	I can honestly say that this hotel is average. I would mirror the room accomodations as ones that you'd get at a Holiday Inn. The bath towels were like sandpaper; the shower products were cheap, the shower/bathtub needs to be updated (we had water squirting on the ceiling from the head). Check-in consisted of at least 1 person working the desk and at best 3 people...it took longer than your average hotel check-in. We stayed in the Park Avenue Stripview room (and upgrade from the Skyline). Our view was of the roller coaster, Tropicana, and Excalibur. The last time we visited we stayed at the MGM Grand so I think that set the bar pretty high. The tenders at the bar on the floor of the casino were rude; I can't come up with a justification for them being that way...they weren't really busy. Dining this time was like eating at McDonalds versus The Ivy....spend the extra money....when it comes to food cheaper isn't always better. The next time we come we won't stay here; it's not our style."
130,407,Jul 8 2009 	Would Definitely Stay Here Again!	My family and I just returned from a 2 week long road trip vacation to California from Alberta. Our first stop was Pocatello and our next stay was New York New York in Las Vegas. We got a great deal on this hotel and didnt have to pay extra person charges for our daughters which was a real bonus. Our check in was quick and easy and our room was very good. It was quite large in that we could lay out all our stuff and still move around comfortably. Liked the theme and feel of the casino and the look of it especially as we had our daughters (17 and 14) with us. We have no complaints and would definitely stay there again-especially if they continue to waive the extra person fees
131,407,"Jul 7 2009 	Not a hotel I'd stay at again!	Last year we went to the NY NY hotel casino for a week. This was strictly for leisure and fun. The good part about the hotel is the location is on the strip. The bad part is you have a noisy roller coaster going for hours and hours. Let me walk you through our stay... we arrive and ask for a nice room. We are given one but the walls are so thin that I hear the squeaking of the elevator all night. We ask to be moved and I still hear an elevator in another room. Then, I try to upgrade and get a better room hoping the room problem will be solved....nope! The guy at the front desk tells us no need to go look at the room that we will like it. WELL, nice enough he gives us a room RIGHT next to the roller coaster and the lights to light up the hotel are outside our window. So, we spent a bunch of extra money to see a concrete slab and bright lights. I spent the next half hour crying. I've been to Vegas 3 times and this was the worst experience I've ever had. On my other trips I was easily given a wonderful view of the strip at both Treasure Island and Mandalay bay. Also, the room smelled like Eucalyptus or something. I started having major allergy issues that week and after reading another review on here about the carpet stuff they use that caused that person allergy issues, well, I'm not sure I'll ever set foot in that hotel ever again. I laid sick all week in the hotel listening to a roller coaster and people screaming on it. Annoyingly enough, one of the doors that leads to and from the strip have solicitors trying to sell you things. We had a couples massage, but the lady had to lead me in a robe through the workout area, which I didn't care for. Also, there should be a no cell phone policy in the spa. As soon as I started to relax another client walked in and started talking on her cell phone so loud she could have woke the dead. Not my idea of a great stay! In the future I hope that when they tell someone at the front desk that they will like the room....they won't be lying! This was the worst view he could have given us, but we were tired of changing rooms and being unhappy. I try to erase this stay in Vegas from my memory."
132,407,"Jul 7 2009 	good location exciting for young adults good value	Had a pleasant stay, young adults in the family loved the hotel theme and its location. Plenty of food to choose from on site, easy walking to MGM, LUXOR,. Had Booked 2 rooms, requiring one room to have 2 doubles. This was not available at check in, and we were checking in an hour or 2 early and they gave us a free upgrade for this room. It was huge. Good value and location. Pleasant staff at check in. Kayc63"
133,407,"Jul 4 2009 	Very nice would stay again	Our room was very nice with 2 queen beds, plenty of closet and dresser space. The bathroom was clean and roomy. Maid service came in every day and restocked the bathroom, made beds and cleaned. The roller coaster was not overly loud. Check in took a little while because computers were down, check out was smooth, valet wonderful! We stayed for 5 nights and would stay again."
134,407,"Jul 4 2009	Plenty to eat drink and Gamble on but No Poker room	My wife and I, along with my youngest son (24) stayed at NY NY between 17th June - 1st July 2009. We asked if we could have a free upgrade and was told it would cost $15 dollars a day, no joy there then. Asking for a quiet room we got room 603 in the New Yorker Tower. This room was at the back of the hotel, and when I say at the back, I mean at the back. Clean tidy, with a safe but no fridge and views of the Roller Coaster and Car Park. The walk from the Lifts to the room was a seemingly endless slalom through the winding corridor, I read about the Roller Coaster before we booked, people said it was reasonably quiet ... they lied, or were not in or near our room. The Pool area seemed to be in the shade when we wanted to be there, however they have a reciprical agreement with the Monte Carlo and we spent our Pool time there. I wanted to play Poker and could not believe I had booked into a Hotel with no live Poker Room. so once again the benefit was to the Monte Carlo , or across the Skywalk to the MGM Grand. Food was good and varied, didn't gamble much as we found we did that elsewhere after playing Poker. Only for the reasons of no Poker room, and the Roller Coaster I feel I could not wholeheartedly recommend this hotel."
