IDREVIEW,HOTELID,REVIEW
182,1210,"Jan 19 2009 	Great weekend at The Cumberland	Just returned from a lovely weekend at The Cumberland. The hotel is in a great position above Marble Arch tube station and is huge! The reception area is massive and very arty looking.Arrived at 10.30am and presumed it would be too early to check in but thought we'd give it a go. There was no queue so we were served straight away and told that there was a room ready for us. We were given a twin room on the 8th floor which was lovely and spacious, well decorated and with an excellent shower room. The Elemis shower and shampoo products were an added bonus. Plenty of storage and a huge plasma screen tv. The room was cleaned thoroughly and all of the staff we met were polite and friendly. Our rate didn't include breakfast so we didn't try any of the restaurants but there are plenty of places to go on Oxford St and there was a small shop directly opposite the hotel.When we were there we didn't see any of the long queues mentioned by some previous reviewers but maybe this applies more at peak times. our room was lovely and warm so no complaints there either.Overall we had a great weekend and really enjoyed The Cumberland."
183,1210,"Jan 18 2009 	Expected better	This is a tough one - it's a hotel with a great location and lots of good points, but too many negatives to make it worth bothering with again.Front desk is simply awful. We couldn't check in forty minutes before the 2 p.m. quoted time and that's fair enough, but we were warned by Michelle that there was no guarantee we could check in if we waited 'til 2. We said that was ludicrous, why not and she responded by shrugging her shoulders and saying they had 1,000 rooms. Well we'll keep that in mind for our next trip to London thanks.Small room is about usual for London, but no wardrobe isn't. No teletext, poor tv channel choice, no replacement water in the room. Our room was clean and tidy although the bedlinen was torn and needed throwing away. King-size bed. Aircon for hotel was outside our window and seemed to go on all night.Queues for the lift. Sometimes three came before we could get in, so many people were using the lifts at 10:30 on a Sunday morning.Breakfast is full of choice, some decent things to choose from too, but woefully inadequately staffed for a busy weekend - big queues to get in, long wait for waitress-served coffee, dirty crocks not removed from tables, dirty floor - they need more staff!Concierge can't cope with bag-drop so you have to go to a bar and drop it off there. Queues again.Shame really, you have the feeling that this could be a very good hotel with just a bit more effort.It would need to get better for us to stay there again. If it does, we'd go back again but only if...."
184,1210,"Jan 13 2009 	Poor Choice	Just returned yesterday from a 6 night stay with a friend at The Cumberland Hotel. Sadly, many of the complaints written on this sight are true. On the positive side, the location is excellent; the room we had was quiet and cleaned well each day. The concierge service was very good and efficient. On the down side, the check in process took a half hour and the woman at the desk seemed not to know her job. Our room was freezing but a heater was promplty supplied. Within a few hours the heating had been repaired.Upon check out, a request for a receipt indicating our balance was zero was denied as the booking had been made on line. A complaint regarding this made at the client relation desk, situated beside the check in/out counter was immediately rectified. There is definitely a training/management problem with staff at the check in/out desk which leaves an overall negative impression of the hotel."
185,1210,"Jan 13 2009	Good location but rooms terrible .	We'd booked two nights in a &quot;deluxe double&quot;, room was very small and freezing cold, even with the heating on constantly. Room situated right next to the staff lift, so couldn't get any sleep at all for the first night as the lift was in constant use. In the morning asked for a replacement room, told we could upgrade for a charge of 30.00, but we did not want to pay more, just wanted a room that wasn't next to the lift and was warmer. The next room we were given was directly above the airconditioning unit, which meant constant noise and was worse than the lift noise and the room was still freezing cold, with a terrible draft from the window. Asked to change again, this time the man on Reception was a little sarcastic with us, but we did eventually get a better room for the second night. Another problem, there is no staircase for guests to use, the only stairs being behind the Concierge area and although the Staff were very friendly, it was embarressing to have to explain each time where we were going!"
186,1210,"Jan 12 2009 	Upgraded - not 4 star but still nice	Me and my Girlfriend decided we'd have our christmas in January so we could have our own celebration. we thought we'd treat ourselves to nice 4 star Hotel. On arrival it looks lovely, big open spaces, wonderful artwork and fantastic lighting. When checking in i spoke to the gentleman - Edgar on reception - Very helpful and he explained that it is the luck of the draw. sometimes you can get there and there is no que (we were lucky) he said sometimes you come and its queing out the door and if you saw the size of the lobby thats a big Que. Anyway Edgar who was very helpful sorted us out nice and quick and we were into our room, (ask for a smoking room if you want the top floor) when we got to our room it was presented lovely all be it a bit small. I went down to edgar and asked to see a kingsize room. he took me up to veiw it before i purchased and i was very pleased. For a small extra fee we were given a room twice the size and lovely veiw over london. The front desk when i called were very helpful. Although the staff apear to be from all around the world however they speak fair english and do appear to try and help the best they can. The 4 star rating seems a little high. id put it more at the high 3 star perhaps very low 4 star. Location is fantastic, turn left out the hotel and your on Oxford street, walk all of 60 feet from the front door and your at Oxford Circus Station. Me and my girlfriend both did have a fantastic weekend and were happy with our first stay in London"
187,1210,"Jan 11 2009 	Take you thermals	Arrived early on Sat and left our bags with reeception, check in took about 15 mins, even though no queue.Went to our room at 2.15 pm and noticed room was very cold and could not increase the temperature, went to Reception for a heater. Arrived but never switched it on so when we went back to our room at 1.00 am room was freezing.We had to ring down for extra blankets and a duvet arrived 15 mins later.We had drinks in the bar which was also cold and would have been better suited as a freezer. The bar staff had 2 portable heaters which were placed by the pillers in the bar. However when guests asked for the heaters to be turned towards themselves we froze on the other side of the room.Overall the room was OK, beds comfortable but cold room. Staff were polite and helpful.Would not go again and would look for a better experience with another hotel."
188,1210,"Jan 7 2009 	Great Location - Cold Hotel	This hotel apparently had 40k spent per room after the renovation from the previous owner. We visited in Dec and apart from the lobby being frigid both in decor and temperature (the staff had space heaters to keep warm) the hotel was fine.It is very well located (previously being Londoners of 10 years we appreciated this, but don't' expect great service, rooms were rarely made up on time during the day, despite leaving for several hours. Also very few of the help actually understood English, management training issue here."
189,1210,"Jan 2 2009 	The Shoe Box	Booked to stay at The Cumberland over New Year.On arrival at check in the queue was enormous, was told that we were staying in the executive rooms which are across the road in a nother building. Ok sounds good we thought Executive- bigger than average.How wrong could you be, we thought that room 0505 was possibly the cleaners cupboard. The bed was up against the wall which meant that you had a frozen back all night. Plus the heating was broken so they lent us a portable radiator ! Everytime a guest in the next room used the toilet it woke us up as the cistern was too noisy. Did not have one full nights sleep in our 3 night stay.Only one of us at a time could get to the bed as there was not enough room for 2 people to be in the same spot at once. You had to climb over one another to get out of bed !!Great news for 2 women that it had a full length mirror but guess what no lighting near it !! I must say for such a fabulous and grand reception which is totally awesome upon arrival the rooms are a total let down.We are very dissappointed considering the room rates we paid. I have never stayed in such a small , cramped room Ever !!!"
190,1210,"Jan 2 2009 	Christmas treat for boys	Booked 2 rooms a twin for teenage boys and a double for us. Check in very smooth no wait. Arrived early before 12 rooms available boys had large twin we had small double. Both rooms in annex block. Very quiet ideal. Staff friendly and helpful.Breakfast dreadful. Overcrowded, messy had to eat on second morning in a conference room. The hotel cannot cope with the amount of guests.Bar had drinks and sandwiches after a show -expensive but ok.Probably would not stop again usually book one of the Marriott chain."
191,1210,"Dec 18 2008 	very nice Hotel	The hotel is central located, near to all sights, the rooms are a bit small for the price paid, breakfast is tooo expensive - recommend the coffee shop next door"
192,1210,"Dec 16 2008 	Speak clearly to the reception staff :-)	In this hotel's defence, we didn't have any of the problems listed in recent reviews. There was no queue to check it even though it was a Saturday, all lifts were working etc. The only hiccup was on arrival my girlfriend and I only had one set of bath towels in our room. Not exactly the end of the world, so on the way out to dinner we asked the reception staff for another set to be dropped in our room at some point. Done and dusted, or so we thought. After a boozy night out we returned at 4am to find a giant electric heater in our room and no extra towels. At 4am, trust me, this was very funny. Being a gentleman, I gave away our only towel for my girlfriend to use and I sat by the powerful heater to dry off. We got some more towels after our second request to the front desk. A great hotel, good location and entertainingly lucky-dip based solutions from the reception staff :-)"
193,1210,"Dec 15 2008 	Another Bad Review	After reading many bad reviews on this hotel, for some reason i decided to go ahead and book anyway. I WISH I HADN'T. As in most reviews the staff were terrible, didn't have a clue how to speak to guests or know what they were doing. Check in took 45 mins, which had to be resolved by customer complaints staff in the end. as they didnt even have a room that i booked and paided for. the only reson i didnt rate it terrible is due to the complaints department being fantastic. in all avoid this hotel"
194,1210,"Dec 9 2008 	Poor staff!	First of all they made us feel as if we were not welcome, the staff looked like it was their first day on the job and therefore we were waiting by the counter more than an hour to get proper understanding that the room was paid in advance, not just that they were totally ignorant. Hotels.com are poorly managed as well since we booked with free bottle of wine in the room as part of the package but we got nothing, barley our room. The hotel is crowded an noisy. Very bad experience, never go there again-never suggest other people to go there-you too!"
195,1210,"Dec 1 2008 	Seriously dissapointed	Arrived 1.30pm and checked in but no room available. Went out for lunch, came back 4.30, still no room available, and met 15 other people/parties in same situation. Finally got a room about 5p.m. All downstairs areas very cold and uninviting. Breakfast great fun. Stand in line for 20 minutes while ONE waitress slowly considers thinking about if she really can be arsed to find you a table in between laying out cutlery and taking up front cash from some poor sods who had not considered paying ahead. All this while about 50 people waiting to be seated for breakfast!!!! And don't expect to leave your bag at reception or with the concierge because it won't happen! They are are far too busy to deal with arriving or departing guests. If this is a 4 star hotel it shouldn't be. It is hopelessly incompetent on the service level. Do yourself a favour and give this place a very wide berth. Alves"
196,1210,"Dec 1 2008 	The worst hotel I have ever stayed at in London	The hotel can clearly not cope with the volume of guests. The check in process was delayed by several ours. The queue to check out was unbelievable. 3 out of the 6 lifts were out of order causing more queues with lots of upset guests trying to get to their rooms. We didnt even bother with the bar as they clearly didnt have enough staff to serve guests. I will never use Hotel Direct or recommend this site to anyone, this hotel was recommended by hotel direct as a gem? The whole experience left us exhausted? We spoke to lots of quest while trying to check in, all of which will be logging complaints against the hotel. One plus point to mention, the staff remained friendly at all times which needs to commended as they had to deal with so many upset quests."
197,1210,"Dec 1 2008 	small room	me and my wife stayed 7 days at this hotel ,on arraival we had to stand in a qeue for 30 mins. which was very stressful after 8 hrs flying ...we escorted to our room which iwas spouse to be large or reasonable size especially we paid for double delux viewing hyde park (double price of stander room)but insted, we got small room with smallest bath room i ever seen in 4* hotel.....went back to recepiton complaining ?we told that is size of all of our room except famaily rooms,,,,so if you looking for luxury hotelwith good size room avoid this hotel by any means .take best westren moysten insted cheaper and located on marbel arch."
198,1210,"Nov 30 2008 	Great location for shops 	A great hotel if you want to be within walking distance of the main shops and a few minutes from the tube. The hotel itself was very comfortable with my only criticism being the shower door didn't close fully so water ended up on bathroom floor, although this wasn't really an issue and I didn't even report it. The bar was fine with a good cocktail list, although not cheap but in line with London proces. Some great restaurants very close."
199,1210,"Nov 10 2008 	great for a visit to london	stayed with 3 teenage boys for weekend in london. read other trip advisor reviews and noted wide variation in reviews. The key get right is to book directly with the hotel (not the call centre) and get a delux refurbished room with a view AND confirm this with the front desk on arrivalkey positives:great position - for a run in hyde park, access to west end, shops etcmodern rooms, good bathroomsgood breakfastsattractive lobbyvery competitive pricinghelpful conciege and staffreduced ncp parking costtoo consider:huge hotel, very busy, wide variation of clientelenot for a romantic weekend"
200,1210,"Nov 10 2008 	Fab Hotel brilliant location!!!	My friend and I stayed at The Cumberland for a girlie getaway. We arrived on the Friday night - check in was quick and the lobby is vibrant and busy. We were given a large twin room, with the most comfortable bed i have slept in (besides my own!). We went down to the bar late in the evening - prices were high - but this is central London. We eventually went to the on site club - for free and danced all night till 3 am. This was one of the best nights out I've ever had in London, such a good laugh and great music. Spoke to a few of the people in the club and they said that it is one of the &quot;in&quot; places in the area - just make sure you have a full wallett! We didn't have breakfast at the hotel, but there is a brilliant patesserie just outside the entrance of the hotel that was very well priced, and I can't recommend the cakes enough!!All staff in the hotel were extremley polite and professional, and the hotel itself was a pleasure to stay in and I would recommend a stay there - the location is amazing and facilities fab. Molton Brown/ Elemis products impressed me and my friend. One of the best things about the hotel is a well organised and secure luggage room where we left our cases before we got the train home, was so good not having to cart them around Oxford St. Brilliant!!Taxis to/rfrom Euston - between 6/8 not worth buying a tube ticket. Two glasses of wine 15 (off licence outside hotel!) Tube station 2 mins away."
201,1210,"Nov 9 2008 	great location but a few blips !	Just arrived back from spending one night in this hotel.We arrived at 1 pm and queued to check in . This took an age only to get the front of the queue to be told to come back for the key (and queue AGAIN!) at 2pm!The check-in process is a shambles and most of the receptionists do not have very good English.The rooms are fine- quite spacious and ours was quiet - we were at the side of the hotel.The hotel is in a brilliant location- a few yards from Marble Arch Tube.The lifts are always busy- it can take forever ! Lift number 5 broke down on us and we were trapped in it for about 10 mins-- a horrible experience ! No apology given to us.We used the stairs up to the 2nd floor after that experience.However the stairs which are behind the concierge desk are absolutely horrible-- like a service stairwell. As far as we could see theses were the only stairs -- God help everyone if there is a fire !We went into the bar and were charged 43 for 4 shorts and mixers ! (2 brandies, 1 gin and 1 vodka )Included in this was a 12.5% service charge !!WHAT SERVICE? - we had to queue 3 deep at the bar for our drinks. WHAT A RIP OFF!The Italian restaurant across from the hotel entrance) is lovely and do a special lunch menu -- 2 courses for 7.95 with a glass of wine for 2-- and it was lovely!"
202,1210,"Nov 8 2008 	Good value good breakfast excellent location	We have stayed at the Cumberland before and full marks to the Front Desk staff who knew that. This London hotel is next to Marble Arch tube station and Oxford Street, and if arriving by car there is a choice of 24 hour ncp car parks just minutes away -be sure to ask the concierge for your discount voucher.The rooms are comfortable - not very large, but this is London, The bathrooms are clean, bright and modern. A computer keyboard in the room provides internet access if needed. Make sure you take a clock to see the time during the night though. Breakfast is in the Market Cafe,which is self service , there is food for everyone's taste and the system works well.We couldn't get in to the Rhode's Brasserie due to a private function which was disappointing, but ate in the bar instead - the little hamburgers were lovely and just enough to share.The Cumberland is good value and an excellent location."
203,1210,"Nov 7 2008 	Dont spoil it by having breakfast.	My husband and I stayed at this hotel on the night of Monday, 6 November 2006. Check in was pleasant and quick and we were allocated a room located right next door to the lift on the first floor. Unfortunately, the continuous ping of the lift was disturbing and in addition there was a noisy air-conditioning unit outside the bedroom window. We asked to move, and were relocated to a room in a quieter wing of the hotel. Please be aware though that this hotel is situated at Marble Arch so the traffic noise is 24/7.That evening we stayed in the hotel complex and used the bars and the Rhodes restaurant. The standard of food was superb and service impeccable. The next morning we arrived downstairs for breakfast and were absolutely astounded to have to take breakfast in what really resembles a school canteen  the Market restaurant. The place was very noisy and exuded the strong smell of fried foods. We enquired as to whether or not we were in the correct place and if there was an alternative breakfast room. Unfortunately, we were told there was not. We were shown to a table and had to queue for our breakfast! When we returned to the table and our coffee was poured, the table was not stable and the coffee spilt over the table onto my suit. This was extremely embarrassing as the room was packed. The staff passed me a napkin but by then the damage had been done.The lovely relaxing ambience of the reception areas, bar and bedroom along with the superb food and service in the Rhodes restaurant was totally blighted by the dreadful breakfast experience."
204,1210,"Oct 30 2008 	Great Location.	Having read reviews was a little apprehensive about this hotel when booked into it by my work. However, needn't have worried.Lobby very impressive but arrival coincided with a lot of others so wisely sprinted for reception desk to avoid consequent queue. Check in seemed slow process.Room - larger than most single rooms I have experinced in London, quiet and well equipped- flat screen TV, iron etc.. Modern bathroom. Everything clean and functional. Wireless internet but at a price.Breakfast in the Market- a little impersonal but large choice. Only criticism was coffee was not the best and luke warm.Check out fine- did notice one man complaining about his room- principally because it was next to very busy lifts and they offered to move himHowever, main benefit of this hotel is its fantastic location at Marble Arch End of Oxford Street"
205,1210,"Oct 29 2008 	Average hotel great location	We booked the Cumberland due to the great rates on offer aswell as the location - a hotel on Oxford Street for a shopping weekend, what more could you ask for!On arrival it's very impressive. The reception lobby is huge, very modern and clinical. You get the idea that you're in a top modern hotel and the rooms will follow suit. Unfortunately they don't. The rooms are basic and nothing special, on the small side - but alot bigger than many other London hotel rooms. Everything you need and very clean. Plenty of wardrobe space. The mini bar was empty apart from the complementary water - very strange. When the maid cleaned the room next day all she did was make the bed and change the towels, didn't even remove the dirty glasses we had lying around. On our final morning the maids knocked on our door 4 times, even though we told them first time we weren't checking out until 12 - you won't get a long lie in this hotel!We didn't use the bar or the restaurants, mainly because of the prices. There are loads of places to eat and drink round about, a short stroll away - so why pay the extortionate prices. I'd only stay here again if I got a great deal on the rates, as the location is fantastic. otherwise I'd look elsewhere."
206,1210,"Oct 21 2008 	Convenient Modern Hotel	We ended up staying at the Cumberland by chance, through Virgin Vacations, after our original hotel had some problems. It was a great replacement. The Cumberland seems to have been recently updated, so the decor is clean and modern. The only problem I had with the room was that the bathroom door had strangely big opening from the doorframe. But this was a minor trouble. The room was spacious by London standards, and very clean and enjoyable to relax in.The location also can't be beat -- just outside the Marble Arch tube station, and down the street from all the great shopping. A full English breakfast was also included in the cost, which was a great bonus. Definitely recommend the Cumberland!"
207,1210,"Oct 21 2008 	Great night away at a lovely hotel	My daughter and I have just had a wonderful night in London where we met up with other family at The Cumberland Hotel at Marble Arch. We had a fantastic time and the hotel is in a superb position. It is clean, lovely rooms and yes it is absolutely huge, but that added to the excitement as we live in a tiny remote village. The staff were very helpful and had a good laugh at all of us taking photos in the reception area. It truly is a stunning hotel. The rooms are very modern and not huge, but hey - you're in London - who wants to stay in the room? The beds were comfortable and the only problem was someone in the next room being noisily passionate at half 12 at night! It was all over very quickly though!! The breakfast was very well organised considering the amount of people at the hotel. We were taken to a separate suite which was better as my 88 year old Grandmother found it a bit noisy in the main area. She then sat while we waited on her! My 2 Aunts came down a bit later and were taken to the A La Carte restaurant for their breakfast as it was so busy. But we only waited a couple of minutes to be seated and then everything was self service and there was no wait. The food was hot and nice and plenty of choice. There is a fantastic 'pod' chair in the reception area where you sit and listen to different sounds! Very artistic. The night for a twin room was 139 which I thought was extremely good value and I would definately stay there again."
