IDREVIEW,HOTELID,REVIEW
176,402,"Jul 16 2009	food police	Had to change rooms twice, each time waited 20 mins in line. Waited ten mins for a drink at the brew pub while staff chats to one and only customer about how good they look for their age ( happened at least two other bars in hotel) Pool bar charges $10 for two bottles of water. They check your room key at the pool gate which is good but they also check your bag . I thought this was also for security but found out they are looking for food , after buying two ice creams FROM THE HOTEL and taking them to the pool I was stopped and told I could not eat them by the pool. I stood there in 40 degree heat with ice cream running down my arms unable to reach my sister to tell her to come out to eat and unable to go in. I argued there are no signs anywere about this rule and. I then asked for the reasons, because it was not for hygiene because people are drinking creamy cocktails and rainbow ice drinks in the pool spilling them and leaving a nice foamy scum around the edge of the water for you to swim in, could the reason be they want you to buy the very expensive food and drink from the pool bar. Pool area was filthy ,put my bag on the floor and was covered in stains, clothes dirty from the beds ,swam twice in seven days because pool packed out with lots of people just standing in the pool waving drinks about, sun beds all reserved at 9am but no one around until lunch time . Sat and watched as people forced to eat quickly standing up or throw food away, even families with small children had to throw away snax bought from the hotel shop, one woman was turned away bacause she had an apple. The loud rock music started at 9AM and got louder through the day, The rooms and the hotel was shabby and scruffy and house keeping done as little as possible. Lots of what look like drunk teenagers running around screaming and shouting. Most of the staff were rude apart from the buffet staff. Paid alot of money for what is supposed to be an ok hotel , feel cheated and ruined my birthday trip"
177,402,"Jul 16 2009 	Friendly clean and a bargain	Despite the construction going on in and around the hotel, we really enjoyed our stay. It's not the swankiest of rooms (mainly the bed linens are okay, but not great), but when you're spending so little, what do you expect? It was very clean, and the casino is one of the less frenetic ones on the strip. There's plenty of space and light, and the dealers are nice. The casino also does not have a strong odor (neither of smoke nor cloying air fresheners). We were in Vegas to meet up with family. We checked in first. We were on a different floor from my parents and, after spending a night in our original room, we asked if we could move to their floor, which promptly happened.I would be happy to stay here on a return trip."
178,402,"Jul 16 2009 	Wanted to love it... but they didn't want my love!	Okay, I wanted to try staying at the Monte Carlo because it seemed to be a little more upscale than the NYNY next door, where I've stayed twice. I was hit with disappointment the second I arrived. The entire MC parking structure was CLOSED to guests! They were using it for construction workers for City Center! I had to park out on the hot sun and walk about 200 yards with my heavy bags, through lots of traffic on the side alley. Valet was very packed the whole time I was there, and I hate leaving my nice car with valets.Also, like the Mirage, they have this strange check-in area, where there is no single line, and you just stand in front of each desk clerk. I had several other people walk up and get their rooms while I waited.The elevator banks are close by though, and I had one that serviced just the upper rooms. The hallway to the room was very sparse, with no decoration or feel that you are at the Monte Carlo. The room was the same and it made the NYNY look like The Palms! Nothing special about the room at all. It had most of the normal amenities, but these days hotels in Vegas should be offering something beyond &quot;normal&quot;, especially for the higher rates I paid.Most of this average quality was to be found in other areas too. The pool area was packed every day of my 4 night stay, and I got the last chair each time I went. It would have been a nice pool area were it not for the loud music which made talking to your waitress almost impossible. The river they have is nice, but you need to get rid of half the people in order to have a nice swim not getting bumped into. I heard they are letting people from the NYNY use the MC's pool.Gambling, the buffet and coffee shop were also nothing special, though the service was above average. Diablo's, right out front, had great fajitas and a great view of the Strip. We ate at Andre's and had a 4 Star meal. Had the sea bass and it was worth every penny! But they would not let me open a bottle of expensive wine I'd brought. They didn't have corkage at all. The front desk clerk had given us a $25 off card to use, so once again, the service is great but some policies need to change. We ended up buying a pair of cheap wine glasses and drinking out on the steps right on the Strip!I also tried Brand, which is their steak place, but it is right off the side of the casino and open to it. Smelled lots of cigarette smoke throughout dinner. The burgers were good, but the servers are a little young for such high prices.The overall crowd at the MC was younger than I had expected and it proved that Vegas has lots of visitors. If I ran the Monte Carlo I would demand shuttles, buses or carpools for the construction workers, thus giving MC guests back their parking structure. I would also create a single check-in line, add special amenities to the rooms, lower the music at the pools, or have a separate area for adults who want more peace and quiet.Until then I'm not really able to recommend the MC."
179,402,"Jul 15 2009 	Very nice room at a very good price.	The service was excellent, location great, and check in was a breeze."
180,402,"Jul 14 2009 	I will be back	I travel to Vegas yearly, and I will have to say that the Monte Carlo is a very classy hotel at reasonable rates. I have stayed here the past two years and found the hotel to be clean, and staff to be very helpful. The rooms are not extravagant, but they are clean and very nice. Look forward to my next trip to Vegas, and the Monte Carlo!!!!"
181,402,"Jul 13 2009 	Stay Away	I had hear pretty good things about this hotel but, that was not the case at all. I don't find myself to be a picky traveler. The customer service was horrible. The front desk was not knowledgeable. They were rude and not helpful. I felt like they were doing me the favour by allowing me to stay there. I have been to Vegas many times and never had an experience quite like this one. This will be the last time that I stay at an MGM property."
182,402,"Jul 13 2009 	Really enjoyed our time at Monte Carlo	Just returned from a great stay at Monte Carlo. We try to get out to vegas once a year and was a little nervous after reading reviews. Previous trips we've stayed at Venetian, MGM, and Caesars. Monte Carlo sent us a deal that was too good to pass up and we really enjoyed our stay. We'd definitely stay here again. We loved the layout of the MC. It was very easy to get around. When you come down from the room, you have the main lobby, pool, casino, and food court all right there. The other hotels you have to walk a mile to get around. The room was average but we didn't care at all. We generally left the room at 9am and didn't go to bed until after 1am. We slept, showered, and changed at the room. I've seen some bad reviews on beds but ours was fine and comfortable. Our room was the last one on the 27th floor so noisy neighbors and construction wasn't an issue. Another good piece of advice we took from previous reviews was bringing tubes for the lazy river with us. I think my wife bought some for under $5 compared to renting or buying at the pool. only negative I had was you couldn't sit on the edge of the pool with a drink. This is the only hotel I've been too where i couldn't drink a beer sitting on side of pool. So instead of running up a $75 bar tab per day at the pool, i bought one beer in four days b/c I didn't want to drink it sitting in my chair. As I said, we'd definitely stay here again. It's not as nice as the other hotels we've stayed, but for the price it was great. We averaged $50/night (Wed-Sat night) and would stay at the MC all the time for that rate."
183,402,"Jul 13 2009 	hotel staff not friendly	Hotel is mediocre. Room is dark and not well ventilated. Mattress is way too soft. The hotel staff is not friendly at all. Called and asked for direction to the gym, got rude answer and hung up. Will not stay here again."
184,402,"Jul 13 2009 	Poor Service for a Strip Hotel	First review for us and it must be said that this service in the Casino is the worst I have ever seen in Las Vegas. We will not spend our money at this Casino tommorrow. The staff is rude and their is no atmosphere that makes playing fun. Spent nearly 30 minutes before we got service at the craps table for drinks. Video poker was even worse, the bartender spent his time NOT delivering drinks. The place is just dead and absolutely no fun! Isn't Vegas about fun? Do not stay or play here!!!Oh, the Diablo Cantina is a great place to eat and hang...that is it!!"
185,402,"Jul 7 2009 	amenities were ok customer service was horrible	I had booked my room ahead of time and prepaid and when I checked in they only had me down for 2 of my 3 reserved rooms. Fortunately I was able to pull up my confirmation emails on my phone and show them I had indeed booked 3 rooms. Once I arrived at my room, the shower was awfull. In addition, the maids did not clean the bathroom or room very well, I found garbage on the floor by the window and the shower had hair smeared on the tile side when I arrived. However, the maids did manage to lift an item of clothing from my room. When I filed a report about it I was treated rudely by the &quot;risk management&quot; staff and not compensated. I was told they sent me a letter of apology and when I said I hadn't received it I was rudely asked if I had &quot;checked my mail recently&quot;. To say the least I was not at all impressed with my stay and I will never go back. oh and you had to pay to use the hotel gym."
186,402,"Jul 7 2009 	good location 	The hotel was in a good location of the Strip. The room was a tad dated but very clean &amp; comfortable. The maid service was adequate also. The pool was overcrowded (being summer &amp; all, no surprise) but we managed to have a good time relaxing there &amp; ordering some decent poolside cocktails &amp; food. The beds were real comfortable..after an evening of walking the Strip, you want a comfy bed to go to."
187,402,"Jul 6 2009 	Great Stay- Pool makes it all worth it!	We were hesitant to book this hotel for a 3 night stay over the 4th of July weekend. I feel that this review is needed to balance the bad reviews. Our experience was great. Overall, the staff was very helpful and friendly, the hotel room (while fairly basic and small) was clean and had a nice view of the srip. We stayed in a deluxe high floor strip view room and it was quiet and the beds were fine. The pool was the best part! You do have to get there early to get a chair- if you do, you should have no problems finding chairs together.Pro's- Wave pool- while kind of small, it is lots of fun- The lazy river is swift and fun- You can bring your own raft to the pool. You can also rent one of their rafts, but it's cheaper to buy one at walgreens which is nearby. The pool attendants are also happy to blow it up for you- again, very good service- Pool drink service was fast and someone always came by. The food by the pool was also good.- There's a regular pool as well- mainly adults in this pool. We had a 6 year old with us, so we used the wave pool and lazy river mainly.- Pool area can get croweded, but don't let that deter you- it's fine- Pool hours are the same in most of the big hotels- this one closes at 7. Some others close at 6 (it's vegas, go figure)- Live DJ at the pool. The music is loud, but not terrible. Even with a hangover you should be ok.- There's a store in the lobby- has all your essentials you could need- Food court in the hotel (McDonalds, Starbucks, Rubios, etc)- great for a quick bite- Fast elevators- easy check-in and check-out- fast valet service- pretty good location on the strip- especially if traveling with kids- it's close to excalibur and M&amp;M world, etcCon's:- Room pretty small, but adequate- Halls could use some touching up- Room service trays left out for a few days- Food and service at their cafe was just ok- and prices pretty high- Casino was ok- I've been to better and worseAll in all, I would say that this was a very kid-friendly and nice hotel. I would definitely recommend it to anyone who is looking for a hotel with a great pool and a clean room with a nice view. Don't worry about the bad reviews- I couldn't find anything really bad with this hotel- and I am a tough critic."
188,402,"Jul 5 2009 	Nothing to write home about but does the job	Really decent price for a hotel that is relatively close to some of the better casinos. Accommodations are pretty standard but much better than I expected for $40 a night! Bed was comfortable and room was clean, water pressure good. I didn't spend much time there anyway =)"
189,402,"Jul 3 2009 	Great Location - Ok Casino - Staff ""ok""	So my girlfriend and I stayed at the Monte Carlo in late June. We booked a Tues-Sat for $42 a night. Couldnt really beat it. My other family were staying at the Mandalay Bay and the Hard Rock. So we were in close proxemity to them all.So we arrived and checked it. We were glad to see the casino was easy to navigate. It's kinda just like a straight line, not crazy halls and turns everywhere. This was probably my fave part of the palce. Didnt have to look hard to find my family.We didnt really eat there, so i cant comment on the food.The rooms were pretty blah. Nothing special, but nothing wrong either. It wokred out. I dont know how I'd feel about paying more/night. But for what we paid we were very happy. Great location, ok service, and ok rooms."
190,402,Jul 1 2009 	Not all that	The location of this hotel is good. The rooms were small.The only poor service i would elaborate on was the hair dryer had stopped working and someone came to replace a new one on the wall (at a bad time). They were to come back and never did. So the remainder of the visit I had the dryer sittin on the counter. The room was plain as jane. The bathroom fixtures were old. There was nothing elaborate about the room. You had to pay for the internet and local calls. The money taken in of this place is spent in the casino and making it look appealing on the outside. I wouldn't stay here again.
191,402,"Jul 1 2009 	No Thanks!	The location of this hotel is great for most activities in Las Vegas.The hotel itself is however not good at all. Its old and worn. Cleaning was ok, as long as you dont look under the bed. ( I did..)If you like really bad tvreception, doorkeys that work perhaps every third time and plumbing that wakes up the whole floor then this is the perfect hotel for You. As an added bonus You get a boring casino and a not working players club. And ofcourse they lost my membership information for the players club and almost accused me of stealing a card.Internet access at $14.99 per 24h period is an insult even though it seemed quite fast. The only really good thing was the staff for check in/out and the poolarea."
192,402,"Jul 1 2009 	Monte Carlo - Good Enough	This review is long overdue.  We had a wonderful family reunion which included family members from Montreal, Toronto, LA and Santa Barbara. All fifteen of us stayed at the Monte Carlo. What got the ball rolling was the fact that my brother-in-law won a free five day trip to LV through work for his family, so we decided to join. Managed to get a fabulous rate of $59 for the first 3 nights, then $129 on the week-end. Having stayed at the Venetian two years aga ( first time in Vegas) , I was leary about such a stepdown. Here are my impressions: Firstly, the size of the hotel was a huge plus. It was wonderfully manageable. No walking for fifteen minutes just to reach the front desk. No big hustle and bustle in the lobby and common areas. This made sense since there is no big attraction here drawing the crowds. No theme. Just a nice marble lobby.Check in was a bit dicey upon arrival. My sister requested that we all be on the same floor. Instead, we ended up on different floors. Staff response was rather icey and not apologetic in the least. We decided not to move in the end. Too much hastle.Room: Clean. Decent enough furnishings. Came nowhere close to our suite at the Venezia Tower. Bathroom was fine. One big problem - the beds were awful (we had two Queens). I told everyone it felt like we were sleeping on water beds - filled halfway! Lumpy, soupy, lightweight. The blankets and sheets were no better. Thin linens; ugly brown woven blanket. No fluffy duvet nestled between two layers of crips sheets in this room. Honestly, I suffered with a lower backache for two months after those sleeps. Other than that, the room was adequate. We were on the fourth floor looking out at the NYNY rollercoaster. Screams and wheel grinding got going on the early side (it's a wonder why anyone would ride a rollercoaster at that hour). Oh yes, we also heard that beeping sound from garbage or construction trucks. Thank goodness for earplugs.I don't gamble, but the casino seemed decent enough. Food: Fast food choices fine for breakfast. Discovered hot oatmeal with a variety of fixings at Starbucks - yummy. Eggs were rather greasy at the breakfast stop. We had coupons for the buffet, so decided on breakfast one morning. Good selection. No complaints. Ate at one of the restaurants one night. Sorry, I've forgotten the name, but it's the casual diner type one. Overall, food was very fair and we definitely wouldn't go back. What really made us squirm was witnessing a crew (including some kind of security person or manager) totally disinfecting the table behind us, all in blue rubber gloves. They even threw out all cutlery and dishes on the table. We didn't go to the trouble of asking why all this was going on for fear of the answer. A plus for us was the location. We liked the fact that the hotel wasn't dead set in the middle of all the strip action, but rather closer to the south end where the scene wasn't so hectic. Also, made getting out of Vegas much easier, both navigation and timewise.Bottom line - would I stay at the MC again? Probably not unless we were guaranteed brand new pillow top beds and top quality duvets and linens. Did I mention that the bottom sheets weren't fitted causing them to slide off at somepoint during the night. It was totally gross waking up on the matress cover. What can I say? The Venezia spoiled us silly!"
193,402,"Jun 29 2009 	Enjoyed the hotel pool was disappointing	We stayed for 2 nites and were happy overall with the hotel. I really liked the layout - you did not have to walk for miles through the casino to get to your room. The elevators were right off the lobby as well as the 'fast food' type restaurants. The beds were very comfortable - which is a plus after long days walking the strip. We booked a special summer package which included several 2 for 1 coupons. When we got to the room, we realized they 'forgot' the coupons - however the front desk corrected the mistake later.The biggest disappointment was the pool area. We were only able to go to the pool one late afternoon. We found 4 chairs together (a plus), but I thought the pool water was very dirty. It was cloudy and had pieces of paper floating in it - probably because of all the people drinking and smoking IN the pool. The wave pool was not working this day, but the water here was much cleaner and no one was in the pool. Of course I expected the loud music but it was definitely LOUD - forget relaxing by the pool when the music was on. I might stay here again based on location of the hotel - and only in the colder weather - not when we wanted pool time."
194,402,"Jun 29 2009 	JUST SAY ""NO""	The only thing good about the hotel was the fact that it does not smell like smoke like other hotels. The room was outdated, the tub was not working, we had to stop in the middle of the shower to let the water go down so we can continue and it would not overflow, we called and they never showed up to fix it, and when we told them at checkout they said there was no mention of it at all, and we had to ask for a new hair dryer, since ours was throwing sparks out and we got one that was nasty dirty and it did the same thing the next day, and finally we called them again and they brought us a new one at 4:30am, when we asked for it at 2:30am....."
195,402,"Jun 28 2009 	Great view of the strip	The room was spacious, the beds were squeaky &amp; my back hurt for days after staying here. The chairs had stains, I hate that, I will not sit on anything that looks like that. The pool was nice, the food in the bar area was good. The buffet, for the price, was YUCK! We had a great view from our room. Find someplace else to stay."
196,402,"Jun 26 2009	Skip the Monte Carlo!	The best thing about our recent stay at the Monte Carlo Hotel &amp; Casino was that it was only 1 night. The room itself and the buffet were adequate but nothing special. The first problem was check-in, when the agent handling our check-in answered a phone call and kept us waiting close to 10 minutes while he handled a complaint from another guest wanting to change his room. When we got to our room, a quick check out the window revealed the ugliest view we've ever had - nothing but construction everywhere. However, we hadn't come for the view and figured that the construction wouldn't be a problem at night. Wrong! All night long, equipment delivered supplies, with crashing metal and equipment backup beeping dominating the night noise. We then understood why the guest had been trying to change his room when we checked in. The next problem was heading for breakfast. We heard the 1st emergency alarm while boarding the elevator. Alarms kept going off peridically for over half an hour and it wasn't until the 4th or 5th alarm that they bothered to announce that the alarms were only a test. Three days later we again passed through Las Vegas and spent 2 nights at Treasure Island in a great room for about the same price (around $75 night). What a difference!"
197,402,Jun 26 2009 	Definitely a keeper	The Monte Carlo is definitely on my list of favorites for Las Vegas. We arrived early (noon) and were able to check in right away. Check in was quick and easy. Our room (16th floor) was spacious and clean. Beds were very comfortable. The bathroom was all marble and very clean. The shower was great. We were not bothered by the construction at all. We did not use the pool but did walk out there and I agree that the music is very loud (as it is everywhere in Vegas) and it was very crowded. The food at the Cafe was excellent and reasonably priced by Vegas standards. The casino was large but easy to navigate. Don't plan on winning in Vegas right now. Things are wound up tighter than a drum. Do your gambling downtown at the Four Queens and be sure to stay for the laser light show.
