IDREVIEW,HOTELID,REVIEW
22,371,"Jul 24 2008 	great new hotel but one problem...	Greetings,Stayed at this hotel right next to las vegas airport on July 22nd.Very nice hotel, this is obviously some brand new construction. the rooms are super clean, and all have full kitchen equipment and a small living room area with sofa and tv. It is really well located for people that need to catch an early flight from las vegas mccarran airport and this hotel provides a shuttle service to the airport for free.So everything positive, except for one major problem. The noise. We had a room facing the hidden well street. The street itself is not noisy, the issue is that right next to hidden well street is a major highway (15 or 515) underpass and basically it was impossible for me to sleep during the whole night with this constant strong noise. The other members of the family apparently managed to sleep somehow decently, but if you are a traveller like myself that is sensitive to outside noise, than you may be in trouble.So bring ear plugs and/or make sure you get a room not facing the hidden well road and perhaps you will be ok./family from montreal, canada"
23,371,"Jun 13 2008	Great non-gaming extended stay	While I had reservations about staying someplace that just opened its doors, this place was ready for business. Located just south of the Mandalay Bay Hotel and east of Las Vegas Blvd, just a couple of blocks fromt the airport car rental center, this place great. The rooms were top notch, the breakfast and evening fare were great and the staff very helpful. A non-gaming property with no casino nearby, this is a great place to stay if you are not a gambler or prefer not to stay in a gaming hotel. All rooms have a small kitchen. Although I didn't use the pool, it looked inviting, but it didin't appear that you could do much tanning during the day, except at high noon, as the pool is located in an area surrounded by the hotel building. As I said before, this place is new, very little noise from the traffic or airplaines. This place is very similar to the same property located in Henderson, NV."
1,372,"Hidden Secret	This was my 3rd visit to Hooters.The staff is freindly and helpful, beds and pillows are comfortable. They have cable television and complimentary bottles of water in the rooms. Dan Marinos has the 9.95 prime rib 24 hrs and the Hooters hot wings are great. The price is right ."
2,372,Cheap weekend getaway	Got a great deal from the slot club for Sat and Sun. Made for a nice quick and cheap getaway with wife.
3,372,"Great views and Excellent Housekeeping	My wife really liked the prime rib special. I enjoyed the breakfast buffet and the fresh fruit and with biscuits.The housekeeping service was very good and thoughtful, she brought my daughter extra sheets w/o asking for them on the second night.Hooters restaurant waitress were friendly and helpful. Although menu was different: prices and sauce choices were minimum. Food was very good and beer too.Dixie bar did not have the great looking ladies that were pictured, only couple of bartender guys. Maybe seasonal?Casino girls were nice and nice looking. Machines need updating like the MGM across the street.The room AC was VERY old and HARD to maintain a consistant temperature makeing sleeping difficult at times. It is VERY LOUD and either Very HOT or COLD no in between.Although, we did not win the $$$, we will likely return if price is good."
4,372,"Good Value with a good location	The room itself could use some attention in that there was peeling paint and a slightly damaged drain in the bathroom. The hallways were rather dingy and did not feel very welcoming. The casino itself was good. Sure, not as upscale as many of the other casinos but the service was excellent and the staff were very helpful and welcoming. The gem of the hotel/casino was the gym, though I couldn't figure out how to turn on all the lights."
5,372,"You get what you pay for	I was suckered in by the Internet special. The casino itself is small but relatively clean, the rooms however were dirty and dated. I do not reccomend."
6,372,"Great place to stay for the price .... I have not one complaint!	My family and I always stay at hooters ! They are always accomodating our every need ! In this day n age , with the economics the way they are u just can't beat the prices of the rooms at hooters!!"
7,372,"Stay anywhere but here.	The young man at check in wasn't at all helpful, never mentioned a kids area which is listed on the survey card. The hallway on the10th floor had an offensive odor, the rooms and carpet are tired but adequate - certainly nothing to write home about. Elevators (garage &amp; room) were frightful - they did not always work. The slot machines were dirty. Security, housekeeping, and maintenance were helpful and pleasant. They do have a heated pool. The bed was comfortable."
8,372,"Not too bad for the price	We were expecting a total dump based on the price we paid, but were pleasantly surpirsed. It is a small casino with a lot of penny and nickle slots. There was a restraunt, club, and show on site. The food was pretty good, so were the drinks (just don't buy a drink, they are very expensive considering you can sit at a machine and get them for free. The gym had pretty good equipment for such a small hotel. The pool area was cozy with fire pits and different seating areas for visiting. The rooms were typical of a Howard Johnson or equivalent. The beds were comfortable and the rooms were clean. However, there were food trays sitting outside someones door by the eleveator for 2 days which was anoying. We were in walking distance to many of the bigger hotels which was nice. All in all I would stay here again if I didn't want to spend the money at a bigger hotel."
9,372,"Perfect	Very good location to stay at south strip. One of Vegas smaller hotels, which I prefer.It doesnt take long time to get access to your room."
10,372,"Great Hotel with Mates	Stayed here for five nights on a trip with mates from the UK. Overall this is a smaller and more friendly hotel which means it doesn't take 30 minutes to get back to your room if you forget your camera.Yes it is not as plush as other hotels, yes the fascilities are not as up to date but if you need a hotel as a place to crash with mates then this is the place.The staff were all really friendly and helpful, there was a party going on all day, the pool and bars were excellent, and last but the not least the hooters bar is top class.Other reviews say this is off strip, it is but only 100 yards off strip! It is located next to the MGM and in a real good spot for getting about Vegas.Would I go back, hell yeah, would I go with my Wife, Hell NO, butu saying that her and her friends are staying there next year."
11,372,Nov 26 2009 	Quick easy and the stay was clean	I enjoy staying at the hotelThe service and food was pleasant
12,372,Nov 24 2009 	great hotel for the price	good value for being right off the strip good service perfect size not too big and over the top.Like the other hotel's on the strip perfect walking distance to the mgm and others.
13,372,"Nov 24 2009 	Seemed like best price but.......	I searched the web for a good price on a single night stay in Las Vegas. Hooters was offering a low price and what seemed to be a good location. So I booked the room. When we got there I learned that there was an extra &quot;cleaning&quot; charge of $12 per night. This increased the cost of the room by nearly 20%. The drinks were very expensive, $7 for a cocktail, $14 for a double shot of name-brand rum. Internet service is $13 a day.The hotel is located across the street from the MGM but you have to walk down the street a 1/4 mile to cross over on a pedestrian bridge. Then you have to walk the entire length of the MGM to get to the Monorail. The funny thing is I could see the monorail station straight across from Hooters! Finally, the rooms were functional but seemed to be converted from another hotel chain. There were no bedside lamps, only floor lamps in the corners. Wood &quot;patches&quot; were applied where the bed lamps used to be attached to the wall. But the room was clean.So beware of the price and be aware that the location is not as good as it seems!"
14,372,"Nov 24 2009 	I enjoyed my stay	Well after reading most of the reviews, I was very hesitant to go. But I was pleasantly surprised when I arrived. Check in did not take that long. The room was clean, beds were good. Staff were nice to deal with. I paid less than 40 bucks a day(fri-tues). Location was awesome. A few cigarette burns here and there, but room was better than I expected. I would recommend this hotel to anyone who wants to save a few bucks."
15,372,"Nov 24 2009 	WOULDN'T STAY HERE AGAIN	My husband and I decided to go to vegas and on our drive up we booked the room here at Hooters. We thought it was a good price. However we will never stay here again. To start off the elevators are falling apart. There were cracks in the corners from the top to the bottom, if you push the wall a little you can see through---SCARY!!!! The hall ways to the rooms are so dirty and it smelled. There was no ice in the ice machine the whole time we were there and had to go up 2 floors to get ice. Our shower didn't work right. Half the water came out of the shower head and the other half came from the tub spout. The handle to turn on the water in the shower needed major maintence. Our air/heater was sooo loud that we had to turn it off to sleep. The capet was so dirty and the room smelled funny. However one nite we got in really late,(or you can say early, about 4am) and were hungry, so we ordered room service and I would say our food came fairly quick and it was hot and tasted good. We had decided to extend our stay but did not stay here. We booked another room at another hotel and stayed 2 more days there. This would be a decent hotel if they would keep up with the maintence and do a little more cleaning."
16,372,"Nov 23 2009 	Nice room good facility adequate staff.	We checked in and were given keys to an occupied room at the opposite end of the facility. Had to return to the lobby with baggage and baby for another room. We were never offered help with luggage which would have been polite after making us walk so far. Wanted big bed but got 2 standard, it was a pleasant surprise that we could get an infant bed. We liked the room, it was very clean and tasteful, not fancy but good. Beds were adequate.Big letdown was the staff. Most were polite but nowhere near the standard I find at the restaurants which we frequent. when we returned to the desk after being given the wrong room we were helped politely but never felt like we were important. The 2 desk people chatted with a 3rd employee from retail, the desk guy was trying to get a free shirt. The girl in the poolside cofffee shop in the morning was just plain rude."
17,372,"Nov 19 2009 	If this is a 3-star hotel I don't even want to know what a 2-star would be...	If you're traveling on a budget, pick something else. I'm pretty sure you'll be better off at Tropicana, Excalibur, Circus Circus, Riviera, etc... This place was awful. Their staff is not really friendly. The front desk guy was short and harsh when we were checking in. When we got to the room, the decoration was cheap and tacky, one of the lamps was damaged, the beds had a dip in the middle (like very used mattresses), the sink was clogged, and there were shampoo bottles from previous guests in the bathtub. My brother's room had a wet, used towel. Basically, the hotel has &quot;Please, remodel me&quot; written all over it.The hostess at the Dan Marino restaurant was not friendly at all. It looked like she was doing us a favor - and she wasn't very happy about it. Plus, they wanted us to wait 45 minutes to get a table at 3 in the morning even though we were only going to get food to go. The good things about the hotel were the wings and the location. And that's about it."
18,372,"Nov 17 2009 	Not bad for a B hotel off the main drag	Liked the hotel on the whole. Not as fancy as the MGM across the street, but close enough to the strip to get to things, accessible to the monorail and the prices were good."
19,372,"Nov 6 2009 	excellent holiday	this hotel was excellent , ideal location to walk anywere , rooms clean and had everything you needed casino was ideal size not too big but again had evertything you needed pool was gorgeous weather was lovely for november sat by the pool most days everyone in our group enjoyed it and they varied from age 21 to 60 men and women .room had 2 double beds in tv and computer games ."
20,372,"Oct 29 2009 	Won't go again!	I booked this hotel through Priceline.com. Unfortunately I wasn't expecting to see Hooters as a result. The front desk though it was quick to check in, the service was bad. Also, the hotel charges an additional $5.65 as a reserve fee that is also added onto the price which I wasn't expecting. Therefore, it ended up costing more then what priceline promised. The housekeeping staff charged me for water that I did not drink. I will definitely think twice before booking Hooters. You mind as well pay a few more dollars for a descent hotel."
21,372,"Oct 29 2009 	Excellent value for money just round the corner from The Strip	Check in and out were slow and the standard of service at the desk neither as efifcient nor as friendly as we experienced in other hotels and motels while in the US, however this hotel was excellent value for money (less than 35 for two nights!). We were supposed to have a Bungalow room but were given an Ocean View one instead - this turned out to be a blessing as it was several floors up away from traffic noise and music piped around the pool area from early morning. The room was large and well-appointed. The only gripe was that the bath took ages to drain of water when having a shower. The breakfast buffet in the hotel restaurant was good/varied and fruit plate I had was huge. Prices on a par with the other places we breakfasted during our holiday. The room was quiet, however we think that occupancy levels were pretty low. The other guests of the hotel were predominantly a younger crowd than us - we're in our late 30s."
22,372,"Oct 27 2009 	Great for the price	We are frequent travelers to Las Vegas. The Golden Nugget is our favorite place to stay, however, we have stayed at many of the hotels on the strip in our 50+ times to Vegas. Hooters was decent for the price. We paid $20 for sunday night which included a buy one get one free breakfast buffet at dan marinos, 2 complimentary tickets to Todd Paul and $100 in promo slot play. The casino is small, however, Tropicana, MGM, Monte Carlo, New York New York casinos are close by. The rooms are clean, however, the entire hotel - elevators, carpet, rooms, bathrooms are in desperate need of updating. The pool and hot tubs are nice. If you are on a budget this is a great option in vegas."
23,372,"Oct 23 2009 	Never again	I will never stay here again, The worse service ever. I would rather stay at Motel 6 where I have recieved better service. I was given a smoking room even though I told them due to me being asmatic I needed a non smoking room. They didn't even make an effort to accomodate me. The view I saw was trash. When the maid came in to make the bed it looked like she just threw the bedspread and pillows. The Dan Marino restaurant had extremely slow service even though it wasn't crowded. I was completely dissapointed. I have written a letter to the hotel manager but have yet to recieve a response."
24,372,Oct 20 2009 	Better than I expected from the reviews I read	Some friends of mine were going to Vegas so I headed out as well at the last possible moment. Was looking for a room on the cheap decided to give Hooters a try glad I did. The rooms are pretty much like a motel 6 room with Hooters trim. My room was fine and very clean house keeping did a great job. The room service was great as well both the restaurants were excellent and thrift priced compared to a block away at the strip. I am a person that likes a luxury room as much as the next guy my wife and I stayed at Bellagio in Sep in a suite for $450 a nite and it was luxury this room averaged $22 and was well worth the price. The $9.95 prime rib was great as well as the steak and eggs For $11.95
25,372,"Oct 15 2009 	Hooters better than I thought it would be!	After reading some of the negative reviews on this hotel/casino I was a little unsure, but...the price was right &amp; it was so near the &quot;strip&quot;.First, the room was clean, fair sized &amp; comfy! I also had a great view of the strip from my window!The pool was awesome because it is open 24/7! After a big day/night of LV, it was nice to swim or hot tub at any hour! It is nothing fancy at all. Just a nice &amp; clean pool (2 of them) &amp; 2 hot tubs.On site restaurants were fine (nothing special).The casino was nice because it was small &amp; clean.It is right across from MGM so you can just walk across the street to be in a huge casino, night life, studio 54 (fun night club!!) &amp; the tram! the tram will take you up the &quot;strip&quot;Tropicana is right next door &amp; Excalibur across from that. So it is near many fun things to do if you don't have a car. I stayed when the prices were dirt cheap. It was only $35 a night! but I see their prices have gone WAY up! too bad! it is not fancy! Not all that sexy either.The people who work there are real nice &amp; professional as well. the security guards were NOT awesome. They mostly talked to each other &amp; never really seemed to care what was happening around them. I had to ask them a question &amp; they both seemed annoyed I interrupted them! Oh well..."
26,372,"Oct 14 2009 	Would stay again	Not luxury but comfortable economy. Hotel is older and well worn but clean. Don't expect excellent room service. Our hair dryer broke and it took 1+ hrs to get a new one delivered (we left after an hour so I'm not sure how long it took). Hotel atmosphere is fun and laid back. Nice music playing. Room was clean and bed surprisingly comfortable. Walking distance to several other hotels. If you have the time I recommend visiting the VooDoo Lounge (on top of The Rio) in the evening. You get a beautiful view of the city and great music. If you get there early, you might even get free entrance passes."
27,372,"Oct 14 2009 	BED BUGS!!!	I stayed in the Hooters hotel in LV, NV from oct,9,2009, to oct 12,2009. I started getting itchy bumps, and i didn't know what they were until i found one of the bedbugs. It was disgusting! when we checked out i told the manager at the front desk about it, and she offered me 20$ off. The bites got worse, like i had an allergic reaction. Also, i am very scared i might have brought them back.The work experience of my life! I have already called the hotel and left a message with the main manager, and am hoping to be re compensated for my stay!"
28,372,"Oct 13 2009 	Great Hotel for the price and location not to great if you have minors.	We stayed at hooters las vegas from Oct 10 thru the 12th. We went to Vegas for a wedding and decided on this hotel as it was fairly cheaper and close to the strip. its a pretty small hotel not as big as i thought it would be the staff was very nice to you IF you where gambling if you where just walking through the casino they seemed to be very rude and very rude to my son. I have a 13 year old, we where walking to the garage and we where waiting for the rest of our party to catch up, so we stood right in front of the elevators to wait for them, this very rude person comes up (who works for hooters) and rudley asks him ARE YOU OVER 21??? i looked at her and said no he is not and your point! she tells me well this is a gaming area so he is not allowed here, i said ok well we are staying here and going to our car we are by the elevators (which mind you there are no games by) and she was like well he needs to wait in the garage! i looked at her and was like umm yeah i dont think so but thanks for your suggestion LOL! at that point the rest of our party arrived and we left. The gift shop sucks it only has a few items, most of the areas are empty or just have 1 or 2 shirts. OMG and the restaurant ewwww!! i had never eaten at hooters before so we decided to have dinner there our first night to try out the wings. Once again because we had a minor we had to wait longer as they only have one area for you to sit with minors. (all this really means is that the girls dont bend down and have there hooters all over the place LOL!) Once the wait was over we where seated, right by the kitchen area where all the traffic is because everyone is going back and forth to get the food. The girls...i was a little surprised i thought they would all be very pretty with nice bodies and that was not the case. I was sooo dissapointed with the wings they where just oozzing grease and had no flavor whatsoever and these where suppose to be the hot wings. All in all i would never go back to that restaurant.."
29,372,"Oct 8 2009 	Cheap price friendly staff but would prefer to stay elsewhere for a few bucks more	scored the room for $25 which included a breakfast. all staff we came across was friendly. room was a decent size but really needs to be updated. i would typically say it was amazing bang for my buck but in Vegas perspectives, i cant say such a thing. for about the same price or maybe $10, i couldve stayed at many other options including Excalibur, which i have stayed at before and was much nicer and with a great location. also Sams Town was cheap and better but I avoided due to nonconvenient location for my plans on my trip. overall, not terrible, but i personally would try something else on my next round."
30,372,"Oct 8 2009 	Not as nice as I thought- but definitely worth $24!	Hotel was okay. I expected it to be a little nicer since it said that it opened in 2006, but I think they just redid an older hotel. Dealers were really nice and taught me how to play craps. Had a lot of fun at that table. The dealers were not the standard &quot;Hooters&quot; type workers though- so that was different than I expected. I only paid $24 per night so it was a great deal in that regard and I would stay there again because it was so inexpensive. If you don't mind staying a tiny bit off the strip it'll work!!!"
31,372,Oct 8 2009 	budget hotel	Good hotel for the money. However if I had to do it over again I would spend a little more and get a lot more. the people were really nice. The food in Dan Marino's was horrible. The prime rib had more fat on it then meat.hooters food was normal but of course you paid more for that.No coffee maker in the room and no coffee in the hotel. The room was average but severely lacking in outlets. The rooms were called beach side so I thought I was going to see at least a view of the pool...nope a view of the parking lot.The pool was very nice and the staff including security by the pool were awesome!the hotel very quiet in the room areas so that was really nicesign up for the free chips just to get the coupon to see the comedian for 7.95. I laughed from the beginning to the end!! hilarious
32,372,Oct 5 2009 	great time	had a great time. check in was very good staff was great very informative. room was cozy for the price(best deal) went to see tod paul very good. casino was small but nice. pool was nice but very cold. Stayed there twice and loved it will stay there again. Food was great at marino (the steak with garlic sauce was excellent) Plus hooters food was great to. Check out was very easy. Needed a later check out and got it with no problem(thanks)
33,372,"Oct 1 2009 	Perfect for what we needed	We stayed here for 2 nights on a quick cheap trip in Aug 2008. We got a dirt cheap bungalo room and it suited our needs just fine. The pool area was a nice place to relax at night, the staff was friendly and more importantly it was like $30/night. If you want something that just works well for quick trips or if you're not planing on spending much time in the room this hotel was perfect. We're staying one day here again in December for nastalgia before moving on to the Bellagio for the remaining 4 nights. Cant wait."
34,372,"Sep 28 2009 	Hooters is just for Wings!!	LOOOVE hooters wings but not their hotel...waaat kind of place is this anyways?! we weren't in the room more than to change and sleep but wow was it run down. Moldy showers, Dirty Carpet, DUMB front desk staff, and to top it off as we were packing to leave I discovered ANTS on the bed that had found their way to my suitcase. One reason would be because Room Service didn't clean up food from the hallway ....just GROSS!"
35,372,"Sep 26 2009 	A HOOTING TOOTING HOTEL	we stayed at the hotel in 9/9/09 the hotel was nice. the down side was that the towels they provdided around the pool were very small to say the least (best take your own) the room was ok but it would be a lot better with fresh painted walls and a new carpet, the wardbrobe doors didnt work either. the breakfast buffee was ok but we found another hotel that was a lot better ( the next one up) the location was ideal it didnt take you too long to be on the strip about a 5minute walk. all in all the budget hotel gets my vote for the next trip."
