IDREVIEW,HOTELID,REVIEW
147,1064,"Feb 5 2008 	Excellent value	Stayed at this hotel 2nd Feb for 1 night after returning from a trip to Bruges we had travelled on the Euro Star so the hotel was very well postioned for us. We didn't know what to expect but had checked 1st with Trip Advisor so hoped it wouldn't let us down (it didn't ) Check in brill the young man was very helpful and friendly. The room was really clean and had everything we needed the bed was huge and very comfortable. Had a meal at the hotel and it was really good. We couldn't have asked for more, we would definetley use this hotel again"
148,1064,"Jan 29 2008 	Excellent value - great hotel	This hotel definitely lives up to its reputation in previous reviews (which was why I booked it).First of all, their price is absolutely fabulous, considering what you get for it AND especially compared with other central London hotels.It is right in the centre of town and extremely well accessible(literally across the street from King's Cross/St Pancras train and tube station), but nonetheless very quiet.The room was sparkling clean, with not a fleck of dust to be seen and the bathroom was shrubbed and looked very clean and hygienic. The size of both the room and the bathroom is ample (while in London I visited somebody else staying in a large luxury hotel who paid much, much more and his room was actually smaller!).The staff was friendly, courteous and helpful all the time (although admittedly I did not have any special requests/complaints).I did not take their breakfast option (you have to pay extra), and I did not peruse their in-house restaurant/bar, which was actually quite lively in the evening, with obvious non-residents joining in the fun. It wasn't rowdy or anything, just quite lively.I did enjoy the fact that they have a coffee bar on the premises and made use of their offer at least - lots of other bars and restaurants in the area, by the way, King's Cross has improved a lot recently!Anyway, this hotel is definitely a two-thumbs-up-recommendation!"
149,1064,"Jan 21 2008 	Great hotel- perfect next to King's Cross/ St. Pancras	The reviews that I read about this hotel are very accurate. It is a nice place, which is probably the MOST convenient hotel to the King's Cross station. Other hotels nearby are in much less safer-appearing areas, as about 2 blocks from this hotel the neighborhood gets dicey (or dodgy if you're British). However this hotel is on a well lighted street and I never felt uncomfortable. My room was very quiet. The only comment that I have is that there is no room service, but there is a restaurant in the bottom of the hotel. You can go down and order and then they will call you in your room to come and pick up. The food is outstanding. I had a Caesar salad with chicken that was really delicious. I was there on a Fri. night so the bar scene was really hopping. However, it was comfortable to be there to order and pick up food. I highly recommend this hotel."
150,1064,Jan 11 2008 	Very Comfortable and great Value	This hotel is great value and was very comfortable. Check in was quick and easy. The room was large and very comfortable. The whole pplace was spotless. It's definitely above average for a budget hotel.
151,1064,"Jan 6 2008 	Great find	I stayed here with a friend for 2 nights in early December. I was very impressed with the hotel. The staff were very friendly and efficient. Our room was overlooking the courtyard so very quiet. The breakfast was good and I would have no hesitation about recomending this hotel for a London break. Excellent value, excellent location."
152,1064,Jan 6 2008 	Jolly Good!!!	What a fantastic hotel!!! - My husband and two children aged 11 &amp; 9 stayed here on our recent stay in London. We had caught the train from Paris to the nearby St Pancras Internation Station. The hotel is perfectly located and only a couple of minutes walk- much to the delight of our children carrying their luggage!! The room was very comfortable and quiet. The staff very helpful and friendly. The breakfast was a real bonus as children eat for free with their parents. The selection and quality of food offered should be commended and was definitely one of the best we came across during our 5 weeks abroad. The hotel is also perfect for travellers departing/ arriving from London's Heathrow airport- travel on the Piccadilly line - with a short walk to the station and a fare of only 4 pound per person (kids travel free) it is absolutely perfect. We will definitely return and have no hesitation whatsoever in recommending this great hotel.
153,1064,"Jan 3 2008 	Very nice surprise	This was my first trip to London for some years and I was not looking forward to it. My opinion quickly changed when arriving at this relatively new hotel though. Friendly and efficient check in and I was pleased my request for a quiet upper floor room was no trouble to them at all. The hotel atrium was busy but not crowded, with a nice buzz from the easily acessible bar and coffee shop. Majority seemed to be business types, but certainly families were evident and appeared very comfortable. My room was standard but very clean and I was pleased to find an iron and board in situ and that the TV was working. Bathroom was compact but immaculate, as was the room after housekeeping each day. I used the bar for just a pre-dinner drink in the early evening and found a quite good selection of wines and beers; the draft lagers I sampled were fresh and well kept, with prompt and polite service. The restaurant was popular and I was met at the entrance each evening with a smile and a few friendly words, which are always welcome to a solo traveller. Table service was very friendly and efficient. Menu was limited but very well priced for London - options of two courses for around ten pounds or a more ambitious three courses which could come in under fifteen pounds. Simple choices - soup to start, sausage and mash, fish and fries etc were reasonable sized portions, freshly cooked and nicely presented but you are chosing from a budget menu, so don't expect high value ingredients. Still, most pleasant. Breakfasts were again from a standard buffet, with a good selection of fresh fruit, cereals, bacon and eggs etc. Everything carefully cooked and well presented, if once again, ingredients chosen to a careful budget, but nonetheless at 7.50 again very good value for the capital. I slept well and was pleased to see high levels of security inside the hotel, with keycard access to floors as well as individual rooms. My only frustration was a lack of ventilation. The room was well heated, but being from the north, I prefer a cooler room for sleeping. Checkout was prompt and efficient. One note - if you need a cab, the hotel is on a one way street and just beyond the station entrance, so commuters get first call on passing taxis - you may find you have a wait at busy times.Otherwise - a very nice surprise; good value and I am returning shortly."
154,1064,"Dec 7 2007 	Ideal for early Eurostar departure	This Premier Inn is ideal if you've an early Eurostar departure, it's less than ten minutes walk away.The hotel is excellent value for money; clean and tidy and as quiet as any central London hotel can be.Would I stay there again - definitely!!"
155,1064,"Dec 6 2007 	Excellent hotel in a good location	For value for money and location this hotel really has to come tops - it's modern, stylish and an all round brilliant base for a trip to London. The bathroom wasn't perfect, but it certainly wasn't anything worth making a fuss over. The room itself was great - the window looked out into the central undercover courtyard but there was no noise at all. When we aksed for an iron we were directed to a little cupboard a couple of doors from our room where there was a store of irons and boards that you could just take to your room and then return to the cupboard - really convenient and it was nice to have a proper ironing board to use. We had dinner in the restaurant the night we arrived because it was late and it was really pretty good, not amazing but certainly good enough. Breakfast was good too, plenty of choice. Check in and check out was easy and friendly. Perfect for the British Library which is just a couple of minutes walk away and of course Kings Cross Station. I am tempted to stay here every time I go to London now because I think I'd be hard pushed to find anywhere comparable for that price range."
156,1064,"Dec 6 2007 	Recommended	Me and my partner spent 2 nights here in early December - selected this on the basis of (a) proximity to St.Pancras (our train's arrival point)(b) links to all major underground lines(c) good reviews (on this site) and reasonable pricesWe weren't disappointed - sure, it's not the most attractive or prestigious hotel, but then again, it's 90 a night for a double room. Try and find somwhere of a similar quality in London for this price.We had the breakfast there, largely due to our laziness - reasonable food quality, but not brilliant value (7.50 each) unless you're going to literally try to eat all you can.Staff were pleasant and polite, and all in all, I'd recommend this to anyone wanting a decent, basic, short stay hotel room in central London"
157,1064,"Dec 2 2007 	Good value convenient locatiion	I've stayed at this hotel several times while working in London. Location is very good for King's Cross and St Pancras, staff are helpful and the place is good value for London. Rooms are generally good, beds could be a bit more comfortable, but try and get something on the outside of the hotel as the inward facing rooms tend to be smaller and very warm in summer and on one occasion I had one where the floor mounted aircon unit made the carpet damp. Hotel has attached coffee shop, pub and restaurant. Restaurant is good value for London and food OK. Breakfast buffet is good value. Prices have gone up since the opening of the St Pancras Eurostar terminal. In some rooms it can be difficult to get a mobile signal."
158,1064,"Nov 28 2007	Great Reasonable Hotel	I stayed at this hotel over Thanksgiving weekend 2007, on an extended weekend break. I've stayed at a PTI before, and was as pleased with this one as I was with that one. In fact, I'd recommend the PTIs generally, for any traveller who seeks a hotel for short stays, more than no-frills but nothing fancy.My room was small, but there was still room for two of us to co-exist comfortably. The bed (king-size, as I think they all are) was very comfortable, and the in-room heater was adjustable. Our room was an interior one, facing the courtyard, and I'd heard that these tend to get hot, but in the London winter with an adjustable heater and a window that opened, I didn't find it hot at all. Quite pleasant, in fact. The hotel was also quiet inside and out -- no interior noise, and no noise from the exterior (although I was briefly in one of the rooms that faced out onto the street, and I could hear traffic noise). In addition, the hotel has a &quot;good night guarantee&quot;; if something goes wrong or you are dissatisfied during your stay, they refund one night's worth of your bill. We had some difficulty with our heater and ended up taking advantage of this guarantee, so I can say that no hassle or tricks are involved.My one complaint would have to be the breakfast room. The restaurant staff generally seemed to be a little less practiced than the reception staff -- who were fantastic -- so we ended up waiting for a while before we were seated for breakfast. I believe someone else has commented on the badness of the coffee here, and my companion certainly found his quite horrible. The toaster also made very raw toast, and the vegetarian sausages we ordered arrived cold. That being said, when we went to the restaurant for dinner the food was excellent and the service was very prompt. So perhaps it's merely the breakfast that's the problem.All in all, I would recommend this hotel very strongly. I was very happy there, and I'll certainly return if I get a chance."
159,1064,"Nov 25 2007	Great Value - Quiet Hotel	With the value of the US dollar at all time low, finding an affordable and comfortable place to stay in central London can be difficult. The Premier Inn in Kings Cross meets both of these criteria. My room, though smaller than the other Premier Inns I've stayed in, was very comfortable. One plus that I've found in other Premier Inn properties - the rooms let in very little street or hall noise - it's great - you close the door and you leave the madness of London's street scene far behind. The hotel is located on a side street right by Kings X station and a short walk from the recently re-opened St. Pancras Station where the Eurostar is now operating. It'd be a great location to stay in if you're planning a few days in London before heading to Paris... One weakness, the expensive breakfast didn't seem to offer that much in the way of variety. I opted for the cold continental breakfast - and noticed that both my choice and the hot buffet lacked anything very interesting. There's a Costa and Starbucks nearby as well as many nice restaurants within a five minute walk. Also, there's a Tesco Express in the same business block . Would come back here without any hesitation..."
160,1064,"Nov 25 2007 	Nothing bad To Say!	We stayed at this hotel for 2 night weekend break. As all the other review state, the hotel is in an excellent location - 2 min walk from Kings Cross tube and the area is just fine! The hotel is clean (if may be a little hot!) and the staff and really friendly and helpful.Our room overlooked the reception area on the 4th floor and was immaculate - bed was extremely comfy! We paid the extra for breakfast and it was worth it!! The resturant staff are efficient and helpful and the breakfast choice was fab &amp; fresh - better than the Hilton, De Vere, Marriotts etc. Yum. We took our car, and it is near on impossible to avoid the congestion charge - parking is issue... the NCP car park is very expensive and located quite a distance from the hotel (too far to carry bags etc and there is not really a stopping area outside the hotel) I also wouldnt be too keen to leave my car there overnight... however there are some single yellow lines directly outside the hotel (about 4/5 spaces) and you can park here after 6pm on weekdays until 8am saturdays and then again after 1pm Saturday through till Monday morning! FREE! Which worked perfect for us. I would recommend this hotel!"
161,1064,"Nov 4 2007 	It's a winner	As other posters say, this is a great location. Tube station with 4 lines just nearby and a mainline rail station. In an up and coming neighbourhood - St Pancras High Speed railstation opening soon has prompted lots of rengeneration in a gritty area.Room was clean and well laid out, quiet and a very comfy bed. Staff were good also.Great value for a great location."
162,1064,"Nov 4 2007 	No Stress.	My friend and I just spent 3 days at the hotel.Being just a very short walk away from Kings Cross Station it took all the stress of having to lift cases off and on tubes to get to a good hotel, and also gave us much more time to spend in London.We arrived, they stored our cases, we left and they did the same. Nothing was too much trouble for the staff and we have never seen a breakfast table cleared so quickly in between courses.The food was very good and choice exceptional. Porridge on request at sitting down within 2 minutes.Beds were comfy and room absolutely spotless.Only one thing which was &quot;off putting&quot; shall I say. The room was an inner (the hotel is built on a square design with the Reception in the centre) was the heat which built up the room, even with the air-conditioning unit. It had a window but it was locked and we had to ask for it to be opened, they did with no problem and room fine after that. Tip for travellers who wish to stay - ask for an outside room perhaps!The hotel has its own pub and a Costa Coffee attached together with a restaurant at very reasonable prices. They even texted early on the morning we were to arrive to ask if I wished to book a table for dinner that night or if I required directions. Kings Cross used to be a dodgy area, but with the arrival in 2 weeks of the Eurostar to St Pancras, they are really pulling out all the stops to make the area up and coming. No worries at all.We shall certainly be returning to this hotel."
163,1064,"Nov 3 2007	Perfect base	Lovely hotel. Stayed there for weekend with my husband and daughter. All that we needed was there. Very clean. The perfect base for site seeing. used resturaunt, good friendly staff throughout hotel. No faults at all. Would highly recommend this travel inn . Have stayed at another since which I wasn't so pleased with at Euston London. Will definitely return here when next in London."
164,1064,"Oct 28 2007 	Nice hotel - Great location!	The Premier Inn Kings Cross did have a great location - Only 500 metres from Kings Cross Underground Station. The hotel itself were also very good. Good breakfast and good restaurant!The A/C worked perfectly and the room was big + the beds were comfy. Toilet was great too. Despite the hotel lying so central in London, there weren't much noise from the traffic."
165,1064,"Oct 10 2007	Convenient location	Stayed two nights at the Premier Travel Inn (now Premier Inn) at King's Cross in early September. The neighborhood is &quot;gritty&quot; for lack of a better word but it was good to be so close to the King's Cross/St. Pancras stations.The hotel lobby was a pleasant surprise, very nice and airy.We had a reasonably sized double room on the first floor (there are elevators). Fairly quiet though we did hear a little noise from a nearby pub on Saturday night.There was some strange odor in the room, I never figured out what was causing it. I'm not sure that the fan/AC unit was working correctly but that wasn't a problem as the temperature was in the 60's (high teens-low 20's Celsius).Bathroom was clean. The bathtub is high so you have to be careful stepping in and out.There is a Tesco Metro nearby (turn left from the main hotel entrance, then turn left at the next block onto Caledonia St) as well as the previously mentioned Pret a Manger, McDonald's and Subway. There is a Boots chemist at the King's Cross station. We didn't eat at the hotel restaurant because it was more expensive.The hotel price is a good value especially considering the exchange rate. We would consider staying there again."
166,1064,"Oct 3 2007 	Decent enough that we came back	My fiancee and I booked the King's Cross Premier as the first stop on our European honeymoon. After flying in to Gatwick, it took about 45 minutes to get to King's Cross. The hotel is less than a minute from the Underground and a minute and a half from the Thameslink. The hotel itself is nothing special. Decent size rooms, comfortable beds, pleasant staff and, in comparison to other hotels in London, relatively inexpensive. The shower is a decent size, large for European standards. I have a hard time describing the neighbourhood around the hotel. There is a bar/club at the corner and being so close to the Underground and train station, some questionable locals but at no point did my fiancee or I feel scared. We walked down towards Euston and found that neighbourhood to be even more questionable. Around the hotel are a McDonald's, Starbucks and Subway. Not much to see around the hotel but being so close to the underground, there doesn't need to be.The hotel is not a 5 star venue but a decent place to stay while seeing London. We were happy enough, that we returned for a few more days at the end of our honeymoon before returning home."
167,1064,"Sep 16 2007	An all go short break	I have just returned from a long weekend in London and it was brilliant! My friend and I stayed at the Premier Lodge in Kings Cross which was lovely and comfy, clean and very affordable. The location is just 3 minutes from kings Cross station so very accessible for trains, buses and the underground. We went to see a couple of shows while we were there - on the Friday we went to see &quot;The Sound of Music&quot; and on the Saturday we went to see &quot;Phantom of the Opera&quot; both were Fantastic! We did some sight seeing of London and there is so much to see you'll be spoilt for choice. We found a little pub just off Leicester Square called &quot;The Crooked Surgeon&quot; which we classed as our local and where the atmosphere was great and the staff although they were mainly all foreign were very friendly!"
168,1064,"Sep 2 2007 	Shame about the smell	The breakfast was good, the shower was excellent and the bed was comfy. But we had to put up with the smell of nicotine from what was supposed to be a N/S room. The first one we tried was bad but on asking for another room, the second one was even worse. We were so tired after 2 days travelling that we could not be bothered to move again, so opened the window and hoped for the best. Luckily we were there for one night only. We would not go there again, although as i said, lots of other things were good."
169,1064,"Aug 29 2007 	did I stay in the same place as the rest of you?	My 13 year old daughter and I stayed here for 5 nights in August. We had a twin room on the 1st floor. Unfortunately i did not realize until we entered the room that some of their rooms are interior rooms (there is a window that does not open which looks out into the interior hotel lobby). I was very tired by the time we got into our room (about 4om that afternoon) after a long flight, and even though I had asked for early check in (we arrived at 1pm at the hotel) they said they had no rooms available. So decided to just make do.The problem with an interior room is quite frankly the air conditioing is non existent, and extremely noisey to boot. Constant on and off running at a very noisey level. It was cool in London, but the interior room was very hot at all times. With a window that could have been opened it would have been fine with no air, But we had no window to the outside.Shower was good although bathtub was a little difficult to get in and out of due to height. But bathroom door had to be kept closed or steam could set off fire alarms!! Made for a very hot steamy room, with no fan.Soap was in the form of wall dispensers.Room very very small. I had expected small room (I have been to London many times) but be aware we could not put our luggage lying down on the floor (not enough space between wall and beds) and even standing upright, with the luggage on the floor you could only just squeeze by.Area- very handy to underground, various buses, and come Nov/07 when the Eurostar moves to St. Pancreas (just next door to Kings Cross), location will be amaazing. Area itself a little seedy still, but there is a Starbucks, McD's. KFC, Pret a manger, and nice italian restaurant just across the road.Hotel restaurant- had the breakfast once- expensive but if you have a child under 15 with you they eat free, so not bad. Big buffet style breakfast with some hot food and fair range of cold choices. You can do better but if you want this kind of breakfast and you have children with you it is not a bad deal.We ate dinner twice in their restuarnt as my daughter liked their pasta, and it was a great deal (I think 3 pounds and I believe that included a dessert). Adult meals run around 8 to 12 pounds but that would be with a coupld of courses. Food Ok (not great but good enough). Service of the meal was fast but always slow getting bill.I would stay here again given the cheap price (Ithink it was 89 pounds/night) and location, BUT GET AN EXTERIOR ROOM."
170,1064,"Aug 28 2007 	great stay at premier travel inn	myself,my husband and our two boys aged 8 and 13 stayed at the premier travel inn kings cross last week for 2 nights. we travel from belfast international airport to stansted then on by train to tottenham hale to the tube which took us straight to kings cross.the hotel is immediately round the corner from the tube station so it could not have been more conveniently situated . when we arrived at the hotel we were immediately impressed by the light and airy feel of the place.the reception staff were fantastic,they made us feel very welcome and were extremely helpful and courteous.they were lovely with the children and they were given sweets and a kids activity pack,so they were well pleased by that!our room was very nice,it was a good size for the 4 of us. a massive bed for the adults and 2 smaller beds for the kids although we could all have been comfortable in the 1 big bed!the bathroom was a good size too,with everything you could need.we think probably the best thing about the hotel might be the breakfasts although everything was great so its hard to decide!breakfast was great value at 7.50 per adult with kids eating free and what a breakfast it was! there was every breakfast item under the sun and then some and all delicious and very well presented.eat as much as you like and we did!when we were leaving to come home again we had a very positive experience. our luggage was kept for us in a locked room so we could enjoy our last day in london.the only very slight criticism would be that on our last day we got a bit wet with the heavy rain that day and we could have done with somewhere to open our cases and change into some dry clothes.the staff of couse tried to help by giving us a key for the toilet but there was no room to open the cases to look for clothes.so all in all we had a great experience staying at this hotel and would thoroughly recommend it to anyone!"
