IDREVIEW,HOTELID,REVIEW
309,402,"Mar 3 2009 	What a waste of money	I was very disappointed with the Monte Carlo. We were told it was a four star...far from it. The reason we chose it was because of the pool, but the pool was closed and they didn't tell you unless you asked. They informed us we could use the Bellagio (which they made seem like it's right next door) but it's over half a mile away. The walls were sooo shallow, we heard people's TV's above us, below us, and next to us plus everyone in the halls. The beds were uncomfortable, shower head very low, and the handle to the sink came off when I put it on!"
310,402,"Mar 3 2009 	Fun Hotel with One Exception	I stayed at the Monte Carlo Hotel and Casino on March 2, 2009, with my wife, my brother and his wife. We were in town to see The Beatles Love at the Mirage. Overall I would give the Monte Carlo very positive reviews. I like the Monte Carlo because the casino is fairly small by strip standards and not so hard to find people or lengthy walks to get places. The casino was very nice, clean and very good drink service. The rooms were nice and clean. Diablos Cantina was a lot of fun during Happy Hour with crazy drink specials with the female bartender pouring wild shots while standing on the bar. My only complaint involved an incident at the Cafe and involves something that would have never happened in Vegas 15 years ago before the whole town went corporate. After we returned from the show at the Mirage we went for a quick bite to eat the Cafe before going to bed. While we were in the process of being seated the hostess had a fight with three servers right in front of our table over who was going to be our server. We waited for about 10 minutes and no one even brought water to our table or took our drink orders. If the cafe had been busy I would have understood, but it was close to 90% empty. I called over the hostess to ask if there was a problem and she said someone would be with us shortly. We waited a few more minutes and still no one came to our table to even bring us water, let along take our food order. I then complained rather sternly to the manager about what the problem was with the service. She informed me that if I did not calm down she was going to call security and have me removed. This despite the fact that we had been waiting for 15 minutes with no assurance we would get water let alone dinner. I told her this level of service was not acceptable and she told me that she would not speak to me until I calmed down. I saved her the trouble and our party just left the cafe. 15 years ago that would never have happened in Vegas and is now one of the reasons I go to Laughlin now rather than Vegas. 15 years ago that manager would have go to the kitchen themselves to get the water and probably comped our meals. But in these modern times where these corporate casinos have to squeeze every dime out of every possible source of cash in the hotels customer service has to take a hit. So instead of taking care of us, the manager was complete rude and disrepectful to me and probably cost her resturant $100 that night. In the grand scheme of things that doesn't matter to the Monte Carlo, but it demonstrates how much Las Vegas has changed and not for the better."
311,402,"Mar 3 2009 	Much better than expected	We stayed here for the Valentine's weekend. It was much better than expected after reading some of these reviews and we would stay here again forsure! We got the deal from Westjet with 2 free buffets (AMAZING!), 2 drinks and 2 spa passes. We only used the buffet. We also got $10 slot money with the package on top of the $10 for signing up for the MGM card. (The casinos in Old Vegas only give free cards or entry forms for signing up.) The fast food places were ok, but a little expensive. The room was very nice (especially compared to Stratosphere), the service was great, and the casino had very loose slots. It was the only casino I won in. I also won the free trip to Cancun that the casino in Old Vegas draws each night, but the trip was not free. It would cost over $300 in taxes and fees. We asked for a room away from the construction and we got a room on the 27th floor. We did not hear a thing, and the beds were very comfy. We saw the V-Show after getting a cheap ticket from a timeshare promo. It was good for $10 but not worth a full price ticket. If you are going to see a show, but the tix for half price on the street. Just get in line early in the morning. We also went fishing in Lake Mead with a guide and it was AMAZING! We caught 23 fish in 5 hours. It is only 30min away from the strip. The wax museum was ok, but not really worth the price of the ticket and the aquarium at Mandalay Bay was not cheap but very good.We will definately stay at the Monte Carlo again. Our stay was great! Thanks!!"
312,402,"Mar 2 2009 	Nice but could be noisy	3 Night stay at a great price.Asked for a room away from construction which they obliged by putting us away from the major City Centre construction.However we still heard construction early from building works near New York New York so ask for a high room.Room was fine,beds comfortable but the walls are very thin and if you have a neighbour with a noisy child like us and you have jet lag it can be a problem.Loved the Brew Pub downstairs- nice atmosphere and good cheap specials.Casino had a nice atmosphere.Diablo restaurant out front was a little like a conveyor belt with the staff constantly rushing you through to serve the next eaters.The construction work next door also hinders walking up and down the strip as the sidewalk was closed at times causing much crossing over the busy road and extra steps.Also what is it with the people giving out the porn cards on the street .All in I would stay again but would probably wait a while until the construction is finished."
313,402,Mar 1 2009	Great location low-key hotel in middle of action	The Monte Carlo is a great value in a great location. It is safe and clean with nice amenities. It is not as &quot;over-the-top&quot; decor-wise as other Vegas properties. The pool is lovely and suitable for both adults and children. The restaurants provide quality foods appealing to a variety of tastes. The casino is bright and cheerful with a nice range of slots and tables.
314,402,"Feb 28 2009 	Hotel Going Down Hill	Third visit to Monte Carlo in 3 years.25th Floor view of Strip. (Non smoking room)'BLOOM' promo purchased.Pros:+ Front desk staff friendly and helpful+ Clean and tidy room, good water flow in shower/bath, soft towels+ Safe, iron and board, hair dryer complimentary + Spa/gym facilities good + Outdoor pool closed, under repair. Patriots were asked to use Bellagio's poolside - nice! Cons:+ Paper thin walls offering loud, various sounds from neighboring rooms and noisy water pipes.+ Dried blood stain on linen + Smell of cigarette smoke in room was strong. It only subsided when air conditioning was put on. It's Feb!+ Amenity mini soap &amp; shampoo was not replenished in our3-day stay.+ Requested extension to check-out time, as we didn't fly until evening. A half an hour was granted, with reason that hotel was full (not true) and cleaning staff was limited (yes)."
315,402,"Feb 28 2009 	Spa Suite Worth the Upgrade	My husband and I traveled to Vegas recently for a few days away. Upon our arrival we were booked in a standard room. We had requested a King but none were available so we ended up with two double beds. At that time we also upgraded to a Spa Suite for the next two nights. The upgrade was given at a very reasonable price. It was well worth it. The suite was located on the 21st floor. It had a two person jackuzi in the room that was right by the window and overlooking the strip. The bathroom was very large as well. The only negative was we requested a late check-out and was not granted this request although we were told it wouldn't be a problem at check-in. The location of the Monte Carlo is good. It was a little farther down that we would have liked, but still within walking distant to almost everything."
316,402,"Feb 27 2009 	Great deal	Spent 2 days of rest and relaxation at the MC. Got a great special that included drinks, fitness center, and buffet all included. Room was fine nothing special. I will say that construction starts early in the morning. Really wasn't that bad I had asked a room away from the construction. I will say that I did have a good time in the casino, the cocktail remember my drink each night which is like old Vegas! Table games were not over priced even on Friday night, played Let it Ride for $5. Check out was great no wait did via TV. I would highly suggest the MC for a quick stay!"
317,402,"Feb 27 2009 	Eh - average	Stayed at the MC because rooms were comped. I would not stay otherwise. The bedding was flimsy (no comforter, just a thin scratchy blanket with some sheets (like a motel). This is my main gripe. I really like their casino (not too big, not too small), but their rooms are really not up to par with other places.I'll probably stay at other hotels in the future."
318,402,"Feb 26 2009 	Decent hotel but north end of strip is much nicer	We hadn't been to Vegas in 5 years. Went to see what was new &amp; exciting. Truth is - not much. Chose the Monte Carlo because they were offering a good Winter Special - decent weekend room rate and a few perks - free buffet, drinks at el Diablo and some other incentives. The hotel was fine - nothing special - but the construction going on around it (the Aria) was ridiculous. Trucks and banging starting at 4 a.m. Noisy!! No TV remote in our room and ill-fitting sheets, hard pillows, soft mattresses. Decent food court with a Starbucks, but the smell of smoke makes it impossible to sit and eat. We enjoyed the breakfast buffet - great selection. Worst part - their location at the south end of the strip is a dump. Vendors on every street corner and people handing out what literally is porn - cards with naked women advertising strip clubs all over the city. Glad we left the kids at home! If you're going to Vegas, stay at the Bellagio or anywhere north of it. The Wynn looked lovely."
319,402,"Feb 25 2009 	marvellous hotel	After reading some of the revues on this hotel,we were a bit concerned. But on arrival the staff were marvellous, the reception was really nice.The check in was very quick, before we knew it we were on our way to our rooms. We were on the 24th floor with views over the Strip.The rooms were quite big and nice and clean.The hotel was very central, plenty of places to eat.Lovely casino and shops. Couldn't ask for anything else.The only downfall was the building work going on next door,it didn't bother us but we found the hotel staff worked really hard to keep the place clean.Would definately stay at this hotel again.The only thing is the City Centre that they are building next door hides a lot of the view of the Strip, it is a shame really as it is a lovely hotel,but how long do you stay in your rooms in Vegas."
320,402,"Feb 25 2009 	Great time!	Went for a long weekend and had a wonderful time. Great rates and location. Right next to New York New York, so was able to go to the Irish pub and have a great time!"
321,402,"Feb 20 2009 	Great Comps	We spent a long Valentine's weekend and were very happy with the hotel and it's services. Checked in around noon and got a room immediately. Room was clean and bed comfortable. I am a smoker and did find there wasn't much ventilation to get rid of the smoke. Window opened about 6&quot; but that didn't help much and no exhaust fan in the bathroom. Also thought the bedspreads and carpet were outdated but I didn't expect (or pay the price of) the Wynn. We had a corner room and could still hear hall noise but never heard any construction noise. Shower was amazing. The location is convenient with MGM and New York, New York within close walking distance. Also nice to have Walgreen's and CVS within a block for those forgotten items. Food at the Cafe and the Buffet were both very good. We found casino staff to be very friendly and comps from their Players Club were amazing. All of our food charges were comped ($150+) which was a surprise since we are not big gamblers. We will definitely stay at Monte Carlo again."
322,402,"Feb 16 2009 	Perfect Getaway	My boyfriend and I stayed at the MC for the long weekend and we enjoyed it. Check in was a breeze and they gave us a room on a high floor. Not too many people checking in earlier in the afternoon was nice. The room was nice, it was a room with a connecting door but we hardly noticed. Only on one of the three nights we were there did we hear neighbors. View out the windows wasn't the greatest- it was on the construction, but we saw gorgeous sunsets all three nights. No fitted sheets on the beds, but I think that is common in most hotels on the strip. Location was perfect, we walked everywhere we went, never even thought to use the car. Casino didn't have as much traffic as the others so that was nice. Buffet brunch in the morning was great, had a lot of food and great selections. Free margaritas at Diablo's were welcomed and tasty, but when we wanted to eat at 10:30pm on a Sunday night, there kitchen was already closed so we had to go next door to the NYNY. No complaints about the room or anything like that, it was a great location, price, and room for the romantic getaway we were looking for!"
323,402,"Feb 16 2009 	Monte Carlo Just Fine (if you aren't picky and expecting the Wynn or Bellagio)	We (boyfriend &amp; I) stayed at the Monte Carlo Feb 12-15th for a Valentine's getaway. Check-in was quick, we asked to be located away from the construction going on next door and they happily obliged. The room was standard and fine for us - clean and nice enough. Noise - We did hear construction the first night (a few bangs like they were moving steel) at about 4 am so it probably was very loud if you were on the construction side of the hotel but that was all we heard in 3 nights. We heard our neighbors once but then they were either quiet or never in their room...if you had noisy ones I suppose that could have been a problem but we were lucky. Casino - The casino is a little smokier than others but also a little quieter which was okay with me (we just went to the other hotels... we don't gamble much, maybe 2 hours total the whole trip).Food - We ate at the food court for breakfast the first morning and it was standard Starbucks (yes the prices are a little higher but what do you expect, if you want the cheaper prices you have to leave the hotel and go across the street to that food court - we were willing to pay a couple bucks more for the convenience). The second morning we went to the cafe...the &quot;Ultimate Oatmeal&quot; is good and huge enough for 2 people to easily share (maybe even 3 people) so we both ate for under $12. We had a free buffet and used it for dinner...not impressed with that. The food wasn't BAD but it also wasn't great or exciting (kind of like a college cafeteria level of food instead of a resort buffet level). If you had to pay for it, it wouldn't be worth it...go elsewhere. The pool was closed until March but they told us we can go next door to the Bellagio and use their pool/hot tub (for free). Check out was easy. Housekeeping was nice and I thought they did a fine job. Location is excellent (I was bummed that the tram to the Bellagio is gone because now you have to walk past all the construction to get there but it's still a good location) . Don't expect the Mirage, Bellagio or Wynn - type luxury here, I certainly wouldn't call it Motel 6...it's more a Holiday Inn/Doubletree level hotel. We thought it was a reasonable price, in a good location and a decent hotel."
324,402,"Feb 16 2009 	This place is a dump!!!!!!!!	Sink clogged, wallpaper falling off, bathroom filthy, floors dirty, Sheets dirty. What more can I say. This place sucks now. I stayed here a few years ago and it was ok. Now its way worse that a $39 old town hotel."
325,402,Feb 15 2009 	Dirty Room	First day at the hotel - had to asked for the sheets to be change - sheets was dirty. The wornout mattress - was very uncomfortable to sleep on. Had to asked for the floors to be clean. Deluxe Double Rooms &amp; bath is a standard Motel 6 decor. I felt the rooms was overpriced because no extravagant decors - standard 2 star hotel decor.
326,402,Feb 14 2009 	Great Location - Low end hotel	The Montecarlo is in a great location but the hotel is so-so. Beds do not have fitted sheets so you end up sleeping directly on the mattress which is not really hygienic.
327,402,"Feb 14 2009 	It was fine for the very discounted rate	We got a &quot;Monaco Suite&quot; package for only $89 per night and we got our money's worth, but I wouldn't pay over $100.00 for the suite.Check-in was rather slow. I counted 15 people in line and only 2 stations open. No indication of where to line up, everyone just sort of bunches up and tries to figure it out.The room was HUGE, and had 2 bathrooms. The very small closet was as far from the main bathroom as it could be. There was a jetted tub that had a shower head above it, but not so much as a single grab bar to hold as I crawled in and out over the high sides of the tub. And I am not short. Huge toilet closet which was a waste of space and easily could have accomodated a shower.Soap dish was not cleaned out while we were there. The first day our towels smelled very scorched, but the 2nd day were replaced with better smelling ones. Toiletries were simple and nice.Old bananas in the refrigerator and a call to housekeeping resulted in only an empty promise to remove them. We tossed them out into the hallway 7 hours after calling (didn't want to stink up our room) when we wanted to use the fridge and someone did manage to pick them up by morning.The bed was comfortable and the construction noise did not bother us at all, but we are very sound sleepers. We did hear the phone ringing next door a few times.Internet service is wired only and costs $15 per day. Very strange, but the connection is by the television and quite far away from the desk. No informational magazines anywhere to be found in the room. That was a first for Vegas.The casino was nice, the dealers were great, but we could not get water from the waitresses. Food at the buffet was very good. Diablos was a fun place and the food above average. The free margarita was &quot;ok&quot; but hey, it was free.I'd stay there again if it was cheap. Location is good, it was easy to walk everywhere we wanted to go and CVS pharmacy is right outside for anything forgotten."
328,402,"Feb 11 2009 	Nice Time at the Monte Carlo!	Stayed at the Monte Carlo from Feb 6 to Feb 10, 2009. Nothing but praise for the hotel staff who seem to go out of there way to greet you and make sure everything is okay. Before we left home we asked our rep at WestJet vacations to put a note on our file requesting an upper level room away from the construction next door and we got just that - room 30310 with a lovely view of mountains. Make sure you are not on the construction side of the hotel or you WILL be disturbed by the noise.Our room was a nice size, clean and the maid accomodating - asked for a feather pillow and got it right away - our towels were fluffy and clean and plentiful - the bathroom spotless.Tried the buffet for breakfast and dinner - really good quality food - execellent service - chefs and wait staff very friendly.Casino area smells nice and they try to eliminate the smoke - better than a lot of the other casinos. The music was loud at times in some areas. Waitresses always nearby and happy to serve you. Had some good luck on the Monopoly game and then some bad luck....&lt;smile&gt;.The food court offers some of your favourites, Subway, Starbucks, McDonalds, Sbarro, etc. but for value - you can't beat the buffet.Yes, the Monte Carlo is dated, and there is noisy construction zone next door, but for sheer value you can't beat it. So don't be afraid to give the old girl a try.(Be advised that the Lance Burton Magic show and the Micro Brewery Pub are both closed on Sundays and Mondays.)"
329,402,"Feb 10 2009 	Wonderful stay at the Monte Carlo	I took my husband to Las Vegas for his 40th Birthday. Since it was his first time to Vegas (my 3rd visit to Vegas, but never stayed at the Monte Carlo) I wanted everything to be perfect. I was very worried after reading the reviews and I had already booked and payed for our stay (with not enough time to change our accommodations). We stayed at the Monte Carlo Feb. 5th-9th 2009 in room 9103 and everything was wonderful! We did ask for a room away from the construction going on next to the MC. The rooms are simple and very clean. No coffee in the room, but there is a Starbucks in the MC. The food court in the MC is very convenient for breakfast, lunch on the go, or late night snack . Checking in and out was fast. The location is great. All of the staff were very nice and never rude. We enjoyed our stay so much at the MC, we will be returning this summer."
330,402,"Feb 4 2009 	very nice hotel	I am staying at the monte carlo as we speak and I am quite pleased. My only advise would be to ask for a room on the south side to avoid the construction noise. There is a large hotel going up right next door. There was still some residual noise and the only way to avoid it would be to stay at the luxor or Mandalay Bay which are much further south. Nice clean hotel though, no complaints..."
331,402,"Feb 3 2009 	Exceeded My Expectations	Due to numerous negative posts about the Monte Carlo I had set my expectations fairly low. However, I was very pleasantly surprised at my stay. The check-in was quick, friendly and accurate, and all the perks of the package I reserved were noted and offered.The room was very, very nice and the bathroom was roomy. Everything was clean and fresh in appearance and smell. The housekeeping staff restocked and refreshed the room very well each day.Yes, there is construction next door and they do work 24 hours a day. But I was never bothered by any noise whatsoever. Occassional banging or a horn were insignificant and would never prevent me from sleeping comfortably. I've got to assume it was more quiet and less bright than the flash of the Strip, had my room faced that direction.I will admit the walls are very thin and a noisy neighbor &quot;could&quot; be a problem very easily. I was fortunate that my neighbors were quiet so no problem there.The food was good at the restaurants and buffet, and even the food court would be great for someone who just wants to spend a couple bucks on food or a soda (even the McDonalds had a few items for $1).Didn't do terribly well on the slots at Monte Carlo, compared to other casinos, but that's Lady Luck, not the establishment so much.Checkout was efficient and accurate.All in all, I would definitely stay at Monte Carlo again. Previous negative reports are helpful but remember that some people only see the bad side of everything. There is definitely very little &quot;bad&quot; about the Monte Carlo so don't be afraid at all."
1,404,Nov 5 2008 	Drug needles under the bed!!!!!!!!	This motel is absolutely terrible. There was a Drug syringe left under the bed and all they could say about that was that it was a &quot;budget&quot; motel what did we expect?. We switched rooms and the new room had a dirty toilet. All this and they charge you extra for WIFI Bad customer service and no cleanliness makes this one of the worst rooms we've ever had the misfortune to visit. Avoid at all costs. (seriously stay in your car if you have to).
2,404,"Mar 26 2007 	This place stinks - literally!!!	We requested a non-smoking room. What a joke, the room was labeled non-smoking, there were ash trays in it and it stank so badly I had a raw throat and stuffy nose by early morning. If there had been another choice I would gladly have paid for another room elsewhere. It was filthy. The lady in the office was very pleasant and helpful but I didn't complain about the room so I don't know if complaining would have changed her attitude or not. I would definitely never stay there again nor would I recommend this place to my worst enemy."
3,404,"Feb 7 2007 	Rather Sleep In A Cardboard Box	My wife and I were going to stay here for the night, on our way to my brother's house. It took the rude woman at the desk several minutes to notice us, and looked like she had NO IDEA WHATSOEVER what she was doing. We got to our room, and it felt, sounded, and smelled like a thousand rats were living in the walls and floor. The sheets were stained with bodily waste and cigarette burns, and whether you believe me or not, I even found a pistol under the bed. VERY SEEDY! Due to the horrible state of the bed, (bedbugs and loose springs), I was up until midnight, so I looked out the window, and while I am not sure, I could have sworn I saw people making drug deals in the parking lot! Like I said, VERY SEEDY. Give it a miss."
4,404,"Aug 20 2006	Yuck! Double Yuck!	If you like feeling like you're sleeping in an ashtray (in what was supposed to be a non-smoking room), being bitten by bed bugs, and wondering if you're going to wake up with your belongings and self unharmed, then this is the place for you, otherwise, stay clear. BY FAR THE WORST HOTEL/MOTEL I HAVE EVER STAYED IN! My husband says we would have been better off sleeping in the middle of Las Vegas Blvd. than this joint."
