IDREVIEW,HOTELID,REVIEW
22,721,"Jan 1 2009 	Quiet Street Convenient Good Value	We had a very enjoyable week in London from Christmas to New Years, and the Enterprise Hotel was a wonderful place to rest at the end of each day. After a day of walking, sightseeing, museums, etc., a quiet place to relax and reflect on the day was very nice. This hotel is very convenient for London travelers. Only 250 meters/yards from the Earl's Court tube station (District and Piccadilly lines - easy access to Heathrow), no long walk with luggage is required. There are many places to eat nearby (Lebanese, Chinese, Halal, Japanese, Italian, plus fast food options KFC, Burger King, McDonalds, Starbucks, a couple Cornish pasty shops) and a few neighborhood convenience stores including Sainsbury's (cheap groceries). Pubs, ATM's, internet cafes and laundry - these are all within a 5 minute walk of the hotel.The twin room we had was very small but clean. The water pressure was good, but the shower drain was slow. Free tea and instant coffee, electric teapot were provided. There are phones in the room which we used to call home (USA) and London - be aware of the charges, though they are not unreasonable. The staff was friendly and polite. The hotel is on a quiet little side street with a couple similar hotels - no road noise. If you are looking for a good place to rest after enjoying the day in London, the Enterprise is a good choice for the budget traveler."
23,721,"Dec 16 2008 	Consistently Good	This is my 3rd or 4th stay at the Enterprise. It's in a very good location just a half block from the Earls Court tube stop, and on the Piccadilly Line that comes in from Heathrow Airport and the District line that runs to central London. It's location is easy in and out of the city. The Earls Court area is a great place to stay, close enough to be just about anywhere in London in 15 minutes by underground, but far enough away from the City Center to keep the prices down. Don't book the Hotel Directly, even the front desk staff recommend booking through a travel site like Expedia. I was able to get a 5 day, average rate of under $100 per night! The Hotel is clean, fairly modern, well appointed. The rooms are the typical small London hotel rooms, but if all you are doing is sleeping there, who cares! It's also a good place to stay if you Pub Crawl as the entire front of the hotel is lit with a purple light at night, making is VERY easy to find.The staff is very friendly and helpful and the hotel is in a good area so walking around at night has never been a problem. There is internet access for a fee (15 for 12 hours of use) not a bad price for London, but it's very slow. Showers are small, and water pressure on upper floors is a bit weak, but again I've found that's typical for most 2 &amp; 3 star hotels in London.There is a restaurant in the hotel, it's OK for breakfast, but nothing special for dinner. The bar is good as well, if you don't want to go out, there's a big screen TV that always has a football or rugby match on. Within a short (1-2 minute walk) there are 4 great pubs, and a couple of pretty good restaurants so there's no need to stay in.I HIGHLY recommend the &quot;Blackbird Pub&quot; just a half block up Earls Court road from the tube stop. They have a great selection of meat pies. No Sweeney Todd here! The Venison (the specialty of the house) is fantastic! If you are in the mood for Italian Zizzi half a block down the street in the other direction is very nice as well, and if you get in late from Heathrow, they serve till midnight. If you are looking for a pub near the hotel, the &quot;Kings Head Pub&quot; is directly behind the hotel, and has a large selection of Beer and Ale.Overall, great value for the money. I will stay there again!"
24,721,"Nov 14 2008 	Clean friendly good location	Stayed there for 4 nights in Nov 2008. Hotel was a bit pricey compared to others nearby, but after reading the reviews about the others (dirty, insects, things not working etc) decided to give it a go.My room was very small, but I guess the norm for these type of buildings that have been converted into hotels. I knocked the TV with my shoulder, which then fell off its bracket, luckily I caught it before hitting the floor.Food in the &quot;Indian&quot; restaurant downstairs was excellent and very good value for money (try the taster plate for 9.95)Would happily return."
25,721,"Nov 13 2008 	Awesome location	If your looking for a good budget hotel in a awesome location, then this is your hotel.... If you are looking for luxury look elsewhere. This hotel is a minute walk to earls court tube station, which will bring you almost anywhere in central london. Also you can take the piccidilly line directly from heathrow airport to Earl;s cout. The rooms were small but adequate, and most importantly they were clean. The hotel does have a elevator, however it was small and since we were on the first floor hardly used it. I wouldn't recommend the breakfast, but there are many coffee shops with excellent pastries near by."
26,721,"Oct 21 2008 	Great!!	Married, 28 &amp; 31 years old. Looking for a hotel with a great, central location, CLEAN, and decent price. Enterprise was a jackpot! Located two minutes from the nearest subway which takes you pretty much anywhere you want to go in London (2 major lines Picadilly and District). The lobby was quite impressive, very stylish and great Indian restaurant in the lobby. Staff was The rooms were quite small compared to north american standards, BUT HUUUGE and very clean compared to rooms in Paris. Since we only stayed 3 nights, we did not mind. The bathroom was brand new, renovated, and very clean. Best sleep and shower I had in my 3 weeks through Europe! Would go back in a heartbeat."
27,721,"Jul 2 2008 	Very good!	It's got a good location, clean and tidy. Although the en suite was a bit small it was perfectly adequate. Staff very polite. No complaints at all."
28,721,"Jun 21 2008 	Central location	Stayed here for 4 nights based on tripadivsor reviews and was not disappointed.The hotel had a great central location with a 2 min walk to the tube station which was on the picadilly, district and circle lines.the lobby and exterior must have had a recent refurb as it definitely had a wow factor - the room was quite basic but clean and comfortable - exceptional value for London.breakfast in the hotel was also reasonably priced - we used this service on a couple of mornings.a bit of street noise at night but hard to avoid in a big city.highly recommend."
29,721,"May 31 2008 	Last Minute Deal GREAT LOCATION. NEXT TO TUBE	The reviews are so-so about this hotel, but my room was of normal size so I was quite happy. I had 5 bags of luggage and there was room...although I did have to step over them to go to the bathroom. The bathroom was the worst. There was no water pressure no warm water just HOT and COLD. We booked a double bed, but it was two twin beds pushed together so if you want to snuggle up to your sweetheart you might need to clarify a double before you get your key. The maids were awesome and very friendly. The front desk staff were so-so. One guy let us smoke out of the window in our room though, so that was nice. I can't really complain. I booked this last minute and hotels in London are so expensive...especially when you're converting from US$$. I didn't need a fancy hotel nor did I want a Budget with a shared bathroom. I found that this hotel was a good medium. My only complain was that the walls are super thin. One night a german couple were fighting for about 2 hrs. She was screaming and crying hysterically and running out of her hotel room and it scared me... it sounded like he was slapping her around or raping her or god knows what. I called the front desk and told them that there was a domestic disturbance and they called the room. They stopped for 5 minutes after the phone call, but continued after. I'm not exaggerating when I say this lasted for 2 hours. Not really the hotels fault for drunk or crazy guests. Other than that it was a really nice location to ALL of London. Earls Court Station is LESS than a 5 minute walk. It was a great location to get around all of London. There is also great great restuarants. We ate breakfast at Cafe Deli every morning&gt; They have amazing food and its cheap. Instead of getting breakfast at the hotel for 10- you can go to Cafe Deli and spend 6. There's also a lovely Indian Restuarant right by the ice cream cart.I would stay here again. I would recommend it. Just expect bad water pressure and don't let the fancy lobby fool you. The hotel rooms aren't new."
30,721,"Mar 16 2008 	Clean but small	I arrived at this hotel around 11:30 mid-day and I was supprised that they actually had my room ready. The lobby was pretty posh.After reading reviews on the hotel I was prepared for a small room, and that was indeed what was expecting my. But the room was very clean, and the bed very comfy. Even though I didn't sleep very well (which I'm sure is d-t first night alone in 2 weeks). But a must for this hotel is earplugs! The walls are very thin.The staff is also very helpful, my shower drain was blocked and was fixed the next time I had a shower. Very close (like 2-4min walk) to the sub-way at Earl's Court which can take you into the heart of London within 5-10 min. I will defently stay here again if I come back to London ;)"
31,721,"Feb 15 2008	Good value hotel	We stayed two nights at the Enterprise, and enjoyed our stay. The hotel lobby is really smart and stylish and the reception staff were helpful and friendly. Our rooms were functional - probably in need of a refurb, but clean and had everything we needed. We loved the location, really near to Earls Court tube station, and plenty of shops and bars nearby. We had a drink in the Kings Head pub round the corner and ate at the French restaurant opposite (3 courses for 10) - both venues were good. Travelling around the city from here was easy, by tube, on foot and by cab. A taxi from here to Harrods in Knightsbridge was 7. Would use this hotel again, no problems!"
32,721,Dec 24 2007	Avoid!	Would not recommend. Looks can be deceiving! I thought it was a nice place from what I could see in photos on the net. It looked nice from the lobby. Then we got to the guess floors. It is not as bad as the London Town or Premier Travel Lodge. I would avoid it you really have too. I would stay at a YHA/HI if I had to do it all over again. Thankgoodness Earl's Court provides many emenities. I love my Doner Kebabs and chips with curry sauce!
33,721,"Dec 1 2007 	Smart clean and convenient	My Mum and I stayed here three days, for a family party. The food was THE best Indian food that I have had for a long time.Our room (top floor) was quiet and we slept well every night. We had a narrow but decent bathroom with shower only. The daily maid service was excellent.I have read the other reviews of the Enterprise here, but our experience was really good. Price was average for Central London but the location (100 metres from Earls Court Station) is really convenient."
34,721,"Nov 20 2007 	Light Sleepers look elsewhere	Hotel is in a good location and convienent (3-5 minute walk) to the underground at Earls Court. Good location for a variety of dining choices, including Italian, Indian, Coffee, American fast food and pub settings. Additionally, very convienent to a grocery and pharmacy.Hotel staff was friendly enough, but not outgoing. Lobby is 1990s contemporary and includes a small bar and adjacent restaurant. Wireless internet access is available throughout the hotel in blocks of time for a charge, however in-room access was weak and troublesome; the best reception being in the lobby.Our room was a single double, clean and neat, and maid service adequate. Our view was of a brick wall, and the bed marginally comfortable. Aside from being very small, (I fully expected that) the walls are not adequately insulated and normal, &quot;inside&quot; voices from the ajacent room could be readily heard from inside our room. If you have neighbors who come and go at night, or stay up late or snore your going to hear that. Those who come a distance and suffer from jet lag or those who have trouble sleeping will not find a restful stay here. I would suggest paying the extra money for a more modern or national/international chain if sleep is critical to your enjoyment of your trip.Speaking of money, I shopped online for this hotel and certainly felt that I overpaid for what I expected. If you choose to stay here and are travelling with someone, consider one of the larger rooms. Pack your earplugs."
35,721,"Nov 8 2007 	Terrible hotel.....	My travel agent found this hotel for me. Her and I reviewed my options for price and this was one of the better looking ones from the pictures given at another hotel booking site. It looked too good to be true for the price. The pictures made the hotel look very modern and cozy. I arrived on Nov 1st 2007. As I made my way into the hotel I wasn't sure if I was in the right place. It looked nothing like the pictures online. I promptly walked to the desk to ask for my reservation. The receptionist, barely spoke English and it was hard communicating with her. I was tired from my flight and traveling on the tube, I waited for 40 minutes before she could find me in the system. I then checked in and proceeded upstairs to the 3rd floor. As I was walking other rooms that were being cleaned... my mouth dropped in awe. I was given a double occupancy room which consisted of two single beds. I was barely able to fit between the beds. The room was so small after I put down my laptop bag, my carry on and my medium sized duffel bag I literally had no more room to walk. Please keep in mind this is supposed to be a double occupancy room. After 20 minutes of unpacking I was finally settled in. I went for a shower and it took 5 minutes for the hot water to kick in. Later that day I also purchased a 4hr internet time card for my laptop. The system they use is terrible, it was barely able to load hotmail or outlook. Visiting websites was a nightmare, I used the internet to look up some hot spots for London and was unable to do so at times. Near the end of my trip I had a big issue with my internet time card, every time I logged on it told me the user name and password were being used. They had a look at it and told me to buy a new one when I had over 2 hours of usage left. After 20 minutes of arguing with the terrible receptionist she decided to give me a 1hour voucher that did not work which in turn dragged me out of the comfort of my tiny room to the lobby. I eventually bought a new time card and was able to use the internet without any hassle. The only good thing about this hotel is it's location. The receptionists had terrible attitude the whole time I was there.The one positive point with this hotel is the location. Other than that there is nothing. They will not be seeing me again."
36,721,"Nov 2 2007	Disappointed with the Enterprise	The hotel was very clean and it is in a great location. However, we booked a double room and what we actually got was two single beds, with single sheets, on wheels that were pushed together and moved apart every time one of us got on the bed! It is also good that we are not big people as there was only about a foot of space arond the beds and the shower room door hit the bed everytime it was opened- in fact we could lay in bed and open the shower room door! I have known better hotels for the price."
37,721,"Oct 6 2007 	Perfect Location and Hotel	I was a little nervous after reading some reviews about this hotel but I'm glad I stayed there anyway! My girlfriend and I are in our late 20's and we wanted a hotel that was clean, affordable, and close to everything in London. This hotel was just that! The location is right off the Earl's Court stop which makes sightseeing on your own VERY EASY! Then getting to bars, club, restaurants and shopping is also just a couple tube stops away. The staff was friendly enough for what we needed. We used the safe in the hotel and there is a computer with internet connection that we were able to print our boarding passes the next day in the lobby and the restaurant looks GREAT even though we didn't get a chance to try it. One last point is that this hotel is extremely easy to get to from Heathrow - just get on the Piccadily line and you are there! I will certainly return to this hotel, for this location the price is unbeatable!"
38,721,"Sep 11 2007 	Great location	I have stayed in quite a few hotels in London some Great some not so great! The Enterprise was ok and would probley stay again as the location was excellent.The hotel itself? Ok , the rooms are very small but very very clean housekeeping clean the rooms every day , There is no A/C so it was very warm and we kept the window open all the time, The bathroom is tiny and the shower worked but getting the right temp was a nightmare but was quite funny to hear my husband getting a cold shower!Keep your valuables with you or put in the hotel safe.Staff were not overley friendley but polite.Location, Brilliant! Just a minute away from earls court underground and we walked to the natural history museum the science museum and the VA museum, Earls court has a great atmosphere and we walked around at night visiting a few pubs feeling quite safe .So if you can put up with a small room which after all your only going to sleep in ! Its ok!"
39,721,"Sep 10 2007 	Very good.	As has been said on a previous review the rating of this place is a little lower than I suspect it should be. Although there was a little confusion over my booking it was quickly sorted out and with no fuss. Room was of a good standard, with en-suite bathroom, tea facilities, balcony, tv and all that you would expect. Though not the biggest of rooms I've ever stayed in it was very comfortable and clean. I would have no reservations in stopping here again and I reckon I probably will make it my regular London haunt."
40,721,Aug 3 2007 	Great for the price	My wife and I stayed here in the summer. The room we had was small but fine. We didn't go to London to sit in the room. Its location is great just steps from the Earls Court Tube stop which gives you easy access to London by Tube.The staff is very nice and helpful. The only issue we had was the noise. It was warm and without A/C we had the window open. The room was not hot but the noise was very loud. Lots of loud people late at night outside. Also in adjacent rooms you can hear thru the walls easily. It didn't bother me so much but my wife could not sleep. I don't know if they have rooms that do not open to the street or not but if you are anything but a heavy sleeper I would be concerned about the noise in the summer with the window open.All together we enjoyed it and for the price is a great stay just be aware of the fact the it is a small room and can be loud. But the location just a few tube stops away from central London is great.
41,721,"Mar 20 2007 	Better Than The Ratings Imply	We stayed in the Enterprise for 5 nights. I thought it was fine. Here are the good and the bad. The hotel is very close to Earl's Court tube station which has 3 lines going through it. There are lots of interesting small restaurants, pubs, handy shops, and internet cafes nearby on Earl's Court road. It's a working class neighborhood. There's a nice vibe to it. The hotel is secure and safe. I never felt uncomfortable in the neighborhood or in the hotel even late at night. Our rooms were very small, but they were clean, neat and functional. Our rooms had balconies (not all do). I liked having the balcony. The TV in the room worked properly, and the radiator worked very well. The bathroom was also small, but functional. My toiletries bag hangs, which was handy because there is littl to no shelf space in the bathroom. If you are a really large person the shower could be a bit claustrophobic. The staff was always courteous and very helpful. There is free wifi in the lobby and lounge, but it has encryption and I could never get my laptop to connect. (This is my only complaint -- other hotels have free wifi with no encryption and it is EASY to use.) There is a computer in the lobby connected to the internet, but it costs 1 pound for 15 minutes. The food in the restaurant was good, and the the wait staff was very accomodating of my kids' food requests. We would return again to this hotel. We would recommend this hotel to friends unless they specifically expect large rooms and an American style hotel."
42,721,"Feb 1 2007 	Small but functional	After reading some of the reviews I felt i had to write my own!I was really worried after reading some of the things people have said however i was pleased to see that they were not true! The Enterprise is worth the money. you get what you pay for here!The lobby of the hotel was really modern and it was clear that renovations had taken place recently. The staff on the desk were really helpful and unlike in other hotels we didnt have to wait to check in.The only available rooms when i booked were twin rooms so i took what was available. however when we arrived our room wasnt available. After realising we were a couple the manager offered us a double room at no extra cost which we gladly accepted. In no other hotel have i had this experience - a free upgrade and check in before 12!!!!Our room was quite small but was clean and perfectly functional. There was however little or no floor space and as a result i had to open my case on the bed everytime i needed to remove something (an annoying experience when you're a girl!!)I loved the fact that the key had to be used to switch the electricity on! Really quirky and eco friendly! Exactly what the world needs in 2007!On our second or third night we had a problem with out sink draining which we reported to reception as we went out for the night. The next day we left to go out and when we returned the sink had been repaired as promised! no reminder necessary.The area around Earls Court is said to be a little seedy in another review however we never encountered any evidence of this(except call girl ads in the payphones on the street!!). Like in any city, if you keep yourself to yourself late at night you'll be fine!I would recommend this hotel and will definitely return! Functional is exactly what you need in a city like London with sooooo much to see!Must Do:London eyeLondon AquariumWest End Show (Lion KIng is AMAZIN!)Places to eat nearby:Eat (brilliant italian -have the bannoffi!!)Garfunkels (like TGI's...really good food!)"
43,721,"Dec 13 2006 	Ok budget hotel young couple.	I stayed here for 3 nights with my girlfriend in a standard double room. As a Norwegian citizen (pardon my English), it was my first time in London, but I soon realized that London hotel rooms are not among the largest. The Bathroom was extremely tiny, and barely fitted one person. The room was a bit bigger, but it did still not have a lot of free space.Even though the rooms are tiny and the hallways are narrow, it was a clean and healthy hotel. The hotel met my expectations as a normal budget hotel, were the important factor is location.The only negative thing I might have to point out, except the small rooms of course, is the lack of isolation and the poor oven. These factors made the room a bit to cold, and I could easily hear what kind of language that was spoken in the hallway.If you are looking for an ok hotel room, as a base camp to explore London and excpects no further luxury, this hotel is absoluteley recommendable."
44,721,"Oct 6 2006 	What was I thinking?	I don't know why I did not read the reviews here before booking the room. Staff at the hotel helpful enough, but indifferent..I was able to leave my luggage, but wasn't able to check in until 5pm! That is just ridiculous..when I get off an intl flight I can't wait to get to my room and take a shower. Bathroom decent size by UK standards.My room was right next to the elevator--UNFORTUNATE--because every time the elevator door opened the door to my room would creak into place--I was so afraid someone was breaking in! Not the most secure doors in the world; the door didn't close completely unless you locked it with the chain. Loud bar downstairs on a Saturday night; not good if you want to get to bed early. The bed was very very uncomfortable, completely sunken in on the bottom right side. And the whole business of having to put your key into the WALL to get electricity is just BIZARRE!!!So, no I will not be staying here again."
45,721,"Aug 23 2006 	You could do better than this	The positive thing about this hotel is that it is easily accessible from the tube (and what's more there's direct connection to Heathrow from the particular tube station). But this is where the good things stop.The rooms are small, the mattresses old, the staff couldn't care less, and the whole establishement looks run down and dirty.Truth is that there IS a reconstruction thing going on, but I'm not sure it's gonna get any better by the time it's done with. Oh and although my room was on the first floor I didn't get any incovinience from the works done.Another thing: when I arrived (since I was earlier than check in time) I left my luggage at the reception, no problem there. When checking out I took my stuff to the reception and rushed to a meeting, only to find out later that THIS time I had to pay for my left luggage."
