IDREVIEW,HOTELID,REVIEW
205,363,"Sep 3 2007 	Excellent Non-Casino	This is a timeshare property that my fiance and I were asked to go visit. We got a great deal for just sitting through the 2 hour presentation. Hotel is very clean. The rooms were amazing. We stayed in a 1 bedroom suite. You have your choice of Building 1 or Building 2. One building has a plasma tv, the other has a whirlpool tub. We chose the tub.The pool was very nice, although a little crowded. The bar next to the pool was reasonably priced, with nice bartenders. The only downside is the location. You're right next door to Circus Circus which is a little run down and across the street and down a little from the Sahara.All in all, great experience and would definitely recommend the property."
206,363,"Aug 28 2007 	Good Stay at Hilton Despite Negative Feelings	This is a great resort in Vegas. I always love sharing my thoughts on Trip Advisor but I also realize that this is kind of more of a hotel sight than a &quot;resort&quot; or &quot;timeshare&quot; review sight ... but in travel these days .. they cross over .. so I'm sharing this review as a review of a hotel but recognize that I stayed there in a &quot;resort/timeshare context,&quot; This is a great place to stay. The room was beautiful. It was beautifully appointed ... sort of odd really, nothing matched and yet everything went together. The bed was so comfortable. It was just a great place for a weekend. I don't really know how this place is marketed as far as a hotel ... it really is a timeshare resort. Honestly, I don't think I would buy there .. but this site is more directed toward hotel stays so that's what i'm going to review it as. As far as a place to stay for a couple days it is absolutely wonderful. The room is beautiful, comfortable and there is almost everything you need for a few days. There is a great Marketplace which pretty much has everything you need - coffee, food, dinner, etc. albeit at a high price but if you are there for a couple days .. who cares and if you stay for a week you will probably go to the market. The pool ... Hmmmm. Nice, but it depends on what you are looking for. If you are a sun chaser like me you will have to either just have some patience or move your lounger around. There are too many palm trees so if you want sun all day you will have to keep moving. If you don't care about that then the pool is great. When I was there a child had an unfortunate incident in the pool with diarreha so the whole thing had to be shut down ... not too nice. Again, this is not really a hotel as much as a time share but I know it is available as a hotel and I would not detract from it in that regard. The rooms are beautiful and if you want a place that has almost everything it is great. The Marketplace offers everything from fruit to pizza to Starbucks to beer and you can really stay there for days without need. Some people discern because there is no casino -- but I believe this issue is not well placed. Vegas is changing. The Strip has gone from wild to family to -- now &quot;resort.&quot; This resort does not have a casino and it's not in the center of the Strip, but it is very close to Sahara - which has a Monorail connection and that can get you to wherever you need to go including gambling and restaraunts. It will cost you but this resort can provide whatever you need. Honestly, my only complaint is that there is not a lounge. Granted there is beer and wine etc. in the Marketplace and you can prepare whatever you want in your room ... but if you come in late at night and just would like to have a drink without having to buy stuff for your room ,,, there is really no option. I think they should open a little piano bar lounge where late nighter's could get a night cap."
207,363,"Aug 27 2007 	a very nice property - location is a bit remote	We own a timeshare in this property and always enjoy staying there. The location is a bit of a problem since you have to taxi everywhere, but it's not too far and there are always taxis available. It's a great place to stay with children since there is no casino and it is calm. The pool is also very family-friendly since there are a lot of children in the hotel and there isn't a &quot;scene.&quot; I would recommend it for people with kids."
208,363,"Aug 26 2007	Love this property	I have stayed in this property twice. The first time as a a romantic getaway and the second to take my grandmother to vegas. I stayed both times in the one-bed room suite. It had a full kitchen, beautiful bathroom, and hot-tub. The first time I stayed there the mattress were the biggest draw back. They were super-firm and uncomfortable. I spoke to the staff and they attempted to accomidate me with blankets and and extra comforter in order to make the mattress softer. A valient attempt.The second time though this was no longer an issue. Soft mattresses! Yeah! The location is great it is on the north side of the strip but easily accesible to the rest of the hotels via the back lanes behind the hotels. I did not feel at all slighted by not being further up on the strip. The price was incredible. Both times the price of the room was in the 150 range which easily could have been more further up on the strip.Other great amenities: pool, NICE workout facility, grocery store (mini-mart) with starbucks in basement, and concierge services. The only down fall is that it is a time share property - however being upfront and indicating that you are not interested - no problem!Great stay and will return on any future visits to Vegas."
209,363,"Aug 25 2007 	Superb Accommodations	We thoroughly enjoyed our week-long stay at the Hilton on the Strip in Vegas. The facility is fairly new and has been well kept. The bell service was terrific. They were always making sure we were taken care of, and even provided bottled water if we had to wait for a cab or shuttle. I was actually glad this Hilton did not have a casino. The lobby was nice and neat and without cigarette smoke! They do not yet have a restaurant, but we had a full kitchen in our unit and since Hilton offers free wireless internet, we were able to easily order groceries from Albertson's online and they delivered to our door. The Hilton has a small store that is open 24 hours. It is a nice convenience, however, the prices are quite high. The pool atmosphere was also enjoyable. There was plenty of seating and some of the chairs were arranged in areas away from the pool, which was much more relaxing than being right next to the pool. The pool bar offered quality food and drink and friendly service.I liked that the housekeeping service was optional. We could have our room cleaned for a fee or we could just request towels and shampoo. Housekeeping checked with us once during the week to make sure we had what we needed.The location of this Hilton is ideal, as it is about halfway between the old section (Fremont St), and the newer section, yet it is on the new strip. The shuttle from the airport was cheap - $5.95 pp, and we took the double decker bus up and down the strip for $5 per day.The hotel concierge was helpful in connecting us with a rental car through Budget. It was about $45 for the day and we drove to Hoover Dam.The only issue we had involved a garbage can that did not get emptied promptly on our floor outside of the elevators. We called two days in a row because the smell of rotten garbage was so bad. On the third day, it was finally taken care of.I would definitely stay at this Hilton again and would recommend it to others."
210,363,"Aug 23 2007 	Wonderful hotel for family	We (family of five - parents, 3 teenagers) stayed at the HGVC for two nights recently. We would loved to have stayed for longer but were on a pre-scheduled trip.The hotel was amazing. Fast and pleasant check-in. Spacious suite with large king bed and sofabed. Plenty of space in king bed for 3!!! Great value for money.The kitchen area was amazing with every convenience for preparing food. The laundry facilities were excellent and most welcome for a travelling family.The walk to the heart of the strip was indeed a bit far but after 'legging' it one night, we took the car on the second night and parked near Macy's (free). A short walk and we were in the heart of the activity.The pool area was spectacular, well maintained and whilst busy, there was no problem with noise or boisterous children. We were in tower 2 with a room that did look down on the building site accross the road. Not a problem as the suite itself was so comfortable with its two plasma tvs, dvd etc, that we did not need to constantly look out the window.We would definitely return to this hotel should we be in LV and definitely recommend it to families in particular.Europeans"
211,363,"Aug 23 2007 	Lovely hotel away from the traffic of the strip	We spent 4 nights at the HGVC Aug12-16. We were a little sceptical of the location because it is at the north end of the Las Vegas Strip, however, it really was nice to be away from that at night. We had requested adjoining rooms as there were 3 adults and 3 children in our party, which they did accomodate. The one bedroom suite, king bed has a bathtub which is in the bedroom separate from the bathroom. Each morning between 6-8 am we could hear another room's tub either filling or emptying, which obviously was very disturbing. The full kitchen was a plus. There is a supermarket on Sahara Ave where we bought cases of water and breakfast food for the suite. The market in the hotel is well stocked and not terribly overpriced. The pool was beautiful and there were always chairs available when we arrived even at 11am. There is a grill restaurant at the pool along with a bar. The staff there, and in the marketplace were always friendly. Self parking in the evening was never a problem. There is a secondary lot next to the valet parking lot which was always available and very close to the side entrance of the resort."
212,363,"Aug 11 2007 	A Grand Experience	I did not get to indulge in half of this hotels amenities during my stay, but the suite was immaculate and the service was extraordinary. I was planning a New Year's trip to Vegas, but because it's already booked, I'll plan my trip when the hotel has suites available. When ever I come back to Vegas HGV is where I'll be staying."
213,363,"Aug 9 2007 	A Great Group Outing Place	Friends and I stayed here for a bachelor party for 3 nights - all of us are over 25 so the primary purpose was a big enough place for all of us to crash in between golf, casinos, dinner, etc.Very clean, it is far from the Strip but as others have said it is quiet which makes it a godsend.Do hit the pool, the gym, the newly renovated game room, all I saw were staff running all over cleaning, sweeping, etc.I would stay here again, but it's only for a group or family, couples would be bored."
214,363,"Aug 6 2007 	Great room - easy access - very comfortable suite	I travel to Las Vegas twice a month for business. I'm tired having to walk through the Casino to my room. This was perfect. Great location ( long walk to other casinos) easy access to parking and freeway. The room was perfect. Large one bedroom with a FULL kitchen including dishwasher and laundry. There is no restaurant but the Market place is perfect for picking up a quick bite or groceries to make in your room. The pool has a bar and grill perfect for the after work meal. Has the best gym I have seen in ANY hotel. also has a game room with couches and large screen TV. The pool was not too crowded and had at least 4 lifeguards. great spot for singles, couples, and family's. Its my new home away from home.If you want GLAM and service stick to the &quot;fancy&quot; hotels."
215,363,"Aug 4 2007 	Great Hotel 	Great Hotel &amp; Best for Non GamblerThis was the first time we visited Las Vegas for fun. We chose H.G. V. Club because of the excellent reviews on this forum.Hilton Grand Vacation Club on the Strip was a great! hotel. There is no noisy Casino onsite, which we loved the most. If we needed some action we went to Las Vegas Strip to play and come back our quiet hotel room to sleep. Using the bus was the best way to get around Las Vegas. The bus stop was in front of the Hilton and it was just $5 for an all day (24hrs) pass. Nice clean room with a small kitchen and a comfortable bed. We didnt cook anything while we were staying but it was equipped with Microwave &amp; Toaster in the room, which was very convenient for us to make breakfast every morning.The pool area was very crowd in the afternoon but we could still find a lounge chair or two. There is a small market in the basement; you could get basic foods &amp; supplies from there including Beer/Wine. I understand some people said it was over $8 for a submarine sandwich at the small market downstairs is too pricy, because you could get a nice big juicy hamburger at the Mall Restaurant with service for less.There was one negative aspect; once you checked-out, the Bell-desk could keep our luggage in the storage room until you leave the hotel but there was no courtesy room for late flight guests at the Hilton G. Vac. Club. So you would have to use the Toilet to change if you could not get late check-out.I could give the Hilton G. Vac Club at least B+ grade. If Hilton has a courtesy room for late flight guests, I would give a straight A for them. Excellent staffs &amp; great location.I will recommend this hotel for anyone."
216,363,"Aug 3 2007 	poor location/serviced	We just returned from a stay in Las Vegas. We stayed at the Hilton Grand Vacation Club in a 2 bedroom suite complete with kitchen and master bath. The rooms were very nice but the location is at the far end of the old Las Vegas Strip. There was no security outside the hotel so you could not walk to nearby Casinos, there were drunks out on the street and poor lighting and at least 2 blocks to next casino. This is a huge hotel but it has no restaurants or gambling. There were no transportation except cab to other hotels where you could get meals. This hotel would be good for a family if only they has 2 bed rooms. Rooms are only available with one king bed so if you have kids too bad. Also they are doing construction next to the hotel that starts at 6 am. I asked for a room facing away from construction"
217,363,"Jul 31 2007 	Great hotel	Simply excellent. The person before me was correct. The bell persons were not helpful when I arrived, they just watched me carry my bags in. No problem and no tip. They were 10 times better when I left and yes the were tipped. We arrived in th middle of the week and started off with an upgrade to a 2 bed room suite. The kitchen and everything was clean, very happy. You must ask for the pool view in tower one. Tower 2 only has 2 views the strip, how many times can you look at neon lights over 5 days? The second view was of ongoing construction of new parking and hotels. The pool was excellent and friendly service. It's a real family atmosphere. Nice slow and easy. No wild girls like the other fast pace gambling hotels. You must rent a car period. If not, It will be like you are in the walkathon. It may be 2 or 3 blocks to get some other foods or see hotels , but these are long hot July Vegas blocks. The Double Duce bus was always packed and it looked very hot. Not a pleasant sight in July. The freedom of jumping in your rental was great. I was able to run up to any other hotel anytime I wanted to see the other sights and restaurants. The massages like everyhing were expensive, I picked the free work out room and pool. No real restaurant on site. They have a place called the market &quot; very clean and nice&quot;. Since you have a refirerator and micorwave,stove etc.. You can buy milk,cereal, sandwiches and other fun foods. Think of a high class 7-11 store with the food precooked under a light. If you really need hot cooked food go outside to the pool hostess. They have a short order cook for fast items such as hot dogs,hamburgers. Try the eggs and bacon in the a.m. with the fruit. Again a very limited menu and only if you are at the pool area. My special tip for anyone, you must get a rental car. We drove down to the Hoover Dam only 50 minutes. The hotel desk will give you the directions. We drove out to Red Rock park to see the wonderful mountain view you will see from you hotel room in tower one &quot;&quot; pool side '''. 45 minutes. After spending a lot of money on the strip for subway and other common names. It was much cheaper off the strip to feed your family. Ride up Sahara Ave down from the hotel in the day time to get a feeling of the area then use the map from the rent a car company to map out locations. Enjoy your trip to VEGAS........"
218,363,"Jul 23 2007 	King Studio OK Valet Needs Work	At the last minute, my husband and I decided to head to Vegas for the weekend for our anniversary. Rooms at the big hotels were over $400 per night since it was the weekend and last minute. We decided to go with the King Studio for $149 at the Hilton Grand. Since reviews were great, decided to give it a try.Well, I guess I'm writing this from the point of view of the King Studio. The other reviews seem to be on the suites or condos. Our room had typical Hilton amenities but nothing above and beyond for Vegas. When we got to the hotel, it was about 1 am and we had rented a car from Hertz (hint... to avoid long lines, sign up for express membership). Pulling up, the valet saw us but never came to service us. I went inside to check in and 10 minutes later, my husband finally came in after getting someone to park the car. The gentleman at the front desk was friendly enough. We had called ahead to have a crib set up in our room and when we checked in, he confirmed the crib was in the room. We got our King Studio room and when we opened the door, no crib and no washcloths. Our room view was supposed to be of the strip but all I saw was construction across the street (room 11009). The TV was an older 27&quot; but the mini-kitchenette was a nice addition. The floors and counters were nice and modern in the bathroom, typical Hilton touch. But everything else was basic for Vegas.For the room, we were just satisfied. Nothing stood out or had a &quot;wow&quot; factor. The disappointing part of the Hilton Grand was the valet service. After our initial experience upon arrival, we should've knew to just self park. The next day when we got up, we tried to call ahead to have our car ready. It was extremely hot and it would have been nice to have the car on with the AC going. Nobody ever answered the phone. We get downstairs and it takes over 20 minutes to get our car. That is the longest I've ever had to wait and there wasn't a huge crowd to blame it on. While we were waiting we talked to one of the guys and found out they're not supposed to accept call aheads but they sometimes do. I guess if they answer the phone... Anyway, the next day was even worse. We happened to get our car around check-out time. Wow. Talk about a back-up. It took almost an HOUR to get our car!! People were standing outside all over the place. I even heard one of the bellboys complain about it taking over an hour to get someone's car whose bags he'd been holding. They really need to learn how to prepare for busy times like that. It would've been much quicker and simpler to self-park. At MGM, parking gets hectic due to the large crowds but they have an organized system and staff that works it all out. The Hilton was highly disappointing.The positives I experienced were the Marketplace for sandwiches; Fitness room was well-equipped; and the pool area (5-6 pools)"
219,363,"Jul 15 2007 	Luxurious!	We stayed at tower 2, on the 20th floor with the strasphere view.It was so pretty at night and in the early morning sunrise time.Then units had huge windows and no other buildings werenear so you can open up curtains and have the whole view to yourself. There was this huge empty lot that was about to begin the constructionn so beware.Marketplace on the ground floor was pretty neat with star bucks.You can get decent snacks from there.The resort itself was great but it's not so conveniently located when you don't have a car. They have a monorail stop at the Sahara's across the street but it's not a good walking distance. It's about 5-10min walk and that's a killer during the day in the summer.The kitchen was very modern and it was the best!Beddings were great with extra puffy pillows and sheets smell nice &amp; clean!Oh, keep in mind that tower 2 has no jacuzzi tubs but it had a tub in the master-room."
220,363,"Jul 11 2007 	Gotta Go Relax and Have Fun!!!!	GOTTA GO. WE HAD A GREAT STAY @ THE HILTON.nice resort.This was a TIMESHARE exchange. Home Base is @ the GRANDVIEW LAS VEGAS.nice to be close to the CASINOS and Midway Game room @ the Circus Circus.The Strastrosphere was also a great stay, c-in on 7.5.07 to 77.07, used both Hilton and Strastrosphere.Hilton had the kitchen, washer-dryer, and flat screen t.v.'s.The heat was bad during our stay- OUTSIDE now!!! Insidehad a great A.C. system.HOT water from the shower was good.The children enjoyed the LARGE pool like tubWe liked our stay. if you have a chance to stay, jus' GO and STAY and enjoy.ALOHA :) :) God Bless"
221,363,"Jul 7 2007 	Found an Oasis in Las Vegas	A cab-driver told me that nowadays gambling is only rated fourth regarding profits made in Las Vegas, after hotels, shopping and dining. I have no idea if this is accurate but Las Vegas is worth a breakaway, even if you're only a casual gambler like myself.Reception was very friendly and efficient and got me into my room minutes after I had arrived after a long transatlantic flight, even though the official check-in time was two hours later. I had booked a one-bedroom suite and was very pleasantly surprised, especially by the kitchen which was better equipped than mine at home! It included a stove, oven, coffee-maker with complimentary Starbucks coffee, fridge, micro-wave, dishwasher, washing-machine and dryer and all the plates, cutlery and utensils you could ever need. Although we never cooked, it was very pleasant to be able to use the plates and glasses for snacks, brew a cup of coffee in the morning and have a huge refrigerator to store our drinks.The rest of the apartment was equally well equipped, with a huge LCD TV in the living room, DVD player, iron and board, in-room-safe, second TV in the bed-room, free and fast WLAN, large king-sized bed and a huge jacuzzi tub. The interior wasn't really of cutting edge design or extremely luxurious but pleasant enough. Also very practical is that the hotel maintains a 24h mini-market on the first floor where you can purchase cold drinks, snacks, ice-cream, Starbucks coffee, freshly made sandwiches and pizza etc.The Hilton is located at the very beginning of the strip and it's quite a walk to the fancier casinos but for my needs, the location was perfect. There's a 7-Eleven and Wal Mart in walking distance and also a Denny's restaurant which may not be a big deal for Americans but is an absolute treat for us Europeans.For a quick bout of gambling, there are three casinos very close by and frankly, to me they all look more or less the same from the inside and you'll lose your money just as quickly in any of them. But of course, the spectacular casinos located in the middle and the end of the strip must be visited as well, a cab ride costs about $10 + tip from the Hilton or one can take a bus which stops close to the hotel entrance. We usually walked in the evenings when it was a bit cooler and took the cab during the day. I've been to Las Vegas quite a few times and until now always stayed in mid-priced casino hotels like the Monaco or Aladin. For a similar price, the rooms at the Hilton are vastly more pleasant than a typical medium-range casino hotel. So if you don't need the casino atmosphere right next to you 24 hours a day and just want to spend some time shopping in the excellent Fashion mall or see a few shows than the Hilton is most highly recommended."
222,363,"Jul 2 2007 	June 22-27 2007 Great Time at the Hilton on the Vegas Strip	We stayed at the Hilton on the Las Vegas Strip from June 22-June 27th. I booked the resevations on line and took adantage of the Time Share Discount. So, for 6 days and 5 nights,it cost me $500.00. Of course, we had to sit through the time share orientation, which is high pressure and lasted 2.5 hours. But it was worth it. In addition to the discount on the room, we received a $100 gift certificate to use for entertainment. The Hilton on the Las Vegas Strip is wonderful. It is clean and well maintained. The Staff is friendly and always say hello, . We arrived on a Friday and our room was ready and clean. The Bed is comfortable and the room had a refrigerator and microwave and A DVD Player..The pool area was great, they offer drinks and food at poolside or you can eat at the small restaurant by the pool. The deli is well stocked and is priced at hotel rates. I did not find the prices to be totally high. We rented a car and found you could either valet park for $6 or self park behind the hotel for free. All of the hotels have free parking.The Hilton is on the far end of the strip and does not have gambling within it. The Sahara is down the street and within walking distance if you need to gamble.Over all, it was a nice quiet hotel and we enjoyed our stay.While we were in Vegas, we saw the David Coppefield show.I would strongly suggest that you save your money and see something else. The show was an hour and a half. During that time, Copperfield performed for about 45 minutes. The remaining time was watching Videos of himself and all of the awards that he received. Save your money and see somethingelse. It was not worth the $100.00 ticket price."
