IDREVIEW,HOTELID,REVIEW
11,619,"Oct 23 2007 	Basic Bed in London	I stayed at the Chelsea Guest House for 3 nights. My initial impression of the area was dubious as the railway station is quite lonely, however this improved once I got my bearings). The guest house is cheap - no frills - but I had a comfortable double bed and clean ensuite shower. They do not provide breakfast but there are a number of places in the immediate vicinity where you can get some, although I did not do this.Ask for a room at the back of the building as the guest house is on a busy road and the traffic noise early in the morning is quite bad."
12,619,Oct 16 2008 	Un po lontanoma a buon prezzo!
13,619,Oct 5 2008 	????????????
14,619,Sep 23 2008 	Ottimo rapporto qualita' prezzo
1,620,Jun 18 2008 	Dirty and Loud	My husband and I booked the Chelsea Lodge because it was on Arthur Frommer's recommendations and we were thoroughly dissapointed. We didn't mind that the rooms were small but we did mind that it was very filthy. There were curry stains on the wall
2,620,May 1 2008 	A solid deal...	I read about this property on BudgetTravel.com
3,620,Aug 8 2007 	The Absolute Worst Hotel Ever	After a 7 hour transatlantic flight
4,620,May 13 2007	Worst Hotel I have ever stayed in	Rooms where extremely dirty. Didn't look like they had a good clean in years. I was afraid to get into the shower as it was so discoloured. Bed had no springs
5,620,Mar 25 2007 	Dirty and Rude	My mother and I booked in here having read the reviews on TripAdvisore for seeing the Chelsea Flower Show in 2006. When we arrived we were led up a filthy stairs which smelled of smoke
6,620,Aug 3 2005	Still a good choice	As we stayed here two years ago and I was pleased with it at the time we decided to stay here again for another weekend. The hotel is still a good option if you're on a budget. The pub has gone and been replaced by a french bistro. The place still offers value for money. There are 3 buses stopping just outside the hotel and you're near Harrods within 15 minutes.	
7,620,Apr 5 2005	Value for money	We stayed here during Wimbledon two years ago and for what you pay for it you get great value. Prices include (simple) breakfast served in the pub downstairs. The pub can cause some noise on weekends.Taking the buss (there's a stop just outside the hotel) to the city centre takes about 15 minutes
8,620,Nov 3 2004	Clean + Affordable = 2 Content College Students	I was visiting London on short notice and most of the hotels that I found for good prices received terrible reviews on this website
9,620,Nov 3 2009 	Salet et moisissure		
10,620,Sep 19 2009 	Fr Sightseeing Perfekt!		
1,632,Nov 18 2009 	Good value	I staid for a week and was satisfied. The price is very good but remember that room service is extra (..for a studio apt is cost 15 pounds extra/day).
2,632,"Nov 18 2009	Amazingly good value	Stayed here for the night after a day of shopping / sightseeing/ drinking and watching Priscilla Queen of the dessert for the 4th time just love it, rather than rushing to get the train home. We were pleasantly surpirsed at how good it was for the price we paid. Now if you think about Super 8 in USA and Best Western you are not far from these, (apart form complimentary brreakfasts in USA) Situated on Northumberland Avenue, 2 minutes from Le Cage Aux Folle, River Thames, Embankment bridge/station, and close to the Sherlock Holmes pub. At the end of the road you hav eTrafalgar Square and a Tesco xpress good for grabbing a snack on the way back.Lobby area really plush but rest of areas are serviceable . The room a twin on the Mezzanine floor had 2 single beds, small flat screen TV, kitchen with dishwasher, microwave, fridge, hob and enough items to keep you going for the overnight stay, as did the bathroom. there is also a safe which was welcome!We did not sample anything here just used it to sleep but seemed to be ok for a base if you are not spending hours in your room, but why would you want to do that anyway when you are on holiday with lots of things to see. Yes we would go back it was great for what we needed."
3,632,"Nov 9 2009 	Location location	For visiting London, I have not found a better place to stay because it is 3 minutes to Trafalgar Square, 3 minutes to the Embankment underground station, 12 minutes to waterloo, 7 minutes to the theatre district, 10 to Covent Garden and surrounded by pubs and restaurants. The apartments have kitchens for breakfasts or late night snacks.BUT with the exception of the lobby, the building (corridors and units) are very basic and quite graceless.YET when we next go to London, we will try to stay there. At under $300 a night for a one bedroom unit, it is cheaper and yet more flexible than hotels in the same part of this great city."
4,632,"Nov 9 2009 	Great Location Old guest house fittings	Great location with well signed entrance and good looking lobby with one laptop giving free internet .Breakfast available.Rooms have dated furniture, old carpet to the floor with dirty curtains and dingy lighting.The value is in the opportunity to have mutli room price tarif which offers a kitchenette.We had a three room penthouse Hahah. Please do not book one of these if you have ltd mobility. There is a very dangerous spiral staircase and the shower room is tiny &amp; unable to open the door fully, and there is just one toilet which is downstairs(both bedrooms upstairs). The beds are made with crisp fresh bedding and we were provided with lots of clean towels.The beds were comfortable.The carpet really is not nice and I would recomend bringing house shoes or slippers.They do provide welcome bathroom pack and tea making pack and there is plenty of hot water .Plus a tesco express at the end of the street.I think this is why the reviews vary so much. The essentials are covered very well, but only if you can ignore some tatty environment and safety issues with those stairs.We would use it again , we've got 4 children and London is really expensive for us when we stay over but I wouldn't recomend friends to stay, as I think most would be very peturbed by the tired furnsihings, almost unhygeinic flooring and tiny bathroom.A good location for families or for extended stays using the kitchenette but do not expect any element of luxury."
5,632,"Oct 18 2009 	Location brilliant rooms a little jaded	A group of 3 of us stayed here in a 2 bed apartment for a long weekend at the beginning of October. The hotel has 2 major advantages namely LOCATION and (less so) value. It makes a trip to London so easy when you can walk.......to the river, Tate Modern, National Gallery , St Martin in the Fields, Covent Garden, the Eye, Westminster. It's especially nice to be so near the river. The front of house staff are fine, the beds and shower were fine, the luggage service was very easy when we left our luggage for a few hours after check out - what would make me hesitate to recommend the hotel is the jaded feel, eg the carpets in the corridors upstairs, the sofa was a bit tired, the toilet was a little on the odorous side. Also, the ceilings in the narrow corridors were low. The windows were in peculiar places in the bedrooms because of the way the interior of the building has been refitted. This might not apply to all rooms as ours was a duplex, with an internal stairs from the living area to the bedroom area. On balance, if the accommodation aspect of a break isn't the major criterion, then the location of this hotel outweighs any other factor."
6,632,"Oct 18 2009 	Good value for Central London	My husband and I only stayed here overnight for a theatre trip, but it would be very useful as a base for a longer stay, being in the middle of things. The room was functional and fairly no-frills (although there was a new LCD TV with Freeview channels, which we didn't use!), but the beds were comfortable (we had expected a double but got two singles) and the little kitchen would be very handy if you were staying longer. The room was a good size too, although the bathroom layout wasn't the best use of the space. The room was clean and modern enough. Staff at reception were ok but not especially friendly; we had no contact with other staff. Our overall impression was very good for the price in Central London, but don't expect too much."
7,632,"Oct 5 2009 	Better than expected... value for money in everyway! Loved Citadines!	On the weekend October 2nd to October 4th we (3 adults) decided to spend a weekend in London We booked in Citadines Hotel at a rate of 271 Euros (2 nights, 4 adults max) After reading the reviews, we were not really sure what to expect the final result, as you will see, was surprisingly positive! First of all, the location! The location cant be beaten! Right in the middle of everything, still in a very quiet street its like 2 minute walk from Charing Cross or Embarkment Metro Station the London eye is like 5 minutes away and so on the rest of the tourist attractions The commuting from Gatwick Express was like a breeze, going ton Gatwick to Victoria and then to Embarkment in like 45 minutes . Within 2 blocks there are plenty of supermarkets, small shops, bars, pubs, clubs, restaurants, etc Then, our room was ready upon early arrival (1030 am!) the room (820) was on the eight floor the size was perfect by all means!!! Bathroom and separate shower then a separate double room and then a quite big living room with one sofa (that converted into 2 separate twin beds), a big desk and a flat tv besides, a small kitchen the dcor was modern and practical, nothing fancy but not cold either the shower had plenty of hot water and nice pressure our room at night was not noisy at all!The place was not small at all and everything worked perfectly it was even bigger than many English flats!The convertible sofa was great because it turned into 2 separate beds, so you can place then in a 90 degrees angle the beds, sheets and pillows were comfortable everything was clean and in perfect shape The service in the front desk was practical and efficient in everyway there is free wifi in the lobby and a computer with internet free to use Upon checkout, we stored our stuff in the luggage room, as did mostly the rest of the guest, and indeed they make you sign a form that they are not responsible for your goods as it happens in every other hotel, its just that they explicitly admit it no problem at the end when claiming our bagsIn general, we were extremely happy with our choice I really believe that Citadines offers true value for your money, since in such an expensive city like London is difficult to find roomy and fairly priced accommodations. I would definitely recommend this to all my fellow travelers."
8,632,"Sep 27 2009 	Excellent Location and Value for Central London	Will try and make this as short/brief as I can as there is much to say about our recent stay at The Citadines Apart 'hotel in London Trafalgar Square.Our family (myself; my wife; and 2 teenage kids ages 16 and 18) planned our trip to London at the VERY LAST MINUTE - literally 4-5 days b4 leaving - obviously not what you normally would want to do. Especially not at the &quot;high season&quot; for tourism in London. Thus, our choices for hotels were very limited at that time. After hours and hours of searching, I stumbled upon a room/suite at The Citadines Apart 'hotel near Trafalgar Square. Had never heard of the place and wasn't overly familiar with the entire Trafalgar Square area. Having said that, the daily room price - $250 (US) was reasonable given the ridiculous prices I was being quote elsewhere and other reviews on Trip Advisor were positive overall so we took a chance and booked a room for the week we were staying (Aug 8-16th). In a nutshell, WE WERE VERY GLAD WE MADE THIS CHOICE. Let me address the 2 primary issues to be considered here - the Location and the hotel itself:1. as others have said, it's all about LOCATION, LOCATION, LOCATION. I can't imagine there being a place to stay in central London that would be more convenient than The Citadines. You are literally within 10 minutes or less walking distance to many of the major attractions:-Trafalgar Square and National Gallery (3 minutes away) - major people watching!-Big Ben (8-10 minutes)-Westminster Abbey (8-10 minutes)-Theatre District (10 minutes)-The &quot;London Eye&quot; (5 minutes)-Thames River (5 minutes)-10 Downing St (6-8 minutes)-Covent Garden (10+ minutes)-Piccadilly Circus (maybe 15 minutes; over rated btw)-Regent Street (10 minutes)In fact, Buckingham Palace was only a 20 minute walk if we had chosen to go that route. The British Museum and Library about the same distance. And walking in London can be fun. Tons to see; surprises around every corner if you watch closely; and lots of people watching. Other conveniences close by would include:-a tube and major rail station immediately around the corner (Charing Cross)-several mini-markets within 2-3 minutes walking (which we used A LOT)-a number of American fast food places (Subway; McDonalds; Burger King; Pizza Hut) for those with fussy teenage eaters also within 5 minutes or so. You get the picture. Everthing was very convenient for our traveling needs. And the area itself - particularly Trafalgar Square - feels very much like what you would expect London to feel like. You can just feel the history oozing out of this area. 2. The hotel and room itself - while not a 5 star world class accomodation - was more than acceptable for our families needs. Specifically:-Our suite (#418) consisted of a main living room with a couch bed and pull out bed and a side bedroom with a queen bed (note: and a fair amount of closet space). The rooms were not huge by any means but certainly not as tiny as some on the 'Net would have you believe and certainly &quot;livable&quot; in that regard. To be precise (yes I measured), the main room was approximately 10' x 15'; the side room was approximate 10' x 10'. Add to that a separate bathroom; separate toilet; kitchen area and a main hallway and it feels like you are living in a small apartment. Which is exactly what this place is advertised as.-The rooms were clean and functional. The Beds were comfortable and that's saying something as both my son and I are over 6 feet tall. And just as importantly, our room faced the back of the hotel (vs the main street which was faily busy) and we heard absolutely no noise at night whatsoever. Very quiet.-The Bathroom - while not huge - was more than sufficient. Very nice shower stall and tons of hot water and pressure which I know is an issue in many European hotels. Towels were sufficient and comfortable. Hair dryer worked fine. (Important to note here: they only change the towels and sheets once a week here if you're staying that long; you can pay to have it done daily (about 15 pounds) but we chose to tough it out).-the modest kitchen with microwave, toaster; 'frig; utencils; etc. was extremely useful for our family - allowed us to save big $ on meals which can be very pricey in London. The only thing not provided (which you can get nearby) was paper towels. Do not underestimate the importance of having an in-room kitchen - especially if you have kids and/or teenagers. Was a major benefit to our stay at this hotel. -almost as important as the room itself, was our ability to connect to the Internet (hey - we have teenagers and the thought of being away from Facebook for more than a day was almost more than they could handle). In that regard, our room was a 10+ as the WiFi connection worked every single time with no problems at all. I was actually stunned that we were able to access the Web so easily as I had read the horror stories from others. No such problem with our room. And the speed was very acceptable.-the flat screen TV in our room - while not huge by any means (about 19 inches or so) was (again) acceptable for our needs. The reality is that your choices in London are fairly limited for TV viewing - especially if you are an American who is used to 300-400 channels on Direct TV or the Dish. And we weren't in London to watch TV so the amount of time we spent in front of the tube (no pun intended) was fairly limited.-the A/C in the room worked fantastic - almost too good - as it could actually get a bit chilly at night if we left it on. Again, I've read stories of other hotels where rooms were stuffy and hot - no such problem with our room. Very comfortable at night.-lastly, there was a trash &quot;shute&quot; (common in European hotels) immediately outside our door. Very convenient. A couple of other things to mention:There is a computer and Internet availability in the main lobby - I used this a lot (at 4-5 am) when the family was sleeping and I was answering email and writing folks at home. Connection was actually slower than the WiFi in my room. But it's available if you choose not to bring a laptop with you. The front staff - while nice and professional enough - were not overly attentive and/or seemingly concerned to the few issues I had to bring to their attention but everything got resolved in due time - albeit with a bit of pressure applied on my end. I would rate them about a 6 or 7 on a scale of 10. I would give the in house maintenance guy a 10 for the one time I had to call for his help as he was there within seconds. We (unfortunately) cannot speak to the breakfast accomodations at the hotel as we did not eat a single meal there. The room is directly off the main lobby and was nice enough. However we rarely saw more than a few people in it. The price of the breakfast - 10 pounds - may or may not have had something to do with it. We choose to stay in our room and prepare our own means given we had a kitchen. Saved lots of $.-There is a very nice looking pub - &quot;The Sherlock Holmes&quot; directly adjacent to the hotel. It's literally within 90 secons of the front door. So there's another food option. -There is also a very nice Italian restaurant also wthin 1-2 minutes of the hotel. We ate there our last night in London. Food wasn't anything to write home about - good but not great - but it's an extremely nice place if you want to go out for a dinner that won't break the bank. Kind of like an upscale CA Pizza Kitchen. OK. . . . .hopefully I've provided you with a good snapshot of this hotel. Bottom line is that we would have no qualms at all about staying there again - and our teenage kids enjoyed it as well for what that's worth. On a scale of 1-10:Location is a 10+Hotel is a solid 8-9 (assuming you have reasonable expectations)Hope that this input is useful for any of you out there looking to visit the central London area. We had a great family trip and this hotel was a critical and positive piece of that experience!"
9,632,Sep 23 2009 	Great location	We choose to stay at citadines trafalgar square having previously sayed at citadines accommodation in Paris. We were not let down. The rooms are basic but clean and the little kitchen is very handy. We didn't get the warmest welcome on arrival from the receptionist but the service we received was much better from other members of staff. The location was fantastic - Embankment tube station only a couple of mins away and there were plenty of ameneties close by.
10,632,"Sep 19 2009 	Keep away from this hotel - you things are not safety and may be stolen !	We were very disappointed by this hotel. Our laptop computer was stolen from the luggage room of the hotel. The hotel stuff and management made them not relevant for this accident and behaved as if it is some negligible youth-hostel, and not the member of the world-wide hotels network. We never met such relation to the customers before!So don't be misled by the visible things - the very central location, reasonable price versus value etc. - in the end you are not safety in this hotel. You things may be stolen and nobody will take responsibility on your troubles."
11,632,"Sep 15 2009 	Great Location but Accomodation could be improved	A group of five of us stayed at the Citadenes Hotel Trafalgar square for 4 nights in August 2009. The location is fantastic, a few minutes from Trafalgar Square, the Covent Garden, the London Eye and all main London attractions etc.Two of our group shared a studio apartment for two adults and three of us had a one bedroom apartment for three (two adults and one teenager).The studio apartment for two adults had a bathroom (small and very high sided three quarter length bath/shower to get into), a well appointed separate kitchen, and a main living room lounge with pull out sofa bed for two. The one bedroom apartment however, had a bathroom (same small bath/shower with high side to climb over and into), a separate bedroom with double bed, and a living area with sofa /pull-out bed. There was no kitchen in this apartment, when opening what looked like wardrobe doors in the main living area, there was found a kitchen area. The master electricity switch for this kitchen area was behind the pull out doors and was initially overlooked being hard to find. The kitchen units were clean but shabby with chipped edges. The cleanliness in the bathroom was much to be desired, human hair on the tiles and mirror as though an old rag had been used to wipe over, (possibly a previous occupants bath towel). Also, this room overlooked the back of the hotel and was quite noisy at nightime. The studio apartment, very clean kitchen and bathroom, had a front of hotel room view overlooking Northumberland Avenue, this was a much nicer apartment. We did not however have time to keep putting the sofa bed up and down, so left it up, so may as well have been staying in a normal double hotel bedroom with a real bed as opposed to a pull down sofa bed. The first night, my alarm clock fell under the bed, and I found a load of broken glass underneath the sofa bed itself while trying to retrieve it.When I booked these two apartments several months in advance, I knew I was booking rooms with sofa beds and kitchen facilities so that savings could be made on eating breakfasts etc., however, it was not immediately clear that rooms are not cleaned unless requested and paid for as an extra. Beds are not made, bedding not changed, towels not changed and rubbish is not removed. This is acceptable for a one or two night stay. But, after four days, we would have appreciated at least our rubbish bins emptied.Another thing to mention. On early arrival at this hotel, our room was not ready, ok we knew it would not be ready, we were early. The reception staff greeted us warmly and told us we could leave our luggage securely with them in a locked and secure area behind reception, and we were pleased and grateful for this. However  on vacating our rooms on the day of departure, we needed to leave our luggage for a few hours that morning before our transfers arrived to collect us. We were told that there we would have to sign a responsibility waiver form as our belongings could only be left in two left luggage rooms where the keys are given freely to anyone seemingly using this facility. This was actually quite alarming. There are two small damp cupboard rooms where luggage can be left, but the keys to both rooms are given to anyone requesting them. Both rooms had broken locks with handles which came off when opening and closing the doors. It was a case of you are no longer residents here; its up entirely up to you if you risk leaving your belongings here because we dont care now you are going! Very disappointing after having spent a large amount of money staying at this hotel.The price we paid, being the height of season was not cheap. It is about the same as a hotel room which includes room service (rooms cleaned, beds made etc). The advantage is that you have kitchen and fridge facilities. I would stay here again - as I now know what to expect, and as mentioned, the location is fantastic for London and sightseeing."
12,632,"Sep 15 2009 	disappointing	Very small, cold and noisy room. Honestly with there are many cheaper and better places in London."
13,632,Sep 14 2009 	perfect	It had a great location. staff were friendley and rooms were clean. had a great time in London a lot of attractions were in walking distance.The bus tour was good got to see a lot more than we would of by tube.Was worried about getting to hotel from Heathrow but found a great taxi company{london Executive Chauffeurs} were there on time and good price. Took us door to door. Worth trying this hotel if you want somewhere central.
