IDREVIEW,HOTELID,REVIEW
107,2234,"Jan 4 2006 	Shanghai landmark worth staying	This is an absolute must see destination in Shanghai - even if you are not staying in this hotel. Even the high price of rooms Grand Hyatt should not put you off when considering hotels in Shanghai. For a day or two at least. I stayed at the Executive Floor (Grand Club) - on the topmost floors with its own check in facilities. I do not think that the views or services differ very much if you decide to stay a couple floors down in a standard room. The room was absolutely great and the views even better. My room was so high up that clowds prevented the view over to the city most of the time. However even walking next to the floor-to-ceiling windows makes those ones of us who are afraid of high places shiver. Centre of Shanghai and especially Pudong side of the city resembles Gotham City (from Batman, the movie) and the Jin Mao Tower where this hotel is located is a star reminder of that. The small details in rooms are great: heated mirrors that do not fog when you take a shower, lights that switch automatically on when you walk to the room etc etc. They have really paid attention even to the smallest of details at this hotel. Location: As Grand Hyatt is located at Pudong side of the city it is in a somewhat awkward location. Jin Mao Tower is surrounded on all sides by broad motorways and crossing these is next to impossible by foot. There is an underground station some 500 metres from the hotel but getting there is a problem as crossing the streets take ages - and is dangerous. So you should rely on taxis and take into account that getting to the otherside of the Pearl River may take even 1-2 hours at peak times. Despite of the seemingly short distance.I prefer outdoor pools which this hotel does not provide. However the indoor pool at Grand Hyatt and the excerise rooms were absolutely superb.Remember that even as a guest at this hotel you are constantly overlooked. Elevators, corridors and all other public areas are constantly monitored and if you actions apper suspicious to the overlookers you will immediately get a voice responce. I once tried to get to the opmost floor restaurant which was not open at that time and immediately after pressing the elevator button I got a voice responce from the &quot;overlookers&quot;: &quot;Sir.. may I help you... the restaurant is open only in the evening...&quot; You'll see cameras all over the cenre of Shanghai taking a good look of your actions. Shopingwise, there is no better place than Shanghai. So leave a lot of room in you luggage for all the things you end up buying!"
108,2234,"Dec 3 2005	A must visit destination	Location: Its at a convenient point at Pudong: a short stroll to the Superbrand Mall and the Oriental Pearl TV tower. The St Regis is way up further but the Shangri-La is closer to the river (for postcard view of the Bund). If location is paramount, the Portman Ritz is next to Plaza 66 for luxury shopping and JW Marriott is in the centre of Nan Jing Road (between Ritz and Westin).Dcor/Design: If you are overwhelmed by the Peninsula Hong Kong or most Ritz Carltons and rate highly on their dcor, then the Grand Hyatt would slightly disappoint you. As a modern architect, I would prefer a modern design with a respect to the history/local culture, so you feel the essence of a particular country but still on the right track of time. Grand Hyatt embodies this concept. It is not as minimalist as Park Hyatt Tokyo, but not as culturally-infused as the old Mandarin Oriental Hong Kong (now being refurb). Hyatt incorporates the golden day of Shanghais art deco style with modern Chinese; and the result is excellent. Even the building (Jin Mao Tower) by top US firm SOM is truly breathtaking, one of my all time favorite buildings!. It even impresses my old-fashioned mother!Lobby/Public space: Although large (500 plus rooms), Grand Hyatt is surprisingly small inside, it almost feel boutique. You have to change 2 lift banks from ground to lobby; and to your room. In between is the lobby with double story lounge area and breathtaking bund view, which can be overcrowded in the afternoon with tourists taking photos or tour groups flocking the lobby.The much publicized 30 storey atrium is smaller in reality, but still awe-inspiring. There is a lobby lounge on its base with no view so unless you have a good conversation, staring at the atrium could be boring and dizzying after a while.Rooms: Opt for the Grand Bund View room for an extra! The view is truly impressive with views directly to the Oriental TV tower, aerial view of Bund and Shanghais skyline. Be careful when choosing room, as the buildings design is tapering to the top, so some rooms can be smaller than the other; rooms on the corner side are larger (still standard room) than in the middle. Standard room is 40m2, but my gold passport room at Level 71 is much much larger as it sits on the corner. What you see in the brochure is exactly what you get. The bed headboard is adorned with Ming dynasty poet, which is quite special. The window is from floor to ceiling with a lot of horizontal frames in between which might obstruct looking at the view. There is no sofa, but a relaxing chair with ottoman. In the brochure it was said there are wireless keyboard to connect to TV, but in reality this service has been cancelled, I guess some of the mainland clients must have took it home. Bathroom supposes to be big, but the layout makes them feel smaller. I particularly dislike the flimsy glass door for the WC, I mean how does it work with the acoustic (remember hot shanghai food)??. But the amenities are nicely packed as a souvenir. Noise: My room shares a wall with the lift shaft, but we could hardly hear anything!. In fact the only noise we encountered is a constant yelling from a mainland customer next door, which is very annoying!. I hope its not how they talk because I swear it feels like a battle ground.Food: Didnt try the buffet there, but the Cloud nine has fantastic view. The food court (by Hyatt) on the basement should be avoided.Facilities: Swimming pool has views over Shanghai, which is fantastic.Service: Polite, efficient and personal. You were whisked directly to your room by one of the receptionist where he introduces the room. But on one visit to the business centre, one of the lady there did not understand what is a brochure / catalogue that I simply gave up.Overall, a must see destination. The layout and sky location is similar to the JW Marriott but for me Hyatt reigns supreme. If budget is not an issue, opt for Grand Deluxe Bund view with 180 degree view of Shanghai."
109,2234,"Nov 15 2005	Spectacular Grande Hyatt	One of the most beautiful hotels we've ever stayed in, with service to match.Because of the height (hotel occupies from floor 54 through 85) the views from our room, public rooms, all restaurants and bar, are simply breathtaking. Food at breakfast, and at two of three restaurants, the best we had in the city. Spa was also terrific--I had two Oriental massages, a facial and a manicure. Decor (art deco) stylish but inviting. Unlike many of the other 5 star hotels (which we visited--Ritz, JC Mandarin, Shangri-La, with cavernous lobbies), the Hyatt feels more personal and warmer. Concierge desk competent and charming. The location is not the negative as billed. Shanghai is enormous, and spread out--and not really a walking city like many in Europe. So to go anywhere, you must take a taxi, which is very cheap. It is worth an extra few minutes in a taxi to stay at this first class hotel."
110,2234,"Nov 10 2005	Make sure you know what you are getting into!	The experience started of poorly. I personally wrote to the Hotel in Shanghai as suggested by reservations, inquiring about a long-term stay. A 21day stay to be exact. They quoted me a more expensive rate than the most expensive I could find on Hyatt.Almost crooked!Eventually, we change travel plans to stay only 6 nights. We only ended up staying 3 nights! Food in the Italian restaurant was fair. The service was about 2 star level. It is really a business hotel where the are very proficient at moving them &quot;In and out&quot;. They really have not interest in the qaulity of stay. The Business traveler does not have much time to spend complaining about accomadations that their Company is booking and paying. Service was poor from the Front Desk to the Atrium Bar, where we sat for 10 minutes and never were greeted/served. It might be worth a stay for 2 nightsin a &quot;Grand Deluxe Bund View Room&quot;. Free breakfast in Atrium Bar with a free Gold Passport. Sky pool and gym are to be seen. Just understand you will be run over by business people and expect 2 star service. If you can get past that you will enjoy 2 nights.5 star service with better location can be found at the JW Marriot."
111,2234,"Oct 30 2005 	Spectalular experience	Spectacular experience, what else can be said about this hotel in this great city. Ashtonishing views and architecture make this hotel a once in a lifetime experience. If you are going to Shanghai once in your life, this is the place to stay. The overall service and western food at the Cafe were very good.The only drawback is that it is located in Pudong, the new Shanghai, while most of your activities are in the other side of the river / city and a taxi is needed everytime going out. Anyhow it isn't too far or expensive and its worth it.Also definitely, try to get a room with a view to the Bund and a river view. That is a must."
112,2234,"Oct 15 2005	Deluxe bath with a view	Many reviewers mentioned the deluxe bathroom and I must just add a few words on this. Make sure you get a deluxe room with Bund view, order a botle of champagne and strawberries and enjoy the magnificent view from the bathtub."
113,2234,"Sep 30 2005 	Unrivalled Views at Hyatt Shanghai	Without a doubt this hotel is one of the most memorable I have stayed in recently. Standard rooms are a cut above the rest and the service was impeccible. Not only do the rooms command some of the best views of Shanghai, they are extremely spacious and tastefully decorated as well as good value for money. A wall of windows in the bathroom meant every time I lay back in the bath I had a spectacular view of the city shimmering below.The spa was excellent with a wide variety of treatments and the pool, on floor 57, is the highest in the world. This by no means is an average hotel and I do hope to stay here again.There are numerous restaurants in the hotel ranging from Japanese sushi, traditional Shangainese and even Italian. It's what I would expect of a Hyatt and am surprised to read some disappoiting reviews.I can't really think of any down points other than you can't buy cigars in the Grand Cafe at 3am in the morning after partying the night away in the Bund! As a 29-year-old female non smoker, I didn't really want one that much anyway!"
114,2234,"Sep 26 2005	Take away the view and it's distinctly average	Before starting this review it's worth putting my post in perspective as Iappreciate it's at odds with some of the other comments on the site.First of all I'm someone who spends every spare penny (and then some) on travel, and have had the privilege of staying in some really excellent hotels such as the Mandarin Oriental in Kuala Lumpur and the Chedi in Muscat.In fact staying at the Hyatt Shanghai made me realise just how good they were!Though I'm far from the red faced western tourist who will bellow at the &quot;natives&quot; for not serving his beer cold enough, that does mean my expectations are set fairly highly.Secondly, I was here almost a week and so was perhaps able to road test the hotel more than had I breezed in and out on a corporate expense account.However, once you take away the views from the Hyatt, which the Shanghai guide books rightly rave about, my experience was that this is not a signature five star hotel at the top of its field. Instead, I found it distinctly average.Nothing too major to spoil our break, but some significant chinks nonetheless. To take the good and not so good from various areas of the hotel:* The public areas of the hotel and the rooms are decked out in dull, business colours, which is appropriate as the Hyatt is stuffed full of suits. And the place does seem to be well kitted out for a variety of business meetings, so if you are here on company business and just staying for a night or two it will probably be fine. But, other five star hotels have much more grand and (in the case of the Westin) stylish entrances and areas.* The staff: Lots of them milling about with dark suits and ear pieces. However, here is a case of where more really does not mean more. There were plenty of people around to whisk my plate away at dinner before my wife had finished eating, but on one or two occasions there was a distinct lack of initiative shown for some of the most simple requests.* The grand club: The Hyatt, like a lot of other 5 star hotels, makes a big deal about its club floors. The staff in the club lounge were generally the most helpful in the hotel, but the breakfast served upstairs is unfortunately a pale imitation of what you get (and, true, have to pay for) downstairs in the main restaurants. Also I was surprised that the piece of paper you are given when checking in fails to communicate one of the most useful perks of staying on a club floor - free Internet access in the business centre (usually around USD3 for 15 minutes).Don't think that staying on a higher floor will give you a better view though. On floor 80 upwards you are almost too high. The views are better from reception on floor 54.* The health club: The Hyatt has a small, but fairly well equiped gym. It also has separate men's and women's jacuzzi and sauna areas and a pool. When using the pool,they make you wear a swimming cap. If that's the rule then that's fine...but I expect everyone else to do the same.Bizzarely though on my second day I took a swim and spotted a Chinese man and his two kids in the pool. The kids wore a cap, the man didn't. As a result, I figured I didn't have to either.As I mentioned, the Hyatt has plenty of people lurking about doing nothing in particular, and the pool is no exception. I was promptly asked to put my cap on. When I pointed to the man, I was told my hair was longer. Not true, my hair is generally considered pretty short!On two other occasions, Chinese men didn't bother to wear the cap and weren't questioned. Only one of them had what could be considered to be a 'buzz cut.' The impression I was left with, was that these guys were some kind of big wigs and that asking them to don swimming gear would be a major loss of face by the local staff.* The spa: I had a stone massage at the 'Oasis Spa' near the gym and my wife had Chinese foot massage. Other five star hotels in Shanghai such as the Westin and Marriott have brand name spas attached (in the case of the Westin, a Banyan Tree).The impression I got from the Hyatt is that this was added as an after thought and the practitioners were more like enthusiastic amateurs, not therapists. The guy giving me the stone massage seemed like a masseur (he didn't speak English so I couldn't ask) and tried to be pleasant, but the way he was fumbling around with the rocks didn't inspire confidence. The spa room was also right by reception with the door open, so I could clearly hear people clearing the phlegm from their throats (quite a common sound in China)!* The location: Not great. All the action happens on the other side of the river. There is a road tunnel, but if this is closed or heavily congested your 10 minute trip can become a 45 minute one. I did overhear some guys saying they were building a new bar and entertainment area nearby though.* The view: Yes, the view is great and the building is an architectural landmark. The thing is, there is nothing stopping you coming to have a coffee in the Hyatt. Actually I'd recommend it. But Shanghai really is Sci-Fi city. Anywhere high up seems to have a view.In summary then, if you at the Hyatt for a short trip or have a business meeting nearby, then the hotel is probably the place for you. If you are here for a holiday, I recommend the Westin where we tried out the Banyan Tree Spa. I didn't see the rooms, but it looks a lot nicer inside and less staff milling about managed to be a lot more friendly and helpful!"
115,2234,"Sep 2 2005	The sky is the limit	Of course, before posting my review I've read the previous comments. Well, it's really hard to me believe that some people can report a bad experience with this Hotel. I have traveled all my life long, and I've stayed at the best Hotels in the world and, trust me, It's quite impossible to find something like the Shanghai's Grand Hyatt (and I'm not particulary in love with the Hyatt). I had a Diplomatic Suite in one of the Club floors and the room was incredible, at the 79th floor, with glass walls and a view on the city like the one you can have only from an airplane. The room, like the whole hotel, is very, very elegant and confortable. The service is accurate and kind. The restaurants are a bit smokey and busy, but the food is very good. The lobby is some 40-floor high and really impressive. In one word it's a once-in-a-life experience you can't miss! The only spot is about some employees speaking very poor english.P.S.: I have found two taxi lines and the one reserved to the hotel guests had the priority."
116,2234,"Aug 31 2005	Wonderful Experience	I read some bad and good reviews of this hotel before we went to Shanghai, but we choose to stay at the Hyatt anyways. It was a lovely experience. We stayed on the 81st floor, Bund view, club room, and that made the experience both wonderful and expensive at the same time. Everyone was very kind, and the club breakfast and happy hour was great. The pool and fitness area had the same lovely views, and the restaurant, Canton, had fabulous dimsum. I would stay at this hotel again.One thing though, the Internet isn't free in the room (and they charge you for each laptop about USD$15 a day), but if you have a notebook, use the club room for free.Also, try the mooncakes! They make a great present to bring someone. They are to die for!"
117,2234,"Aug 26 2005	Flying high in Shanghai	We stayed for 5 nights at the Grand Hyatt in August 2005. The hotel is situated between floors 54 and 88 in the 'Oriental Empire State Building', the Jin Mao Tower. There is no doubt that the building is impressive, even if the area, Pudong, is rather soulless - rather like a rather rubbish 1960's sci-fi film's 'city of the future'.Our room was a Grand King and consisted of bedroom with king bed, tv in cabinet and a desk, and a lovely bathroom with large bath, walk in shower with body jets, modern sink with heated mirror and a separate toilet. The storage area was rather limited with just the one wardrobe and very few drawers. The main attraction of the room is the floor to ceiling window which, from the 80th floor, gave superb views over the Bund (you need to request this or you will be given a Pudong city view which is not as exciting). We spent many an evening wowing at the amazing vision of Shanghai at night lit up with as much neon as possible (and amusingly the room has a sign which says 'Help Shanghai to save electricity'). The room was very clean but the accessories are a bad choice, e.g. a lot of stainless steel in the bathroom suffering from water marks as soon as you used it. The tv had a good number of channels but the air conditioning was not good, we were very warm at night (and I am never warm!)The staff in the hotel were courteous but a little stuffy at times. We had a problem with our credit card (security check even though we had phoned them to tell them we were in China, tut) and felt that it was far more of a hassle to them than it was to us.The club provides a good buffet breakfast (continental only), an afternoon tea and an excellent evening buffet. Hot and cold drinks are available throughout the day and we found this invaluable. The hotel contains a fine range of restaurants and bars and it is not necessary to leave the hotel. Be aware that it is necessary to book. Room service is delicious and we made good use of this. Always remember that a 15% service charge is applied, even if the service is lacking, and they will still leave a space for a tip!My main disappointment with the hotel was also my main delight. We loved the view from the room because of its situation however, as a tourist, it really is not the best place to be if you have come to visit Shanghai. Taxis are easy to get but the traffic is very busy; the Bund tourist tunnel is a lot of fun once, but an expensive option; and we never did manage to find the ferry port..."
118,2234,"Aug 21 2005	Breathtaking Hotel	The Grand Hyatt Shanghai is in the breathtaking Jin Mao Tower just wonderful located. I think it is one of the greatest hotel experiences in the world. Rooms in the corner of the building, where there are three glazed walls (even in the bathrooms!), are excellent. The food in the two Chinese restaurants and in the Japanese restaurant is outstanding. On level 87 is a charming bar and on level 53 there is the smart Piano Bar with live entertainment, perfect!BUT service was absolutely dreadful! On the first day they wanted to cancel our Club privileges, then there was some noises in our neighborroom and they didn't manage to stop it (not til we asked them to do so four times!). Another day we wanted to have a nice diner in the Canton restaurant. So we asked them in the afternoon for a specific table in front of the window, where you can overview the city by night. After two confirmations from the concierge (with adumbration), we came at eight o'clock to the restaurant and they gave us a table, which was not by the window, and the restaurant was full!!! And the staff and even the duty manager do not accommodate to you with a little regard. Rooms where not very clean too!The reason why I rate this hotel with four points is, that there isn't a better hotel in the city! We had a look to all of them (Four Seasons, St Regis, Marriot, Ritz Carlton), but they aren't as nice as the Hyatt.In spite of everything it is a beautiful place to stay!"
119,2234,"Aug 16 2005	Great hotel in a great city	We just returned from a 10 day trip to China. We were in 4 different hotels, but the Grand Hyatt definetly was the highlight of our trip. Our 70th floor room had an amazing view of the BUnd and the Oriental Pearl Tower, which was enormous in the evening. The room was very comfortable and good equipped. THe food was very good,both in the cafe, as well as the other restaurants. The room service was excellent. The bar &quot;Cloud 9&quot; on one of the highest floors had an extremely cosy atmosphere. We would stay here again. It was the nearest thing to heaven. Excellent!"
120,2234,"Aug 12 2005	All Hype -- Disappointed and Not Going Back	We were in Shanghai last Sept/Oct during their National Day holiday period. We were on a &quot;hotel-review mission&quot; because we stayed at both Westin and Grand Hyatt, both using points for their respective hotel &quot;frequent traveller&quot; program. What a difference service-wise, granted that we were also upgraded at Westin (to a residence apartment), and we were offered to pay another $100 for a river-view room at Hyatt. Both hotels had two taxi lines set up at the front door. One for hotel guests, and one for non-hotel guests. At Westin, when taxi was not in abundance, hotel guests always had the priority. At Hyatt,we waited in the taxi line where the sign for hotel guests was for 10 minutes, and they ignored us and only tending to people in the non-guest line. We did not get a taxi until I walked back into the lobby and complained.At Hyatt, the bedding consisted no flat sheet, no blanket, but only a comforter with bedcover or duvet cover (to make it sound better).At Westin, heavenly-bed a hype or not, there was the usual set up: flat sheet, covered blanket, then comforter with a duvet cover.At Hyatt, it took them almost an hour to get the crib set up in the room, after I requested at the front desk, called the front desk, called the housekeeping dept, spelling the word &quot;crib&quot; along the process. There is no comparison for the crib itself. It is indeed a heavenly-bed type crib at Westin, and I dreaded mold for the foam used at Hyatt, so my three-year-old ended up sleeping in our bed anyway."
