IDREVIEW,HOTELID,REVIEW
50,826,"Aug 28 2005 	Really good hotel!	Stayed here for 2 nights and we were very pleasantly surprised st what we found. Plenty of parking space, relatively easy to find, friendly staff, efficient service and excellent food in the hotel restaurant (this was actually one of the best meals we have had believe it or not) although a little pricey we thought, there was a reasonable wine list and nice atmosphere. Room service failed to turn up but when alerted they delivered promptly, apologised and reduced the bill. Breakfast was huge and very nice.Would definately recommend this hotel with the only negative being that the bathroom although sufficient looked a bit tired and could do with updating."
51,826,"Aug 14 2005 	Average expeience most of the time	I travel to London a lot from the North of England on business and normally stay at This hotel as it is conveniently placed at the bottom of the M1. I usually have about 5 nights a month here and yes the staff are friendly and the rooms are clean,spacious and air-conditioned. The food can be well below average and on the whole for some reason I find the quality of Room Service food to be better than that in the restaurant. The London Tube 'shuttle' is very good when leaving the hotel but they can be very tardy when you need to be collected from the station and returned to the hotel.Previous reviews highlighted problems when attempting to get to the Brent cross Shopping Centrre/Mall - at busy times of day this can be a problem on foot as you are crossing a feeder road to the notorious London North Circular - avoid peak times and you should be OK. There are a good range of shops when you get there but foodwise if you take my advice get a taxi to Highgate or the tube to Belsize Park. There are many good value ,good quality restuarants there."
52,826,"Nov 7 2004	Nice hotel	Nice hotel in Northern London. Good for those arriving at London Luton airport. We've been there for a night on 6th of November 2004.There is a big shopping mall right across the street. Well, &quot;right across the street&quot; is unfortunately a disadvantage of the hotel. I mean, to get there by walk is quite an achievement. I know that there is the M1 Motorway nearby, but still it's REALLY hard to get from the hotel to the mall or tube station by walk. Fortunately the hotel offers free shuttle from the front door to the tube station of Brent Cross (and from tube to the hotel). Very nice of them.The rooms are quite nice, medium size, rather big bathroom. Clean and bright. Staff is very helpful, food could be better but it's not bad.Great place if you are there for an event at Wembley Stadium (which should be ready in 2007 :)).Overall - good choice."
53,826,"May 20 2004	Great place to stay	I spent a week at the Holiday Inn - Brent Cross and I have nothing but good things to say about the rooms and the friendly staff. I've stayed in central London on other occasions, but decided to stay in Brent Cross because the room rate was better. I expected to give up quaility for the better room rate, but imagine my surprise when I walked into a very nice room and was welcomed by very helpful staff. Finding my way to central london was easy with the tube station within a short drive, courtesy of the hotel shuttle and there is a mall (brent cross shopping center) within walking distance. The breakfast was excellent although the eggs tended to be alittle runny. Otherwise the food was good. Hey, if you want pizza, just walk across the way to the shopping center for some Pizza hut or Marks and Spencer(grocery store) for sandwiches and wine or other snacks.I will most likely stay there on return trips. You truly get more for your buck(or pound)."
54,826,Oct 31 2009 	???????????????????
55,826,Jul 5 2009 	?????????????
1,827,Nov 15 2009 	Pleasant Hotel	My friend and I spent two nights at this hotel and were impressed with both the cleanliness and staff. We booked the hotel as we were attending a function nearby otherwise we would normally stay in a more central location. The only disappointment was that breakfast was not included in the rate although there were several restaurants within easy walking distance and we could have paid extra for breakfast at a reduced rate on check-in.I would recommend a meal at the Camden Brasserie which is just across the road. We had dinner here on our first night and thoroughly enjoyed it.
2,827,"Oct 25 2009 	A hassle-free stay in a clean friendly hotel.	This hotel is very well-placed for exploring the delights of Camden Markets and Lock.We couldn't check in until 2p.m. but were allowed to drop our bags off early, which helped.Room was quite spacious with two large double beds and a reasonable sized bathroom.Clean and quiet are my main requirements, and we got both.Friendly reception and a nice meeting area with coffee bar and tables.Breakfast very expensive but only adaquate - nothing to justify the price really.Next time I'd eat at one of the many places nearby."
3,827,"Oct 24 2009 	Wouldnt stay there again due to the poor service!	After reading reviews on Trip Advisor, and the hotel being in the perfect location as we were travelling to go to the Robbie Williams concert at the Roundhouse, we decided to book with this hotel despite being quite expensive! Booked over the phone with no problems and good service however whe we turned up at reception they had told us that our room had been cancelled and we werent notified!!!! Despite this they were fully booked and we had travelled for hours and definately needed a room. The reason for this was because there had been an issue with the payment as apparently if using a switch card to pay it needs to be physically there if you dont have an issue number???!!! There excuse was that they couldnt get through on my mobile and had left a message which never came through! Although they never tried to post or email me as accordinging to them this is not there policy even if they have them details!!!!! So they had cancelled a room and not notified us!!!!!!!! Terrible service we were left waiting in reception for over an hr and eventully when he magically found us a room...he offered no benefits or discounts and acted like he was doing us a favour!!!!!! The hotel however was very clean, good rooms, excellent breakfast however due to all the hassle we wouldnt stay here or in a Holiday Inn again.....although Robbie was absolutely amazing and overshadowed the rubbish hotel service!"
4,827,"Oct 8 2009 	Comfortable Hotel in Pleasent location	The hotel is modern and seems quite new. The rooms are of a good size and are very clean. The place was also noise free at night considering it was in LondonThe hotel is about 4 minutes from Camden town tube and while the northern line is not the greatest to be on as you will have to change the majority of times its only 1 stop from kings cross station and only a few stops from oxford st. did not have breakfast there is quite expensive went to nearby diner. The hotel is beside a starbucks and a wagamama and it beside the markets of Camden which I found lovely but the area did not appeal to my older mother as there is a lot of teens and young adults with tattoos, skateboards and dressed wildly about so maybe not the best area for older or more conservative people. There are also not alot of nice restaurants more pub grub around. The internet in hotel is quite expensive but overall good stay esp of you get the rate we did on hotwire makes it a bargin compared to other lower class hotels in central London."
5,827,Oct 7 2009 	1st class hotel. Best Holiday Inn i have stayed in. Made me feel at home	The hotel is located in a lively part of the town. Easy to find. Hotel is very modern and bedrooms very clean and of a suitable size.The staff were really attentive and made me feel at ease during my stay. Even when i passed a member of staff in the corridor they were very welcoming.Breakfast was busy but had a good selection of food. More so than in any others which i have stayed at.Easy access to the west end and Oxford street.1st class hotel.
6,827,"Oct 4 2009 	Great location	Excellent location in Camden, overlooking the lock and market and 5 mins from tube. Stayed in room 213. Immediate view is of office building, but when you open doors of room, you can see good view of lock and market if you look to your left. When arrived in room, TV didn't work and there were no shampoo or conditioner in bathroom, but staff were very apologetic and it was all sorted out in less then 5 minutes. Breakfast was 9.95 each if you paid for it when checking in (otherwise 12.95 on the day) and was good value as good selection and eat as much as wanted. Went into hotel to book and was offered standard rate, when pressed they then offered the advance booking rate, but found a cheaper rate online with hotels.com."
7,827,"Sep 22 2009 	Wonderful stay	Four 18 year old girls traveling alone for the first time. Booked this hotel through Hotwire for seven nights. We got two nice rooms with two double beds in each. Though our windows faced a brick wall, this meant that we heard no outside noise at night, which was perfect. Tried the restaurant one night, and they had really good food. And the staff were really nice and helpful."
8,827,Sep 9 2009 	Hotel and location great but beware of referrals from the front desk	We spent 8 nights at this hotel and overall had a very pleasant experience. The neighborhood was lively and an interesting place to shop. Hotel is close to Camden Lock tube station. Only have 1 major negative to report: DO NOT ALLOW THE HOTEL TO CALL YOU A TAXI. Twice we arranged for taxi service through the front desk. Each time we believe we were overcharged. For example return charge to Paddington Station was 5 pounds more than inbound trip. Note that taxis provided by hotel were not typical black London taxis. They were guys in minivans who had dubious taxi meters. Otherwise experience was pretty good. Would recommend this hotel.
9,827,"Aug 31 2009 	Great London location - full of character""	The Hotel was fine, very friendly staff and good amenties. The location was great, just on Camden Lock and the Markets, which is brilliant for our 14 year old daughter. Lots of restaurants to chose from. The Mango Room near the Camden Town tube station is fabulous. Great food.Only a short walk to Primrose Hill which has magnificent views across the city.All in all we had a great time."
10,827,"Aug 25 2009 	Generally pretty good	Stayed here on business. Location not ideal, but hotel generally pretty good - rooms nice and large by London standards, although furniture a bit cheap. Service at check-in a little brusque but nevertheless efficient. Did not try breakfast. Ironing board a bit crappy. Otherwise not bad - just remember that the location means it may be a bit noisy. Plenty of good restaurants etc. nearby, although area may not be to the taste of some business travellers."
11,827,"Aug 9 2009 	Good value just be prepared for the neighborhood	We spent 5 nights here in two separate rooms. For London, I thought the rooms were quite spacious and were very clean. We had an issue with the A/C that took a couple of calls to maintenance to get resolved, but it was eventually fixed. Main objection regarding the hotel was it's location, and the noise level. We were put into two rooms on the 2nd floor overlooking Jamestown road, which by itself was not a busy or noisy road, but there is a bar across the street on the corner which has a very loud outdoor clientelle until well after 1 am on Friday and Saturday nights. I observed in advance the possible problem when we checked in, and was told that it never a problem, which in fact it was, so I think they were just wanting us to take the room knowing we probably wouldn't want to uproot and switch once we had settled in. The location is right next to Camden road and Camden Market, which is frequented by seemingly no one other than tattooed and body pierced individuals. Most of the storefronts along the street are tattoo parlors or t-shirt shops, or both. We never really felt unsafe, but just know this before you go and be prepared for a little bit of culture shock if you are not used to tattoos, multi-colored hair, and piercings all over the face."
12,827,"Aug 8 2009 	Pleasant and functional	Ideal for exploring the Camden Town area, Regents Park / Zoo, Primrose Hill, etc, and still only 15 minutes from Leicester Square on the Northern Line, this is a well-located hotel.I booked via the Holiday Inn website and the photos there make the hotel look very contemporary and almost boutiquey. The hotel doesn't quite live-up to those images - it is clean, modern, functional and pretty-much provides everything that you could need from a hotel at this price range, but it wasn't quite as funky as I had expected for this location and there was far too much cheap 'wood' veneer. The room was of an okay size, but the bathroom felt tiny. It had a multi-channel tv, tea/coffee and biscuits, tissues, facecloths, iron, minibar, safe and all other amenities - except complimentary toiletries (except for wall-mounted squeezy containers). My room faced onto the street and, whilst you could make-out some slight noise from nearby bars, it really wasn't intrusive and didn't continue late into the night (despite being a Friday).Breakfast was comprehensive and the service was very attentive throughout my stay.Overall, this is a modern mid-range brand hotel - not outstanding quality and not spacious, but spotlessly clean, with good service and comfortable. I'd go again."
13,827,"Aug 6 2009 	Great Location Great Hotel	Family and I stayed here in July for nine nights. The location is great - close to Camden Market, Sainsbury, tube station, Regent Park and all types of restaurants to suit the most discerning tastes.The room was small but well furnished and maintained; the bathroom was clean and bright.The beds were a littel soft as were the pillows (which were somewhat lifeless) but staff was cheerful and helpful.The array of foods available was astounding - Camden Market is filled with little food stalls that served Mexican, Indian, Thai, Chinese, Italian, Malaysian, Fish &amp; Chips. Not to mention the many restaurants around and your typical KFC. Sainsbury is a 5-minute walk away.Would definitely stay there again and would recommend to anyone. Ask for a room that faces the inner &quot;courtyard.&quot; Not much of a view - unless you happen to like to stare at a blank brick wall - but you'd be able to hear a pin drop at night, and be safe from the street and pub noise."
14,827,"Jul 24 2009 	Will stay again	Unfortunately we only had one night in this hotel. Treated ourselves to one of the executive rooms and this was very spacious, clean and comfortable. The balcony didn't overlook the lock but that didn't matter as it was peaceful. All the staff we met were very friendly. As we had to leave at 8a.m we had an early breakfast and had the whole room to ourselves - that is a first for us! The area - Camden market is just a treat to walk around with all its interesting people, stalls and different foods to sample. We also found an Italian restaurant within a short walk which would be good for families if they wished to eat outwith the hotel.We will definitely book into this hotel again."
15,827,"Jul 20 2009 	Great hotel if you don't plan to stay in your room	Took my 2 teens to London and stayed in a double room. We had a disgusting view of the air shaft. When I called the front desk to ask for a better room (we are Platinum members), they told us that they would move us ASAP. We waited in the room for 95 minutes. When the porter came, we were moved one floor up, in the exact same location. Same view. I was told that &quot;all of the double rooms'&quot; are in this location in the hotel. The bathroom is outfitted nicely and the beds were comfortable. The Camden area is pretty funky and filled with street vendors. Mind your wallets/purses. It is a 10 minute walk to the London Zoo (find coupons before you go: it is pricy) Be aware that if you want to have a meal after 9pm, you will have to travel out of this area: all of the restaurants become 'pubs' and refuse to serve anyone with children under 18. We were turned away from 5 restaurants before finding a Chinese rest. that was happy to serve us. The breakfast buffet is standard fare, but the dining room is bright and the servers attentive. Although they were working on the plumbing and some other renovations, it was quiet and unobtrusive."
16,827,"Jul 17 2009 	Great location clean room good value	The hotel is conveniently located near the Eurostar station at Kings Cross, about half a mile away which is a 5 min bus hop or taxi ride. There is a Wagamama noodle shop that opens to 11 pm across the street. The beds are comfortable and the bath is clean. We only stayed overnight to catch the train but it was a great value for the room and location."
17,827,"Jul 17 2009 	Excellent location	I stayed here one night for a gig at The Roundhouse. Great location, right by Camden Lock. Easy stroll to The Roundhouse.The room was quite big but my bath water was luke warm. Mini bar. Breakfast was comprehensive but rather unexciting in the taste department. Would use again."
18,827,"Jul 15 2009 	Modern Hotel in a Lively Part of the City	Having stayed for one night at the Holiday Inn Camden Lock using my priority club points I can recommend this hotel to other travellers.The room was the standard layout of 95% of hotels around the world, although the room was on the smaller side it was faultless with quality. All fixtures and fixings were in good working order and the room was clean. Where quirky operation of things like the shower taps, safe, etc. an idiots guide has been written. The TV has the standard five UK terrestrial channels plus Sky News, Nickelodeon, TMF, selection of radio and hotel pay TV.Hotel has WiFi but no price is advertised, but it definitely was not free.Air conditioning was efficient if required. When I was there London was the usual humid muggy affair that it experiences during the summer and I had the window open for fresh air.I can understand the other reviews that mention the noise from the Lloyds Bar opposite, which with the window open could be heard but shut the double glazing and all was at peace. I did not find this a problem considering what a vibrant area Camden is.I had the full English breakfast in the hotel at 12.95 (9.95 continental) which was expensive but was buffet style and as I wanted it to last me all day I needed to fill my boots to the max. Quality of the food was good with a choice of two types of good quality sausage. The staff were very attentive, the amount of times they asked me if everything was alright was over the top.The hotels location is brilliant for eating out with many restaurants and food outlets within very close walking distance. The Lloyds bar opposite serves all day the standard pub grub offered by this chain, including breakfast at half the price of the hotel, although the quality of sausages does not match the Hotel.Eating out was easy and there is plenty of choice. Across the other side of the canal are multiple fast food outlets serving Mexican, Burgers, Indian, Chinese and Italian. I opted in the evening for Chinese at a cost of 3 for Chicken in Black Bean Sauce with fried rice. Although not filling for a growing lad like myself, would suit many, at this price you can always have a second. The seating areas are novel consisting of the seats of scooters.The tube station is no distance from the hotel to explore the rest of London.For the tourist, Camden is a good location to base yourself, although it is tube ride to the West End.To sum it up the hotel is as expected modern, clean and in a good location."
19,827,"Jul 14 2009 	Welcoming hotel in great location	We stayed at the Holiday Inn Camden town for 1 night although I wish we could have stayed longer! As a Platinum Priority club member we were upgraded to an executive room on the top floor wth a balcony which was fantastic to enjoy the lovely weather. It was also very quiet on this floor, didn't hear any noise from the streets below and it was a Saturday too.We ordered room service to eat on the balcony which I have to say was fairly reasonably priced for a London hotel, although I did have a problem trying to make the person on the phone understand my order but this was soon resolved by contacting the duty manager.We were offered breakfast for 9.95 pp when we checked in, its 12.95 if you dont pre book, but to be honest there are plenty of places in Camden Town where you could get a cheap breakfast. We love the area around Camden, very trendy and lots of great places to eat. We went to a Lebanese restaurant called Mezza Express, great value and tasty food.Would definitely stay here again especially if we can have a balcony room!"
20,827,"Jul 12 2009 	Good on weekdays noisy on weekends	Our flight from Los Angeles was early (!), so we arrived at the hotel around 10:00AM. Without checking to see if any rooms were available, the staff made it perfectly clear that we would not be allowed to check in until at least 2:00PM. That was a bit of a drag, as we had not slept on the plane.Once we were allowed in, the hotel was fine. The room was adequate, the bathroom nice although small. The lobby was plain and the bar area limited, but we didn't really care about those. We'd rate the hotel as three rather than four stars.On Friday and Saturday night, the noise from the pub across the street was intense until the wee hours. (We're not light sleepers, but this kept us awake.) Noise was not a problem on weeknights.Like others, we had booked through Hotwire, so we were pleased with the rate. We also liked the area, which we had not visited previously. It was colorful and interesting. Our overall rating of &quot;Very Good&quot; is significantly premised upon the locale. Wagamama (across the street) had good food at reasonable prices.We would definitely recommend this hotel for stays on Sunday through Thursday nights. On Friday and Saturday nights, we'd look for something quieter. We also wish the staff were a bit more accomodating."
21,827,"Jul 11 2009 	Great...	Like many others, we booked through hotwire and stayed two nights. Rooms are small but very very very well maintained - immaculately clean and ours seemed newly remodelled, especially the bathroom. I like the wall dispensers instead of those tiny bottles that are so bad for the environment.The area is great - so close to Camden Lock with a great variety of food and neighborhood restaurants (we had excellent Indian at the Masala as well as market selections for everyone); the towpath is a great, pretty, cut through to Regents Park and parts south as well as Primrose Hill etc. We loved being so close to the park.Note - there is an excellent Morrisons supermarket off the towpath in the direction of Regents Park - go up at at the Pirates castle and follow in the Primrose Hill direction. I think it's closer than the Sainsburys.I don't think the northern line is the most convenient for the tube, but the tube station is close.Excellent friendly front desk service.A great deal and a great place to stay for the price."
22,827,"Jul 9 2009 	Great place to stay	Had 7 nights exploring the area and loved it. Modern hotels are not the norm in London but this had all a leisure traveller could/want. Cannot understand why I got it so cheap through Hotwire ($79+charges), but it's worth lots more. The breakfast at 9.95 (if bought at reception) is nicely presented, although coffee is atrocious - hard to find good coffee anywhere in Britain. Wi-fi at 15 per day was outrageous - I cannot believe they have many takers at that price. I bought a 3G SIM for my iPhone and had most of what I needed for 1 daily.I had a view on the first floor on the outside. I was worried about the noise some reported, but soundproofing was fine."
23,827,"Jun 19 2009 	Ideal hotel for access on Northern tube line to the City	All rooms have a safe in the wardrobe, a hair dryer, a small ironing board and iron, an electrical trousers press, a writing table and office chair.The hair-dryer, iron and trousers press only work after you have switched on the electrical socket, and in the case of iron&amp; trousers press, also 2 buttons on the trousers pressThere's a big Sainsbury supermarket at 17 Camden Road, about 150m from the tube station &quot;Camden Town&quot;.Twin room:- two double beds- faces inner courtyard and has view of a wall 3m away- window is relatively small, about 0.6m x 1.2m and does not open properly, you can only tilt it to open about 20cm- if you don't really need the 2 beds, try to avoid these rooms Double room facing outward:- 1 double bed (1.50m x 2m)- big floor to ceiling window (1m x 2m), which you can open completelyExecutive room:- big roof terrace- 1 big double bed- about twice the size of a normal room- separate walk-in shower and bath tub- bath robe and slippers provided- weighing scales in bathroom- collection of little shampoo bottles, shower cap"
