IDREVIEW,HOTELID,REVIEW
116,1000,May 1 2008 	Crticas excelentes
117,1000,Nov 9 2007 	Novtel Rcent de qualit
118,1000,Sep 20 2007 	Hotel ottimo !!!
1,1008,Jan 2 2009 	very enjoyable stay	after reading the last review on TA of this hotel
2,1008,Jul 5 2007 	Please avoid it at all cost!	We took our two young boys and our grown niece to London during mid June 2007 and stayed at the 13 Half Moon Street Apartments in London Mayfair for 10 nights. This is a three bedroom serviced apartment that is affiliated with the Flemings Mayfair Hotel right next door. We were in the Sanford suite
3,1008,Jun 10 2004	A Wonderful Hotel	Ah
1,1010,Nov 21 2009 	Excellent hotel; modern and clean. Very friendly staff.	I planned a last minute city break to London with my sister. I booked this hotel less than 2 weeks prior to our trip. It cost 120 per night for the room which was excellent value given the standard of the hotel and the location. It was much better in reality and the photographs I had looked at previously didn't really do it justice. We arrived early and our room wasn't ready so we left our bags. Emeric was on the door and he was most friendly. He was on the door for the duration of our stay and on every occasion went out of his way to welcome us back or to provide us with directions when we were leaving. Our room was lovely. It was very modern and clean. We didn't eat breakfast in the hotel deciding to do a bit of shopping first before stopping for breakfast so I cannot comment on the restaurant facilities. Location was perfect. It was about a 3 minute walk from Baker Street Tube Station and within walking distance of Oxford Street. However the street were the actual hotel was located was quiet and very pleasant.I would definitely recommend this hotel and would have no hestiation in going back there again.
2,1010,"Nov 20 2009 	Lovely Hotel - Highly Recommended!	Found Ten Manchester Street via a good deal on lastminute and stayed one night on business. As it's a newly opened hotel they probably don't have full bookings yet hence the good deals still available. I imagine that when the occupancy increases so will the charges...and quite significantly!Ten Manchester Street is best described as a small, exclusive boutique hotel and it's been finished to a very high standard. Excellent and friendly staff who really can't do enough for you...it's like being in your own private Gentlemens club! 5 minute walk to Oxford Street so also an ideal location for a shopping weekend. Nearest Tube station is Baker Street, again about 5 minutes away. Hotel is set in a quiet residential area away from all the hustle and bustle.We didn't eat in the hotel but the dining area and menu looked excellent! Lovely outdoor cigar terrace for a nice relax at the end of the day! Only compliants were the lift, it takes forever and the free wi-fi not being password protected. They probably have half of West London all using their connection which caused it to be so SLOW!Highly recommend Ten Manchester Street and will look to stay again next time I'm in London!"
3,1010,"Nov 19 2009 	A Fantastic Classic London Experience	The staff really made this fabulous hotel. The manager Suzie was a model of grace and charm. They are lucky to have her. No ten is brand new and they are still ironing out a few creases. The bed was the most cozy and comfortable I have ever slept in. They are using these amazing mattress toppers. The location was fantastic, great shops, restaurants, London at your feet. Try Hardy's traditional English resturant near by, it has the best traditional English food I have ever tasted. The Lebanese restaurant close by has won lots of awards and the food is delicious also. Our suite at no 10 was large and luxurious. I can highly recommend it."
4,1010,Nov 10 2009 	Just opened few teething problems but suspect it will be great	Stayed here the first week it was open. The room was lovely if a little compact but hot unusual for London. As everything was brand new it was spotlessly clean. Nice bathroom with good ameneties. Price was very good for room quality. Few teething problems with TV not being tuned / aeriel connected and a pillow case missing. But once this is sorted I think it will be great.Best bit is outdoor heated area for drinks.
5,1010,Nov 6 2009 	Lovely hotel great location very welcoming!	Stayed for a birthday weekend treat and were kindly upgraded to a suite! Brilliant room - all newly furnished. Quiet location and excellent service. Manager (Suzi) very welcoming. Like other commentators we agree that it does feel like a private club. Didn't try breakfast but will do so on our next visit - which is in fact in a couple of weekends time. Intend to use this as our regular place as we were so impressed! We have stayed in a lot of London hotels so that says a lot!
6,1010,"Nov 4 2009 	We want to come back	What a beautiful hotel. From the moment you walk up the inviting stairway to the glorious foyer and smiling staff; you feel welcome.The room was sexy, yet warm and very chic! Great design.Food was great, I want the recipe for both dishes we enjoyed.Stroll to central London shopping, heaven! Definitely looking forward to returning soon. Thank you!!!"
7,1010,"Nov 3 2009 	stay away its all mine!!!	We decided to make a shopping trip to London and were looking for somewhere very close to Oxford Street and stumbled on this absolute gem.5 mins from Selfridges but a million miles away from all the hustle and bustle.Recently refurbished, this beautiful hotel has all advantages of a modern hotel but made us feel like a member of the family. Large Plasma TV's, (we had an upgrade and the room had 2!) large shower heads, beds to die for. The staff were happy, smiling and always on hand to help.I didn't want to leave, but the nespresso machine in the room meant I had to go for a walk. We will be back!"
8,1010,"Oct 30 2009 	Great new hotel	I stayed at Ten as my usual local favourite was fully booked. This was a real find in a peaceful location, and had only just opened a few weeks ago. Rooms were extremely well furnished with aircon and bathrooms were fabulous with huge walk in showers. It really felt more like staying in a private club than a hotel, particularly with the cigar terrace to the rear and very intimate bar / restaurant. Food was good although service could have been a little slicker - am sure this will come with practice!! All staff were extremely friendly and willing to please. I will certainly be back. Many thanks."
9,1010,"Oct 24 2009 	Excellent Hidden Gem in London - recently re-opened	I decided to try this hotel after learning of its recent reopening after refurbishment. Not only is it perfectly located in Marylebone it has been done to an exceptional standard and fantastic value for money. The rooms were exceptionally well presented and one of the most comfortable nights sleep I have had in a while. I didn't need have dinner as I was dining locally, however I bought my guests back for a night cap on the cigar terrace they have created, which is a very comfortable warm space, where we enjoyed 5 star service and one of my party tried a Cohiba Robustos cigar from their well stocked humidor.I am delighted to have found a new home in London and would recommend to anyone visiting on business or pleasure."
1,1018,"Nov 20 2009 	Disgusting!	Filthy place, apparently now being used by London Council to house asylum seekers. I turned up with work colleague with the rooms pre paid by our company. Receptionist (in cupboard) insistant that rooms had not been paid for insisted on credit card for further payment! Left very swiftly and found alternative accomodation at Holiday Inn Regents park for a cheaper rate and a room where you felt safe to close your eyes. Definately a place to avoid."
2,1018,"Oct 5 2009 	TERRIBLE TERRIBLE TERRIBLE!	I don't normally complain, but please don't go near this hotel. The customer service from this place is the worse I have ever encountered. I booked a room and then hours before my stay they cancelled on me on a very busy weekend, so finding another hotel at such short notice was difficult. But the worst was to come. Days later after looking at my bank statement I noticed that they had still charged me! An honest mistake I thought... But when I phoned them the rude staff (especially the manager) told me I was charged because I did not show, even thought they had cancelled on me! They refused to give me my money back. They told me I would have to speak to the booking agency or the go between Hotel Solutions. They refused to discuss the matter even when I explained that it was their mistake. In all my years (39) I have never experienced such poor customer service. Fortunately, after 2 months of haggling and endless phone calls and a word with Trading Standards Hotel Solutions kindly gave me my money back even though it wasn't there place to do so. The Opulence Hotel refused to acknowledge their mistake or refund me. It's not what the Opulence Hotel did to me but it's the way they did it that is so disgraceful! They were rude and arrogant. I've never heard anything positive about this place. It's a complete fiasco. If you've booked and still have time to change do so now, or you WILL REGRET IT!"
3,1018,"Sep 10 2009 	dreadful dreary disorganised and dangerous	The booking for 7 rooms was made by our secretary through Laterooms. Having looked at the Opulence Hotel website, she told us to expect a four star hotel at a bargain price. How wrong!We arrived at a pokey, tatty little hotel on a busy main road.Reception was at a cubby hole on the first landing. There was no formal check in. The receptionist gave us keys but did not take our names or personal details. Although it was 4pm my room was not ready. I asked if there was somewhere to wait. The receptionist walked to a locked door which she opened. In the room I heard her argue with a colleague. He was very angry and shouted that she had made a mess of things and to sort it out herself. By this time I felt distinctly uncomfortable. She ushered me into the room to sit with her colleague while my room was cleaned.Eventually I went to my bedroom which was in the basement. It was dark, very hot and had no facilities for hot or cold drinks.The main problem occurred when the remaining 3 people in our group arrived to check in at 6pm. Despite one of them having dropped off his bags earlier in the day, he was told his room had been given to someone else and the hotel was now full. The last 2 people of the group were told their booking had been cancelled!All three of them had to leave and find alternative accommodation.The next morning, to add insult to injury, we were told on check out that two of the rooms we had booked had not been used and we would have to pay 200 for the &quot;no shows&quot;!The hotel is very badly run. There was no apology and were told in no uncertain terms that it was all our fault!Don't stay here!!!!!!!!!"
4,1018,Jul 21 2009 	Excellent Hotel Great Service and Splendid Rooms	I booked two rooms for a one week stay and of us really enjoyed it. Rooms are spacoius with rich decoartion .Nice bathrooms with bathrobes . Breakfeast Buffet was fine with the Chef inviting us for fresh omlettes.We were able to order room service at very reasonable prices. My children were accessing broadband internet all day long we had ample choices of TV channels . This has been one of my best hotel experiences in London.
5,1018,"Jul 12 2009 	never ever be tempted to stay here	The hotel was booked last minute and the picture looked ok - oh how deceptive that picture was! The reception is a shack, in effect stuffed into a corner, it was a shambles. The carpets are filthy and stained and were not fitted - as a consequence the edges were all tattered. The trip to the room (god help you if you are at the top as we were) was via a staircase which was poorly maintained (wall-paper peeling off, water stains down the wall). The room was terrible. The carpet was again stained and poorly fitted. the bedding was a disgrace and I threw the top cover into the wardrobe, where it stayed. The net curtain was grey with filth. The shower leaked all over the floor and was crammed into a space that my husband could not turn round in. You could not get to the sink properly because it was so crammed. The television did have 25 channels, however 24 of them did not have a reception. If there is a fire and you are the top, make sure that you have made a will because you will never get out unless you use the net curtains to paracute out! The receptionist was there from dawn to dusk but we did our best not to wake him when we came back at 10am to find him snoring laying on top of his reception shack. I would not rely on him for security or any form of fire warning system. The best way to navigate the room is to back into the shower and then jump onto the bed to dry off - thereby avoiding the carpet! To top it off two pillows with no pillow cases. We were flabergastered at the place, however my heart went out to the two Americans behind me who had paid 231 to stay there !"
6,1018,"Jul 6 2009 	I would never advise to stay here	How I wish I'd seen these reviews before booking my stay. My weekend was ruined because of this hotel. I tried to call about 10 times to get directions, but nobody answered the phone. We eventually found it at around 16:00, and when we got there, there was nobody to let us into the room as he &quot;had gone to the post office&quot;. We were shown into a grotty little downstairs kitched to wait, and then when he showed up, we were told he needed to get the room ready.....when it should have been ready for us to get into at 12:00. We waited a while longer and then were let into our room which looked run-down....and the noise from the road outside was awful. Having had enough, I advised that we weren't staying, whihc resulted in an argument about payment for the room. This was supposed to be a special weekend to celebrate my girlfrieds birthday, and they completely ruined it."
7,1018,"Jun 13 2009 	Friendly start but poor stay	Stayed here with colleagues and had to cut my stay short after one night. Whilst check in was very friendly with the concierge taking our bags to our rooms, the room I was given was at the top of 3 very steep flights of stairs and very small with a tiny bathroom. I wanted to open the window to let some air in but the very thick net in front of it looked dirty. The TV had poor reception and when I woke up during the night my room was filled with the smell of cigarette smoke - no idea where this was coming from as the hotel was non smoking. When I told the receptionist in the morning of the issues I had experienced he was not particularly helpful and made no apology."
8,1018,"Jun 8 2009 	The worst hotel experience ever	At first i want to point out the only thing i liked, the staff was ok. Now to my negative experiences.At first we arrived at the hotel att 2 a.m and we had to clime a lot of narrow stairs with our luggage. When we arrived at the room the minibar was not functioning. So we had to run down the stairs to ask the guy in the reception if they had anything to drink in the hotel. They hadnt. He was about to lock up the hotel so we couldnt go outside. Although it said in our reservation that the hotel reception was supposed to be open 24h. But we were to thirsty to go to bed after a long travel so we had to knock on the room that he slept in and he just said that we could put something under the door so it didnt lock itself. We also had a problem with the reception when we were going to check out and we found the reception unattendent. We almost missed our flight becuase we had to rung around the hotel looking for any staff, But we never found anybody so i had to write a note. Now to the rooms. It was absolutely disgusting! The first thing we saw was the the bed had a lot of stains on it. The curtain had a sticky big white stain allover the bottom. I found broken glass in the drawers. The floor had dark stains. But now to the worst i found a pair of mens underwear with faeces all over it beside the wardrobe. It was aboslutely horrible! I would also like to point out that it said in our booking that there was supposed to be a lot of channels on the TV but i was like 6 channels and only 3 of them were in english. No movies channels. It was also supposed to have movies you could watch but surprise, they didnt work. You can guess what my overall experience was."
9,1018,"Jun 2 2009 	fantastic helpful staff	We were moved here the day before our stay as the original hotel was overbooked. We found the staff very helpful, they had been informed that we had booked a twin room and although they had none available at the time they set a room up for us and when they realised we prefered a double they moved us on the second night. The staff organised the move including all the luggage, including the stuff my partner had put in the fridge.The breakfast was superb, we would visit again but unfortunately are unable to ge the same deal so we have had to look elsewhere"
10,1018,"May 30 2009 	Nice place to stay	Ok, where to startthe hotel is located in very good area, 5 mis from Oxford Street, very good for tourist. A small hotel, nice and clean. I have booked a Double room for 140 a night, and when I have arrived, the gentleman at the reception was very nice and gentle. He helped me with bags and offered me Suite with no charge, because the room booked for was on third floor, so didn't want me to wake up with my heavy luggage. I had room, very nice decorated and clean. I have really enjoyed my stay, and i would recommed to my best friend to stay in Opulence hotel."
11,1018,"Apr 27 2009 	Telephone beforehand	I booked a night at this hotel through Hotel club. I received my confirmation e mail.Planning to attend a university reunion in London this was ideally situated. I arrived at the hotel where the gentleman at the front desk said he knew nothing about my booking and sorry he was full. Another guest was getting the same story. He looked in his computer and said there was somewhere round the corner for 400 for the night but that was the limit of his customer service. I had to try and find a late room at 5pm on a Saturday night in London, not an easy or cheap thing to do! I then e mailed Hotelclub the following day who said they had tried to contact me (No evidence of e mail or phone call ) and they had also left a message at the hotel to go to another hotel (Again no message according to the only gentleman on the front desk).All in all very bad customer service and leaves a very bad taste . so my only advice ring beforehand to confirm otherwise you might have a very expensive shock."
12,1018,"Aug 6 2008 	Crazy manager filthy rooms horrible breakfast	The hotel is horrible, do not believe the pictures dispalyed on their web-site. So, where do I start. First of all, I was woken up in the middle of the night becase the ceiling was leaking right above my bed. And not just some drops, no but like a proper rain. I went to complain to reception and there was nobody there. It turns out that they have no staff at night, and mind you, this is a hotel advertised as 4 star, and I was paying a lot of money for the room I had, some 350 prpn. In the morning I went to the manager about the problem, and you won't believe it, but he said that he had a headache, and he cannot do anything about it, and plus he had had enough of this country, (he is a foregner, apparently egyptian), where everybody is crazy and out of their minds. I couldn't believe this, I wanted to leave the hotel but I couldn't find anything else at the time, everything was full, so had to stay there.Second, the restaurant is filthy. Again, It took me a while to find somebody to serve me my breakfast, so had to pop into their kitchen to see if there was any staff. My God, the kitchen is the worst I have ever seen, the filthiest, the dirtiest, with garbage on the floor, dirty utensils, and th floor looked like it has never been swept or mopped since the opening. Needless to say that i was off my breakfast, but i decided to stay for a cup of coffee. There is a buffet, but I would never eat anything from it even if I was dying from famine, cheese and salami looked mouldy and well past the use-by date, so was the bread. If the sight of the kitchen, restaurant and food hadn't put me off my breakfast already, then it would definitely be the blonde girl who was serving the breakfast who would finish off the whole disgusting image. She was rude, loud, and had dirt under her nails, and in general didn't look very hygienic. She was talking loudly on her mobile, and you could hear her from evey corner of the hotel. She approached me with over-familiarity, bordering on obsenity as if I was her drinking buddy. I decided against having coffee there as well. The only exception was a receptionist, Venera, a ray of light in the whole hotel, who made everyhting possible to make our stay bearable, always with a smile on her face, and full of knowledge on London, she went out of her way to help us with everything. But sadly, the next day when I came to check out I was told she resigned. And I'm not surprised she did. I will never come back to this hotel, i would not recommend anybody to do that."
13,1018,"Mar 13 2008 	Noisy expensive and run down	Very poor. Our room was over the main road outside and very noisy.Upstairs showers leaked into our air conditioning system.We though expensive for a tiny room and no gym and no free Wifi.Yes it is opulent, but its fading and past it's sell by date.Don't bother"
14,1018,"Mar 12 2008 	Fabulous Hotel!	We've stayed at this lovely hotel in February this year. The hotel is new, it opened only last year, I was told by staff. We had a very nice stay, the staff was very freindly and nice, and made us feel at home. The furnishings and decorations are luxurious and rich, when you walk into the hotel you feel like you are in some art gallery, and not a hotel. It's a quite a small hotel, but very pleasant. The beds were wonderful, and so were the bedding, the pillows so comfortable that you fall asleep as soon as your head hits it. Another great thing about the hotel is it's location. It's very close to Oxford street, if you like shopping, and quite close to the West End too. I would recommend to have dinner at the hotel. We had our dinner there every night, and very pleasantly surprised, as the food was far tastier than some restaurants. I will definitely come back and stay at Opulence when I'm in London again."
15,1018,"Oct 20 2007 	Nice room but very noisy	The rooms were very nicely done with lots of fabrics and artwork. Sadly, my son had to walk downstairs to the owners unit at 2 a.m. because the television was so loud we could not sleep. The hotel also lacks a lift.... or a bellman. Carrying my own suitcases up 5 flights of stairs in a $500.00 a night hotel seemed a bit much!"
1,1022,Mar 18 2008	Stinky - Oxford House	Filthy net curtains - filfthy carpets.Gross - Smelly toilets.Got sent to another building - climbed up flights of stairs - got to room only to find telly wouldnt work without remote. There was a note on the wall saying if I wanted to use telly I had to get a remote from reception. Why couldnt they give me one when I booked in????The only good thing about the place was the location!
2,1022,"Oct 28 2007 	Good value	Stayed here over two years ago. I believe I paid 35 pounds a night for my double bed. Other than the manky headboard (seen in the photos), I found this place very clean and comfortable. Great value if you're just looking for a place to sleep and clean up while you spend your days out and about the city. Had to use the loo and shower either up or down half a stairway, but that's OK with me. Good breakfast too."
3,1022,"May 8 2005	Oxford House Hotel - good value	My husband I spent 11 nights at the Oxford House Hotel, 92 Cambridge St, Westminster/Victoria (London) in April/May, 2005. We found the hotel entirely adequate for our needs and within our budget at 45/night for our double that included a substantial breakfast. Shower and toilets are either up or down a half-flight of stairs and are shared by 3 or 4 other rooms; we rarely waited for a shower, especially if we were up early. The hotel is well located in a very nice neighborhood full of similar hotels, within easy walking distance of Victoria Station, an excellent supermarket and bus line #24 which serves the central part of London. The hotel was acceptably clean though paint is needed on window sashes; places such as corners of the showers, under and behind faucets and the like could use some attention (Im a corner cleaner!). Towels (no face cloths provided) were exchanged every third day. I found the heavy, flowery room odorizer a bit much but the smell didnt pervade our room much, especially since we were able to leave the window open. Our room, on the street side, was very quiet; airplanes from Heathrow early in the morning were only a slight annoyance. We felt the hotel was good value for the money. Payment by credit card incurs a 5% cash surcharge. Phone: ----------- Fax: ---/---------"
4,1022,"Apr 25 2005 	clean hotel	I stayed in this hotel for three nights together with a friend, when I was in London for a conference. The room with two single beds was ok, clean. There is a sink in the room and if you don't mind a shared bathroom this is a good place to stay. Nothing for a romantic stay, but if you want to explore London it's good. Close to Victoria Station. Our room was on the frontside, but there is hardly any traffic in the street so it was quiet. I liked the english breakfast which was included, and I think it's pretty cheap for London. It's not possible to book the rooms via internet, you have to phone or fax them. I would stay here again if I was London"
