IDREVIEW,HOTELID,REVIEW
2,2182,"Nov 22 2009 	Absolutely divine hotel- class all the way	My husband and I stayed here for a week, returning this morning. I repeatedly said that I couldn't fault the hotel. We both agree that it was amazing value for money and the location - just steps to Union Square - simply couldn't be bettered.The decor was stunning and I was very sad when it came time to check out!Very accommodating staff and lovely little touches such as the afternoon sherry, and complimentary morning coffee. A very chic experience.We would not hesitate to stay here again when next we are in San Francisco. THANKS KENSINGTON PARK! :-) 10/10."
3,2182,"Nov 10 2009 	Perfect weekend getaway	My husband and I just returned from a long weekend in San Francisco. We stayed at the Kensington Park Hotel and this is where we will stay if/when we return to the city. The location is perfect - it's literally in the heart of Union Square. Union Square, to me, was definitely touristy and not really my favorite part of town, but the central location is perfect. My husband and I love to walk around and explore the city and this allowed for us to do so very easily. Also, if you're new to San Fran, you feel really safe because there are always lots of people around. Additionally, there are great amenities (Walgreens, coffee shops, breakfast places, etc) right around the corner. When we arrived at the Kensington Park Hotel, we were very impressed immediately with how cute the lobby is and also how friendly the staff is. We were early in our arrival and they gave us several choices of rooms (explained front vs. back of building; choice of king v. queen bed, etc). Our room didn't disappoint. It faced a building, but we didn't care - the room is a great size (definitely a city hotel size) and the bathroom was pretty large as well. Our bathroom only had a shower (once again, they had given us a choice upon check in) but it suited us just fine and it was actually really large. The Kensington staff is tremendous. Everyone was incredibly friendly and helpful and definitely wanted to make sure we had a great stay. This hotel is the perfect &quot;boutique-y&quot; hotel and we will definitely stay there again."
4,2182,"Nov 5 2009 	Excellent hotel great location	Stayed here for 4 nights on our first trip to San Francisco. We were in the front on the 9th floor. There was quite a bit of road noise in the early hours from trash lorries, but after the 1'st night we closed the window and put the fan on and all was OK. Room was very clean and bed comfortable and the location perfect as close to many restaurants and cable cars. Would definately stay there again."
5,2182,Oct 16 2009 	Romantic beautiful rooms.	This is a gorgeous hotel. The rooms looked newly re-done with very modern and plush decor. It was surprisingly very quiet for being right near Union Square. The only complaint was the hotel parking fees were very expensive. The staff was very helpful and professional. Very clean. Would love to stay again!
6,2182,"Oct 15 2009 	Lovely Stay	We stayed at the Kensington Park as part of our honeymoon &amp; were upgraded to the Royal Suite where we had a fab room with a great view. After travelling from L.A. it was a refreshing change to be close to all amenities. The hotel is just off Union Square &amp; is a great location for catching tour buses &amp; is in walking distance to the shopping areas, restaurants &amp; night life. Only regret is that we didn't stay longer! Lovely hotel &amp; would like to give a special mention to the very helpful staff."
7,2182,"Oct 13 2009 	Charming hotel in great location	Lovely hotel, close to transport and Union Square. As mentioned by other reviewers, this is an older hotel which adds to the charm. Rooms are small but have been modernised and are very inviting. Bathroom is very small and there's no real bench space, but this is only a minor inconvenience. Some have mentioned the street noise can be annoying - we did hear sirens etc but with the window closed, it wasn't an issue.We took the train from the airport and walked the three blocks up to the hotel. It wasn't that far, but if you have lots of luggage, might be a bit of a struggle. Check-in was quick and hassle-free. Seemed like a good area and we felt comfortable walking around. The restaurant looked next to the hotel looked very nice but we didn't have a chance to go. There's also a little cafe on the other side of the hotel which we had breakfast at one morning, which was ok but nothing special."
8,2182,"Oct 13 2009 	Fantastic Hotel great location! Book it now!	I couldn't decide where to stay in SF but we definitely picked the right spot! We were right on union square with shops, restaurants &amp; bars right on our doorstep without the need for taxis, public transport etc. The rooms were v.spacious, extremely comfy beds &amp; modern looking also had free wifi. Great rates generally available in comparison to some other hotels that seem dingy and very old fashioned!! Definitely recommend staying here over Fishermans Wharf which is fine for an afternoon &amp; a burger but nowhere for you to enjoy a nice meal &amp; btl of wine etc. Only downside was the parking at $35 per day but you can't escape this if u want to stay in this central area. Would recommend to anyone going to SF!"
9,2182,"Oct 10 2009 	Great value	We consider ourselves very lucky in finding this hotel. Its location is superb, in short walking distance from Union Square. The hotel is charming, and our room was spacious, clean, I would even say luxurious. On the minus side, there is no breakfast included, but you will not find any trouble in finding a nice place for having breakfast in the area."
10,2182,Oct 8 2009 	Great Stay!	This was a great stay. Its not super modern. Its not new. But it was clean and the room looked just like the picture on the internet. The location is perfect. We would definitely go back.
11,2182,"Oct 6 2009 	Nice hotel in a great location	The Kensington Park is a great hotel if you are after a good location in SF close to shops, restaurants and transport. We caught the BART from the airport to Powell Street then its just a few blocks walk up to the Kensington.Vincent on the front desk was very friendly and welcoming on our arrival. There is no tea/coffee in the rooms but these are available on the 9th floor and you can use the takeaway cups if you wish. Our room was a reasonable size - slightly noisy but then this is a central hotel! Very clean, comfortable bed. One small thing I would say is that it seemed difficult to shut the doors without force ... and noise! We struggled and think next door did too, hence being woken up on a couple of occasions. We got the tour bus on a 2 day pass from Union Square for $20 each and with this you can get on and off as many times as you like. David our driver was hilarious - a fantastic guide with some great stories to tell.If you want a reasonably priced hotel in the heart of it all then the Kensington Park is perfect!"
12,2182,"Sep 28 2009 	Best Customer Service I have enjoyed in a long time	Stayed 5 nights on vacation with spouse, daughter and mother-in-law. Had requested two adjoining rooms so as to be able to assist 91 year old family member. I had neglected to request separate beds for daughter/mother-in-law. Desk clerk, on her own, saw the reserved room only had one bed and asked us if we would prefer separate beds. She not only found new rooms, but moved us up to the top floor so we could get a better view and be on the quiet side of the building. She was extremely cheerful, helpful, proactive in asking if we needed any help/info/reservations/ etc. In fact, all the desk clerks and the conciere were extremely friendly, helpful and genuinely interested in providing any help they could. We used a muni pass to navigate around and several times asked the desk staff for help...they went online to research the bus routes/connections which was very helpful and appreciated. ALL the housekeepers greeted us with a smile and &quot;good morning/ good evening.&quot; Kudos to management for assembling and training an excellent staff! Afternoon sherry was a nice touch. Rooms were not fancy but clean, quiet and with very comfortable beds. Free internet and nice business office with printers. Location was only 1/2 block from Union Square-close to mulitple muni transportation alternatives. We visit SF every two years or so. Next time we will going back to the Kensington Park."
13,2182,"Sep 26 2009 	Great Location - price is right!!	This is an older hotel that has recently been updated. The bathroom is small but clean. The beds are very comfortable. This was one of the few older hotels that offered two full size beds in one room. The room is fairly well appointed but cramped with the two beds in it. However, the location is great and the price is low(for San Francisco)! It's 1/2 block from the Powell St cable car and Union square. Rental cars are two blocks from the hotel.We were able to ride the cable cars all day. Cable car ride to Fisherman's Wharf, Ghiardelli Square. Walking distance to shopping, dining, SFMOMA, Chinatown.Spent one night while touring SF for 2 days. After consulting tripadvisor and knowing my wife's love of fresh air , we requested a corner room above the 5th floor when we booked. We were moved to a 6th floor corner room at check-in for an extra $10 charge. Please note that the guest rooms are located on the 5th floor and above anyway and we ended up closing the windows because the temperature dropped to 50 degrees that night.The staff is courteous and excellent! The doormen especially during the day are great. We arrived early and stayed late because of an Amtrak connection. We were able to check-in early and store our luggage after checkout until well into the evening."
14,2182,"Sep 25 2009 	Small quality hotel with excellent service.	This hotel was on the older side, which added to it's charm. The service was first class and friendly. The staff seemed attentive to all of our needs. Tea &amp; sherry in the lobby every afternoon was a nice touch. On the down side , no AC, but we definatly did not need it. There was a big ceiling fan and the window opened. We would go back."
15,2182,"Sep 23 2009 	Loved it!	We booked our vacation package to SF from Montreal via Yahoo travel. We decided on the Kensington Park Hotel based on reviews on TripAdvisor and price comparisons. The Kensington Park Hotel is value for money considering its rooms are comfortable and clean, and the fact that it's in the middle of all the action. Actually, we were surprised that the rate was so affordable. The staff were friendly and helpful, the bed was very comfortable, and the room was clean (I paid special notice to the bathroom because I'm finicky about these things). It's true there is no air conditioning (there is a ceiling fan), but we didn't need it anyway during our stay as the weather was cool. I had read some reviews complaining about street noise, but we experienced no problems in this department. Before traveling, I requested a king size bed and/or a room on an upper floor if possible, and they were able to accommodate us with both things. We were not disturbed by outside noise on the 9th floor. All in all, for an expensive city that was full of tourists at the time, we felt we got a great deal at this hotel, and I'll likely stay there again the next time I visit San Francisco."
16,2182,"Sep 21 2009 	Great location	We booked our stay at the Kensington Park after reviewing trip advisor and researching different rates and availability at various hotels. It was a great decision as the location of this hotel was perfect for everything we wanted to do. It was situated just off Union Square; the hub of all activity in downtown San Fran. The cable car stop was just at the end of the block and there was many restaurants, coffee shops nearby to get a meal or a quick snack. This boutique hotel was a perfect size , not too big where you feel like just another guest. The staff were very friendly and quick to answer our questions and be very helpful. The concierge was not as friendly and I found it easier to ask the staff questions. Our room was very comfortable and nicely decorated. We would definitely stay here again."
17,2182,"Sep 7 2009 	Great boutique hotel value 	Kensington Park was a terrific boutique hotel and was very conveniently located in proximity to restaurants, shopping and cable cars. The hotel did not have air conditioning (not uncommon in San Francisco), but there was only 1 day where it was warm enough to be an issue. The staff was friendly and the rooms were clean and comfortable."
18,2182,"Sep 2 2009 	Great Location	This was a lovely hotel with a very helpful staff and a great location. The rooms were very clean, and great bedding. The only negative was we did not realize it was not air conditioned when we booked the hotel. Being from Texas, you want air conditioning. The weather was a little warmer than usual but it worked out for us."
19,2182,Aug 28 2009 	Location is just great!	Hotel staff are friendly and I just love the location which is just around the corner of Union Square.
20,2182,"Aug 26 2009 	OK hotel. OK service. Great location. No repeat visit from us though.	The location is great. The front desk service was fine however on the 2 occassions we asked concierge for assistance, we were treated rudely and dismissively. In fact I found the concierge treatment quite upsetting. 1 query was about Alcatraz tours and we were rudely told &quot;they are all sold out&quot; and no further effort was made to suggest an alternative. The second query, I asked where a certain street was and the guy looked at me and said &quot;I have no idea what you are talking about&quot; . Just so rude. It's a shame the helpful front desk staff can't also do the concierge work. Rooms are exactly as pictured and described but many parts of the hotel ie) hallways, show signs of wear and tear. On a few occassions we were waiting for ages for lifts as they were being used by maintencance staff. There was just something not right about this place, we couldn't put our finger on it. It's like a mediocre hotel pretending to be exclusive. Don't get a street side room - very noisy."
21,2182,"Aug 15 2009 	Can't wait to come back!	This was my brothers and I first trip to San Francisco and we stayed at the Kensington Park for one week. I have to agree totally with the other posts that the service given by the staff was always very attentive and friendly. We stayed in room # 46, eight floor, two double beds was really nice and clean. Nice cafe right next to the hotel called Cafe Taza for a quick breakfast or other meal. Hotel is only about 4 blocks North of the Powell St. Muni &amp; BART station which is great if your using the BART from San Francisco Airport."
22,2182,"Jul 28 2009 	Perfect hotel in a perfect location!	The rooms at this hotel are simply beautiful! The bed was one of the most comfortable I have ever stayed in (other than my own) and the decor is beautiful. Everything from the huge flat screen tv, king size bed, cute bathroom, spacious closet and storage space was perfect. The heating was also great in the cool weather. I guess my only (tiny) gripes were the pressure of the shower head being really weak, and the lack of bar fridge (although there was an ice facility close by). The location was fantastic, being only a 5 minute walk from Macy's Union Square and 10 minutes from the Westfield Shopping Mall. I would definately stay here again and recommend it to anyone considering a stay in San Francisco."
23,2182,"Jun 26 2009 	Nice!	We stayed at the Kensington Park for three nights. Our room was nice - the bed was very comfortable! The location was very good, close to Union Square. The front desk staff were friendly and helpful, but we never caught the concierge! We ended up getting some information via the front desk person on the phone with the concierge. We paid a discounted price, which was a good value, but I'm not sure I would have been as happy with the value if had I paid more. Although the hotel is refurbished, some parts are still dated. And, the internet was very slow."
24,2182,"Jun 19 2009 	All round pleasurable trip	My husband and I stayed at the Kensington Park hotel for 4 nights and we couldn't fault it. The location couldn't have been better. Walking distance f rom the cable car pick up, with Macy's, Tiffiany's and the main shopping Mall all within easy walking distance. The hotel was very clean and the staff extremely helpful. The rec eption staff were delighted to offer advice on any questions we posed to them. The reception area is a little quirky and their afternoon ritual of complimentary sherry was an unusual offering, although i must say it was a nice way to meet up with other guests staying in the hotel as it turned into a little social gathering,Our room was spacious and very clean the only down side we found was that the garbage collection and street cleaning was done during the early hours of the morning and our room was directly above this area making it very noisy. Luckly it wasn't every day, and it didn't last for too long. The hotel has a theatre which seems to be well attended and the restaurant next door, (access through the reception area) is very good. In fact all of the restaurants in San Francisco we ate at were of a very high standard."
25,2182,"Jun 13 2009 	Awesome Hotel	This was my first trip to San Francisco and I didn't really know what to expect or where to stay..... I did a little research online and we stayed at TheKensington Park Hotel...... WOW!!! Great lobby with free evening tea &amp; sherry. Great beds, large flat screen TV's and the shower had great water pressure!! 1 block to Union Square...... all of this and the price was affordable for a large city."
26,2182,"Jun 10 2009 	Simply Perfect	I always stay at this hotel when I am in town and recommend it to colleagues and friends as well. It is a perfect location - just steps from Union Square. The Powell Street Bart station is just a few blocks away, so those coming from the San Francisco airport can save themselves the price of a cab or shuttle! The hotel is in an Elks Club building, and still maintains an air of &quot;clubiness&quot; - old world European charm. Tea and Sherry in the afternoon at the hotel is a delightful touch. The rooms are pleasant, clean and although you may hear some street noise (ask for earplugs at the front desk, just in case), I have NEVER been bothered by noise from the hallway, adjoining rooms, etc. This hotel seems to attract a respectful clientele. Hint: For your morning coffee, go down to the corner Borders bookstore and visit their 2nd floor coffee shop. Grab a seat by the window, which directly overlooks Union Square, and enjoy people-watching at its finest!"
27,2182,"May 17 2009 	Kensington Park Hotel - Fit for Royalty	Everyone knows that traveling can be expensive. On tight budgets, oftentimes the first place you cut is your hotel quality because all you really need is a place to lay your head at night. However, this can be one of the most important parts of your trip. Who wants to share their bed with bedbugs or mites after a long day of sightseeing? That can truly ruin a good time, don'tcha think?My experience at Kensington Park Hotel in San Francisco has been wonderful. It is one of the Personality Hotels in SF and is located at 450 Post Street, right in the heart of Union Square. I stayed there in November 2008 for a couple of nights and again on my recent weeklong adventure from May 5-11, 2009. Why'd I go back? First off, the price was right. Obviously, from looking at its website, Kensington Park can be a bit high for most budgets. However, remember that you're in SF and that everything is pretty expensive. I got a great deal for air and hotel from Honolulu so I booked it right away. There were other air/hotel deals out there (believe me, I combed all the usual sites and then some), but when Kensington popped up within my budget, I jumped at the chance to stay there again.What I learned last fall is that their beds are truly heavenly, especially after a day of walking up and down hills or in and out of stores. I have never slept on a bed better than this one, and this includes my own bed at home. I don't even know how to describe it to you. It's just the right firmness and softness to ease your aching body to sleep every night. You melt into the comforter and are engulfed by softness.Another good quality about this hotel is that the staff is very accommodating. My flight arrived at 5:55 a.m. and by the time I got to the city it was around 7:15 a.m. Despite this ungodly hour, the staff allowed me and my BFF to check in way ahead of schedule. (When we called to double check that they had our reservations, we put in a request for early check-in but they said they couldn't guarantee anything.) I can only imagine that either we looked pretty had-it from the red-eye flight out of Honolulu or that the staff was very, very accommodating. I like to believe the latter but cannot be sure.The room we were given (#4 on the fifth floor) was a bit smaller than the one we received on our last trip. However, this could also be because we were only two people and last fall we had three. Even though the room and bathroom were smaller than before, they were still very satisfactory. Everything was clean, which was a definite plus. There was no mold, mildew or hair in the bathroom. The beds were made and everything seemed to be in order. For a peek at the rooms, check out their website. Yes, those are probably professionally done pictures and no doubt are enhanced with a little help from Photoshop. But, trust me. That's exactly what the rooms look like, if not just a tad less bright and vibrant. Still, the beds and rooms definitely live up to the PR/marketing hype of the website.Another good thing about the staff is that they're very friendly. I hate to admit it, but for the life of me I cannot remember the name of the guy at the front desk. There were actually three different people at the front desk at different times of the day and night. However, the night shift/early morning guy definitely stood out. He's the guy who checked us in (this time and last time if I remember right). Every time he saw us, he'd greet us with a big smile and address us by our names. Yeah, he actually remembered our names! Amazing when the hotel seemed to be almost fully booked. This kind of customer service is a sign that Kensington Park is really going the extra mile for its guests.If you're not convinced by now to try this hotel on your next SF visit, let me add that it's only a skip away from all the shops at Union Square, steps away from the Muni (cable car and buses) and just a couple of blocks up from BART. The location is hot, hot, hot. So definitely try Kensington Park Hotel because it's fit for royalty.--------------------------------Check out:http://skycastles808.blogspot.com/http://movieaddictsclub.blogspot.com/"
28,2182,"May 14 2009 	Lovely hotel fabulous location	We stayed at the Kensington Park for 2 nights. The location is perfect, walkingdistance to many restaurants, shopping and cable cars. It was nice to have thepersonal service and touches of a smaller boutique hotel. The staff were veryhelpful with transportation and restaurant suggestions. We faced the street anddid get some street noise but you are in downtown San Francisco, same as anylarge city. Would absolutley come back."
29,2182,May 13 2009 	Newly Renovated and pet-friendly	When I went the rooms had just been renovated and every detail was immaculate. The location was perfet. Central to all my needs. We ate at the Farollon restauant twice. The food was good and not too expensive for a hotel in the heart of San Francisco. I loved that it was pet-friendly. Being able to take my dog anywhere makes my life easier. The staff was so loving toward my dog too. I loved the architechture. Combining old world charm with the comforts of technology. The bed and bedding were pristine and soo comfortable.
30,2182,"May 12 2009 	Luxurious Romance and Fun Package	Kensington Park is a Personality Hotel and this hotel has got it all. One of the best in SF. right at the heart of Union Square where everything is accessible by walking right outside of the hotel! the view we had from out room was great, we had a telescope to see (spy!) on people outside! it was very fun! right outside our window we could see the union square, the ice skating rink (because we went during winter time) and the Macys all lit up! The bed was super comfy, had one of the best sleeps ever there. The staff is very friendly, the rooms are clean, comfortable, they also have a showroom, cinema on one floor as well as a seafood restaurant next door. I highly recommend this place. The hotel is very luxuriously themed and its quite the romantic time to spend there. However, with all the shopping, eating, skating, and looking around to do, its so much fun!"
31,2182,"May 6 2009 	A gem!	Couldn't agree more with previous reviews - and it's all true!!Perfect location! Friendly, helpful and attentative staff. Although no meals were available at the hotel it was nice that they provided morning coffe/tea and also had complimentary afternoon sherry in the lounge area. The room was spatious, was nicely designed and the bed very comfortable.Only drawback (very minor though), if you are a light sleeper - there is the street noise of San Francisco and the neighbours in the next room! But hey - the hotel is not sound proof!"
