IDREVIEW,HOTELID,REVIEW
30,616,"May 4 2008 	Goodf hotel for category	A very good hotel in central area of London. Very clean, a large and comfortable bad, room large enough, friendly staff. Breakfast is good. London, in the morning rush, is a noisy city but the hotel rooms are well isolated even the front street rooms are OK. Hotel is near London Tower and London Bridge (2 minutes walk). Tower Hill underground station is there and you can go everywhere in Central Area of London in few minutes. When I return in London of course I will stay there."
31,616,"Apr 29 2008 	Fantastic Hotel.	We have just had a fantastic weekend away in London.It was my 2nd Visit to the Chamberlain and it was just as fantastic as the first stay I had.The reception area is great, all the staff were very friendly and helpfull and we did request our room to be ready for 11-00 and yes we did arrive at 11.00 and the room was ready.How fantastic is that, it meant we could unpack and freshen up and go and see off for our visit to the houses of parliment which again I recommend to you all.Our room was lovely and also so quiet.Breakfast is great and the dining room had been redecorated and was nice before but even nicer this time.It also great that for a London Hotel check out time is 11-00.I cant fault the place its so handy for buses, and tube.Also recommend for anyone going to london order your Oyster card before you go and that is so handy for using around London and cheaper of course.The surrounding area was different this time because I went for 2 nights this time the area on Friday night was busy, not rowdy had a good atmopshere. Then come Saturday completely different everything was closed so was extra quiet.Cant wait to go back it wont be very long.Great value for money for Weekend rates."
32,616,"Apr 5 2008 	Excellent service	I go to London on a regular basis and I must say that this is the best hotel I've stayed at in this price range. The room was clean , quiet and comfortabe and I have rarely come across such professional, friendly service! The only minus is the area on a weekend as most places are shut for business (the hotel is in the financial district of London) but the tube station is nearby so not a big problem. However, more and more places seem to stay open for the tourist in the City these days so you won't be totally stuck for places to eat/ drink. Liverpool street station is very close. Highly recommended!!!"
33,616,"Mar 31 2008 	An enjoyable stay	My partner and I stayed at this hotel for one night, at the weekend. I thought it was very good value for money - having got a deal for bed and breakfast for 80. Normally, the rates are much higher and do not include breakfast, so felt we did very well!The hotel was nice, the staff very polite, and the rooms clean. Breakfast was a continental buffet, which was tasty. The only downsides I felt were the fact that not all the channels worked on the television, and the much-hyped tv in the bathroom didn't work. This wasn't too much of an issue for us as we were only there the one night and went out, but if we had been looking to stay in and relax, I would have felt cheated. All in all, I enjoyed my stay. I would not, however, pay full weekday prices that don't include breakfast."
34,616,"Feb 26 2008 	very good	very clean hotel ,helpfull staff ,only one minute from aldgate tube station,food good,b&amp;b only 190 for fri/sat"
35,616,"Jan 10 2008 	Brilliant small hotel	My girlfriend and I stayed at this hotel for a blissful two nights last week.It was easy enough to find (although the area wasn't one that I was familiar with). Also, it's only 5-6 stops away from Westminster on the underground, so perfect for those travelling into the heart of the city.We were greeted at reception by friendly and efficient staff, who didn't bat an eyelid at our request to check in 3 hours early.The room was spacious, well furnished and clean. The much vaunted television in the bathroom was in full working order and the only complaint I could make is that some of the hotel furnishings are a little dated (while well maintained!) Great choice of TV channels for those with kids, or those tired after a day of exploring Very quiet for London and slept well.Our rate included free continental breakfast, which was tasty if unimaginative and was served by very friendly staff.Much better than most hotels in London, even those with and extra star and a steeper price!"
36,616,"Dec 30 2007 	Great find	This was a surprisingly good place for a night in the City. Room was bigger than most City hotels, nicely appointed and with a lovely bathroom. No complaints at all, and the added benefit of being able to park right outside if you stay on a Sunday as we did."
37,616,"Nov 30 2007 	Fantastic Weekend Rates	This hotel offers fantastic weekend rates (65GBP for a regular room, 75GPB for a deluxe room). In addition, they include a full English breakfast (including a continental buffet) on Saturday, Sunday, and Monday mornings in the room price. The rates during the week are in the 200GBP range, and it definitely felt like we were getting a MUCH nicer room for a very cheap price (this IS London after all - 75GBP will only get you into an IBIS here with no free breakfast).We made our reservation on the hotel website 2 hours before arriving. When we got there they didn't have a copy of it yet (I'm assuming it gets faxed from a central office as they checked the fax machine) but went ahead and gave me a room at the rate shown on the printout I'd brought. (Take a printout of your internet reservation with you - ALWAYS, to any hotel - to make sure you get the rate shown on the web.)We went ahead and paid for the deluxe room which was very nice. No additional charge for our infant daughter to share our room. No view to speak of - the building next door - but we don't spend much time in our hotel room during the day to enjoy the view anyway. We were in room 101. Nice electronic room temperature controls. Funny little TV screen in the bathroom so you can watch TV from the tub! The room had a tub AND separate walk-in shower, heated towel rail, and nice bathroom amenities (i.e. soaps). Breakfast was great - they don't officially start until 7am but around 6:45 when we came downstairs they went ahead and got us coffee and some toast while they were getting everything set out. Nice continental layout - meats and cheeses, fresh fruit, croissants, etc. My husband had a full English Breakfast and I had porridge, all included in the weekend breakfast thing. Easy access to Tower Hill and Aldgate tube stations, as well as Tower Gateway DLR. We drove into the city and parked at Thomas More NCP car park (good weekend rates - around 8GBP per day) then walked the 10 minutes or so to the hotel. No problems leaving our luggage the entire next day after check-out."
38,616,"Oct 9 2007 	keeps authorisation money still locked	I was quite positive on this hotel, even after they had removed the extended mirror in the bathroom without any reason. I just asked them to return it back if possible.I stayed at the hotel from 23-Sep-2007 till 28-Sep-2007. I wouldn't say it is a perfect hotel, for the 4star rank it could be better of course. But as a unpretentious person I felt everything was okay till now. Today is 09-Oct-2007, more than 10 days from my departure from this hotel and the money on my card that had been blocked during the authorisation procedure are still being blocked. I have made already 3 times to the hotel. At first call there was a young man telling me he is busy and advising me to call later. Second time another man answered he was working for his second day in the hotel and didn't know how to unlock the card. And the third time the lady has transferred me to the reservation department, the member of which told me she couldn't find any records on me and asked me to send her email with details of my full name, dates of arrival and departure and the number of the credit card. I have written them all details apart from credit card number of course. I fain this ridiculous, she could have asked for the security 3-digit number as well. But I am still there with my credit card being locked and noon still contacted me from the hotel."
39,616,"Oct 8 2007 	Brillant Brillant Brillant	We stayed for 1 night as part of a wonderful surprise weekend arranged by my husband for my birthday.We have stayed in bigger hotels in London, which have lovely reception areas's, but the rooms have been just ordinary.Not the case with the chamberlain.As soon as you walk in the hotel, everything is spotlessly clean, and very warm and inviting. Beautiful fresh flower arrangements are in abudance throughout the hotel. The carpets were lovely and thick and of high quality.The receptionist was exceptable, even remembering our name the next day when checking out.Upon walking into our rooms, we instantly knew that we had choosen the right hotel. They were just beautiful, even down to the little details. Gorgeous High Quality furnishings and bedding and having the Plasma TV screen in the bathroom completed our wonderful experience of staying at this hotel.We are sure that anyone staying at this hotel will not be disappointed, and we would recommend anyone else to stay here.It is literally 3-4 min walk to Tower Of London, which is beautiful when all lit up on an evening....."
40,616,"Oct 5 2007	Great service	The best thing about our stay in The Chamberlain Hotel was the treatment. In a hotel you usually get EITHER good facilities, location, price or service but in The Chamberlain Hotel we found all three. We stayed for three nights and the staff were always friendly and willing to help, nothing was too much, even local information such as transport, if they didnt know something they find out. So all in all right down to the little touches such as fluffy white dressing gowns and a plasma TV in the bathroom the stay was great and I would recommend this hotel to anyone."
41,616,"Sep 20 2007 	Ideal for underground	We stayed in The Chamberlain for two nights in April 2007 and recommend the hotel for its location for Aldgate underground.We booked our room over the internet and, although the confirmation was for bed and breakfast, I knew from reviews of this hotel that breakfast wouldn't be included. There is a Wetherspoons near Tower Bridge and the breakfasts there are excellent value for money (two brekkies for a tenner).The room was booked for a 1pm check out which was definitely worth paying the little extra for. As our room was on the second floor we didn't hear any noise from the Underground, but I understand that rooms on the ground floor suffer from the vibrations from the trains.There was an excellent welcome tray, the rooms are extremely clean and the hotel upgraded us to a roof terrace room and so the balcony was a lovely extension to our room.The Chamberlain is close to Aldgate Underground which serves The Circle Line and Metropolitan Line, within walking distance to Brick Lane - famous for fabulous curries -and the Bank of England and St Paul's.I wouldn't hesitate to stay at The Chamberlain again, especially for the television in the bathroom - just make sure your partner doesn't keep flicking channels when you're trying to watch Deal or No Deal!!!!!"
42,616,"Sep 17 2007 	really friendly	I have just returned from a weekend in London, we took advantage of the Open House weekend held every year in the capital ,it is a fantastic chance to get to visit buildings not usually open to the public I would really recommend it.we stayed at the Chamberlain Hotel situated a few minutes walk from The Tower of London, the hotel was a fullers hotel which meant a fantastic pint of good london beer was on offer!The hotel has about 64 rooms and is exceptionally clean and the staff were really helpful and friendly, the only problem I encountered was the TV in the bathroom did not work and i was quite dissapointed, I had looked forward to luxuriating in bubbles whilst watching 'who wants to be a millionaire' !! but this was not meant to be!!The only other downside but I think this applies to most london hotels was the price of the breakfast, 15 for a full english we declined this as the Weatherspoons chain of pubs offer a huge breakfast for 4.50 a fraction of the price, apart from that I would definately recommend this hotel."
43,616,"Aug 18 2007 	Great if you can get a special rate	We live just outside London so we often stay in London hotels for a night after seeing concerts or whenever we know it's going to be too late to get the last train home.We booked the Chamberlain through Lastminute.com and paid 69. For this price, the hotel was an excellent choice. The regular rate, however, is about 220.The room was a good size, and very clean. The bathroom was lovely. Overall the room felt like it had just been redocorated.The aircon worked well (something we're quite fussy about!). We were at the back of the building and our room was nice and quiet. The beds were comfy too.Re previous reviews about towels etc - check the wardrobe for spares! And all hotels these days suggest not washing towels every day (the environment and all that) so the Chamberlain can't be faulted on this front.The pub downstairs was nice for a quiet drink (quite a rarity on a Friday night in the City!). The food both in the bar and through room service was basic but nicely done. Locationwise, it's two minutes from the DLR and the tube, and from tourist sites such as the Tower of London and Tower Bridge.We were really pleased with our stay but this review might have been different if we had paid 200! Would be good if you have business in the City (ie, if the company were paying). If you're looking for high-end hotels though, this might not cut the mustard. For 200 you could stay somewhere much nicer in London, the Zetter in Clerkenwell for example, or you could save money and stay somewhere like the London Bridge Hotel, which is just as nice, and only 150ish."
44,616,Aug 2 2007 	Not so good	We tried to book the excellent London Bridge Hotel as usual but unfortunately on this occasion they were full and were recommended the Chamberlain. The rooms were ok but we found that the much publicised plasma tv in the bathroom didn't work and there were not enough towels. When we arrived back in our room after our second day around the city we found that we had no new towels at all !! The cooked breakfast was cold and although there was cold meat and cheese there was no bread or rolls to have with it. On check out we were charged for cooked breakfasts that we didn't have and when we explained this to the receptionist she didn't believe us and went through to the kitchen to find out and still came back and told us that we did have cooked breakfast every morning !!! She eventually found someone who told her that we didn't but by this time we had decided that if our favourite London Bridge Hotel isn't available next time we certainly won't be staying at the Chamberlain !!!
45,616,"Jul 10 2007 	Great Hotel	I stopped at the Chamberlain for a week end break in July and I found the Hotel to be excelent value for money. The staff were always friendly and happy to help with any enquires. The room was comfortable and clean, I liked the tile tv in the bathroom which is something I have not encountered before. The location in the city is quiet at weekends and close to two tube stations and I ate at a Thai restaurant on the same street as the hotel and would do so again. Overall the hotel contributed to an hugely enjoyable weekend and i would definatly stop there again."
46,616,"Jul 9 2007	wow fantastic	i would reccomend this hotel to anyone, we stayed on the tour de france weekend the service was great and the rooms were immaculate. the continental breakfast is a must , very good location as its ten minute walk to tower bridge and the tower of london. lots of attractions for people to visit. we will stay again next year ."
47,616,"Jun 24 2007 	Great hotel great experience!!	Stayed in the Chamberlain with my girlfriend 22nd - 24th June (Fri &amp; Sat nights) and had a brilliant time, everything was spot on from the moment we checked in until the moment we checked out! The room was very cosy and comfortable, not to mention spotless, and had everything you could expect of a hotel including the most comfortable bed you could dream of, all mod cons (tv, phone, internet access, hairdryer, trouser press etc...) and a small tv screen built into the wall above the bath!!Food was also good as we ordered room service on the Saturday night - service was very prompt and the food itself was very tasty with a menu consisting mostly of traditional English grub. One thing I should point out though, is that the items in the mini bar seem to be on pressure switches as we had a wee look round it before replacing the items, only to be charged for them on departure!The Location is good for tourists as it is only a 5 min walk to the Tower of London and Tower Bridge and has 2 tube stations located within roughly 2 mins walk (Aldgate to the North and Tower Hill to the South) which will take you pretty much anywhere in the city for a small fare.Staff were also very helpful and friendly throughout our stay.Overall, we had a great time and would recommend this hotel to anyone - we will definitely use this hotel again any time we are in London."
48,616,"Jun 4 2007 	Weekend in the smoke.	We stayed in the Chamberlain for a Friday and Saturday night so that we could go out and enjoy some of London without having to worry about heading back to Kent at the end of each day!The room we stayed in overlooked the back of the hotel but it was clean and well presented and the view was fine (Not that we stayed in the room to look at the view!). The windows didn't open fully but luckily the room had air conditioning which kept it cool during the night. The bathroom has a mini LCD screen fitted into the wall, which would be great to lay and watch while in the bath, shame I had a shower. It's a little difficult to see through the glass, but turned onto the radio with the volume up a little you can hear it easily.Most of Friday was spent in the bar after eating in a nearby restaurant. The bar is also a pub open to the public and has the full range of Fullers beers on offer as well as some bottled Belgian and European beers :) The beer was good and the staff seemed to know what they were talking about when I asked about a couple of beers I didn't know and they were happy to let me try a sample. One surprise was the table service, as I neared the end of my pint a waitress came and asked if I would like another drink! Excellent, I didn't even need to leave the comfort of the big soft sofa.Will go back again for a weekend in the town."
49,616,"May 30 2007 	Had a really great weekend	I've stayed at this hotel twice previously on business and decided to book a surprise romantic getaway for my partner. We had a wonderful time. The rooms are on the small side but were well laid out and more than adequate for our needs. It feels like a boutique hotel, beautiful decor, luxurious toiletries in the bathroom, yummy biscuits on the tea tray, fresh flowers in the lobby and the TV above the bath is a nice touch. The staff were a pleasure, so helpful and very friendly. We asked about last minute theatre tickets and the manager at breakfast went off and found all the information we needed and then gave us directions to where we needed to go. We felt so relaxed after a leisurely breakfast it was almost a shame to leave and be touristy! We walked the five minutes to the bus stop and bought a two day pass which got us round all the sights, hop on and off as you like. We returned to the peace and calm of the hotel, a lovely bottle of wine and a very restful nights sleep. The following evening we had dinner in the bar which was really nice. I will definately use this hotel again in the future, for business and pleasure."
50,616,"May 22 2007 	Really good hotel !	We've spent three nights at Chamberlain ( 18-21 May) and really satisfied with the hotel. Helpful staff, quite good location ( close to Tower London), not large, but very clean and comfortable room, nice breakfast. I've booked our room via hotelsrus website. Got a very good deal ( 81 ? for a double with breakfast ) !Before booking I checked the reviews about this hotel on this forum. Must tell you, that the reviews are not so good as my experience with the hotel. I think it's a really nice hotel ! And not to speak about the price ! They have special weekend offer. Located in the City of London, which is a very quiet place at weekends. Close to the hotel ( 5 min. walk) you can reach two tube stations ( Aldgate, Tower HiIl ). So, I highly recommend this hotel for anyone travelling to London, either on business, or just for fun !"
51,616,"Mar 28 2007 	Very good hotel for City business	This is an excellent boutique hotel for business travellers, especially those with business in the City. The rooms are small but very clean and well-appointed with comfortable beds, good linen, reliable broadband internet and very nice bathrooms that include a small TV embedded in the wall so you can lie in the bath and watch your favourite show.I've stayed at the Chamberlain three times and have had a consistently good experience. The staff are friendly and efficient, and the food is reasonably good for hotel food. There is a small pub attached which is convenient for casual meals, as there are few restaurants open in the neighbourhood on the weekend."
52,616,"Jan 18 2007 	Half-decent hotel	I stayed in London for tourism for four days after a business meeting I attended in a nearby town had ended. My check-in experience was less than perfect as the desk attendant was slightly rude and not forthcoming for the information about which I inquired. On the first morning of my stay I made the mistake of trying the abysmal breakfast buffet, obviously bad so that guests are encouraged to order a la carte. The hot pot that came with the room didn't work. Twice I complained to housekeeping it was not replaced. The housekeeper did not wash a dirty glass that I had used, which I found completely unacceptable. The room/bathroom was kept pretty clean. The hotel has a bizarre perk of placing a tiny plasma TV in the bathroom facing the tub but (1) I'd never take a bath there; (2) I didn't care for watching TV in the bathroom! On the positive side, the hotel's room service and hotel bar/restaurant (Fuller's) are very good. I ordered room service once and ate at the adjoining bar once. Both times the food was good quality English fare (fish and chips, pot pie, etc.). And I'm not a huge fan of English food.When I booked a cab before my departure it arrived promptly. Wake up calls were also perfect."
53,616,"Dec 10 2006 	Good value for 99 BB !!	We stayed one night in superior room # 409.Had our room at 3pm as promised despite the fact that they were fully booked the night before.The good thing about being on the 4th floor is that you don't feel the vibrations of the metro as some of the travellers mentioned it in their reviews. View on the inside court with emergency staircase in front, so nothing exciting, but that was not important to us. The street view would not have been much better as it is located in a business area. Not far at all from the metro Tower Hill, so that was good. The lobby is very nice and charming. Typically English!Lift: modern. Impressive. Decor: liked very much all the engraved pictures in very nice frames. The room was large enough with a table and 2 nice chairs, desk, a minibar and a TV on top of it, a nice and large bed with a cosy duvet. Air conditionning worked well. We had two robes, and 2 chocolates. Iron and ironing table in the closet, as well as a press for pants. Did not tried the TV neither the small plasma one in the bathroom. Bathroom was nice, large enough, with a bathtub and a shower. There was also a phone. However, a hair dryer would have been much more appropriated than a tv!! Front desk staff was fine. However, we would have appreciated recommendation that the restaurant was too small for the whole guests and that we could have to wait... when we arrived at 9:40am on Saturday, there was a waiting list of 20min long! As we needed to leave precisely in 20min to get to the airport, we asked for room service and that was approved with no surcharge. Took them 10 min to bring it to us. They had no more croissants, but had other pastries. However, orange juice was preserved (and not from fresh squizzed oranges) and hot chocolate had no taste... Had only marmelade and honey.Location: Not far from London Bridge, in a business area as mentioned, so not very lively, particularly at night, but that was not a problem since the metro was not far (green and yellow lines). Not much more choice of restaurants, you need to go closer to downtown for that. The hotel had a restaurant that we did not tried. Overall impression was good. We would definitely come back there!Sorry, forgot to take pictures!"
54,616,"Nov 17 2006 	Ripped off with Breakfast!	Hotel convenient for City and good selection of beers in the bar (so they should be, the hotel is owned by Fullers Brewery!!), but experienced ruined by inattentive staff (everything was too much trouble), defects in the fire alarm installation (with the result that guests were evacuated around midnight and left to stand in the street with no explanation or apology) and double charged for breakfast on check out (Expedia rate expressly included full English breakfast, but this was denied by hotel)"
