IDREVIEW,HOTELID,REVIEW
219,407,"Mar 24 2009 	Would recommend this hotel	Stayed at NYNY for 9 nights (second trip to Vegas) mid March 2009 and found the hotel to be great. Check in was a breeze and we had booked a Broadway Deluxe room with a strip view. The room was quite large and the bed very comfortable. Bathroom was nice but for some reason no exhast fan so mirrors were always fogged up. Maid service was sufficient and room always smelt fresh. As some other reviewers mentioned the walls are thin but over the 9 nights we only had rowdy neighbours for 1 night - hardly a major inconveniance. The hotel has lots of choices to eat and some great shops. Casino itself was large enough not to get lost in and always found a slot machine or position at roulette table. Dealers were friendly and made the gambling experience fun even if you lost. Drink service while gambling was sometimes slow but if you tip well they would keep them coming. Overall I would recommend NYNY - it is at the end of the strip but is close to many other hotels (MGM, Excalibur, Luxor, Monte Carlo and Tropicana) regardless of where you stay you will have to walk or navigate down the strip at some stage. The major tip I would give people if you plan to gamble at NYNY and their partner hotels (Bellagio, MGM, Mandalay Bay, The Mirage, Luxor and many others) is to sign up for a players card straight away - we were only told about it by a roulette dealer on our third last day and during those three days of table and slot play were able to receive 2 nights out of our nine for free, a $50 voucher at America restaurant and $20 of free slot play. If we had of signed up on our first day I am positive most of our accommodation cost would have been comped. Check out was a breeze and Bell Service quick and friendly."
220,407,"Mar 22 2009 	Just OK.	The outside of the hotel is gorgeous, with the NYC skyline, and it continues its looks on the inside. We travelled during March Break, which might have been part of the problems we had. Our room (which they upgraded since they ran out of the one we booked), was right next to a bunch of college guys and they were annoying! Granted, I can't blame the hotel for my nrighbours, however the walls were so thin. Not only could we hear their conversations, but we could hear their phone ringing. Also, we were annoyed to realise the mornig we were checking out, that hotel guests got 10% off meals at a couple of the restaurants inside the hotel. We ate at those restaurants 3 times, at it was neevr mentioned! Overall, its a nice hotel, but I didn't like the service we received, or the really thin walls. However, I will give credit where credit is due, and the interior at the back of the hotel is amazing! Its like they rebuilt NYC inside the hotel with all the little shops and stores. That blew me away!"
221,407,"Mar 18 2009 	Staying further down the strip next time	This was the first time in Vegas for me and I was completely amazed! The NY,NY is almost to the end of the strip, it's a lot of walking but right across the street is the MGM and they havea monorail stop (ride it, trust me). The hotel itself was huge as is most of the other hotels but as a small town girl, I was a little overwhelmed. The room was nice sized but I do believe it was decorated either in the dark or by a blind person. Not to sound picky or anything but it was loud! But then again, it's Vegas and who spends that much time in the room? We had an awesome view of the mountains. You have to pay extra for a strip view but really, like I said, who spends that much time in the room? The check in was brief, didn't take long at all. People in the casino are nice it is so busy though, if you order a drink, be prepared to wait a LONG time to get it! We went to the America restaurant one night, not the best but was a decent meal, and we went at 11pm so... The layout of the hotel is pretty easy to negoitiate after a little bit of time! it is on the corner w/ Excalibur on one side and MGM on the other. Overall, we had a good time. Would I stay here again? Yes but want to experience further down the strip first. TIP: when you are in Vegas go see Blue Man Group at the Venetian...well worth it!"
222,407,"Mar 18 2009 	Great hotel Comfy beds Great Service!	We just got back from our Trip to Vegas March 9-13th. My boyfriend and I had never been to Vegas so we weren't really sure where to stay. We booked our vacation with WestJet vacations and they did a great job of giving us lots of different hotel options for a great price. We chose the New York New York because it looked hip, fun, and was decently priced. We arrived in Vegas at 10:00pm and had about a 10 minute wait at check-in. The check-in lady was VERY nice and got us checked in promptly. She even upgraded us to a Park Avenue Deluxe room for free. (We had booked a Skyline room) We got just what we had asked for-a non-smoking room with a King size bed. We stayed in the NyNy Tower room 1110 and the view was amazing. If you are older or have kids I wouldn't suggest asking how far of a walk the room is from the elevator, because my boyfriend and I are both physically able to walk perfectly fine and found it to be a very long walk to the elevator from our room.Our room was great. VERY clean, shower worked well (good pressure) and the bed was EXTREMELY comfortable. I haven't slept that well in a while. The mandatory $3 a night fee for the telephone came in handy because we made many phone calls to get show tickets/times/reservations. When we couldn't find any extra pillows we called down to housekeeping and they brought us up some extra ones along with extra towels within 5 minutes of me making the call. GREAT service!There were only two things we didn't like about the room. 1. The shower doesn't drain very well. It wasn't until we got back to Ottawa that we realized that they actually do this on purpose to try to get you to conserve the water. (You end up soaking your feet while you're showering basically)2. Our room was overlooking the rollercoaster so you would hear a lot of rattling from the metal and some yelling from the riders. It wasn't unbareable by any means, but it may be a nuisance for some people. The hotel itself has lots of great food options and they really try to keep with the NY theme. Casinos are all really smokey and the hotel always seemed really busy.The night before we checked out we called down to the desk to see if a late check-out would be a possibility. They allowed us to check-out at twelve noon even though check-out was supposed to be at 11am. Our flight only left at 11:30pm that night so we had a long day and wanted to check out as late as possible. Upon check out, we had some luggage we needed to put aside so we brought it to the Bell Desk and they dealt with it very quickly and stored it away safely. It was fast and friendly.Upon check-out we only waited about 3 minutes and the lady at the check-out counter simply asked for our names and then told us we could keep the key as a souvenir, and thanked us for staying there. That was it. Simple and fast.My boyfriend and I are not fussy travelers and we are satisfied if our bed is comfortable enough to fall asleep in, the room is clean and that we feel safe throughout our stay. We were very pleased with our stay at the New York New York"
223,407,"Mar 17 2009 	Great location and value. Rooms are questionable.	We stayed in the spa suite. The bed was very uncomfortable and we could hear everything going on around us. The huge tub with surrounding mirrors was great, but that was the ONLY highlight."
224,407,"Mar 17 2009 	Dissapointed	We went to the NYNY in October last year (2008), and were very dissapointed. When we walked into the casino, the centre of it was cordoned off as they were doing some construction work, and we could hear loud hammering noises. We went to Vegas to experience all the casinos, and on a previous visit had really liked NYNY but we feel that we should have been told about this when booking (we rang to book).We were two couples, and had rang to book to request rooms close to each other. On arrival and after a very long check in, we were told that the rooms were in the same tower but on different floors, this was OK although not what we requested. Our room was dated although had everything we needed. Compared to rooms at the Luxor and Treasure Island, where we had previously stayed for similar prices, the rooms were nowhere near as good. Unfortunately, our friends room had a strong smell of smoke, when they rang down to say that they had a smoking room and wanted a non smoking room, they were told that they didn't have to smoke. Their room was changed the following day to a non smoking room.The bars and restaurants were OK, but felt a bit rubbish as we could hear the construction work, and this also blocked our view of the whole casino. The pool area was small and not as good as others on the strip.Location wise, its OK, although in future I would stay nearer to the Bellagio."
225,407,"Mar 13 2009 	Outdated Rooms	We went to Vegas last June and stayed at MGM. This trip we decided we wanted to stay somewhere different, and went with New York New York because it was the best rate we received. I didn't expect New York New York to be as nice as MGM, yet we were still disappointed in general. Check-in was long and drawn out, it seemed as if the person helping us had no clue what she was doing. We were upgraded to a Park Avenue with a &quot;deluxe strip view,&quot; and I am so grateful we were, because based on our &quot;upgrade,&quot; I NEVER would have wanted to see a Skyline Room. The Park Avenue was set up in a very strange manner. The armoire seemed way too big for the room and was oddly placed. Also, there was no closet. The bathroom was tiny. The beds were incredibly uncomfortable, and the linens were something you might expect to find in a rundown motel. I don't understand what was done when the rooms were renovated because it seemed very outdated. My biggest complaint was the fact that housekeeping did not show up until around 3pm each day. Everyone in my party is an early-riser, so our room was always vacated early, yet we would come back around 3pm to find housekeeping just coming in to fix the room. I am just glad that it wasn't warm enough to sit by the pool because the pool area looked very disappointing, especially when compared to others on the strip. There were some positives about the hotel - the 24 hour essentials shop was a great place to get everything you need. The hotel overall was incredibly clean and well-maintained, and the restaurant Chin Chin was very good. Basically, if you have kids I would recommend the hotel for the family friendly vibe, but if you are looking for a decent hotel at a good price, I would definitely suggest going to MGM instead."
226,407,"Mar 11 2009 	NOT a 4 Star Hotel	Cleanliness: AverageService: I give this an average review due to one issue. I received free Zumanity tickets with my room, but I was then charged for them. I had to wait in line to have the charge removed, even though they were supposed to be comped automatically. I had the feeling that the &quot;automatically&quot; never happened and that the whole thing was kind of a scam. Otherwise, everyone was helpful and friendly. Also, the $3 per day phone charge was a joke.Location: Not bad...it's kind of at the end of the strip.Value: Average.Rooms: This was my biggest complaint. The decor was very dated. There was no fan in the bathroom, and there was no vanity outside the room. My iron and the makeup mirror lights did not work. The bedspreads were visibly worn and threadbare. The pillows and bedding in general were of a very low quality. Also, while being near the elevator was nice, I could hear it all night long.The restaurants and casino overall are pretty good. It is a fun place to hang out, but I would not stay there again."
227,407,"Mar 10 2009 	Big Changes at New York New York	We always seemed to end up at the New York New York when going to Vegas in the evenings because of the atmosphere, Live bands in the Big Apple pumping out Rock and Roll, The look of walking down thru Central park and a fun place to party. We started staying at the hotel when going to Vegas. Big shock in Novenber of 2008 for my wifes birthday, The Big Apple was gone, The Central Park was gone and replaced by machines and what was booming out all over the casino in the evening- full blown rap music from a new club that had just opened. We will be staying some place else from now on."
228,407,Mar 8 2009	Follow up to	A very nice rep from New York New York read my review and took the time to find me. I received a email so I called. She was very sorry this happened and said she would make sure that the clerk and Manager would be address and this would be brought up in meeting to work on Customer Service. She offered a comp room for my next trip and asked that it be offer to a guess at random. I just wanted to be heard.Thank you.
229,407,"Mar 5 2009 	Would not choose this hotel again because of service	The rooms were okay. Housekeeping does an excellent job. However the desk does not understand the word service. I took my Dad down -his first trip. We had booked a room with two beds, smoking. When we arrived at midnight I was told that there were no rooms available with two beds but they had upgraded me to a room with a king bed, non smoking and a strip view. When I stated that one bed would not work they said they would give me a cot. I do not consider a cot an upgrade! Besides which I had to phone an hour later to ask where the cot was. No one apologized. Being in the business I know what happened! I was told they would move us between 9 am and 11 am the next day. When I called the next morning at 10 am the desk told me that they didn't do room moves until between 1pm and 3 pm! Slight lack of communication or the desk person at night didn't want to deal with me anymore. I was put through to a manager and guess what -there was a room available immediately. Why do guests have to get really upset and go to managers before anything happens. Just a quick note- the strip view is not worth it-window very small and you had to climb around furniture to see anything. Our standard room had floor to ceiling windows with a decent view. We had a buffet breakfast in the small restaurant the first morning and I would definitely not recommend it. The selection was limited and the price high. I would absolutely recommend the America restaurant. Service was amazing and the food excellent. The casino was small, crowded and noisy due to the night clubs. Tables were very quiet.I asked for a late check out and was willing to pay for it but was told to come back the day before we were due to depart. I was told it would cost between $50 and $65. Went back the day before departure and was told &quot;no we don't do that until the day of departure&quot;! Oh and the rate would be some place between $60 and $119. Guess what on day of departure I was told sorry ( at least I got the apology) no late check outs! Again a total lack of communication and no service. Quite frankly, while the rooms are a high quality, Circus Circus, 4 Queens, the Venetian and the Stratosphere all have better service. Next time will stay at a different hotel."
230,407,"Mar 4 2009 	Good for its location and restaurant choices	Rooms are OK. Staff are reasonably friendly. Travellers should be aware of the room rates as they change daily. You might have booked it more expensively than what it is when you arrive. I find this kind of pricing policy annoying, to say the least. How about introducing a lowest rate guarantee?? The casino was OK, but most dealers were not exceedingly friendly. You might do better elsewhere, e.g. at the Bellagio, etc.The reason I chose this hotel was for its access to the Cirque du Soleil shows (i.e. Ka, Zoomanity), which you can easily reach on foot or take the bus to the Bellagio (for O).There are also lots of eateries downstairs and at the other hotels nearby. My favourite was the Mexican place 'Gonzales Gonzales' for the food, not for the service however.Another plus point for this hotel is the relatively clean air. Some hotels, such as the Venitian or Mandalay Bay, seem to have the idea that an attack of chemical smells throughout their premises will increase guest comfort or make them spend more at the games. Sorry to the psychologists who thought this up, but it just induces feelings of nausea and puts people through an olfactory stress test. In summary, this is a good place to base yourself for visiting the major attractions this town has to offer. Definitely go and see the shows! They are world class."
231,407,Mar 3 2009 	No coffee pots in the rooms!	The hotel and casino are darker than most of the others with everything crowded together. We were told upon check in that the pool was closed only to discover as we checked out that it was open. The rooms were small to average in size and dimly lit. The water pressure in the shower was great but I bruised and almost cut my leg on the shower slide getting in. Beds were comfortable but linens were well worn. Housekeeping was wonderful and always had our room ready regardless of what time we left or came back. The restaurants that we ate in were average in quality but not price. My number one complaint was there was no coffee pot in our room and I had to go down 24 flights and stand in line each morning for about 10 to 15 minutes to get a cup or call and wait for a little longer for room service to deliver. I didn't ask about the coffee por because it has been years since I have stayed in a hotel regardless of how nice it was that it did not provide a coffee pot in the room. The casino was small and low payouts on their slots - we didn't try any of their tables. It took about 30 to 45 minutes to walk to the middle of the strip. Would not stay here again.
232,407,"Mar 2 2009 	NYNY is good but not great	It is not a bad hotel at all and since you try to spend as little time in the room as possible its OK. I got annoyed at them the 1st day when we got to the room the safe was locked so I called house keeping and they said 15-20 minutes. 30 minutes laster I called again, he was on his way. 10 more minutes I call again and was told he knocked but no one answered. BS unless he knocked with a feather. Annoyed but not pissed. CheckinNo problem and fast around 430pm on a Thursday. I asked and we were upgraded to Broadway room becasue it was my birthday.BedsWe had a Broadway room with 2 double beds. They were OK.TVSmall. Why do you have a &quot;newer&quot; room with a 19&quot; TV? (We did get free porn)SafeThey had a small wall safe in the room and it worked just fine.BathroomVery clean. It annoyed me that they replaced all the soap each day. What a waste. No problem with the hot water in the morning, afternoon or evening.Internet Was $15 a day I think. I didnt get it.FoodThere are a lot of choices in the hotel which is nice. The prices are really $10+ for lunch and up from there for dinner. Even a hot dog, fries and a pepsi costs $8. But that is to be expected in all hotels on the strip.CasinoI like the casino and it always seems to be lively. Like everywhere else its a maze. I think this place gets me more confused then most.CheckoutNo problem ad quick at 1030 on Sunday. I really expected a long line but there wasn't anyone. Overall its not a bad place. it is on the far end of the strip. I'd be happy to stay here again if I get a killer rate like I did this last time with player club."
233,407,"Mar 1 2009 	New York - New York Hotel and Casino	We stayed here for 3 nights (Fri., Sat., Sun.,) over Valentine's Day weekend in 2009.We waited about 5 minutes in line to check in. It took us a while to find the check in counter. We had taken on of the mini-buses from the airport that drops off people at any casino and they had dropped us off at a weird deserted entrance. We looked for signs to the check in counter, but there were none, we ended up having to ask twice to find it.We had room 777. We thought that they would have said something being a lucky number, but nothing was mentioned. The room was a standard hotel room with a king size bed. The view from the window was of wall. There was nothing to be seen. The bathroom was average size and the water pressure was strong.We put our our &quot;do not disturb sign&quot; and did not have maid service during our stay. We saw the housekeeper every day on our way out, and she always asked if we wanted service or not, as well, we had our sign out.There is a small restaurant that has a breakfast buffet in the morning, but the buffet is extremely small with very few choices - you are better off walking next door to the Excalibur or Luxor for a &quot;real&quot; Las Vegas buffet. There were several other restaurants and bars within the New York -New York, including numerous quick food choices. We did not eat at any of these.There is an outside walk way/ bridge from the New York -New York to the Excalibur hotel/casino, and then the Excalibur has inside walking to the Luxor and then inside walking from the Luxor to the Mandalay Bay. There is also an above the street level walkway to cross Las Vegas Blvd to the MGM from the New York -New York.The casino floor in the New York -New York is small compared to other casinos on the strip. There were lots of slot machines crammed closely together and not as many table games as other casinos.Upstairs there is a large area with games for kids and access to the roller coaster. We didn't ride it because we thought it was too expensive (it was either $12-14 a piece).The show at the New York -New York is Zumanity, which is an adult cirque soleil. We saw the 7:30 show. Get there when the doors open, as there is entertainment from the moment you walk in. We sat in the balcony. The theater is relatively small, so I don't think there are any bad seats. I wouldn't sit on the couches in the front row, unless you want to be part of the show. Overall, it was a great show!We took a cab to the airport when we left - the cab ride was $10.50 before tip."
234,407,"Feb 26 2009 	It was OK	This was a family trip with spouse and two adult daughters. We have all been to Las Vegas many times but this was first time staying at New York New York. Lady at check-in was wonderful and speedy. She upgraded us a little, and we had two rooms with nice view. Rooms were good and very clean. No complaits in the room department and price was very good. None of cared for any of the restaurants we ate at. Coffee shop for breakfast was blah. Mexican food was not great. Food was very expensive ($3.60 for a cup of coffee). Because our daughters were with us we elected to stay on the strip, but in the future we would prefer the area by Ceasar's Palace, Bellagio, Flamingo &amp; Bally's, if staying on the strip. When it's just my husband and I, we prefer staying at Sam's Town and visiting the strip on their shuttle. I doubt the any of us will stay at New York New York again."
235,407,"Feb 25 2009 	Pleasantly surprised	We booked online through their website and got a upgraded room with a strip view for the same price as a regular room. The room was clean and in good shape. We were on the 18th floor acording to the elevator, did not seem that high. The view was nice, we were able to see the sun rise over the mountains. The roller coaster could be heard. It was not an obnoxious noise, more like a loud ocean sound. the room was close to the elevator. Other rooms are a long walk from it as there is only one set of elevators and they were at the one end. We only stayed there 1 night and went to the Paris Las Vegas for the rest of our stay. I think the comfort was the same at both places. I was expecting more from Paris and they didn't deliver. I would definately stay at NY, NY again."
236,407,"Feb 25 2009 	Great Bang for the Buck	My husband and I decided to travel to Las Vegas for a last minute getaway to meet up with a group of friends. They were staying at the MGM so we wanted to be close to them without paying the MGM pricetag. As soon as we arrived we were able to check in very quickly (although, we arrived late at night and I noticed during the day long lines). They gave us a room with a great view of the strip. It was decorated very nicely, it really looked like a hotel you would stay in New York City. The bed was good, not great. The 1st night we ate at the Italian Restuarant, Il Fornaio and we weren't impressed. Although the next day we had italian speciality sandwhiches at the cafe and they were very delicious. We used the gym, while a little on the small side we were able to get in a good workout. I got a polish change on my fingers/toes and it was VERY pricey. One thing that really annoyed me was that I recieved 10 VIP bracelets for the club ROK so our group decided to go there so we wouldn't have to pay a cover charge. Well, they don't tell you that it only applies before 10 pm and we arrived later so we ended up having to pay $25 each and it wasn't a great club. There are so many great clubs in Vegas I wouldn't reccomend this one. All in all, we had a great trip and would def. stay at the NYNY again."
237,407,"Feb 25 2009 	Smaller and cozy awesome rooms	Ok, It is a very nice hotel. It is very suitable for crowds between 21-50. There are many places to go out in there and its not so &quot;Overwhelming&quot; that you just give up. It is has a very good location. You can see the MGM, Excalibur, Luxor and the Monte Carlo. The pizza is cheap and good. Everything is so expensive in Vegas. I loved our room. We were on the 26th floor. The maid came everyday and cleaned great. Very clean and had a reasonable price. I heard the rollar coaster was awesome. Our trip was so rushed. Plan on having at least 3 full days in Vegas to get the full effect. Its so romantic.."
