IDREVIEW,HOTELID,REVIEW
15,1350,"May 8 2007 	What a Disappointment	This place was as expected for a 3 star 'Youngs' establishment so no shocks there. We had just got married so we arrived in the early hours and just needed the room for a night as our relatives were in our house. We overslept and arrived at breakfast at 5 past 10 and were told the kitchen was now closed for breakfast. Fair enough, we were 5 minutes late after all, but there was absolutely no allowances made for the married couple. We tried to reason and the only response from the waitress was a flash of her wedding band in a 'So What' manner. Right on cue 2 cooked breakfasts wafted past that had obviously been done at 5 to ten. The excuse being was that they were now getting ready for Lunch (do me a favour - it was five past Ten).Anyway as shocked as I was that they couldn't go the extra distance for the married couple we went to pack and return the mile and a half home. Only to find we couldn't wash because the could tap in room 304 doesn't work and on the way out to put a cherry on top there were 2 chefs enjoying a ciggy break in the waste area. (Clearly rushed off their feet).If you want a classic 'Youngs' approach to hospitality, heres where to find it - Woeful for 100 for 8 hours sleep in a cigarette smelling room with no cold tap in the bathroom."
16,1350,"Mar 23 2007 	They saved us!	What a weekend!!! We were victims of the fire that disrupted the Eurostar service on March 16 and the hotel (guesthouse) that we had booked was evacuated. So, we were homeless and didn't know the zone at all. Someone recommended us to check out the Windmill Pub on Common.Wow, what a place, I loved the concept...it is a Pub + Restaurant + Hotel and they don't get mixed at all. You have people drinking and listening to semi loud music at the pub but still the people at the restaurant are having a nice meal and you at the hotel can relax without listening to a thing! Nice! True, the price is a bit high (100 pounds) but they have specials and you can get two nights for 160 pounds, not bad at London. Our old place wanted 65 pounds and that was without a private bathroom!The rooms are pretty well decorated though you can tell they are getting old. TV works fine, you get the normal channels, automatic heater/AC and obviously coffee/tea in the room. The bathroom was the part we liked the most.. The tub was huge, I am 5'7 and could almost submerge my whole body. Toiletries were provided. The bed was fine, I particularly liked it compared to other hotels. The only kind of annoyance was that the wooden boards creaked when you walked on them. Breakfast was included in the price and is not your regular corn flakes/muffins breakfast. They will cook eggs, sausage and other traditional English items for breakfast. We would have stayed another night but they were fully booked. Still, Caroline at the front desk was kind enough to phone at least 15 hotels to find us a room for that night. I would recommend this place to anyone who can afford it. It is close to Clapham Junction which takes you into Central London. Clapham is south of London."
17,1350,"Jun 1 2006 	average and expensive	overpriced for overheated rooms with Eastern European service, but still the best hotel in Clapham you can get."
1,1352,"Apr 27 2007 	Good Location Lousy Apartment	The location is very good with close proximity to 2 Tube lines. Flat # 6 is very run down with dirty carpets and blown bulbs, broken shower screen etc Don't bother contacting Woogoo's Customer Care Manager. He or she does not respond to comments."
2,1352,"Mar 15 2007 	Pleasant stay but with some minuses	When arriving in the dark it was impossible to see the phone by the door. Luckilly we met someone and they told us to dial 0 and showed us the phone. Our papers said a different phone number. Once we got the entrance code we could not see the numbers on the security box. (We are not so young 50 - 75). But once in it all was good except following:There was no bedside lamp. Why?? So if you read at night you had to get up to turn of the light. And the carpet on the lower floor was dirty. But other than that - good value for money and clean. We missed a storage room to put the luggage day of departure. Spacious rooms, small bathroom. Very good kitchen - also with washer. Elisabeth, Oslo, Norway March 07."
3,1352,"Jan 16 2007	Trouble to get in but once in we loved it	Having read the reviews after the apartment had been booked, we arrived with some trepidation. We did have trouble getting the security number using the phone number on the website. Eventually, after many phone calls and some misunderstanding on their part we got the number and was informed we had been upgraded to the three bedroom apartment.Once in, we were more than pleasantly surprised. Apart from the cream carpet having a few grubby marks, the rooms were very clean, spacious, well decorated with everything we needed. Unfortunately, we were only stopping one night so didn't get to enjoy it as much as we would have liked.Around the corner are many places to eat, an excellent Spar and Tesco's and Hyde Park just up the road.Apart from the early trouble of getting the security code (apparently the firm is based in Israel) we couldn't fault the three bedroom apartment."
4,1352,"Nov 22 2006 	a very bad experience	I booked this place direct on the recommendation of a colleague as a quality inexpensive central safe place to stay in London.For GBP99/night Woogo confirmed in writing that I had been upgraded from a studio to a 1bdr apartment. On arrival I used the phone at the entrance and was connected to what I now realise was a call centre somewhere in the world (Mexico?) and the people had no idea of the location or what the property was like. After being told to enter the building and pick up the keys - I couldnt find the apartment. there was no #1. Eventually I found a resident who directed me outside the building and down into the basement where I found a 1 room apartment (studio) heated to about 30 degrees C. On checking out the appliances the bottom of the kitchen module fell off. Also, despite promises in writing by Woogo there was no phone. I called the call centre who said I needed to speak to the building manager but it was his day off. 24 hours later someone came while I was out and re attached the bottom of the kitchen however this meant that the dishwasher could not be opened but I already ascertained that there was no power to it anyway. There was still no phone, and the only picture on the various tv channels was snow. By this stage I had called the call centre maybe 6 times and in all cases they referred me to the building manager who in the 3 days I was there made no attempt to contact me or rectify anything. Eventually I emailed Woogo and gave them 24 hours to rectify the problems - no response. I have now moved to a hotel which is clean comfortable and safe (pity about the roaches and the rising damp at Woogo Bayswater). Another matter arose which made me feel quite unsafe however I gather this cannot be posted on this site.I would not recommend Woogo Bayswater to anyone."
5,1352,"Nov 3 2006	Worst service i've ever encounter	Bad service.....call up the person in charge and he told us that we had to wait till 3 pm in order to check in. When we asked more info regarding getting the key...he just replied unpatiently and said &quot;sir please get there and then call again&quot;. Everything had to be done in his way or no way. Then when we got there, call him again and unpatienly he just told us how to press the code and get the keys. The apartment is really run down, no person will attend to you if there is anything wrong. During our stay, some drunk fellow just sat outside our unit. What an unsafe place to be in."
6,1352,"Oct 31 2006 	worst company ever	A company representative called us at 3.15 pm - 15 minutes after we could have checked in - saying that we had to be relocated due to unforseen maintenance problems. We were originally booked at Kensington Palace, with 5 stars (now I doubt this too) and the guy said that we would be upgraded to Bayswater. The stress of the situation was awful, not knowing London or where the new apartment was wasted a lot of time. When we arrived at the apartment I was so upset. It was a dingy basement bedsit, with dirty sheets and a dirty bathroom. AVOID THIS COMPANY THEY ARE SCAMMERS!!! The staff were all totally unresponsive and blunt, and the whole experience was dreadful."
7,1352,"Jul 23 2006 	Very disappointing	This was a very disappointing experience. We were told upon arrival on the phone to go to the apartment and someone would be there with our keys to let us in. We took our 4 children and all our luggage only to find that no one was there and we had to take a tube ride to retrieve the keys-it took incredibly long to finally figure this out, with three phone calls and 3 staff each telling us something different. The apartment was marginally cleaned-old earring on the floor, very stained (disgustingly so) pillows and duvet, towels inadequately sized. The kitchen had no basics-not even paper towels or salt! The bathrooms had one roll of toilet paper!! Very unusable for a family. The microwave and clothing dryer were broken and after calling they never got fixed-left with a pile of dirty laundry. Unable to talk to a person when I called customer service-no one was there! It was so bad it was almost funny."
8,1352,"Jun 18 2006	not as expected very disapointing.	after reading your feedback on accomodation in bayswater (17- inverness terrace) we were reluctant to go! we thought it cant be that bad surely! we are back now after a weekend away. the accomodation as previous customers had pointed out lived up to the reviews. 1- the 3 bedroom apt- sleeps up to 8 people! two seperate rooms with double beds. one with ensuite. the third bedroom leads from the lounge gaining access from a spiral staircase. a double bed is located here, with no privacy. 2 fold down beds in lounge, not clean.- very tatty. 2- when we arrived we were very disapointed. the accomodation does not meet up to the standards that are advertised. the pictures of the luxurious bedrooms we never saw. the place needed a good clean and also a lick of paint. 3- for the money we paid, we expected a lot more. VERY DISAPPOINTED CUSTOMERS!!!!!!"
9,1352,"May 15 2006	Great deal for a flat through Woogo [...]	We recently spent 4 nights in London and I rented a flat through [...], I got an early booking discount since we reserved it about 6 months in advance. We paid only 300 pounds for 4 nights and had a studio flat. The flat was in the Bayswater area at 17 Inverness terr, it is a 2 level flat, very small. The first floor is a kitchen, a spiral staircase to the second floor which is a bedroom and bath. I was able to pick up a wireless internet connection within the flat which was nice. The kitchen was minimally equipped but enough for our breakfasts, there was a stove, fridge and microwave. The washer and dryer worked fine. The location was great as it's about a block from the Tube and the area was quiet and nice. This was cheaper then most of the hotel prices I found online and the accomodations were very comfortable."
10,1352,"Jan 11 2006	Bait 	Upon return from our vacation I did a web search and learned that Woogo is nothing more than a rebranded Yourstay. And Yourstay lodging has a notorious reputation for the mistreatment of lodgers.Enjoy Woogo with the following expectations:(1) Rooms not as advertised. Two bedroom means that someone gets to sleep on a mattress in the living area.(2) Fully kitted kitchen is not. A few plates, and some flatware, applicances which do not function. A stove with three of the four burners inoperative. A microwave oven which does not work. (3) If you want a clean unit, then do you own cleaning upon you arrival.(4) The location of the flat will not be as advertised. After you arrive you will discover that your quoted and guaranteed rental is 'currently unavailable'.(5) Marginal locations suggest that you consider not leaving the premises at night.(6) Company representatives on the phone will gladly treate you like dirt after they have your money. They are not responsible for any problem with your lodging and never offer refunds for their commission of fraud."
11,1352,"Aug 18 2005	Best self-catering apartments in London!	Have been staying in the bayswater apartments for the last 2 weeks.have got one more week to go, and quite upset to go back to Blackpool...I have only the best things to say about the staff of Woogo and the weekly cleaning is always done is the best way.I have my own w/m, d/w and all the kitchen appliences i need.and more more than that- i have the wonderful kensington gardens 5 minutes away. the best park in London if you ask me.Worth your money till the last penny- i actually would like to leave a tip.5 star recommendation from me.Louise R Smith- Blackpool, UK"
1,1361,"Oct 11 2009 	Great Experience	Clean and Cheap!! Easy to book, great location!! Highly recommended!!"
2,1361,"Aug 12 2009 	Great Location Clean Rooms Good Value	I stayed at the YWCA Hotel Montreal. (They run a hostel too). It's got a great location for visiting Downtown Montreal, and even Vieux Montreal, if you don't mind the walk (almost 30 min, but lots of sights). You can walk to a variety of different restaurants at night. The rooms are clean and basic, and service is good. There is a restaurant in the lobby (breakfast is not included). The rates are fantastic for a big city--and the proceeds support YWCA programs, so that is a nice bonus. It's a quiet hotel and they have lots of tourist information and can help with anything you ask. The restaurant for breakfast is okay. Oh, if you stay out past 11, they lock the doors and you have to ring a bell to get in, FYI. Great stay on a budget, in the heart of the city."
3,1361,"Sep 27 2008 	Good value	We stayed in this hotel in Montreal for one night. We had one of the cheap rooms with shared bathroom. The room was clean with a TV and air conditioning. It was comfortable but not attractive. We were happy with the room for the price. The one real problem is with the bathroom and shower facilities. There's no problem with this as far as the ladies are concerned, but for men things are much more grim. The men's bathroom is dark and dirty, and you should be prepared to wait for your turn almost every time you visit. The shower room is a little better, but it too gets messy quickly. Here's my top tip: if you get fed up with waiting for the bathroom (and, eventually, you will), there's another one on the ground floor. It's the only additional one I could find. Or even better: pay a little more and go for a room with a private bathroom! Or even better than that: forget about staying in a hotel and book into one of the many good B&amp;Bs in Montreal for the same price!"
4,1361,"May 10 2007	Exceeds my expectation	I stayed a couple of days in Hilton, Quebec City for business prior to traveling to Montreal. This was a side trip and I didn't want to spend too much money, so I booked the Y hotel with not much expectation since I paid about $60 per night only. It turned out to be a pleasant experience. The facility is old and cannot be compared to Hilton but the room is almost as spacious as the 4 star hotel I stayed previously. The kitchen facility is a great bonus even though I didn't really use it. My guest visitors were also very impressed when they came to visit me."
5,1361,"Jan 13 2007	Great budget hotel	I stayed at the Montreal Y hotel when I went to a conference in Monteal in June of 2006. I highly recommend this place to travellers who look for an inexpensive and decent place to stay. (I showed my student ID to the cashier, and got 10% off!) In general, the area is pretty safe. The location is central, close to tons of restaurants, bars, and shops. There's a metro stop a few blocks away. The room that I stayed had a private bath. It looks like that the hotel is recently rennovated. Everything looks new! Both the room and the bathroom were very cean and comfortable. (The room was very quie?.) There's a TV set in the room. Also an ice machine down the hall way. There are a microwave, pots, and pans in their kitchen (there's a supermarket just blocks away), where you could prepare your meals. The kitchen is clean and has lots of sun light. (Also free use of the YMCA gym)The only downside is that there's no wireless internet access inside the hotel."
1,1362,Nov 13 2009 	Great Location	I stayed here 3 nights on a personal visit. I booked it through Expedia. I paid AU$545.05 including taxes for the 3 nights. The location was exactly where I wanted to be which is the main reason I chose it. The entrance is a bit odd. From the street you go though doors and down half a flight of stairs. What you see from the street is a hair dressing salon. The entrance to the hotel lobby is to the right of the salon. The lobby is incrediably tacky
2,1362,"Oct 18 2009 	Don't even waist your money	ya the rooms are small I went with my husband and son the beds were comfortable but the service ahhh no ... you know what don't even waist your time at the time of check in we requested a queen size bed they didn't have it available we made the reservation a few days ago, so they gave us another room at no extra charge, but they wanted a $20 deposit incase you rent a movie... anyway yes the bathroom is small and they had running hot water, but when it was time to check out the receptionist said ya you get your $20.00 back they put it back in your account so my husband called the credit card company to see if they put back the money ... the receptionist lied so my husband went back and had to complain the receptionist gave us the run-around so on top of that they gave us the money back in cash... and the parking lot was across the street from the hotel ... so if i were you don't bother going to this hotel i hope you make the smart decision"
3,1362,"Sep 15 2009 	Location location location	Best Western Europa is located in the heart of downtown Montreal, close to lots of shopping, restaurants and of course the Bell Centre. If you are planning to get out and keep busy seeing the sights, this hotel is great. If you want a large luxurious room to spend a bunch of time in, you might want to choose another hotel.&gt;Rooms are very, very small. Not only the actual room but the bathroom is tiny as well. Relatively clean, although while we were getting ready to check out we found an old black banana peel. Elevators are also small. No issue with noise, we found the rooms to be quiet. &gt;Staff is polite, helpful when asked.&gt;Restaurant in lobby, Chez Cora serves breakfast and was good, but long lineups on weekends. As noted above, lots of restaurants within walking distance to choose from as well.For us, the price was reasonable and the location was superb. We don't spend a whole lot of time in the room on trips, so we would consider staying here again next time we visit. Metro station is also close by, so getting elsewhere in the city (Old Montreal, ect.) is very simple."
4,1362,"Sep 5 2009 	Tiny rooms tinier washrooms horrible service	I am not sure why this hotel has good reviews.Small smelly rooms. Tinier washroom. Horrible service.We checked into the hotel because I have stayed at other Best Western hotels and this is nothing like them. Compared to this Best Western, the other Best Western hotels were luxury hotels!!I am writing this review from the hotel room.Our room was so small only one of us could move in the little space between our bed and the TV.The washroom was so tiny that you would have to sit on the edge of the pot so that your knees don't bang against the wall.The exhaust in the washroom gave both of us a terrible headache. The washroom did not have sufficient toiletries for 2 people so I called the front desk. It took me more than 1 hour to have 1 extra towel, soap and shampoo sent up to the room. Basically - a very disappointing experience. I would NEVER recommend this hotel to anyone."
5,1362,"Aug 27 2009 	Clean hotel good value	My boyfriend and I were pleasantly surprised by this hotel. Ups: Clean, comfortable hotel. Good location, and close to both the green and orange subway lines. Great value!Downs: The location is convenient but we ended up trekking to other neighborhoods most of the time. The service is disappointing - staff was either unfriendly or inexperienced. Our single King room was right by the elevator and I heard all the people walking by. Maid service came at an alarming 830AM, waking us up way too early.Even with all the downsides, the hotel is a great value."
6,1362,"Aug 19 2009 	Great Location 	It's very true - the rooms are TINY. But they are clean, the shower has lots of hot water and it's 1/2 the rate of any other hotel downtown! So if you are enjoying Montreal and just in the room to sleep, you won't mind the small rooms.The location alone is fantastic right next to shops on St. Catharines St and a couple blocks away from the pubs on Crescent. Also only a 15min walk from old Montreal."
7,1362,"Jul 27 2009 	Good Location Run Down Hotel	We stayed at the Best Western Europa hotel on Drummond Street July 21-24, 2009. The hotel was in a great location right in the centre of everything. It was within walking distance to the Metro station, shopping and tourist attractions. The staff at the hotel went to great lengths to assist us in whatever we needed.My problem was with the room. We stayed in 412 and let me tell you, this room was very basic. The carpet is worn out and looks dirty. The air conditioner was really loud and every time the compresser went on and off it banged. This went on through the entire night. The bathroom has to win an award for the worst layout I have ever seen. The toilet is so close to the door, that when you are sitting, your knees are actually touching the bathroom door.The hotel restaurant has closed and a Cora's has opened up next door with a very limited menu. We went up to have a look at the spa area which opened up to replace the roof top pool. The floor were all cracking and there were actually holes in the walls. In my opinion this hotel is in serious need for some rennovations. The front lobby looks great but the rest of the hotel needs some work."
8,1362,"Jul 14 2009 	Nice but small ""Comfort Level"" rooms great location	Room was small but in great shape, price was great, awesome location, Cora restaurant in hotel only serves breakfast food. Would stay again for one overnight."
9,1362,"Jun 1 2009 	Nice Hotel - Fantastic Location	Came to Montreal for the weekend to visit some friends and booked into the Best Western Europa last minute. The staff were very friendly and helpful from the moment I arrived and the hotel has a nice up scale feel.The room was incredibly small and I could not imagine sharing it with another person but it was very clean and the bed was comfortable - I really didn't need any more than that. Plus it included free wireless internet which really came in handy. The restaurant in the lobby served a great breakfast but it's the location that makes this hotel a real winner.Just steps from St. Catherine Street, it is right in the middle of the shopping district during the day and the club district for nightly entertainment. There are fantastic restaurants of all kinds every where and many attractions and museums all with in walking distance. As well Old Montreal is only about a 15-20 min walk away. And considering the price I paid for the room, the Europa is a terrific deal! It was a great choice for me and I'll definitly stay here again next time I'm in town!"
10,1362,May 19 2009 	Good place to stay although nothing amazing	good location and relative good service. The room are in line with what we can expect from this chain.
11,1362,"Apr 30 2009 	OK	Good location, decent room. The staff were just okay. We booked a 3person room through AAA, however they gave us problems when we checked in. I didn't like how we were treated, which was too bad because I liked the bartender. He gave us more inside information than the staff and he certainly had more smiles! Parking was a bit off-site, but it is a city!"
12,1362,Feb 17 2009 	Small Room	Pretty clean hotel booked it to save some money after wish I had spent a little more. Was basically a bed in this tiny room hard to walk around the bed. One receptionist was great the other very rude (because I was anglo) If money is and issue then this is an okay option close to Bell Centre! Go Habs Go!
13,1362,"Feb 11 2009	Bad breakfast	Nice hotel and location, but the breakfast...If they call a very small glass of orange juice, a slice of bread and a glass of coffee breakfast..."
