IDREVIEW,HOTELID,REVIEW
310,1201,"Aug 13 2007 	Chesterfield Mayfair - Best hotel in London	My teenage daughter and I stayed here for 5 nights in July. This is an excellent hotel in a classy, lovely residential neighborhood (Mayfair), convenient to everything. The rooms are generous and the bathrooms are beautifully appointed and spotless. The hotel staff are just fantastic - very helpful and pleasant in every respect. I was very wary of London hotels, having read many with bad reviews on hotels.com. I chose this hotel because it had uniformly good reviews on tripadvisor.com. I booked my stay on hotels.com and got an excellent price (for London!), including a &quot;full English breakfast&quot; every day (in the room or in the restaurant). Overall this was an exceptionally good value in every way. Next time I go to London, I am staying here - no need to look any further!"
311,1201,"Aug 12 2007 	Superb Value Fine Location	Stayed for 6 days in this small, elegant hotel on a quiet Mayfair side street. Superb, personal service; impeccable room maintenance, easy walk to dozens of restaurants, pubs, delis, tube, and central London landmarks. Rooms are compact."
312,1201,"Aug 10 2007 	Unique experience	In July this year I stayed at this hotel with a friend of mine. We were looking for a good hotel and got the name of the Chesterfield from a travel agent brochure. We checked out the hotel's reputation on tripadvisor before booking. I must say the hotel has a lot to offer: next to its excellent and quiet location, the staff is extremely friendly and very service-oriented; rooms, restaurant and lobby are very well maintained and very clean. Breakfast is superb. We didn't have lunch or dinner at the hotel though.A bit on the downside was the size of the room we stayed in as well as its wallpaper: the deep blue vertical lines all over the room felt very unrelaxing to say the least. Still, this is a detail and probably related to personal taste.As the price / quality mix is quite right, and the hotel is very well located, I'd definitely advise it to other travellers, especially to Business travellers."
313,1201,"Aug 10 2007 	Unbelievable Service at the Chesterfield Mayfair	My wife and I thoroughly enjoyed our stay at the Chesterfield Mayfair. We were there for three nights, business related but Sat. and Sun. we toured London. The Chesterfield was recommended to us by our travel person at work, a colleague, and tripadvisor.com reviews. Many of the trip advisor reviews note the high levels of service at the Chesterfield, but you cannot imagine it until you experience it. I would like to highlight the staff, we arrived at 7:30am on a Saturday, and we were treated extremely well, given our king room, Flavio helped us with our bags, Anthony the concierge was excellent, and the restaurant staff were exceptional. The breakfast crew, Fe, Carolina, and the other ladies whose names I cannot recall, were wonderful. The food was excellent. The dinner staff was similarily exceptional, Tara, the sommelier, the host (can't remember his name), Aldo the meat carver, and all of the wait staff were amazing. The food was delicious. We ate breakfast every day and dinner every night in the restaurant because of the service and the food, we did not care to try any other restaurants in London. The location was excellent for touring, many spots are within a short 5 minute walk such as Green Park/tube station, the Big Bus stop at the Ritz, Picadilly Circus, Hyde Park, Regent Street shopping, and it's only a short 10 minute walk from the hotel through Green Park to Buckingham Palace.If I could offer any constructive feedback, the shower was not so good, the shower heads are too diffusive, my wife opted for baths as she is short and could not enjoy the shower, and the water goes everywhere in the absence of a complete enclosure or shower curtain. A minor issue when compared to the exceptional level of service. We'd stay there again and recommend it to all of our friends."
314,1201,"Aug 6 2007 	Great location helpful staff wonderful food...	My wife and I stayed for just one night - next time it will be longer! Rooms are tastefully decorated and furnished, the staff are extremely helpful and courteous, the food is excellent - all in all excellent value for money and a special experience! The location of the hotel could not be better for visiting London and i have no hesitation in recommending the Chesterfield Mayfair."
315,1201,"Jul 31 2007	A class above	In an age where it is all too easy for Hotels to take your money and not offer much in return it was a breath of fresh air to walk into the Chesterfield and be greeted with the friendliest staff I have come across in my travels so far.Both my wife and I had a truly wonderful time where staff were at our every beck and call and no task or request was too small. I particularly enjoyed sitting in The Terrace enjoying fine whiskies whilst my wife caught up with old girlfriends.As a seasoned traveller I believe the ambiance of a Hotel can be sensed upon immediate arrival and in the case of the Chesterfield all i could sense was warmth.This is a truly outstanding Hotel where if you require a little love and tenderness, as opposed to a fake smile and a hand requesting your credit card, I fully recommend the Chesterfield.If only Sydney would take a leaf out of their book.Thank you once again."
316,1201,"Jul 30 2007 	Service with a smile	The service during our stay was impeccable. Not only helpful but genuinely friendly. LOCATION, LOCATION, LOCATION!!!, A nice quiet street yet close to everything. Would definately stay there again."
317,1201,Jul 30 2007	Unbelievable	This hotel is by far and away the best hotel we have stayed at. We have travelled around the world to most major countries and we were blown away by the quality of Chesterfield. The service and friendly staff made the stay something we will rememeber for ever.
318,1201,"Jul 30 2007	Great Hotel	From some Aussie travellers. Had a great stay - staff have tremenduous value of customer relations. Nothing was any trouble. Restaurant and food fabulous. Could be considered expensive by what we are used to in Australia but what the heck treat yourself to being pampered. Rooms not overly large by our standard but nothing out of place, rooms practical and well appointed. Room service terrific - no sooner off the phone and there was a knock at the door. Well positioned and quiet. Thank you to our NZ friend Cameron who took our bags on the first day - a very pleasant and excellently presented young man. All the staff made it a great experience. My wife and I will certainly stay here again. Thank you."
319,1201,Jul 18 2007 	Tiny rooms.	The service at the hotel was excellent but the rooms were so small that you couldn't walk around without tripping over yourself. Only one person at a time could squeeze into the bathroom. Great location. The concierge was fantastic.
320,1201,"Jul 4 2007 	Much better than corporate hotels	I have stayed in the Chesterfield Mayfair a couple of times whilst onbusiness in London. Whenever I have stayed, the service has been excellent. The last time I stayed on my own, I was greeted at reception and asked if I would like a complimentary drink in the bar - how could I refuse! All the staff are extremely friendly and polite, room service is quick and food still hot when delivered. The room I had last time was quite small - but was spotlessly clean and had everything I needed. Staying at the Chesterfield is a much more pleasant experience than staying in a larger 'corporate' hotel."
321,1201,"Jul 4 2007 	I'll Be Back Again!	I love this hotel. Its above my budget, but in a years time I hope to be back for another short stay. I felt so pampered while I stayed there.The management and staff are bursting with pride in their facility, and it shows. The place is immaculate. Everything that can be polished, has a high sheen. The rooms have everything that a hotel guest can be anticipated to need. In my room, everything worked well, from plumbing to air conditioning to lights. (I cant tell you the number of times I have stayed in a hotel and found light bulbs out, or balky A/C.) When I had a bit of trouble with the in-room safe, I called for assistance, the engineer came within 5 minutes, and in another minute the safe was working. The guest toiletries were worthy of a spa and were renewed daily. The bed had the perfect balance of cushiness and firm support. The restaurant employs highly competent cooks who turn out perfect meals, and wait staff who ensure you are happy with your meal. There is Internet connectivity in the guest rooms. For those traveling without laptops, the hotel has a high-speed Ibahn Internet portal. If you don't use all the Internet minutes on the Ibahn card, you can expend the remaining minutes in the next 12 months. I expended mine at an airport hotel later in my journey.I found the staff had a highly-developed service ethic. Any help I needed, I only had to ask. I was astonished to be able to have my room by 9:30 AM, although I had assured them I didnt expect a room to be available at such an early hour. (My good luck. No one should expect that.) Even before my arrival, the concierges had patiently corresponded with me by email to find a good seat at a West End play, and they endured my fickleness with absolute courtesy. (No, that seat is behind a pillar. No, that one is near the end of the row and has a poor view. No, I want the Royal Circle.) In the end they booked me a great seat. They booked my pick-up and transport from the airport. To my surprise, they didnt send me a Black Cab, but a chauffeured Mercedes, for only a few pounds more. After clearing immigration and baggage claim, I presented to the arrivals area. Although I was a half hour late, the driver was waiting for me, holding up a sign-board with my name on it. What a welcome sight for an exhausted traveler at 5:30 AM. That same excellent driver was available later to take me to my play and whisk me back to the hotel afterward. The concierges helped me to locate specific stores on a street map and gave me clear directions that made it easy to accomplish my shopping. Each time I returned, shopping bags in hand, they asked me if I had found everything. At all times during my stay, I was treated like a VIP.As a lone female traveler, I felt extremely safe at this hotel in the lovely Mayfair district. It is only a 5-minute walk from Green Park tube station, convenient to any number of Central London shopping areas, and within walking distance of some theatres.In summary, yes, the prices in Mayfair are high, but youll receive value and service for your money at this hotel. In the past, at other hotels, I have paid more and received far less. If you are a female traveler coming alone to London and want to treat yourself, do shopping and take in a play, I highly recommend you book at the Chesterfield Mayfair."
322,1201,Jun 24 2007 	Loved the Chesterfield	Great hotel in a great location. We spent a week here in January and couldn't have asked for a better location and hotel. We paid a little over $200 a night and included breakfast. The location was convient to everything and the staff was very accomidating to us being our first time to London. If we go back to London we would definately stay there again.
323,1201,"Jun 19 2007	Yet another wonderful stay - home from home	We have been visiting London 4 or 5 times a year on business and pleasure for about twenty years. Around ten years ago we discovered the Chesterfield - there was such a warm and personal welcome. Compared to other London hotels where life is anonymous and the service sometimes 'not so good' the Chestefield was a haven. Its location is so convenient for both business and leisure, its restaurant must be one of the best in London.Despite being gold card Hilton members we always choose to stay at the Chesterfield when in London. It has become our home from home and the odd thing to do would be to go anywhere else. Sadly we do not visit as much now as we are retired but we would not think of going anywhere else. Our recent visit took in the Chelsea Flower Show and the Sound of Music and with the help of the Chesterfield our short visit to London was just magic. VM &amp; PM MBE Edinburgh UK"
324,1201,"Jun 17 2007 	Perfect in Every Way	I was traveling alone and wanted a safe and comfortable hotel. Being familiar with the Mayfair area, I found the Chesterfield and will return there whenever in London.The hotel is small and lovely, the dining room and bar area are inviting and the staff is extremely helpful and friendly. You will love your room and bathroom! I had coffee in my room each morning and it arrived within minutes.The ladies room on the lower level is worth a trip :-) !!About a block away is Half Moon Street and Shepherd's Market. This is a quaint area, little shops, cafe's and popular with the locals.You can walk to Buckingham Palace, through Green Park, in about 15 minutes. You can hop the #14 bus and be at Harrod's or The V&amp;A in 10 minutes. It's a perfect location. Go and enjoy!Barbara from Northern Virginia (60 yrs young)"
325,1201,"Jun 12 2007 	Great hotel in a FANTASTIC location!!	We chose the Chesterfield Mayfair for our first trip to London based on trip advisor reviews. We liked the location because the hotel is less than a 5 minute walk to the Green Street tube stop. There isnt too much around the hotel but if you walk a few blocks youll run into tons of things. We walked very easily to Piccadilly Circus everyday. So the location was fabulous. We had access but none of the fuss! Our room was very nice as well. It was very, very clean. Housekeeping does a great job. I liked the bathrooms too. Both were just the right size for my husband and I. The staff were very nice as well. They fall over themselves trying to help you. It rained out while we were there and they were always ready with an umbrella or a taxi. We didnt eat in the restaurant; it seemed expensive. We had a few drinks and a dessert in the bar and it converted to almost $50 US. There are two pubs a block away that were fantastic  Red Lion and the Punch Bowl. The hotel was lovely; wed return, if only for the location. One plus  we left (by accident) some money out on the dresser. It was there when we returned. Id highly recommend this hotel!"
326,1201,"Jun 10 2007 	A bit disappointed	I chose this hotel for my parents, my husband and myself as it was number 1 on the TripAdvisor website, and we were coming to stay in London for the first time. Certainly the helpfulness of the staff more than lived up to expectations. They were courteous and attentive. The bedrooms were quiet and well equipped, but in our bedroom the TV didn't work, and they were unable to repair it.The real disappointment was the meal in the restaurant. It was expensive even by London standards, and we were brought our main courses which went cold while we were waiting for the vegetables. I would advise that if you use this hotel you go out to eat."
327,1201,Jun 9 2007 	Great Mayfair Hotel	We stayed 6 days in June. This is a wonderful Mayfair hotel. Check inwas efficient. We accepted an upgrade for a reasonable price(rememberreasonable in London is expensive). The staff were gracious and welcoming. The room was large and comfortable. Housekeeping was spotless. One special comment is that the piano player in the barwas outstanding. Ask him to play Cole Porter and Duke Ellington. You can trust all the great reviews. The photographs are accurate. We would definitely return.
328,1201,"Jun 9 2007	Where 'Have a Nice Day' really means 'Have a Nice Day'	Okay, this is not a cheap hotel but never have I been made to feel so welcome by the staff at any hotel. Reception, Door, Housekeeping and Breakfast people were just so genuinely friendly and welcoming. Great location, terrific breakfast selection and a mean Mochito in the terrace bar though this bar is for winding down, not catching the London buzz. Will be back when next in Town."
329,1201,"Jun 5 2007 	The Very Best!	We have stayed at The Chesterfield about 5 times. Several stays were for two weeks at a time as we enjoyed London. This hotel has class, comfort, fantastic service as well as fine cuisine. We enjoy it because of location to the sites of London as well as the tube to Heathrow and for general transportation. Theater, Parks, Galleries as well as the Palace are all within walking distance. What a great staff to make our visits memorable. We plan to return and enjoy the Chesterfield again. Norb and Helen of Wisconsin."
330,1201,"May 28 2007 	Excellent value in the heart of London	Just left the Chesterfield after 2 wonderful nights. What makes this hotel stand out in London is the staff. Nothing is too much bother and if they say they will do something, it gets done. An obvious comment you may think, but this just doesn't happen in lots of London hotels. Rooms are small but deliciously furnished and the hotel as a whole feels intimate and welcoming. I would strongly recommend this hotel to anyone if they wish to stay in central London"
331,1201,May 22 2007	Great Hotel	Remembered from previous visit and greated by name by reception staff. Quick and efficient regristration. Very comfortable and well equipped room. Very good restaurant and bar. All staff very friendly and helpful - nothing is too much trouble. Location - walking distance to Oxford Street and Green Park - is excellent.
332,1201,"May 16 2007 	Great service and lovely hotel	My partner and I were having a night out in London and decided to book into a nice hotel for the night (even though we live in London). Booked a room at the Chesterfield via their website which seemed to give the best prices. Booked a Superior room as there was not much difference between that and a standard room. At the weekend full english breakfast was included.The Chesterfield is in Mayfair on a lovely quiet street - yet moments away from Bond Street, Park Lane etc. As soon as you arrive the service is great. Doorman opens the door and you are greeted by the freindly reception and concierge staff. Special thanks to one of the recpetionists Cindy who was charming. We were informed that we had been upgraded to a suite and checked in and were taken up to our suite. It was fantastic a separate living room with TV and then a large bedroom and huge bathroom. The Chesterfield is a traditional english hotel in that the furniture is mainly antique but it has been decorated in a very stylish way. We had a call shortly afterwards to check the room was OK and we had everything we needed. We ordered afternoon tea in the lounge of our suite and felt thoroughly spoilt!Returning back to the hotel at night it is in a safe area and it was very quiet so a good night's sleep. Breakfast was served in the restuarant with an a'la carte english breakfast to order form as well as a buffet continental breakfast.Overall a lovely experience in a grand old hotel in Mayfair and we had only paid just over 150 for this so well worth it. Definitely a good hotel. Upgrading to a Superior room would seem well worth it."
333,1201,"May 15 2007 	Exceptional Service	My boyfriend and I stayed just for just one night and I cant say enough just how exceptional the service was. The dcor of our room was quite old fashioned and not very big for a superior king room but it had everything you could possibly need; air conditioning, iron, ironing board, tea/coffee tray (with cafetiere), fluffy bathrobes and slippers, hairdryer, plenty of mirrors and plug sockets, even a stationery kit!The queen sized bed was lovely and comfortable. So much so that I slept like a baby and missed breakfast which is a shame as the reviews on here suggest it was worth having! All in all, a great hotel and very friendly efficient staff."
334,1201,"May 13 2007 	A more nuanced view	While unqestionably the hotel has many endearing qualities as enumerated in most other reviews, the guest rooms are most certainly not among them. We had booked a junior suite for 4 nights in late April on the basis of it accommodating a third person, but after 10 minutes in the room decided to splurge and upgrade to an executive suite. The latter had two rooms with a pull-out sofa bed in the larger, almost living room in size anteroom that led to the separate bedroom. But back to the junior suite. While it had a super-size king bed, about two feet from the foot of the bed was a rectangular or oblong structure, close to 4 feet in height and about the same length, that's sole purpose was to contain a pop-up television set. Not only was it an obstacle but it had the effect of sub-dividing an already smallish room. Why the TV was not placed on the glass-topped table a couple of feet behind it was a mystery to me. Moreover the two matching high-backed armchairs to the side of the table could have been right out of a 1930's stage set. Badly in need of recovering and most uncomfortable to sit in, they should have been consigned to a garage sale a long time ago. Really, the room had a distinct tired look to it, and judging by its size I would have to assume the regular rooms must be, say, quite compact. On a more positive note, the staff was unfailingly attentive and friendly and the hotel's location, near Berkeley Square, couldn't be better. While the dinner we had one evening in the hotel restaurant, Butler's, was excellent, the breakfast buffet was nothing special (e.g. little variety of fresh fruit). As to whether I'd return, it's tough to say. If I did, it would more likely be for dinner in the restaurant preceded by a cocktail in the quintessentially English bar, a delight in itself. H.W.H. Denver, CO"
335,1201,"May 13 2007 	Loved the Chesterfield	My wife and I stayed at the Hotel Chesterfield Mayfair for 5 nights in May 2007. As our room wasn't quite ready on arrival we were invited into the Club bar for complimentory drinks. It was here we had the great pleasure of meeting Loris Lucchini (the Hotel Restaurant Manager). Loris was typical of the experiences we had with all the staff at the Chesterfield, he was a most charming wonderfully talkative gentleman. Loris's enthusiasm to enquire about our trip and ourselves turned us into dedicated repeat customers on the spot. Rarely in todays hustle and bustle does one come upon such genuinely delightful experiences.Our room was all we expected of it, it was a good size and beautifully furnished and decorated. This Hotel is more like an old world gentlemans/gentleladies club, it has plush leather sofas everywhere and the Club Bar is furnished much as you would expect from such a luxury boutique Hotel. But the Chesterfield Mayfair experience is most definately about the wonderful staff, from the check-in to the room service to the bar staff and to the door men I can honestly say that they each not only met my expectations but each and every encounter I had with the staff left myself and my wife smiling and delighted, well done to them all.As far as the location of the hotel goes, it is perfectly situated, walking distance to Trafalga Square or Buckingham Palace or Houses of Parliament or many other tourist attractions. A hundred metres (or yards in England) down the road is the quaint very typically English pub The Running footman, I dont know where they got their chef from but on the two occassions we ate at the pub, the chefs creations must have been guided by an angel. The meals were both exquisite masterpieces and I'd consider returning to London just to eat there again. If you only get to do one thing while in London, make sure you eat at the Running footman (assuming the chef is not lured away to another restaurant in the meantime).For a typical and cheap English breakfast you can't go past Katies. Katies is just around the corner and a couple of hundred metre's away. For an expensive cocktail there is the Ritz Hotel , also just a couple of hundred metre's away.After my wonderful experiences in London I am most definately a lifelong Chesterfield Mayfair Hotel guest and I would recommend the Hotel to anyone who values not only luxury at a sensible price but more so being treated genuinely as a valued customer. Well done to everyone at the Chesterfield, and a special thanks to Loris."
336,1201,"May 12 2007 	Great location great staff great hotel	Its the 3rd time we have stayed at the hotel and each time it seems to get better and better. The staff are fantastic and the location has to be one of the best in London. The rooms are beautifully decorated and have everything you could ever wish for.We ate in the restaurant on one evening the food was outstanding, I had the Dover Sole and my wife had the rib of beef from the beautiful silver trolley. Breakfast each day was out of this world, even the pastries are warm! The bar is also great and somewhere you can relax and soak up the atmosphere.A little tip is book on the hotels website as it seems to be 1 cheaper than other sites and from time to time they have special offers, such as a bottle of wine as an added extra."
