IDREVIEW,HOTELID,REVIEW
7,712,"Jun 8 2008 	Mmmmmmmmind the gap!!	The hotel was an excellent two star one, with private facilities and tea &amp; coffee boiler.. Perfect to stay in for a holiday..Really pleasant!! Truly recommended... :-)"
8,712,"May 6 2008 	where did they get the stars from?	my wife and I booked a theatre trip to celebrate our first wedding anniversary. we booked via lastminute.com and appeared to get a really good deal, theatre tickets for Lord of the Rings and a nights accomadation for less that 100.Unfortunately we had transportation problems and had to find alternative transportation from Leicester to London. On the trip down to London we spent 2 hours trying to get through to the hotel to check what the latest time we could check in. Althought we were supposed to have been able to check in from 14:00 no one answered the phone until 17:00. We had chosen the Edward hotel because of its location and the amenities its claimed to offer. Such as en-suite bathroom, Satelite Tv in Room safe etc. We arrived at the hotel at about 23:30, had to wait for about half an hour whilst the night porter dealt with a group of italian tourists. The problem was, the night porter spoke rather broken english and no Italian. The italians meanwhile could also only speak rather broken English. Eventually we got checked in and headed up to our room. Upon arrival we found our room down a small dingy corridor. The room itself wasn't bad, 2 comfortable beds, which we simply pushed together to make a double bed. Its from this point on we had problems. My wife nipped the bathroom and came running back out, as she'd found what looked like a baby cockroach climbing the walls. I took a quick photo of it with my camera phone and then got rid of it. The amenities that the hotel boasts appear to be destinctly lacking - satelitie TV? you get Sky News and CNN and that's only if someone has remembered to turn the channel on downstairs. The in room safe was superbly secure, i couldn't even find it!!!! So there was no way any burgular was going to. The door didn't have any proper locking device, even the door chain was missing. The hotels only plus point was the free WI-FI available, although all the exposed routers on each floor does pang of a rather DIY approach- but as an IT engineer even i had to admit that it worked. At the end of the day however, if you are looking for a dirt cheap hotel in which to get a bit of kip then you could do worse, i know i have in the past, however if you want my adivce and can stretch to the extra cost then i'd stay in a travel lodge or similar, at the end of the day at least with them you know what you're paying for."
9,712,"Feb 16 2008 	Some where to lay your head for the Night	We (me, hubby + daughter 12) stayed here one night in Feb '08. I paid 76 (through ASDA Travel) which included a full cooked breakfast.The room was very small, one double + one single bed, with a Small gap between the two. A double wardrobe. One shelf/ dressing table which had all the tea and coffee stuff and no where for me to place my makeup etc!The bathroom was ok, - basic. Room was clean and tidy.Basically the room served a purpose for us to use as a base and lay our heads after a night out at the west end. Don't think I could have stayed there long than the one night, due to the lack of comforts being squashed in the room and no luxuries of a hotel break.The staff on reception were polite but not overly friendly or much interaction.The breakfast was ok, I've had better for less money. The dining room was bland, no atmosphere, annoying music!!Location was the best and only reason we booked, close to hyde park and Paddington station, a tube ride to anywhere!Only use this hotel as a B/B, a cheap base to a trip to see the sights of London."
10,712,"Jan 19 2008 	great location and thats about it!	We chose this hotel for the location, and in this respect it did not disapoint. It was a comfortable walk from the hotel to Oxford street and other attractions in that vicinity.Other than that, it was only just worth the money paid. The staff at the front desk were indifferent to guests, and actually seemed quite surprised that an English person would want to stay there. The rooms were small and very shabby. The scratchy blankets looked as though they had been there for decades. The breakfast was okay, but certainly not worth the price charged.Basically, stay here if you want to spend time in central London without breaking the bank, but if you can afford a little bit more than it would be better to treat yourself."
11,712,"Nov 8 2007 	A Warning Should Come With This Hotel	Myself and my partner booked this Hotel via the interent, the pictures on the site looked reasonable (lets face it - it's not the Ritz) but I was very happy with the pictures on the website and it appeared to be very central to most attractions in London. We arrived at the Hotel prior to the 1pm check-in and would have been very happy to leave our luggage somewhere secure while we had a spot of lunch until we could check-in. UNLUCKY for us this was not the case! The receptionist that greated us virtually reduced us to tears! He threw a key at us for a room to place our bags screaming at us that it was not acceptable to arrive earlier than check-in time. I must admit that I did look at him in a manner that he obviously did not approve of but I have to say I was completely dumfounded. He then went on to ask for the key back - said we could &quot;Do whatever the hell we liked we our bags - but they were not obligated to keep them!&quot; I pondered the situation for a minute then informed him that we would go for some lunch and come back at check-in time. We went, had lunch and arrived back at 1'o clock. The pleasant receptionist had changed his tune when I asked him to write down the name of the manager - he bribed us with telling us in very poor English that he was giving us the nicest room in the Hotel - it was the suite and cost 150 per night but he would give it to us for two nights at no extra charge! I told him I would not accept such a thing as a apology for his behaviour and he insisted..............WELL..........................if this was the nicest room I would seriously HATE to have been staying in any other room in this Hotel.The carpet was sticky and dirty, their was black mould on the shower curtain, their was cigarettes all over the balcony furniture, other peoples hair in the bath and by 8'o'clock on our first evening we noticed we had no warm water or heat in the radiator! The TV looked like it was borrowed from a museum, most of the lights did not work, the walls needed a good lick of paint. It was bitter cold outside and wasn't much better indoors. We approached the same RECEPTIONIST who told us to let the water run for ten minutes! and give the heat about another half an hour and he would call up.................and he did! With a plug in radiator that was broke on two wheels. We froze in a dingy bedroom for two nights with no warm water and gave up trying to rectify the matter.I suffer from Asthma and left this establishment with a Chest Infection from a cold damp grotty room - I spoke to the Manager upon leaving who offered my 20 compensation but no apology! I took that matter one above her and the Group General Manager apologised on behalf of the RECEPTIONIST telling me that the receptionist is used to doing night shift and obvoiusly the daylight had something to do with hs behaviour! And that I should be grateful that he had tried to make amends offering me their suite! AND that I had already paid a really cheap rate for the hotel. (70 PER ROOM PER NIGHT)!The Group Manager of course denied that the heat or the hot water were both on the blink and it's very easy to deny now that we are back in Northern Ireland.He proposes that when we next require accomodation in London if he has suitable accomodation available we can have a room with his compliments.................well over my dead body.I find it dispicable that establishments like this are allowed to continue operation. 2 star's is far too many for this Hotel and for 70 a night - I have stayed in better Hostels. I think Bed and Breakfast would be a better title for this place although I'm not sure about that either maybe HELL or something I don't know."
12,712,"Oct 29 2007 	Great for the Money	Booked this hotel as part of a theatre package through lastminute.com. At 90GBP for two show tickets and a twin room for a one night mid-week break it was a bargain. After reading some of the previous reviews I was somewhat sceptical but I needn't have been. Chap at check-in was a little unfriendly, don't expect any polite conversation! The room, however, was a pleasant surprise. We had a twin on the 4th floor that, whilst being comically small (wouldn't liked to have stayed more than a couple of nights in such close quarters!) was clean, comfortable and adequately equipped, far better than I was expecting for a budget 2* hotel. TV with remote, Safe, tea/coffee making facilities, windows that actually open and a perfectly good ensuite. Even though our room was at the front of the hotel overlooking the road, traffic noise certainly wasn't a problem, nor were we disturbed by any &quot;hotel&quot; noise. And being only minutes from Paddington tube station we will definitely be staying again."
13,712,"Sep 28 2007	YUCK.......Bedbugs!!!!!	Took two nights to realise that we were being bitten alive! We checked under the mattress and found a heap of bugs. We later found a mature female bug (the worst kind that lays up to 10-20 eggs a night) was feasting on our luggage!!! We went and spoke to reception and they moved us into a new room. I had my doubts but tried it anyway. When we got there, again....bugs under the mattress. We complained again and were upgraded to a room completely separate from the hotel....NO BUGS this time. The reception dude later accused us of bringing the bugs with us....hmmmmm!!!! We had friends arriving later that night and they were shown three rooms in the hotel, 2 of which had bedbugs sitting on the top of the bed as you entered! There was no need to even lift the mattress. Suffice to say, they chose not to stay!"
14,712,"Aug 16 2007 	Wouldnt go back..	At first we got this tiny room with a toilet that didn't flush. Next day they switched us to another one though thank god. Last night coming in to the hotel ( there were three in our party, in a single and double rooms) the receptionist was telling us no visitors are allowed ,which is fine- except we had paid for three and had NO visitors ! Going back to the room we noticed lights were already on and apparently , (eventhough it says in the toilet that if you wish your towels to be changed they should be put on the floor) they don't bring new ones in. Had to go to reception to ask for more and they refused to give us more than one per room. (?!)Working in a hotel myself I found the customer service of the night porter very bad."
15,712,"Jun 4 2007 	Filthiest room in years of traveling	I've stayed in over 25 countries and spent a decade travelling constantly while a naval officer (staying at budget or moderate properties) and this was the dirtiest room I've ever been presented. The stickily stained carpet had not been vacuumed (ever?) and the previous guest's bits of tissue paper, hair, and misc. receipts (in Cyrillic) littered the floor. Water stains on the ceiling and stains of unknown origin on the walls. The door jamb near the latch still showed damage from a long ago prying open. Ground floor window looked out on the bottom of the light well / fire escape, complete with rotting banana peels. One of those nasty Glade deodorizers was installed high on one wall, misting every 30 minutes, giving the room the smell of a service station restroom. Halfway through the night I climbed on the chair to disable it. The bathroom was relatively clean, though, so not a complete horror show. Sheets and pillow case were also clean. I only needed a place near Paddington to overnight for a flight connection, so this place served its purpose, but the neglect (once past the decent lobby) was astounding. With the dollar/pound rate at about 50%, this room cost $110. Cheap for London, but disgustingly overpriced when viewed objectively."
16,712,"May 29 2007 	Basic but great for the $$$$	Just got back from a 3 night stay. The hotel is VERY central to Paddington Station, which was a HUGE Plus for touring around town. Yes, its a basic hotel, but at London Prices, who can complain. We had a triple on the 5th floor. We found that we didn't have water pressure and the moved us right away to the 3rd flr and everything was great! They even offered to move our luggage while we were out, but we did it ourselves. The rooms are basic, clean and fine for a tourist level hotel. Its not the Ritz, but I wasn't paying Ritz rates!! I would recommend the hotel to anyone as long as they knew it was sort of a Motel 6 type room in the US.I will stay there again."
17,712,"Apr 27 2007	Eaten Alive!	While I liked the staff our stay was ruined by bedbugs. Lots of them. I woke up in the middle of the night on our last night there and had four crawling all over me. I've never had this happen before, even in Mexico. Still gives me the creeps. DO NOT STAY THERE. IF A TRAVEL AGENT BOOKED YOU, PAY THE EXTRA CHARGE AND GO SOMEWHERE ELSE. There are numerous budget hotels in London where you will be happier."
18,712,"Mar 28 2007 	Terrible hotel only good quality is location	I'm not even sure where to begin: the arrangement of the room was awful, no remote, had to call twice for them to turn on our phone with broken buttons, internet machine in lobby ate my money, bathroom floor outside the shower was literally black from mold/mildew, faucets were rusty. The whole room and hotel generally felt unclean with subpar service. I dont have the picture of the hallway outside my bedroom but in short it had a rat trap and completely stained carpets. Picture can be sent upon request."
19,712,Mar 18 2007	Budget class but adequate	This hotel is a budget class which means low price and small rooms but don't let this stop you from booking. The staff was helpful and the location was excellent. The showers at peak times lacked hot water and the drain in my room was a problem throughout my 6 night stay. I stayed there with a group of high school students and would book another group there without hesitation. The students got a taste of what most Europeans expect in a hotel room. Breakfast room was bright and most welcoming.
20,712,"Feb 6 2007 	Nice place good price.	Spent one week past spring with my girlfriend. On the first nite, we were given a very small double room on top floor. The bed was a french one and not a conventional double. The room was so small there was no room for our suitcase. A window as small as a 12&quot;. Totally nightmare!On the next day, they moved us to a very nice and clean room on the first floor. We spent the rest of the soujur there. Large room, very nice bathroom, nice view on the street. So be careful for what you get!Nice location, few metres from subway and train station (Paddington).We were told that no breakfast is included when booking thru Expedia or related websites."
21,712,Jan 8 2007 	Don't Let The Bed Bugs Bite!	We arrived at this place and even though it looked older it wasn't bad-at first. The elevator is tiny and the hallway leading to our room was narrow and dark. The room was ok- 4 beds and upstairs/downstairs. When we arrived we tried to take a shower but there was no hot water. The management came up to help us - made the water lukewarm and said we could get a maintnence person 'tomorrow.' While in the bathroom I noticed a couple of small black bugs in the shower. About an hour later my family and I sat around watching tv. We saw a small black bug crawling on the white bedding of one of the beds. It was the same bug seen in the bathroom. When we pulled back the sheets we found 10 bugs crawling around! We immedietly notified the person working at the desk who stated he didn't need to see the bedbugs because he believed us. No apology. Also he did not look surprised! We were so grossed out we left and found another hotel. Until this experience I didn't know bed bugs existed. It was a terrible experience!
22,712,"Dec 27 2006 	UGH!	Booked thru Go-Today travel agency. Knew it was a budget hotel but why the owner of a property with a decent location would let it get so rundown-I do not know! We arrived and are told the lift is broken and will be out for 24 hrs. NO HELP in getting our bags up three STEEP flights of stairs! a 62 yr old man in the lobby said his 85 yr old father could not even walk down much less carry luggage down! No help! next day we were told the lift was out for two weeks! Obviously this was heavy duty planned maintainance that they knew in advance and did not notify the public or their travel agencies. But wait! Our tv was out the first day, they charge for internet but hey it was out! I had a new ac/dc converer that burned out after twenty minutes! The attidude at the desk was so what I won't carry your bags! Why they did not hire a temp to help elderly travellers with their bags is insane. Did not make a dime's adjustment to our bill either. The hotel should have been closed during this time! This hotel makes a motel 6 look like the Ritz! In Oct the room was hot and when you open the windows the traffic noise was horrible. A DUMP! We stayed at a budget hotel in Paris the next three nights-Larger room, quiet , freshly painted, everything worked and the front desk was very helpful."
23,712,"Dec 8 2006 	Great	If you're going to have a late party and live out of town, this is a great little hotel. It's cheap, conveniently situated and the rooms are great value. I shared with a mate after the office christmas party, and it worked out to about 24 - much less than the cost of a taxi at 2am. Go for it - it's warm, the beds are clean and it's just nice knowing you can have a bit of a sleep in instead of commuting the next day."
24,712,"Dec 7 2006 	Room 208 - Room burgaled by hotel staff	I stayed here during my first trip to London in which I had booked no accomodation prior to my visit. On arrival at paddington station it seemed a reasonable hotel from the foyer but little did I know the heartache this place would cause me.On arrival we were told that the room would not be ready and to come back in two hours time, on check in we noticed that the room number 407 had been scored out on the receipt and replaced with 208.The first night went without much problem but the evening of the second night before we went home things started to develop into a nightmare when we arrived at our room to find the exit door next to our room open. When we got inside our window was lying open and several items were stolen including a 60GB Ipod, iM3 Docking Station, 2 psp games and over 500 in cash.Our window was not open when we left so the only way in was from the inside itself, the window and susequently the fire escape were left open as to indicate to us how they got in. This however was no opportunist thief as our passports were left alone in the room on the table in plain sight as well as the fact that they would have covered their tracks a little better.Add to this the fact that the hotel refused to phone the police and you can see that something is not right about his hotel. The hotel have as yet refused to compensate me for this loss and I would advise anyone thinking of staying here to forget about it you will only get robbed if you have expensive items and they see them."
25,712,"Jul 29 2006	Good Location/Not a great room	We chose the Edward Hotel for its location as we knew we would be sightseeing a great deal. However, at the end of a long day of walking one would expect the elevator to work and a cool breeze to be available. There is no air conditioner in this hotel and the only relief comes from sitting out on the window ledge. Bed is extremely small and there is no water pressure in the toilet. Continental breakfast means &quot;pay&quot; a large sum for a very limited breakfast. Staff is not helpful--the best thing about this hotel is its close location to Hyde Park and several Underground routes."
26,712,"Jul 1 2006	Could be good	The foyer was lovely...then you hit the lift.....and you and you get an idea of the rest of the place. A narrow corridor lead to our room, which was tiny but rather cute. No ventilation we thought, and extremely tiny, but we can cope with that at least we have windows right!!!!!!A hint here &quot; CLEAN THE BIRD DROPPINGS OFF THE WINDOWS&quot;. The rooms facing the street may have clean windows..but the windows in the rooms at the back are filthy with bird droppings, we could NOT see out our window at all, so we were not game to open it to get a bit of fresh air.On the other side of things, it is well priced and is staffed by nice people.Also there is everything you need right at hand including a GREAT indian resturant."
27,712,"Jun 23 2006	Never again!	stayed in this hotel for 6 nights. The first single room of my friends smelt so strongly of sewerage she had to get another room. Our room smelt ok, but after a night there we were all bitten by bed bugs, receiveing some nice red bites all over. They moved us and supposedly fumegated the room, but some of our things were missing in the process of the move. Would NEVER stay here again and advise all to stay away no matter how tempting the price! Health inspectors needed here!"
28,712,"Jun 19 2006	A good buy	I was probably lucky because having booked a single room for four nights through hotels.com I was given a two bed room. It was quite a good room and the only complaint I have is TV reception which was sometimes OK, sometimes had OK sound but blurred image and sometimes dropped sound too. I mostly used BBC but sometimes zapped and sometimes found better quality for Sky and some less interesting channels. This came as no surprise having read an earlier review.My room was not towards the street so trafic noise was not a problem. Spring Street is also not a very busy road. The distance to the tube station is not very long.When I booked I did not realize that breakfast was not included but after having read an earlier review I checked the confirm message and it was not stated that breakfast was included. Not a big problem because I could make my own coffee with equipment and instant coffee provided in the room. Last morning I had forgot to buy something to eat for breakfast so I had the continental breakfast for 5. The lady in the breakfast room who checked my room number pointed out that breakfast was not included for me but I told her that I was going to pay for it. The continental breakast is better than at many other hotels, as both yoghurt (with or without fruit), muesli and other cereals, ready to eat grape fruit slices and other kinds of fruit were available.For the price Hotels charged for this hotel, 165 for four nights, it was a very good buy."
29,712,"Jun 15 2006	Relieved - thought it was a great value	I was very worried about the hotel after reading the reviews and tried to change hotels but was having a hard time meeting all our requirements anywhere else. So my husband and I were pleasantly surprised when the rooms were fine: decent size for Europe, cleaned daily, and serviceable. At $80 (including taxes but excluding breakfast ) through expedia, this was a *great* deal for London. (I don't think I'd pay more than $120 for a double, though.) Most of the staff was very friendly, and the night guy, who could be a bit grumpy, was fine with a little patience.BTW, the continental breakfast at 5 pounds was fine, but we liked Luigi's down the street on Spring Street--you could get a decent-sized breakfast for 3.5 pounds or less."
30,712,"Apr 30 2006	Adequate	I was really worried about staying here after reading the reviews on this page, but it turned out to be a perfectly adequate hotel room for how low a price we paid. It was clean, had great plumbing and was in a perfect location. My only real complaint was that the bed was small and hard. I wouldn't go out of my way to stay here again, but it was certainly serviceable (sp?) and met our needs."
