IDREVIEW,HOTELID,REVIEW
167,2142,"Sep 20 2007	Great location but very disappointing hotel	I have just returned from a trip to San Francisco. We stayed in the Radisson Hotel on Fishermans Wharf. The location was fantastic, the pier is very lively and there is always something happening. Not too far from Pier 33 (Alcatraz cruises) and easy access to the city centre. Having stayed in Radissons before I was very disappointed with this one. The matresses on the beds were very uncomfortable. The noise level was appalling, I found it very hard to sleep at night. The hotel breakfast was in this fast food cafe called IHOP just around the corner which was not very appetising! This was also the hotel's &quot;restaurant&quot; too and having had dinner there once, it was the greasiest meal I believe I have ever eaten. For a hotel is have a restaurant like this in such a great location in the city is ridiculous."
168,2142,"Sep 8 2007 	Location	Stayed here for 3 nights, have to say, brilliant.The location is fantastic, at the rear a safeway supermarket, to either side johnny rockets, and Ihop, and to the front you are right on fishermans wharf.Rooms are very good, cant find anything negitive to say, iron and board, refridgerator, toiletries, very fine bed and crisp bedding.Quiet rooms, nice view, free internet.The open top bus tours go from here, ie fishermans wharf, pier 39 &amp; 41 leave you spoilt for choice where to eat, we loved the crab booths.Would really recommend this hotel, I booked early and got a good rate of $168 per night which is reasonable to San Francisco, I did take a look into the Sheraton which seemed lovely as well.Loved Fishermans Wharf, yes very touristy, but everyone was here to have a good time and made for happy atmosphere, We had 2 days LA and 3 days here now I wish I did 5 days here, great holiday, will post trip report in forum alsoPlease feel free to email me if I can help, because I have had a great holiday mostly due to all the fantasic advice I got from here."
169,2142,"Sep 2 2007 	The Hotel was perfectly placed	The hotel was perfectly placed for our first visit to San Francisco, in particular for Fisherman's Wharf. The hotel was clean and in good order. The pool was very good, in particular for our chldren following a long sightseeing day!!! The bedroom we were allocated included 2 double beds that were sufficient in size for our family of 2 adults and 3 young children. The only negative point is the lack of breakfast facilities but they do have a faciity in the Reception Area where coffee and pastries can be purchased and a 24 hour restaurant next door."
170,2142,"Aug 17 2007 	Very Nice	We stayed here for 4 nights in July and overall had a very pleasant stay. It's ideally placed within very short walking distance of Pier 39 (restaurant/shopping heaven for tourists) with good access to the buses and streetcars. Taxi from SFO costs about $45 and a door-to-door van about $15-18pp. We contemplated taking a streetcar to the BART for our return journey but I wouldn't advise doing that if you've heavy luggage or if you're going to be travelling between 1000-2000 as they can get very busy. As for the hotel itself, it's a very pleasant 3* with very helpful staff. We arrived late on a Saturday night and the room we were given was really quite large. However, it was close to the elevators which make a fairly loud noise. Fortunately we were so tired it didn't keep us awake. We went to reception the next morning and requested to move, which was dealt with very promptly and we were moved as soon as a room became available. For breakfast/brunch there's a Johnny Rocket's diner at the back of the hotel which was pretty good and you can access The Wharf via this direction too. One piece of general tourist advice for this resort; book your Alcatraz trips online if you can as they get mega-busy. However, if you choose not to and you arrive at the ticket booth to discover that they're &quot;fully-booked&quot; days in advance, ignore that. You can pitch up any morning and start queuing at 0730 for an 0800 opening and you'll be able to get tickets for that day."
171,2142,"Aug 16 2007 	I would stay elsewhere	I have to say, the mixed reviews on this hotel are warranted. I have stayed in a lot of hotels over the years, and this one definately has some good points, like location. Granted, Fisherman's Wharf has some interesting people hanging around it, but no reason to feel unsafe in or around the hotel. Any big city has the same problems. The part I felt was very poor, was the staff at check in, terrible experience. I booked 3 rooms with BayView and they only had two when my group got there, which was very annoying given the amount of time the rooms were booked in advance of you stay. Only 1 clerk working, line of people waiting to check in, no management around to discuss the problem with. Overall, the hotel service was poor. The hotel decor is ok, sleep number beds were cool. Not worth the money they want for this hotel. Next time, I'd probably try the Sheraton across the street, or the Holiday Inn."
172,2142,"Aug 12 2007	OK but I wasn't impressed with Fishermans Wharf area	The hotel was adequate. The room was OK, the pool was a bonus. The concierge was helpful and there was a complimentary on-line flight check-in facility which was useful.Otherwise the facilities in the hotel were poor e.g. no restaurant although you didn't have to walk far (a short step to the adjacent Wharf) to get food and drink. As a first time visitor to San Francisco I was disappointed with Fishermans Wharf. I would stay nearer Union Square next time.San Francisco is a beautiful city but I think the Wharf is not the best place to be."
173,2142,"Aug 9 2007	Great location and value	Hotel is in a wonderful location, steps from Fisherman's Wharf and really good value. Staff were friendly and the hotel and room was clean. Rooms were just a bit on the small side but adequate and problem free for us. I've definitely seen smaller. Mini safe was a good feature. Hotel location is very much in a tourist area. The F Line street car is right out both the front and the back of the hotel. Hotel is in a good location for walking, biking, renting cars, public transit. If you rent cars in this area I recommend returning them each night. Parking at the hotel is $40 per night or it can be had for free at the rental car outlet. If you want to go to Alcatraz, book your tickets as soon as you arrive, or better still on line before you go. Only one company actually goes to the island and their tickets are in high demand."
174,2142,"Aug 7 2007 	Nice Hotel for Tourists and Families	I thought this is a great hotel for tourists, right in the heart of the Fishermans Wharf action. We had a small, but comfortable king room on the second floor, at the end of the corridor, a great location to keep the noise down. We were assigned a room with a Sleep Number bed which my husband described as an overpriced air mattress. It was comfortable enough, but I wouldnt run out and buy one! The room had very nice amenities: coffee maker, iron and full sized ironing board, hair dryer, nice bathroom stuff, excellent water pressure and lots of counter room, and best of all, free Wifi so I could use my Palm to check my email (only twice in three days, which is infrequent for me!) The AC and fan worked very well, providing a nice steady hum which drown out most of the noise at night and let us sleep very well. They had an outdoor pool that was full of children, but we had no intentions of swimming in the chilly July weather! We didnt have much interaction with staff, but what we had was pleasant and efficient. The room was clean and the dcor was actually pretty up-to-date and attractive! I would recommend the Radisson as a good family and tourist hotel."
175,2142,Aug 3 2007	The Place is a Dump	We were so disappointed with this hotel that we checked out early. I did NOT feel safe. The parking lot was confusing and I was afraid to go from parking to rooms alone. Very long and confusing corridors. This hotel is located in a seedy section of Fisherman's Wharf.
176,2142,"Jul 30 2007 	Okay if you like the smaell of Clam Chowder!	We stayed at this hotel for 4 days in July. Hmmm...first impressions, NOT GREAT! Check in staff - RUDE! Our room safe needed a different code everyday as everytime we returned to the room, our safe wouldn't open, granted they did send someone to attend to this quite quickly but strange that it was always after we'd left the room un-occupied! The furniture and carpets are old, need up-graded! Location is great if you like smelling clam chowder all day and all night!! Lots of tramps and beggers hang around the hotel, quite un-nerving.I wouldn't stay at this hotel again - EVER!"
177,2142,"Jul 28 2007	Once was enough...	Unfortunately, once was enough to know we won't stay at the Radisson Fisherman's Wharf again. There is something about the exterior of this hotel that looks more like 1960's Florida than San Francisco's Fisherman's Wharf. The interiors have been remodeled, but there is the feeling that as many roooms as possible have been crammed into this location, much more so than the usual...even for San Francisco. The physical layout of the floor interiors is prison-like with narrow, long hallways..extremely narrow...even for such a large hotel.. The rooms are crammed in there quite tight and are very, very small. Only two elevators for this large hotel...clearly not enough for the number of rooms, so long wait times. Old bathrooms that have been remodeled. The room was surface clean, but the opened doors on armoire holding the television were coated with sticky fingerprints and smudges...clearly hadn't been wiped down in ages. Wallpaper dried out and peeling in room, carpet torn away from bathroom door threshold. Indifferent and unfriendly staff. The only employee that smiled and was helpful was a concierge named Olivia. The rest of the staff was completely disinterested and unsmiling. The pool area was shabby and dirty. Altogether, the atmosphere at the Radisson Fisherman's Wharf is tired, cramped, crabby, cheap looking and very crowded."
178,2142,"Jul 25 2007 	Highway 1	Stayed here two nights at the start of a trip down higway 1 to Sta Monica. The room was quite good, with a nice view over the pool area. The hotel was quiet and in an excellent position for excursions. Walking distance to cable cars, pier 39 restaurants, chinatown etc. The price was also reasonable."
179,2142,"Jul 24 2007 	Disappointed	We really wanted to like this hotel but, too many little things were wrong. Booked our room on line and preregistered so check-in was a breeze. We were not happy about many things in our room. Like: peeling wallpaper, sleep number bed not plugged in and not enough plugs for beds and lights (forget a computer), bed seemed to lose air, only place in bathroom to set a bag, was on the floor, closet doors wouldn't close with clothes hanging, no table (there was a desk), only 2 chairs (room was set-up for 4), no frig, lack of places to charge phones and cameras, bright lights from parking area filled the room if curtains were opened and more. Little things but they add up. The bathroom was really small with no place to put personals, a shelf would have helped a lot. The room was clean and the daily service good and prompt. The air conditioning is indeed very noisy but necessary as we found out when we lost power one evening and had to try to sleep in an overly warm stuffy room. On the good side the location can't be beat, you are right on fisherman's wharf and it has a pool. I found most of the employees very accommodating. If you drive don't forget to add the $34.20 per night parking fee (the parking spots are very narrow). Would I stay here again? No, but I give it a rating of two based on cleanliness, location and pool."
180,2142,Jul 5 2007 	Best place to stay on a budget	This hotel is in the best location! It is at Fisherman's Warf. The room was modern and clean. The staff couldn't be any friendlier! The pool is heated. I will only stay at this hotel whenever I visit San Francisco.
181,2142,"Jun 26 2007	Radisson Fishermans Wharf	Radisson Fishermans Wharf. Third year in a row. Everything went great as usual. Staff is all ways great. Location is right where I want to be. One note- theres a Walgreens right up the street and it came in handy this trip. All ways forget something! Had a very small problem, It was handled qucikly and professionally. It was not a problem for me , but more of a heads up for staff. This is the place to be to get any where, street cars ,cable cars walking. Price was good for San Francisco. Clean and those sleep number beds what a treat! Housecleaning staff was on top of everything every day. All in all a great place to stay. Would I stay here again. Oh wait ! I have three years in a row. I'll be back next year. Stay was 14 May 07 - 18 May 07. The passageway from the pool area to Jefferson St. is a time saver and puts you right on the wharf."
182,2142,"Jun 25 2007 	Not bad - very comfortable beds!!!!	We stayed at the raddison for 3 nights from 6th- 9th June. Staff at reception were friendly although a bit slow at checking us in. Property was in good condition and rooms were well proportioned and clean. The bed was probably the best part of the room: it was king size and you could change the softness/harness of the bed on the two different sides of the bed to whatever you wished by using a remote control. View was poor but to be honest we didn't spend much time in the room so weren't that bothered.Position was great. Below the hotel was IHOP which did good breakfasts although extremely big portions and hotel was within walking distance to all public transport and fishermans wharf,All in all not a bad hotel!!!!We booked an airpot transfer back to airport from the hotel and they were on time, friendly and a competitive price."
183,2142,"Jun 18 2007 	Save your money and go somewhere else	This hotel was nothing like it appeared on the website. The amenities were totally outdated. For example, one machine in the workout area was broke for an entire week! Secondly, since I am a non-smoker, to smell someones else's cigarette smoke was really an inconvenience! Not to mention to place you in rooms with broken furniture, outdated and worn out carpet and toilets which doesnt flush. Several nights I was awakened by commotions outside of my window..and the window as closed. I finally requested to move until another room in which I finally obtained a room with a view. It was like night and day. Of all of the Radison hotel's I have ever stayed in, this was one of the worst hotels of the lot. They save the best rooms for the expensive clientel and give the crappy rooms for everyone else. I seen this first hand. I dont recommend my pet poodle stay in this ghetto dump hotel. On a positive note, you are in walking distance to Pier39 which has absolutely fabulous restaurants which specialized in seafood. Plus the tours are fabulous!"
184,2142,"Jun 11 2007 	Best San Fran Hotel for First Timers Families Friends!	My family and I (parents and brother) stayed at the Fisherman's Wharf for three nights in early May as part of our cruise package vacation. This was our first time to San Fran, and it was absolutely amazing!The cruise package consisted of 3 nights in San Fran and a coastal cruise back to Vancouver (where we're from), and Bon Voyage Holidays (tour operator) seems to know what they are doing in terms of a great deal. The price of the total package was a mere $621 CAD plus tax, which covered the flight down to San Fran, 3 nites hotel, all transfers, and a two night coastal cruise on the luxurious Golden Princess back home.When they say this hotel is centrally located they weren't kidding. This hotel is located RIGHT off the Pier 39 and Fisherman's Wharf--a must see for those visiting San Fran. The main entrance faces the side street, but you can walk through the courtyard by the pool and there's a hallway that takes you to the wharf, or you can walk around.The rooms were spacious and very clean. We had two side-by-side rooms with comfy sleep number double beds to each person. Washrooms were basic, but clean. The hotel is large and was always busy since it seems that it was a popular package for tour groups.Checkin WAS the most amazing and painfree I've ever had since the tour operator had pre-arranged our rooms and we were given key cards that didn't need to be returned. You just got your stuff and checked out by 11--perfect!There is a safeway very near by two blocks down in the mini mall and you can grab all sorts of fruit, water, and drinks for you choice which you can stock in your complimentary mini fridge. There is also a complimentary safe for your valuables and it's big enough to fit a laptop. There was WIFI and we were able to connect for free!! Perfect for checking email and updating your friends on your trip.The only thing is that this is clearly and older building and the windows are thin. It can be pretty bright due to its proximity to the wharf, and even somewhat noisy at times due to the traffic outside. The Sleep Number beds were comfy though, and even fun to use. You can access all the transportation from the hotel with little trouble as the F line street car is down the street, and you can hop on the historic cable cars to downtown easily. We purchased the Go San Francisco Card (2 day for $65 USD) from Orbitz.com (look it up under &quot;activities&quot; and it is a must buy as you save a ton of money to 40 attractions including the red &amp; white fleet boat cruise (we did this first for a good overview of the city and its history), the grayline hop-on-hop-off tour, the aquarium at pier 39, and the exploritorium at the palace of fine arts (beautiful!!) to name a few. I also recommend tourists go to destinationcoupons.com for a free Pier 39 Funpack booklet for great discounts including at the famous Boudins sourdough bakery stores/cafes. There is a 24hour IHOP downstairs at the hotel, but we opted for Boudins. Try their soudough french toast!! It's to die for.All in all I would definitely stay here again. The weather was better than expected (windy, but warm), and the city was utterly beautiful. Would definitely come back again!Please let me know and/or vote if you thought this review was useful--feedback is always nice!"
185,2142,"Jun 9 2007 	confusing nasty stairway access	Can't believe nobody mentioned that you have to use outside stairways to get to the second floor, then passkeys into the hallway and elevators up to floors. No lobby access to rooms, multiple public access points to stairs. Absolutely did NOT feel safe in these stairs or halls. Shabby carpet, dinged-up veneer furniture, wallpaper peeling, window that wouldn't stay open and (of course) no screens. Not worth the money we saved (AAA deal - free parking). Avoid this one if you like safe, controlled room access!!!!"
186,2142,"Jun 3 2007 	Over Priced Under Sized	For $300/Night we got a tiny room with threadbare carpeting, worn out furniture, no closet just a wardrobe which along with the bed took up most of the room. The bathroom fan rattled like crazy and the bathroom was very small. The halls were cramped and dingy as was the lobby. We expected more for the money. Location is good, we could walk everywhere but that didn't make up for the price and the lack of ammenities."
187,2142,"Jun 2 2007 	Good location and value	I've stayed at this hotel about three times in the past. My most recent stay was in May 07. Like any hotel, there are pros and cons. The Pros: Location: it's located in Fisherman's Wharf. Some people may criticize the area as a 'tourist trap', but I find it an interesting and lively area. Why stay downtown when you can be in the waterfront with views of the bay, Golden Gate bridge and Alcatraz island? The hotel is also within walking distance to cable cars, Muni busline and the F-line (streetcars). Plus, there are plenty of restaurants and shops around. The price: it costs compartively less than other surrounding hotels in Fisherman's Wharf. However, the Radisson is no five-star accommodation; so if you're looking for something like the Ritz, go to the Ritz! The basic amenities/service: It was somewhat slow at check-in (apprx. 15-20 min.), but not a big deal, esp. since I went to SF on a holiday weekend. I requested in advance a room near an elevator, and they did honor that request. The lobby was clean and they had a helpful concierge. My room size (city view w/king) was comfortable for a single traveler; it would be fine for two as well. Overall, it was clean with everything working. Another plus-they have 'sleep number' / sleep comfort beds (which you can customize) in most, if not all, their rooms. The cons: Location: My room was facing the back street, which could be somewhat noisy at times. But overall, I didn't have much problem getting sleep (okay if not in the room most of the day). Additional amenities/service: My only minor 'complaint' is the air conditioning, which was a bit old-style and making a bit of noise when turned on. They also have a back entrance/exit which leads directly to the main street at the wharf. But I was told this door does not work at times when you swipe your room card. The hotel doesn't have its own restaurant and doesn't offer continental breakfast, but it wasn't a big deal for me since there are so many nearby restaurants. Overall, it was a good stay and a good value. I would recommend this hotel for most people."
188,2142,"May 24 2007 	A difficult choice	Hotel accommodation in SF is expensive - fact. Fisherman's Wharf is the US equivalent of Blackpool (no offence meant). So, if you are looking for &quot;reasonably&quot; priced accommodation in a convenient location (we were in SF one night and had booked the Alcatraz tour) then the Radisson is a fair option. Just don't expect any frills.The room looked directly out onto (not over) a car park - in which we had to pay a further $30+tax to park. So even though the hotel is close to the water front, don't expect views.The room was clean, tidy and well furnished although lacked character. But it's in the middle of a vast swathe of restaurants and entertainments so you needn't stay in it longer than is necessary to get a good nights sleep."
189,2142,"May 15 2007 	Travel Agent Visit	Great location if you want to stay in the Wharf area. About a 5-7 minute walk to Pier 39. The outside of the hotel is not very attractive but don't let this worry you.Rooms were small but nice. My room was on the 4th floor (only 4 floors) streetside. Could hear the traffic at night but by putting the fan on, the street sound was gone.There is no restaurant on site at the hotel. Many restaurants within walking distance. In the AM there is a coffee stand in the lobby offering simple breakfast grab and go items. Next door is an IHOP offering good food and service.A small courtyard offers a small pool. The staff was polite and helpful.Parking is $40 per day.The public transportation is within 1-2 blocks from the hotel.I used an airport shuttle service and the cost is $15 one way."
190,2142,"May 11 2007	Poor	I can't believe so many people list the room being clean as a bonus - isn't this a pre requisite for ANY Hotel?On checking in we were greeted by rude staff who just seemed to want to get rid of us as soon as possible, the rooms were more basic than some of the smaller chains we stayed in, and the outside door to the car park wouldn't shut - not exactly secure.still, the location for Fisherman's wharf is great, but unlike other city hotels, no information was offered on how to see the sights - strange in such a touristy area."
191,2142,"May 6 2007 	Better than expected	Reviews of this hotel varied from very good to poor, so we didn't really know what to expect, and were pleasantly surprised by a good sized room, very comfortable king sized bed, very clean. When we complained about the toilet running on and on, it was fixed the next day. We were on the 2nd floor, by the parking lot (very sparsely used) and so had a view of Alcatraz and Fisherman's Wharf, which we enjoyed. We found it very convenient for shopping as we could pop down one floor and be on Jefferson Street, right in the middle of shopping and restaurants. I wouldn't recommend the IHOP - too busy and not great food. Johnny Rockets makes a good breakfast, and try Boudin's for Clam Chowder in a sourdough bread bowl. Close to the tour buses, Pier 39 and the Alcatraz ferry (which I recommend)."
192,2142,"May 2 2007 	A good option in Fisherman's Wharf	RadissonThe location of the Radisson couldnt be better, just a few blocks from the Fishermans Wharf, Pier 39 and the pier where leaves the boat to Alcatraz, close to restaurants and the Cable Car stop. The most expensive ride by taxi was from the airport: about US$ 45. To Union Square it was about US$ 8. You can also get the Cable Car to downtown (US$5, 25 per person), the stop is 3 blocks from the entrance of the hotel. But we enjoyed a lot walking around instead of taking cabs.Our room was very clean, we had a king bed with nice and clean linens and extra pillows. The bathroom had complete set of shampoo, conditioner, soap and body lotion replaced every day. It also had a hair dryer and iron in the room. The service was great from the front desk to the housekeeping.We got the best rate in our entire trip! And again: very comfortable and very close to everything. For my first time in SF it was great to stay in a place close to tourist attractions, but maybe next time Ill try a different neighborhood."
