IDREVIEW,HOTELID,REVIEW
285,802,"Feb 28 2006	I am a Hilton Gold VIP not a good service	This is a copy of the letter i sent to the help i did not like the customer service1.I called the hotel and asked where the nearest tube station was. I was then told that it was high street Kensington which was wrong I then had to pay for yet another tube ticket to get me to shepherds bush. 2.I put some chocolate in the mini bar as it was melting. when I got back the mini bar was locked I was staying in room 4028 I reported this to the front desk at 9pm and was told that the system said that the minibar was unlocked but would not let me access it . I woke up and the mini bar was still not fixed. I went down to the front desk and was told that someone would come and look at it. .I is still waiting for the person to come and look at it. And I am Still waiting for that person to turn up . So off to the exec lounge to see what they can do. She call the maintenance department and they said that some one would come and look at it I waited 60min and they went back to my room. The minibar still was not fixed. Therefore, I went to the front desk again and spoken to Shailesh who said again that they will send someone up and will change my room to 7013. Jackson turns up and pushed a button on a remote that fixed it in 5 min why was this not done at 9pm on Friday.3. When staying at the hotel there was a comp breakfast with in the exe room well I was not able to user the exe lounge for breakfast Saturday and Sunday as it was full. I had to go and pay for breakfast some where else,4.I reported this to front desk on the check out and was told that they will get the duty manager to call me on my cell phone I am still awaiting that call.I was looking at becoming a shareholder with in the hotel and I am having second thoughts.I have stayed at the London metropol, the service was great, and I would think of the same service from all Hilton hotels"
286,802,"Feb 22 2006	Great Value Large Rooms nice Hotel	Just got back from 2 nights at the Kensington Hilton I bought this through Priceline for $68 a great buy worth a lot more.I knew where this hotel was situated so it was not a problem there is a bus stop outside and across the road that will take you to Notting Hill or Oxford St.5 min walk to Holland Park tube which is the Central line. There are some very expensive restaurants in Holland Park and a Burger (Tooties) Place. If you want to be in a quite location then this is OK but if your looking for the hustle and bustle immediately outside then NO. You have Sherperds Bush 5 mins to your left or Holland Park on your right everything else is a (small) bus a tube ride away. The hotel was pretty grand for a $68 London hotel .Great front staff,rooms were a real good size compared with other London hotels very good size in deed we were surprized,Clean,Bathroom, Comfortable beds A very good experience I would have loved to have stayed our other two days but they were free with BA at the Paddington Court which was TINY."
287,802,"Feb 2 2006	Pretty awful	The first thing is that this hotel is a long way from the fashionable shopping area of Kensington. It's actually in a not particularly attractive area of Holland Park. I have to say it was a long way down the list of places myself and my partner have stayed in. The foyer area was dark and uninviting and the first room we were given was on one of the upper floors and obviously hadn't been used for a while. There was a bloodstain on the carpet and a cracked tile in the bathroom. We asked for another room which was OK, but nothing special.Breakfast in the morning was quite an experience. We were directed down to the bowels of the hotel where a long queue was forming (outside of the breakfast room itself!) just to get in. I understand this was a temporary arrangement while the main breakfast room was being refurbished, but this had not been explained to us and was really unacceptable. The room in which we (eventually) ate breakfast was a large conference room without any windows. The staff seemed completely overworked, often speaking poor English, and the quality of the food was certainly not what one would expect from a (supposedly) premier London hotel. Especailly as they charged London prices for food and drink. I wrote to Hilton customer service after our stay and received a standard type response - I guess they must be used to it.Don't think just becuase it's a Hilton hotel in a posh sounding area it's necessarily going to be any good."
288,802,Jan 23 2006	a faceless hotel	I stayed at the London Kensington Hilton for only one night. i had to stay at this hotel as it was part of a package i bought with an Eric Clapton concert in the Royal Albert Hall.This is a hotel with no character at all!The rooms are old and with problems and the bathrooms too. There is nothing in particular to mention about this hotel as it is the meaning of an average hotel!Far from the city center with not good facilities and a not polite staff. Maybe because our stay there it was a package.Anyway when i return to London i will try to avoid this hotel.There are better hotels in the town closer to the center and in very good prices.
289,802,Jan 2 2006	Wonderful service......	I stayed at this hotel from the 30th of December to the 2nd of January with my elderly parents . I'd originally found a very favourable rate using an internet company which included a twin guest room with a foldaway bed and breakfast. On checking in I was told I had been given a complimentary room for no extra charge. The rooms and bathrooms were pristine and in good condition. The beds were extremely comfortable and temperature control units were provided in each room. Breakfasts were an absolute treat-a huge selection of food to suit all tastes ! The staff were friendly and attentive but not over-bearing. I would not hesitate to recommend this hotel to any of my friends or family.Buses (94 and 148) pass frequently to stops just outside the hotel and travelling between to and from the West End is not difficult. The only negative would be a slightly smoky lobby.
290,802,"Nov 29 2005	Kensington Hilton a great choice	We just returned from seven days in London, spending four of the nights at the Kensington Hilton on Holland Park Ave. We had been warned that it was out of town and out of the way. Not true! We had a bus stop directly across the street from us and a tube stop only blocks away. The room was spacious by European standards, with two restaurants to choose from. Concierge desk was helpful as was the front desk. We did switch to the Hilton Mews for one of our last nights in London--a mistake! Tiny room, old facility. One might call it cozy, to us it was cramped. It is located right off of Park Lane, but offered no real advantage to us. We should have stayed in Kensington. Next time we'll know. We would recommend the Kensington Hilton."
291,802,"Nov 28 2005	3 days in London	I just returned home from a vacation to Europe that include a 3 night stay at the Hilton Kensington. Based on the quality of the room and the price I paid through priceline ($75 US), I was more than satisified with my stay. The room was clean, updated and modern. The staff was very helpful (a much needed corkscrew was delivered in under a minute!) and the workout facilities were top notch. I would wind down the cold days with a break in the steam and sauna rooms.Overall, a great experience for the price. Located in a quiet residential neighborhood with access to authentic pubs and restaurants, and close to Holland and Hyde parks. You can take the #94 and #148 buses to nearly every major tourist attraction."
292,802,"Nov 25 2005	You Get What You Pay For	We stayed at the Hilton in Kensington just before Christmas to do a spot of Christmas shopping. The location of the hotel is good, a short walk from the tube or the bus stops right outside the hotel and runs 24 hours. Its a good base for seeing London but the journey into the city can get a bit tedious if you are doing it a lot.The hotel itself is a bit tired. Having said that we only paid 64 pounds per night and for what we paid we had no complaints. The concerige were very helpful and breakfast was good. The rest of the staff we just ok. We did have cause for complaint on one occassion and the duty manager was fantastic. Sent a bottle of wine to the room by was of apology.Tip - Ask for a room on the 5 floor or above as these have been refubished."
293,802,"Nov 7 2005	Fantastic break - highly reccomended	We booked this hotel and then checked the reviews on other sites.... I have to say I was rather worried... but it was booked. The hotel is 8 mins. walk from Holland park tube (or get the 94 or 148) bus which drops off right outside When we arrived the hotel staff were very friendly and helpful. Our room was small (what do you expect from London) but clean and very comfy (best nights sleep I have had in a hotel) the food was fantastic, breakfast set us up for the day... I certainly intend to go back to London in February with my children and I will not bother checking any other hotels..."
294,802,"Nov 4 2005	Pretty good deal for the price	Booked this hotel online (for 89 GBP), where I had stayed my first time in London 12 years ago, so I knew what we were getting into. I was neither disappointed nor pleasantly surprised. Even though I'm a Hilton Honors member, we were not given a refurbished room, but we found the rather smallish twin-bedded room adequate and comfortable for our 5-day stay. Next time, I will be a bit more assertive and ask for an upgraded room. I like this place because it's in a very nice neighborhood; walking on the street at midnight did not make me uncomfortable at all. The tube stop is less than a 10-minute walk and takes you past several &quot;necessity&quot; retail shops like a small supermarket, a deli, pharmacy, camera shop and several nice restaurants. Front desk staff was exceptionally friendly and helpful. Bell staff greeted us every time we walked by. Did not eat in the bar or restaurant because we were always in a rush to get to the theatre. I don't care for the overwhelming odor of smoke from the bar the second you enter the front door...but this is England after all where non-smoking accommodations are not yet the norm. I hope they (and the rest of Europe) catch up to us soon! Overall, a very decent lodging experience. I will come back."
295,802,"Oct 22 2005	Excellent Experience	Located in a nice residential area, this hotel was a pleasant surprise. We stayed for 8 days and had a newly renovated room-very comfortable although a little cramped. There was a bus stop directly at the door and we felt very comfortable walking everywhere at night. All in all an excellent experience."
296,802,"Oct 14 2005	Awesome Value For US$70!	We stayed at this hotel for 2 nights in the beginning of Oct. We got the deal through Priceline. For US$70, we have absolutely no complains. the hotel looks dated but our room was clean, the double bed was comfy, and the front desk staff were friendly, and the Concierge staff were extremely helpful. The hotel is 8 mins walk away from the Holland Park tube station. There's not much around the hotel except for a Tesco (supermarket) 10 mins walk away."
297,802,"Oct 8 2005	Great Stay	I cannot comment on value because we stayed here using points.Our five day stay started off shaky since the room we were given was obviously for a single with no luggage; we could not move except by going over the bed.We were given a new room the next day which was more than adequate. The staff was always friendly and courteous, especially the concierge. The location is ideal for anybody who is touring; with a bus stop outside to take you to a tube stop which is only aboidut a seven - ten minute walk at the most but appreciated after a long day of touring on your own.We did not eat at the restaurant but it looked appealing. We did eat at the &quot;bar&quot; area and the staff was agaion helpful and courteous.There are a number of restaurants on the way to the tube stop so we tended to try to eat out and conserve our precious pounds.I would reommend this hotel without reservation and say that it equals some of the four star Hiltons I have stayed in the States."
298,802,"Sep 28 2005	Great Hotel	After reading all of the bad reviews on this hotel I was very nervous about my stay in September. I enrolled in the Hilton Honors Club one week before we went and sent an email to the hotel with my club number. When my husband and I arrived they already had my Hilton Honors club number and put us on the executive floor (7). This entitled us to the continental breakfast, evening drinks (wine, beer, mixed drinks, water, juice and cokes) and snacks in their executive lounge. This came in very handy because I had booked on their website and prepaid at a very good price which didn't include breakfast. The room we had was very large compared to our room in Paris. We didn't have a great view but since we didn't spend much time in the room we didn't care. We also had several bottles of water left for us in the room that we were not charged for and they also replaced every day. The front desk informed me that they have completed the renevations so there was no noise during our stay. When we arrived our safe didn't work and we didn't have an iron. On our way out around 12:00 noon I told the front desk and when we returned the safe was fixed and we had an iron. We were told by the staff to not used the closer tube station (Shepards's Bush) but to use the Holland Park station which is about 4 blocks up the street. I have absolutely no complaints about this hotel and would stay there again."
299,802,"Sep 26 2005 	Overall Nice Stay	Stayed 1 night in August. REad reviews before I booked and asked for refurbished room. Overall very nice although 15 for Wifi in room is a bit excessive. Restaurant was good. Overall very good.PLease be aware that if you have baggage its a fair walk from either Shepherds Bush tube or Holland Park, so take a cab."
300,802,"Sep 25 2005	unsatisfactory	The price of the room, around $200 was the only thing to recommend for this hotel. The rooms were small, one minuscule closet that could barely accomodate 2 suites.The bath room was cramped with a high tub, if you are taller than 6' you may need to stoop. The carpeting was stained inside and outside the room, the walls were dingy . There was no safe in the room, a big inconvenience for me. The TV had a grainy image and you can easily hear the toilets flushing in the adjacent rooms. The breakfast buffet was costly for its limited selection and mediocre quality."
301,802,"Sep 25 2005	Good value	Good value hotel, a little away from a tube, but a short bus ride to High Street Ken."
302,802,"Aug 10 2005	Will be great when the reno is complete	My husband and I stayed at the Hilton Kensington for 6 nights in July. Our first impression on walking in was that the hotel was very nice. The main floor has a the AM/PM Lounge, a larger restaurant and a small tuck shop. There is also a door for direct access into an Asian restaurant. We arrived early in the day, having flown in from Toronto and were so pleased to learn that we could have a room right away. Unfortunately, the first room we had was awful. The furnishings were worn and dated and the bathroom had seen better times - the shower also had a ridiculously low ceiling and my husband had to keep his neck bent to shower! We lay down for a much needed nap and then the drilling started - right above us. It appears that they are renovating 1-2 entire floors and it's very noisy. We asked how long the drilling would last and they said it is every day from 9am to 5pm. We asked to change rooms and the next room we had was nicer - it had already been refurbished and it was just generally cleaner and fresher - it had a proper shower! Unfortunately, the drilling noises were still very loud and we were moved to an executive room. These rooms appear to be above the floor that is being renovated and are much quieter - we didn't experience any more construction noise. The executive room we had was larger than the standard room, had lovely furnishings and a duvet. The bathroom was marble up to the ceiling and the room even had 3 phones. There is a small bar area by the door with complimentary coffee, tea and bottled water. We were not able to use the executive lounge because, of course, it's under renovation - they do convert part of the rear lobby lounge into an executive lounge in the afternoons, but we were never around to enjoy our complimentary drinks anyway. As for the neighbourhood in which the hotel is located, we loved it. We both bought 1 week tube passes for Zones 1-2 and just hopped on the tube to get anywhere - forget about most buses - the traffic is so bad you will be in traffic forever. The Holland Park metro station is 2 bus stops from the hotel, which is really only about a 7 to 10 minute walk along Holland Park Ave. It's a nice walk with great little shops, restaurants and very expensive flats and townhouses. It's a really nice, quiet neighbourhood which we actually enjoyed after spending our evenings closer to the heart of the city - busy spots like Leicester Sq. All in all, we found the staff and service at the hotel to be top notch. They addressed our concerns about the noise and we had a room we were very happy with. The concierge service is also excellent. Granted, there should be a warning on the Hilton website about the massive renovation. We would however definately recommend the hotel to friends and family and would stay there again - hopefully the construction will be finished."
303,802,Aug 2 2005 	Awful Hotel - leave well alone!!	This hotel is not really in Kensington at all - even the taxi drivers agreed with me on that point - it is very misleading of Hilton Hotels to call it Kensington - it cost me 20 each way to get to The Strand by Taxi!!I booked an exec room with access to the exec lounge - on arrival I was told it was closed due to a fire at least a month ago!! Nobody had mentioned that when I booked the room - no mention on the web siteThe rooms were horrible - they were supposed to be newly refurbished and executive but they were very very small - smaller than even a cabin on some ships! They were not what I would have called refurbished! I changed room three times but they were all the same tiny roomsThe worse thing about the hotel is that it is undergoing major refurbishment which it badly needs - there is no mention again of this on the web site where I booked the hotel - the banging and drilling are non stop all day from first thing in the morning!!It is what I would call a transient hotel used by aircraft crew and the main reception areas and restaurants are all very drab and unwelcoming - not at all what I expected from the Hilton GroupIt took many many phone calls to Hilton to even get the room changed and they refused to change my hotel for me despite all the above problems - namely the building work and lack of an exec lounge that I had booked!In short I wouldnt recommend this hotel at all
304,802,"Jul 17 2005	Not really in Kensington	I read several good reviews before booking this through Priceline. However, we were disappointed upon arrival. Had to stand in line for some time for check-in at 11:00 p.m. When arrived at my room, it was next to the elevator and a single. Had to go back downstairs and stand in line to get the double room we had reserved. Rooms are very small and very worn. I am not sure why they consider this the Kensington location. Getting from Harrods to the hotel cost 15 pounds. Internet connection did not work in the room and, although they did send a service guy, he could not fix it. All that said, I would have been pretty upset if we had paid normal prices, but luckily we got it for $110/night on Priceline."
305,802,Jun 14 2005 	Tiny and very noisy 'executive' room!	Being a Diamond Honors member I was given an 'executive' room on the 6th floor. However the room turned out to be tiny and the 'double' bed very small. The decor of the room was OK but the bathroom was very tacky with a plastic toilet seat and black marble cladding. Looked straight out of the 80's. The hotel is quite noisy but eventually I managed to drift off only to be woken up at 5:00am by the mini-bar which was making an extremely loud buzzing / vibrating sound. It was clearly faulty and it took them half an hour to cut the power off to the unit. By which time I was fully awake and resigned to an un-planned early start to the day. Also I had to pay 17 to use their car-park for a measly 10 hours.I think there is a myth surrounding Hilton hotels and their quality. I have stayed in many and on the whole the chain is pretty average with a rare selection of extremely high class hotels and a large number of very average hotels.
306,802,"Jun 13 2005 	Very Pleased and Impressed	Intro:I have no quams with awarding the Hilton London Kensington with a well-deserved Trip-Advisor 4-Star Rating. I am being careful in writing this review whilst taking in the following factors espescially; Cost and Service - as the two are normally related directly to each other, as unfortunate as that likelihood is - it was most pleasantly not the case at the London Hilton Kensington Hotel. As A very well-travelled avid Trip Advisor reviewee, I have stayed in some of the most luxurious hotels in the world, and indeed London. For this particular trip my sister and I were attending an important event at the Exhibition Centre, Earl's Court - thus, we chose function over fashion - that is, Hilton Kensington. We were pleasantly impressed!Review:Location is easy to get to via Public Transport; from Heathrow one should merely take TWO tubes and then a Bus. Located in a pleasant neighbourhood by Notting Hill and Portobello Market. 3-5 mins walk from Sheperd's Bush underground taking you direct to the heart of Oxfor St. or a taxi for 10 to Knighstbridge - if budgeting my personal recommendation would be 6 Zone Card for Zones 1-6 (entire London) allowing full use of Underground, Trains + Standard Rail + Buses. Fabulous.Check-In staff, Han, was very helpful in kindly granting permission for my sister's friend to stay with us in our room free of charge. We had the option of a roll-away for her, but unfortunately that would require a down-grade from our Executive Room to a Standard Room as the Executive contained excess furninshings. We stuck with the Executive Room as they are much nicer, spacious and give access to the Executive Lounge for complimentary Continental Breakfast (ample) and afternoon-evening drinks (decent)Room Service was prompt + well-priced. MiniBar slightly overpriced but decent.Majority of staff extremely helpful and not all, &quot;fishing for tips&quot;. Notable commendation to the concierge, Antonio - who amazingly managed to gain us and some friends VIP access to a very exclusive club in London. Thanks!One must remember this Hilton is only a three-star. It is pleasantly furnished, well serviced, and reflects a higher standard than many, &quot;historical-five-stars&quot;, in London, that survive by reputation.Overall, a very good trip that deserves high commendations. Thanks."
307,802,"May 27 2005	Pleased	After reading reviews, I was a bit uneasy after reserving through Priceline. However, I was pleased with the accommodations. The staff was very friendly, competent, professional and accommodating (a 1230pm late check out was readily granted.) No problem with the Priceline reservation as the clerk stated, &quot;you are pre- paid&quot;. I requested a room on the 1st or 2nd floor. A brief pause until I produced my Hilton Honors Card and we then had a choice of a room on the front or facing a building on the first floor (HiltonHonors Floor). The reservation clerk warned about the potential for noise in a front facing room but it was not a problem for us and I preferred looking at beautiful 100 year old trees instead of a 100 year old building. The quite clean room was ample sized with tasteful decor, fluffy &quot;feather&quot; comforter, smooth linen, complimentary in-room coffee, tea, shortbread cookies. It is true that it may be a &quot;duck&quot; for a tall person in the shower but other than that, the marble bathroom was small but clean with the usual complimentary amenities, large bathtowels and washcloths! The only disadvantage to this hotel is the somewhat &quot;off center&quot; locaiton. The double decker stops in front with direct access to Picadilly or Westminister but slow going in traffic. The tube is about 10 minutes away. . .the taxi from Victoria was $30.00, however. The Airbus no longer stops at this hotel so we took the Hotelink van to Heathrow at 16 pounds per person. If location, location, location is your primary criteria, consider other hotels but otherwise, I was pleased with this hotel. Its not near the center of London although there are interesting sights nearby such as Notting Hill, Portabello Road and Kensington Gardens. The neighborhood is quiet and safe."
