IDREVIEW,HOTELID,REVIEW
131,275,"Nov 2 2005	Good Hotel for Happy People	Recently stayed 4 nights at the Alexis Park Hotel ($75/night, try and get a suite for that price in Sin City). The hotel is directly across the street from the Hard Rock Hotel which is always fun to run into the musically inclined. We stayed in a standard Monarch Suite that has a large sitting area (living room) connected to the sleeping area. The space is nice to have people over, just make sure you pick up after yourself if you don't want your friends to see your unmentionables. Wet bar and fridge are good to keep snacks and cold drinks. Bed was a bit uncomfortable due to lack of padding. Electrical plug in the bathroom didn't work. The entire hotel complex is undergoing renovation, but we weren't bothered by it. If you don't need pampering and just want a good room at a great price then check out the Alexis Park."
132,275,"Oct 31 2005	Bad disgusting never again!	I wish I had read reviews about the Alexis Park *before* booking.The place has a fabulous lobby and looks nice from the outside, but the rooms were atrocious. The first room we were given wasn't made up, smelled horrible, and there was a lot of dried blood on one of the pillows. We demanded another room, and were given one in much better condition, though the bed was squeaky, there were gaps in some of the multihued bathroom tilework, mystery stains on the sofa, and one dead cockroach. On the plus side, it looked like the exterior had been recently painted and the pool areas looked clean.All this for $180 a night.This establishment advertises itself as a &quot;resort&quot; but should really be your last resort."
133,275,Oct 30 2005	The Alexis Park is always fantastic	Two weeks ago my family had a huge birthday party for my cousin and I have to say that my experience at The ALEXIS was great. The front desk people have always been professional and prompt. The pools look good and parking is always available. The rooms are big. It is like staying at an apartment. I visit Vegas about five times each year and I have always enjoyed my stay there. It is the only place I will stay at.
134,275,"Oct 25 2005 	Don't stay at Alexis!	I stayed at the Alexis for a conference last week. What a disaster! The entire resort is just *tired* -- looks like a 70s style motel that's been cheaply renovated. They're halfway done repainting the motel buildings into a terra cotta stucco faux finish, but it looks &quot;faux&quot; and the colors from building to building don't match. The rooms were rehabbed, yet outdated. Some of the entryway tiles in my room were cracked and replaced with mismatched tiles. Other tiles were loose and would move when I stepped on them. The tiles around the shower were also &quot;peeling&quot; -- i didn't think that tiles peeled, but I never stayed at the Alexis before either - you learn something new everyday! :) Also, the remote controls for the TVs didn't work and one of the lightbulbs in one of the lamps were burnt out when I arrived. The worst part of my stay was when the water main broke and there was no hot water in the entire resort. It was the same day as my checkout and I would expect that one member of the staff would apologize and/or ask me how my stay was -- nope -- the front desk just handed me a receipt, no questions asked or apologies given for the water problem.This is definitely NOT a resort, it's an over-sized motel."
135,275,Oct 25 2005	Great hotel great value	My family and I enjoyed our stay at this hotel. We drove all the way from Wyoming for my wife's sisters wedding. I was very glad to have been able to park our family van right by our hotel room. The room was much bigger than we expected and since we arrived ahead of schedule the font desk was very accomodating about checking us in a little early. One gal at the front desk (cant remember her name) was helpful in recommending where we should take our children for some fun.I would like to thank the entire staff ESPECIALLY the housekeeper who kept our room so tidy.
136,275,Oct 21 2005	Great Stay-Great Rate	We spent three nights at the Alexis Park Resort and we had such a good time. The front desk agents were so accomodating and our room was so much nicer than what we had expected for the rate we paid. Every one of the employees we encountered were so friendly and replied to our requests promptly. We will definitely return to this hotel!
137,275,"Sep 25 2005	Disorganized so not a resort!	After reading all the reviews, I was skeptical about staying her. Mainly, for the bad reviews regarding the cleansiness of this hotel. However, this hotels biggest issue is a disorganized front desk. Since, we were on a budget for our wedding, we decided to give it a try anyway. Upon checking in, we were given a Queen Suite, after reserving a Loft Suite. After, spending 45 minutes trying to straighten this out, the person at the front desk tried to charge us for the room we didn't even check into. To make matters worse, our card, which we held the reservation with, was charged for the stay. Even though we paid cash for both the stay an incidentals, prior to arriving. When we discussed the matter with the front desk, they said no charges were placed on our card. We had to call the credit card company, while at the front desk. The card company had to tell them, &quot;yes, this card was charged by your hotel&quot;. As for the room. Once, we received the right one, it was clean and comfortable, except for the upstairs shower. It had severe mildew, and we actually had to buy cleaner to get it clean enough, for us to feel comfortable to take a shower. Overall, if I was on a budget when visiting Vegas again, I would look elsewhere, and only stay here as a last resort. By, the way, still waiting for the credit on our card to appear!"
138,275,Sep 22 2005	Not what it seems	More like a dorm. The rooms do have a fridge and a sofa but beware that &quot;two beds&quot; might mean one bed and a sofa bed.
139,275,"Sep 18 2005	Not a resort	This hotel had bad service in all areas except the housekeeping was decent. This place looks great from the website photos (which must be at least 10-years old) but look at the other reviewers photos that show how truly shabby this place is. Paint and plaster are peeling off the buildings around the pool area and the interior of our suite was very cheap quaility (plastic tub) with very poor finish work. There even was a hazardous, sharp piece of metal sticking up from the floor where a doorstop had broken off, the floor tile was cracked with chunks missing, and we had a room in the &quot;refurbished&quot; wing! The location was bad with lots of construction going on Harmon Road. We love to walk everywhere but it was very unpleasant to walk to nearby areas from this location with too much traffic and poorly lit street and sidewalks. If you have time to watch TV, forget about it. Channel selection and reception were both poor.We had ants in the bathroom and the air conditioner was horrible. The first night we'd go from sweating to freezing, with no happy medium. A little sign on the thermostat said not to set below 70 or the unit would freeze. We turned it down as low as possible and by the 3rd night, the AC unit next to our bed was dripping water all night with a water torture effect. I only got some sleep after using ear plugs. Someone was sent to fix it and all they did was turn the thermostat back up! On the same day, our electronic key stopped working, which made another extremely long wait in line in the lobby a necessity. As it turned out, they had us checked out of our room 2 days early! Another guest in line ahead of us, said it was his 3rd attempt to get checked into a room and one time, they actually put him in a room that was already occupied - it wasn't our room either, so they must routinely &quot;accidently&quot; check guests out of their rooms prematurely. The front desk service was extremely slow and each visit required a very long wait in line with other disgruntled guests. The thing that really ticked me off was their internet service. I signed up for a full day at 10 a.m., only to later learn the cut-off time is at noon! So, I had paid $10 for full day service for only 2 hours of actual service. After calling the front desk twice, they finally said they would reverse the charge. I later overheard another guest asking for a refund for the same reason, so this too must be an ongoing problem. After we checked out, I called the front desk and they confirmed that no extra charges were incurred on our account, only to later see that darn $10 charge show up on my credit card bill a month later. That really ticks me off because it is hardly worth my time to fight a $10 charge and they know it.This was one of the worst hotel experiences I have ever had. If you are considering a stay at the Alexis &quot;Resort,&quot; save your time, money, and peace of mind by staying elsewhere. It is NOT worth the savings you may think they are offering."
140,275,"Aug 14 2005	A home away from home	I booked my stay at the Alexis Park Resort while I was attending to a convention. I got a great deal when I booked my stay in advance. When I arrived to check in at the front desk, I only waited about five minutes before they served me. I asked if I can check in early and they checked me in quickly. They were very accommodating. The staff and security were friendly and very professional. The room I was assigned, was very nice, spacious and clean. The bed was very comfortable too. The room had a living room area and a kitchen bar. Plus internet access (for an extra charge). Room service was good and they made my bed and restocked the towels twice in one day. I will defiantly book my stay again. It was like a home away from home."
141,275,"Aug 5 2005	Nice but with some problems	We checked in quite late and were greeted at the reception by a rather abrubt, unfriendly receptionist who seemed to take forever checking us in. When we checked out, the service was no better. A different man at reception arrogantly said that the room would be charged to my credit card, and then when I said I had already paid for it through expedia, he just snapped at me at said, 'ok, fine', then moved on to the next customer. No apologies or nothing. Of course, when I got home, I glanced at my credit card statement and noted that I have indeed been charged for the room! What a joke. So, I now have to contact expedia and inform them so I can receive a refund. On a more positive note, the rooms are quite cheap. We stayed in a bungalow and it was lovely, spacious with a nice jacuzzi half way up the stairs. Criticism time again - the air conditioning was inadequate in the room. It wasn't even cool in our room, and bearing in mind 115 fahrenheit temperatures, you kinda need good air-conditioning. Also, our room was round the back of the building and faced a waste ground or something (cant remember exactly what). However, the breakfast was lovely, and inexpensive. The hotel offers free parking which is good and it is in a nice location, close to the strip, yet in a quiet position considering proximity. Again, another criticism is that, for some reason an outside attendant constantly felt the need to whistle loudly (to call in taxis I think), so I would pity anyone whose room was near the reception area as that would be all you would hear all night long! Yes, so overall review is good and bad. I would probably stay there again if only for the lovely bungalow."
142,275,"Jul 27 2005	you get what you pay for	After refusing to pay $300 a night for hotels on the Strip during Memorial Weekend I opted for this &quot;resort.&quot; I definitely do not think that resort is an accurate way to describe this place, it reminded more of an apartment complex. I had not done my research on trip advisor prior to going so I was not sure what to expect. I must say that had I read the reviews beforehand I would not have stayed here. BUT, I was pleasantly surprised. Check-in was quick and easy.The room was very big and looked like it was newly remodeled. Overall it was clean enough, I did not notice any stains on carpet, towels or sheets and I felt comfortable walking around barefoot. I am somewhat of a neat freak so this is a big deal to me. We did have a problem with housekeeping in that we left the room late afternoon and came back that night to find that our room had not been cleaned. We were only able to get clean towels after calling the front desk but room could not be cleaned as housekeeping staff had left for the day. the next day we made sure to call housekeeping prior to leaving for the day and thus ensured that our room was clean once we returned. The location is far off the strip but close to Hard Rock. I did not notice the airport noise but that is probably due to alcohol consumption....if you are a light sleeper the airport is definitely close by."
143,275,"Jul 27 2005	Don't Sweat the Small Stuff	If your the kind of traveler that needs alot of personal attention from hotel staff, this is not for you....If you want to stay some place economical and well located consider this place...Had the crown loft great space...The entrance to the hotel is misleading...the front of property does not look like the rest of the hotel. Renovations seem forever on-going, but after a few days you think they may be finished. Large pool not open. A/C wall units (3 in all) had some leaking problems and noisy. Front desk are not quick to the phones. Some no answer at all or busy signal. Room was clean, well stocked, furniture and room was in good condition and very spacious. Spa tub was nice. Would stay again, just keep your needs in prespective."
144,275,"Jul 20 2005	Bad Experience	My flight to vegas got cancelled, and they refused to refund me my money (prepaid), whereas circus circus did. Its off the strip and there are better places on the strip, or off."
145,275,Jul 14 2005	I had a great time at the hotel	My friends and I went to Alexis Park in Vegas for my friends birthday. I was very happy with our room. It was big enough for my friends and I have a plenty of room. It was (4) girls so you know we needed plenty of room. THe staff was pleasant and the grounds were well kept. During my stay I even saw a beautiful outdoor wedding. THe hotel had done a really nice job. Overall my stay was excellent and I would go back again.
146,275,"Jun 9 2005 	Worst hotel ever	I stayed at the Alexis Park in Vegas recently. The hotel is in very bad shape. I was supposed to stay 4 nights, but left after 2. On the first night, the air conditioner broke. So they moved me to a room that had dead bugs laying on the bathroom floor and ants crawling all over the bathroom sink. It was disgusting and I highly recommend staying anywhere else. The website made the hotel look great, but it was a different story once I got there. Stay Away!!!!!"
147,275,"Jun 3 2005 	Alexis Resort Problems	1) TV sets (approx 30&quot; x 30&quot;) in Alexis Park hotel rooms - were not secured, or bolted down. Could be a hazard. 2) Bathtub/shower unit did not have slip resistant bath mat or other slip prevention device. After housekeeping cleans tub unit - surface is very slippery - could be hazard to children or adults. No hand rail in tub area for elderly guests. Also, there is no bathroom fan.3) Pool, contaminated and closed for several days. Notices appear to be from the local health department. This situation continued for several days -without full disclosure from staff.4) Air conditioning did not work in all Alexis Park units. Fellow traveler had a room without air conditioning while temperatures exceeded 100 degrees. The windows do not have screens or security devices.5) Full Disclosure of Hotel Charges (no room document/staff untrained) The phone lines were often busy - I was unable to get an outside line for up to an hour. Not good in the event of an emergency. Room service charges a mandatory 18% that is not disclosed on room menu. Internet is available for $12.95 per day. (At time of booking room - I understood it was free.)6) Mini kitchen (small sink, refrigerator, 2 drawers and 2 good sized cupboads, bar with 2 bar stools) is not fully functional for guests. The refrigerator temperature is set too high - and food freezes. Turning down the temperature, caused refrigerator odor. The room we rented had a queen bed and a couch/bed. The room could sleep 3-4 people - but the coffee maker was a single serve - for 1 person. No can opener, no microwave oven (to warm tepid room service meals), no toaster, and no dishes or silverware. Hotel staff did not have dish cloths or dish towels. I have rented several hotels along the WA and OR coast with a mini kitchen - and ALL have a few dishes, a few pieces of silverware, hand can openers (dish cloths and dish towels) and a microwave oven. 7. Movie selection - is not current. TV programs: NBC, Fox, ABC, (Alexis Resort Personal Billing channel - that never had an accurate billing posted for my room, Station/Computer program - non functional),ESPN, ESPN 2, ESPN News, CNN, Headline News, Cartoon Network, Weather Channel, Las Vegas channel - non functional, TBS. NO PREMIUM CHANNELS.8) No Shuttle service to the strip or to the airport. From Alexis Park to the strip - is a very hazardous section of roadway. Cars and taxis are going from 45- 60 mph and make quick entrances into and out of properties along Harmon Ave. There is a sidewalk. Staff will tell you that the Hard Rock Hotel - across the street has a shuttle (to Las Vegas Ave) every hour on the hour. The Hard Rock shuttle does not charge for the service. 9) Alexis Park room amenities: Iron/ironing board, 5 hangers, queen bed (springs were terribly noisy), 3 drawer chest of drawers, 2 nightstands, couch/bed chair, 2 bar stools, small mini kitchen with single serve coffee maker and 2 coffee packets/2 condiment packets. Several towels were dingy and some had terrible stains, stains on the sheets as well. Laundry staff may not be using bleach for the laundry. No care is taken to provide clean looking towels and sheets.10) There was plenty of hot water for 2 nice long showers daily - and the hotel room was clean. My room had 4 sprinklers - and a working smoke alarm.11) Room keys stop working after 7 days. At the end of 7 days, the room key did not work. Staff did not alert guest to this standard issue at time of entry to hotel. Nor did staff member apologize for the inconvenience to guest. Front desk staff, not courteous to guests - a lack of common courtesy appeared to be standardThe stay at the Alexis was for business. It is known that several business associates stayed one night - and found better/less expensive housing in Las Vegas. For the record"
148,275,"May 28 2005 	Never Again	I would rather sleep at a truck stop, the help would certainly be friendlier.After arriving at 4:00 I found a check-in line 15 people long and only two people working the front desk. After the 45 minute wait to actually talk to the desk staff, I was told that my reservation had been cancelled. At that point, the desk staf was simply done talking to me. &quot;Call Orbitz&quot; I was told while they called the next victim in line.Orbitz did fix my reservation, which was entirely a hotel problem and I was checked in. Luckily, my room was clean and remodeled. Other guests attending the convention I was with were not so lucky.The main pool and hot tub were condemmed by the county health department. The third floor open air patio over the convention center hadn't been cleaned since what looked like a new years eave party. The bar was horribly dark and smelled of 20 years of smoke and spilled drinks.I had a bit of trouble with the $10 / day high speed internet access in my room and called for help. After prommising to have the technician there as soon as possible, I was lucky to figure it out myself after waiting 6 hours.If you used the second pool you had to share it with ducks each evening.On Friday evening, every teeny bopper in town showed up to share a room and hang out by the pool, right outside my front door... there must have been twelve 20 year olds sharing one room.Room service trays stayed in the halls all afternoon.The ONLY saving grace for this place was my 700 square foot remodeled room. I would never stay there again if given a choice."
149,275,"May 28 2005	Great room decent price unique gem of a hotel	Well, I just got back from my most recent trip to Las Vegas. I stayed in four different hotels and had four totally different experiences. This hotel started off very very negative in that the line to check in was a monster and there was one check in girl who barely spoke english. The manager did come out to help and that moved things along. From an organization standpoint this place gets one star. That said let me tell you why I rated this four stars. First let me say there is no casino on property which is good. The place is super quiet and the rooms are nice nice nice. I stayed in the Crown suite and only paid $115.00 per night. A great bargain for a room that is two floors two bathrooms and a king sized bed. It even had a hot tub in the stairs very cool. I would highly recommend this place for a honeymoon couple that does not want the distraction of heavy casino traffic. You still getr great views of the strip. I cannot give this five stars only because I stayed at the Bellagio this trip and it is now my worldwide standard bearer for hotel rooms. This far exceeds the Aladdin which was my previous favorite but not a good as the Bellagio. I recommend highly. Feel free to e-mail me with any questions"
150,275,"Apr 30 2005 	Not really great but the pools open 24 hours.	We stayed here for a convention that was happening at the Alexis Park resort in August 2003. We ended up having to stay in the farthest section of the hotel, all the way in the back. At least we had a car and we could drive over there with our luggage. The room was average. It was a suite with a pull out bed. If I recall there was a kitchenette. One thing that turned me off was the shoddy cleaning job that housekeeping did. I remember walking around with socks after they had cleaned and then looked at my socks and they were black. I don't think they ever mop up the floors in the kitchen or bathroom. Not to mention I could tell they didn't vacuum. The only thing that I enjoyed about the Alexis Park was that the swimming pools (there's 3) are not monitored and you can swim in them at any hour of the day. We were at the farthest so farthest from the lobby and hotel staff could not hear or see us. We would go swimming and sit in the hot tub late at night after we can home from partying. That was really fun. Especially since the water was so warm from the hot August days. I wouldn't really go back except for the swimming situation."
151,275,"Apr 15 2005 	Long lines at checkin	I booked over the internet and got a really good deal but learned a good leason....you only get what you pay for in life! The lines at check in were long, which i guess is normal for Vegas but to top it off the front desk clerks were so rude! They did not even apologize for the delay and really need a leason in customer service. The room was OK ( i liked the coffee pot) but housekeeping was not good-stained sheets, and they did not empty my trash. In fact, the garbage can did not even have a liner. The only good thing about the hotel (or should I say resort?) was the food-fabulous. By the way, where are the villas they are talking about?"
