IDREVIEW,HOTELID,REVIEW
134,372,"Dec 8 2008 	Great Location and Inexpensive	Stayed for four weeknights at the Hooters Casino Hotel in Las Vegas in the bungalows which is what we asked for. The location is great, one block from the strip, MGM and the walkovers to NY NY and Excaliber. The rooms are small but clean, housekeeping staff is very nice. Had one small maintenance issue and they came in 10 minutes to fix it. Parking there is easier than most of the very large hotels. Pools are very nice too. If you want luxury like Bellagio or Wynn, this is not the place for you. We get up around 10 or 11 and stay out till midnight or later so as long as the room is clean and fairly comfortable we are fine with it. Would have liked another chair beside the one in the room and maybe a small table, but not complaining. We had a king size bed and it was very comfortable. Had the breakfast in Dan Marinos one morning that came with our package. It wasn't the greatest but for comp, it was just fine. We ate the 25 cent wings after midnight one night in Dan Marino's and that was just fine too. There was never any line at the front desk if we needed anything. Heard horror stories at some of the others just about trying to check in at the huge places. I work at a hotel in a resort area and a 600 room place would be considered large but for Vegas, it is small. Makes it more intimate.They charge for wireless internet, but we were on vacation and didn't use it, but most of the other more expensive places charge for this too. It would have been nice and some hotels do this even though they charge for internet access, they let you print up your boarding passes free. Hooters didn't so I paid the $6.95 and the girl in their gift shop was very nice in helping me with the computer to print it out."
135,372,"Dec 6 2008 	My last time staying here	Stayed in this hotel over Thanksgiving and I took advantage of some of the freebies they had offered, ie free breakfast buffet for 2 and $ 200.00 free slot play. Me and my wife ate at the buffet the first morning using the free coupon, it was ok but we could not see going back the next day and spending $9.99 a person on that buffet. It was a combination of ready to serve quick heat food and dry danishes. I have stayed at a Marrott hotel and the &quot;free&quot; breakfast there was much better. The elevators going to the garages were filthy. We didnt even try to eat in the Hooters Restaurant there becouse the last time we were there earlier this summer the service was extremely poor. The second morning we were there the maids were out in the hall in the early morning cleaning the rooms. We left and got back around 4pm and discovered our room wasnt even cleaned. I had to go to the desk, wait in line 20 mins and complain about it. An hour later 2 maids showed up to clean the room. Bottom line,,,,,,,,this is a dated hotel that the Hooters Corp has bought, threw some surfboards in the hall and decorated in wood. Ive been here twice and the service has been poor. My advice is take your money and for about the same price,,,,,usually less,, stay down the road in the Orleans. I will never go back to the Hooters Hotel in Las Vegas and will recommend the same to my family and friends."
136,372,"Dec 3 2008 	Hooters - $1 Dixies draught?! Can't complain	So, a group of us booked a trip to Hooters in January. 10 months down, and we hit Vegas. Hooters of all places!!I thought all a long this deal is too good to be true, and Hooters is going to be a let down. I read some pretty poor reviews, and expectations where certainly not high. But all I wanted was a roof over my head, a clean room, and some reasonable food and service.Firstly the location. I knew it was near to the MGM grand, which is huge, but right on the strip. You are literally 5 minutes walk away from the main strip and have good access to New York New York, MGM, Excalibur and many more hotels. It cost us just $12 from the Airport to the Hotel, and you can see it as you land.Secondly, the staff. 99% of the time great. Everyone was very friendly, and more so with it being Thanks Giving. I find some of the reviews people left saying the staff where moody and bad is probably a reflection on the reviewers personality. The staff where great with me and my friends, always a good morning, and always offering assistance. There was the odd one who was a bit moody, but you get that everywhere. Also on the staff, the Hooters girls got progressively better as the week went on. The girls in Dixies where just phenomenal to look at, and again, very friendly. Food and Drink was very well placed, like it was in most of Vegas. $4 for American beers, and $1 draught at night in Dixies is great value. Even with the weak pound to dollar. We ate in the Hooters restaurant one night, and again, service was great, and the food very good.The room was much more than I expected. We had clean towels every day, a reasonable selection of TV, and it was clean and tidy. Some people must have got a dodgey room, because mine was spot on the mark. If I had one complaint is that you get a 50/50 of what your view is. One side is the strip, one side is Motel 6 and the Airfield. Shame that, but did you come to Vegas to look out your window?!No, the real reason we went to Vegas was to gamble. And while you want to big it up in the big casino's, Hooters is a great place to start and end the night. And as said earlier, the location is spot on near the strip, and near the monorail stations into the middle of the strip also.Overall, did I expect a lot? No. Did it go beyond the expectations? Yes.I would have no problem recommending Hooters to friends, and I would have no problem staying myself their again. The only reason I wouldn't is so that I could see the rest of the fine hotels in Vegas, but when I return if I don't stay at Hooters, I will certainly pay a visit."
137,372,"Nov 29 2008 	Cheezy as expected - but worth the $29 to be less thank a block from the Strip	Check-in staff were not friendly and neither were the lady bartenders (maybe because I'm a girl). The hot tub wasn't so hot, but that allowed me to spend over 3 hours in it getting to know some Brittish guys. Room was about motel 6 quality, and the bathroom had mold in the calk around the bathtub. HOWEVER - I paid $29 for one night - it was well worth the $29 because you are less than a block from the strip!!Stay here if you want to be close to the strip and can't get a room for under $100!"
138,372,"Nov 26 2008	Crap time Hooters style	Having been to Vegas several times, we have never been let down by our hotel standard, not the very top of the range but good, Stratosphere &amp; Sahara. So this time our travel partners booked Hooters! It is well located &amp; not far from the airport or Monorail at the MGM, so it is accessable. It is advertised as a Floridian theme, I never saw grey drab walls inside &amp; out in Florida,dull. The room we had ,621 was of a low standard, stained carpets, poor decor, looking onto the airport flight path with all that take off noise. We had an interconnecting door, so all in 622 could be heard! At some point early morning, 3 am, in 620 either someone was having a ride to heaven or the adult movie was on loud. The walls are so thin, unbelievable.Breakfast another bad experience $9.99, but watch out, juices, toast etc extra. The basic breakfast was a poor selection, but then again it was $9.99! Service was poor, being held waiting for seating when the place was nearly empty was a joke.Waiting staff, bar one lady, was dreadfull, no tips there.The whole place was well below par in every respect. To add insult on check out, we were OK, but our friends were handed a bill for drinks they never had. Someone had charged a large round of 9 Buds &amp; prawn cocktails to their room No. Obviously bar staff did not care to check validty of the order. They did not pay that &amp; await the outcome.When you look at the deals now on in Vegas, in hindsight we should have just turned up &amp; got in the MGM of Venetian as my friends wife wished, plenty of room. Sadly we stuck it out from Monday to departing on Saturday morning,our fault there!!So any one reading this, please, please do not go to Hooters, it is certainly not a Hoot, quite dreadfull.Take care all &amp; do not be Hootered!!!!!Les wilkinson (an un happy Brit Abroad)"
139,372,"Nov 18 2008 	I just can;t reccomend this place	We usually stay at some simple place to save money for other things on our trip. My motto is safe and clean and I am happy. I want to say this was the case here, but can't. The room was smoking even though we asked for nonsmoking. The tub faucets fell off all the time and the room was at best tiddied up like a 14 year old tidy's his room when forced. The hallways weres simply dirty and the elevaters worked only slowly and sometimes. The pluses were it was super close to the strip and other than not being RIGHT ON the strip was super convenient. Being smaller, parking was a breeze and getting to our room took under 5 minutes comparesd to a half hour at some of the big places. Staff were polite and our room for the most part was quiet. In the end though i just can't reccomend it. With all the choices there, you can either stay a bit off the strip and save money for nicer rooms (no big deal if you have a car) or pay maybe 10 to 30 dolllars more a night (things are very competitive now with the market in Vegas) and stay at nicer place on the strip. We dresssed up to go out and felt a bit like freaks going through the casino to the car. It is a very simple casion with casual people. A suit and cocktail dress couple walking through here really stand out."
140,372,"Nov 15 2008 	Good hotel we had a nice stay here.	We stayed here 3 nights at the end of October. Room was big and clean. They gave us clean towels every day and changed the sheets once. The hotel and casino is layed back and there is a lot to do. On certain days ladies drink for free from about 5-11pm in the Dixie bar. You have to take the $200 gameplay you receive with a grain of salt, of course you're not going to win on those machines in the roped off area but hey, just have fun with it for 30 minutes right?Unlike the comment further below, the girls were curvy enough for us and they were all dressed up during halloween. We did not run into any rude staff members at all, everyone was friendly."
141,372,"Nov 13 2008 	Value For the Dollar	I stayed during October 2008.I was looking for an inexpensive room in Las Vegas during the week, this was my choice.The hotel was very clean the room was well furnished, the bathroom was also clean. Only one negative no tissues, but I managed.If I am going to Las Vegas again I will look into Hooters."
142,372,"Nov 10 2008 	Not Too Shabby!	3 Ladies and i went to HOOTERS hotel for a quick,cheap Vegas getaway. The Hotel was okay. Obviously an older hotal that was re-vamped with tropical decor.If you are looking for Clean, Neat and fancy, this isn't the place for you. Bar stools were broken, bathroom counters were stained, the drian in the shower backed up. Other than the above it was pretty decent. After all, it's just a place to sleep after a long day on the strip!We had a Bungalo which is the way to go if you are there in the warmer months. It backs up directly to the pool. Music at the pool turns on around 9:30, which can be annoying.If you are looking for CHEAP, and EASY...Go for HOOTERS!"
143,372,Nov 10 2008 	Thought Hooters was supposed to have women!	I stayed at the Hooters Hotel and Casino for the Hooters experience that I get at my neighborhood Hooters. The majority of the Hooters girl here are frail thin with no curves at all except for the ones that have obviously gone under the knife. Not sure but most of the girls don't look old enough to be working in the casino or serving drinks. No curves at this Hooters. Very disappointing.
144,372,"Oct 24 2008 	Hooters was truly Fantastic	My wife and I stayed for 15 nights recently on our first visit to Vegas from the UK. We were amazed after reading some bad reviews at how fantastic the hotel was! The room was very clean and spacious and the bed was enormous. It was ideally placed both near the airport ($10 in a taxi) and also in walking distance of the strip. While the $200 free slot play is limited to the promotional machines (only a jackpot win pays) we took advantage of the free show and saw the 'Mentalist' Gerry McCambridge. What a fantastic show and completely free, no catches. The pool area was extremely clean and very relaxing, my wife especially enjoyed the hot tubs. The staff were very friendly and we ate in the Hooters restaurant a number of times, on each visit the food and service were excellent. On our last night we paid for a picture with the Hooters girls from the restaurant photographer and she very generously gave us two pictures for the price of one! A tip for others, the Excalibour Hotel offers time share tours with some excellant prizes just for going. We spent 3 hours (yes I know, but as we were there for 15 days it didn't matter really) listening to a woman talk with no intention of buying. At the end we got free Lance Burton tickets (tax had to be paid on them) and 5 x $25 vouchers for food/gambling at the Mandalay Bay, The Luxor, The Excalibour, The MGM Grand or The Mirage. If you can afford to lose a morning and know how to just say &quot;no thank you&quot; then I would highly recommend it (we had three excellent meals and made a profit on our gambling)."
145,372,"Oct 19 2008 	Great room great staff and great surroundings	I stayed at the Hooters and being a travel agent, I hear a lot of positives and negatives about many hotels. I personally stayed in the Hooters and would recommend it to anyone. The staff are super nice and friendly. The beds were comfy and the room was spacious. The best thing and a lot of people notice this, it dosen't take 30 minutes to walk from the front door to the rooms, the casino isn't huge so there isn't a lot to walk through!I look forward to my next stay at the Hooters!"
146,372,"Oct 17 2008 	More than I bargained for	I booked our room late September for our 3 night/4 day stay in Las Vegas because it was such a deal $29 a night. The insane price during Columbus Day weekend was a deal on top of: $200 free slot play, $25 match play @ the tables, free drink @ Dixie's, free breakfast buffet, free night show and more!!!!But I was a little apprehensive AFTER reading all of the reviews. But I figured, if I checked in and it was lousy I knew there would be other options.Figured out that after almost a 5 hour drive from San Diego and arriving at the hotel at 3am, checking in was no problem and we were given a room on the 14th floor in the Ocean Tower. To my surprise the room was big, spacious &amp; clean. There was a stain on the carpet, but I wasn't planning on sleeping on the carpet anyway. Two clean, comfy beds and a decent bathroom. Not to mention my own make up counter next to the minimal closet.It WAS NOT bad at all and I was extremely impressed. It wasn't no Bellagio or Caesar's Palace....but when you're in Vegas all you need is a room to shower and nap in. Who the hell goes there for the rooms?"
147,372,Oct 13 2008 	very good	got a 53.00 per night rate. It really was a good room. I thought it was clean and the bed was very comfortable. The place was very quiet at night--it is close to the airport so there was take off and landing noise during the day but no airport noise at night. The casino is fun. The pool area is nice. We would stay here again.
148,372,"Oct 6 2008 	Cockroaches mold and dirty carpets...Oh my!	I booked my room at Hooters Casino Las Vegas for my brother's 21st birthday. The hotel halls were extremely dirty and stained. Once in our rooms, first thing I found on the bathroom floor was a cockroach! (Later another cockroach was found roaming the bathtub.) I was disgusted. Then on further inspection the shower curtain had several mold mounds gowing. I would expect this from some cheap motel but I paid $150.00 per night to stay at this infested hotel. (I think they charge extra for cockroaches and mold.) I travel to Vegas well over 8 times per year and this is the worst hotel I have yet to stay in. Needless to say, my brother's 21st birthday is one to be remembered, just not the Vegas style memory I was hoping for!"
149,372,"Sep 26 2008 	Pleasant stay Not awful Not Excellent	I recently stayed at the Hooters casino/hotel, Was a bit apprehensive at first after reading all the negative reviews bu booked through priceline so it was take it or lose out.Thankfully I was suprised when I got to my room in the tower was a spacious twin room plenty of room and most importantly clean ,didnt see any of the dirt othes mentioned.The pool was great but did tend to get crowded sometimes and I wouldn't like to be in the bungalows with the music on from dawn till dusk, could only slightly hear it in the towers.Found th staff friendly enough but didnt really have loads of dealings with them so cant say how they would have handled any complaints.Oh and the shampoo and conditioner smells really lovely.Its in a good location only a short walk from the tropicana and MGM, the walks prob less than getting out of some casinos from your roomFor the money they charge you get what you pay so dont go in expecting some swanky hotel."
150,372,"Sep 26 2008 	Hooters Restaurant YES - Hooters Hotel NO!	We stayed there the first month it was open and LOVED it! We stayed there again last Saturday, September 20th. This time we didn't. The deterioration was unbelievable. It's pretty obvious that employees really don't care about the facility. The hotel hallways and room carpets were black with dirt. You even saw dirt tracks permanently in the carpeting from luggage. I don't believe they have ever washed the carpets. The maintenance in the rooms were nil. Our bathroom had multiple mold and rust stains, missing shower curtain rings, toothpaste on the front of the sink, dirt in the crevices of the bathroom floor. The room had filthy carpeting and stuck taped paper/toilet paper on the wall over the bathroom door. You couldn't miss it so I find it hard to understand how it could still be there. If you end up in room 839, look up! The slot machine promo is truly a joke as others have said. There are approx 12 machines that are roped off. You stand in line to push a button on a $2.00 machine and you only have 3 winning combinations. I also never saw anyone win anything. I actually won 50.00 in coins which added to my total but I was not allowed to cash out because it was not one of the 3 winning combinations they designated. The comedian was also worthless. Several people walked out of the program out of disguist. Old jokes...I definitely recommend he find some new material. Heard it all before. They could easily upgrade this facility to make it liveable but apparently chose not to. New carpeting, new paint, employ friendly people who take pride in doing a good job. One highlight - the band in Dixie's, the Country and Western Bar, that night. They were amazing and I don't even like CW Music. But, don't stand at the bar. You'll stick to the floor. I walked right out of my shoes the floor was so sticky. My husband and I got a chuckle out of that. Again, we have always loved Hooters Restaurants and plan our vacations around them all over the world. We have a Hooters wall in our bar at home. But, they've really lost it at this facility. They need to make some real changes to bring it back to the standards that make it resideable. It's too bad....we loved it the first time. I would not stay there again without some serious renovation even with the great location and great price!"
151,372,"Sep 25 2008	Not so great service/ rooms or stay all around	6 of us booked our stay at Hooters for the weekend we saw Jimmy Buffet at the MGM across the street.Checking in was a breeze and the counter help was great. We booked King size beds however all 3 couples got 2 singles? The were out of rooms with Kings................The rooms were not clean, hair clogged the sink, the hair dryer was broken and there was junk all over the floor behind or under anything the vacuum could not get to. Two of the four light bulbs over the sink were out. I called and got a replacement hair dryer right away. The Dan Marino Restaurant when we arrived off the plane was empty, the bar was closed at 11:00pm and our server let us know it was his last night because he was going to a better place as the restaurant was no longer highly rated. The pool side service was the worst, the waitress took my drink and food order at the same time. I waited 20 minutes then chased her down to see if I could at least get the drink. She said &quot;OH I thought you wanted the drink when your food came out&quot;??The last night of our stay was the concert night. We ate at the Hooters Restarant and had a fabulous server named Stephanie. She made the best of a bad situation. We all ordered and began getting our food except my meal which they forgot because it was seafood. Stephanie removed the charge for my meal. The gift shop had really fun items and the staff was very kind. All said our next stay will be at the Stratosphere in November."
152,372,"Sep 23 2008 	Bad Promotion	Some positive and some negative-- We arrived early and were able to check in and the process was very quick with no one else in line. Booked directly with hotel because they were having a 200 dollar free casino credit...dont be lured in by this promotion....only certain slot machines included and I dont think anyone has ever won.... cant cash out when you do win. BAD promo. , and should not be deciding factor in booking this hotel. Hotel is very close to airport, so cab fare was only about 13 dollars. However, far away from Old Downtown Vegas..cab fare 30 dollars with tip. BED is awesome..shower had NO NO NO pressure at all...took 20 minutes just to take quick shower. We were on the 19th floor though. Not a huge pool area, about 50-100 guests max or there would be to many people... Only had one bartender on a Saturday and with the huge group there had a hard time getting drinks. perfect just to lay out and jump in to cool off. Water had a dirty film on top..could have been from the huge group of people there . Loved the hooters wings!! Always good... Breakfast buffet 9.95, kind of expensive, but convenient. not sure if they have a dinner buffet. ALWAYS a cocktail waitress to get drinks in casino area and at inside bar. that was nice, the bigger hotels you could hardly find one on your own. C lose to MGM, Tropicana, Excalibur and New York New York. Other hotels a bit of a walk. Overall, I would say that if I had not been lured in by promo I would have stayed elsewhere. Would only stay there again if I get hotel FREE or around 30-40 a night total."
153,372,"Sep 13 2008 	Brilliant time at Hooters	We decided to stop at Hooters as last year some of the party that we went Vegas with stopped there and really enjoyed it.I can honestly say that i didn't have a problem with the hotel at all.The location was great,the room was large and spacious and had the most comfortable bed I've ever slept in!!The pool was also great.Its location at the southern end of the strip was really handy and considering the price of some of the hotels in the vicinity it was really good value for money.The main benefit though was the size of the hotel,it was not too big.I've been to other hotels in Vegas and it takes ages to get to the room.We had a brilliant time and would definately stop again next time we're in Sin City.The only compliants i can make are the dirty carpets in the corridors and Dan Marinos wasn't the best but who cares,Vegas is full of restaurants."
154,372,"Sep 12 2008 	You get what you pay for	We stayed at Hooters in September 2007. Had booked the bungalow category by the poolside which had some downsides but then, on the other hand, was really cheap. I guess you get what you pay for. The room was clean, however, the carpets in the bungalow part of Hooters were horrible - both on the corridors and in the room. Dirty and smelly. Another downside was that there was no fridge in our room. We did, however, really like the pool are. Had great fun at the casino, too and enjoyed the restaurant. Service was good. It is very close to the strip but a real budget alternative if you do not want to pay the prices for the big hotels on the strip. Overall, I can recommend this place. You might not want to chose the bungalow category though :-)"
155,372,"Aug 30 2008 	beds are comfy	We were in the 2nd floor bungalow facing the pool. Yes, we had a real balcony! The bed was comfy, the view was great, but we didn't spend too much time in there, it WAS Vegas after all! We had a great time gambling there at Hooters as well as other places but after a long day of fun in the sun our bed was soooo comfy, sleeping wasn't an issue. (The pool music does turn on at 10am or so though...)"
