IDREVIEW,HOTELID,REVIEW
108,827,"Nov 17 2006 	Comfortable Hotel	Stayed at this hotel for one week in October for a mix of business and pleasure. As other reviewers have indicated it is a comfortable, modern, roomy (by London standards) hotel. Camden itself is a cosmopolitan area well serviced by the tube and buses. There are several restaurants within a block or two of the hotel with a variety of cuisines. Older and single travellers may find the walk from the tube station a little uneasy after dark. Our room didn't face the outside of the building and we were pleasantly surprised at how quiet it was. Would happily stay again on future visits to London."
109,827,"Nov 12 2006 	Good but noisy location	This hotel has a good location at Camden Lock, a lively area with plenty of nightlife including a large Wetherspoons right next door. The nearest tube station is a short walk away. The hotel itself is modern, comfortable and well-maintained, with smart rooms (particularly the bathrooms). The only downside is that it's a bit noisy; the windows keep out some, but not all, of the noise from the people on the streets below, and I also found I could hear the people in the room next door. Other than that this hotel's great, but if you want peace and quiet look somewhere else."
110,827,"Oct 25 2006 	great hotel	We stayed at holliday inn camden lock for 3 nights.The room was very spacious compared to average british hotel standards. Nice clean bathroom with a tub.The surronding area goes from beautiful to wouldnt go there alone a dark night.Between the hotel and the tube station there are alot of gothand punk type of shops with the accompanying sort of people, and if youre not used to this type of crowd that might make you feel uncomfortable. But I never once felt unsafe in the area.The breakfast buffet was great it had a large selection of everything from toast to hot food.would absolutlety stay there again"
111,827,"Oct 4 2006 	One of London's better hotels........breakfast ok	Stayed at the hotel, on business during September 2006.The hotel is only 5 mins from Camden Tube station which makes it easy to commute into the city for business or a night on the town (10 taxi from Leicester Square).At the rear of the hotel there are several shops and bars around the canal / locks. These are nice area for a relaxing afternoon, away from the hussle and bustle on Camden High Street.I have stayed in numerous London hotels, however this was my first visit to this particular hotel. I was very happy with the location &amp; size of rooms, therefore I will definately return on business. I would also recommend this hotel as good destination for a weekend break.Breakfast was ok, however it wasn't excellent !"
112,827,"Sep 23 2006 	Good hotel	I stay here regularly on business.The hotel is relatively new and purpose built. As such, the rooms are a good size, standard Holiday Inn, rather than converted from previous use. The staff are friendly and room service is reasonably priced. There are a number of restaurants nearby. Camden is out of the central zone to the North. The tube station is 5 mins walk from the hotel and there is a bus service. Camden has long been a &quot;bohemian&quot; area in london and the main street has a famous clothing market. It does have a drugs scene and is not appropriate for youger children after dark, although the hotel is set on a side street where it isn't so visible. Efforts to clean up the area continue."
113,827,"Sep 6 2006 	Excellent hotel!!	I stayed here with my mum over the August bank holiday weekend and had a great stay. Our room was large and clean and the bed was so comfy! The bathroom too more than lived up to expectations with both a bath and a great shower. In addition, we had a balcony which was completely unexpected and gave us a great view over the Lock.The bar downstairs was a great place to relax and the staff were really friendly - asking how we were, giving advice as to where to go out to etc. We also got a free newspaper and breakfast was included - although we only had this on one morning, when checking out they refunded us for the breakfasts we hadn't had, which I thought was a nice touch.The area itself is great - there's a great choice of restaurants and bars with a Weatherspoons 10 seconds walk from the lobby, and a Wagamamas right opposite, which served us well on our first night.The only complaint we had during the stay was the room next door which decided to have a party on the Saturday night at 3.00am. However, we phoned downstairs, got an apology and within the next 10 minutes it was all quiet again. In addition, the next morning we got a small box with two free chocolates inside - very nice touch!I would definately stay here again - its close to the tube and the nightlife - all in all a great hotel."
114,827,"Jun 4 2006 	Excellent hotel highly recommended	You know, if you were to hunt back over my previous reviews in TripAdvisor, you'd find that I'm starting to sound like an old grumpy man.Pretty much every review begins with my description of my shoulders slumping and the depressed sigh as soon as I've entered most of the 100-a-night London hotels (excluding breakfast, of course). The feeling of &quot;Is that IT ?!&quot; as soon as you walk in most London hotel rooms is enough to put me off returning to the capital.It's a relief to finally be able to praise a London hotel.The Holiday Inn Camden Town is a stunner. I've stayed here for three weeks (not at weekends), and it just manages to tick all the good boxes. The hotel feels modern, the rooms are spaceous (gasp!), and have lots of mod cons. The curtains are blackout curtains - you can actually sleep beyond sunrise if you want to. The room temperature works well, and is controlled by ONE dial for heating and air conditioning - genius! - I wish all hotel rooms had this. And the lighting in the rooms is very hip and modern. Would sir like background lighting, spotlights, or a subtle lamp ?The bed is really comfy (better than mine at home, damn it!) and the staff are genuinely helpful and friendly. During the first week, I stayed in a room with two double beds (83 per night, inc breakfast), but for the next two weeks, I went for a room with one double bed and desk with leather chair. This is much better for working.Oh, and for once, the hotel *is* close to a tube station, just a 5 minute walk from the Camden Town tube. Commuting into the financial district used to take 25 minutes at rush hour.The restaurant food is good, but it always seems a little empty in there, and there's a Weatherspoons pub next door (if you fancy something cheaper) and loads of really good restaurants between the hotel and tube station. The downside to the hotel: well, the area outside can feel dodgy at times. It is right next to Camden Lock, with the market area right next to you, but you really can't walk far around here without being offered drugs.The soundproofing within the hotel isn't too good (but was mostly peaceful). But my biggest bugbear was with the internet connection. Yes, the rooms have wireless, but 8 pounds for 4 hours use is a ridiculous price to charge.The room charges on the Holiday Inn website seem to vary a lot. Two weeks ago, I was paying 110 per night, then 83 the following two weeks... so shop around.Oh, and at 4 pounds per (small) glass, you would kinda hope that the hotel bar's range of white wines would stretch beyond their one single Chardonnay on offer.All-in-all, this isn't just a good hotel, this is the BEST hotel I've stayed at in London, and the only one I actually enjoy staying at. Highly recommended."
115,827,"May 29 2006	positively surprised	knowing some hotels in london we did not expect too much. But we were positively surprised. The rooms are spacious (for London standards), bathroom clean, everything fine. We did not have breakfast, so I dont know anything about it.The Hotel is located in the middle of Camden, just around the corner are all the little shops of Camden Lock, pubs and restaurants are just a block away (one is opposite the hotel).Short walk (about 5 minutes to the next underground station (Camden Town), Leicester Square Area within 15 minutes by tube. Enjoyed it very much, will stay there probably again next time in London."
116,827,"May 25 2006	Nice Hotel Eclectic Location	The hotel is located right off the main thoroughfare, backing onto the canal. The hotel is very clean, quite modern and the staff are friendly. Our room itself was on the smallish side, but it had nice full size window/door that fully opened. Our room had one queen size bed, but we saw inside other rooms that had two queen size beds. All the amenities were there (ironing board, dryer, TV with a few channels and some crappy old movies on Pay-per-view, coffee machine, cream soap dispenser next to bathroom sink, body gel/soap dispenser in shower). Also, these thin towels that were amazingly absorbent; weird I know, but its one of the things I remember about the room! The place is also in a great location. Camden Town is an eclectic area with lots of small shops, pubs, clubs, restaurants, food stalls. I would say this area is &quot;edgier&quot; than other parts of London we visited with a more punk-ish/alternative style, which was perfect for us. We never felt anything negative in our many forays around Camden Town, including many a late-night walk back to the hotel. Yes, we were offered drugs a few times on the nearby streets, but we are young-ish and dressed in such a way that we presumably fit the demographics though we never felt threatened. And no, we never partook. The hotel is also very close to Camden Town station on the tube which is on the Northern Line. Very easy to get to and from other places in London. For those who know such things, the hotel is just inside Zone 2 for the tube. So for an all day tube pass from the hotel to Zones 2 and 1 (where mostly all the tourist attractions are) is 4.90 (this pass is good on the buses to).One thing to avoid about the hotel is paying the 2.50 for 15 minutes internet charge in their mini business centre. Just go up to Camden Road where there are many internet cafes. These are not easily noticable though. There is one, for example, at the back of Noodle Hut food vendor. Just look for (often handwritten) signs at the entrance to the cheap food vendors. These are often 1 for 2 hours, quite a difference over the Holiday Inn's prices! The hotel does offer in-room wireless internet access, but I have no idea of the charges, if any.Also, Priority Card members get a free newspaper (of your choice) delivered early morning under your door.There is a breakfast buffet which was very good, if a bit pricy. Typical British fry-up fare available (eggs, beans, cumberland sausage, blood sausage, veggies, hash browns) along with more traditional fare (cereals, juices, croissants, cheeses, breads, etc..). Be careful though, this buffet is sometimes included in your hotel charge, but it may not be. We had two different reservations (don't ask) one with the breakfast buffet, one without. The buffet was very good, but see how much it knocks off the price of your hotel room before you decide if its worth it or not. If you don't have the breakfast buffet included, I recommend you go up to the main street (Camden) and just walk. You'll hit a number of small cafs or diners.Couple of decent pubs just up the street, Oxford Arms and Elephant's Head. Standard pubs, but very convenient locations relative to the hotel. Literally a minute away.Despite my minor internet quibble, bottom line, I would recommend this hotel to friends."
117,827,"May 17 2006	Would definately be back	My wife and I stayed here on the Thursday and Friday, May 11 and 12. We had read the reviews and prepared ourselves for quite a threatening area but had no need to worry. Although it is wise to be cautious in any location, the Thursday and Friday late nights were fine and there was a good mix of people on the streets. We were given a room (417) overlooking the lock which we loved as it had two glass door which opened fully to allow us to sit and relax with the view down below.During the day, the markets were very interesting with a wide variety of items for sale. The lock area is excellent and it is very relaxing to spend time around the market buildings, in the outside food areas or indoor cafe.The hotel is modern, clean with staff who were very helpful. The reception manager, Federica, took time to find our Priority Club membership so we could have a late check out and a couple of free bottles of water. It felt as if nothing was too much trouble and we felt very welcome.We will definately be back for the above reasons, but also because it was quick to get to and from the city centre with only a short walk to the underground."
118,827,"May 12 2006	Good Value	Stayed at the Camden In over the weekend of 5,6,7 May 06. The hotel is very new and is right on the canal beside Camden Lock. The hotel staff were friendly and the facilities modern and very new. The room was clean and spacious and offered a room safe, trouser press, ironing board, coffee facilities and pay per view movies. The hotel is very close to several trendy pubs right on the canal.The area of Camden around the hotel is very 'Bohemian' but there is rougher edge to it, and I would not recommend it after dark to families are single travelers unless your are very confident in yourself. I did not see any trouble but witnessed plenty of police cars speeding up the road with blues and twos on and was offered drugs several times whilst waking down the street! (I declined!).Overall the hotel is good the area is funky but a bit risque, and if you can cope with that then go for it!"
119,827,"May 2 2006	Nice Hotel Ignore first impression of area	Nice hotel, if a bit apprehensive when we got off the tube as to what type of area we were in. HOWEVER, I felt totally fine walking through the Market and Lock and Saturday by myself. Take my advice wander round the markets, get some food for one of the stalls and watch the canal boats pass by, you wouldn't think you where in the middle of a city.Hotel itself was fine, nice rooms, even provided me with a toothbrush when I realised I had forgotten mine. Would definately stay again."
120,827,"Apr 23 2006	Excellent - no problems what so ever	Ive stayed in this hotel twice before. It is a fairly modern hotel and the service here is excellent. The executive room is nice and spacious, with bath &amp; shower, king size bed and a balcony over looking the canal. Room service was on time, reasonably priced and of good quality. Some people say that Camden is 'strange' or 'dangerous'. Camden is unique in its own sense, but its fairly safe. If anything, go to the hotel via the main road and not through passed starbucks, weatherspoons and the bridge."
121,827,"Apr 7 2006 	Rotten area.	I stayed here for one night as a retired female travelling alone. It was a mistake. I booked this hotel because I wanted a room with a proper bathroom and air conditioning near to Euston. The bathroom was absolutely lovely and immaculately clean, nice bath, fabulous power shower and good quality fittings but tiny towels. The bed was very comfortable and decent linen. So what was wrong? The room had one small window which barely opened and I had no view, literally a brick wall high enough to block out the sky. This was a real shock. The room was oppressively stuffy and the air conditioning was totally inadequate. I found it to be like a prison cell and couldn't wait to leave the next morning. Worst of all was the area. The hotel is in a side street off the main shopping area right by Camden Lock. It should have been great but the streets were teeming with people who were unfriendly/aggressive and too rough for my liking. I felt at a real disadvantage being on my own and would not have felt safe after dusk. I have to say it would be a brilliant hotel for a group of young people going to a rock concert. Not for me. I am getting old and hard to please maybe but for 95 I might have fared better somewhere further away from Euston station.The staff were pleasant and friendly which was nice but if you are going it alone I would avoid this place and get a recommendation from someone who is more experienced at booking suitable London hotels."
122,827,"Apr 4 2006	Best Location / Best Price / Best Everything....	Such a high standard hotel for such a low fare! And all this in the middle of London, in Camden Town, where it all happens! Clean, high standard rooms ( designer-like ), excellent breakfast, friendly staff, unbeatable location.Don't worry about reviews that say &quot;strange neighbourhood&quot; or so. Camden Town is not dangerous anymore! Quite the contrary - camden town today is one of Londons' hippest neighborhood with the best stores, food and markets. Check it out - you won't be disappointed!"
123,827,"Apr 2 2006 	Nice! Good location. Comfortable hotel.	I stayed here just for one night but there really was nothing to fault other than the breakfast, which there wasn't enough hot vegetarian foods. But other than that it was great.Good location, I went with my work place who were organising a team building event. The location was great, 5 minutes from the nearest tube station. Interesting people in the area! The hotel room was superb, nothing wrong with it at all, it was very comfortable and spacious. See pictures. Staff from my experience were all fine too. Would reccommend it to most."
124,827,"Feb 6 2006	Fantastic	This was one of the best hotels I have ever stayed in, we had room 220 overlooking the lock and the market, and it was surprisingly quiet at night - no problems with getting to sleep. The breakfast at this hotel was the best I have ever had, fantastic buffet with just about everything you can think of on it! We paid only 70 for a queen sized room including breakfast by booking direct on the Holiday Inn website - such fab value for money!"
125,827,"Jan 23 2006	Great Hotel - Veeerrry Interesting town - and people!!	After reading some reviews we spent only 1 night at Holiday Inn Camden Lock, to our great disappointment. Originally booked for 2 nights then changed to another hotel for the 2nd night - big mistake!! The Hotel was very modern, clean , bright and comfortable. The room was very comfortable and spacious, with two big double beds, excellent air conditioning system. The mini bar was quite pricey, though we didn't use it as we took our own minitures! Staff were very kind and helpful with any queries we had. Breakfast was included (good deal from Holiday Inn website 85,) and was very good, with a good selection, clean lovely bright dining room, but on reflection we wish we hadn't eaten, as there was so much variety on offer at the market just outside the hotel. The hotel itself is in an excellent location, right on the lock (we are big fans of canals and barges! - no we are not THAT old!) Only downside - no car park facility - nearest one is Pratt Street, but very reasonable at 12.50 per 24hrs, 10 weekends, but hey - this IS London. We got on the 88 bus to Trafalgar Square, and realised it wasnt too far away for all the regular tourist attractions, and for only 1.50 single, but a day ticket is very good value too.To say the Camden markets and the people were interesting is an understatement. We picked up some great bargains, lots of original itmes, and had a real laugh with some of the characters on the stalls. We also met up with the resident town crier around the Lock market, who was a bundle of fun too!!There is a pub on almost every street corner, and plenty of good bars and restaurants. Try the Tapas bar round the corner on Inverness street 'Barganza' for great tasting, great value food, and plenty of it.Yes, there were some dodgy looking characters at night, (same as most towns) but we didn't feel threatened or vulnerable in anyway, just smiled politely and went on our way, and they did the same.The high street and the markets are just so full of life and vibrancy, friendly people, Punks, Goths, Mocha's galore, but all the more interesting for that, it was hard to leave. We will definitely be back, with our 2 teenage kids, and sooner rather than later!"
126,827,"Jan 23 2006	Fantastic Hotel Will Use Again and Again	I brought my boyfriend a weekend stay in Camden for his Christmas present as he hadn't been to London before. I didn't know what to expect with the hotel as i have never stayed here however this hotel was one of the parts that made our weekend perfect. We turned up 2.5 hours earlier than the arrival time and they let us have our room straight away, the hotel was extremely easy to find and i would say you couldn't find a hotel in such a perfect location for Camden. Its very clean and the staff are always there to help. Our room was an exectutive room and i would say they are well worth the money the views along the locks are great, You don't get any problems with the noise coming from the markets and the bars either. Our train wasn't until the night time and the hotel porter came an collected our luggage and put them in a safe room for us to come back and collect later. The only problem we encountered was that we wasn't staying long enough and we didn't want to leave...."
127,827,"Jan 19 2006	Good value	Great location for the price if you don't mind not being slap bang in the centre of town which is only a very short tube or cab ride away. Tube station is a one block away and there are plenty of cafes, restaurants and bars within a few blocks. Our room was spacious, modern and very clean. Front desk staff are friendly but slow and somewhat bewildered."
128,827,"Oct 24 2005	A real find in London	Myself and partner were attending a concert in the Jazz Cafe so we found this hotel to be quite near the venue.Camden is a funky, trendy, hip and happening part of London which means there are plenty of bars and clubs nearby and a few 'characters' out and about which, in my view, adds to the ambiance!The Holiday Inn Camden Lock is right on the canal edge beside the famous Camden Lock footbridge and the many markets and shops. The bar next door to the hotel doesn't allow outside drinking after 9:30pm so noise shouldn't really be a problem.We did hear some revellers late on but nothing too bad.I found the check-in to be swift and courteous, our room and bathroom was immaculate and functional. A nice juliet style balcony enables you to open glass doors onto the canal side. The bar area is friendly and not too expensive with a plasma TV and internet room off to the side.The hotel is about a 10 minute stroll from Camden Town tube station and is therefore very easy to find.I wouldn't hesitate to stay here again in the future. In fact the location is great for seeing some of the real London yet only a 10min tube ride from the tourist sites and much more expensive bars/resteraunts in the West end.Well recommended!"
129,827,"Sep 13 2005	Good hotel interesting neighborhood	I stayed in this hotel for 6 days in August. It's located in Camden Town, in northern London. The tube station is right around the corner on the Northern Line, so it's easily accessible. When we got out of the station to walk to the hotel, we were amused by the crowded, punk neighborhood. It's like St. Mark's Place in Manhattan, only more. The hotel itself is quite comfortable: the room was a fine size, clean and cozy. I slept well each night, but as a New Yorker, it might have been noisy at night but I wouldn't know. For some reason there are only about 4 tv channels, and lots of pay channels. So don't go for the television viewing. They had a large breakfast buffet of average quality (which was devoured for an hour every morning by my German travelling companions) with good service. We had dinner in the area one night, and realized that everyone in the restaurant was younger and louder than we were. Didn't go back, opting instead for travelling on the tube to more central neighborhoods in search of quieter dining. All in all, I think it was a good value, you just have to decide if you mind the young, loud area. The hotel is perfectly comfortable."
130,827,"Sep 4 2005	OK Hotel Dodgy Area	Stayed here for a Saturday night whilst in London. Hotel was OK, but nothing special.However, would agree with other reviews that the area seems a bit dodgy. Walked down Camden High Street about 8pm and there seemed to be quite a few dodgy looking characters hanging around (drugs dealers ?) which made us feel a bit apprehensive. Bizarrely, when we walked back around midnight, they'd all disappeared and it seemed a lot safer.All in all, would only stay here again if I needed to be in Camden."
131,827,Jul 31 2005 	Nice hotel Not so nice neighbourhoud	In the month april I have stayed in the Holiday Inn Camden Lock. The room is clean and it's size was comfortable. The staff was very friendly. The only major drawback is the location of the hotel. The hotel is located in the Camden Lock area. During the night you can feel quite uncomfortable when walking on the streets in this area. So i wouldn't recommend this hotel to parents with kids. But if you aren't scared easily and likes to stay in an alternative neighbourhood this hotel offers a good value for you money ( Paid around 85 a night)
