IDREVIEW,HOTELID,REVIEW
116,679,"Aug 29 2007	Excellent room location and service - Even for lowly hotwire guests	We stayed for a week at the Crowne Plaza in August. Got an amazing deal on Hotwire so the place was dirt cheap.Service: All of the service was superb. We used the concierge quite extensively for bookings and information and they provided us with great service. They made several restaurant recs and had no problem recommending places off the beaten path if we asked. Every time I entered the hotel, I got a hello Mr. X from the staff. The cleaning staff was wonderful as well. Our room was tip top shape always.Room: Room was large, especially by London standards. We had a standard room on the first floor. No outside noise could be heard in the room. Room had a gorgeous marble bathroom. While a little small it was very stylish with the marble and had a nice shower with good water pressure. Room also had a safe, hair dryer, etc. - all the things you expect in a luxury hotel. Bed was comfortable. Nice bonus: Free bottles of water in the roomLocation: I believe it is a great location for a tourist. I always stay in the city. 15 minutes your in Covent Garden, the Tate, Southwark (markets), St Pauls. 10 min in the tube and your at the Tower of London. 15 min tube your at the British Library, British Museum, etc. And there are buses from Picadilly back to the hotel.Negatives: Internet is pricey. Carry your laptop to the lobby and connect to the City of London Wireless for a 10th of the price."
117,679,"Aug 20 2007 	OK- Not the best Crowne Plaza I have stayed in	I am a reasonably regular traveller and have stayed in Marriotts or holiday inn / crowne plaza where possible. I booked this for a trip to celebrate my wifes 30th birthday as I felt that the Crowne Plaza would be a pleasant experience for a weeked.Generally there were no major issues with the hotel. Check in was fast, efficient and friendly and they remained so thorughout the stay. Small gripe about the room, 305 was that hte carpet was lifted in ridges in spots in the room and generally looked worn giving a poor appearance to the room. Bed was excellent and comfortable. Room was quiet which is something htat I always look for.On the negative side food and drink is priced at company expenses level. I bought a Bombay Sapphire with Tonic and a pint of Guinness on the first night for 12. Poor show as they got no more business from me for the remaining two days. But then they are not aiming the prices at leisure guests.Hotel is a little out of hte way for leisure but London is well serviced by the tube so it really makes little difference."
118,679,"Aug 14 2007 	Alright for a short stay	We stayed at the Crowne Plaza City Hotel for two nights in early August. Overall the hotel is a decent three star facility conveniently located next to the Blackfriars tube stop on the District line. We took the recommendation from another tripadvisor reviewer and took the Piccadilly line from London Heathrow and changed at South Kensington to the District line. The overall travel time was a little over an hour including the purchase of the oyster cards. On reaching the Blackfriars tube station come out exit 8 which will put you right in front of the hotel.Our room was on the 5th floor and had two double beds. The room was a decent size and considerably clean. The toilet was another story, although it looked very clean on first glance but when we checked the toilet bowl it had remnants of poop stuck to the wall, it had obviously not been cleaned after checkout. Look at the attached picture. There was a lady from housekeeping on our floor that very time working in another room so I grabbed her quickly. She apologized a lot and cleaned it right away. After seeing this I didnt have a warm feeling about the other things even though they looked clean. When you pay $400/night your minimum expectation is that it should be at least clean.The first day we called housekeeping to get an extra pillow and it was brought in 5 minutes. The second day after the room was cleaned the pillow was still there but without a cover, so called again, this time to get a cover. It was brought in 5 minutes.We never ate breakfast at the hotel, plenty of choices around like Costa Coffee, Pret A Manger and others for getting breakfast and lunch sandwiches. There was also a restaurant nearby serving English breakfast for 6.50. London is expensive so be prepared to pay big money for everything if traveling from US.At night the area gets very quite as its in a business location but we liked it this way. There are no restaurants nearby for dinner or at least we could not find any.Overall it was a pleasant two days and if I overlook the toilet situation then I might stay here again."
119,679,"Jul 26 2007 	Super hotel	My wife and I stayed at this hotel for two nights for a weekend break in June. I am pleased to report that at last I have found a Five Star hotel that actually felt like a Five Star hotel, even in a standard room! Check in was fairly prompt and efficient. The porter who took us to our room was really first class and remained so throughout our stay. We could not really find fault with the room at all, it was spacious and very well fitted out in all respects. There was a very minor glitch with a bathroom accessory, but this was sorted out promptly. For breakfast, an additional self service point was created at the far end of the restaurant, the heating arrangements meant that the food could have been hotter; however, the food was of good quality and quantity. There was some confusion amongst the staff as to whether coffee/tea pots would be left on the table or whether they would provide top ups, fortunately the former was the case which was good as the service was not that quick. We completed a Customer Feedback Form highlighting the minor shortcomings we found and got a virtually instant e-mail response back which was very good. We didnt use the bar or restaurant in the evening (as you would expect from such a hotel, the prices were pretty high). The hotel is well located near Charing Cross mail line and tube stations and only 5 minutes walk from the river. We thoroughly enjoyed our stay at the Crowne Plaza and would definitely come again."
120,679,"Jul 25 2007 	Good 5 stars hotel in center	Very good location few meters from Tamiza River, St. Paul Cathedral and Paternoster Square (London Stock Excange).Nice rooms - I stayed on Club Level, so all needed amenities in my room were available. Very comfortable and big bed (single room). Also DVD player, hi fi system and of course internet in the room."
121,679,"Jul 15 2007 	Nice hotel with great location	I am a Priority Club Gold member and my wife and I decided to stay here for 2 nights on points (July 4 - 6). Needless to say, it was well worth it. We reserved a king size bed and it was nice and cozy. Upon check-in and each morning, a complimentary bottle of mineral and carbonated water is left in the room - we thought that was a nice touch.I've been told that hotel rooms in London are typically on the smaller side, but this room was spacious enough for us. The concierge will typically recommend the breakfast in the hotel, but we opted out as the prices were astronomical. There are a couple of restaurants just down the street from the hotel that serve a hearty breakfast and are very much more reasonably priced (as you would expect eating breakfast at a restaurant in the US). I would recommend &quot;The Ludgate Cafe&quot; - nice portions and very decent priced. When exiting the hotel from the 2nd floor entrance, turn left and walk a couple of blocks. It will be on your left hand side. I ordered the &quot;Full English breakfast&quot; and it kept me full until well after lunch time.My only negative experience with the hotel (if anything) was that we never received our wake-up call, but luckily we had set it on my wife's cell phone just in case. I don't think this is the norm so i would chalk it up to being a fluke occurrence. One thing we noticed too was that there was only one available and accessible outlet to plug your electronic items into. This didn't really affect us, but we did find it a bit odd.The location of this hotel is fantastic! The hotel is literally like a few feet from the &quot;Blackfriars&quot; tube station. A hint - when exiting the &quot;Blackfriars&quot; tube stop, follow signs for Exit # 8. Exit 8 is on the same side as of the hotel and only about 50 feet away; otherwise if you follow any other exit, you will need to cross a pretty busy street to get to the hotel. All the major sites are practically 2-4 tube stations away. It was very convenient! I would highly recommend purchasing the day passes (even cheaper if you begin your day after 9:30am - considered an &quot;Off peak&quot; day pass). The day pass costs something to the like of 5-6 pounds. The tube is the best form of public transportation I've ever experienced - better than NYC.The staff is also very friendly and seemed to be fluent in several languages, and the room was very quiet. Even though it faced what seemed to be a major street, we heard nothing! And for those that crave that cup of coffee, there's a Costa Coffee shop nearly just beside the hotel and a Starbucks accross the street."
122,679,"Jul 12 2007 	More for business but good for tourists	Four of us, two adults and two teenage children stayed in a room with two double beds. The room was clean. The beds were not as comfortable as we had hoped. I should note we are used to a queen size bed. These were double beds.The staff was friendly and courteous. However, one gave us an incorrect bus number that led us to a part of London most tourists do not see. Once we picked up our London Passes, along with our transportation tickets, we had no trouble getting around. There is an underground station in close proximity to the hotel. St. Paul's Cathedral is within walking distance.The fellow who brought our bags to the room showed us things in a small refrigerator and explained we would be billed for them as soon as we removed them. This did not surprise us. He did not mention a charge for items out in the open. We were surprised when were billed for items we thought were complimentary. The small bag of potato chips below the TV was 2.50 in Pounds Sterling. That's $5.00 US. Don't eat or drink anything unless you are prepared to pay premium prices.Overall, we enjoyed our stay, though the hotel seemed more for business travelers than tourists."
123,679,Jun 3 2007 	Great Hotel Good Location	Nice hotel with clean spacious rooms that I was able to book on Hotwire for a very good price (especially for London). Location was good for getting places during the day with a Metro station across the street. Staff was extremely helpful and friendly in situating us in our rooms for an early check-in. The one potential negative for some travellers is that the hotel is located in the business district of London which on the evenings (and weekends) is pretty much deserted.
124,679,"May 11 2007 	Friendly Staff at Great Rate	Based upon user reviews, we booked this hotel using BA Holidays at 197 USD per night for 2 nights. We were very pleased with the hotel and breakfast buffet. The staff were extremely friendly and accommodating. Although the Business Center was closed for the weekend, the concierge printed our boarding passes for us. It was a superior deal for the rate &amp; would definitely stay again."
125,679,"Apr 29 2007 	too expensive	i stayed at a corporate rate of 230 GBP- by no means a bargain in my book. I chose this location because i had a meeting next door the next day. the hotel is conveniently close to the tube but not in a great location for sightseeing. I used the little gym- which was OK. However, i find it really penny-pinching that one has to pay 15 GBP for in room internet usage- at this price this should be included. Otherwise it was a very anonymous,but efficient experience. would not stay here for pleasure."
126,679,"Apr 16 2007	Service with a personal touch	Service, service, service. Just spent the weekend at this marvelous hotel and it was great. I informed the staff by email that my wife was having her birthday and they got her a card signed by all the staff. We also got a free upgrade. The room was nice and spacious enough to have a sofa, desk and double bed in it. Bathroom was great as well and had a heated mirror.The location was also great right next to Saint Paul's and the Tate Modern bridge with good links to the underground. The only things I would have them improve on was the cooked breakfast (tomatoes &amp; mushrooms) tasted a bit funny and the potatoes were undercooked. The rest was delicious though. The view from the bedroom was also dissapointing as we looked over a massive air vent (still the upgrade outweighed this). Overall I would highly recommend this hotel simply for the amazing staff. Paid 50 pounds for the night with breakfast included."
127,679,"Apr 15 2007 	Fine apart from getting locked in the bathroom	Stayed for 2 nights with kids. Generally fine, and weekend price is reasonable. But there were faults with the room. Within minutes of arriving I was locked in the bathroom due to a broken latch, and although a nice engineer appeared within minutes of my husband calling reception it took him (and his crowbar) a while to get me out. A lamp in the bedroom was also not working, so I'm not sure how well things are checked/maintained.I'd have let them off the bathroom-lock incident if they'd apologised a bit more! But apart from the nice engineer chap I didn't get any apology. I tried emailing the hotel after we got back, but no reply. Maybe its just communications problems, but for an expensive hotel I would expect a bit more.Didn't try the breakfast as it wasnt included in rate, and places to eat for 1/4 the price nearby. The Italian restaurant was nice, though didn't include many kiddy-friendly dishes. Good location, and suitable rooms for families so probably still worth considering."
128,679,"Apr 15 2007 	Fantastic- five star service	This rates as one of the best hotels I have ever stayed in- the staff were extremely attentive and the rooms had so many fantastic little details that other hotels skip upon. The Breakfasts were fantastic, with a fantastic range of choice and no-one ever had to wait on the buffet being restocked. The location was superb offering a fantastic walk along the Thames to all central amenities such as the London Eye and Westminster and in the other direction St Pauls Cathedral, The Globe and The Tate Modern. The rooms were superb- extremely clean (and I am extremely fussy)- there was so much attention to the decor- sculptures in room, fantastic luxury toiletaries, complimentary tea/coffee tray with little extras, fantastic television and comfort, well sound proofed from both noises outside and inside. The bar was extremely modern and ideal for a queit drink. The lobby and lobby staff were exceptional. I tend to like to visit different hotels each time I go to same place- but this will be my primary choice when in London from now on."
129,679,"Apr 10 2007 	Theatre Break Weekend	The first piece of advise we would give anybody would be to research your HOTEL on trip adviser, we did and the Crowne Plaza was everything that we had expected.The Hotel has a quiet but very good location, conveniently placed opposite the Blackfriars underground station.The Thames is but a short walk from the hotel and has a lovely walk along the embankment.The hotel itself was immaculately clean, staff very friendly and helpful. You will not be disappointed at this hotel.Must see: Billy Elliot (Musical) at the Victoria Palace....brill."
130,679,"Apr 10 2007 	great location	Stayed in this hotel with my family including 2 children. The hotel website would not let me book a family room so i had to telephone their booking centre. They were very helpful and rang the hotel to confirm. We had a king studio room which had a king size bed, sofa bed, nice chairs and very modern. Nice bathroom all marble and molton brown toiletries. These did not get replaced during our 2 night stay. I thought this was a bit on the tight side and when i asked if i could have another shower gel for my family of 4 as one does not last 2 nights, they gave me a cheap alternative. I thought for the price of the room they would not be so mean over a bottle shower gel that was included in the price of the room. If a customer is used to luxury products they do not want to be fobbed off with a nasty alternative.It did cost 231 per night though. This is a bit pricey. However, we had access to the Club lounge and included free drinks and canapes. No free internet though as in the club lounge they had old computer and charged 5 per hour of internet. A bit cheeky considering that they charge so much for the rooms.We had breakfast at the hotel as again this was included in our rate. Normally it is a continental buffet breakfast in the club lounge. However, it was a weekend so served in the normal restaurant and included a hot buffet. It was not the quality i would personally expect of a hotel of this quality. We were shown to the table but not offered tea and coffee as a normal first. We had to wave the waiter over for this. I thought this was bad as other hotel restaurants offer this first. The food was in troughs and obviously mass prepared. No how do you want your eggs cooked here. There is a starbucks across the road but this closes of a weekend as did lots of the other food shops nearby. It was deserted. I would of course say this is a plus if you want a quiet relaxing break.The location of this hotel is good - walking distance to the river, tate modern, st pauls cathedral. If you get the tube use exit 8 at blackfriars and the hotel is a stones throw away. If you want somewhere nice to eat walk over blackfriars bridge and turn left and there are some lovely bars and restaurants. There is also a pizza express and cafe rouge and simply m&amp;s at st pauls and a few other eating places.The hotel reception was very plush, the staff very helpful and quick to maintain an excellent customer service. We discovered that we had no bedding in the room for the childrens sofa bed. We rang reception it was 10pm and they were very apologetic, returned our call to find out exactly what we needed and within 5 mins we had the bedding. Very good i thought."
131,679,"Apr 9 2007 	A Very Good Stay	Stayed here for 2 nights over the Easter Weekend. Booked a King Studio and was upgraded to a One Bedroom Suite. The room was relatively small for a suite and did not have a separate shower but we were very pleased overall.The room has a dvd player, a cd player and an i-pod player. The room was extremely clean and housekeeping offered a turndown service both nightsThe hotel itself was farily quiet as it is mainly a business hotel and this being Easter, the City of London was deserted. However, the tube station is right outside and the west end is 10 mins away.I would definitely return at the right price."
132,679,"Mar 21 2007 	Beat My expectations - Loved this Hotel	Stayed here with my wife and 2 small kids (5 &amp; 3). Was very nervous at first, because it had mixed reviews, but overall, had a great time!We stayed for only one night, but the room was spacious and very clean. It was very convenient to the Underground (literally right outside the door), which made sightseeing simple. The staff was very friendly and helpful, concierge helped me several times with taxi service, and other miscellaneous items. My family and I would definately stay here again."
133,679,"Mar 8 2007 	Excellent Experience	Stayed here on 1 March using points. Welcomed back from friendly receptionist. Hotel had allocated a double room on the club floor, requested a twin and was upgraded to a junior suite, including breakfast and entry to club (complimentary snacks and drinks). The bar was friendly and lively. Breakfast was very good.Overall excellent quality and service will definitely return."
134,679,"Mar 6 2007	Classy Hotel	I cashed in a few thousand Priority Club points for a 2-night weekend stay here with my girlfriend. Check in was efficient and Silvia upgraded me to a Club Room (6th floor) and told me that breakfast was included. The room was spacious and clean, but the old-style non-widescreen CRT TV seems a little out of place these days. There was also a radio and DVD player. The bed was very comfortable, and the hotel was nice and quiet - no issues with banging doors etc.The Club Lounge was small but pleasant, with free drinks.Breakfast was a reasonable buffet, but surprisingly less of a selection than some Holiday Inn's I have stayed at.This hotel oozes quiet and efficient professionalism - the staff are all excellent. Although a little out of the centre, this hotel is ideal for a quiet but very comfortable weekend break."
135,679,"Feb 20 2007 	Not bad at all	Stayed at the Crowne Plaza in order to visit TheatreLandThe CP is a nicely located hotel on the banks of the Thames and extremely close to Blackfriars tube station.On entering the hotel, you are greeted with a very nicely decorated foyer. The reception staff were both efficient and friendly (Erika is a credit to the hotel) although it was not particularly busy when I arrived.We were given a room on the third floor. The room itself was spotlessly clean and had all the basic amenities you would expect in a London hotel. It was fairly small but well decorated and it was extremely quiet - this may have been because it was 'the city' at the weekend but nonetheless it was very welcome.The only downsides with the room were that the bed was TINY. It was a double bed but so small and very uncomfortably which meant neither myself or my wife got much sleep. Also the bath was tiny as well (i struggled to fit in it) and the hot water was lukewarm at best.I didnt explore the bar / restaurant so cant comment on these.All in all it was an ok stay. I paid 80 for the night which in London is pretty good so I dont have much to complain about. I guess you could say this hotel was average."
136,679,"Feb 11 2007 	Truly excellent	This was my first time staying in the Crowne Plaza London City. Given that there was quite a lot of snow that morning ( February 8th February ) I was delighted to find the hotel directly opposite Blackfriars station.Despite the early hour, there was no quibble about checking in and having a coffee in the Club Lounge whilst rooms were being prepared. However, there was a heart stopping moment when there was a query about my reservation, and there didn't appear to be any room at the inn!!A very helpful manager (Kati) sorted the matter, which was down to no more than human error. She very kindly upgraded me to a studio room and offered a complimentary lunch. It is so rare to find this sort of attitude in a large hotel chain, and it did wonders in restoring my spirits.The Studio room has a dining table, desk and sofa bed, as well as a very comfortable king bed. The bathroom was nicely finished with and came with Molton Brown toiletries.As well as the usual tea facility, there was a coffee maker (no instant here!) with biscuits, and complimentary wine and nuts.The room was very bright and was supremely comfortable, so much so that I was reluctant to leave for my appointment in Westminster that evening.The Club Lounge is small but very cosy, and has complimentart internet access &amp; printing. I was pleasantly surprised to fine evening canapes still available on my return at 9.30pm. Just what was needed after being out in the cold!I would definitely stay in the Crowne Plaza London City again, and have no hesitation in recommending it to anyone."
137,679,"Feb 7 2007	It's fine. Not great just fine	Stayed at this hotel for just a quick Saturday night and found it OK, but not particularly great.The good news is that its location, just across the river from the Oxo Tower, is great; and the rooms - while not large - are still a good size and easily large enough to contain two double beds.Admittedly, we were in a standard room and we were there at the weekend (which is a very quiet time in The City) but when you arrive there in the evening and find the bar closed at just after 10pm and replaced by a one-man drinks service in reception - which meant it took over 15 minutes to take our order, despite the fact we were the only ones there - it doesn't bode well.The room-service menu was 24x7 and the mini-bar, while exhorbitantly priced (but isn't that standard) was well packed. All in all, room clean, beds quite comfortable and bathroom contained 3 Milton Brown extras that were welcome.One word of warning - at the front of the hotel there's massive building work going on (see the attached photo). Fortunately at the weekend there was no noise at all, but it could be something to bear in mind if you're going to be there mid-week and need your sleep. Make sure you ask for a room towards the back!Overall, I wasn't too impressed and for roughly the same price (particularly discounted off Priceline) I'd recommend the Victoria Park Plaza far more strongly."
138,679,"Jan 31 2007 	Perfect hotel on a perfect city	We're from Brazil and booked this hotel from British Airways Holidays for the New Years Holidays. Since our check-in, our experience was really great. Perfect !!! They provide us an early check-in. The bell cap, Karol, was so kind and helpful with us. The room was in perfect condition. Very clean atmosphere, with new furnitures and modern amenities. Perfect beds, excellent breakfast, very close to Blackfriars Tube Station. It was a perfect hotel for this perfect city !!!"
