IDREVIEW,HOTELID,REVIEW
174,303,"Jul 22 2009 	AWESOME ROOM - BRING LOTS OF MONEY FOR FOOD!!!	My husband, daughter (12 yrs. old) and I arrived at McCarran from Newark around 11:30 am - bumpy flight. We were picked up by Presidential Limo (stretch). Very nice! Stopped at liquor store on way for supplies.Room: 5 Nights Comped at Forum Tower Deluxe (thanks to my Atlantic City Harrah's Play).Upon arrival at Caesar's, there had to be about 50 people in the check-in line....so the wait began. Finally, I &quot;tipped&quot; the check-in clerk $25 to get an upgrade from our Forum Tower Deluxe room to an Augustus Tower Deluxe Room (we had a great view of the Bellagio Fountains! Room 3782).We had a refrigerator brought up (free of charge) and unpacked. Walked around hotel a bit....ate some lunch at Augustus Cafe and had a very nice lunch (expensive, though).Gambling Highlights: Played mostly 3-card poker, VP, and Blackjack. Went up and down on the table games, although I did get three &quot;6's&quot; - the sign of the beast, which paid 30 to 1 on my $25 bet. Not too bad, but I ended up giving it back eventually. VP machines at Caesars were scarce, so I played at the VP Bar by the Sportsbook. They sure know how to pour drinks over there....I don't remember getting back to the room that night....and YES I LOST AGAIN!I did have fun and met some nice people. My husband played in a few poker tourneys, didn't win either. We have a curse with Harrah's properties, as we never win at any of them (even in Atlantic City). We are good with Boyd/MGM though. Went to Bellagio and won $250 within 5 minutes on a $.25 slot! Go figure!Food: Went to Bellagio Buffet. Had to have the giant Alaskan King Crab Legs and the Prime Rib. Excellent! We all got our money's worth that night for sure!Caesar's Food Court: Beware! Food isn't bad, but God forbid you want a slice of pepperoni pizza, you'll pay $6.50 for it! Or how about $4 for one bagel?Rao's: Inside Caesar's. Very nice meal - excellent food. It should be for $160.00 (without liquor)!Otherwise, ate at Caesar's Cafe Lago Buffet for breakfast only. I heard it sucked and it sure did. Awful - stay away. The eggs were runny, no selection, too expensive, etc.Mostly went to the Payard Pattisere coffee shop for breakfast sandwich/coffee. Ate at BLT Burger at Mirage one night - very good food and reasonably priced!Went to Joe's Prime Steak and Stone Crab on our last night (Fri.) for our 15th anniversary. Excellent steak and crab! Yes, you sure do pay for it, but the food/service is excellent. I think I saw a few celebrities there as well!POOL: The pool at Caesar's is still under construction. You don't hear the noise too much, as they play loud music. 2 main pools are open, but we pretty much stayed by the round main one. No, there was no styrofoam or dust or dirt from the construction in the pool at all. Get there before 9:00 for decent seats. It opens at 8:00 a.m.Tip: Don't order a beer at the pool - it's $8 for one, or $18 for a frozen drink. Ouch! We learned early and brought water most of the time.Fun: I had to take my daughter to the NY/NY Rollercoaster or I would never hear the end of it. $28 later, we rode it (I shut my eyes the whole time - I don't like heights!). We went to their arcade, Rainforest Cafe for lunch at MGM Grand.I took my daughter across street to Flamingo Wildlife Habitat - Nice birds, turtles, Koi fish! Went shopping.Went to the Dirk Arthur Extreme Magic Show at Tropicana - very nice magic show with Lions. Good value at $30, as well! QUA SPA: I had my husband booked for a massage for his early birthday present. They run a $99 special Sun - Wed. with full use of the spa/gym all day and a massage. He enjoyed it up until the end when he slipped and fell in the steam room. He hurt his back. They did fill out accident report, but that's about it. No follow up calls to see how he was doing or anything. I did enjoy the spa baths and steamrooms (especially the artic ice room), however.Thus, with my husband layed up with a hurt back, we couldn't go see Love as we had wanted to. Next time for sure. He's feeling much better now!So, that pretty much sums it up! Much drinking, gambling with little wins, a couple of nice restaurants, alot of pool time, and the token arcade/magic show for the little one. We all had a good time and Caesar's took an extra $150 off the final bill in comps~!"
175,303,"Jul 22 2009 	STILL AMAZING	Its location still makes this the best hotel in vegas.And dont be put off by the renovations ,this is still the BEST pool in VEGAS."
176,303,"Jul 22 2009 	Stay only for the location	Caesar's is an ok place to stay, but I certainly wasn't blown away by anything there. I've had better service other places. We were given an upgraded room, but had to switch rooms and were downgraded again. We were there for a conference and I think its hard to go to Vegas for a conference, because you have to be up at 6 am to attend. We ended up having to switch rooms because we were on a nonsmoking floor and there was a HUGE party of young men in the room across the hallway smoking like chimney's in their room and Security wouldn't do anything about it. They were also in and out ALLLLL NIGHT LONG. Which is to be expected in Vegas so we couldn't really hold it against them for having a good time. But, we could not sleep with the smoke and noise and had to ask to be moved. EVERYTHING is a ripoff at Caesar's. If you stay, make sure you have deep pockets. I need not bore you with the details. Rooms were VERY CLEAN. We stayed in the forum tower. Housekeeping was good/friendly. The elevators are nice and quick...never had to wait. The location is one of the best on the strip, but I think I would try another hotel in the same area next time. I don't think it is worth the price because who wants to be in their room in vegas anyway?Pool construction is still going on, but there are a couple of pools open."
177,303,Jul 21 2009 	great place	Fantastic hotel. Brilliant location for exploring the strip. So many amenities with great shopping and eating at the Forum Shops.
178,303,Jul 20 2009 	Fantastic Visit	We always stay across the street at Harrah's and thought we'd try Caesar's this time. I was comped 3 nights stay and given a room in Classic Tower. After reading poor reviews on the Classic rooms I asked for an upgrade. We were given a beautiful room on the 68th (of 69 ) floor with a strip view. We had a few meals at the Cafe Lafo Buffet; not too many choices for the price. Overall great trip! Treated very well.
179,303,"Jul 18 2009 	Nothing Special!	Stayed at Caesar's Palace for three nights. The only reason I stayed at Caesar's was because we got a fantastic deal. Enjoyed my stay, however I would likely not stay here again unless it was super cheap. Here are the pros &amp; cons in my opinion:Pros:- Spacious Room- Jacuzzi Tub in Room- Clean- Overall, great customer service.- Toileteries replaced everydayCons:- Long line-ups upon check-in- Pool under construction, you can't relax by the poolside due to the jackhammers!- Takes forever to exit the casino/hotel because the towers are far away from the entrance/exit- No mini bar/fridge in room- Late checkout only 1 hour later- Noisy AC unitOverall, I enjoyed my stay. It served it's purpose to sleep and shower while we were in Vegas. However, I prefer smaller sized hotel where you don't need to walk 10 mins just to get outside."
180,303,"Jul 16 2009 	Relaxation Heaven	I have been coming to Vegas several times a year for over eight years and I stayed at Caesar's for the first time on this trip. I was able to register early and after I asked the desk clerk upgraded me to a beautiful room in the Augustus Tower with a view of the Bellagio Fountains. If you can manage a room in this fairly new tower DO IT. The jetted tub was sensational, the bed heavenly and room service was prompt and pretty reasonable. There is a 5.00 service fee and an automatic 18% gratuity so it may not be for everyone, but I was traveling alone and so it was fine. The Cafe Lago breakfast buffet is good but limited. The coffee was great though. The best part of the whole trip was Qua Baths. There is a 45.00 entry fee per day, but it entitles you to the use of the workout facility and the incredible spa for the whole day. If you use a spa service (Salon services like pedicures do not count) use of the facilities is included. I had a massage - ask for Kira M., she was really terrific. All in all it was a wonderful visit and I will be making Caesars Palace my new destination in Vegas."
181,303,"Jul 15 2009 	All hail Caesar!	Our experience at Caesars Palace probably made this the best Vegas Vacation we have taken.Location  Best location on the strip, about midway up. Next to Bellagio, across the street from the Flamingo, which means the Venetian or MGM is only a 10 minute walk away. Even if you dont like the casino at Caesars, you are very close to a range of others. And if shows are your thing, there is a half price tix booth right across the street at Bills. Check-in  We checked in at 1:15am (thanks crazy reduced airline schedules!), but this seemed to work to our advantage; the line was non-existent (just one person in front of us), and we got a free upgrade! The staff member was on the computer for 5 minutes or so with the occasional apology for the delay, but then declared that the rooms werent coming up so he upgraded us! We booked the Classic Room, but got an Augustus Tower room (needless to say, this review might have been different if we had got the room we paid for!). Staff member at reception was very polite and helpful despite the late hour. Worth noting that when we passed reception at other times, lines were huge, so if you are arriving at an earlier hour, bring a book. Room  Augustus Tower Rooms are marvelous! The dcor is modern, with just enough hints of the Roman theme to fit without being tacky. The view was of the strip and the mountains, if you looked to the side of the window  otherwise straight ahead was just the roofs of the casino buildings (they should really think about putting solar panels on them  such a waste of space!). The bed was very comfortable, room was clean. Nice sofa and armchairs, so when relaxing one doesnt have to sit on the bed like a teenager in his room. Closet had a safe, robes and slippers. The bathroom had twin sinks (always a wife-pleaser), a separate small room for the toilet, a TV and separate bath and shower, with the bath being a whirlpool bath! After reading reviews on this site I didnt even touch the mini-bar fridge for fear of false billing. TV had a nice selection of channels, and was a new LCD. Restaurants  Every time we went past most of the restaurants, there was a line, so we ate elsewhere. Amenities  Casino is a nice size, but didnt have a lot of Video Poker (our game of choice) so we ended up not gambling here at all. Have gambled here in the past, but there is just something that doesnt make it appealing. Didnt use the pools, so no comment on them. We did however use the Qua Spa, and I have to say it is phenomenal! You can use the gym for $25, or the whole facility for $45  I recommend the $45 day pass! I was shown the facilities and given a locker, as well as robe and slippers, then set off for the gym. The gym is very well equipped and compares favorably to some private gyms, let alone the usual sad excuse for a hotel gym. Post workout, your options are incredible  plan to spend a whole afternoon here! Sauna, steam room (so steamy I couldnt see anything beyond 2 feet), steam room with eucalyptus, and a cold room, with moisturizing snow! There is a hot tub, as well as roman mineral baths, of different temperatures. Showers have body wash, shampoo and conditioner in them as standard. Once done, you can shave in the well lit bathroom (shaving gel and razors provided), then relax in the tea room, which has a large TV showing ESPN, magazines for men, a range of five different fancy teas, as well as snacks, fruit and choices of water or juices. At no point did I feel pressured to leave or hurry up. If the rest of your vacation involves late nights, drinking and over-indulging this is the perfect recovery for you. The only time I got a bit miffed was with the staff at the gift shops, who really didn't seem interested in serving someone who only wanted to buy a postcard, to the point where I just walked out the first one after waiting a ridiculous amount of time. Checkout  I checked the bill online through the hotel TV, and there was almost no wait at reception to get a copy of the bill and hand the keys in. Bill was correct, staff very friendly. Overall, the best experience at a hotel in Vegas so far. If you are one of those picky people that want fresh soap every day, and new towels and your slightest whim at a moments notice, then you may be disappointed. As someone that just wants a nice clean room, working amenities and a correct bill, I was very happy."
182,303,"Jul 14 2009 	Great Place to Stay!!!	Three friends and I traveled to Vegas because one of us was attending a conference. The rest of us piggy backed on his room. At check in we were offered an upgrade but due to using &quot;company&quot; funds he declined. Once we arrived in the &quot;Romar Tower&quot; room we promptly exited and went back for the upgrade. There's a reason there are no pictures of this room on Ceasar's website. It looked like a Motel 6 room. Once back at the check in desk we asked for the before mentioned upgrade. The clerk had already assigned that room so she gave us an even bigger room in the &quot;Augustus Tower&quot;, for the same price as the smaller room. Lets just say we made a good decision. The room was clean, well furnished, great view, and we all slept well with no outside noise heard. As with most rooms in vegas, there was no coffee maker, no fridge, etc. Stay away from the food and drink bar. If you lift an item out of it's place, a sensor is alerted and you will be charged. We had to get creative when icing down our beer. The beds were very comfortable and AC worked very good. WiFi in the room is $15.00 a day.The restaurants at Ceasar's are very expensive, $77.00 ribeye is a bit much. We only ate at Ceasar's for breakfast, in the food court. Average price for a 3 egg omelet, 4 pieces of toast, potatoes, and large coffee was $14.00. A little high but we couldn't eat all we were served. We did have a late night bacon cheesburger combo one night, same food court, $15.00, and it too was huge. Very good food as well. I utilized the workout facilities for the three of the four days while there. It's normally $25.00 a day but they had a 3 days for $50.00 deal which was o.k. The gym was clean and the equipment was new but it lacked somewhat in space. It has a very small area for the hand weights and free weights. Other than that I was able to get a good workout in.If you plan on getting some sun by the pool, plan on getting down there before 1000 a.m. If you don't, you'll find yourself walking in circles waiting on a chair to open. Even though it was crowded the chairs are only 3 rows deep in most areas so it wasn't too bad. Drinks at the pool are around $12.00 for 12 ounce and $19.00 for 16 ounce. Some kids but not alot. That&quot;s important to me as I don't want to listen to a bunch screaming and crying while lounging. Spoke to a security guard who told us that two additional pools are supposed to open in Aug. 09 but they may be running a bit behind. That would bring the total to 5 pools. The slots paid pretty well at Ceasar's. Three out of four of us took extra cash home from the slots. Can't speak for the blackjack tables or poker.All in all the hotel is very clean and well maintained. No complaints about any of the staff. Plenty of bar maids both in the casino and at the pool. I'm already planning another trip in Sept. of this year and I will be staying at Ceasar's Palace."
183,303,"Jul 12 2009 	Treated as a valued customer.	After an initial wait on the priority line (as a Platinum Reward Member), with those with the Gold card being taken ahead of me despite the intent of the PRIORITY line, the service was quick and supportive. The staff on initial registration and sign out were efficient, polite, and helpful. Although I was not placed in the wing I initially booked a room in, the room I received had a wonderful view. Even as a solo traveller, I felt safe and at ease. I will definitely stay at Caesars again and will recommend it to friends and family members - based on my experience. BTW - I even treated myself to a hair salon treatment (coloring) with my long time earned points and was again treated with respect."
184,303,Jul 12 2009 	Okay Stay	I stayed here for 2 nights as part of my nine day stay and did enjoy it. The rooms were comfortable but a little dirty. The bathroom was awesome had a shower and bathtub separate. There was construction going on at the pool that was annoying couldn't relax. Lots of slots to choose from on the casino floor. Good drink service and nice costumes. The shops were fun lots and lots of them top of the line. I probaly would not stay here again but it was not bad I just didn't feel that comfortable there.
185,303,"Jul 11 2009 	If you are going for the pool......wait a while	Can't beat some of the rates in Vegas right now so we couldn't resist a quick week vacation. We picked Caesars Palace for it's great mid-strip location (we didn't plan to really leave the strip and did not want to rent a car). Here's how we found it:Location = Mid-strip can't beat it. You will do a lot of walking with thousands of complete strangers but....that's Vegas. The hotel is HUGE, lots and lots of walking so bring the right shoes.Rooms = We upgraded to the Palace tower upon arrival for an additional $25.00 a night. This is the closest tower to the pool and that was one of main reasons for going. The room was very spacious as was the bathroom, excellent jacuzzi tub and separate shower. We heard horror stories about the Roman tower and wanted to avoid it at all costs.Housekeeping = top notch, room was kept very clean and no personal items were disturbed.Prices = Food and drink are not cheap at Caesars; the food court is the best bet where most meals were about $10.00 each. Soft drinks at the pool are $3 to $4 a piece. Alcohol at the bars is armed robbery, one night my wife and I each had a simple shot and it was $30.00 for both!Pools = You may have heard the pools are being upgraded or rather new additions. They are in the process of adding new pools and finishing construction on a new tower and meeting facilities.....all of this is around the pool. Dust and construction noise surround 50% of the pool area and you can't help but notice them. The pool chairs fill up on the early side, we were at the pool by 8am and had no problem but by 11am you were out of luck. There are two main pools available now with a 3rd &quot;European&quot; pool available for an extra charge. Not enough chairs for the crowd that hits the area so get there early if you want to sit.Bottom line; nice and big place pick the right tower and wait a few months if you plan on spending time at the pool."
186,303,"Jul 10 2009 	Perfact Vacation!!!	I had a great package deal at Travelocity (I booked about 6 week advance) for this hotel.Upon check-in, I asked the very friendly desk clerk if I can get any complimentary upgrades, and she upgraded us to a Forum Tower, which is one of newly innovated tower - everything in the room were cleannnnn!! If you don't ask, you will not get it. Don't ever touch anything in the fridge in your room, eventhough you don't open, they scan things that removed and charge you for it.We did not try the restaurents in this hotel (very expensive, but I am sure they are good), but we tried at Beijing Noodle 9. If you like a chiness food, you got to try! Handmade noodle and dumpling are just perfact! Average entry costs for 12-18 dollors. *** Try at &quot;KOKOMOS&quot; at Mirage Hotel - they have Pre Fixed Menu (you have to ask) for 29.99, and it was amazing!!! 3 course meal, nice atmosphere, good food.***Sushi Roku at Forum Shop - the best fresh sushi I never had. Try live sweet shrimp, the best!!!You will not see any $5 table game in this hotel. The lowest table I saw was $15. Most of them are $25 min.Shopperholic? Forum Shop got everything (all expensive designer handbags and cloth...you know the deal) I will recomand the Prime Outlet Mall - great deals on nice brand names.Overall, we just had stay at Caesars Palace and we will definately go back!"
187,303,"Jul 10 2009 	Wow!	I had taken an early flight and arrived at Caesars at 10:30am. I was somewhat concerned because I knew that check-in was at 3:00pm. There were perhaps a half dozen folks also attempting to check-in early.The woman at the front desk was very friendly and accomodating. She was able to find me a room (and EVEN upgraded it at no cost). I was in the Palace Tower right near the pool. This was perhaps the easiest tower to get to. You must walk through the rather smokey casino to get to the elevator.I was on the 20th floor and my room faced the Strip towards the right and mountains to the left. Wow! The room was huge. The furniture was modern, but simple. The king bed had very comfortable sheets, pillows and comforter..lots of huge pillows. The matress was firm, but not too hard. The air conditioner system worked flawlessly. The thermostat is on the wall, my room was hot when I arrived so I cooled it down to 70 and it only took about 15 minutes to achieve this.The bathroom was about the size of my living room.A stall shower, two sinks and a sunkin jacuzzi. I had no idea where the toilet was. Aha, it was behind the door and included a phone. The tv was flat screen and received an impressive amount of channels.A robe was included in the closet. The toiletries had a tangy, orange scent. I loved the lotion.There was an ipod docking unit/radio, but the docking did not work and the radio only picked up a few stations. High speed internet cost $14.95 per 24 hour. At times the internet was quite slow.The room was incredibly quiet. I never heard a door slam or noise from another room.It was very clean. My only objection was the maid walking into my room at 9:00am and didn't even knock. I guess she must have assumed that I was still out partying/gambling. You can check the cost you have accrued to your room on the hotel's tv channel. In addition, you can check out after 6:00am utilizing the hotel tv channel.The casino is large and perhaps one of the more sought out on the strip. I have heard that many people come over to Caesars to play the slots and cards. The casino floor went on and on and on. Unlike Atlantic City (which has smoking sections), smoking is everywhere! Even if you just walk through the casinos on your way to somewhere else, you are bound to get smoke blown in your face.After you leave the casino you are immersed in a huge shopping area with some of the most upscale shoppes in Vegas. The stores go on and on and you can get lost trying to navigate from one side to the other. The price of a Coach purse actually was higher then it would have been at Macy's, but I'll always remember where I bought it. The ceiling is a distinct blue and the area is very posh and made to look like a Roman street. Caesars is one of the largest hotels and it takes about 2 days to figure out how to get from point A to point B. There is a LOT of walking involved. Some times I found it easier to exit and walk outside then maneuver the massive maze.The Coliseam is the theatre where the top stars like: Cher and Bette Midler play. I saw Bette and had wonderful seats and she put on an impressive show.The pool is waist deep(so don't expect to be able to swim). It is a large circle surrounded by fountains and sculptures of caesar. There is contruction going on near the pool (a new tower is being added). The music at the pool was so loud, it drowned out any of the construction noise.There were many young people when I was there in the pool and nearly all had drinks in their hands. It was hot and the pool was crowded. If you want to get some exercise, you can actually walk around the pool a few times.You have to get down early because the lounge chairs get filled up quickly. I tried to get my space staked out between 930-1030am. Those who came in the area after 1100 did not have much luck finding a place to lounge. There is also a &quot;European&quot; pool located just outside of the doors.This is an adult-only pool area and the women can go topless.The waitress/bar staff at the pool are agonizingly slow. I ordered a drink and it arrived about 45 mins. later. It just appears that they do not have the adequate amount of staff to services a large crowd.I treated myself to a massage near the pool (in the shade) for $50 for a half hour. The masseuse was fantastic and very friendly.The pool store is very overprised. Unless you want to pay $12-$15 for suntan lotion (bring your lotion from home). Soda's cost over $2.00 a bottle and snacks range from $2.00-$4.00.There are loads of restaraunts, but they are quite expensive. I ate one large meal at the Japanese restaraunt (which I was told had among the best sushi in Vegas). The sushi was by far among the best I have ever had, fresh and tasteful. The cost was $25.00 for two rolls.One word to describe the Caesars staff--Accomodating.The cost of the stay was well worth it."
