IDREVIEW,HOTELID,REVIEW
49,1994,"Dec 13 2007 	I Agree - It's Fine	Though it's on the edge of a sketchy area, the Adante is pretty good, considering its place on the hierarchy of hotels. The standard rooms aren't very big, but they're just big enough for two. The bathrooms were renovated - nice and clean. The decor was pretty nice, and so were the linens. The people at the front desk were all nice and helpful. I kinda liked the mural on the wall. And the breakfast was enough to tide you over until lunch. It was a busy weekend (Nike Women's Marathon) and prices were through the roof at many places, so we were happy to stay at the Adante for a fairly reasonable $89 rate. I'd rather pay less, but I also didn't want to pay $300+ for a 3 or 4*."
50,1994,"Nov 5 2007	Great value	We were also a little worried about some of the bad reviews, but on this trip to the city we were extremely budget conscious and only needed a one night stay anyway. It is an old hotel, however, our bathroom was brand new, squeaky clean with jacuzzi tub, and the room itself was squeaky clean. Frankly, the bathroom newness/cleanliness and room cleanliness is what really matters to me anyway. So we were pleasantly surprised and enjoyed the brief stay. Regarding noise; the walls were a bit thin, and I think only at one point did i hear any talking, but if you had loud neighbors i guess that could be a problem, although loud neighbors and be a problem with thicker walls too. we did hear some street noise (motorcycles and sirens). The only potential problem I saw was if you had a room near the ice machine. The ice machines were located close to rooms and i actually felt bad using it at night, because if the rooms adjacent to it were occupied, it would be obnoxiously loud. So when you reserve, make sure you are on a floor that doesn't have one or a room that is far away from it. For the price, it was great!!"
51,1994,"Oct 21 2007 	Don't worry it's OK	I was concerned about the varying reviews, but not to worry, it was an overall good experience. On arrival the receptionists (mainly seem to be students working part-time) were friendly and helpful. We were on a motorcycle tour and they recommended overnight parking in the adjacent street. The room was small but clean, the breakfasts were fresh and plentiful. The area is really central to the main shopping area, Macy's is only 5 mins walk. We ate at the Grand Cafe a couple of blocks east and would recommend it, great atmosphere. There are a lot of beggars about, but this is true of all areas, I had previously stayed at the Whitcomb Hotel on Market Street and to be honest the area around there was worse. If all you need is a well located clean room, don't hesitate to book the adante."
52,1994,"Oct 15 2007 	Would stay again and again!	This hotel is in a transitional area, the Tendloin/Nob Hill area. I felt safe, the room was as pictured on the website and EXCEPTIONALLY clean. The bathroom was as clean as can be! The hotel staff were exceptionally friendly, courteous, helpful. They printed tourist resources directly for me from the internet. Continental breakfast was white bread toast, coffee, store bought muffins. For the price in San Fran, the cleanliness, and the hospitality of all staff, I would definitely stay again!"
53,1994,"Sep 20 2007 	not so bad	Had a pleasant 4 nite stay at the Adante and read some very uneven reviews.For the money you know that you should lower your expectations, having said that front desk staff were always courteousand helpful, housekeeping was always on top of things, rooms done everyday and done right. We had the park and room rate and with the transit system in that town you don't need your vechile to get around. If you book a room at the back of the hotel away from the road we found it was quieter. But if people in the next room talk in loud voices early in the morning and late at nite, bang their door closed when they are coming and going, it doesn't really matter. As far as the area is concerned maybe not the best area in San Fran, but you could easily spend two or three times the money and stay in a upscale hotel a block or two away but your still in the same area with the same homeless people it is not just around the Adante! Skip the continental and go to Dotties or the Crepe house."
54,1994,"Sep 11 2007 	If you want clean and basic.....	We have previously stayed at the sister hotel, The York, and had a pleasant stay, so we thought we would give the Adante a try.This is an old fashioned, mid sized hotel in a good central location. The staff were very friendly, and the hotel was clean.The decor of the room was a bit strange (undersea mural painted on the walls), but the room was clean, comfortable, and had everything we needed.The valet parking was superb, and I would recommend this hotel if you are having a short stay in the city and want somewhere convenient. It's not luxurious, but for the price it is great value for money, and we would definately stay again."
55,1994,"Aug 12 2007 	Great Hotel!	We enjoyed our stay at Adante Hotel &amp; would stay there again. We were greeted Tony at checkin who was always friendly &amp; helpful at the front desk. Our room was clean &amp; tidy with a huge ensuite, big TV, iron, safe &amp; ceiling fan. The area can feel a bit dodgy at night, but we felt safe going to &amp; from the hotel. The only negative is that the complimentary breakfast isn't very exciting, so we went to 'Dottie's True Blue Cafe' nearby &amp; enjoyed delicious breakfasts there."
56,1994,"Jul 31 2007 	Does exactly what it says on the tin	I have just come back from San Francisco. I stayed at the Adante hotel for 10 nights with my girlfriend and we don't have a single complaint about it. The hotel is clean, the rooms are cleaned everyday. The staff are friendly and helpful. Our toilet got blocked while we were there and we informed the front desk of this as we were leaving for a bite to eat. When we returned to our room the problem had been resolved. The hotel is is at the start of part of town called The tenderloin which has a lot of homeless people walking around. Although it could get a little bothersome being asked for change every 2 minutes walking around the area back to the hotel, not once did i have a problem with those people. They just ask and you walk on by. So i felt pretty safe there and didn't feel threatened at any time. I have read other reviews before i went where people have said the rooms smelled and what not. This is not my experience at all. Others said the decor of the rooms was bad. Well, why don't they stay at the Hilton then.I don't know anyone who goes on holiday to stay in their hotel room. I went to see San Francisco, not 4 walls of a room. If you want to see the city, the Adante is great."
57,1994,"Jul 23 2007	Good for the price	They were having computer problems and couldn't check us in right away. They locked our luggage in a room and bought us a couple of drinks while we waited. I'd only recommend the room as a place to sleep and shower. If you aren't planning on spending much time at your hotel it is perfect. It is clean, safe, and comfortable."
58,1994,"Jul 19 2007	Not bad for the price	My family and I stayed for 1 night and I must say, I had a few reservations after reading the previous reviews. However, the hotel was basic and old but clean. Our bathroom was quite new and very clean. The complimentary breakfast was adequate and there was plenty to fill up on. It was centrally located and an easy walk to Union Square (we have and 8yr old and 5yr old and they managed without a problem). The streets around the hotel werent the best and we made sure we were back indoors before dark. There were a lot of beggars which was intimidating. Overall, if you are looking for somewhere cheap, this hotel is fine. I probably wouldnt stay a week in it but 1 night was fine. Basically, you get what you pay for so dont expect the Ritz."
59,1994,Jul 16 2007 	Good place tos stay for the budget conscious	We arrived about 10.00pm and was advised by the friendly front desk staff member that we had been allocated a delux queen room. Room was a good size with a separate couch. Batthroom was very large. Room very clean and bed comfortable. All staff were very courteous and helpful. I would stay again and recommend this Hotel to others.
60,1994,"Jun 12 2007 	10/10 for great value for money	I stayed here in June 2007. I booked through expedia and got a great rate ($65/night). The hotel is centrally located. It is indeed not far from the sketchy part of the city (to the right as you exit the hotel), but it is still safe and only three blocks away from the Union Square and all the restaurants and shopping. (to the left as you exit)My room was on the 7th floor. It was definitely neither new nor well-decorated, but it was clean and had all the elements one really needs: comfy bed, good water pressure in the shower, spacious bathroom, telephone in the room, TV, hairdryer, coffee maker, iron and ironing board. If you are going to San Fran to hang out in your room, then you might want to pay more and stay somewhere fancy, but if you are there to explore and enjoy the city, this hotel is a great option. Some people in previous postings complained about the lack of AC, but I found the ceiling fan quite sufficient (during my stay in June, temperatures were reaching around 24 degrees). Actually, it was a bit chilly during the night and had to turn on the radiator.The hotel staff was exceptional  very friendly. The internet caf staff was super cool and you can also count on wicked music there as well. Overall, I will definitely be staying here again on my next visit. I would certainly recommend this hotel for an easy going traveler who can appreciate a good deal."
61,1994,"May 24 2007	Horriable Accomodations Good Service Great Location	My mother and I flew to San Francisco 5/19 for a concert and stayed one night at The Adante Hotel. The hotel definitely needs some work.1) The room accomodations were unsatisfactory. Apon walking into my room I was horrified by the color of the walls, which were a shade of yellow that looked ike someone had urinated on them. There was a hole in the wall that someone had unneatly covered and painted over. The murals on the walls simply show how cheap of a place this hotel is as they did not even purchase framed photographs for their rooms. The bed spread was worn and torn which prompted my mother and I to go out and purchase Lysol, spray down the bed, and sleep with our clothes on. At night, we were both very uncomfortable because the room was freezing and there was not AC control in the room and the door wasn't sealed correctly so light from the hallway pierced our room. Also, the window's lock was broken and a check makeshift lock was installed but one could still open the window from inside or out with the lock on. This made my mother and I feel very unsafe. The good thing is we only stayed one night, slept only 6 hours and checked out of the hotel as soon as we could in the morning.2) The service was decent. Julius the manager accomodated me very well and the desk clerk Tony was also very helpful in letting us know places to go around town. However, when my mother and I needed to store our bags, the clerk gave us a key to a side closet and we had to store our own bags - which means anyone could have had access to our things and easily stolen them.3) The location is good. 4-5 blocks from Union Square. However, when you walk out of the hotel go left not right, as the area borders Tenderloin - a not so friendly place. If asked would I stay at the Adante Hotel again, the answer would be definitely be no. The service and location don't make up for the horriable and disguisting hotel conditions. Even though its inexpensive, next time I'll pay the extra $30 bucks to stay at a nicer hotel."
62,1994,"Mar 23 2007 	You get what you pay for	For San Francisco, the location was very good and the price was quite reasonable. The doors were not very soundproof, but after each day of tiring touring we were not very disturbed by the noise in the hallway. The staff was very helpful. The room was overheated, but anyone who knew how to turn off a radiator and open a window could deal with it. Couldn't find a better deal for the money paid. Our room was waiting for us and we were satisfied. The &quot;continental breakfast&quot; was less than ok but the on site internet cafe provided a cheap supplement. This &quot;review&quot; mechanism did not allow me to give an accurate rating so I would say that the hotel is due a 3.8 out of 5."
63,1994,"Mar 5 2007 	Horrible - don't stay here	The service at this hotel was horrible!! The room was sweltering; we were told they were experiencing problems with their heating, and it could not be turned down. It was 85 degrees inside, 50 degrees outside, but the window only opened 6 inches. When we woke up the next morning, there was no hot water. Again, we were told there was a problem and they were working on it. After waiting over 2 hours for the problem to be fixed we ended up taking cold showers. When we checked out I asked if they were offering a discounted rate because of the problems. I was told they could credit us $3 for the Evian water we drank, but that was all. Of all the places to stay in SF, Don't stay here!!!!!!!"
64,1994,Feb 27 2007 	So so	No heater in room. Toilet just been renovated.Lift is very old n slow.Hotel is walking distance to Union square n cable car station.
65,1994,"Feb 13 2007	And it's close to Dottie's True Blue Cafe	Just what I was looking for. A comfortable, inexpensive place to hang out for a long weekend. The front desk clerk was very helpful, quickly finding me a nonsmoking room despite my early arrival. The room was clean and everything worked: the towels were clean and soft, there was plenty of hot water, the tub drained quickly, the lights didn't flicker and the TV and remote worked fine. For the price I paid ($54/night via Expedia) I don't take these things for granted! It was also convenient being able to get Internet access at the attached cafe without even having to step outside.And while the hotel isn't on a particularly charming block, it is just around the corner from Dottie's True Blue Cafe, a first rate breakfast place on Jones St. In summary the Adante is a good choice if 1) you're on a budget, and 2) you get a good price."
66,1994,"Feb 10 2007 	Adante will see our family again	The Adante suited our 6 night stay including a 14 month old. The front desk clerk upgraded our room to a suite for $10 per night, this was very affordable due to original nightly rate being $60 odd dollars. I appreciated that the clerk recognised we needed a little more room with tour toddler. I can recommend the Adante without a problem for families who wish to spend money on other things such as sight seeing etc. The room was newly renovated with big screen TV's in both king size bedroom and lounge that also converted into a fold out bed. The bathroom very clean and modern, in fact we were very satisfied with all the room features. Fresh coffee to brew when your room was made up every day, we had a back room which was very quite though I don't mind the noise in any case (sirens etc). The locality was great with Union Square and transport close, a Walgreens is a 2 minute walk on Geary Street so when any snacks or drinks required they could be collected close by. The staff were friendly and one afternoon is was too wet to venture out so we sat in the attached cafe with a delicious coffee (they serve beer too) and watched the world go by out on Geary street. Family friendly restaurants are within 2 minutes walks from the hotel (Diners or similar) so after dark you don't have to stroll to far in this is an issue. We'll give the Adante 10/10 for great value for money."
67,1994,"Feb 7 2007 	Good little place	This hotel is in a good location and at a good price. The room I had was clean and well presented if a little old. If you can ignore the rather misguided pink paint effect that covers walls and all woodwork then you should be pretty pleased. Hotel staff were very helpful and advised me of the one area not to walk after dark when I checked in which was helpful being a female travelling alone. Area felt safe to walk around at night and is handy for buses out to Pacific coast, as well as acceptable walk to cable car (4 blocks). Slight drawback was the toaster setting off the fire alarm 2 out of 3 mornings! Definitely get a MUNI pass as you can save your energy on those hills!Watch out for the Scientologists in the old Transamerica Building, they lure you in with an Open House sign, but do have a quick stop at Wells Fargo Museum in the Wells Fargo Bank, if you're at all interested in the real Wild West! The Thai place on the corner up from the hotel does quick, cheap, good food."
68,1994,"Dec 5 2006 	Great location 	What a wonderful old hotel in a wonderful location in San Francisco. Just 4 safe blocks from Union Square, near the theatres &amp; lots of shopping. The lobby has a nice fireplace, relaxing chairs &amp; sofas, and a variety of very handsome men who work at the check-in. The hotel attracts a wide variety of visitors - esp. families with children, foreign travelers, and gay &amp; straight singles &amp; couples.I was surprised at the level of service for such a great price. From check-in to check-out, it was very smooth. They have a free baggage room so you can store your bags safely if you arrive early or leave late. The maids are very helpful &amp; the rooms are very clean. There is a free continental breakfast, with an attached bar/grilll if you want more.The only downsides were no view out of the window &amp; a smoke-detector that went off when I took a shower. Luckily there was no fire, because no one showed up when the alarm went off. LOL.I would gladly stay there again (as I did at Thanksgiving), and I would recommend it to anyone looking for a great, safe, and welcoming hotel at a nice price."
69,1994,"Nov 28 2006 	Old....	Girlfriend had booked this one, and we arrived separately. Without her presence, I was unable to check in. With a stressful arrival, this was not appreciated. In the end, we maybe could've prepared better somehow...Room was very old and was about as solid as a cardboard box. Room did not smell great either. Was a very average experience. Baggage storage was not secure at all, was open to any guest requesting its facilities. Was an open storeroom where you put your bags with everyone else's and while there were tags to place on your bags, anyone could go through anyone else's bags. Was not a comforting experience."
70,1994,"Nov 4 2006 	My new favorite in Union Square	Of all the hotels I've stayed at in SF the Adante is the best in terms of value. I paid $64.80 for a room for one night. They honored my request for the top floor at the back. Room 710 contained two double beds, the usual furnishings, a safe, newly remodelled bathroom with all new fixtures, hair dryer, iron and ironing board. Walls were handpainted with rural scenes and tropical fish--not very well done but it gave the room some character. With the ceiling fan and the window cracked open there was plenty of ventilation. I couldn't believe how quiet it was. With the window open all night I heard nothing beyond the occasional siren in the distance. The location is great, a few blocks from Union Square. I went to the Curran Theater that night so after the play it was nice to able to walk home in less than 5 minutes. The breakfast was skimpy, just muffins toast and coffee, but at this price I think that's acceptable. There are many good coffee shops nearby if you need more. I highly recommend this hotel to anyone. I can't imagine finding a better deal in San Francisco."
71,1994,"Oct 17 2006 	Good budget hotel option	After looking at tripadvisor to find a hotel in S.Francisco i decided for Adante hotel as it seemed a good value and good reviews.I've just came back from S.Francisco, staying at this hotel for 4 nights and I agree with the other travellers I was satisfied.I asked for a quiet room in the back and I got it and the staff was very friendly.I got all what you expected in a good budget hotel, the only think I missed was a refrigerator.The location is also very convenient."
72,1994,"Oct 15 2006 	Great location very friendly good value.	My daughter and I traveled to San Francisco and wanted to stay at a place that was convenient, safe, clean and affordable. This hotel was perfect. The cable cars are just a few blocks away and the bus stops downstairs. The cafe at street level offers wireless internet and GREAT coffee. The staff was always helpful. If you are not accustomed to street noise you might want to book a room in the rear. We felt it just added to the feel of this wonderful city."
73,1994,"Oct 10 2006 	Great value for money	Booking a 1* hotel sight unseen can be a bit risky but we were delighted with our choice. We caught the BART from the airport to Powell St and wheeled our luggage to the Adante. Our plane arrived early in the morning but they have a luggage room for storing baggage when necessary. The room was small but clean, quiet and comfortable, which is all we ask in a hotel. The bus at the door goes to Golden Gate Park and y ou can walk to the cable cars and Union Square. Breakfast of muffins, toast, juice and coffee is enough to get you going for the day and the internet cafe right next door is very convenient. Would have no hesitation in staying here again."
74,1994,"Oct 9 2006 	Excellent value for money	We stayed at this hotel for two nights in September and it was excellent.As we were in a city centre I asked for a room on a high floor in a quiet area. When we checked in we were given room 711. This is on the top floor (I think) and right at the back. The room was really quiet and just what we wanted.We flew into town and got the BART train into the city. This was really easy and cheap $5.15 each and the hotel is only about a 5-10 walk from the train stop. If you do this I would however recommend you walk up Powell and along Geary st as opposed to taking a direct route from the train station to the hotel like we did. Unfortunately this takes you through the homeless area which wasn't too pretty.The hotel itself is clean, the room was big enough for us with an excellent bathroom. The shower was low but this seems to be the done thing in America as every hotel we stayed in had a low shower. The reception staff were helpful and gave us a handy map of the city which was excellent. They also marked out any areas to avoid.The breakfast is basic with Coffee, Juice, Toast and Cakes but this was more than enough to enable you to get out sightseeing quickly. The location was good, really close to the shops. The walk to the Pier, Alcatraz takes about 40 mins and involves a few hills, so if this is your main focus you might want to stay a little closer or get a tram.The only downside was the window in our room didn't lock, however when we looked at the drop out from it we realised no one would try it.In summary an excellent hotel and I would recommend to anyone going to San Francisco who doesn't want to spend all their money on hotels"
75,1994,"Oct 9 2006	Great Hotel	Was very suprised at the great quality of this hotel considering it's price and 1 star class rating. The receiption area was bright and modern ... the rooms very clean with a huge bed ... bright and airy and very comfortable ... rooms had a safe, were secure ... the bathroom was big and our room even had a jacuzi ... have stayed in other hotels in the area for roughly the same price and they were so bad compared to this hotel ...i strongly recommend staying at this hotel ... it's location is great, it's very clean and brilliant value for money. Could not have been happier ...."
76,1994,"Oct 7 2006 	Great budget hotel	On my first trip to San Francisco the Adante hotel was both cheap, clean, and in a very convienent location. The rooms were small but very clean and cozy. The contiental breakfast wasn't anything but muffins and coffee, but at least it saved us from buying breakfast for our three day stay. I would reccommend the hotel to anyone looking for a place to stay while vacationing in the city. I don't think that the hotel would be very good for families, but was perfect for my boyfriend and I (a couple in their young twenties). The only advice that I would give is make sure not to take a right turn out of the hotel as the neighborhood gets a bit sketchy, ( we made this mistake but luckily in the daytime, even though it was still very scary!) but as long as you head towards union square you will be fine. Great place for people on a budget looking for a clean and nice hotel!"
