IDREVIEW,HOTELID,REVIEW
19,2173,"Jul 28 2005	Avoid at all cost!	This is not a hotel, more like a motel in TJ (Tijuana) Mexico. This hotel has no association with the Hilton Embassy Suites. The bathroom has purple checker board and the heater looks like a radiator. The trim is painted with a cheap silver and gold painting. Sirens ring almost on an hourly basis. The room smell like rotten cheese. I recommend if you plan to stay to pack with M-16 and gas mask to survive through the night. Every corner of the hotel smell like [urine]. The entrance gate is operated by someone inside who is watching the monitor. The gate is old looking like backyard ally dog watch. Don't stay here unless you only want cheap rate or free parking. That was our mistake."
20,2173,"May 24 2005	A Suitable Accommodation For A Suitable Price	We chose this hotel for the price and the central location to many nearby attractions in San Francisco. We came during Chinese New Year, we arrived at the hotel late in the evening. When we got inside to the front desk, where we were greeted and received the key to our room. One thing we did noticed was that the elevator was very old but still seem to work fine. Our room was on the fifth floor, the room was clean; there were clean sheets on the bed; there was new soap and clean towels in the bathroom; cable television; desk and a very large closet. Each day our trash was taken out and the beds were made by housekeeping. One thing that people have to realize is that this is an old hotel built back in the 1930s', but still well taken care of despite its age.We are glad that we did not read the reviews that were posted here, or else we probably would not have picked this particular hotel. We believe that if anyone is on a budget and is just looking for a place to sleep for a few nights, this hotel would probably be your best bet."
21,2173,Jan 10 2005	The worst ever	I have stayed in hostels that were cleaner than this hotel. I do not recommend it to anyone and it is not a value for what you get it is a rip off. the window overlooked a dumpster that had people drinking all night by it. It has no airconditioning which was awful when I stayed there because it was in the nineties. The bathroom is large enough for one person to stand in. I didn't sleep in the bed one because it was too hot and another because it looked dirty and stained. The carpets had stains and everything about it was awful. The rooms have no amenities. Please don't stay here you would be better off sleeping in your car.
22,2173,Aug 17 2004	The Embassy Hotel needs a Cleanup!!	The hotel does not do a good job of cleaning. There is usually garbage left in the hallways and stairwells. The elevator smells of old beer and is quite filthy. They need to clean the place up. The staff appear overworked.
23,2173,"Jul 23 2004	A terrific bargain in a great locatioon	We chose the Embassy because of its proximity to the War Memorial Auditorium, where the San Francisco Opera Company's productions are held. The location was ideal - no more than a ten minute walk to the opera. The hotel offers free, no-limit, &quot;in and out&quot; parking in a locked and gated area protected by security cameras.It is directly across the street from the California Culinary Academy and many of the Academy's students use the Embassy as a resident hotel. We found them to be quiet and unusually well behaved and courteous.Although the hotel obviously is somewhat old, the current owners have done an excellent job of refurbishing it. While we were there (June, 2004), the completed installation of a new fire protection system.Highly recommended to anyone on a budget."
24,2173,"Feb 20 2004	Simply atrocious!	I would advise anyone planning to stay here to seriously reconsider. I'd even go as far as to say don't bother! As bad as you think this may be for the price, I really don't think anyone can be prepared for how awful this really is. Not only is the hotel old, dirty, run-down, and sickly, but the neighborhood outside is downright frightening. No one can feel safe walking outside at night, and even during the day a tourist should be wary. Even finding a taxi in this part of town proved tricky. This hotel and this area are definetly places to avoid in San Francisco!"
25,2173,"Dec 31 2003	Seriously think about staying here!!!	I stayed at the Embassy in November 2003. It was pretty bad. When we checked in, our reservation was cancelled. They then gave us our allocated rooms and mine, was one that had not been completed!!! Although the room was changed, the shower would not work. Eevn though I complained to the management about it, it wasn't fixed. The neighbourhood and I cannot stress this enough is really awful. We did not feel safe during the day walking and during the night, I would advise people to use cabs. The free breakfast that they provide, is not appetizing. Needless to say I shan't be making a return trip!!"
26,2173,"Nov 6 2003	We Wouldn't Even Stay The Second Night For Free!!!	We received a two nights free stay at the Embassy Hotel as a free gift for attending a time share presentation. Having read the reviews from Trip Advisor.com, and knowing that this was not the Embassy Suites, we were prepared for the worst, which is exactly what we got! The neighborhood surrounding the hotel is one of the worst in San Francisco, which includes pan handlers, transients, prostitutes and drug dealing.  Upon arrival we were greeted at the counter and given an actual key (as opposed to the what seems to be the standard, in today's technology, a key card) We then boarded an ancient elevator, which had a door that needed to be opened from the outside with a door handle. The elevator held only four people at a time and would not operate unless the entry door was closed. (At one point we waited approx 10 minutes for the elevator on the fourth floor, due to the fact that the entry door hadn't been closed on the ground floor.)  Our walk to our room was met with trash left in the hallway (which was still there the next day) by other guests. Most of the other guests seemed to be students of the Culinary Academy located across the street from the hotel.  Upon entry into our room, we discovered several black mold spots on the bathroom walls, poor patch jobs to the bathroom tile, a picture which was hung upside down and very few amenities.  After spending the night listening to the neighborhood locals scream and yell, hearing the numerous sirens go past the hotel, waking to the sound of the guest in the room next door throwing up, accompanied with the odor of vomit, we decided to check out, even though we still had another free night stay left.  The only bright spots were that it was an architecturally interesting building, which was built in the 1930's, although it needed serious remodeling and the Temple bar and grill had pretty good food."
27,2173,"Jun 25 2003	A place to avoid!	An awful place in one of the worst neighborhoods in San Francisco. Our room stunk, the bed sheets were sticky, the bathroom was old and small. We found broken glass under the furniture. No computer outlet."
28,2173,"May 28 2003	They Just Can't Get It Right	Of all the Embassy Suites I stayed in (well over 20) this is the only one that cannot make the grade. Rooms had inadequate ventilation, as a result they were very hot during the day and early night...cold late night and early morning.Embassy claims to give you a &quot;free complimentary cooked to order breakfast.' This Embassy does not have adequate staff to support that. I stayed at this hotel for three days, one day the breakfast was OK. The second day, I had to wait 15 minutes to place my order, which the cook limited. The third day I was unable to get breakfast. I was at the breakfast area during the mid-morning serving time. The line to be served by two people winded from the breakfast area to the check in area...almost the entire lenght of the hotel. Rather than wait on line, I decided to get cold ceral, there was none, there was no bread, no pastry and I had to wait for ten minutes to get coffee.It appeared that this hotel has no desire to keep up with the demand of their customers. I would assume that this hotel was near capacity...it is not reasonable to believe that one cook and one server is adequate to staff breakfast. The hotel front desk had to know of this problem as the line for breakfast started within ten feet of the checkout line. One night at the 'reception' there was a women who did not seem to 'belong' ordering six drinks at a time, and downing them while sitting in front of the bar. I left as she stubled to get yet another round of drinks for herself."
29,2173,"May 14 2003	You Get What You Pay For	I stayed at the Embassy in February for three nights, and I have to say that overall I was not impressed. The ice machine is in the basement, and I never did find the free contential breakfast. There is a small bar in the restaurant that seldoms serves food, so I wonder why they even call it a &quot;restaurant&quot;. The room itself was ok. Nothing fancy. Bed, desk, lamps, tv, radio. I was surprised by the walk-in closet. The bathroom was tiny. On my last night there, the knob for the radiator got stuck in the &quot;on&quot; position. But I guess for about $70 dollars a night, you get what you pay for. The Four Seasons and Waldorf-Estoria this isn't. But if you are on a budget, I guess it's ok. It was clean at least."
30,2173,Sep 30 2009 	Diebes- Hotel
31,2173,Aug 19 2009	viellot  limite propre
32,2173,Jun 28 2008	hotel simple proprebien situ.
1,2174,Gorgeous hotel	The Fairmont in Mason St is a beautifully well maintained hotel with a long and colourful history. The rooms are large and comfortable with fabulous city views. The lobby is fabulous and the photos and stories documenting the hotel's history are fascinating. Staff great too.
2,2174,"Enjoyed my stay	The Fairmont for me lived up to expectations. A good quality hotel, great rooms and I think a good location. It was my first visit to San Fran and I thought this was a great area to stay in. Close to the cable cars, Union Square etc.The only thing I would say is that the beds are getting a bit old. They were very soft and not very friendly to my back!Still, a very enjoyable stay."
3,2174,Feel like royalty	This hotel was located in the best part of San Francisco with easy access to everything. All cable car routes were within the block. The food was fantastic at the restaurant as well. The decor makes one feel so special.
4,2174,"Nov 24 2009 	The Suites and Hotel Lobby and Accomodations are breathtaking	I live in San Francisco and every once in a while I like to take a trip within my own city and stay at one of the suites at the Fairmont. I stay during the week because I can get the best rates. Its truly the best hotel I can ever imagine staying at. From the Suites, to the lobby, to the restaurants, to the service. the Location is Excellent, especially for tourists because not only is Nob Hill a nice place to keep you busy for hours, it is conveniently located on the trolly line that takes you straight to union square and many of the other worthwhile districts. I recommend this place for anyone who wants to get away from &quot;it all&quot; and feel relaxed and joyful."
5,2174,"Nov 23 2009 	Dated but good	Spent three nights in the Buckingham Suite in the main building. The Fairmont is one of the city's best known, but is showing its age and in need of a good upgrade ( and cleaning), particularly in the main (older) building. Staff were good, location was good, but not really convenient if you like being in the heart of the action ( shopping, theatre, restaurants ). Went with high expectations and was a bit disappointed by this much talked about hotel."
6,2174,"Nov 20 2009 	The Best!!	Beautiful, grand entry, that gives an aura of true class. The hotel was preparing for the Christmas Season during our stay. A &quot;gingerbread house&quot; was being built in the lobby and the aroma gave a fantastically warm touch to the spacious but warm surroundings. The bell staff were smartly dressed, and for the most part, pleasant and gracious. Our room was large, well appointed, and clean. As far as I'm concerned, there is no other place to stay in San Francisco than the Faimont Hotel!"
7,2174,"Nov 19 2009 	Great in every aspect!	My friend and I stayed in their basic queen room, which was already great, apart from a torn drape. best bed I ever slept in, great appliances, nice storage spaces and very tastefull decoration. Great bathroom as well. Very spacious.Best location in San Francisco - up the hill with a great view and close enough to lots of great restaurants and touristic interest points.Service was also great. I didnt have that many requests, but they were always prompt to answer them.Definitely recommend it as one of the best places to stay in SF, specially considering the value."
8,2174,"Nov 17 2009 	Location is the key.	On most of my business trips to San Francisco, I stayed at the Fairmont Hotel. It's historic rooms in the &quot;old building&quot; were a treat, although could have used a bit of updating just for comforts sake. But, despite the &quot;old&quot; feel of those rooms, the location is the key to the Fairmont's success. It sits right atop Nob Hill, and the views are truly incredible. It's easy to get anywhere in the city from there by trolly, but don't try walking those hills in heels. It really is a special part of San Francisco that everyone should experience."
9,2174,"Nov 14 2009 	You must stay here.....	This was my second visit to the Fairmont. My first visit I stayed in a tower room with views of the city and fell in love with the hotel instantly. This visit was for my honeymoon and we booked the same room type but were upgraded to the Bali Suite in the main building. I was initially worried that the views would not be as good and the room was would be decorated as its in the older part but since they made the effort to recognise we were here on our honeymoon i didnt want to sound un-appreciative. Anyway the room was huge and we got a lovely view of the Red building infront and the cathederal behind. Yes, the hotels food/drink is expensive but you know you dont have to eat there. There are ample eatieries around and Cafe Centro is good value. On my 3rd visit I will stay here again. I am very lucky to be in the travel trade and get very good deals at the Fairmonts."
10,2174,"Nov 11 2009 	Parthenon	The hotel is first class, everything from the bellmen to the maids. views are spectacular and the location is perfect for a great San Francisco retreat. We had 800 company representitives here for this function, and to my knowledge there were no problems. AWESOME place to stay. I will most certainly return to this fine establishment."
11,2174,"Nov 9 2009 	Anniversary	We love to visit our favorite places - the city and The Fairmont. Is clean, detail oriented and with good location. Walking distance to China Town, Union Square and more. We love nice room and service. This hotel is perfect ."
12,2174,"Nov 7 2009 	Wedding Night Bliss	My husband and I spent our wedding night at the Fairmont. It was fantastic. The room, a balcony suite, was bigger than our apartment, paneled in wood, with real books on the shelves and was simply lovely in every way. The desk people were courteous and when I called for information about room service or how to work the fireplaces or where to find the light switch for the balcony (it was hidden), they always greeted me with &quot;Hello, Mrs. XXX, how may I help you?&quot;Most excellent.The bed was very comfortable and the room itself impeccibly clean. The location is unbeatable, where the two cable car lines meet on top of Nob Hill.The cons were minor, but going to mention them here:1) When hubby went to check in the day of the wedding, they did not have the room I reserved nearly a year in advance. However, since we were not going to be in our room until later, they managed to put us in the Buckingham Suite - no complaints there.2) We ordered room service for breakfast and when it arrived, the drinks were warm. Despite being in iced containers, the milk and orange juice were both warm from having been under the tray. Not drinkable. Also, we didn't order orange juice, but they included it anyway. Yes, I could have sent it back or asked them to send new drinks, but it was too much hassle.3) The fireplaces don't actually work. A bit disappointing but hardly a huge deal.Overall, we were very happy to stay there. Hopefully we'll be able to get the same suite on our honeymoon. We only live a few blocks away, but staying at the Fairmont was a treat that we'd looked forward to for several months. Aside from the very minor items mentioned above, excellent service."
13,2174,"Nov 4 2009 	Best hotel best location	It's expensive relative to others but you do get what you pay for. Location was unbeatable and the tram stops on the corner, so it's easy to hop into the town or down to the bay. The hotel opposite has a roof top bar but get there early as we had to queue!"
14,2174,"Nov 3 2009	Classy but not first class.	Rooms were small, everything was too expensive. Neat history of the place, but the room was small."
15,2174,"Nov 1 2009 	Nice location	We stayed for one week at the Fairmont, for a professional convention. We had a room in the tower section, on level 2. The best is to have a higher level, facing the golden gate. It is a huge hotel that could cater for the 600 delegates of our convention. Though, you dont feel the hotel being that crowded. All the services were quite efficient. Its location is on top of one hill and its downhill to the wharf. A nice hotel for a professional stay."
16,2174,"Oct 31 2009 	High prices and classic style	The service at the Fairmont was courteous, overall 4-star but a little uneven. At check in the desk was most welcoming and the parking charges were clearly explained at over $50/day additional parking. There are significant additional taxes, so expect sticker shock at checkout. We were appreciative that the desk check-in upgraded us to a larger suite since we had a child in tow. This room had only an interior view, but the extra room was most appreciated. The sheets were soft and the cushions were plump and plush ... very comfortable sleeping. The soaring lobby is spacious and sumptuous on a grand old scale and still inviting and comfortable. It is also the only place with free guest wifi, so I did enjoy the lobby, but felt nickled &amp; dimed that the rooms didn't have free wifi too.Located on the top of the Nob Hill area, the hotel has a trolley stop-off, and is a strenuous but bracing hike up from market street. It is an easy walk to Chinatown, and 15 minutes walk to SOMA and the SFMOMA.The main hiccups in service were when my wife was ignored at the entrance driveway because a VIP car had arrived. I commented to her that this was exactly the difference in service between 4 and 5 stars - that 5 star hotels treat all guests well all the time. The second hiccup was a slightly discourteous employee, and finally a noticeable drop in staff responsiveness when underdressed. Overall the Fairmont is still 4 stars. It definitely is a grand OLD hotel and one should expect the associated quirks, charms, and annoyances such as smaller elevators. Charming, historical, and storied - definitely not a corporate chain Hotel experience."
17,2174,Oct 27 2009 	Truly Amazing Hotel - so much history	We stayed here as part of our Honeymoon. We knew it would be a beautiful hotel and it didn't disappoint. The hotel is truly stunning &amp; has so much history. The Staff were really friendly and we even got upgraded and had the most beautiful view looking out our window we could see Alcatraz. The room was beautiful too with a lovely big bathroom! The hotel's location is excellent as long as you are prepared for walking up and down the hills. I recommend reading the information on the walls about the hotels history andall the films which had been filmed there &amp; also all the famous people that have stayed over the years. We really recommend the Fairmont and would stay there again!
18,2174,"Oct 22 2009 	Very nice but small room.	Overall it was fairly nice, and we got a good deal because we booked with an airline package deal. The room was quite small and the fan in the bathroom did not work. Also, the mini bar was well stocked, but wow, was it ever expensive! I think I paid $6.50 for a can of sprite! The bottle of Evian water was $8! I thought that was pricey. The lobby was absolutely beautiful. Staff was pleasant but not overly friendly. The hotel is on a very steep hill (Nobb Hill), so I hope you like walking! There are not really any birstos, cafes, etc near by so it was quite a jaunt to eat. After getting back we saw on the travel channel that the Hurricane bar is one of the best in San Fran! We missed out I guess! It's right in the basement of the hotel, used to be the old swimming pool before WWII. It was a very nice place but probably not right for us. I am in my mid-twenties and would have preferred to be closer to Union Square and the nightlife. If you like to stay in a quiet hotel with history and don't mind traveling to where the action is, then this is the hotel for you. For me I would have preferred a bigger roomed hotel with better priced movies/snacks not on a GIGANTIC hill, but that is me! Oh, the bed was wonderful!"
19,2174,"Oct 22 2009 	Great Hotel - But the amenities will cost you	PROS Great location, right near Chinatown and Union Sq.Beautifully ElegantGreat bellhop serviceComplementary shoe shineGreat TVs in bedroomBedroom clean, neat and ready immediatelyGreat Views from Hotel windowsBathroom large and with nice bathtubValet parkingHigh-end shopping within HotelGreat Restaurant and BarRight on the California Ave cable car lineOverpriced WiFi (PER COMPUTER!)CONSA little too stuffy in appearanceFood, Valet parking, room services insanely overpricedAdjacent hotel was noisily being protested, not the Fairmont's fault thoughClaims to have swimming pool, but they really send you blocks over to another place, then you have to PAY to use it!"
20,2174,"Oct 19 2009 	Slightly Tired Elegance with Terrific Views	We had a very nice stay at the Fairmont, and whether you love it or not depends on point of view -- this historic grand dame was elegantly renovated -- but ten years ago.... So, the furnishings are far more luxurious than an average four star, but slightly too worn for top ratings. The beds, however, are very good and the linens are Frette -- wonderful.If travelling with children; this would not be my top choice -- stay at the waterfront! The Argonaut is a terrific, fun, hotel with kids, and there will be far more to entertain them. Likewise, for a young adult, there is nothing hip or cool about the Fairmont. But for the business or adult traveller, the location is central for business and restaurants and quietly above the fray -- no cheap t-shirt shops on Nob Hill! And the Fairmont is truly a beautiful historic building.The best thing about the hotel per se, are the views -- so book a tower room (this is admittedly not the old part of the hotel, but you can still hang out in the historic marble lobby). Another decent choice are rooms in the front of the hotel overlooking the roof garden, which is lovely. By all means avoid the interior rooms - there is no point in staying here at all if you are looking out at grey interior walls!On a clear day, go across the street to Top of the Mark (at the Intercontinental Hotel) for breakfast or drinks."
21,2174,"Oct 19 2009 	Wow!!! We Loved This Place!!!!	We were in san Fran as part of our honeymoon and ended up at The Fairmont after we had a terrible first night at a different hotel. My Mum arranged for us to stay at The Fairmont from The UK. On arrival we were blown away - compared to where we had stayed the night before! The entrance is beautiful! We were given a corner tower room on the 12th floor for our first night which was wonderful, we had amazing views of the city, for our second night we were lucky enough to stay in the suite on the 12th floor. This was all thanks to Ana who did an incredible job on the reception desk and we can truely say that she made the final part of our honeymoon unforgettable. The suite was out of this world, we had views of the city and of the bay! Just wonderful! I cannot say a bad word about this hotel. I would love to stay again!!!Thanks Again Ana!"
22,2174,"Oct 19 2009 	Astounding city views from the 22nd floor	My husband and I received a room on the 22nd floor and were treated to astounding panoramic views of the city during our stay. We had clear views of the city when we first entered the room in the afternoon. When we came back after dinner, we now had the twinkling lights of the city laid out before us. In the morning, we awoke to a city shrouded in clouds with buildings coming in and out of view through the swirling mist. We kept the curtains open during our entire stay as the views were simply amazing. The room itself was spacious - the bathroom was exceptionally large - and ultra clean. Stay here and ask for a room on one of the higher floors - you won't regret it."
