IDREVIEW,HOTELID,REVIEW
36,813,"Feb 29 2008 	good value	I had to stay close to Hammersmith for business reasons.Considering the prices of London, this Holiday Inn is not bad (119 GBP internet rate). It is fairly new and still look well kept. Bathrooms and elevators are modern and functioning.It is 10 minutes far away (walking distance) from Hammersmith Tube station and it is very easy to reach. In spite of the closeness to the main road, it's in a somewhat quiet area, a shorter side street with parking.Check in and personnel assistance is decent enough considering it's a sort of 2-3 star hotel.The room is of the size you'd find in a Ibis or another Holiday Inn, plus with necessaire to have a cup of tea.Shower pressure is very good and the room is quite comfortable.No complaints about breakfast either but it's an area so full of every fastfood/restaurants/cafes that you will find whatever suits your needs.I have no complaints and I found this place to be a good deal for the area."
37,813,"Feb 9 2008	Nice UK hotel	We stayed at this hotel over Thanksgiving 2007. It is a little bit out of the way but it is close to the train stations. The price is okay for a UK hotel like this. We stayed for 4 nights for GBP506. The room was clean and the facilities were modern. There was no free internet. However, they provide free continental breakfast. They also have a microwave oven, dishes and cutlery in the lobby for the hotel guests. One nice thing about this place is its proximity to supermarkets. There is a Marks &amp; Spencer down the street and they sell pre-packaged reheatable meals. One word of caution though. The train from Hammersmith or Olympia do not start to run until about 8 AM on Sunday. We were unable to catch the train to the airport and had to catch a taxi instead. Otherwise, it is a decent hotel and we will consider staying there again in the future."
38,813,Dec 10 2007 	Very poor hotel - stay in the Novotel down the road!!	I can't believe this hotel ranks higher on Tripadvisor than the far superior Novotel down the road which I have stayed in numerous times. Stayed at the HI Express recently having paid the horrific sum of 263 for 2 nights in a family room (the Novotel was fully booked). Arrived to find that we were in a microscopic room and that the bed for our children had not been made up. The heating in the room was not working and we were not given sufficient towels and pillows for all of us. The breakfast was extremely poor with very limited choice and the coffee was undrinkable. I wouldn't mind all of this if I had paid a fair rate for the room but I really think we were charged way over the odds for a very basic hotel a long way out of central London. I will not be staying here again and recommend anyone wishing to stay in this part of London to stay in the nearby Novotel.
39,813,"Dec 7 2007 	Good location - Internet is $120.00 for 7 days!!!	I stayed at the hotel on a business trip while in London. The hotel is very modern and somewhat clean. The beds are somewhat comfortable and the pillows are hard. They do not have face clothes, instead, the have a heavy duty paper towel that has facecloth printed on it. Also, the soap comes from a dispenser on the wall - The breakfast is very typical. The internet is $120.00 for 7 days!!!The hotel is centrally located and an 8-minute walk to the Ravens or Hammersmith Tube stop"
40,813,"Oct 7 2007 	A Really Good Deal	My wife and I stayed at Express by Holiday Inn for 4 nights in September. The room was small but clean and adequate, and everything worked. They gave us a top floor room, as we had requested, and the lifts to the fourth floor worked well. We never heard sounds from neighbors on either side. We could hear trains on the Jubilee line in the distance, but the window glass was thick enough to muffle the sound. The sound of dogs barking in the morning came through, though. While the room was small, the public space on the ground floor was quite roomy. It served as a breakfast area and a lounge. The website said the hotel was a Stg 25 taxi ride from Heathrow airport, but our taxi took the most direct route (M4) and the meter showed slightly more than Stg 40 when we arrived. We will come next time by underground from Heathrow because the Jubilee Line station is only 10 minutesaway. We used a nearby Internet cafe to pick up our e-mails for Stg 1 per hour, but the hotel offers an affordable deal for accessing only e-mail sites (but not browsing), I think Stg 3 for 60 minutes. The Plough and Harrow bar and restaurant in the same building provided a good lunch, and there are many good restaurants on King Street. We enjoyed dinner at Minato Japanese restaurant. The questionnaire given to us on the last day asked if we had received the privileges appropriate to our Priority Club status and if the staff considered our needs a high priority. Perhaps this highly professional corporate emphasis is why the staff that we met were so personably helpful and friendly. We especially appreciated the genuine helpfulness of the tall young man named Saran and the young lady named Saldina. We feel the Holiday Inn Hammersmith was an unusually good deal, and the management should be complimented for doing such a good job."
41,813,"Aug 24 2007 	Basic and clean	This is a typical 'Express' hotel. Rooms are basic and a little on the small side, but clean and comfortable. The buffet breakfast, which is essentially served in the lobby area, is passable but nothing special and the staff seemed very over-worked. The hotel itself is a good 10 minutes' walk from Hammersmith tube station. Definitely not worth the 109 rack rate, but ok if you can get a good deal."
42,813,"Jul 13 2007 	Great Hotel and good location	I was a little dubious when I heard was staying at a &quot;Holiday Inn Express&quot;. However I was pleasantly surprised! The rooms are modern, clean and a fair size. The shower was great - which is always a plus after a hard night on the tiles.Staff were very friendly and helpful and the continental breakfast is great - the croissants were the best I have had in a long time.Mix of business people and tourists at this time of year, and there is parking available if you need it.All in all a very pleasant experience."
43,813,"Jul 2 2007 	Good value hotel in central location	I stayed here with my wife and ten year old son for a night . The hotel is everything you would expect from a Holiday Inn Express (clean, basic, good value) - we asked for a quiet room and despite the location (situated on a busy shopping street) we were given a quiet room. When I arrived I needed to make a call and the receptionist offered me the use of the hotel phone free of charge.The room cost the three of us 88 - not bad for London. The breakfast is a basic continental buffet but fine for the price.Ten minute walk to Hammersmith tube station, which is on the district line and takes approx 15 minutes into Embankment and the centre."
44,813,"May 27 2007 	Value for money	We stayed here for 4 nights in May 2007. It is a 7 minute walk from the tube station and a bit more signage would help as it is at the back of a pub, down a lane. It is a modern hotel and the front desk staff was helpfull although busy most of the time. The room were modern and clean but small with the sofa bed in use. The breakfast was reasonable and in the foyer area you could get a beer and play pool. Right in front of the hotel is a pub that has drinks and food specials every night for a good price and quality but can be a little slow. The hotel internet was expense, but they directed you to an internet cafe to the right about a minute away for 1 pound an hour. We travelled for six weeks and this was about the best value for money and I would stay here again."
45,813,"May 17 2007 	Great for the Apollo	This is a great hotel if you are at a gig at the Apollo. We stay there everytime we go. Free continental breakfast too. Loads of cereal and toast and yoghurt, tea, coffee, milk and juice."
46,813,"Apr 23 2007 	Is not worth it	I must admit this hotel is spotless clean,and of course as they emphasis they have powerful shower. The beds are comfortable, the room are a little bit cozy and small.However few drawbacks that really make this stay not worth it at all time.I stayed for almost a weeks in early April.First of all the hotel has very sensitive fire alarm, it sets off twice very early in the morning thoughout my 6nights stay. Once was when some people didnt know their toaster can only put one bread at a time and get too smokey. If only they replace the toaster....Secondly, their staffs are generally very kind, excluding this indian(or pakistan) girl i met (no offence to indians, just so happen this one is indian origin), her name is meena or meana, i can't remember. She gave me the impression she is there to answer phone calls and a few questions, she is not suppose to do anything else due to shortage of manpower. I asked for a replace of boiler, she response LATER(she was busy with other customers). The second time i asked forit she response you really want it now? What the heck is this attitude, i won't ask for it now if i want it to be replaced tomorrow. Then she said is late now, and there are no maintainance fellows in the hotel until tomorrow morning. Can you wait till tomorrow. Of course she didn't do anything the next morning.They have this tv in the room, where you can check you email, by paying around 2-3pounds per hour, but is only for email checking not surfing.Unfortunately the mouse who come with the keyboard don't seems to works. This very nice guy actually replace the keyboard for me very early in the morning when i called the reception around 6a.m. And this guy manage to delete the internet charges from my bills because after replacement of new keyboard, the mouse still doesnt work. There certainly are good people in the hotel, however one evil colleague of them is enough to make my stay.the hotel is about a 15minutes walk from the tube station, is a pleasant walk, but is not convenient enough. If you could find any hotel in zone 1 for 80pounds, then avoid this hotel at all time, unless you are trying to stick with your budget, then this hotel might offer some saving for your trip. however they don't save you money during peak season or if you book direct.The rooms are very noisy every morning when this truck come in to collect some steel container from the next door barHammersmith is a pleasant place to be only if it is good value compared with central london. But avoid this hotel, you dont want to be waken up every other day around 7 am in the morning while people start toasting their bread. Only if their receptionist (meana) are more sensitive than their toaster, i suppose"
47,813,"Apr 13 2007 	Great place to stay	This little gem in Hammersmith is a great alternative to city centre hotels. For a start there's a (small) car park which at only 12 for a 24 hour stay is a bargain but you probably have to get there early to get a space.The hotel is just off the main shopping thoroughfare in Hammersmith but is surprisingly quiet. Our room was clean and fresh with enough room for a small desk area, TV, tea and coffee making gear. We didn't need anything else. There are safe deposit boxes and a vending machine in the ground floor lobby. There is a small bar area with a pool table. Breakfast is of the help yourself continental type (cereal, juices, tea, coffee, cheese, pastries and fruit salads) taken on the ground floor. There's no restaurant but Hammersmith high street is just outside and is full of coffee shops and cafes.The nearest tube is only 5 minutes walk and within 10-15 minutes you can be in Green Park or Piccadilly. All in all I would recommend this hotel for both location and cleanliness and would definitely use it again."
48,813,"Apr 12 2007	Good value for London	Good value for London. Hotel visitors were a mix of business travelers and those on vacation. Rooms and lobby area were very clean. Breakfast Bar was very good- fresh fruits, cereals, breads, yogurt, etc... We also enjoyed the pool table in the bar area. The tube station is down the street, about a 7-8 min walk."
49,813,"Apr 10 2007 	Excellent!	Excellent! I stayed here with my partner and children over the Easter weekend as we'd booked to see Scooby-Doo in the Hammersmth Apollo. Also caught nearby tube to Madam Tussauds, Museums, South bank etc. Staff really friendly and helpfull (especially Laura - a big thanks for sorting out our room) Hotel located next to a cheap Wetherspoons restaurant where we could all eat reasonably. Also visited cinema close to hotel, as we were all too exhausted to do any more walking!Will definately stay again."
50,813,"Feb 18 2007 	Very nice	Stayed with a friend in twin room while partying at Hammersmith Palais.It is a 10 minute walk to the tube station,and 15 minutes to the Palais. It is a very clean hotel, rooms were spotless, and we got it all for 70 through one of the associated web sites that pop up on left of computer screen, it was an american site that was non refundable ( that was why it was such a good deal). Nice Weatherspoons next door, with good pubs and resteraunts on way to Palais. All in all good value ,very efficient, modern and clean. Only a buffett breakfast though, but that is expected at Expess, so cant complain, (I needed a fry up after a big night out!)"
51,813,Feb 17 2007	beware booking process	I should make clear I am not reviewing the hotel itself. For reasons that will become clear we never stayed there.I booked over the internet about a month before the proposed visit in January. I took an offer that was slightly cheaper if you paid there and then. If they gave me a booking reference I failed to note it. I assumed they would send an e-mail with the reference and details. It never arrived.I therefore e-mailed the contact address on the holiday express website asking if they could tell me the booking reference number. They e-mailed back saying they would need the details of which hotel and the date (which I had already given them). I therefore e-mailed those and the response came back that no booking had been made by me of that hotel for the date given.I proceeded therefore on the basis that no booking had been made. As I wanted to stay in London on that night but did not by now have much faith in the Holiday Express booking process I booked somewhere else.Weeks after the visit was complete I received my credit card statement showing they had taken payment. I e-mailed the contact address again asking why this was. They responded on this occasion that I would have to contact Hammersmith direct to ask. This I did. The reservations guy there asked me to send him copies of the e-mails I had before which I did. Eventually however he got in touch to say that he could not refund the money because as far as Hammersmith were concerned the booking was made. He told me to contact Customer Services.By this time I gave up as it was taking up a lot of time and getting me nowhere. The chap in Hammersmith did indicate that I had probably been e-mailing America and also that they did not seem to understand my point when explained by him - which I took to mean that he saw my point.Anyway I did not have the resolve to persevere with this but clearly they should have refunded me this payment. I just therefore wished to warn anyone else booking this hotel that while it may be fine to stay there be careful you do not end up in this booking morass and similarly out of pocket.
52,813,"Jan 26 2007 	Good for exploring London!	Stayed her for 5 nights with my girlfriend to celebrate new years eve 2006/2007! We found that the hotel staff were friendly and helpful, we are from Norway so our english is not the best but they understood!The room was clean and large enough for the two of us. Bathroom was ok! Our room was 340 (I think), and that was a bit noisy, but we were tired from walking all day i London!The next time we travel to London we will find a Hotel closer to central London, but as it was our first time there the hotel was great for exploring! The tube took about 13 minutes to central London."
53,813,"Jan 5 2007 	Great value	This hotel is very clean and comfortable. It is located right near the tube station for Hammersmith and some bus lines that take you to central London, so it is a great location for sightseeing without having to stay in an area that is too crowded with tourists. Taking the underground to the hotel from Heathrow is very easy because they are on the same line.  The rooms are very clean and did not smell like smoke the way many &quot;non-smoking&quot; rooms often can. One thing that detracted from the experience was that even though we reserved a room with a sofa bed and a double on the website, when we arrived we were given a choice of twin or double rooms because we were only 2 to a room and they allocated those rooms to families. So if you book here you may want to call before hand to ensure the specific room you book is what you get. Other than that the staff was very friendly and helpful. The hotel breakfast was awesome, lots of fruit, pastries, and cereal. A very good value at 70 pounds a night including breakfast."
54,813,"Dec 13 2006 	Great for travellers from the West	This is a good Express by Holiday Inn. It's own very small on-site car park make it a good option for travellers from Wales and the West of England, (providing there is a space, it's first come first served). It's about 10 minutes walk from the tube, and you can drive here fairly easily without the headaches of driving in central London. I've stayed here a few times, the last time in August 2006. The rooms have always been clean, staff helpful and continental breakfast as you would expect.The area is fine with lots of drinking and eating options close by.The hotel rates don't seem as good as some of the Express by Holiday Inns in London, and I expect this has much to do with the convenience of the site and the quality of service delivered. This is one of the first hotels I look for when staying in London, and you do seem to need to book early here."
55,813,"Oct 23 2006 	Recommended	Thoroughly recommend using this hotel if visiting London. Accessible tube nearby, quiet street, plenty restaurant choice, polite and friendly staff, spotlessly clean rooms, working (!) air conditioning, etc etc etc. We stayed here with our 2 small children and although the room was cramped with the sofa bed out, we were only really there to sleep.After reading reviews of other hotels and B&amp;Bs on here in the same area, I'm so glad we went here. Worth every penny."
56,813,"Jul 31 2006 	excellent value between heathrow and central london	I paid GBP82 for a room including an excellent continental breakfast. The room, breakfast, and the service exceeded my expectations. The airconditioning worked (it was 36.5 celsius outside), the shower was really a power shower, the room was very tidy and efficiently equipped, the breakfast offerings were plentiful and varied, and the reception at the check in desk friendly and efficient. Plenty of excellent, cheap restaurants around -- check out Sagar for vegetarian south indian cuisine across the road from the hotel on King street. I would definitely go back -- it's a great overnight stopover option en route to Heathrow (only 3 GBP on the Piccadilly line)."
57,813,"Jun 13 2006	Excellent value for money	This is the second time I've stayed in this hotel. On both occasions it has provided the perfect base for exploring London. We managed to get the (double) room for 59 per night, on the internet, a bargain for London. We had to pay to park the car in the secure Hotel car park (24 for 48hrs) but it still worked out less expensive than getting the train, and the Hotel even extended our ticket for an extra 5 hours at no extra charge.The Hotel was clean and bright, the rooms a good size, clean and smart, there's a shower but no bath. The AC in the room was great as the weather was fantastic. The continental breakfast consisted of wide choice of cereals, toast, pastries, hot drinks and juices and was included in the price.The tube links with the city are great, there are 2 stations within walking distance. Unfortunately, the line was closed for maintainance on the Saturday and Sunday but the replacement bus service took us to the next available station and it was fast and efficient there were also plenty of transport advisors around to advise and direct you.There are lots of restaurants in the immediate vicinity, if you don't fancy heading back into the city. We visited Chula which is very close to the Hotel entrance and enjoyed an excellent indian meal, which was very reasonable and a bit different to the usual (sit at the rear, in a booth it's very intimate and authentic). There were some unusual characters on the Hammersmith High street but none of them even looked our way and we never felt intimidated or threatened. Cross the road directly in front of the hotel, up the side street and under the subway and you come to a nice park area where you can have a picnic, or take a right through the park and head for about 1/2 mile to the Old Ship (my friend got married there last year) and enjoy a drink on the Thames....FAB!All in all we had an excellent time and we'll stay there again."
58,813,"Dec 1 2005	Visito to Hammersmith	It was in a perfect location for me as I was visiting the Apollo Theatre nearby. It is very convenient for the tube and its just a short trip into the city centre. Very Clean room and very friendly staff, however it was expensive considering breakfast was not provided. I would return there if I was visiting Hammersmith again"
59,813,"Oct 16 2005	Excellent hotel but not centrally located	This is an excellent, modern hotel. Its disadvantage is that it is located in Hammersmith, which is west of the central part of London. I chose it after carefully considering other reviews of it here and was very pleased with my choice. My room (no. 408) was a single on the 4th of the hotel's 4 floors. It was very modern, with a built-in desk, TV with combination computer terminal and modern tiled bathroom (shower, no bath). It had the largest bed I have ever had in a single. I have stayed in a number of other single rooms in London and Europe, and this was among the roomier ones. The breakfast was ordinary--rolls, juices, coffee and tea. The hotel is located on King St.--actually its entrance sits some way back from the street down an entrance driveway. It is a 10-minute walk to the Hammersmith underground station. King St. is a decidedly downmarket, although bustling, shopping and restaurant street. There are about 5-6 restaurants (including fast food) within 2 blocks and 15-20 within 4 or 5 blocks, although none seemed any more than average. There is a medium-size shopping mall about one block down King St. and another one in the building that houses the Hammersmith underground station. Hammersmith is in underground fare zone 2, which means that an all-day underground ticket costs slightly more than one if you stayed closer to central London in fare zone 1 (most of the attractions in London are in zone 1). It takes about a 20-minute ride to get to the sites in London that most people come to see. Thus, there very much is a tradeoff between the extra time and distance it takes if you stay here versus staying closer to the main part of London--but also involving the reasonable prices and modernity that this hotel offers. I have stayed previously in Bayswater, and it was so nice to be able to leave the hotel there in the morning and just walk to Hyde Park or some other nearby destination (although the hotel room I had there was wretched). Because of that tradeoff, I frankly can't say whetherI would choose Hammersmith or not next time. The hotel staff there was cordial and efficient. In short, very good hotel, not-so-good location. (One further thing: Hammersmith is on the underground line that goes out to Heathrow. That means that coming in from the airport (jet-lagged in my case) it's possible to get off the underground at your hotel stop without having to travel into central London and change to another underground line. A nice little advantage coming and going.)"
60,813,"Jul 26 2005	Holiday Inn Express in Hammersmith London	Funny, I usually dislike &quot;small&quot; and &quot;impersonal,&quot; and the rooms here fit both those adjectives. But I really enjoyed my five-day stay at this HI. The &quot;double&quot; rooms are small, but mine worked fine for me when I was alone. My wife joined me for my last night, and -- yeah -- that was pretty crowded. But the first four nights were fine. The rooms are well designed and efficient: a sofa, a good desk, and a comfortable bed. Everything worked, including the air conditioning (and it was in the 90's F outside). There's also a high-speed Internet connection, which is why I stayed there in the first place ... but the two I'net cafes across the street offer much cheaper connectivity. Within a few hundred yards (or meters) of the lobby, you have several good Indian, Thai, and Japanese restaurants ... a Radio-Shack knockoff ... a big grocery store ... liquor stores ... a computer store ... etc. And you're only a half-km from the Hammersmith tube station."
61,813,"Apr 5 2005	Very Enjoyable Stay	My wife, myself and our 6yr old daughter stayed here for two nights in April. All I can say is we would not hesitate to use this hotel again. I could not agree more with the previous reviews, our room was spotless as was all other areas within the hotel.The staff were very friendly and helpfull and our continental breakfast (included in the price) was well presented, fresh and plentyful."
