IDREVIEW,HOTELID,REVIEW
310,1210,"Nov 22 2007 	Perfect location BUT...	This is my last hour in Cumberland. My company travel agent booked this hotel for me for the nights 20-22 November. Let me just say that there is a reason why the hotel is ranked 301 in TripAdvisor.The location is perfect, perfect, perfect - for shopping, sightseeing, business. Now the rooms... Well, my company has booked a single for me, but I dreaded even seeing it, so I upgraded to what they called a Deluxe Double with inside view on the 8th floor for 30 per night more. Unfortunately it was a smoking room, and despite being quite tolerant to smoke and smokers I just couldn't stand it. Besides, the room view was hideous, actually facing the hotel's other wing. The bathroom was a cell. I called reception and asked for another room, and they informed me that I only had the option of one Deluxe King in the 4th floor with Park view - it seemed perfect, but of course it came with an additional 25 per night [actually they said 20 over the phone, 25 afterwards at reception, but anyway...]. The room was only slightly bigger, and the view was much improved, giving out to the corner of Marble Arch and Hyde Park. Bathroom a bit bigger this time - however I had some serious struggle turning on the shower. Well the bed that was supposed to be king size, was basically 2 mattresses united [god, I always hate that], which perhaps may be convenient for 2 persons. Mattreses OK, pillows average. There was also a huge LCD TV in the room, with lousy reception though. Internet at least came for free - well, wired Internet of course; wireless had to be paid for. Mow, you must understand that you are not going to a boutique hotel - this hotel is huge, I almost got lost finding my room. The breakfast area, well... I was lucky to find a table rightaway [I was one person after all], but I saw people queueing up for a lot of time. And the vast breakfast area, extremely busy and noisy just didn't do it for me. Perhaps if I was with other 3 or 4 friends I wouldn't have minded... Next breakfast I took in my room without extra thought. Only, it seemed that they didn't pass by my room to collect my In-room Breakfast menu and I had to phone them up on the spot in the morning. In-room breakfast was extremely poor, and they charged me 11,25 supplement!!! Room service menu, average to boring-to-death, and breathtakingly expensive.They also charged a 10 guarantee for the adaptor. Well, it just seems that I will have to do some serious checking up in my credit card charges...The hotel staff was very nice, polite and friendly.All in all, I don't quite see why spend so much money on a room in this hotel, that is not fantastic but just happens to be in a fantastic location. Checking their web-site, I think the rate for my room is around 225 quid, which is a ridiculously expensive price... Will I go there again? Hmmm, I don't know; if I had to pay for it on my own, I wouldn't. But again on a business trip, I might consider it, given the location alone; but I would certainly give some priority to other hotels..."
311,1210,Nov 19 2007 	Fantastic hotel	We had a triple room at the Cumberland which was an executive twin with a third bed added. Even with this extra space taken up the room was still spacious.We ate at the Gary Rhodes brasserie and the meal was fantastic and very reasonably priced. Yes the drinks in the bar were expensive but this is the same in all London hotels!A couple of lifts were broken on the Sunday which caused a few problems but nothing more than waiting 5 mins for a lift - it's only a problem if you're inpatient and want everything now!There were queues to be seated for breakfast on a morning but this queue moved quickly and once allocated to our table the queues for the actual food were 5 people long max.I had read lots of negative reviews before my stay so was a little apprehensive but we had a fantasic weekend and the staff could not do enough to help.Will definitely stay here again.
312,1210,"Nov 19 2007 	OK for 1 night	We were originally booked into the Park Plaza County Hall but as it had not opened, were booked into the Cumberland by them and charged the same rate 75 per room plus VAT. Room was clean and quiet with a shower but no bath and Elmis toiletries. Did'nt eat in the hotel but thought the price of drinks in the bar was very high. Reception staff polite and friendly. But, there are not enough lifts. On Sunday morning loads of coach parties were leaving at the same time and you could'nt get a lift. So everyone was pouring down the stairs. OK for us with one small bag but not so good for other people."
313,1210,"Nov 13 2007 	Fantastic!!	I booked this hotel through Top Secret Hotels - I'd worked out which hotel it was prior to booking due to the restaurant description (Gary Rhodes W1) so I was able to check previous reviews on Trip ad before booking......I'm so glad all the negativity didn't put me off.....It was the pictures of the lobby and the ideal location that made me proceed with my booking.....And I'm so glad I did!We only stayed one night so we didn't really get chance to explore the whole hotel (Especially as I ended up in a wheel chair at 9pm due to a bad fall elsewhere!)Although our room was on the small side, it had all the amenities that we required - the bed was lovely and comfortable, tv a good size, complimentry toiletries 'Molton Brown!' and a lovely power shower - what more does one need.This hotel doesn't pretend to be 5*, it just prides itself on being a damn good 4*!The carbon bar is fun, funky and welcoming!The staff couldn't have been anymore helpful - and in contrast to some other reviews... our check-in was the quickest ever - 1 min checking in and one of the concierge checked us out so we could just head straight off!Loved it so much we've booked again for 3 weeks time!"
314,1210,"Nov 10 2007	Great Location	Was nervous when booking this hotel but knew the location would be worth it. Right at the top of Oxford St and directly above Marble Arch Tube Station. Could not have been better. People on this site have moaned about the size of the rooms, well their not massive but fine for 2 people if your in and out during the day. How long do you spend in your room anyway?! Beds comfy, good shower ( did flood the bathroom though ) Breakfast was good, did'nt like the long line ( like a school canteen ) . Theres a Pret next door if your room only. Great modern lobby. Just shop around for a good deal - they can be had."
315,1210,Nov 6 2007 	A little impersonal	The hotel on arrival looks very clinical. A large modern lobby that is very noisey and the check in was problematic as reception could not find our details. The room was ok and dispite having to line up for breakfast it was well worth the wait. Not sure if i would choose this hotel again.
316,1210,Nov 5 2007 	Terrible	The room was okay (although there was some noice of fans and the Urban Disco). But I have a TERRIBLE experience with them. Credit-cards are not working. After that a double charge was done and NO-ONE is responding on my emails and even on my phone calls. NOTHING IS BEING DONE ABOUT IT.Due to this issues with the hotel I had a very unpleasant stay in London and big trouble on getting home! Thank you folks.So the service you get is far below any decent behaviour! Price is much to high. AVOID THIS HOTEL!
317,1210,"Nov 4 2007	worst deal ON EARTH - never stay here!!!	Worst deal on earth!!!Never stay in this hotel!!!! It's expensive, service id TERRIBLE, rooms are ridicusly small...smaller than in a hostel...and I payed 600 dollars for my room!!! didn't even have a tub. lobby is nice and moder but more crowded than paddington station...so you have to wait 30 minutes evertime you need to ask a question...and don't even try the room ohone...because they put you onhold forever. I travel for business 30% on my time nd I never stayed in such an small, run down and expesive rom in my life!!!"
318,1210,"Nov 2 2007 	loved the cumberland!!!!!!	absolutely loved this hotel! where do i start? the hotel is lovely, the reception is absolutely stunning. I'd called the hotel before our arrival asking for a room upgrade after reading reviews on this site. Definatly worth while, our room was lovely. Large,airy and modern. Only complaint that it is slightly noisy at nite, but you cant forget your in central london! the location of the hotel is brilliant! right next to the tube... brill! i've read complaints of this hotel about the foreign employees of the hotel, although they did seem a bit abrupt at times i found them efficient enough! try Carbon the bar/club by the hotel, really good nite out!!would definatly recommend this hotel to others, but from reading the other reviews i would definatly advise to ask for an upgrade!"
319,1210,"Oct 25 2007 	Down the tubes	I have been staying at the Cumberland on trips to London for the last 10 years. The hotel was getting a bit tired prior to the Guoman makeover. What an improvement I thought then. However the standards have consistently deteriorated since. There are no English staff left. Most of the current staff struggle with English and service standards are just appalling. The customer profile has changed accordingly.After scores of nights spent there in the last decade, they have seen the last of me."
320,1210,"Oct 24 2007	overpriced and not a quality hotel	service is appalling, receptionist more interest in answering telephones than booking in guests,i had to wait 10 minutes while the receptionist was on the phone. This happened twice in two days. Room i booked was a double room the staff gave me a box room with a double bed! than they gave me a room which was bigger however it had stain floor carpets rattling window which let in cold air even when it was closed.There were stains on the wall and in the bathroom wall. The heating could not be switched on. when i got the heating fan to work with instuctions from the hotel repairman it still blew out cold air. i used the hair dryer to warm the room. The shower cubicle door would not close when the shower was running. The shower mixer tap started at a cold position and closed at the cold position. so when you turn the shower on you are gauranteed to have cold freezing water hit you!!. even though i managed to get a better room for the next two nights i would not use or pay extortionist amount of money for a third class hotel providing third class accommadation and service DO NOT BE MISLED BY THE PHOTOGRAPHS ON THE INTERNET!!"
321,1210,"Oct 24 2007 	Meh.	The Cumberland looks good on the outside, but has some flaws on the inside. It is in a great location - close to a Pret a Manger and a Sainsbury Express, close to Marble Arch tube and 5 mins from Marks and Spencer! There typically was someone to meet you at the front door. We too were told that our room wasn't ready after arrving from an overnight flight - we ended up giving up a more upgraded suite to get one immediately. We were fine with this.I had written an email ahead of time to make sure that they had our rez and that it was a twin room. It was my mother's birthday and to my surprise after our original arrival, we came back to find chocolates and a bottle of wine! so nice right? WRONG - they tried to charge my mother for the bottle of wine when she checked out - she put her foot down and made sure that the changes were made on the bill.The staff there definately have below average language skills, it was hard to understand a lot of them. they try, but just don't cut the mustard. The line up for breakfast was atrocious - we didn't even bother. The lobby is visually stunning and the restaurant is allegedly very well regarded (some fancy english chef runs it). However, the hallways in the hotel look like they were abandoned dorm rooms that got a lick of paint and night club lighting. Our room was a good size with comfortable beds. The shower was a bit tricky and slippery but we managed. The cleaning staff did a great job. Overall it is a decent hotel, but I wouldn't stay there again. We have stayed at the Trafalgar before which is smaller but far superior. We have also stayed at the Thistle Charing Cross which we wouldnt stay at again either (it is not nearly as nice as this hotel)."
322,1210,"Oct 22 2007 	Positive experience	I was quite hesitant at staying at The Cumberland due some of the negative reviews that I had read by other travellers. However my recent stay there was a positive experience. True, on arrival I was told room was not available, but I got there at 10.30 am and it is common policy in hotels worldwide that check-in is in the afternoon. However, I was soon accommodated in a decently sized room on the second floor overlooking Oxford Street - and no, it was definitely not noisy at all considering I was so 'close' to such a busy road!Decor is ultra-modern and might not be pleasing for more conventional minded people, especially lobby, which is large and a bit bare. However, the furnishings in room were well thought out. Shower was enormous and enclosed with glass doors - a positive break from the shower curtains one still finds in some hotels which just stick to you no matter what! The only drawback was that you had to get partially wet to turn on the water tap.My only complaint is that my shower cap kept disappearing each day and was never replaced thus would have to ring housekeeping to be brought another one - but these obliged with a replacement without delay.All staff with whom I came in contact were very helpful, and breakfast was quite good although not particularly bountiful. But still, the location of the hotel makes up for any minor shortcomings that it had.Good thing I was not that much influenced by the negative reviews and changed hotels. Looking up hotel reviews is good, thus one would get different opinions, but I think that these are to be used more as a guide since ultimately, it all depends on the expectations of the individual traveller."
323,1210,"Oct 18 2007	Be very Wary of the Cumberland Hotel	I had such a disturbing experience at this hotel I would never recommend it to anyone. I arrived around 11.00 in the morning for a 2 night stay and no rooms were available which is not unusual. I had got a &quot;special&quot; rate for the room of 300 for the two nights. The attendant was from Eastern Europe and his English was so-so. I asked if any other rooms were available and whether I could upgrade. They only had a suite and he said that the rate was 275 a night. I thought about it for a while and in the end I thought what the heck - I had been travelling for 12 hours to get to London and was exhausted. So, I double checked and asked him: So the total will be 550. He said &quot;Yes&quot;. When I come to check out, I look at my bill and it shows the room charge as 850. I ask her what is going on and the young girl says this is the rate. I tried to explain to her that the total was 550 but she kept talking over me and saying that that amount was the upgrade fee. I explained to her that I would never agree to go from 150 to 425 a night and that this was not explained to me at the time. She was like &quot;There is nothing I can do&quot;. Finally I had to lose my temper and made her get the supervisor on the phone. After a lot of back and forth, it was agreed that the total would be 550. I had had a taxi waiting for 15 mins by this point and so I put a line through the 550 upgrade charge, wrote 550 in total and signed the hotel sheet. She did not make me sign my Credit card receipt as they dont seem to do this anymore, just the hotel sheet. I ran off as the taxi driver was threatening to leave. When i get my credit card statement - guess what?! The 850 was charged. Furious I tried to speak to 3-4 people about this and got NOWHERE. Every time I asked for someone to call me back, they promised but did not. What a joke! Avoid the Cumberland Hotel - they are theives!"
324,1210,"Oct 17 2007 	Over-priced room	I booked the Cumberland for an anniversary weekend in London with my husband. I looked at the pictures online on the hotels own site and also on expedia. It looked lovely, trendy and modern. The entrance to the hotel was fabulous. The check-in staff were cheery and helpful. Everything was going well until we were given the key to the room and we started the treasure hunt to find it! The directions to the room were so complicated that we had to ask several people before we could find it. In order to get to our room we have to go down 1 flight of stairs, up one floor in a lift and then down another floor in another lift.....quite incredible! It turned up we were actually in the building across the street from the main building. We were upgraded to a de-luxe king so I was excited to see what the room would be like. Upon entering the room I could tell it was anything but deluxe. The funiture was modern which I guess is the reason they called it deluxe. It looked like it had been furnished from Ikea. There was a huge pillar in the middle of the room which prevented you from getting inside the wardrobe. We had a wall outside our window so you had a feeling of being trapped in a basement. The bathroom was modern again but the door to the shower did not close properly and you had to go in the shower to put it on meaning you had to soak yourself with cold water! The bed was comfortable that is the only positive thing I can say. We ate in the Gary Rhodes Brasserie was was lovely but expensive. We also had coffees in the Kau lounge which were 3.50 each plus a 12.5% service charge....so it is not cheap! Would I stay there again......no, never!"
325,1210,"Oct 15 2007 	Canteen Breakfast	I agree with all other reviewers who write about the poor standard of what are meant to be de-luxe rooms. The price we paid for b&amp;B was 232.00 and the room was just an average standard room. I rang down to complain and was offered another room on the next floor which was bigger and a little more decorative, but still nothing like the pictures on their website. As for breakfast, served in the aptly named Market, it was like a school canteen, with formica topped tables and tea or coffee served by a roving waitress from a vacuum flask!. Definately not a 4* experience. A vastly over-rated hotel. Would not go again."
326,1210,"Oct 9 2007 	Ok but problems !	Well booked direct with the hotel groups reservation line and got a good deal, better than the hotel web site and other usual on line hotel web sites so good price for a hotel in this location.Hotel is massive ! not easy to navigate around, poor signage bt got there in the end.Very friendly and eager to please on checking in, room okay. modern and fine. had to specify bath so be carefull..Now the problem ! the hotel has in its wisdom opened a night club called &quot;carbon&quot; in the basement or lower ground floor ! ALERT!!!!!! which shuts on a saturday at 3am ! our hotel window was 4 floors directly above the entrance ! no more of an explanation required ! could hear every tune and all the drunkards being kicked out at 3am ! The hotel has a seperate block which i found out after so stay there or go to the club yourself ! The funny thing was they even leave a flier on your pillow for the nightclub ! Also the other problem was breakfast ! , no problem with the actual breakfast which was plentiful and quite good actually BUT the queue on sunday morning was huge ! half an hour to get a table ! shame it was spoilt by these two faults as otherwise was fine..."
327,1210,"Oct 6 2007	Not impressed	Stayed at The Cumberland on business and was not impressed from the moment I entered the hotel. Lots of small, but unacceptable points made for an unsatisfying stay at this hotel.- Most of the staff were incredibly rude, unhelpful and dismissive.- The room itself was fine but really small.- Somebody walked into my room at 6pm at night (as I was just getting out of the shower!). This also happened to a colleague who was staying too.- Drinks are ridiculously expensive.- Corridoors were unclean (e.g. there were chicken bones, I imagine left from dinner service, lying on the carpet outside of my room)- Every time I went to my room the key didn't work, so I had to go back down to reception to ask them to reactivate it.I think what was most annoying was the attitude of staff to any questions, concerns etc. It's a shame as the hotel is in a good location for Oxford Street etc., but I won't be staying there again."
328,1210,"Oct 6 2007 	Great Location...	Not really sure why people feel the need to complain about the smallest of things. e.g yes the drinks are expensive in the hotel, but are drinks not expensive in all hotels?? my hotel room was lovely, very comfy pillows on the bed, full size mirror and gorgeous bathroom, with a wonderful view of... pipes and a roof!! nice, but i wouldn't say i would feel the need to complain who goes to london to look out the window!! the hotel room has a hairdryer, ironing board, fridge, safety deposit box and kettle!! hotel has a big open lobby with lights that change colours thoughout the day and smells lovely! alot of people seem to have a promblem with the staff and did not find them helpfull, i found the staff very helpfull considaring i left my mobile there, they found it for me and sent it to my home address.hotel is in good location for shopping and hyde park but not really for nightlife, but whats the harm in a long walk!! Would i stay here again?? Oh Yes!"
329,1210,"Sep 25 2007 	Loved The Cumberland!	We booked the Cumberland at the last minute after a disappointment at another hotel. The Cumberland did not disappoint. The staff were eficient and friendly. The room was very comfortable (with a huge plasma tv) and one of the comfiest beds i have ever slept in! The location is excellent, next to Marbel Arch tube, and many bus routes just outside the door. very convenient for shopping in Oxford Street and Regent St. i would advise anyone visiting to make good use of the efficient and inexpensive buses as well as the Tube.Also - if you can afford a room with a view of Marble Arch and Hyde Park, it's worth the extra!"
330,1210,"Sep 23 2007 	Loved Cumberland on Marble Arch Oxford Street	Really liked Cumberland hotel for its ideal location right on Oxford Street. I stayed there for one week with my partner and really enjoyed our stay over there. It is close to many nice places e.g. Oxford Street, Bond Street, Regent Street and Picadilly. Underground stop Marble Arch is right next to the hotel. The room was spacious and very nice. Decor was scandinavian. The bathroom was excellent. Staff was very nice. Celebrated new year night and walked from there to London Eye. Had a night to remember with my partner. Booked online and in two months in advance and got incredibly good rate. Would love to go there again.Cheers"
331,1210,"Sep 15 2007 	Mixed Feelings About The Cumberland Hotel	Just returned from The Cumberland Hotel today.Great location to Oxford street and to all areas in London via tube. Large hotel which is modern in style and appealing to large corporate parties and conferences. Plenty of staff to cater for the large number of clients staying at the hotel and they deliver the services quite satisfactory however do not expect a personal service as they will never know who you are, where you are from etc...this is not a bouqitue hotel with service second to none...you are just a room number!We were upgraded to a king size room (which we were very happy about) however it was in the building next door and throughout our two night stay the same bed linen that was from our room previously (from the guests who stayed in the room before us) was left at our front door and everytime we went to our room we stumbled upon it all the time. We gave them 24 hours to remove it (more than fair) however they did not have the initiative to do so so we asked at reception for it to be disposed of and it was....to the outside of the room across the corrindor from us...Do I need to say anything more????"
332,1210,Sep 13 2007	Lovely hotel	The hotel is lovey and our stay in the end was lovely. I booked through Last Minute and on arrival at the hotel they told me that they did not have my booking. After 45 mins of stress i finaly spoke to a man on the front desk who was very helpful and upgraded us for free (as i had already paid in full through last minute). The room we had was lovely and very very quiet. It made our stay more enjoable becaue of the upgrade and because of that it worked out as good value. The hotel is really expense though and for a shot of spirit we paid 7!!!!! Dont drink there would be my only advise. But it is a lovely hotel and i would recommend it.
333,1210,Sep 10 2007	terrible service for guests with disabilities	i have just returned after a very stressful stay at the cumberland. the hotel is in a great location and is very trendy inside the lobby plus it smells gorgeous.however i was a companion to a patient of mine who was in a wheelchair and we were told our room would be ready at 12pm which it was but it had a double instead of twin bed! it then took 4hours and 20 mins and 2 other rooms to eventually get a room with twin beds.we had just 10 mins to get ready for our night down the west end.when we got back our room was across from a casino/nightclub so we hardly slept due to the noise.i did not find one fluent english speaking national in the hotel and i found the level of service to be very poor.the breakfast was amazing in the morning with lots of choices.i feel disappointed that despite careful planning and advance communication that the hotel could not provide a twin room and that it took a long time to rectify the situation with poor attitude and understanding from staff.unfortunately my patient will probably never be able to go to london again so i feel angry that we spent most of an afternoon trying to get a room with twin beds.
