IDREVIEW,HOTELID,REVIEW
123,2174,"Nov 23 2008 	Wonderful respite on top of Nob Hill	I am a fan of Fairmonts in general, and though the brand is not absolutely consistent, it has often delivered high quality service and physical facilities. The Fairmont SFO is no exception. A very nice property and generally courteous and professional service.Location is great. It's right on top of Nob Hill, so the view is quite spectacular. I was in the Tower, and my room had a harbour view, which means I could see Alcatraz from my room. At night the lights of the city below are quite enticing.I was in SFO for business in the Union Square area, which is only a quarter of a mile from the hotel. But because the hotel is up on the hill, it's away from the noise and crowds below. I consider the location of the Fairmont to be ideal -- close enough to things but a place to escape to after.But it's on a hill. A steep one to boot. I like walking, but still going up gets tough especially if you do it two or three times a day. Of course you can also do the cable car, or take a cab. But I thought the walk would do me good after all the nice good in the city.The room is spacious. It's called a deluxe room in the Tower. Marble bathroom. Separate shower and tub. Miller Harris toliteries as usual. Bathrobes, etc.Large Flat screen TV, though reception is a bit iffy. No stereo equipment, other than an IPOD docking station/alarm clock. No coffee/tea making equipment in the room -- this is disappointment, since I have always enjoyed a cup of their nice Fairmont selection of teas in my rooms.Electronic safe in room, which is very nice. A/C works, if not extremely powerful, it is effective enough. Good closet space, though if you have a lot of overcoats etc it may become a bit cramped.Room in very good condition. I encountered none of the worn out conditions that some other reviewers mentioned. As is, my room, at least, does not even need a reno job. It's nice enough for a Fairmont.Breakfast in the Laurel Court. It's included in my rate. Very wide selection of foods for breakfast buffet. $28 per person. Given what's available and the quality, it's a bargain. I did not have other meals at the hotel.The lobby is probably the grandest part of the hotel. Impressive.All in all, a very nice hotel. If I go back to SFO, I'll definitely check out this hotel first."
124,2174,"Nov 18 2008 	Kind of Oldish	I like Fairmont hotels. This was not my favorite. The hotel seemed in need of a remodel. We had a suite which was nice and clean, but the bathroom had mold in it. I think that is just not good when you are staying somewhere to see mold and mildew. We had a nice balcony. The food was pretty bad and the selection of restaurants were even worse. The location was good and central. I stayed here to attend a wedding so it served its purpose."
125,2174,"Nov 14 2008	really fullfilled expectations	Terrible flight from the UK, really tired. Took a shared shuttle and was last to be dropped off. And what a lovely surprise to see this wonderful hotel.My room was adequate and olde world as well as quiet and i really needed to sleep. However I was disppointed that there was no tea or coffee facility.Room service was extortionate so I just slept. The next day I found a really good cafe in the basement which i could get to by a back lift. They do great coffee and fruit salad which is a great alternative to the divine experience which is the Fairmont buffet breakfast. This was the greatest breakfast I have ever had to pleasure to devour.The concierge was helpful and a little dismissive., he had no great recommendations. The hotel felt like a refuge where I was safe and well looked after and it was central for galleries, shops,markets and other restaurants. It was wonderful and I would love to return one day with my partner for a romantic rendezvous."
126,2174,"Nov 10 2008 	Classy Old Dame that sits on the top of Nob Hill	We (family of four) stayed at the wonderful Fairmont at the end of October 08,We got a super deal through Hotels.com but took the (non pushy)receptionists advice about upgrading our rooms.She was very helpful (I can't recall her name but I do recall she was in a Witches costume for Halloween!) and upgraded our boys to the 4th floor in the tower without charge and charged us $60 per night upgrade to the 20th floor in the tower which gave us breathtaking views of San Fran Bay/Alcatraz/The Golden Gate Bridge, a treat not to be missed!From the time that our taxi pulled up at the front door we really felt like we were truly appreciated as Guests by all the Hotel Staff,the wonderful classical Hotel reception is a very welcome alternative to today's modern hotels where one hotel is just like the last one you stayed in ,this beautiful building is exceptional and full of history, you will have great fun in reading the captions under the photographs that line the corridors, this all adds to the uniqueness of the Fairmont.!While the building is really wonderful it would be nothing without the exceptional staff."
127,2174,"Nov 8 2008 	The ""Queen of Nob Hill"" Continues to Reign	My partner and I stayed at the Fairmont SF over Halloween weekend and both of us couldn't be more pleased with our experience. I personally have stayed at the Fairmont multiple times prior, but the last time was 6 years ago, so this experience seemed new to me as well. Everything and everyone we encountered at the Fairmont was first class. The timeless elegance of the Grand Lobby envelopes you in opulence without feeling stiff or too cold. Our arrival was processed swiftly and efficiently and we were ensconced in our room with our luggage within 10 minutes of walking through the doors, even though we arrived over 2 hours prior to the official check in time. I'm a member of the President's Club, so we were upgraded without asking to a corner room on the 9th floor of the Tower Building, which was just fine with us. I personally would rather have the breathtaking views of the Bay and Coit Tower out of one set of windows and the SOMA district out of the others. The concierge was extremely attentive and helpful with every request as were the room service attendants that we came in contact with. The hotel is located in a great location to traverse the city via any of the many forms of public transit available. The Fairmont truly is a wonderful hotel to stay at whether it be for a special occasion or just a &quot;get away from it all&quot; weekend. I cannot recommend it highly enough. We will surely be returning here when we come back to beautiful San Francisco again."
128,2174,"Nov 4 2008 	Great Stay	We have booked The Fairmount hotel through travel agent, she got us a great deal for a standard room. Upon arrival hotel staff upgraded it for a room in the tower. the room was great with magnificent veiw of the bay, the only problem was they gave us the smoking room, we both non-smokers so the smell was unbearable. We asked them to change the room but hotel was completly booked, so they offer us the air cleaning machine and let us run it for the entire lenght of the trip, which was very nice of them. Its a great historic hotel with a very beatiful lobby, the cafe downstaris have the best coffe and crossants. i whould stay here again but I whould wait for a deal."
129,2174,"Oct 26 2008 	Unbelievable Stay	We got an unbelievable deal through Travelzoo.com for $179/night...which ended up including the best breakfast buffet I have ever had....french toast with bananas foster for topping, eggs benedict, omelette station, etc. Basically I feel like I got the room for free. They upgraded us to suite 715 upon our late arrival...for free as I had joined their rewards club when I originally booked the hotel a few months ago. All of the staff was very nice. I had no complaints at all. I would surely go back. And the lobby was beautiful. Excellent stay."
130,2174,"Oct 25 2008 	Best Spot to Stay in San Francisco	San Francisco is a great city with so much going for it one doesn't always focus on where they stay. However this year I found the best!! deal on expedia that introduced us to the Fairmont on Nob Hill. The locaion of the hotel might deter some as you are always climbing back up the hill to get home. However we love walking so that was a bonus and it is central to everywhere. The beautiful lobby provides a tremendous first impression to this historical hotel. Our room faced an inner court with no view but the room was extremely well decorated, meticulously cleaned , well equipped with anything you needed and quiet. We have travelled to this city many times and love it. The people are friendly and the staff of this hotel were no exeption they were tremendous. A hint for breakfast - great coffee in the downstairs small cafe by the cable car stop (busy but worth the wait for the coffee). Saturday morning you can walk down to the market - it was wonderful. Lots of great restaurants close by.Highly recommend this hotel!"
131,2174,"Oct 23 2008 	Great Base for San Fran--Parking is OUTRAGEOUS!	The Fairmont is a gorgeous historic property. We had a room on the second floor (though I requested higher floor) with a king bed and a view of the financial district. Our bed was comfy and the room felt pretty spacious. Bathroom was nice with Miller Harris toiletries! There may have been A/C in the room, but we could not tell if it was working. Fortunately, it was not too hot in SanFran while we were there...if we wanted to open our windows to the breeze (which, surprisingly, we could do on the second floor--no screens or bars!), we also had to listen to the trolley bells until about midnight as well as traffic. Beware that the valet parking costs $50 a night! With taxes, it came to about $64/night--absolutely outrageous! We normally don't have a car with us in the city, as we prefer to take taxis and walk everywhere, but we had been traveling south of the city before this and decided to just keep the car until going back to the airport. In other words, we paid $64/night to park our car and still paid to take taxis to dinner, etc. Do yourself a favor if you're staying within the city proper--don't rent a car! If you decide to venture out of the city for a day, rent a car from one of the &quot;city&quot; locations and return it the same afternoon. If you do have to drive in, the garage around the corner charges the same, so don't even bother looking elsewhere, you are a captive audience. Also, we noticed that the staff (and even the concierge) did not seem to have very strong opinions about the best places to dine or go for nightlife. We had done some preliminary research on Zagat and Citysearch, so had a fair idea of what we wanted, but when we had had enough fine dining and we were looking for a good &quot;local's&quot; perspective on a place to grab a good burger and a decent draft beer, they looked at us like we were aliens. For the pleasure of staying in a great location (be prepared for the &quot;hike&quot; back up the hill from anywhere you go--the way out is easy, the way back is EXERCISE!) with elegant surroundings, if you can get a good price in pricey SanFran, the Fairmont is a good deal (we got a corporate rate) and a memorable property. From a service standpoint, however, we were not really impressed and would not have paid full price for this experience."
132,2174,"Oct 22 2008	Beautiful!	This hotel is big and grand and has ornate features and an old charming style. Some peices throughout (wall paper, furniture) could use and update but overall it's really a great property. The location at the top of Nob Hill is nice - those hills really get you when you're walking up though! The Crown Room at the top of the hotel has amazing views of the whole city. Bathrooms are small, lots of rooms have just one double or queen size bed, there are nice flat screen tv's and bose radios and the suite I had had a huge balcony with lots of furniture which was great to relax on. I would definitley return."
133,2174,"Oct 5 2008 	Perfect Hotel	We stayed at the Fairmont for four nights as part of our honeymoon and had a fantastic time. The Fairmont is a fab hotel, historic, beautiful decor, great food and great location. It has all of these without being pretentious. The staff there are exteremely helpful and professional and add to the lovely atmosphere of the hotel. A tip for a bit of fun is book a meal in the The Tonga Restaurant in the hotel, beautiful thai food with a rainstorm about every half hour!! All ages will enjoy this. The location is also perfect as the cable cars stop directly outside the hotel so if you don't fancy the hills this will make life easier. Next time I am in San Fran I will most definitely stay in The Fairmont."
134,2174,"Oct 4 2008 	Excellent but...	Superb, characterful hotel - old, but refurbished in style. I agree with other comments that the lobby is stunning but this is not continued throughout. The room was very good with huge, comfortable bed, desk and a couple of armchairs. Bathroom was very nice but small. Soundproofing was definitely a problem - both out to the hallway and between rooms. Breakfast was included in our deal and was to a very high standard, although as mentioned elsewhere, it did feel a little formal. Parking was $50 + tax/day! If you can afford to eat in I'm sure it would be very nice, but for the rest of us go to Fisherman's Wharf, Pier 39 and sit down at the Pier Market. Wonderful, fresh food at a reasonable cost"
135,2174,"Oct 3 2008	Very nice!	Warning; They charge an extortionate Daily parking fee of $50 plus 14% tax so beware. Checking in slow but very friendly and with an exceptional lobby area. Rooms are as you would expect for a 5* hotel with the added luxury of what I can only describe as a sumptuous bed.On the negative side being an old building you can easily hear people through the corridors and with the obligatory loud American voice especially at 6am it can get very frustrating, oh and did I mention the parking fee of $50 a day? Other than that well worth a stay.I must recommend to eat at Davids Deli just down the road on Geary Street. For lunch a little expensive but superb, and for dinner THE PIER MARKET on pier 39 does excellent reasonably priced fish."
136,2174,"Oct 1 2008 	If this is #30 - Can't Imagine The Other 29	Fellow Travellers,Fairmont in San Fran was the last stop on our 5 hotel trip in California (1. Fairmont Miramar, 2. Inn of the Spanish Garden, 3. Intercontinental The Clement, 4. Napa Valley Lodge).First off, the Fairmont holds arguably one of the better locations in the city, right atop Nob Hill - great unless you have to walk up this hill a few times. So my first suggestion is to get a 3-day (or however many days your staying) pass for all transit and use it! It will save your feet. Two major cable car lines go right past the hotel.The hotel is certianly one of the most historic in San Fran, and the walls inside are fairly tastefully plastered with lots of memorabilia to remind you of this.The lobby is quite spectacular, with tons of marble and seating, all very old world style. Staff were wonderful with one notable exception - Rick. Rick was completely unhelpful both times I had the misfortune of trying to seek assistance at the front desk. Just avoid him and you will be fine!We initially had a room on the 14th floor, and the staff was happy to move us up to the top floor (23) the next day - so we had a spectacular view of the bay, including Alcatraz and the bridge.The Tower room was very nice, well kept with spacious bathroom completely swathed in marble. Seperate tub and glass shower - all the amenities you would expect.Beds exceptionally comfortable, staff all great (except Rick) and great location made for a memorable stay. Since I have a corporate rate, and also Fairmont President Club status was able to get an upgrade at a great price. Highly recommend the Fairmont President Club - one of the best in the industry in my humble opinion - and only 5 stays to get Gold status! This is nothing for business travellers.Would definitely stay here again. Only downside is, as with most large hotels, the price of food onsite is outrageous. I used my $50 food certificate for breakfast on the last day, and that did not even cover the full cost!! I have no problem paying $200- $300 for a great dinner at a top scale restaurent, but the idea of paying $60 for breakfast just spins me around. You can get a perfectly good breakfast sandwich, with large latte at Starbucks for $6.50. Nothing justifes 10x that.Wonderful historic hotel, great location (despite the climb to get there), great staff (except Rick), wonderful room and bath - no problem recommending this hotel. It should be higher on the list - in Top 15 I would think. Wish I had the time and money to hit the otgher 30 San Francisco hotels if they are all BETTER than the Fairmont - that would be something.End of hotels reviews for this trip (whew!), but now I have like twice as many restaurent reviews to write. All for a good cause fellow travellers."
137,2174,Sep 24 2008 	Great Hotel	Our room was huge and very nice. The view was great. The staff were very nice and treated us great! I was surprised how well kept the hotel was for its age. I would not hesitate to stay again. Great location too!
138,2174,"Sep 9 2008 	The Fairmont SF is a Historical Wonder!	First and foremost, we got an amazing deal via hotels.com for about $200 a night for a 800 sq ft, 2 room suite - THE LUXOUMBERG SUITE. I went to the Fairmont website to see what these rooms would have been if I booked direct and it was a whopping $550 a night. We were in the Main Building and I would have loved the views from the new tower, but what it lacked in views it made up in style, comfort and amenities. Just wandering the hotel, you get this great feeling of oppulance, history, and wealth. I heard some weird fact that every US President from FDR that has visited SF has always stayed in the Fairmont. I can certainly see why. The lobby is not trendy, or sexy, but it is grand and full of the finest marble. There must be 15 different little couch areas to just to sit with a drink or wait for someone. Please promise me you will visit the in-house TONGA ROOM bar and restaurant, at least for a drink. It's quite a scene! Great place to have a Mai Tai before you head out. There is this feature where they make it rain and a band plays on a moving boat. I felt like I was really in Tahiti. (even though I had never been) Also worth a drink is the Top of the Mark Bar and Lounge right across the street in the Intercontinental hotel. One minute I had amazing views of all of SF, and the next minute we were encompassed in fog. Do like I did and sign up for the President's Club for free, before you check inn. It will get you free internet, gym usage, and a daily paper. You can do it at the Fairmont website. My only problem and it's not the hotels fault, is those darn hills! Some say it adds character to the city; I simply find it annoying. I'm 28 and in decent shape and I was huffing and puffing when returning from a dinner of bar around the area. They are more like little mountains. I felt like I was a Sherpa at time's with my wifes bags from shopping. I was a little skeptical because I kept hearing this hotel was &quot;old&quot; and &quot;outdated,&quot; but all areas we looked at, including our room, showed no signs of wear-and-tear. We had a late flight (10pm) and the bell desk was happy to hold our bags until about 8pm. In fact, he also got us a Fairmont House Car / Luxury Sedan to take us to the airport, rather than a regular cab for the same price. Overall a great hotel. It seems to get an older crowd and it's not a W by any means, but it's not trying to be.If you need additional info, please contact me:[-]"
139,2174,"Sep 3 2008	Nothing bad to say but was just OK	I travel frequently for work and find myself in hotels at least 75 nights out of the year. Fairmont hotels are supposed to be &quot;breathtaking&quot; and &quot;top notch.&quot; While I can't really say too much bad about this hotel, I'll just say I don't think it would be worth the month for a regular rate. We received a corporate rate of $229 per night and I can honestly say I've received better rooms at a Hilton Garden Inn. The room wasn't ready when I arrived at 4pm which was odd because check-in was at 3pm. So I waited a while and was assigned a room on the 5th floor. It was just OK, nothing real special about it, just a standard hotel room. The food in the bar and restaurant is WAY overpriced, but I guess that is to be expected for San Francisco. If you want to get to the attractions of SFO this hotel is not real convenient, but it is a short ride on the trolley or by cab. Overall I'd have to say it wasn't BAD, but for the price most would pay for a regular rate, I'd check out less expensive options."
140,2174,"Sep 2 2008 	You have got to visit this hotel property	We went to San Fran for the 2008 Labor Day Weekend. We stayed for 4 nights and wish we would could have stayed for 4 more.If you remember the 80's TV Show called &quot;Hotel&quot;, this was the hotel it was filmed in and modeled after. This hotel lobby will take your breath away. I have stayed in many 5 star and 4 Diamond level properties and this one is right up there.The stay was great, the chamber maids were extremely pleasant, the concierge knew everything about the hotel and the surrondings and the drinks at the bar were out of this world.The hotel is so beautiful that over the 4 nights we were thier they had 2 weddings a day. The hotel is located directly at the top of Knob Hill which is between the Union Square area and Fisherman's warf.You can walk to Union Square but not to the warf due to the hills and the grade.I can go on and on with my bits to make you feel comfortable about this hotel but I do not have the time. I can tell you that I we have booked this hotel again for our trip back to San Fran over Christmas.PS - I did forget one thing. The hotel has two areas for rooms. You can stay in the original side or on the new tower side. Here are the differences:Original Side - These rooms are larger, have 12 ft ceilings, all the old wonderful crown modeling, victorian type look and feel and all the charm. The only draw back is you do not have a view. You only look out over the garden area or onto the street.The Tower side - These rooms are not as large (they are approx 450 - 500sq ft not including the very large bathroom) The views are either of downtown looking onto Union Square OR directly facing the bay. We were on the 20th floor and looked direclty at the bay, golden gate bridge, alcatrez and China Town. The view was worth every dollar spent."
