IDREVIEW,HOTELID,REVIEW
51,1064,"Jun 21 2009 	Good value comfortable hotel	We had an excellent, one night stay in this hotel. For us, it could not have been better placed next to Kings Cross station. Our room was a good size and adequately furnished and the staff were helpful and efficient. We paid the extra for the full English breakfast and this was both good quality and good value for money  kept us going through the Chelsea Flower Show until 3 in the afternoon. We would definitely stay at this hotel again on our next trip to London."
52,1064,"Jun 17 2009 	Very Good Premier Inn	Stayed in this hotel overnight before going on the Eurostar. In general the hotel is fine with a good dining room and evening menues which means that you don't really have to go out for a meal . This room doubles as the breakfast room in the morning.The bar is also very good with excellent service from the staff there. The automated checkin is a bit mind blowing but manageable when you calm down, bit like the self service check outs at Tesco.Althought the bedrooms are small , the bathrooms ok ,allla re functional just try to make sure that you don't get a room overlooking the foyer as these are dark and pokey and in warm weather very hot. Cheap a\c in the rooms which are very noisy. clean"
53,1064,"Jun 16 2009 	A Must Stay	I stayed here with my fiance who had lived in London for 9 years, this being my 2nd trip to London.The hotel itself is lovely, staff very welcoming and helpful, even when check in at 2pm gets a bit hectic of a weekend! They make sure everyone is seen to quickly and efficiently. We had one problem though, as we were paying by credit card, we were asked to use the check in pods, which was fine....but the pods checked us into a twin and not a double. A quick call and a receptionist popped up with a new key to a new room. Sorted.The room was clean and bed very comfortable. Great strong shower in the bathroom although the aircon left a wee bit to be desired! It was a very warm weekend and the room did get a bit stuffy.Not the hotel's fault at all, but why parents insist it is ok for their children to run up and down hotel corridors screaming at 2am is beyond me.Check out also painless, they looked after our bags until it was time for us to go to the airport. Handed in keys, job done. Literally a minute walk away from Kings Cross / St Pancras station.Costa Coffee attached to the hotel as well as a bar area (which we never used) so it was a winner for us and we're going back in August with our friends and will not hesitate in using this hotel each time we visit!"
54,1064,"Jun 13 2009 	Above Average Premier Inn	We stayed here for 1 night in June 09 with our two year old. As other reviews state, it is convenient for St Pancras and Kings Cross; and Euston station is 5-10 mins walk away; plenty of buses around too. As usual for the Premier Inn chain, the hotel does what it says on the tin: it's basic, clean, with friendly staff. At check-in they were trialling a new automatic DIY check-in machine, a member of staff showed us how to use it and it was very fast and straightforward. You put your credit card in that you booked with, it takes your payment, and then gives you your room keys. Simple!This hotel has been renovated recently. Our room was on the small side compared to other Premier Inns weve stayed at, but the storage was good, and it was clean and fresh looking; additionally, there was a flat screen TV, and a small but smart looking bathroom, with a powerful shower.The building itself is modern, and therefore the rooms seemed to have good soundproofing, we had no problems with noise; we were at the end of a corridor so this may have helped.As seems to be usual with Premier Inns these days, breakfast was fully self-service. The only problem I have with this is when its busy, there are a lot of people to-ing and fro-ing between the tables with plates/cups of hot food/liquid  health and safety? However, 7.95 for as much as you can eat, and under 16s eat free is very good value. Wide range of breakfast foodstuffs, except no cheese or cooked meat. Hot breakfast has REAL mushrooms, not the disgusting tinned grey sludge that can be found in even more upmarket hotels. Whilst we were there the toasters didnt work properly, one undercooked and the other cremated! Still, I expect this was rectified as Premier Inn have a rolling programme of maintenance.120.00 for room only, is reasonable value for London, and if you need the nearby train stations, its the best option."
55,1064,"Jun 11 2009 	Convenient location great price great service. What more could you ask for?	This is a great hotel! Location: The location is a very short distance from King's Cross and St. Pancras - not the greatest night life, but you're minutes from anywhere and everywhere you'd want to be (Victoria, Circle, District, Piccadilly, etc. run right through this station). I heard from a few locals that St. Pancras area was previously a bit of a dodgy place known for prostitutes, but it's recently been cleaned up a lot with the introduction of St. Pancras International. I had NO problems whatsoever, there were always a lot of people around so it was very safe feeling, and I saw a good number of police officers in and around the station so I would say the city has been very successful in making this a safe neighborhood now.Service:Everyone from the front receptionists to the cleaners to the night staff was friendly, willing to help with just about anything, and knowledgeable about the area itself. They did an amazing job keeping our room clean, and on the one day that we left the &quot;Do not disturb sign&quot; on, they left us a note saying they'd be willing to come back and clean at a more convenient time in the evening if we'd prefer that. Great service!Rooms:The rooms were CLEAN, and were a pretty good size for Europe. The bathrooms seemed to be brand new - great shower, really big tub. The hotel puts emphasis on people being quiet within the hallways - with the combination of that and the durability of the rooms, we NEVER heard another customer and had no outside noise whatsoever. The TV was one of those 17 or 19&quot; LCD televisions about the size of a computer monitor, but we never used it since we were so busy touring.Misc:We took the Eurostar one day to Paris and back again - this hotel is perfect for doing that, since you're so close. I highly recommend it. Also, the price of this hotel was in line with the Travelodge we stayed at in the Liverpool Street area - but the value was so much higher! Also as an aside - the breakfast was good (they were also really polite), fairly priced and with a lot of food and a cool dining facility. . and it's also worth mentioning that the pub that is attached to the restaurant area of the hotel is great! Good selection of beer, lots of TV's to watch the local Rugby game, and quality British food (Sausage and Mash, Beef Pie, Fish and Chips - all the staples plus everything else you'd expect!) at a great price. An excellent place to unwind at the end of a long day!I 100% recommend this hotel. Great location, excellent service, great price. How can you go wrong?"
56,1064,"May 29 2009 	great hotel great location great price	We choose this hotel because of its location  2 min walk from Kings Cross Station and St. Pancras International. We arrived to London at 11 am and decided to go to hotel to ask if we can leave our luggage there. We were positively surprised that we could not only leave our luggage there, but we could check in at 11 am. The room was spacious, modernly decorated, clean, and quite; the bed was huge and comfortable. The all you can eat buffet breakfast was very tasty and worth of money. The staff was friendly, nice and they answered all our questions.There is a restaurant in hotel  but we did not try. Next to the hotel there is Tesco, Starbucks, and many fast food restaurants.I would definitely stay in this hotel again and I could recommend it to everyone."
57,1064,"May 21 2009 	good hotel at a good price	We enjoyed our stay at this hotel (5 nights - 2 adults and 1 child). The room was very clean and looked recently renovated. It was rather basic (little toiletries, no drawers, no minibar..) but all in all more than adequate for the price and with all what is really needed. The staff was very nice and helpful. Location is excellent being close to a major transportation hub that makes your life as a tourist very easy (especially when you are dragging tired kids back to the hotel after a day of sightseeing). I was actually a bit worried about the area and related safety, but it turned out to be no problem (Just to be clear, this is not a fashionable area in the middle of action, but it is extremely convenient).I would probably not choose this hotel for a romantic week-end, but it would be my first choice for any other trip to London."
58,1064,"May 19 2009 	Front desk need training	Everything is ok with this hotel except the communication and training from the front desk. When we checked in i told the front desk that we will be staying for 2 nights and we will be out of town so i need to put my luggages for them to keep since i will still come back and stay at this hotel for another 3 days and they said ok, the day that i'm checking out they said no, i went down to the front desk and i met an indian guy and he said ok no problem, miscommunication among the front desk people and i need to carry those luggages to St. Pancrass station for locker by myself and they didn't even offer to help me to call someone to help me even to call a cab although it's near from the hotel. When i come back after 3 days with all the luggages, those front desk ladies that said no even give me a ridiculous smile when i check in, is this how they treat the guest?"
59,1064,"May 18 2009 	WOWZER!! perfect place to stay for a trip to london	this really is a fantastic hotel. charming friendly staff, welcoming atmosphere,clean and comfortable, its also excellent value for money. Nothing is to much trouble for the staff at this hotel, we arrived at the hotel at 7am and although check in wasnt until 2pm the staff offered to take our bags off of our hands we could then make the most of our first day without being limited as to what we could do by having to lugg them around with us! when we did eventually get back to the hotel (aprox 4pm) there were staff a plenty that were more than willing to help us check in, retreive our bags for us and made conversation that didnt seem forced or &quot;part of there job role&quot;. The room was airy, clean, comfortable,quite and the most comfy bed we have ever slept in, overall i reallly cannot fault anything in our stay in the premier inn kings cross and would recommend anyone to stay there."
60,1064,"May 17 2009 	Excellent value hotel in great location	We stayed at the Premier Inn, Kings Cross on a saturday night for a trip to the theatre. Coming in to Marylebone Station we took the 205 bus from the station forecourt to Kings Cross Station and walked around the corner to the hotel - less than 20 minutes from train to bed.Check-in was very efficient with the reception staff guiding us through the self service check-in procedure. They even had a big bowl of sweets for the kids - a nice touch. Getting into the room was a bit of a challenge with the swipe cards failing us on several occasions. Surely there must be a more reliable system available - perhaps like the oyster cards on the tube which never seem to fail.Our room was a family room which was plenty big enough for four of us. Even though our room was on the front corner of the first floor right above the bar/restaurant it was very quiet. A small fridge in the room would have been nice, but other than that we had all we needed, including a safe.Covent Garden was a few stops on the Picadilly line from Kings Cross which is literally 2 minutes walk from the hotel. Coming back was equally quick from Oxford Circus on the Victoria line. In fact Kings Cross is on so many tube lines that you can get to virtually anywhere in central London quickly.Next morning the all you can eat buffet breakfast was free for the kids and 8 for us grown-ups - fantastic value and very tasty. The restaurant staff were very efficient, seemed really happy and even had time to stop and chat to the kids.In summary this is an excellent hotel in a great location. The staff are very well trained and really friendly - we will be back."
61,1064,"May 12 2009 	Perfect for all needs	I stayed at the Premier on two different occasions in the same week...once on my own, and the other once my friend got to town. Both rooms were surprisingly large and comfortable.The location of the hotel is hard to beat, just a stones' throw from the King's Cross underground station and St. Pancras Int'l. I was using both stations, so it worked absolutely wonderfully.The hotel staff were top notch, from my early check in, to altering my second reservation, to my key not wanting to work correctly. They were always BEYOND friendly and ready to help in any way they could. They also had solid food recommendations.Though you have to pay for it, the wireless high-speed internet is fast enough and consistent...though a &quot;hard-wire&quot; option would be nice...Overall, if you are in London for business or pleasure, this place is a perfect base for your needs...location, great staff, and amazing prices ensure that they'll see me there again soon!"
62,1064,"Apr 23 2009 	Excellent base for sightseeing	I stayed with my wife and 6 year old son at the Premier Inn Kings Cross for 5 days in February on a mixed business / sightseeing trip. As I had business for a couple of days in the area, I chose the hotel reluctantly, thinking that it is too far from the center for sightseeing. However, the proximity to 5 tube lines means that you can go pretty much everywhere without changing trains, including Heathrow (via tube) and Gatwick (direct train to St. Pancras on weekdays) - this is a very big plus if you have kids with you. There is a grocery store in the same block, the shops at St. Pancras are open late (some are open 24/7) and there are nice places to eat with a kid in the area (including Kitchin across from the hotel and the hotel's restaurant). So the location turned out to be great.Regarding the hotel itself, the price during the weekend was very good, but it nearly doubled during the week - probably some event was going on at this time. Breakfast was excellent (english) and considering that it's free for kids under 16, it is a bargain if you do have kids with you. The room was fine, and the sofabed for the kid was good, but heating came from a portable heater (strange) and there was no fridge (slightly inconvenient). The room was in the back, so it was very quiet. All in all, if the price was reasonable for the weekdays, I would definitely stay here again, especially with kids."
63,1064,"Apr 15 2009 	I always use this hotel when in London	The hotel is all you could ask for really. I would recommend if possible asking to have a view outwards towards Kings Cross Station, Ive been placed once on the other side overlooking a supermarkets rubbish area - not so good!! The location is ideal for the trains and for Subways, especially if like me you train it straight from Gatwick.The breakfast might be expensive, but worth it I'd say!!"
64,1064,"Apr 13 2009 	Excellent hotel	We chose this Premier Inn due to the close proximity to Kings Cross Station. It couldn't have been better located-turn left out the station, left again then a couple of minutes walk and you're there-perfect with a suitcase and family!Our room and bathroom were modern and very clean. Our bed was huge and very comfortable. Our 2 children were on pull-out beds from under ours which were also fine.We stayed for 2 nights and had breakfast in the restaurant on both mornings. It was self service-serving full cooked breakfast, cereals, fruit, yoghurts, pastries etc-there was something for everyone. At around 16 for the 4 of us it was incredibly good value-especially for London prices! The staff were all very friendly and helpful, especially some of the restaurant staff.The ONLY negative thing I could say about our stay was that our room was situated at the front of the hotel, which unfortunately was a very busy road, with alot of police sirens going past. But this didn't hugely impact on our stay. Obviously it's the luck of the draw which room you are allocated.Overall it was excellent-friendly staff, clean, modern, perfect location-we will definately stay here again."
65,1064,"Apr 6 2009 	Good value for money	Just stayed in this hotel for three nights and must say it's really good for London standards AND not too expensive either. It's right next to the King's Cross station, so you have very good connections into all parts of town. Everything was very clean and the room was nice. It might have been a bit small for two people but as I was on my own it was ok. Breakfast was fine too, although I missed some cheese; there was none on offer. The staff was extremely friendly and helpful. The only real downpoint is that you can't open the windows, so there's no fresh air, only the air condition. I would definitely book again."
66,1064,"Apr 5 2009 	Good location pricier than our normal	We stayed three nights in this hotel in early March. Our overnight flight put our arrival at the hotel about 7 a.m. (well before check-in time.) A very nice lady at the front desk was quick to tag our luggage and lock it away. She asked if there was anything we needed, gave us maps and answered all of our questions. We returned from our running around about a half hour before official check-in time but really tired. The same woman went to extra effort to get us a room and find our luggage which had by this time become stored behind a lot of other luggage. The room was very comfortable and clean. The bathroom also was a perfectly functional size and clean. The towels smelled of Elmer's glue, but that could have been worse. There were three of us so we were given a room with a queen sized bed and a sofa/daybed about the size of a twin. The smaller bed seemed rather an afterthought and was shoved right up to the window. The drapes blocked the light well and considering it is a major metropolitan area, the nights were pretty quiet. We are used to staying in very cheap hotels and this hotel is more expensive than we would usually pay for, but it was so close to St. Pancras and we had an early train to Paris when we left so we shelled out the extra. I think it was worth it. I would gladly stay there again and hope I can afford it."
67,1064,"Mar 30 2009 	What a find!!	My family of four went for a sightseeing weekend and opted for this hotel due to its location outside the congestion zone. We arrived early on Friday and had no difficulty negotiating our way around the congestion zone. Parking at St Pancras was very expensive, 40 for 18hrs, and a good 7 minute walk away. On Saturday we were able to park on the road directly outside the hotel. The location of the hotel is perfect, 2 mins to Kings Cross with its links to the whole city, although I did find the tubes unpleasant due to overcrowding. We were also directed to eat at Kitchin, located at the side of the hotel, which was a contemporary Thia, Indian, Chines and Italian buffet, which was very good.The staff at the hotel were absolute gems, the room spacious, modern and clean. The breakfast was fab. Our only gripe was that the heating was faulty in our room. we were provided with a portable heater which meant it was difficult to maintain a stable temperature one night. I mentioned this the next morning and we were given a full refund on that nights stay! What service! I did feel a little guilty because although I had struggled to sleep, I thought the hotel was top notch and would definately return again"
68,1064,"Mar 24 2009 	Wonderful and Convenient Hotel.	The Premier Inn at King's Cross is a wonderful hotel with convenient Tube access to virtually anywhere in the city. The King's Cross/St. Pancras station offers connections to many different lines. Moreover, if you are planning a trip to Paris the Eurostar is just a hop and a skip away. We found out the hard way just how useful this was when we woke up 45 minutes before our train was set to leave for Paris. The checkout was painless as a friendly staff member stands in the lobby and collects your card key and asks your room number. We busted a move through the lobby, crossed two streets and voila we were ready to check in for our train with time to spare. Being near the train station also means that there are convenient shops for necessities (Boots and Marks &amp; Spencers) as well as quick bites that are open late. The restaurant in the hotel offers good food at a reasonable price. The service at the hotel is amazing and everyone is attentive and helpful. A nice perk is they offer a phone card that can be purchased in 5 pound denominationsfor international calls. This was a great way to keep in touch with family and friends at home. Internet is also offered in the lobby using a coin operated system. The rooms are spacious for European standards and is comparable to many American hotel chains in terms of size and amenities. I will definitely make it a point to stay here again the next time I am in London."
69,1064,"Mar 20 2009 	Perfect for Eurostar	This is a great place to stay the night before an early Eurostar trip. Very upmarket compared with most Premier Inns and given the location the price is justified. Good staff who were struggling with the automatic check in as it wasn't working properly. The room was surprisingly big but the bathroom was smaller than usual but adequate. One negative point was that our room had a window facing the atrium, which although there were curtains had strong artificial lighting on all night which was annoying.We didn't use the bar or restaurant as we know the area and did our own thing - there are plenty of good restaurants close by. Good cafes at St Pancras for breakfast."
70,1064,"Mar 13 2009 	From a Singaporean point of view.	Majority of the staff are helpful and proactive. The beds are comfortable and the housekeeping team did a great job of clearing up the room. The location is fantastic as the quick access to King Cross equates to direct access to most part of London. We woke up to tasty and warm breakfast every morning. The room for improvement is perhaps rotating/changing the buffet breakfast items so that guests would not get bored after staying for more than 3 days in a stretch. Eg. Alternate between serving back bacon and ham, pork sausage and chicken sausage, baked bean and green peas."
71,1064,"Mar 3 2009	Handy for Eurostar	There's only one reason to stay here. It's less than five minutes' walk to St Pancras station so, if you've got an early morning Eurostar to catch, it's an ideally placed, fuss-free solution. It's a peculiarly designed building, with an atrium running through the centre. What this means is that a lot of the rooms don't have an outside-facing window but instead overlook the lobby. It's hardly ideal but, if you're only here for a night (as we were), you can live with it.You can check in at reception or at self-service machines, which dish out your room keys along with a receipt (you pay on arrival). This worked well and was certainly quicker than waiting in the queue for a receptionist.The room itself housed a large double bed but there was otherwise very little space in it. The telly was attached to the wall, for instance, as opposed to sitting on a cabinet at the foot of the bed: it was the only way to fit it in. Surprisingly then, the bathroom included a bath, with an astonishingly powerful shower over it.At 108 (not including breakfast), it didn't feel like it offered particularly good value. But it's so handy for the Eurostar terminal that you're prepared to overlook such a steep price for what is, in effect, a glorified Ibis."
72,1064,"Mar 1 2009 	The Ideal Location...	We selected this hotel as we were travelling from Scotland to Europe by train/Eurostar and it had a good rating on Trip Advisor. The location is certainly excellent - 2 minutes walk from King's Cross and 5 minutes from St Pancras Eurostar terminal. Arriving well after midnight, we found very welcoming and chatty reception staff. The room and facilities are high quality and the main atrium and bar area relaxing and attractive. Although relatively basic, you could easily pay far more for a poorer quality hotel in this part of London. Our only gripe was the amount of noise in corridors and adjacent rooms during the night which suggested that sound-proofing was fairly poor, but the hotel cannot be entirely responsible for noisy guests. The hotel was very responsive to complaints though, and they offer a money-back guarantee if they can't solve your problem."
73,1064,"Feb 25 2009 	Good Value Good Location	We spent six nights in this hotel and were well satisfied. It's a new chain (at least to us) with a dozen or more locations in London and probably hundreds across Britain. We were pleased with the location we chose. We were a block from Kings Cross and St Pancras stations, and you can't be much more centrally located in London than that. The hotel was completely satisfactory in every way, and a very good value for London. As has been noted by others, the rooms are a little smaller than average but we found ours perfectly adequate for the two of us.The breakfast buffet (not included in the room rate) was also good value for people who need to begin the day with a big meal. For coffee and muffins, there is a Costa coffee shop off the lobby. We can't think of anything negative to say about the Premier Inn Kings Cross and will probably choose this hotel again on future visits."
