IDREVIEW,HOTELID,REVIEW
9,1079,"Jun 6 2009 	A Nice Clean Hotel at a Very Good Location	I stayed at the Queensway Hotel two times (the first one on June 2008) and probably will stay there in the future also. The location is excellent for a London visitor: very near Paddington Stations (both the Rail one, which connects to Heathrow Airport and South England and the Underground one, which is served by four lines, giving easy access to all of central London) and at walking distance to Hyde Park and several other places of interest. Sussex Gardens, where the Hotel is located, is a very nice small Boulevard where most buildings have been converted to Hotels (of varying standards).As appears to be the case in all of London (or so I was told by everyone), the accommodations are very tiny - there is not much space left in the rooms for circulation or for luggage. Also, it would be better if the beds where larger (both the single and the double ones), but the mattresses and pillows are new and good. Bathrooms are also very tiny, but expertly designed so as to be functional. Both are also kept very clean.Each room offers a small LCD TV, coffee and tea maker as well as a hair dryer. Also, each room has an Ethernet point (cabled; better to bring your own cable, as the Hotel has a limited supply of them) with Internet access, but not Wi-Fi. The low point is the wooden stool that accompanies the desk (not a chair - and all rooms have this same kind): hard and very uncomfortable. Even with a pillow, it is damaging to our buttocks.As for the Hotel staff, my experience with them was very good: owners (it is a small hotel, sometimes the owners hang by), reception clerks and maids are all sympathetic and accomodating.All in all, I think it is a good value in London."
10,1079,"Jun 3 2009 	Great Location cheaper hotel	My wife and I stayed here for just 2 days while we were in London. The location is truly excellent being only a few minutes walk from Paddington station, which is the main one from Heathrow. We only had the breakfast once, but that wasn't too bad because the breakfast wasn't great. Just cereal, toast, yogurt, though they did also have cheese and hard-boiled eggs. The price was good but we checked in early so we didn't get the good room that I had booked, which was ok for me because we really wanted to take showers and a nap before going out. The view out of our room was the vent from the kitchen in the basement. The last problem I had was with the water in the bathroom, it was always close to scalding hot, even with it turned all the way to cold. Which isn't bad in the winter, but in the summer, I prefer cold showers. Another plus for them is that they have internet, but it's corded, not wireless."
11,1079,"Apr 23 2009 	Great Location	The Queensway is in a lovely part of London, close to Hyde Park and easy walk to Oxford Street. Close to tube and Paddington. Staff were very friendly and helpful. Breakfast included is basic but adequate. The room we had was quite small but that is usual for inner city London. Bathroom nice and clean."
12,1079,"Feb 4 2009 	Great Budget Hotel	I stayed at Queensway hotel for 5 nights (double room) based on the previous reviews; however, I was a bit suspicious about the quality of the room due to the reputation of most budget hotels in London. When i checked in all my suspicions were gone, we took a ground floor room and although the room was a bit small it had enough space to make you feel comfortable and it was spotles clean. The bathroom was very clean also and the shower worked perfectly. The room has a coffee maker as well as a satellite TV. The location of the hotel is very convenient close to Paddington tube &amp; train station and a number of late night buses serve this area which made our transportation to all the main areas of London quite easy. The only drawback of the hotel was its breakfast which apart from ending quite early (9:15am!!) it was very very basic."
13,1079,"Dec 27 2008 	Conveniently located	Positives:1) conveniently located within short walking distance to train station, tube station and bus stops.2) Clean facilities.3) Has a small safe in roomThe big negative is the very boring breakfast. Good for those on a diet."
14,1079,"Dec 4 2008 	Quiet and Clean	I stayed at this hotel based on the closest to Paddington Station. Over all it was quiet, clean and had a good cold breakfast choice. The bed was comfy and the bathroon was clean. As for the size, it is the typical London size room. The only drawback for some would be that the lift only goes to the 3rd floor but some rooms are on the 4th floor. Not a problem for me small lightweight bag."
15,1079,"Oct 25 2008 	Perfect locaton Clean Quiet	I had a perfect stay at the hotel that is located close to both Paddington station and Lancaster Gate tube-station and several bus-stops so you can really go allover London at no time. I stayed in room 401 situated at the top floor after climbing some very steep and narrow steps. The lift only goes to floor no 3. The room and bathroom was small but it's all you need for sleeping. It was very clean, seemed to be renovated recently and not any disturbing noices. The only thing that was slightly negative was the breakfast. That was very thin even for a continental one. Next time I go to London I will most definetly stay here again and I recommend it to my friends."
16,1079,"Oct 21 2008 	Good Cheap hotel	Good/cheap hotel in the budget area of London. About 300 meters from Paddington Station, the hotel is easy to get to by walking. I made it with two big suitcases all alone. The hotel staff was semi-friendly. First off, my room was on the 4th floor and the lift only goes to the 3rd. There were two people working at the desk and none of them offer to help me carry my two 20 kg bags up the stairs. If you are staying on the 4th floor - warning- the stairs up are extremely steep. Other than that, my room was really clean. The bathroom was tiny but hey this is London. I had a flat screen tv with cable tv and free Internet in my room. Few pubs and restaurants are right near the hotel. I would recommend staying here."
17,1079,"Oct 17 2008 	If you can get a good rate go for it!	My wife and I stayed at this hotel for 2 nights to kick off our latest holiday. The hotel was clean, the rooms were large for London (room to put two suitcases on the floor without having to jump over them). The bathroom in our from was new, the it was small but that's pretty common to all hotels in London.The hotel is just a few minutes from Paddington station, so it's perfect if you fly in from Heathrow, it's very close to some great restaurants, and Hyde park."
18,1079,Sep 26 2008 	Lovely hotel shame about the breakfast	Queensway is a great hotel if you don't eat breakfast. The rooms were newly refurbished and modern and the showers were hot and the beds comfortable. But the breakfast was appaling as were the staff who shouted at us to sit down and we didn't dare to ask for more sloppy cold toast. We ended up eating at a lovely Italian 50m away - full english breakfast for 2.50 pounds. The hotel is a 2 minute walk from Paddington as well so ideal location. We would definetly use it again but without breakfast.
19,1079,"Sep 22 2008 	Great location with housekeeping issues.	Selling features for this hotel - down the street (literally a 3 minute walk) from Paddington tube station, located in a quiet area (on a block of hotels), has a lift, and is absolutely gorgeous from the outside. The room was standard sized, but the washroom was another story. While sitting on the toilet my face was almost in the sink and I could barely manipulate myself to get into the shower. Linens were not cleaned daily and new towels were not given, even when they were clearly dirty (we spilled curry all over one of the unmade beds and cleaned it with towels. When we arrived back to the hotel the soiled towels were hung neatly in the washroom). When we asked reception for new towels and a new sheet they seemed skeptical about our story, but gave up the goods - they genuinely seemed to have no idea their housekeeping staff wasn't properly doing their job. We were also told by reception that housekeeping was between 10am-2pm and if you did not want to leave your room early you could ask them to come back (we specifically asked because we had had a late night the evening before). When housekeeping arrived at 12pm we asked them to come back, but we were forcefully told if we wanted our room cleaned that day we have 5 minutes to depart.Aside from the housekeeping problems and small bathroom it was a pleasant stay. The location of this hotel alone makes it a worth while stay."
20,1079,"Sep 22 2008 	Good hotel for price and location	These rooms are fairly reasonable considering the price and location. The bathroom was quite small, but it was all that you needed. I would stay here again, but remember that it's in London so adjust your expectations accordingly. Also, the breakfast lady was very interesting (!) - make sure you get there early as she tends not to replace food once it runs out..."
21,1079,"Sep 15 2008 	big thumb up outstanding	I have stayed in quite a couple of London hotels but this one is far the best one and very good value for money.It's the cleanest and tidiest hotel I have ever been in at this price catagory. The drawback: although very tidy and friendly, the rooms are a bit too small. Especially when you are in the toilet which has a very well designed shower, you need to twist a little bit your body to sit down for your intimate business in order not to sqeeze against the sink. I stayed for one week as a single guest and the bed was quite large for one person. However, for two people, the room would have been too small. Therefore, I recommend it for singles but would ask you to get more information if you would like to book it for two guests. I presume that they also have larger rooms. However, I need to stress that in London, large hotel rooms for the same price as on the European continent are considered as luxury and are extremely overpriced. Therefore, Queensway Hotel is doing quite well and as far as I know you would hardly get anything larger for this price catagory in London. Another drawback was the matress, but I admit that this is a personal problem, because I easily get backache with spring coil matrasses. In this hotel, the matrass was brand-new and because I am a bit special with my back, I did not like it. Again, in Britain, the spring coil matrasses are largely over represented in contrast to the European continent where mainly foam matrasses are used.The hotel is not only outstanding for its tidyness but also for the readiness and helpfulness of the personal. When I did not want to sleep on the matrass, they instandly delivered me a lot of bed covers to improve my comfort on the matrass.A very good point: there is a lift, so that you do not have to carry your luggage all the way upstairs.The breakfast is ok, not exceptional but standard and immediately served.The hotel is very well located nearby Hyde Park and between two underground stations within a few minutes walk each. Also, Edgware Road, Marble Arch and the beginning of Oxford Street are easily done by foot. In all, I give Queensway Hotel a big thumb up. It is outstanding for its tidyness, friendly design and good service and well above the value for money compared to other London hotels."
22,1079,"Aug 20 2008 	Gymnastic ability required!	I stayed in this hotel for 5 nights and it did not disapointed me at all... As a London traveller (I stayed in at least 5 diferent hotels in London) this is just what you normally expect for a small, tiny and simple London/Indian hotel. The rooms are small and the bathroom (if you can call that a bathroom) is very very tiny and you only fit there with a little gymnastic ability!! The elevator looks like reinvented from the past century and probably it will stop when you are inside, so it's better to take the stairs...The service is the basic and you can not count on a fabulous breakfast so it's better if you book without the small toast and orange juice!!! The location is great, just a short walk from paddington station wich takes you to all the tourist atractions in London.Overall, do not stay here if you are looking for a charm and confortable hotel, if you are backpacking this is just perfect, but if you want luxury forget it!"
23,1079,"Aug 11 2008 	The tiny rooms of Paddington	Rooms so tiny but at least new interiors. lcd tv and coffee making bathroom compact. All very compact. Compared to the decaying Normadie down the road this is preferred. Breakfast ok but a smile from any of the staff would not go a miss. In hub of the Paddington, many such establishments to choose from. This will probably compare up with the best for new interiors. Location is great if you need to be here. My final night in London on this trip, spent a little more and stayed at the Radisson Edwardian Provdence down by Canary Warf. COMFORT&gt;."
24,1079,Aug 2 2008 	Lovely hotel and area	We love the queensway and stay here everytime we are in london. The location is great near to paddington station. It is close to the airport and close to town. It is very clean and the breakfast is lov ely. Staff are friendly and the price is right.
25,1079,"Jul 26 2008 	Great location - REALLY tiny room	I chose this hotel based on location; its really close to Paddington Station and thus a really convenient base for a holiday. However, the room I had was the tiniest room Ive ever seen, about 2 meters x 3 meters in size. Absolutely no room to move around, I wasnt even able to open my suitcase on the floor as there was no room for it! There was a closet, but that was really small as well. There was absolutely no room to hang around, it was basically just a place to sleep. No room for anything else. Bathroom was a bit small too, but shower was quite nice, better than in some of the hotels in London. The bed and pillow were ok. Room had no view (the room was on the 1st floor). TV had lots of channels, and complimentary tea and coffee were nice. Breakfast was minimal; just toast, cereal, juice and coffee/tea.I recommend future guests bring earplugs as doors bang really loudly in the hall.Even though the room was so tiny, the Queensway Hotel was clean and in a nice location, so I think I would recommend it to others who are just looking for a place to sleep in."
26,1079,"Jul 12 2008 	Clean good location internet -- great for budget hotel	I paid 69 pounds/night for a 3 day stay in June, via Venere.com. Overall very positive experience, I would stay here again. Pros: - 5 min walk from Paddington station. Very convenient if you're taking the Heathrow express to/from Paddington. - very clean - strong reliable internet (in my room at least) - ensuite bathroom (tiny but functional) - ~5 min access to two tube stations - pleasant staff - a handful of restaurants and small shops nearby (all tourist oriented however). Supermarket nearby. Shops aren't all on the same street however, so you'll need to ask for directions and/or wander around a bit. - walking distance to Hyde Park - elevator to basement, 1, 2, 3 floors Cons: - the elevator doesn't go up to the 4th floor (which is built up in the old attic) and the stairs are fairly steep and narrow, so if you have difficulty carrying your luggage up stairs, you should ask for a room on a lower floor. - this is a budget tourist zone -- so if you want to eat at a nicer restaurant, or a &quot;locals&quot; restaurant, you'll likely need to eat elsewhere (although the Frontlne Club restaurant is nearby and it's great -- you will need reservations for it, unless you're lucky to get a seat at the bar)"
27,1079,Jun 29 2008 	Excellent	We stayed here for three nights and were impressed with the hotel. It was extremely clean and though the en suite bathrooms are very small they serve their purpose. The breakfast is adequate but as stated in previous reviews the juice and longlife milk are served at room temperature rather than chilled. Also the croissants are more like a bread roll than a traditional flakey croissant and the fruit salad is the tinned kind. However overall we were pleased with our choice and would stay again without hesitation.
28,1079,"Jun 26 2008 	compact and convenient	Booked two nights for convenience to Paddington and had single room (no 6). There are another 2 single rooms which I would recommend as no 6 is in the basement next to the breakfast room and an enclosed outside area with doors leading to breakfast area - so very noisy. Room clean and compact - please understand compact with capital C! My main complaint is the indifferent staff, moreso at breakfast. We came in and sat down at a table but were told (not asked) to go to small table. The milk jugs from tables recently vacated were poured into the main jug used to fill cereal bowls etc. - perhaps done out of sight might have been better! Hang on to your breakfast as it is cleared up post haste. Please try to sort this out as the milk situ is really not great to look at or hear and friendliness isn't in abundance.However if you need a place to put your head and want convenience miss out room no 6 and this is the place for you!"
29,1079,"Jun 26 2008 	Good location	Queensway Hotel is in a good location, near Paddington Station and Lanchaster Gate (get an Oyster Card if your there for a few days, you get the 3 refunded), very close to Hyde Park which is fantastic for a walk - to Buckingham Palace and Kensington.The hotel itself is fine, small rooms and very small en-suite, but it is sufficient. The Elevator isn't always working, I think they seem to turn it off at night, I guess this is good for the bedrooms next to it but not for those people that have to walk the stairs to the top floor! But we are still alive :)Rooms are clean and tidy, beds a little too soft for my liking! Breakfast was basic... tea/coffee, toast, ceral &amp; afew other bits!Staff - girl at reception desk very nice, everyone else ok but no one is rude, so thats good."
30,1079,"May 21 2008 	A good stay	We (parents + 5 year old child) had a good stay in this hotel. The hotel is close to Paddington station for trains, tube, and buses. Bus #15 that goes past most sites has a stop at the station, we used it for sightseeing. There are also a number of restaurants and pubs in the area. To us it seemed like a decent neighbourhood.We had a triple room, which was spacious. Even though the room was on the first floor facing Sussex Gardens, it wasn't noisy (despite the football finals that was played the weekend of our visit). The room and the hotel was clean, this was most important for us. We also got a third tea cup for the room when asked for it. There was only one small waste basket in the bathroom, but no trash bin in the room, so we had to pile up papers that we left behind on the floor.We also found it a bit strange to use the bed cover as blanket (there were no separate blankets).The breakfast included in the price was sufficient for us: tea, coffee, boiled eggs, cheese, jam, toast, cerials, yoghurt.Tea bags in the room were not replenished when the room was cleaned. I'm sure, though, that should we have wanted more, we would have got them from the reception.The only incident we had was with the hot water boiler, which went off on Sunday. The receptionist called us to check if we had hot water and when we said the water was only lukewarm, I thought they would have fixed it right away. We had to ask again the next morning; fortunately we weren't desperate for shower then. The boiler was fixed when we got back on Sunday evening.All in all, the stay was value for money and we would stay in this hotel again and recommend it to others."
31,1079,"Apr 7 2008 	Splendid hotel	Last week we stayed for 3 days in the Queensway Hotel. The hotel was more than we expected. It was recently refurbished. The reception was very nice with very friendly staff. Thanks to the staff for their excellent service. The room was on the second floor and was very clean with a small but beautifull bathroom. The hotel is situated on a top location, near Hyde Park and on two minutes from the underground (Paddington).We made the reservation with London Hotel Reservation Centre (LHRC) in Paddington. They had a great deal for us and booked also our discounted theatre tickets. The service was excellent. We had a great trip and will come back to the Queensway and book again our hotel with LHRC."
32,1079,"Mar 31 2008	Great stay!!	I was going to the theatre to see the 39 steps and needed a cheap but good quality place to stay. Found the Queensway through a google search and also checked on trip advisor for reviews. The hotel is situated about a 5min walk from Paddington tube station/train station. If coming out of the tube station - follow the sign for Praed Street. Once outside, cross the road and follow it until you come to Sussex Place, there is a pub called Sussex Place on the right hand side. Before crossing the road, you can see the hotel in front on the left. It is a lovely white building situated in amongst other hotels. The reception was clean and bright with a leather sofa and nice pictures. The receptionist was friendly and we got checked in before 1pm. My friend and I had a twin room. The beds were fab with lovely pillows (the best night sleep I have had in a while). The bathroom was modern (small) and the shower was good. It had tea/coffee facilities and a flat screen t.v. Nice view out onto the tree lined road and the window opened which was nice for a slight breeze. There were also extra pillows and a blanket. The room was 69 including breakfast, which is excellent for London. The only real downer was the breakfast. There was the choice of 3 cereals, yogurts, hard-boiled eggs and cheese, toast and juice. Unfortunately neither the milk nor juice were very cold which is a must when having cereal or fancy a nice cold drink first thing in the morning. The kitchen is quite basic so there is no option of having a cooked breakfast which is ok but it's best to mention this. The staff were nice and friendly though and supplied tea/coffee as required. The whole hotel has been refurbished and it shows. I would stay here again without fail as it's situated in a great location, handy for all of London. Definitely a no hassle hotel"
33,1079,"Jan 20 2008 	Great Little Hotel	This hotel is clean, comfortable and modern, at a very reasonable price (single room normally 69 but I booked last minute and paid just 49). The photos on this site are out of date - all the rooms shown here have been refurbished.I had a single room on the 4th floor (lift goes to 3rd floor then short flight of stairs). Room was small but perfect for my needs: bed, wardrobe, TV, kettle etc, phone, hairdryer, bathroom (mine had no bath, just shower). Everything was very clean and I spent a comfortable night. Continental breakfast in pleasant breakfast room was cereals, toast and tea/coffee (included in price of room). Note: If you prefer a cooked breakfast there are several restaurants around paddington station that you can walk to in a few minutes.The only negative comment I have is that the room was slightly too warm for me, even in January I hardly needed the bedding. But, I would rather that than it be too cold!Overall I was very impressed and would recommend this hotel to anyone needing a stopover for a night or two."
