IDREVIEW,HOTELID,REVIEW
24,2266,"Mar 19 2007 	If you do not need service o.k.	This hotel is not a service-oriented one. Apparently owned by government most of the staff are students with not a lot of training and hardly any visable service-orientation and language skills. The hotel however is clean and the rooms also. We had a meeting there with customers and there were no complaints about bad rooms etc., but when it comes to service, the hotel makes a bad performance, especially in the banquette department. The servants could not speak and understand any English, there were 20 cups for 40 partcipants for coffee, the air condition did not work for 5 days although we complaint several times, the general managers was invisible and his staff just not responding. Near our meeting rooms was heavy construction going on and we had hardly any help from the staff to get our meeting going. It took a lot of effort to get what we wanted and this was nothing extraordinary. So if you just need a comfortable bed and nothing else, the hotel is o.k. , the breakfast buffet is fine, the restaurants are also o.k. The location is very good, you can reach most of the tourist attraction by foot. If you expect more service and friendly staff go to the Royal Meridien next door, here you find everything you want at a slightly higher price, however. Their bar there on the 66th floor is amazing. Drinks and food are excellant at European prices."
25,2266,"Jan 19 2007 	You will enjoy	This is a great hotel with a fantastic location for both business and tourism. Rooms are great, beds are firm but nice (I've had some bad experiences with rock hard beds) lobby and facilities are top class and you can't beat the location. You are right in the heart of the action quick walk east and your at the bund, shopping a plenty right out the front door and a quick walk west and your in Renmin square with all the arts, museums, gardens and hotels. Cabs are frequent along the road adjacent the hotel. Great value for tourists especially and the business centre really came in handy for me as I was running a seminar at the time"
26,2266,"Jan 19 2007 	GREAT hotel	Helpful staff, great location, walking distance to the Bund (Peace Hotel and M), right ON the major shopping pedestrian street Nanjing Donglu...theres a convenience store right across Nanjing st (so you can avoid the very overpriced minibar), a Pizza hut as well within feet of one entrance should you crave some western food...A subway within a couple of blocks, etc etc...Super-clean rooms with a flower in the bathroom, with all the HBO, CNN, etc. (and coffee packets in the room! A rarity in China!). Our friend's room on the 17th floor was pristine and beautiful, brand new, felt like a true 4 star, ours on the 19th was not as newly renovated and showed a little wear, but still excellent. Would definitely stay here again. Great place, our room even had somewhat of a view of the river and Pudong....at an amazing place when you factor in the price!"
27,2266,"Dec 29 2006 	Very nice hotel	I spend 2 nights in this hotel at the beggining of December.It is a huge hotel at the center of the town, only a few meters from the main shopping street, Nanjing Road. The hotel is very clean, with all comforts and the price was great."
28,2266,"Nov 6 2006 	Sleepless at Ramada	i just got back from China with my entire family of 16. It was my first trip to Shanghai together with my 12 year old daughter and we were booked at the 8th floor of the hotel which we were later told was the floor preferred by newly weds. The first night was a bit noisy because the newly weds were having games in the hallway! On our fourth night, the couple beside our room was quarelling quite violently. It was terrifying because it came to a point that they were banging the walls like they were going to come through it. Later, someone was banging our door and trying to open it. I had to call the assistant manager, front desk and concierge several times because the commotion would not stop. It was so so so terrible, horrible! They had to physically drag out the couple. When my daugter and I had finally got to doze off, someone knocks in our room at 12:38 am. Scared, I had to go to the door to find out who it was. It was a hotel staff asking if I requested a change. I was quite confused as to what change I wanted and at that time of the night! The following day, my sister-in-law wrote a letter of complaint to management and we personally submitted it. When we returned to check if we could talk to the manager, we were so shocked to see a torn letter held by the assistant manager! They probably did not want the complain to reach the general manager. There were no sincere apologies, just a cheap offering of 5 small cookies on a dinner plate with a bowl of fruits tied with a recycled ribbon! The hotel has great breakfast buffet and an excellent location! If they can polish their relationship with their guests, I do not mind going back and living there on my next vacation but as for now, I would consider other hotels where my family and I will feel secure! Peace of mind is, after all, one of the reasons for a vacation!"
29,2266,"Oct 31 2006 	Very good	This Ramada is better than the ones I've used in America. Helpful, friendly staff, nice rooms and in a great location for exploring on foot or underground."
30,2266,"Oct 13 2006 	Nice Hotel / So-So Area	HotelI was apprehensive about staying in a Ramada brand hotel because my experiences with them in the US have been totally poor. However, this Shanghai Ramada is genuinely a 4 star hotel with good service and English speaking concierge. The room was spacious and clean. Staff was friendly. There was security staff on the first floor at all times. It is 1 hour taxi ride (140 yuan) from Pudong International Airport.AreaThe area is on the pedestrian mall area of East Nanjing Road. Very unfortunately this is a major tourist area and touts are out in full force. You cannot take two steps without being stopped and offered bags, watches, or women. It is not an enjoyable place to stay. There is zero nightlife there. The more up upscale area on West Nanjing Road near Portman Center and Shanghai Hilton hotel is a much better place to stay. There is better dining, nightclubs, bars there and less beggars and touts.Nearby Dining/ShoppingCabs are cheap so every shop and restaurant is in reach. Good spicy food with good service is at Meilongzhen Restaurant. We dined at Shanghai Uncle at the Westin Hotel but the food and service was terrible. If you plan to visit YuYuan Garden you should eat at Shnghai Lao Fndin (Old Shanghai Restaurant) and a visit to Shanghai would not be complete without experiencing the wonderful view/food from the balcony at M on the Bund. We went to KaDe Club video shop and loaded up on DVDs for cheap though there authenticity is questionable."
31,2266,"Sep 23 2006	Hotel Nice - Major Check in problems	I recently booked three rooms at the Ramada Plaza Shanghai with the Ramada Reservation desk. While making the reservation, I was informed that the hotel had a special package which included free laundry, free in room broadband service and a free buffet breakfast. This package was $10 USD more than the rate posted on the internet. I went ahead and booked this package.At check in, the hotel refused to honor the package. They said that they did not participate in the package and that they had informed Ramada International. They would upgrade the room, but would not include any of the items noted in the package that I had booked. After going through three levels of management, they eventually agreed to provide the breakfast and broadband access from the business center. The hotel itself was very nice. The two room suite was nicely decorated and quite comfortable. There was a bit of noise from outside, but that was to be expected due to the location of the hotel.The hotel is located on a busy tourist street (Nanjing Lu). The Bund area and the Huangpu River is approximately a fifteen minute walk. In the opposite direction, one can reach the museum area as well as the metro in approximately 5-10 minutes.The service level was somewhat disappointing as compared to the other hotels we stayed in throughout China."
32,2266,"Aug 5 2006 	Great stay	Location: excellent, right in the centre of where you want to be in ShanghaiRooms: spacious, well equipped, very cleanStaff: very helpful and friendlyRestaurant: the breakfast was disappointing, but okValue: its somewhat expensive (staying on the Club floor is NOT worth it)Recommend staying at this hotel"
33,2266,"Jul 12 2006	Great Staff and Location	My family rented two rooms for 4 days at the end of June 2006. The location was excellent, right on Naijing pedestrian mall with lots of new shops, restaurants and new building. The Bund is a 15 minute walk to the river and sights of the spectacular Pudong skyline.The hotel was 4 star was the usual modern and western amenities. Several restaurants and a upper floor executive lobby overlooking the city.The front staff was very helpful and spoke English. I want to compliment an excellent concierge names Mr. William Shen, who helped us way beyond the call of duty. He accompanied us to a nearby dim sum restaurant to help us orders from a Chinese language only menu - kudos to Mr. Shen.On the down side, internet access was expensive and health club charges were very deceptive. The hotel manager tried to intervene but told me the club is run separately from Ramada. Although the fitness equipment, pool, showers, spa were excellent, there are no indications that using the sauna was an extra charge (the spa next to it was free for guest). There are many English language signs at the front desk of the health club with charges, but nothing that said the sauna was extra $10 dollars per person. Also my son and I was forced to buy a $12 swimming cap for the pool because those were the written rules. But to our surprise, many people using the pool had no swim cap! So, don't let the nice lady at the front cheat the &quot; rich Americans&quot;.That was the only unpleasant experience of our trip. Caution: China is still a very poor country and there many beggars and shady character out after 10 pm on the Mall and elsewhere outdoors. You will be swarmed if they know you are a tourist."
34,2266,"Jul 1 2006	Great Location and Great services	I stayed at Ramada Plaza Shanghai in May of 2004 for 5 nights for vacation. Check in was a breeze. The receptionist of the front desk was very friendly. I was upgraded to a suite as soon as he discovered that the type of room my travel agent booked for me was not available. My room was specious with a small living area though it was a little dark with only one small window. The bath room was fantastic with a large Jacuzzi. It was built with all marbles. House keeping was excellent. My room was always cleaned in a pefect manner. The location of this hotel certainly is the best for a leisure traveler. It is within walking distance to most attractions, such as the Bund, Nanjing Road, Legendary Peace Hotel, Peoples squares, etc There are plenty good and cheap eats as well as many large department stores and smaller shops around the neighborhoods. My breakfast was included in the room rate. Food was good, service staff was pleasant. However, all the guests had to find an available table ourselves. The restaurant was so packed with large tour groups during the breakfast time (7am to 10am). It was a bit struggle to find a table every morning. I had to share my table with strangers a few times. One thing you need to be aware. This hotel has two entrances. One entrance is on JiuJang Road, the other one is on East Nanjing Road. This could be the only hotel in Shanghai that has two addresses. Overall, I was very satisfied with my stay. It is good value for money. I would definitely stay there again."
35,2266,"Apr 7 2006	Ramada Plaza a good experience overall!	A very well location hotel in a very busy and hectic city.The hotel is located on the main shopping street of Shanghai and is well located for walking to any of the major tourist sights and also the very good underground system.The hotel facilities are very good and the staff are both efficient and friendly. The breakfast and the restaurant food is fairly typical of your average hotel and is nothing to write home about. The accomodation, particularly the suite accomodation that we had on our trip, was spacious, clean and well equipped. Overall I was pleased enough with the hotel and would not discount using it again, however I would probably look to see what else was available in the same price range."
36,2266,Nov 18 2005	Excellent location above average hotel
37,2266,Oct 25 2005	Love the location!
38,2266,Oct 16 2005	Reasonable Price for the value
39,2266,Sep 28 2005	You won't believe this is a Ramada!
40,2266,Aug 1 2005 	Fab Location
41,2266,Jul 31 2005 	Construction Boom!
42,2266,Jul 15 2005	Better than average Ramada
43,2266,Apr 18 2005	Bait and Switch rates?
44,2266,Jan 26 2005	Best location ok rooms
45,2266,Oct 8 2004	More than acceptable
46,2266,Oct 25 2009 	????????
47,2266,Aug 14 2009 	???????????
48,2266,Aug 6 2009 	????????????????????
1,2269,Jul 1 2009 	Excellent place	Do you want double the space for half the price ?. This is the hotel/appartment to stay. Very nice property
2,2269,Jun 23 2009 	Very nice apartments near PuDong Times Square	This hotel is very nice
3,2269,Feb 1 2008 	Nicest Place I've Ever Stayed	What a place! I'm rarely 'over impressed' with a hotel
1,2274,Oct 11 2009	Nanjing Hotel	Very convienent location. Nothing flash but clean and had everything you needed. I wouldn't bother with the breakfast.
2,2274,"Oct 7 2009 	Happy Nanjing!	What an easy and pleasant introduction to Shanghai! For starters, this hotel is SIMPLE to get to from the airport - take the Maglev Express train to the terminus, transfer to the Metro Line 2, 6 stops to Nanjing Road EAST, out exit 1, turn right, walk less than 1 minute and voila! Nanjing Hotel. (The express train costs 50 and the metro ride costs 6 and could not be easier to navigate.)For 3 nights the location was ideal, central to everything. If you are feeling ambitious, at 7am you can walk up Nanjing Road to the People's Square and see all the morning buzz of exercisers and dancers. What a treat! The hotel itself has a quaint charm to it, I love this type of place! Like the reviewer below I was also on the 8th floor, in 801 which is a corner room, also at the end of the corridor, about TWICE as big as other rooms in the hotel, and 2 windows for a nice airy and breezy draft. I only mention that because, effective October 7, the hotel has dismantled its AC for the winter season. Great for the environment, not so great if you like a bit of air in your quarters. :) Problem solved, just ask (nicely) for a fan for the room,As for all the commentary regarding the front desk staff, I live in Asia and found the staff to be patient, accommodating, and helpful. ALL OF THEM. From the moment I walked in the hotel there was an issue with my Expedia booking that they quickly resolved. I was given a choice of rooms. I was provided a fan for my room, travel advice, restaurant advice, shopping advice, and even a hair dryer on request! I think if as a guest in China you take your time and communicate slowly you in your language, you will be met with a courteous and helpful response. As for the bedding, some reviewers complained and yes the bed IS firm but I LOVE it!! (I'd sleep on the floor if I could, hello tatami mat and futon!) If noise is an issue you'll definitely want to be on the back side of the hotel although I was on the front side and the noise completely dies down by evening. I am generally a light-ish sleeper and had no problem. Actually I thought the room and corridor were super quiet (not even sure there were any other guests during my stay- it was THAT quiet) In room broadband internet is available for .10 a mn or 20 a day, fairly reliable altho did time-out every couple of hours and the government has a ban on F@cebook, Tw1tter and Pic@sa currently in place, fyi. I would definitely recommend this hotel to friends. Also, I highly recommend the sichuan restaurant (told to me by the Front Desk staff hehe) around the corner (try the chicken with peanuts YUMMMM, 28!) and also the Brick Coffee takeaway stand for a delicious Iced Pearl or Milk Tea Coffee (6 and 10 respectively). See photos attached. :)"
3,2274,"Oct 6 2009 	a great find	having hunted through trip advisor for shanghai hotels i went for the Nanjing.The location really is great- 50 metres from shanghai's super shopping street, 70 metres from the Nanjing rd East metro station and right opposite 3 or 4 really good cheap restaurantsif you're concerned about any road noise at night, ask for a room whose number ends between 10 and 17.BTW a few people have said the front desk people are rude-i didn't find that- they were a bit cold but hey, how long do you want to spend at the front desk when you're in shanghai"
4,2274,Oct 4 2009	Good location 50 m to pedestrian street metro 	My 8 night stay was especially pleasant in corner room 820 at the end of the corridor with no passing guests. The wide single beds were very comfortable. Didn't open the windows because it was hot &amp; steamy outside &amp; of course there's noise from the car &amp; motor bike horns. The step up into the bathroom was most interesting &amp; sometimes the shower took time to warm up but worth the wait to be refreshed. Didn't think the buffet breakfast for Yuan 30 worth the money (lots of food choices outside on the stalls &amp; in cafes). The restaurant menu is adequate. Room cleaning was good. Post box outside hotel &amp; PO a few blocks away has a philatelic counter. The police station is a few doors from hotel so lots of men in uniform ! English language channel is CCTV9. Walk the back streets &amp; see a very different world from the one on Nanjing Lu. Get up early to see the tai chi &amp; badminton &amp; people watch.
5,2274,"Oct 3 2009	Extremely Rude Front Desk Staff	The previous reviewers are correct. The hotel is in a great location, right next to the pedestrian mall. The carpet is dirty, the bedding was questionnable, the bathroom is dimly lit, has a strange step up, had lots of mold and half of the showers were cold.The windows are really thin, and the noise is unreal - if you are a light sleeper, do not stay here! The worst part of this hotel is the unbelieveably rude front desk staff.When we asked for directions to a local coffee spot (Starbucks) they pretended to notunderstand. When my white son spoke Mandarin to them (he is currently attending a University in China and met us for the trip), they refused to listen to him. Finally, one ofthe rudies said to go buy a map in the gift shop...they didn't have one map at the front desk! I will never stay here again, or recommend this hotel. There are other places that are just as handy with nice, helpful, staff!"
6,2274,"Oct 3 2009	basic hotel clean good location	People at reception speak english, better than in other places i stayed.Shower has little water pressure.Nothing else to say. Basic.Super location, as good as on nanjing road. Walking distance from the Bund or the People's Square."
7,2274,"Sep 23 2009 	Do they hate their job that much?	State of carpet and hardness of bed was no different to any other hotel we stayed in, in China , BUT the impression you get is that the staff absolutely hate their job and absolutely hate customers!! One big advantage is it's location - close to metro which is great. Close to The Bund - but that's a mess at the moment and will be for some weeks yet I would expect. Great street stalls for breakfast etc - go out door, turn right and both the next street and second street over have plenty of street stalls. Yum."
8,2274,"Sep 12 2009 	great value convenient location	For the rate we got we did not expect the Hilton, which we did not get of course. But we got an absolutely fine room, which was clean and well looked after in a hotel with a great location near the shopping street in walking distance from the Bund (which is of course currently a big construction venue for the Expo 2010) and only a few meters away from the metro station. Did not try the food there as our rate did not incl. any breakfast. Lots of small Chinese restaurants in that street though. Overall a great value for money deal and a completely satisfied stay. Service attitude at the reception was very different, depending from which staff was catering you. One was great, two others not. But we had no probs at all. Would definitely return."
9,2274,"Aug 30 2009 	Unbelieveable value and location	I swapped to this hotel from my hostel further from the centre. I couldn't believe that such an affordable hotel could be right in the centre of the action. It was great to wander along Nanjing Donglu at night, and then just fall into bed. It's especially good for solo travellers like me, who don't really want to be walking a long way to get back to their accommodation at night.The room was fine...clean and comfortable. Some of the staff were a bit surly, but for 300Y a night, this place was fantastic."
10,2274,"Jul 23 2009 	Decent Hotel Great Location	I will just agree with what previous posters said. The hotel is fine - clean enough, standard REALLY hard bed, decent size room. The location is EXCELLENT making it the perfect place to stay when we only had one night to do some sightseeing.The only negative thing I found was that the lighting in the bathroom was terrible and they didn't have any maps of Shanghai available to us."
11,2274,"Jul 16 2009	Great Hotel : )	One of the best aspects of this hotel is its location, right on NanJing road and with easy access to the underground station and the 'newer' parts of Shanghai. The hotel itself was very nice, big, clean rooms. One thing that was slightly strange is that when we were standing in the bathrooms in the rooms everyone felt dizzy!! (we were a big group and nearly everyone mentioned it!!) maybe it was just us. The staff we also very polite and helpful."
12,2274,Jul 6 2009 	Good location and price. Bad hotel	The price is good for the location. The room is not too clean and small. I won't stay there again.
13,2274,"Jul 5 2009 	Best hotel in Shanghai by location and price range!	As other reviewers say, it is truly right off on Nanjing Lu. This is nice considering that this is a tourist hub. The subway stop is also at the corner which makes for a quick route to the MagLev train (to Pudong airport).There is a c-store across the street which I believe is 24 hours which is handy for snacks and water. If you're looking for a nice Americanized breakfast and free wifi, walk up Nanjing Lu toward People Square and stop in at the Costa's. I don't know if Nanjing Hotel had internet because I only had my iPhone with me.The rooms are nice. Booked on ctrip.com for around $40 - $45 a night. They are clean and comfortable. No complaints, except that the shower head's spray was a bit strong (normally a good thing, but there was no other setting). Also, my tub clogged up a bit so I would stand in water while I showered. A minor thing for me, I didn't bother to complain. The beds are standard hardness but China standards. So if you are used to that or know what that means you won't be surprised. If you're not used to it, you'll probably need to adjust to the firmness, unless you're staying at higher priced hotels.Note that the windows do open and the air conditioning works nicely. The rooms on the front side of the building have a balcony which is a treat.The TV only has Chinese channels -- but we were not there to watch TV. Our unit also had a fridge with mini-bar items, but we kept our waters and stuff in there. We also had a safe in the room that was opened by our key card. The room also come with a hot water maker and complimentary tea.The staff is helpful and nice and speak good english. The breakfast spread at the restaurant was only okay. I did not go back as there are many options in the area.Safety: There is some kind of police station or bureau next door to Nanjing Hotel. And though the area didn't feel seedy (being right off Nanjing Lu), it never hurts to see that.One last thing about this hotel. When you walk into the room you get a nice clean smell. None of that musty old hotel funk. For me, that is the moment of truth when entering a new room. Nanjing passed the smell test on the 2 different rooms I stayed in. If my budget is same, I definitely would stay here again. Hope these details help!"
14,2274,"Jun 3 2009	Great location!	Stayed in this hotel as part of a GAP tour and loved the location. Literally a 30 second walk to Nanjing Road and even walking distance to the Bund and People's Square. Also, very close to the subway. Plenty of restaurants in the area (Western and Chinese) and lots of corner stores to buy things like water and snacks (there is also a fridge also in the room to use). The hotel seems pretty old but still fairly clean with friendly English speaking staff. Balcony was also a pleasant surprise and it was nice to lean over the balcony and take in all the sights, sounds and smells of the busy street below. I highly enjoyed my stay!!"
