IDREVIEW,HOTELID,REVIEW
16,679,Sep 27 2009 	what a difference a year makes	Last year I stayed here &amp; was very impressed with the service &amp; was keen to return but oh dear; standards seem to have slipped somewhat e.g. even in the first hour we were not informed about a planned fire test &amp; had to go looking for somebody to see whether this was the real thing when the alarm went off. We also had to go hunting for supplies to have a cup of tea. There was inaccurate information in the room about the restaurant facilities which was compounded by further wrong information being given by the person at the desk - it turned out that one was closed for refurbishment &amp; the other would be opening much later than we'd been told. The rest of the weekend was OK but not a patch on my first visit.
17,679,"Sep 24 2009 	Good location 	Very friendly &amp; helpfull staff. Big rooms for London. Only down side was the breakfast which wasn't up to the standard of the rest of the service,"
18,679,"Sep 23 2009 	Great hotel!	Stayed for 3 nights. The room was booked through British Airways. We loved it from the first minute. Check in was a breeze. Very friendly and nice staff in all departemts. Breakfast was delicious, and no waiting in line as is often the case.The room was modern and tastefully decorated. And there were two armchairs. The beds were very comfortable, and the items in the mini bar were moderately priced (compared to other hotels). They also offered complimentary bottled water. Nice!We had absolutely nothing to complain about, and we will stay there again for sure.Highly recommended!"
19,679,"Sep 1 2009 	Great Hotel with excellent staff	My husband's comment &quot; i find the hotel pretty good, in a great location the good thing about it, no breakfast so watch out which is pretty expensive almost 60pounds for 2person. close to all tourist attractions. All your staff are very nice/accommodating/courteous and helpful, from Lee/Yanis/Mack or Mick(concierge) to the reception : angelo/carlo/ all the girls. The only trouble we had is with the breakfast charges because i made a booking with priceline breakfast included, i was surprised that it's not included and i was told by your colleague that priceline always do that which will have a bad impression in your hotel, should we know that we will be charge for more than fifty pound for the two of us we should have enjoyed our breakfast, we (me and my husband) had cofee, a slice of bread, little fruits, spoonful of egg because i made an arrangement for a tour through your concierge for the evan evans - bath/stonehenge/windsor and the time is limited if we knew we should have eaten more. Wish we had a room with a view. They have everything i expected expect for the breakfast that's why i'm only rating them very good instead of excellent. Another drawback is the blackfriars station being closed but still temple and mansion house station is close by. Would still recommend for people to stay."
20,679,"Aug 29 2009 	Great location	Thank you for making my holiday in London a memorable one. Your staff are wonderful and very helpful with our needs during our stay. Your location is a plus, centrally located, I have a very good walking exercise everyday and enjoying the beautiful scenery of London's historical places.If I plan to re visit London, definitely, 19 New Bridge Street Crowne Plaza Hotel will be on my mindThank you very much"
21,679,"Aug 28 2009 	Excellent Friendly Hotel	Booked a 2 night midweek stay. Am a Priority Club Platinum Member, and booked a Club Room, but was upgraded to a Junior Suite, bonus!The check in staff were really friendly and helpful and answered all my questions and even remembered me by name when I returned the following day to ask a question.The room was located on the First Floor, so the views weren't great but from previous stays, views from the higher floors are nice. The room was exceptionally clean and tidy with a marble finished bathroom. Those booking Club Rooms or Suites are given access to the Club Lounge on the 6th floor. This is decent sized and didnt get too busy during the times I tried it. Free WiFi access is provided along with a wide selection of drinks and canapes. Complimentary continental breakfast was provided in the lounge for those in Club Rooms.Only downside, which is no fault of the Hotel's is London Blackfriars station across the road is undergoing major refurbishment as part of the Thameslink project. So this means the Tube Station is closed so need to arrive by National Rail services or by bus. However the Hotel is ideally situated for most tourist attractions and I was able to get across London with ease from the Hotel.Overall I was exceptionally pleased with my stay and would definately recommend it ahead of all the other Crowne Plaza Hotels in London."
22,679,"Aug 16 2009 	London holiday after 29 years away!	I trained at a London hosp. for 6 yrs but left 29yrs ago. This was my first return, together with husband and children (13&amp;11) Stayed at hotel for 6 days- a superb,spacious,calm &quot;oasis&quot; in the centre of London. The staff were so friendly,polite,kind and helpful. Children loved the breakfasts,and I was very pleased to see such healthy choices!Such a good,central location. Nearest tube Temple as Blackfriars is closed until ?2011. Only 30 mins from Gatwick to Victoria, and a few mins to Temple on tube. Don't forget to save money by getting OYSTER Cards for travel in London. Hotel is great to walk to Globe &amp; National theatres &amp; Tate Modern over Milleneum Bridge. Also St Paul's &amp; M&amp;S food shop.We did so much,but the list is too long. You can do a family holiday in London for less money, and we all want to come back again from the Scottish Highlands for another holiday of walking,picnic lunches,museums,art galleries,the Wimbledon tour,Globe theatre (5 tickets) a Harrods visit (the pets dept!) and different meals out each evening. Enjoy family time with your teens before they get too old!!! Children want to come back for before Christmas to do it all again! We'll see!"
23,679,"Aug 4 2009 	Breakfasts need some work	Just to confirm this is generally an excellent hotel. However those planning to stay on the 6th floor need to know that breakfast service can be very poor.We stayed for four days and on each of the mornings a big deal was made of setting the table, producing cereal bowls, cutlery etc. Just to clarify we showed up earlier than 9:00 a.m. on each morning (breakfast runs until 9:30 a.m.). A hotel of this quality needs to do better."
24,679,"Aug 2 2009 	Great Location	I think you could not ask for a better location, main London attractions are only at walking distance and you can find Bus Stops and Tube stations just a few meters away from the hotel. Make Charing Cross your station and take the 15 line. The rooms are neat and clean and staff is very helpful. Some rooms in the 7th floor even have a view to the Thames River. I think this the best choice for business travellers."
25,679,"Aug 2 2009 	An excellent hotel in London close to everything you need have stayed before and will stay again!	This was our third stay at this hotel and even after a two year gap since our last stay, we found the hotel to be just as good as it was last time.We got the rooms at a steal, a deluxe room with two double beds for 120/night. We stayed three nights, with the first night on rewards points.The hotel is located in the City of London and is popular with business travellers. It is right across the road from Blackfriars (The underground metro I believe is closed for repairs, but the above ground rail line was still working) and there are many other stations just up the road. At Ludgate Circus there is a bus stop with many routes that will get you to the popular tourist attractions.Reception staff were friendly and efficient, as were housekeeping and concierge. Housekeeping was very quick with delivering any requests.The hotel offers a complimentary morning newspaper to all guests and you can get whatever newspaper you want. You can also pick up an additional one in the lobby if you want, and they didn't have any problems with delivering two if you wanted.There is a Portland convenience store just across the road which is open late into the night, it might possibly be 24-7. Prices there were reasonable. There is also a Starbucks and Costa Coffee within view of the hotel entrance on New Bridge Street. There are some Boots places just up the street where you can get your pharmaceutical goods as well as drinks and snacks.Now onto the rooms, which are beautiful! The rooms are large for London, many hotels don't have rooms which could fit two double beds and still have plenty of room to spare. The hotel has standard, deluxe and exectutive rooms (exec. rooms can't take two double beds for some reason). The TV was an old style one but it had a large screen and plenty of channels including many international ones. Deluxe and Executive rooms have free wired internet, while in the Standard ones you have to pay. Sadly no wi-fi here. There is a business centre which you pay for. The bathrooms were very good with some of the best towels I have had in a luxury hotel. Complimentary tea, coffee, biscuits, small chocolates, mineral and still water is provided and replenished daily.Previous reviewers have commented on the lack of views. The hotel is low rise (presumably building restrictions, same height as all the other buildings on the street) and I don't know what view people would expect in a city block. If you get one of the higher floored rooms you may have a view of St Paul's or a glimpse of the Thames. However, the benefit is that the rooms are nice and quiet.Previous reviewers have also commented on the refurb work in the lobby. I'd just like to point out that this isn't an inconvenience as the lobby previously was just an empty space with a few sofas, but will now be transformed into an area where people can meet and enjoy light meals and drinks. there is definitely no noise coming from the refurb work to the rooms.The only real inconvenience with the refurb is that Spicers is closed. However, Refetorrio is still opened and is serving breakfast in the meantime. We went to Refetorrio for a late dinner. We just had some pasta and a sampler plate as well as wine and it cost 90 for four, not too bad considering it is owned by Georgio Locatelli, who is supposedly michelin-starred. The pasta dishes varied, some of us got small servings which weren't too tasty, while others found it tasty and quite filling. I suppose you just have to be good at choosing!The pub across the road looked good (was busy) but we didn't get to try it. Breakfast is served there until noon and then it is regular food into the night. We went to Chez Gerard in Covent Garden and loved it, I highly recommend. If you would like to have something simple I suggest the Marks &amp; Spencer Simply Food just next to St. Paul's, we all got sandwiches, cakes and drinks, all freshly made for under 20.On one of the night's near Ludgate Circus there was a weirdo who started talking to us. We avoided her and kept walking and she followed for a while until two big dudes came out of the pub and she stopped. I don't see this as a barrier to staying at the hotel, but thought I'd let you know.We are Priority Club Platinum members but there were no real benefits for us, probably because as a group of four we had already booked the best room possible that all of us could sleep in. So perhaps if just one or two people went and booked a deluxe room with a king bed, they might get upgraded to executive.Just a note, getting a taxi on Sundays, especially in the morning, can be difficult. Concierge said that they found it better to go out to New Bridge street and hail a taxi instead of calling because it can take longer if they call. It might be an idea to call reception a few minutes before leaving or checking out to inform them that you require a taxi.The best options to Heathrow or Gatwick are taxi or train. We found the First Capital Connect train from Gatwick very good, as it stopped at Blackfriars and all we had to do to get to the hotel was cross the road!So all in all, I would definitely recommend this hotel, especially at the price we paid. If anyone requires extra information please message me."
26,679,"Jul 30 2009 	Not impressed	Upon our arrival we found out the price was british pounds per night rather than the US dollars that we were quoted by ITC Hotels Group. The desk was able to find us another room at a different hotel in the chain but not for the following 2 nights. We stayed two nights at the Crowne Plaza and for the price we paid (195 bp), we would definitely NOT say this hotel was a good deal. We had the larger &quot;club&quot; or executive room with free drinks and canapes in a club lounge. We probably could have gotten our money out of the stay if we drank heavily, but we don't. The bar that you hang your clothes on in the closet in our room collapsed as soon as we hung our clothes on it. The room may have bigger by London standards but it wasn't large by our standards. The rate included a full english breakfast buffet on weekends. The breakfast was less than satisfactory as they constantly ran out of various items. Not to mention that breakfast was served in a conference hall rather than a restaurant. Travel to and from the hotel was also difficult because of construction and the Blackfriars Tube stop being closed. We did not think this part of London was good for a family or sightseeing. The staff was marginally helpful at best with the exception of the desk manager who tried his best to accommodate our requests when we arrived. In the end we were switched to a much less expensive hotel, The Holiday Inn Express in Bloomsbury, which had a much better room for substaintially less, in a better part of London, with a better breakfast and much friendlier staff. Overall, I can't complain too much because we only stayed at the Crowne Plaza 2 nights and we stayed at the Bloomsbury Holiday Inn 7 nights. Who would have thought a Holiday Inn would be that much better than a Crowne Plaza, but it was, trust me."
27,679,"Jul 29 2009 	Was UNAWARE of hotel renovations taking place!!	I arrived at the hotel with my partner last weekend for a birthday weekend treat to half a hotel reception, half is 'boarded off' for refurbishment. I would not have minded half as much if i had been informed about the hotel renovations when booking the hotel online and speaking to someone on the telephone to confirm a 'room with a view'..The view was 'Blackfriars' train station (which is also going through major refurb and is a building site). The room itself was a very nice size, and one of the biggest hotel rooms ive stayed in, when in a london hotel..Unfortunatley due to hotel fefurb the hotel's restaurant was not fully up and running..The hotel does have a small gym, but my room card would not let me enter the gym (dont know why)..? The hotel does have a nice bar which offers a range of cocktails..overall i would stay again, just after the refurb!!"
28,679,"Jul 18 2009 	Ok hotel.	We redeemed our Priority Club points to get this hotel free. The hotel is located within a short tube ride of any attraction. It is very close to St. Paul's Cathedral and the Thames. We also walked to Big Ben from here. The tube station right outside the station is closed for renevation (Blackfriars), but there are several other stations within a short walking distance. The lobby was under renevation when we were there, it will probably be nice when it is completed. There was more construction outside our window, but it did not distract us from sleeping. The only major issue was that the celling was leaking the day we left. Overall, it was an ok hotel. It will probably be better when the lobby is completed and when the tube station renovation and the outside construction is completed (though this is beyond the hotel's control)."
29,679,"Jul 14 2009 	Comfortable good hotel and value but don't expect to be dazzled	My wife and I stayed at Crown Plaza The City for 6 nights in early July. IMPORTANT NOTE: Blackfriar station is closed until 2011 for renovations, you must use Mansion House or Temple (preferred) tube stations. The staff was friendly and professional but we didn't often see or speak to anyone the 6 nights we were there. After checking in, there was hammering coming from below (there is some construction going on in the hotel), but the front desk quickly moved us to another where it was honestly one of the most quiet hotel stays I've had. &quot;The City&quot; (name of the neighborhood, old London) is close to other places but is fairly bland in some ways and is kind of deserted on the weekend. Overall a good experience, comfortable and a good value but don't expect to be dazzled."
30,679,"Jul 11 2009 	A hotel that gets everything right.	I have stayed at some of the best known hotels and resorts in the world but they could all learn something from this hotel. From arrival to departure these guys got it absolutely right. As is often the case it was the small things that made the difference. Reception staff who are warm, friendly and efficent without being obsequious or(as is often the case)indifferent. They were actually training new staff on the reception procedure as we checked in but there was no delay, no fuss, no awkward silences. The staff talk to you as they tap away on their keyboards so if there is even a slight delay you never feel you are being patronised. The restaurant and bar facilities, along with the staff, are first class. No matter what time of day or night the quality of service never falls below excellent. I have never stayed in this hotel before but its the first place I would stay whenever I am in London. And, for any cynics reading this review, I do not work for this company. I just happened to have found a hotel company that treats its guests as people, not cash machines. WELL DONE CROWNE PLAZA LONDON!"
31,679,"Jul 9 2009 	Lovely London hotel - central with great staff	We stayed here for two nights around our wedding. The staff at the hotel were fantastic and bought us champagne into the room as well as chocolates in the evening. The rooms are spacious and they upgraded my family for free as well which was really kind. The hotel is very modern with lovely bathrooms and it is spacious for London.The location is great, near to the river, Temple tube station and the central sights. The restaurant in the hotel is also fabulous and we had a great evening meal there which i would recommend. The bar is excellent too and has good cocktails and a DJ at the weekend."
32,679,"Jul 7 2009 	Fantastic Hotel great location lovely staff	I would highly recommend this hotel. My sister and I stayed here because we got a good rate and after reading the excellent reviews on here.The hotel is easy to find and just a 5/10 minute walk along the embankment from Temple tube station. The hotel will be even more accessable as soon as Blackfriers tube re-opens. The staff were very friendly and helpful and check in was done in minutes. Our room was on the first floor and we'd noticed some roadworks outside the hotel on our way in and were worried we'd be disturbed but the sound proofing is amazing! Ive never stayed in such a quiet hotel room in my life. The room was a good size, modern and spotlessly clean. There were 'White Company' toiletries in the bathroom and a plentiful supply of clean white towels. My sister and I went to see Take That later that evening at Wembley Stadium and were glad to know we were only a few tube stops away from our super comfy bed after an evening of singing and dancing!The next day we walked to covent garden from the hotel which only took us about 20 minutes strolling along with a coffee. I wouldnt hesitate to recommend this hotel or to stay here again and infact im sure I will everytime I visit London."
33,679,"Jun 30 2009 	Was good hotel for very good price	This hotel is located on the north side of the City (financial district). Location was good for easy access to Tower of London and Tower Bridge. It is about 8 blocks north of the Tube station. There are a number of buses that go by both the Crown Plaza and Tube station. Tube is excellent for getting around London central. If you are going to be out each day, get the day pass/ticket. Crown Plaza (City) seems to be business oriented. That was fine as we were in town over the weekend. It was a good stay for the price paid."
34,679,"Jun 27 2009 	Excellent!	This hotel is inviting, elegant and the services are first class. The staff was polite and accomodating. The rooms are clean, nicely decorated and comfortable. The hotel is close to the tub/metro and the busline. Only negative, no restaurants within walking distance that are open for dinner. I highly recommend this hotel!"
35,679,"Jun 27 2009 	Fantastic can't fault it at all yet again!!!	We've lost count on the number of times we have stayed at Crowne Plaza, The City, and once again we were not disappointed. We stayed here twice in the space of a week, backing onto our holiday in Croatia. On arrival on the first stay we were lucky enough to get an early check in and an upgrade to a Club Room, we were also upgraded again on our following stay.The rooms are clean and tidy with a nice modern decor. Air-conditioned (although they could do with dimming the light on the air-conditioner as I had to put tape over it during the night as the little green light is just way too bright!), with all the usual mod-cons. Great addition was the plunger coffee, biscuits and chocolates in the room. Always a nice touch.Something exceptional this stay was the staff honesty and hotel security. We were completely in holiday mode and on our first stay left all our foreign curency in the safe (which we left open), value of 350. Once we got to the airport the following day, as we stayed the night at Gatwick for an early flight, we promptly called the hotel in the hope that they may have found it. Obviously unable to provide an answer immediately, we had to board the plane and wait and see thinking our 350 was lost, so the holiday was going to be double the cost! Very pleased on arrival of our flight to pick up our messages with the good news that 'yes' ALL the money had been located and was stored securely in the main safe for our return the following weekend, very efficiently providing a reference number for collection. What a saviour!Could highly recommend this hotel, it is only a 10-15 minute walk to Covent Garden. The service is always exceptional and we always have a great stay.We didn't dine in the restaurant, but could highly recommend a nice local Malaysian restuarant called '54' which is on Farringdon Road (yes you guessed it, No 54.) for dinner."
36,679,"Jun 23 2009 	Great modern spacious hotel	Stayed here whilst travelling to London for the night and couldnt have been happier.Firstly, the hotel is perfectly positioned for anyone using First Capital Connect trains (Luton airport, bedford, brighton etc) as the train station for gettting on them (city thameslink) is located &lt;200m away. So we had a nice easy travel to the hotel which was brilliant. The tube station that the hotel is right next to (Blackfriars) is closed for renovations currently till 2011 however Temple statino is a short and lovely walk away along teh thames so not too many complaints there. Location was great for walking to west end theatre, buckingham palace, big ben &amp; st pauls so near all the sights. Quiet hotel.Service was excellent - the conceirge especially was sooo helpful with our requests and really went the extra mile to help us find a restaurant.We received an upgrade to a club room which was brilliant - the rooms were spacius, modern and had all the mod cons - including an ipod dock so we could just slot in our ipod and have music playing. The beds were comfortable and the bathroom was great. Rare to find a modern hotel with large rooms in london and i would strongly recommend staying here."
37,679,"Jun 23 2009 	Dreary hotel in the wrong part of town	Afraid it looks like I am going to be the dissenting voice amongst these reviews. I was bitterly disappointed by this hotel. Set in a dead part of London, down a dreary back street, it's only redeeming feature was its staff who were efficient and friendly throughout the hotel. The Club level rooms were probably the worst of any Crowne Plaza I have stayed in, poky, dark, dreary, cluttered with outdated furnishings and beds that are adequate at best. I dread to think what a standard room is like. After several miserable stays in the group's hotels lately, this is the hotel that, after seven years as a Platinum Priority Club member has tipped me over the edge with the group's declining quality in all it's UK locations and take my business to Marriott. If you get a cheap deal, stay here. If you are paying full rate there are better located and higher quality hotels to me had for your money in London.By the way, no mentipn of it on the hotel's website but Blackfriars tube station across the road from the hotel is closed until 2011 making it's remote location even more of an issue"
38,679,"Jun 12 2009 	nice location	Big rooms, nice breakfast, but parking difficult, and difficult to reach with workts"
39,679,May 27 2009 	A Top class hotel with outstanding staff!!!	My husband and i recently stayed at The City hotel and i can honestly say It was one of the best hotels we have stayed at!! We were celebrating our wedding anniversary and the hotel upgraded us free of charge and then sent Chocolates and a hand written anniversary card to our room!!!! That was such a lovely gesture!! The hotel was spotless and very modern and ALL of the staff were so so friendly!! I would 100% go back to stay there and recomend it to anyone!!!
