IDREVIEW,HOTELID,REVIEW
110,363,"Jul 17 2008 	Beautiful property but seems like inconsistent policies	First off, this is a beautiful, new clean property and I have to give Hilton thumbs up on the decor and construction. The pool is terrific, the fitness center is terrific, the Marketplace is terrific, etc.But I am dismayed to read that a mere Silver member was given an upgrade to a suite with no questions asked and Diamond members are not. My husband and I are Diamond members and we received the proverbial eye roll when we asked about an upgrade. We were there during the week and the hotel seemed to be pretty quiet, so we just assumed it was the property's policy not to upgrade.I have to say, I too found the owner/renter distinction rather irksome. It felt like an us and them between Hilton and Hilton Grand Vacations Club. Hello guys- aren't you all supposed to be on the same team? If I get treated better at Hilton Hotels why would I ever buy into the Grand Vacations Club? It just seems counterintuitive to me.So it seems that this is a perfect place for owners, silver members, and those with no status with Hilton. The rates are very reasonable, the location was great, and, once again, the property is very nice.One more thing- the traveler who had the bad experience with the door not latching was right on. Luckily nothing was taken from our room, but you have to make an effort to make sure the door actually latches every time you leave the room. There was security making rounds throughout the night and that was great and they were very friendly.I don't know if I would stay here again or not. The price and setting are great, the employee's apathy at registration and attitude towards renters are not great."
111,363,"Jul 14 2008 	Awesome Beautiful Wonderful Fantastic	This is one of the most beautiful resorts I have every stayed at. As an RCI owner, and it was well worth the points. The pool is absolutely gorgeous. There are grills outside where you can grill lunch or dinner.  The rooms are beautiful also, very comfy and roomy. I had a 1 room/ 4 Person max suite. It had a full kitchen, garbage disposal, wahser/dryer, and several other accommodations that other places do not have. It was great to be able to go to the grocery store, buy food, and cook at the hotel.  The hotel is on the north side of the strip and is pretty far walking distance to many of the newest casinos, but you can drive and park at any casino or take public transportation.  Other things- The staff was great. The valet was great. There is nothing negative that can be said about this place."
112,363,"Jul 13 2008 	Great Hotel	The Hilton Grande is a non-gaming hotel on the Las Vegas strip across from the Sahara hotel/casino. In the four days we spent in Las Vegas on our honeymoon I noticed that the other hotels no matter how nice on the outside all smelled like smoke and sweat on the casino floor. When you add in the noise from the gaming floor and the fact that most of the check in desks require guests to walk through the casino I have to say that the Hilton Grande was the BEST hotel we saw all weekend.We spent the weekend in a one bedroom king suite and it was beautifully appointed. There was a full kitchen with utensils and coffee, creamer, and sugar w/ the coffee maker. The living room was very comfortable and the bathroom had more towels and washcloths then we could possibly use. Checking in at the front desk was quick and easy and the check in agent even called our room to let us know where the fireworks would be over the weekend so we didn't have to stand there and wait for him to look it up.The marketplace downstairs is a little pricey but very convenient for a Starbucks coffee or breakfast sandwich before a tour. There is a CVS next door where we purchased a 6 pack of water to put in the fridge and take with us during the day.We used the monorail to get up and down the strip and it is very convenient to the hotel. When you leave the hotel through the front lobby walk to the left toward the Sahara hotel. When you enter the Sahara the Monorail entrance is at your 1 o'clock. It took us all of 5 min to get there and the Sahara also have a few rides that the brave amongst you may find fun :)On our next trip to Vegas we will definitely stay at the Hilton Grand again. I saw so many people schlepping their luggage through casino floors that there is no way I would stay at a gaming hotel in Vegas."
113,363,"Jul 9 2008 	Great stay if you don't want to sleep	My friend and I had a one bedroom over the 4th of July weekend. When we got to our room we thought that it looked really pretty and the check in staff were very friendly and helpful. The HUGE problem was the sofa bed where I was sleeping was the worst. After the first night of sleeping on the torture device I called the front desk to see if I could get a roll-a-way and I was told that they didn't have any. What hotel doesn't have a roll-a-way??? After the second night of sleeping on the rack I called house keeping to bring me up pillows as I was going to sleep on the floor which they never brought me. On the last day I went to speak to the manager about never getting my pillows and I wanted to confirm whether or not they actually have roll-a-ways and he told me they did not because of fire hazard. But what he did say is they do have foam toppers for the sofa beds. This would have been helpful three nights ago with no sleep. So, if you are going to stay here and you have to sleep on the sofa bed make sure you ask for a foam topper your first night - and good luck!"
114,363,"Jul 4 2008 	Awesome	What a wonderful experience! Everything about this place is awesome. We stayed in tower one. Our room had a separate bedroom with a Jacuzzi, a great bathroom with a beautiful shower, a full kitchen (Albertsons close by to buy food) and a living room. We requested this room since it was our 25th anniversary. The management sent an employee to our room with a nice bottle of wine! The price was right at $129.00 per night!!!!!! I have been to Vegas several times and this was by far the best place we have ever stayed. The fact that there is no casino is a major plus. I was glad that I didnt have to experience that nasty stale cigarette smell every time I entered the building."
115,363,"Jun 30 2008 	Bargain On The Strip	If you're looking for a base of operations for having fun at various points in Vegas, this would be the place.Relative to the amenities, this hotel is a bargain. Our suite was an Embassy Suites equivalent for less than 2/3rds the cost of a standard hotel room at The Bellagio or Caesars Palace. After a long drive, the in room washer and dryer came in handy, as did the full kitchen. The spa tub was average, the walk in shower outstanding. Separate air conditioning units for the living and bedrooms came in handy as well.The hotel's pantry area was well stocked with a wide variety of food offerings, however the Business and exercise centers were too small for the volume of evening users.Just three quibbles:1) The pantry area did not stock drugs, necessitating a trip to a neighboring CVS.2) The 10 a.m. check out time is too early. As with other Hilton properties, this should be either 11 a.m. or Noon.3) There is no Express Check Out with receipt option. This would seem to be a no brainer as other standard Hilton properties offer this service for Hilton Honors members.All told, if the conveniences of a downstairs gaming room isn't necessary, and you're looking for a medium or long term stay in Las Vegas, and want to be on the strip, this is your place."
116,363,"Jun 29 2008 	bad experience	We are Hilton vacation members and stayed here last year the same time starting on Father's Day for 4 days and this year stayed from Sunday through Saturday. We were so pleased last year with everything since we hadn't stayed at a resort since we bought our vacation membership in Orlando and everything was just as nice and the staff was very friendly.  We rented out the 3 bedroom suite plus in the 2nd tower so it's very roomy and like a home away from home. Our horrible downside to the trip was on Thurs. night my husband and son came back late from running to Circus Circus for a clay face sculpture and then they ran downstairs to the market and forgot to put the security latch on the door. In the middle of the night sometime between 12:30am and 6 am someone pushed on the door and was able to open it and took my purse, my husband's cash and my children's wallets from the kitchen table. It was very scary since our children were sleeping on the sofa bed in the living room and my mom, sister and her family were all there also. A security guard came by our room around 6am and tried to wake my daughter up but just opened the door and turned the door handle that the thief (or thieves) had left in the locked position so when they left we wouldn't hear the door shut. The doors are very heavy and make quite a loud sound when shut.  We were informed the next morning when we reported the crime that 4 other guests in Tower 2 had been broken into since the security guard informed us that it's possible to get into the rooms if you push hard enough on the doors. We were upset that more isn't made to the guests to be aware and that the resort doesn't have video cameras in the hallways. They supply the kitchens with Cuisinart appliances but can't afford a higher level of security? The only saving grace to our trip was that the security staff was able to retrieve my purse which had my digital camera and cellphone in it. None of our credit cards or debit cards were taken just the cash and we are thankful that none of us were harmed. Just a warning to others that you are in Vegas and even though before that night we had put the security latch on we had felt totally safe and probally had our guard down."
117,363,"Jun 22 2008 	A+++!	I was scheduled to stay at the HGVC on the Strip from June 10-20, but because my flight was cancelled I didn't make it to LV until the morning of June 11 instead of 8:30 p.m. Tue. night.When my flight was cancelled I called HGVC and apprised them of the situation, and told them I would be there hopefully by 10:30 am Wed. morning. When I arrived I was able to check in right away, and the manager even credited me for the previous night, which I didn't expect (but was much appreciated). This place is wonderful from the top down!I had booked directly on the Hilton website at $80 weeknight/$107 weekends for a guest room, and am a silver Hilton Honors member. Latanya was at the front desk and checked me in. I was upgraded to a 1-bedroom suite, which was wonderful! She put me in a suite away from construction (per my request). I faced Sahara Ave. and the Stratosphere and was on the 11th floor of Tower 2. I encountered no attitude from anyone because I was just a &quot;renter.&quot; The suite is just like the photos that have already been posted and was extremely quiet. We had no people partying in the hallways; everyone respected everyone else, even the families with kids.I had a rental car and parked in their new parking garage. Self-park starts on the fourth floor, but it really doesn't matter what floor you park on after that; just park as close as you can to the elevators, even if it's the 7th or 8th floor. It's a very short walk to the hotel (hint: once you get to the hotel, instead of walking up the steps, walk around to the left to the side entrance. Your card key will open the doors.)The elevators in both the hotel and the parking garage are extremely fast. There are 5 elevators for Tower 2 and 3 elevators in the parking garage.I was worried that it would be hard to get in and out of the hotel onto the strip, but it was extremely easy. If you're driving north on the strip you can make a left-hand turn onto the hotel property. Or you can drive I-15 or Industrial Rd. to Sahara, drive south on the strip and take a right into the property. I remember when traffic backed all the way to Sahara, but it certainly didn't do that even on Fri. &amp; Sat. nights when I was there. If you want to get to Industrial Rd just take a right onto the Strip from the hotel, drive down to Circus Circus Blvd., hang a right and go down to the light...that's Industrial. Very easy to get to the parking lots behind the west-side Strip properties or to the Rio, Palms, or the Gold Coast. Very fast to get anywhere.I had a problem one night when the sound on my living room TV all of a sudden went out. I wasn't even close to the remote. The next morning it still didn't work, but the bedroom TV was fine. I called maintenance and he was there in no time. He said in Tower 2 the rooms are so close to each other that a remote in another unit can accidentally affect other TVs; I just had to turn the Bose sound system back on, so that was interesting.Everyone I encountered was always smiling and very friendly, from the front desk personnel to housekeeping to maintenance to the security personnel in the hotel and in the parking garage.No matter how late I was in my room (I had to work in the room a couple of days), when I left and returned a few hours later my room was always cleaned and ready for me.I give this property an A+++ and would love to stay here again! I would recommend it to anyone, unless you want to walk through a smoky casino to get to your room.--Mary"
118,363,"Jun 15 2008 	Not your typical LV hotel	My husband and I stayed at this hotel for 3 nights in June while we were in town for a friends wedding. His was our first trip to Las Vegas and decided to stay here based on the reviews and photos we researched on Trip Advisor. We booked a studio since it was only going to be the two of us and we were not planning on being in the room to much anyways. We paid $438 for the three nights and we booked directly through the hotels website. I know we could have gotten a better deal if we would have sat through one of their timeshare presentations, but our time was limited I did not want to waste it. We did get asked that if we would like to return and sit through one of their presentations we would receive a discounted rate per night (I think it was about $50/night stay for two nights).I really enjoyed this hotel. The lobby was nice (no casino to walk through ?). Check in was quick and efficient. The room looked exactly as we had seen in photos and very clean. The studio has a small kitchenette with a small refrigerator, microwave, toaster, sink, and coffee maker (no stove). The market downstairs was wonderful. Although the prices were a bit high, the quality was high as well. I guess you get what you pay for. We bought breakfast items at the market every morning and ate them with coffee we would make in the room. The best thing we liked about this hotel was not having to walk through a loud and smoky casino to get to your room. The thing we liked the least about this hotel was our loud neighbors and the noise in the hallways at night, but what can you expect????its Vegas right?"
119,363,"Jun 10 2008 	Overall a great hotel.	We stayed here over the weekend and ended up with the room for free for two nights because I redeemed Hilton Honors points- suffice it to say I have no complaints over the priceThis hotel is at the very end of the strip (the Sahara and the Stratosphere were the only hotels that were further down) and is not a casino-hotel. For us, that was a plus. We had the luxury of a quiet hotel where we didn't have to fight the masses, and where hotel guest interests are not second to casino interests, but we were close enough to walk to some of the older casinos and in easy driving distance of the newer, bigger casinos. There is plenty of free parking in Vegas, so we didn't bother with a taxi/ bus after the first night.There were only two negatives during the trip. First, the employee who checked me in at the front desk was a bit surly and pretty much blew me off, after I had waited in line for about 15 minutes (with only three people in line ahead of me and about 5 employees working the front desk). The wait seemed to be caused by the fact that the employees were courteously explaining all of the property amenities and location information to the guests checking in. I appreciate that and think it's a great policy, but when my turn came, I was processed in about two minutes, not given any location or property information, and, figuratively speaking, pushed on my way. The employee did not ask if I had any questions, did not tell me to have a nice stay, nothing. He was actually calling the next guest before he had handed me my room keys. I don't know if that was because I had booked with points, or because I was a &quot;renter&quot; and not a Hilton Grand Vacations Owner. In any case, I am a Hilton Diamond member and spend a lot of time and money in Hiltons during the year and the attitude was off putting. The other issue I had, and this is a bit petty, is that the property did not offer complimentary upgrades to Diamond members. The hotel was not full- we only saw two other parties on our floor the entire weekend, so there were certainly upgraded rooms available. We did get the room that we booked on a fairly high floor. Though it was nicely decorated, it was very cramped and seemed much smaller than rooms in which I normally stay.The attitude of the front desk employee, the fact that I was clearly labeled &quot;renter&quot; (definately second class to owener), and the upgrade policies have soured me on staying at Hilton Grand Vacations properties in the future. I will stick to traditional Hiltons.The positives, however, did outweigh the negatives. The rest of the staff we enountered- and I mean everyone- was extremely friendly and professional. The property is beautiful and new and clean. There are microwaves, refrigerators, silverware, and dishware in even the smallest rooms. The pool is absolutely fabulous and never seemed to be overcrowded.Despite other reviews, we did not find not having a large restaurant in the hotel to be a problem. We bought drinks from the market and kept them in our room and got sandwiches from the in- hotel Marketplace, which we did not find to be overpriced, crowded, or slow. And the sandwiches were huge and very good.The fitness room was top notch. There is an activities room that always seemed to be in use. We didn't try the Spa, but there is one in the hotel.All things considered, this is a great property for anyone who wants to stay close to the action, but not in the thick of it."
120,363,"Jun 7 2008 	Great hotel great location beautiful!	We booked this as a trade through RCI and i have to say it is the nicest trade we've gotten. Beautifully appointed two-bedroom suite, more than enough privacy for us and our friends who stayed with us. Full kitchen was a big help because we had someone who was vegan staying with us and made a lot of his meals in the condo.The staff is helpful, courteous and professional. Thought the prices in the Marketplace were pricey but there is an Albertsons 5 minutes away and a CVS next door.Pool was nice, clean and the bar was convenient. The Deuce (bus) stops right outside the driveway and you really don't need a car to get around Vegas, we were able to get down the Strip and to downtown (Old Vegas) very easily."
121,363,Jun 2 2008 	Love Las Vegas	I loved las vegas and this hotel.Great Price and Great ServiceJust Perfect to be in Las Vegas.Amazing Experience!!
122,363,"Jun 2 2008 	Quieter location and good value	We booked two one-bedrooms through HGVC about 8 months ago. We stayed here with another couple for 3 nights during Memorial Day weekend 2008. We requested that the rooms be adjoining or at the very least, be on the same floor across from each other. We got neither. Both rooms were on the 22nd floor of Tower 2, several doors apart. One room faced the north end of the Strip with a great view of the Stratosphere and the Sahara. The other room faced a construction site. Since we were rarely in our rooms and only stayed there at night, the lack of a view from one of the rooms wasn't important. We were allowed to check-in earlier than 4PM. The rooms were clean and smelled fresh. We didn't have daily housekeeping and didn't want to pay extra for it. Everything in the room worked well. We did have one phone call from the sales department inviting us to a welcome and update but it was very lowkey and low pressure. I said no thanks and they never bothered us again. We had a problem with our bathroom sink clogging up and the shower door had a gap that let water trickle out onto the floor. We asked for maintenance to fix it one morning and by 3PM, the repairs had been done. There's a nice Marketplace on the 1st floor that was always well-stocked - hot pizza, a nice selection of wine and beer, breakfast items including Starbucks coffee, daily soups and deli sandwiches. They also have several major newspapers. We also used the GrandVacationSpa on the 1st floor. Mr Flippitti and I got massages the first day there. They have a nice relaxation room and the massage therapists are experienced and personable. Our daughter and friend also had facials on Saturday and they claim it was a wonderful experience. You can also use their steam room, showers and sauna when you book a treatment. The prices are comparable to most hotel spas on the Strip. They add an 18% gratuity to the bill but you have the option to change that if you want. There's a CVS Pharmacy right next door that had everything that the Marketplace sells (except for fresh deli items) but at lower prices. It also had a bigger selection of frozen and microwaveable foods. This hotel doesn't have a casino so you don't have to walk through all the noise and smoke to get to the elevators. We never had to wait more than a couple minutes for the elevator. The business center has an ATM, movie rental machine, printer and fax rentals and a place for you to hook up your laptop. WIFI was free in our room but there's a charge to use the business center computers. In the 1st floor game room lounge, I was able to print out our boarding passes for free from one of their computers there. If that's all you need to use their computers for, go down there instead of the business center. The Deuce bus has stops right in front of the hotel. A day pass is $5 per person, one-way is $2 per person. You need exact change. There were a couple of times that we had to wait for the next bus when the first one was too crowded. We also took a couple of taxis and didn't have to wait too long at the taxi stand outside the hotel for them. Our group had two different experiences taking a taxi from the airport to the hotel. We paid $18 for our early Friday ride but our daughter and her friend ended up paying $27 for theirs when they arrived late Friday night. Apparently, in order to avoid Friday night traffic, their driver took them on a longer route to the hotel. We also hired a car service to drive us from the hotel to the airport early on Memorial Day for $63. We liked this hotel because of the quieter location, there was no casino noise and no second-hand smoke. It's far from the major casino hotels and the bus ride may be inconvenient because of the crowds. But we'd likely stay here again in the future."
123,363,"May 29 2008 	Good place great value	We stayed over memorial weekend and got a great rate booking directly with the Hilton. Positioned at north end of the strip the place is comfortable with good service. Rooms are large and clean with good amienities. Only downside is the building site opposite the Hotel, not the best of views from our room. Saying that Vegas is one big building site the number of cranes is staggering - Not sure why Vegas is so popular, bit seedy and scruffy in too many places for me..............."
124,363,"May 23 2008 	A Non-Gambling Hilton Hotel In Las Vegas	I stayed at this Non-Gambling Hilton Hotel for one nite. December 5, 2007. Because I had an early morning flight to catch on my way to South America. I had a great room on the 22nd floor, Room # 621. The Hilton Honors Silver member rate I paid was $ 97 U.S.D. It's located on the north end of the strip.There are no restaurants, except a little deli in the basement, at this hotel, that's why the rate's are so low for Las Vegas. But, there are plenty of great restaurant in L.V. to visit. It's another Great Hilton.....and that name says it all &quot;You Can't Go Wrong&quot;.I highly recommend staying here. 4-Stars."
125,363,May 18 2008 	Loved the Hotel	The Hotel was Great the room was a 1 Bedroom and very clean. We had maid service everyday the pool was clean and large enough so you had room. There was a small store downstairs to grab some quick food. They almost always had pizza hot and ready. There is a CVS Pharmacy right next door to buy anything from liquor to cloths to anything you might need even groceries. There is a lot of construction all around Vegas. Get the view of the north of the strip. The southern view is a hotel half built so your looking at a construction site. The people were very friendly and helpful. If you rent a car at the hotel specify which company you want. I did not and they have a deal with Enterprise. The car was dirty and 50000 miles on it for about the same price as a Hertz or Avis which is usually a new car and clean. That is my only complaint. My room was on the 22 floor and I never had to wait longer then a minute for an elevator.
