IDREVIEW,HOTELID,REVIEW
279,1991,"Oct 17 2006 	A wonderful hip but complicated hotel	Overall, the Hotel stay was great. I took my significant other there for his birthday during the labor day weekend.The lounge and bar area is so cool, and the music playing all around just makes you feel great.The room size was average and the decor in the room was cool, but simple. The views are minimal due to the location and other high rises nearby, so don't stay here for the views.The Blue Fin restaurant is excellent, and the breakfast is especially good there. Service is also great.Unfortunately our Hotel room wasn't ready to check in until 5pm, and we arrived there at 2:30pm, but other than that all went well. They were booked solid the night before and simply couldn't get our room ready in time. Understandable for this busy part of town. It was a bit of an inconvenience, but we stored our bags and went shopping downtown to pass the time, and then were called when the room was ready.The elevators in the hotel are not well designed. You need to take two separate elevators to get from outside the hotel to your room, and finding your elevator is not easy. I don't know why they designed it this way, it was a mistake. They should try to fix this if they can.Valet parking was good, as were the other services.Overall a great place to stay if you want to be in the middle of everything. It is by no means quiet, but it's Times Square."
280,1991,Oct 15 2006	Great Palce to stay	I loved staying at the W time square it was clean close to all the action and I really enjoyed the staff and the bar and resturant. I was did not like was the spa! a bit under kept and the services was not up to par. otherwise Great!!!
281,1991,Oct 10 2006 	Fun in NYC	This was a GREAT property. We stayed on the 57th floor with an amazing view of Times Square. We traveled with 2 different families and the adults and kids loved it equally!!! It is rather dark in the hallways and lobby but it is supposed to be that way. The beds were very comfortable and the location was great to take in a show or wander the hustle and bustle of Times Square. My only complaint was the noise on Saturday night. The traffic and city life was extremely loud even though we were on the top floor. I had to wear ear plugs to get a good nights sleep. Sunday night was very quiet and the ear plugs went in the trash. We had a great time.
282,1991,"Oct 6 2006 	Ultra Hip Hotel with a Lot of Action	The W at Times Square was wonderful!!! If you like to be in the middle of it all, this is the place to stay, but still doesn't have a &quot;touristy&quot; feel. The rooms were ultra hip with flat screen TV's and modern furnishings. The rooms are high enough from the ground that you will have no problem sleeping. Be sure to check out the Living Room at nights after 10 PM. This is the place to be! Keep your eyes open because we saw and met our share of celbs! If you are into the dancing scene, hit the club in the basement of the hotel - be prepared though the bathroom here is unisex! WONDERFUL Hotel!"
283,1991,"Oct 3 2006 	Can't Complain	My Fiance and I stayed at the W Hotel in Time Square from September 22-24, 2006. I have to say that I rather enjoyed my stay. The hotel is very well located in the heart of Time Square. We walked back from Central Park and it took us about a half an hour.The bar at the hotel is very modern and nice. The staff was rather pleasant as well. The rooms were typical W rooms. Very new &amp; modern, although these are a little older than I am used to for a W. Overall I would say that it is a very nice hotel if you are looking to spend some time in the center of Manhatten. Beware though as like much of New York, it is expensive."
284,1991,"Sep 4 2006 	great location rooms a bit small	Great Location if you're a tourist - you can walk to many of the area attractions. The subway is also fairly nearby opening up the rest of the city for excursions.Bar area was spacious and very hip with nice decor.Hotel security was definitely present in the lobby area checking to make sure only guests entered to the elevator area.Everything else was a bit small - not surprisingly but clean.Rooms were, again, a bit small but the beds were comfortable with nice robes. Good water pressure from the shower although lighting was a bit lacking. Rooms were clean and noise level was low (was at the end of the hall).Elevators were small and could get a bit cramped if you have a lot luggage... although we rarely had to share.Parking - be prepared to pay $50/night for valet parking. Street parking can be hard to obtain.The surrounding area had restaurants from a deli to higher end restaurants depending on your budget. The lighting in the streets were adequate and comfortable to walk around at night."
285,1991,"Aug 22 2006 	Fabulous Modern Hotel	My husband and I had the time of our life in New York City and staying at the W was a highlight. The energy of the lobby bar (which we only walked past) and decor of the entire hotel was modern, well thought out, and very aesthetically pleasing and stimulating to your senses. The staff was very friendly and accommodating. Julia was fabulous as were the guys on the 3rd shift doorman staff. They kept us entertained with friendly conversation as we waited 1 hour for our 4:30 AM car service which arrived at 5:30 AM. New Yorkers really are the best! We loved the bed, Bliss products, location, activity, staff, and again, did I mention the ultra hip modern decor throughout the hotel? Oh, and the cookies served in the afternoon were very good. The tour buses leave from across the street and Broadway shows are right around the corner, location-location-location!!!! Please ignore the bad reviews unless you are known to have really bad, drab taste. We will be back soon!"
286,1991,"Aug 10 2006 	WOW W!	Our first trip to New York. Me, Hubby and Baby (18 months) Uncle and Grandparents too - We Loved it! Yes its Uber trendy, however, fitted us well. My daughter asked me why the TV was on all the time - it was the view over Times Square and Broadway that she was looking at. Now at 3 she stills remembers it! Well placed for visiting all we needed to and the concierge and Door personnel were fantastic - understated but seriously clued up.The aspect of the W outweighed any 'minor' imperfections for us.A great time had by all - really pleased we got to stay at W for our first venture into NYC!Oh - and yes, Sage and Lemongrass products from Bliss have become favourites, we were impressed by the toiletries too!"
287,1991,"Aug 9 2006 	Great Location	I recently stayed at the W Times Square with my mother and brother on a weekend trip to NYC. I typically make it to the city once each year with my husband and have historically stayed at hotels in the financial district. I was a little worried when my Priceline purchase resulted in this hotel based on the reviews at the time. We arrived after midnight Friday evening and were met at the curb by the courteous valet staff. We were in our room in a matter of minutes and were pleasantly surprised by our 16th floor corner room with a great view overlooking times square. It was clean comfortable and roomy by NY standards.Throughout our stay, the hotel service was exceptional. Checkout was very convenient too. Make sure to request your car about 30 minutes before you plan to leave.I almost want to thank the folks who left the poor reviews as the hotel blew my expectations away. Nice job, W!A few quick NYC recommendations:- Caliente Cab in Greenwich Village for great margaritas- Jekyl &amp; Hyde for an entertaining meal with children in the village- Hairspray the musical for a fun loving crowd w/o young children (It's hilarious but a little mature at times)"
288,1991,Aug 9 2006 	Ok but not the best	We stayed here over the 4th of July weekend. The hotel is in a great location - right in Times Square and close to transportation. The hotel was ok. I've stayed at better ones in NYC. It was very dark and dreary. We didn't have any problems with noise or our room. We just thought is was a bit stuffy for a W hotel. Stay at the Westin a few blocks away - it's much nicer.
289,1991,"Aug 1 2006 	Very pleasant surprise!!	We stayed at the W in Times Square for a long weekend and we were pleasantly surprised considering some of the reviews that I read here were not so good. The staff at check-in was very friendly. We checked our luggage and the front desk took my cell phone to call us when our room was ready. We walked around the corner and were about ready to order lunch when they called! We ate lunch and then went and checked in! It is always nice to get settled in as soon as you arrive. We were given a great corner room with a large window looking out on Times Square and another window facing south with a slight view of the Hudson river. Our room was on the 30th floor. Nice clean room with robes and bliss bath products were great. Before we left for the evening, I called the front desk to let them know that our sink was not draining. When we returned to the room, there was a note from maintenance that it was fixed. We never had another problem with it. The beds are extremely comfortable!! We were not disturbed by traffic noise or outside lights. I asked for a late check out because we didn't leave for the airport until 4:00 pm and it was sweltering outside. We wanted to have a place to go rest and cool off. Instead of checking out at 12:00, we were allowed to keep our room until 2:00 which I was really grateful for!! The concierge was able to print out our boarding passes for us too. If you want to stay right in the heart of Times Square then this is the place for you!We thoroughly enjoyed our stay and would highly recommend this hotel to others!"
290,1991,"Jul 31 2006 	great hotel!	My family just returned from a 3 night stay at the W Times Square. We booked on hotwire, but were treated like we paid top dollar for this stay! Staff was overly friendly and helpful. We arrived at 11:00am and were given a room without having to wait. My children, ages 10 and 12, loved the room, especially the plasma screen TV. Beds were very comfortable and the room was not too small as I have read in several other reviews. Would definitely stay again! ( And no problem with a request for two beds.)"
291,1991,"Jul 29 2006	W Times Sq. in the middle of it all	I stayed at the W Times Square for the first time July 21-23. As a frequent visitor to New York and a loyal Starwood member, I felt this hotel and location were excellent.The highlights: - If you like the whole W &quot;vibe,&quot; this place will be right up your alley. The street entrance is a trippy, artsy light and water scene that sets the mood. Elevators take you up to the 7th floor &quot;living room,&quot; which is dimly lit and comfortable with fun couches, light projections and a nearby bar. Check in was quick and friendly. - Rooms decorated very modern, flat screen TV, full mini-bar, desk facing the window, overlooking Times Square, extremely comfortable bed and pillows. Shower was all glass - no tub - and quite roomy. Not great water pressure....but hey, you can't have everything. Bliss bath products were a nice treat. - Location is perfect if you're seeing a show (all theaters are within a few blocks - easy to walk anywhere), catching the subway (stations for Blue Line from JFK @ 50th &amp; 8th.....or all lines a few blocks down the street @ 42nd St.), or just walking uptown or downtown. Very centrally located. Big plus for me was Starbucks only steps away from the front door!Really had no complaints about this hotel. Best rates can be found at spg.com...search AAA (if you're a member - they asked to see my AAA card at this hotel) or promotional rates. Standard rates are very pricey, even for New York.The only caveat is for those not familiar with the W. This chain is targeted to a hipper crowd. This ain't no Marriott with a floral bedspread, plastic shower curtain and a coffee shop. Furnishings and bathrooms are very modern (the bathroom door was frosted glass and slid closed on a track) and hallways are moody and pretty dark.Also, since you're in Times Square, there's bound to be honking horns from gridlocked traffic in the streets below and LOTS of flashing lights from billboards coming in through windows if shades aren't drawn - I love the sights and sounds of the city, but some may not appreciate that.If you get a decent rate, splurge for the W Times Square!"
292,1991,"Jul 27 2006	W all the Way	My boyfriend and I stayed here July 22nd and 23rd. We had a great time. The guestrooms were clean and the aroma of the room was just wonderful. From the time we arrived to the time of departure, the hotel staff was very friendly and professional. The Blue Fin was a great place to eat. We had breakfast, lunch and dinner there and everything was fabulous. The Bliss products are absolutely awesome. My only complaint would be the location of the elevators. We stayed on the 51st floor and were a little confused by the elevator setup. Not a major deal but whatchagonnado. This was the first time we ever stayed at a W hotel and we will gladly stay again ~ Wherever, Whenever, Whatever"
293,1991,"Jul 24 2006 	Honest Reivew	My boyfriend surprised me with a weekend trip to NYC for my 26th b-day. This was our first trip to NYC but we have traveled to many other large cities in the US. I have to admit that I was a little nervous about the hotel after reading what many others wrote about it on this site. We arrived at the W around noon on Friday and the check in was fast and friendly. We had a room on the 40th floor with a view of Times Square. Our room was clean, and more spacious than I expected. We loved the bed and the robes! The Bliss products also were a nice touch. He had arranged to have a birthday surprise waiting for me that night which consisted of rose petals leading to the bed and then a big heart of petals on the bed. Also, there were chocolate covered strawberries and champagne waiting for us with a nice card. (This was complimentary). This is an example of how they go out of their way to make your stay special. Also the next night a bottle of wine was sent to our room. (also complimentary!) All the workers were friendly and very helpful. We both enjoyed our stay at the W. The location was great for us first timers to NYC. We didn't hear much from outside while in our room so I don't know what others complained about. There are areas that this hotel could improve upon (not the the service) but overall we really enjoyed it. I would definately recomend this hotel to friends. I would also suggest contacting the hotel to see if you can get a better rate than the internet, and if not, see what they can do for you to make your stay more special.For what we paid I feel we got a great deal!"
294,1991,"Jul 20 2006 	What an absolute dive	This hotel and the services it offered were so bad, it is hard to know where to start. The rooms were very small and the bathrooms minute. There were stains on the bedspreads and the carpets were very tired. The noise from Times Square was dreadful and could be heard on the 46th, 51st and 37th floors (we moved three times to try and find some peace and quiet).The rooms that have connecting doors to another room must be the worst. There is no sound insulation whatsoever and we had to call security at 4am to ask them to speak with our neighbours to turn the TV down.The hotel is under-staffed. Our luggage took a long time to arrive and on departure, they could not find where they had put our luggage (it had been in storage). The lobby (7th floor) was heaving with piles of luggage everywhere and noone was there to help.The only good thing about the hotel was the breakfast. Food was fresh and the service was reasonably prompt. Then again, for US$39 for two smoothies and two toasted bagels, it should be.An absolute dump. It should be closed down, given a thorough cleaning, hire more staff to look after guests, get double-glazing (at least) and get rid of connecting doors.New York has a tremedous choice of hotels, so avoid this one."
295,1991,"Jul 6 2006 	Second and last time at this joint	If you look closely this hotel is a haven for pretentious people who want to stay and play in Times Square. However, it doesn't take a trained eye to see the service, food and housekeeping is below moderate yet you can say you stayed at the W Times Square...BIG DEAL. New York City is full of truly quaint, exceptional hotels that cost the same and provide a much better level of service. It really seems that W is all about the bars and their stupid lifestyle stores-- they've really lost their way when it comes to accomodating business or leisure travelers -- so why give this hotel anymore of my money? You don't get much in return...not even a glass of water with your room service order...that needs to purchased separately from your minibar, folks. Ridiculous."
296,1991,"Jul 3 2006 	Value Yes Nice No	I was at the W Times Square for business. It is a great location for pleasure but it is very difficult to find a quiet spot or an outside cafe. My room was near the elevators and I constantly heard noise in the hallway and elevator music. I did not feel as if I had any privacy. My room was very worn with the most unacceptable issue being a stained bed skirt. I think without a renovation it is a three star at best. I paid $270 including tax, high floor and nice view, so I consider it a value. And last but certainly not least, the staff was wonderful and helpful."
297,1991,Jun 28 2006	different-but good different!	I was a little hesitant about staying at the W after reading some of the reviews on here but I really enjoyed my stay and wouldnt hesitate to stay again at the W!I do agree that while the rooms were overall pretty good-really comfortable beds etc there wasnt a very good attention to detail.The paint finishes were pretty bad and a few things were shabby but not anough to detract from the overall room-for me at least.The location was awesome if its your first time in new york but maybe a bit crazy if you have been a few times before.Its anything but peaceful.The bar in the bottom of the hotel I originally thought was a bit wierd.A lobby/bar is a strange concept but after going to the bar I realised it was actually pretty nice and convenient.The service was fantastic and very attentive.They even sent a follow up email after I returned home to ensure that we were happy with everything.The hotel did have a pretty strange/mod vibe about it with the black hallways ans blue lights which I thought was cool but im young-ish.Im not sure how much my parents would have liked it had they come along.The rooms were kind of small but not still comfortable.The blue fin sushi place downstairs was pretty unimpressive-with so many awesome places to eat in new york i wouldnt waste my time on that one.The double decker grayline bus tour left just half a block up from the hotel which was great-see all of new york in 2 hours and then decide where you want to go back and take a look at on your own or whatever.I would probably stay in a different area next time i visit new york-but if you like the hustle and bustle of times square then this is an awesome hotel.
298,1991,May 30 2006	Great location/ little value	Clearly you are paying for location- it is really really good. The hotel is too pricey for mini-box sized rooms. Make sure to get a room away from the elevators and make reservations for drinks. Multiple elevator changes makes it a long time to get to the room.
299,1991,May 26 2006	Very good overall	We got a really high floor and a very good view even though I booked it a few days before and it is the memorial day weekend. The boutique style hotel looks very sleek and the room look fantastic. It was very pricy and I do feel like there should be more they can offer. Wierdest is they don't have wireless internet. Shouldn't this be a standard to modern hotels? Everything else are very satisfying.
300,1991,"May 25 2006 	Cool and convenient	The W Times Square has a downtown feel with the convenience of being near the theater, shopping and many tourist destinations. It is consistent &quot;W&quot; fare, which means cool decor, swank lobby bar and great service. I recommend as your home base for a fun NYC trip."
301,1991,"May 23 2006 	Not the best place to stay for your precious $$$	One of the reviewers had a terrible experience. We didn't have it so bad but we did have our issues. The bathroom was not really clean, we felt quite uncomfortable we sprayed everything with lysol! the room was dark, no view to speak of, the bed was comfy with plush pillows but their were stains on the sheets &amp; the bed covers were kind of dusty, our room was by the elevator also, room svc was so slow, we also didn't get a nytimes each morning. at $380 per nite, &quot;what should we have expected from a 1st class NYC hotel?!&quot; Must admit the living room lounge was a kool place to hang out (JW blue was $40 a glass!). Staff were quite friendly, Jana our concierge quite helpful. Kate the bartender de-gorgeous! Those were the redeeming value of staying here in the heart of times square. If it wasn't for the staff from the concierge, bartender, doorman &amp; local beat cop recommending Raku down the block for sushi, it would have not been a very good stay at the W. But the sushi at Raku was excellent - so thks to the W-staff, one last saving grace. But I would not recommend staying here."
302,1991,"Apr 30 2006	Lots of Fun!	Many of the reviews of this hotel are true: 1) it is dimly lit both in the rooms and in the hallways; 2) the bathrooms are tiny; 3) some of the rooms are showing their age. BUT, the atmosphere is fun for couples looking to book a romantic weekend. You couldn't ask for a better location in Times Square. The lobby/lounge area on the 7th floor really comes alive after 10pm. And, the restaurant at ground level, The Blue Fin, is really excellent. We found the staff very service oriented (especially the concierge). Best of all is the trademark W beds - very plush - and the best part of a romantic weekend!"
303,1991,"Apr 9 2006	Relieved - it was a great hotel	After reading the views I too was wondering what we had let ourselves in for. Yes the place was very modern and dark. It is by not means a traditional hotel but we enjoyed it. Our room size was fine the bed was very comfy (maybe a little bit short for US standards) especially the pillows and since back home I shall buy one from their website (as I do miss it it was sooo comfy). We were on the 36th floor so not very high and had a view of another hotel but if you looked sideways you could see times square and on the other side the sea. We arrived in the early hours and in the room a light was on for us and also the cd was playing music.On arrival at the hotel you walk passed the concierge desk on the right with the restaurant on the left. It has the water running on the ceiling and looked very impressive. You take the lift to the 7th floor where the main reception desk is together with the lounge area and shop. You then take another lift to your room. We did not see the whisky club or the spa area as we were out sight seeing all day.The bliss collection they supplied to use in the bathroom were fantastic and you could buy them to take home from the hotel's shop which certainly did have some unusual items. I would have liked to have seen a few womans personal items in the bathroom but never mind. The sink and tap had seen better days but I feel that perhaps the quality of the make let them down unlike the shower which had a good well known company name and this worked wonderful and could copy with the constant use.The food in the hotel was good but very expensive. I did have one complaint as one morning after being seated in the restaurant we waited for 15 mins until I got up to ask for the menu. He said he would bring it over which he did. We then waited another 5 mins without being served and a woman came in and was seen to straight away. We then walked out and complained to the Manager. The concierge, Gilmar, was wonderful. He was so nice and helpful and told us everything we needed to know giving us leaflets with vouchers in for free gifts and money off items.I did find the lounge area to be a bit intimidating as in the evenings it was full of people and very noisy. However, one evening we went in there for a drink and found it fine.I would come to this hotel again if it was just my husband and I. I would not feel it is the right hotel to bring my daughter. While we were there (Mon-Sat) it was mainly business people. I feel it is a very business like hotel which showed in the bedrooms that had pc, printers, paper etc.Everyone there was very nice especially Gilmar and the location was very good."
