IDREVIEW,HOTELID,REVIEW
66,1210,"Aug 18 2009 	Don't look beneath the surface!	On the surface, The Cumberland seems ideal. As many other reviewers have attested, it occupies an excellent position directly opposite Marble Arch and directly above the tube station of the same name. Even when you scratch the surface, The Cumberland still appears somewhat exemplary. Striking works of art and space-age furniture dominate the spacious foyer, evoking a cross between an airport departure lounge and Habitat. Add to this Gary Rhodes' flagship restaurant and a well-respected nightclub downstairs and The Cumberland appears to have all the trappings of one of London's premium establishments.Penetrate the surface (by actually staying there), however, and it is a somewhat different story. Step out of the elegant, high-speed lifts and it becomes apparent that much less attention has been paid towards the rest of the hotel. The smell of food lingers in the long, shabby corridors. Presumably guests are taking to eating in their rooms as the cost of food in the restaurant is extortionate (23 for breakfast!). Stained towels are in frequent circulation and rarely replaced (and you'll be lucky if you receive more than one set, even if there are two of you staying in the room). Wake-up calls are unnecessary in this hotel due to the noisy plumbing and good luck finding a plug socket from this century!The Cumberland is noticeably very popular with Middle Eastern tourists, who, according to one article (http://tinyurl.com/lc3kgr), &quot;save London's summer&quot;. Perhaps this popularity is allowing the hotel to rest on its laurels and coast along on its reputation as an &quot;Arabian home from home&quot; without the need to make vital improvements. We were lucky enough to have found The Cumberland through one of the &quot;Top Secret&quot; hotel deals from lastminute.com. Had we been paying any more, however, and our tolerance for 3-star mutton dressed as 4-star lamb would have been severely tested. The Cumberland certainly has the potential to be a great hotel - just don't look beneath the surface."
67,1210,"Aug 18 2009 	great stay great location	after reading some negative reviews on here we were slightly apprehansive about this place but found it absolutley spot-on. The room was clean, well designed and pretty large for central london. we paid 90 a night for a 2 night stay which, in august is pretty good. Id definitley recommend staying here"
68,1210,"Aug 18 2009 	Very nice good location	I had no trouble checking in very quick, there was a queue for checkout but one of the staff took my details while I was in the queue and said they would e mail my bill so I didnt have to hang around, which all worked out fine.The location was very handy for hitting the shops on Oxford street. My room was lovely. Breakfast was vast lots of options"
69,1210,"Aug 18 2009 	A zoo. Most definitely NOT a luxury experience	Prepare for utter chaos upon check in. The lobby is over-run, as are the lifts. It comes across as more of a convention mill than a high-end hotel. The lobby is quirky, though some would no doubt find it trendy and attractive. The corridors are tired and look like student housing.The rooms are tiny, though fairly clean. There is one and ONLY one reason to consider this place, which is the location. If for some reason you need to be near Marble arch, this is probably a decent choice, though only if you're getting a deal. At the &quot;normal&quot; rate of nearly 200 you are getting shafted, and can stay at 10 better places. For 100 or so you are just about getting good value. I'd rather stay a bit down the road at the Grovsenor House though, which is closer to most of the things you'd want to see if you're in London as a tourist and is MUCH nicer, and not always more expensive.In a nutshell, acceptable but sterile and without any soul or life."
70,1210,"Aug 17 2009 	ideal location helpful staff and lovely room	Arrived and checked in early, room wasn't ready but no problem to leave bags and head out into Oxford Street. So handy for the tube station, shops and open top bus tour link. Could have a lie in whilst teenage daughter did the shops early doors!! No problem with noise - we had a room on the 'inside' so no traffic noise but no view. Concierge and reception staff were polite and helpful. Room spacious and clean with wonderfully comfy beds!! Useful iron and ironing board and mini bar really like a fridge as no drinks in it except water so could put in your own. If possible avoid normal check in/out times to avoid queues and take advantage of leaving luggage as we did and checked out early and left bags for another full day in the city."
71,1210,"Aug 16 2009 	Central and compact not quite clean	Great location for shopping and visiting London. Check in is a slow process. About 20 min or so . Hard to find anything in hotel ie bars, toilets etc, nothing signposted. was in smoking room on 8th floor(as requested). Had everything in it bar a view, bathroom wasn't that clean, more down to leaking water around the sink and it rusting than not been cleaned. Milk in room for tea/coffee not replaced after first day of use , so bring your own milk! Overall not a bad experience, would go back to stay again if visiting london, just dont be looking at photos of hotel on the web as the room you get will not be as big as them"
72,1210,"Aug 14 2009 	Perfect	After reading some negative reviews, we were glad to have had a perfect stay at The Cumberland. Amazing entrance. Very Comfy rooms, Clean bathrooms. Professional staff. Excellent location. Extremely quiet, even with the nightclub and tube underneath. Were glad to have paid 42 a night through last minute but would have easily been worth the full price.Would definitely recommend to everyone looking at staying here."
73,1210,"Aug 11 2009 	Awful customer service and a tiny and dirty room	A party of 4 stayed here for engagement party that was around the corner.On arrival at 6pm we were told that our rooms were not ready despite check-in time being 2pm. The lady behind the desk informed us that they would only take half an hour and that they would treat us to a complimentary drink in the bar.40 minutes later no one had come to offer us a drink and the room was still not ready. When I finally got to speak to the hotel manager at about 7pm I asked her how much longer we had to wait bearing in mind that we had just had a 4 hour drive from Leeds and had to be at the party for 7.30pm.Now I don't mind having to wait, if the hotel are understaffed then although it's not what you expect form a 4* establishment, you grin and bear it as long as you feel that that the staff that are there are doing all they can to help in a polite and courteous manner.Unfortunately the duty manageress that I had the displeasure of dealing with was without doubt the rudest, most patronizing and discourteous woman I have ever met. With no concern for our stiuation she left us standing in the middle of the lobby for another 45 minutes.When we were finally showed to our room it was very disappointing. The bed was less comfy than you get at a travel lodge, the room overall was tiny and there were smears all over the mirrors.I was so appalled by the whole experience I couldn't wait to get to the engagement party and have a few stiff drinks.London has so much more to offer in terms of decent hotels I wouldn't even consider staying here over a travelodge."
74,1210,"Aug 7 2009 	my money's worth	We've booked a special rate package , room for two, upgrade and breakfast, and found it all worth while. Stayed at the annex, loved the bed (a kingsize) and the bedlinnen, bathtowels, and , for London-standards, a spacious room. Yes, the lobby was crowded but London is very busy with tourists in August, and this hotel is too...The breakfastroom is large; the offerings are many, but you feel a bit looked at as a number; then again to many tourists."
75,1210,"Aug 7 2009 	Not the ideal start to a busniness trip I was expecting!	In preparation to a business meeting, I decided to book into the Cumberland for a good nights rest before the meeting next morning.The hotel is centrally located (right next to Marble Arch Station) and has an impressive foyer ... good start so far. However the check in desk was vastly understaffed resulting in a 20min wait to check in. My booking was not on their system, so after a 5min waith until they found my booking they upgraded my room to a 'king-size' .... a small gesture, but it was very much appreciated.The room was clean and tidy, however there was slight signs of mould around the shower cubicle, otherwise it was fine.The problems started at 11:30, when I returned to my room after an evening out. My room it would seem was directly over their newly opened bar/nightclub and the noise was intollerable. Reception tried to bluff it off by saying it was the surrounding bars and clubs in adjacent street, but having just come from outside, I knew this to be untrue. My request for a room change was denied due to the hotel being 'fully booked'Further complaints at 12:30, 01:30 and 02:00 were not dealt with, until I demanded they book me an alternative hotel as I was checking out. Well, you could have knocked me down with a feather, as the once fully booked Cumberland, now had an alternative room for me. This alternative room was quiet, however it was tiny!The next night, hoping to catch up on some much needed sleep, I was awakened by a 06:30 wake-up call (which most certainly wasnt requested!) In the morning I spoke with the guest relations manager who was very appologetic and was willing to give money off the bill. However as it was a business trip and I had already pre-paid, he was unable to do this or offer anything else!All in all it was a totally dissapointing stay!"
76,1210,"Aug 5 2009 	Poor...not four star. Souless and worn	I was pretty unimpressed really. A striking and large foyer suggested a sophisticated hotel, but not so.....understaffed on reception meant there is a permanent queue, the corridors were gotty (in desperate need of redecoration a lined with rubbish bags that were there overnight), then a room that was comparable with a premier lodge rather than a four star.Sorry, but apprat from the polite reception staff, I really dont have a good word to say. Avoid, avoid, avoid."
77,1210,"Aug 5 2009 	Fresh and Modern	My husband and I stayed at The Cumberland for 3 nights at the tail end of our wedding/honeymoon trip. On my first trip to London as a child in 1989 my family stayed down the street from The Cumberland at the Bryanston Court hotel. I remember walking by The Cumberland every day on the way to the Marble Arch tube stop and being so impressed by how posh the hotel was . . . they had doormen in top hats! I've been back to London almost every year since 1989 and while I've always thought it would be a kick to stay at The Cumberland I figured it was well out of my price range. For our honeymoon though, I managed to find a great rate on Travelocity and I snapped it up. The Cumberland has undergone an extensive remodel and looks nothing like the hotel I remember. The lobby is sleek, modern and colorful. The check in staff were friendly and efficient. Our room was beautifully designed and we were happy to find all the conveniences we wanted (coffee/tea setup, tv alarm clock, nice big bathtub, etc.) The location is fantastic . . . you're right off of Oxford street with plenty of shopping and dining available. We really enjoyed our stay!"
78,1210,"Aug 4 2009 	hotel with quality	fantastic hotel , cant complain about anything at all this hotel is real quality"
79,1210,"Aug 4 2009 	OK but too big for it's own good	I've stayed at the Cumberland around 4 times now for both business and leisure, but won't be staying again after my last most recent experience, because I realised it's actually pretty inconvenient for a business traveller. The sheer size of the hotel means it's sometimes noisy and your room is often quite a distance from reception. The laundry service admin is abysmal too, you're never sure when you're going to get your items back and I had to chase it down as I was leaving for a flight, while the laundry staff were particularly unhelpful. Clean and comfortable, but not cheap enough to justify the bad service."
80,1210,Aug 3 2009 	Fantastic hotel.	When we arrived we were a little bit daunted by the size of the main reception. When we checked in we were told we had been upgraded from a double deluxe to a king deluxe so that was a good start!! We were in the annexe building which was fantastic. The bed was super comfy and the bathroom was amazing. We had no noise whatsoever from the road or other rooms. Would definately stop here again.
81,1210,"Aug 3 2009 	Good location	The title is the only good thing I can really say about this hotel. It took over 20 minutes to check in, the queue enormous and for something which is a relatively simple procedure seemed to take the four receptionists on duty 20 minutes per couple it was ridiculous. The rooms were small but as that is fairly normal in London I wasn't that bothered. However the window overlooked other rooms and the room itself was very sparse and not particularly that comfortable. There were no bathrobes and the toiletries were limited. Whenever I go to London I am to loyal to a specific area of a brand of hotels and usually go wherever the best deal is. I paid only 80 a night so was happy with this as the location was good, however I would not be recommending this hotel to anyone who was paying 100+/night."
82,1210,"Jul 31 2009 	Good Location and Value For Money	Stayed for two night mid-week leisure break with my husband. Booked hotel through 'Top Secret Hotel' with Lastminute.co.uk and were please with the rate paid and overall value of the hotel. The hotel is located within a minute walk to Marble Arch Tube station on the Central line and within easy walking distant to Oxford Street shops and Hyde Park. Unless you like to walk you should use the Underground/Bus/Taxis to the other numerous London sites.We check-in at around 1pm and were immediately allocated our room. We were given a complimentary upgrade which was very pleasing. We found the reception staff very quick and courteous. The lobby is large and airey with statues dotted around. Plenty of places to sit. On the lower ground floor is a food court. Gary Rhodes has a Michelin star restaurant and brassiere. Although we did not eat there, the hotel was offering some special offers, 5/10 per person off the price.The room was on the 7th Floor served by 6 lifts and therefore no queuing necessary. The allocated room was of modern decor with a kingsize bed, large LCD TV (with numerous channels, including Sky, Pay movies, internet etc ), desk and chair. A fridge had two complimentary bottles of water and there was Tea and Coffee making facilities. There wasn't any view of such, only over looking other rooms. The bathroom was once again modern, large walk-in shower, no bath, heated towel rail, and Elermis toiletries. The only negative was the concierge service which was completely understaffed. On our final day we left our bags and when we returned to collect them we had to wait 20 minutes as there was only one staff member who was helping other guests book trips etc and there was around 10 people in the queue. Overall this is a good value hotel in a good location"
83,1210,Jul 31 2009 	4 star Hotel with a star service	I read the reviews here after I had booked it and was a little worried. Now I have been there I have to say that the previous reviews are totally wrong. The Cumberland is a fantastic hotel and I have stayed in many 5 star hotels not as good as this 4 star.We recieved a free upgrade when we checked in and all the staff we came into contact with were superb. The room was clean and very well equipped and the Kua bar was fabulous.I highly recommend this hotel to anyone visiting London.
84,1210,"Jul 28 2009 	great location in a modern hotel	stayed at the cumberland for 3 nights in july for a weekend getaway with my fiancee and my daughter. The hotel was modern and trendy and our room was large with a see-through do to the bathroom. The halls were a little tired down, but the room looked like it was newly renovated. Both the bar and the fitness center was excellent! The breakfast was okay, but crowded every morning. Location is perfect. 1 minute from the marble arch tube station and just across the street is hyde park."
85,1210,"Jul 27 2009 	Good hotel with some drawbacks	We got a great deal online for our two nights at the Cumberland, as did many others, judging by the 15 minute queue for check in. No points for exclusivity either as this is a huge hotel, with hundreds of residents at any one time. If you stay in the annexe, as we did, you'll find a much quieter prospect, but the main building feels like an airport , such is the size of the foyer. Our room wasy very modern in design and comfortable, with everything we needed. Some of the modern fittings are just daft! A sink with nowhere to leave your soap and too far from the mirror to shave properly, for example. The staff we encountered were reasonably efficient, but I suspect hard pressed, as we has to ask several times for additional room supplies. The breakfast seems very expensive at 23.00 Why not visit the Tyburn opposite, where you can get breafast for less than a fiver.Internet access was free at the Tyburn. The hotel charge 6 PER HOUR! This is absurd. Why can't hotels in the UK offer this service for free, as do many hotels abroad?"
86,1210,"Jul 25 2009 	Over-promises significantly under-delivers	10 minute wait to check-in, dodged the hoover and full rubbish bag abandoned outside our room (still there many hours later), stains on the sofa, our non-smoking room smelt of cigarettes (tried to contact front desk, twice the line rang out, third time I was told someone would call back but no-one did).In their own blurb they labour the claim to offer the highest standards in quality and service. They should stop kidding themselves and their clients."
87,1210,"Jul 22 2009 	Tiny room with dreadful layout	Upon entering this hotel the foyer and public areas look very contemporary and slick but really for a 1000 room hotel are badly lacking in seats and areas to congregate in. I was staying with my wife in room 6103 which is very small, horribly designed double room and was astonished to see the bed pushed up against the wall so that it could only be accessed from the bottom or one side only, something that would be more fitting in a shabby 2* hotel not a 4*. Perhaps because this booking was made through lastminute.com on a 50% off deal I was allocated an inferior room, my wife and I were very dissappointed and wont be returning."
88,1210,"Jul 22 2009 	Hotel from Hell	The largest hotel in London and probably the worst.NEVER NEVER NEVER book into this hotel unless every hotel in London is fully booked,even then sleep in the park. To much to explain,as I have a long term illness and disability. So am not able to do much typing.All I can say is they treated us appallingly.even mangagement did not care."
89,1210,"Jul 22 2009 	Awesome Hotel!	We absolutely loved our stay at the Cumberland! The location is great for tourists- right near Hyde Park, the Tube and walking distance to many sights. The room was a good size, and we loved the decor. Make sure you eat at Rhodes W1 Restaurant-it was the best food we had in Europe!"
90,1210,"Jul 22 2009 	They Have Serious Problems	The below is an email sent to the management with no feedbackDear Concerned person,It is almost the first time in my professional life to find myself sitting in front a computer to write such a complaint to highlight an unsatisfactory stay at your hotel. Through out my professional career, I have conducted hundreds of personal and business stays, and most of them were either in 5+ or 4+ hotels through Europe, Americas and Middle East. My stay at your hotel (Cumberland London) proved to be the worst ever and made me think twice not only to revisit any UK hotel, but also to revisit the country with my family.To brief you, I stayed with my family on a personal journey from July 15 to July 18 at your hotel. The tragedy started when I first entered the hotel. Your services incompetency can be summarized as below:ReservationAlthough I had a confirmed voucher and reservation number, I had to stay for couple of hours waiting for the receptionist to sort out the problem of my reservation with the local travel agency. I have to admit that he was trying to help, but due to internal process, I was suffering from a delay and was exhausted after traveling 8 hours with my family from Canada. Our previous request (mentioned in the reservation) for 2 double interconnected rooms. Due to the unavailability and lack of rooms, we had to stay all of the first night in one room. The option was that to have two separated rooms. I cant keep my 3 years old and 7 months baby in a room on their own. I waited till the next day to get the needed rooms at 4 pm !!!!! Although they called and said that they room is ready, we had to wait near the room for 1 hour (from 3 to 4) till she actually finishes cleaning the room. Internet AccessI called to enquire about accessing the internet and I was told that I have to buy a voucher to access the wireless network. I went downstairs and bought a 24 hour voucher for GBP4 extra than the price mentioned in your service guide. However, I said fine, I need to check urgent emails and I had to do it. I went upstairs and tried to connect, but the signal was so poor. I thought the problem was in my laptop, but realized later that the signal is in deed poor. I called the maintenance again and they came after 2 hours to amaze me with another fact yes sir, we dont have good coverage here, you have to connect through the cable. I said ok, I do have the voucher and I can access. He said no, this has a different cost and you have to pay extra. Come on guys!!! This should have been communicated to me before. Why do you sell wireless vouchers (over priced) if you can not satisfy the need ??!!! They even rejected refunding me the voucher amount. Room ServiceWe came back to the room from a long day with my family to find a disgusting smell in the room. We though the smell was from the street or ventilation, so we opened the window. But the smell never gone, so I had to search the two rooms for the source of the smell and found a black rubbish bag behind one of the rooms door. It seems the person who came to service the room gathered the rubbish of the whole floor and kept it in my room. I was so pissed off and called the guest relation desk (that was at 11 pm). I explained the problem and she said well we dont have room service now and you have to wait till morning. I told her should I keep the bag with the smell till tomorrow, she said well, its up to you ??!!!!!!!. What a caring person.??? What the message the hotel attempting to convey ???!!!Another hassle with room service, we used the towels and kept them on the floor to be changed. We were surprised to see the same towels hanged on the heating bars for drying and to be re-used. What am I suppose to do to request for a change??There are no standards in room facilities. You might find 2 phones in a room and one in the other. A trash bin under the desk in one room but nothing in the other room. The TV remote control was broken in one room and its clearly seen to a room service employee who keeps on shifting it while cleaning. The battery cap was missing and replaced by a black tape. On the check out, the receptionist asked me did you have a pleasant stay sir. I said  No. He then said, well, since you already paid the travel agency then you dont owe us anything  as if my answer was not related to his question. That was my wife and kids first (and last) visit to UK and the impression you people left was adequate to drop London for any future visit to Europe. I dont want to compare your hotel to American standards or Gulf Hotels because that would be totally unfair, but comparable to a 3 star hotel in Europe, you guys need to work hard to gain trust and confidence. As a word of mouth, I will never stop feed backing people on my experience, not forgetting websites. The only advantage of your hotel is the location. By the way, based on what I have seen, I dont expect a feedback  I will be surprised if I receive any."
