IDREVIEW,HOTELID,REVIEW
74,617,"Sep 14 2008 	Great Stay!	Stayed in this hotel for 3 nights in August 2008. Picked the hotel based on reviews from Tripadvisor. Our total cost (between two people) and including breakfast was 450 euro, this included a 15% discount from a promotion on the website we booked with (Hotels.com), which I found to be a very good rate for the quality and location.The room, a twin, was small but functional with a large bathroom. It was at the very back of the hotel though and was very tiring walking back there after a long day. It wasn't shabby like some of the other reviwers mention, I was very happy with it. The location of the hotel can't be beaten, everything we were interested was either within wakling distance or a short journey on the tube. When we were feeling lazy, it was easy to pick up a taxi as there were lots outside the hotel too.The only issue I had with the hotel was that they attempted to charge us for breakfast, which we had already prepaid when we booked. I had to show them my printout from hotels.com (luckily I had brought it) before they would accept that. Then on the last day, they tried to charge me again for it, but backed down very quickly. I would definitely return to the hotel when visiting again."
75,617,"Sep 11 2008 	Declining the upgrade gets you a smelly toilet	We booked through Lastminute.com for the discount, and when we arrived at registration, they tried hard to sell us an upgrade. When we declined, they gave us the most distant room in the annex, with several turns down a long, empty hall. The first night we discovered that the toilet didn't flush. Instead of a plumber, they sent a man in a tuxedo, who instructed us how to flush their tempermental toilets. They declined to give us another room, so we were stuck with a smelly toilet. The room was large and well-appointed, if a little shabby and musty (perhaps from a tempermental shower?) A scolding sign about keeping the shower curtain inside the tub was inadequate to cope with an out-of-control shower head with a broken support that sprayed full-blast in it's own chosen direction blowing the curtain out of place and sending water into the main room. The concierge and restaurant staff gave excellent service, but the front desk seemed scripted to an anti-service mentality. Charing Cross Hotel is in an excellent location: directly above the tube station of the same name and at a hub for surface buses."
76,617,"Sep 9 2008 	Great Location	This hotel has an amazing location. It is right above charing cross tube station (but you dont hear any noise from it) and just down the road is embankment tube station.It is very close to all the major attractions, it is 1min from Trafalgar square, 4mins from Leicester square and 7mins from Covent garden, these are all walking distamces. The london eye is just across the river and big ben isnt too far away either.The hotel itself is lovely, the staff are very friendly and helpful and the breakfast is very good!Our room was one of the best we have stayed in, a huge queen size bed which was so comfy, big enough bathroom with bath/shower, flat screen tv and air-conditioning. I would definitely stay here again! The only problem I had with the place was that I couldn't stay longer."
77,617,"Sep 2 2008 	Why haven't I stayed here before?	This time I decided to spend a little more money than usually on a hotel in London. Location is important and I like to stay in the area close to Covent Garden. This hotel had very good reviews and I was not disappointed. I stayed here between the 27-30th. August in room 440. Location - It's close to the places I need to attend. Covent Garden and Charing Cross Road are just up the street. I arrived at Stanstead airport form where the train arrives at Liverpool Street Station. From there I can take the Underground to Embankment station and it is a very easy walk to the hotel.If you arrive from Heathrow you need to change once on the underground. The hotel entrance is right beside the entrance to the Charing Cross station so if it rains your hair wouldn't even get wet. Reception - Very helpful and asked if I wanted an upgrade. Room - Two bedroom de-luxe including English breakfast cost a little les than 390 pounds for three days.The room had: TV flatscreen, hot iron, trouser press, safe, tea/coffee making equipment, hairdryer and lights in the wardrobe.The bathroom had separated shower and bath. I was surprised that the hot water was instantly forthcoming.The view out was not the best, but you could see the London Eye.Unfortunately the room was as far away from the lift as humanly possible. The street noise was only noticeable in the morning. There are double glazing windows. As other reviewers have noticed there is some noise from the above room, but it didn't last for long during my stay.Breakfast and restaurant - Nothing was missing during the breakfast. The fresh fruit was mostly melon. If you arrive early you will easily be able to sit in the area overlooking The Strand. I arrived between 06.30-07.00 o'clock and there were not many of us at this early hour. I didn't try the restaurant at other mealtimes.In conclusion - The hotel is certainly not a usual London tourist hotel. It seems more like a conference hotel. The hotel is very elegant and seems well kept. The staircase is huge. At no time did I have to wait for a lift. Every one of the staff I met seemed to be happy to be a part of the hotel.I will certainly stay here again and I recommend it to everybody, especially those who are used to tourist hotels in London. This hotel is far better."
78,617,"Aug 25 2008 	VERY OK	Central position, very friendly staff. Clean, large room and very bright. Recommended"
79,617,"Aug 20 2008 	central and close to everything	This was my first time in London and with so many choice to chose from - I decided on this hotel based on its location and Expedia's special rate. I arrived early (before noon) and was able to check in early. I was offered an upgrade to a junior suite which included a bottle of wine. I took the upgrade and was very pleased with the room on the 5th floor - overlooking the front of the hotel. I stayed for six days - and never experienced any problems with the room or staff. I found everyone very helpful - esp when it came to planning trips throughout the city.Overall, while I would not hesitate to recommend, I much prefer staying in places that are away from tourist areas. It served its purpose as a means to introduce me to the city and the other areas from which I will probably stay. I would recommend this as stopover hotel for those traveling on to other areas - due to its location as being mile '0' ... (from which distances are measured from London)."
80,617,"Aug 13 2008 	Fantastic Hotel; Great Location	We stayed at this hotel for 3 nights (Friday to Monday) for a break away in London. My partner had stayed at this hotel before and had highly recommended it. I booked online via the hotels website and managed to obtain a really good deal (125 per room per night including breakfast). All the hotel staff we came into contact with were very friendly and welcoming. On arrival we were offered a free upgrade to an executive room on the 5th floor. The room was large, modern and spotlessly clean. The bathroom was a good size and had a separate bath and shower. The location was excellent for our needs. Many of our destinations were within walking distance but the tube was on the doorstep if required. Considering the hotels location, above Charing Cross station, we were not troubled by noise at all, either from inside or outside of the hotel. Breakfast was buffet style and the food was plentiful and of good quality. We didnt take any other meals in the hotel simply because there are so many restaurants in the hotels vicinity. We did have drinks in the bar which were expensive, but I suppose that is to be expected in a London hotel.I cannot recommend this hotel highly enough and will definitely stay here when in London again."
81,617,"Aug 12 2008 	Great Location	Fantastic location to enjoy the nightlife and sightseeing of London. The reception area was quite contemporary but managed to retain the character of this old building. Reception staff were very friendly and knowedgable. Quite a trek to our room (a couple of lift rides and a walkway away), but the room was a good size and had all we needed. They could do with 'chucking out the chintz' but we would certainly return to this hotel due to its location and the good hospitality!"
82,617,"Aug 8 2008 	Very very tired.....	We booked this hotel as a 'mystery' hotel on Lastminute, although we'd pretty much guessed which one it was from the description. It cost 120, which wasn't bad for a midweek stay. The receptionist tried hard to flog us an upgrade to the junior suite I declined and got a room which was took two lift journeys and long walk to find. It wasn't worth the walk - it was seriously tired, with a cracked sink, filthy single-glazed windows (on a busy, noisy London street) and aged, tatty fittings."
83,617,"Aug 6 2008 	Loved it	I stayed at the Charing Cross Hotel several years ago, during renovation...and loved the location...but not thrilled with the room. This visit was wonderful....friendly staff (they even remembered me when I returned after a couple of weeks for another night). I would go back any time"
84,617,"Jul 31 2008 	Is this the same hotel advertised on the internet?!	Stayed just this week. Looked at hotel website and was anticipating a very bright, modern boutique hotel. On arrival, Reception lived up to expectation. The common areas although a little in need of some attention were nice and spacious. There were a lot of original features in the hotel which appeared to have been well looked after. Bags were brought to room. Not sure whether the hotel is under refurbishment but we were taken into an annex across Brooke Street. This part of the hotel was definitely in need of some attention. The corridors had a strange smell and the carpets were worn. Our room was also in need of repair. Wallpaper was peeling from the walls and worn/torn in places. The wallpaper beside the waste paper bin was dirty as was the wallpaper behind the new LCD TV. The TV was a nice touch although the money would have been better spent redecorating. The carpet was worn with threads visible. There were two windows in the room which looked like they had not been cleaned (externally) for years. The room was comfortable and the beds probably one of the best we have slept in away from home. The room decor was very busy..... 'chintz' style, nothing like the internet pictures. One further disappointment was that the toiletries displayed on the internet were 'Elemis' which is one of my favourite brands but alas some sub-standard product was on the bathroom shelf. The pictures on the internet do not represent the standard you may receive when booking this hotel. The breakfast was good and the location ideal. When booking be sure to ask for one of the refurbished rooms."
85,617,"Jul 28 2008 	Great location Clean 	The Charing CRoss Hotel is a lovely old-school hotel with a great location near Trafalgar Square and the West End Theater district. If you are in London for just a few days like we were, then you really can't go wrong. The rooms were a perfect size for two, clean, up to date and quiet. The staff was helpful and friendly - we really emjoyed our stay here and would stay again!"
86,617,"Jul 17 2008 	Great hotel near all the theatre's and Covent Garden	Stayed at the Charing Cross Hotel whilst visiting theatre's in London. A very clean hotel, with great standard rooms, asked for first floor as l don't do lifts! the room was large, clean, double glazed windows...... couldn't hear a thing from outside! great selection of tea/coffee and complimentary biscuits! Breakfast was not included in the price. Paid 179 for one night which included vat. The hotel itself is situated right by Trafalgar Square so near to everything, bus stops outside to take you anywhere in London. Lots of Cafe's etc for breakfast, nice one opposite!For this part of London this was reasonably priced as l stayed on a Thursday. Would stay here again."
87,617,"Jul 16 2008 	Great location and nice hotel!	We really enjoyed staying at Charring Cross. It is in an excellent location right off Trafalgar Square and right next to Charring Cross Underground and Train station. There is a pharmacy in the building, and several pubs and restaurants within walking distance. You can also walk to The Embankment station in about 3 - 5 minutes. The hotel definitely had an &quot;English&quot; feel, which is what we wanted. the room was clean but a bit tight. Next time, I would upgrade to a larger room if budget premitted. I did like that they had our room ready even though we checked in before noon. The staff said Expedia had requested this, which was nice.Internet access in the room is expensive! 20 pounds a day. You can get free wireless access in the bar or lobby. If room access was free I would have probably given this hotel a rating of 5."
88,617,"Jul 16 2008 	Fantastic Location! Loved It!	Stayed at this hotel end of april for 3 nights as a base for seeing the sights in london and were not dissapointed!Hotel is in a fantastic location with everything practically within walking distance!Check in was smooth and although we arrived early morning and were supposed to wait until 2pm for our room we got our room straight away! The room we had was a smoking room and was spotless clean!Everything you need for your stay was there!Kettle, Iron, Ironing Board, Trouser Press, Toiletries in the bathroom, and a safe!Huge bed.......and really comfy after a day of sightseeing!Bath and shower!Train and tube station right under hotel and had no problems with noise!If you get a chance to see any shows whilst here i can highly recommend grease and dirty dancing! wow both shows absolutely amazing!Also went to madame tussauds which is brill! London eye is great too! In fact so much to see and do that 3 nights really isnt long enough!Back to the hotel! Really recommend this as the perfect base to do London!Staff really friendly!No probs here!Would go back in a minute!Only for longer than 3 days!"
89,617,"Jul 9 2008 	Great Location	Stayed at Charing Cross for 3 nights with my daughter. Room was an Executive type, bit small for our liking, but was clean and tidy. Breakfast was great. Fantastic location being handy to every major tourist attraction. Recommend the Original Bus Tour for those especially with only a few days to see the great city of London. Overall, would go back to Charing Cross as it was the location that won me over"
90,617,"Jul 1 2008 	Fantastic Location!	A great hotel in a great location. Nelsons Column was virtually on our doorstep and Buckingham Palace was only a very short walk , as was the London Eye. The hotel is at Charing Cross railway and Tube station so access is great. No noise in our room from the railway, which was very spacious (family room). The staff were very plentiful and helpful during our stay. The hotel is classed as a 4 star but I have stayed in worse 5 stars than this one! Overall a great place to stay especially if you can find a good deal on it as we did (secret hotel). We will definetely stay there again!"
91,617,"Jun 30 2008 	This is a great hotel.	This is a great hotel. Friendly helpful staff, excellent breakfast. Their standard is higher than some 5 star hotels we have stayed. The location is great next to the station, possibly a little noisy on the front, but you cannot be right in the action otherwise. A very clean hotel. We booked it through Londonhotels.com who really know their stuff &amp; give excellent advice on the city. We will use both again."
92,617,"Jun 29 2008 	Poor staff attitude	Upon arrival after a long flight from Australia, we were delayed into getting into our room by 2 hours after the scheduled check-in time. When we finally got into a room (not the one we booked but a lesser one) the view out the window was of a down pipe and the wall of the neighbouring building. Finally, after the unfit porter came, picked up and sweated all over our bags and moved us to another room again we were happy. The biggest problem was that there were other rooms similar to ours available the whole time, but the check-in people would not allow us to have them. The location is excellent, and the restaurant is good, in particular the Eastern European mater de, however the damage had been done by a very poor first impression. Would have accepted poor service if the price was lower, but I hate paying top dollar for poor service."
93,617,Jun 20 2008	Good not great... if internet speed is important -- avoid...	The good:Great location -- duh! Great first floor public lounge and barBreakfast was pretty good (although see below)Rates here are generally good compared to the Trafalgar where they have a bit of an attitude...Better rooms than the nearby WaldorfBetter location than the nearby Victoria Park PlazaThe free in-room tea and coffee set was good.*******The bad:The internet was so incredibly slow it felt like dial-up service. My upload speed was about 2kbps. Download speeds were something like 50-100kbps. The hotel seriously needs to work on this.My newspaper was not delivered either morning.Today's breakfast was missing the orange juice.Agree with earlier review about loud laminate floors.Mini-bar was empty except for some free coke and water. I found that odd.Good television (flat-screen) but no in-room movie selection.Bathroom was acceptable but showing its age.
94,617,Jun 7 2008 	fanatasic hotel canot beat its location	Myself and a friend booked this hotel through an agent as a threatre break. We were very impressed with the serivice we recieved and the room was lovely with a massive bathroom. The location of the hotel cannot be beaten. Buckingham palace is a five minute walk away as is convert gardens and the national gallery. The tube station is next to the hotel and oxford circus the main shopping street is only two stops by tube. I am booking another trip later in the year and will be coming back to this hotel. The only problem that we had was the fire alarm went off at 6.45 am on the Sunday morning which wasnt the ideal way to be woken up when you are on a break especially since we had to line up infront of the hotel in the rain and wearing our nighties! It was a false alarm.Any way if you want a nice hotel with good service and prime central location then book at the Charings cross you wont be dissapointed.
95,617,"Jun 6 2008 	great hotel	This hotel was perfect for us as it is in Theatre Land in London and we were seeing a show at the Aldwych Theatre. it has the train station on one side and the tube station on the other but we didnt hear any noise from either. it is on a long street with everything you would need, MacDonalds two doors up and pubs, restaurants, tesco metro, superdrug and topshop.the outside of the hotel is gorgeous and so is the lobby and staircase. our room was a double delux and was nice, not out of the world considering we padi just over 300 for 2 nights but i guess in London hotels are dearer and it was worth the extra money 2 feel safe and secure in a clean hotel.the staff were friendly and helpful although at times they couldnt understand our Scottish accents as a lot of them were foreign!"
96,617,"Jun 4 2008 	Has its problems	I booked this hotel using Tesco Clubcard Vouchers so checked in as normal swiping a credit card in case we had any extras. The room was a good size and you could just see the Thames and the Eye. The only problem was the room above had laminate flooring and the people seemed as if they were practising for a marathon walking up and down all night with high heels! I chose this hotel for the location and it is very central for all the West End theatres and Covent Garden. We went down to breakfast on the first morning about 9pm and there was a queue to be allocated a table, we had to wait about 5 mins to be seated, why we couldnt just find a table oursevles and then give our room number and name to the waiter I dont know. They seemed rather understaffed. I thought this might just be a busy Saturday morning, but the next morning the queue was even longer and we had to wait for 10mins.Check out was fine and they rescanned my credit card. The problem came a couple of days later when I received a receipt in the post from the hotel which was for over 350 which had been debited from my card! I immediately rang the hotel and they got it sorted out after a couple of phone calls, but beware if you are paying with vouchers, dont let them take your credit card details!"
97,617,"Jun 1 2008 	Location is hard to beat!	The hotel has a great location! To reach the hotel from the airport , simply purchase your Oyster card from the subway station and go to the Charing Cross station. The hotel is right up there. It's near the train station that is convenient if you're planning a trip outside London. It's near to the Trafalgar Square and the National Gallery. It's near to almost all the major attractions. We walk to Covent Garden and it's only 10 minutes! There's convenient stores next to the hotel , and some cafes and burger king right in the charing cross station (which is next to the hotel building). The room is good in size with ironing board, hair dryer , small table where you can have the free teas and coffees and crackers. The staffs are friendly and helpful."
98,617,"May 30 2008 	Lots of good points	This property is now managed by Guoman rather than Thistle. The location is very convenient, right on top of the Charing Cross tube/rail and 2 minutes from Embankment Tube, and a 15 minute walk across the bridge to Waterloo station. I have stayed here three times, in both buildings. The Buckingham wing is the older part, and while it is very classic it's still decent although it is starting to show its age. As others have said, the rooms there need a bit of TLC, trimming frayed carpet edges, tightening loose faucets, replacing burnt out bulbs etc. The other wing has a much more modern feel but the rooms are a bit smaller. The beds are decent but the last two times I've stayed the sheets seemed washed a few times too many. The rooms were always clean and everything always worked. The breakfast is in a beautiful room but is standard breakfast fare. The staff was very polite. This is a solid 4 star in London and I'd go back. I did notice that prices remained high, but on the day I was checking in, the prices went down considerably and I canceled my higher price res. and got a much lower one that included breakfast, so checking frequently may help."
99,617,"May 26 2008 	Still A Great Hotel	40 years ago, as a young man, I went to London to see Scotland playing England in a Saturday evening football match at Wembley. This was a last minute decision so I had to book a hotel on arrival. London was very busy but I eventually got a room at the Charing Cross Hotel and was very impressed with this quality hotel. It kind of set hotel standards for me and I always remembered it as I stayed in hundreds of hotels in my business life thereafter.I have stayed in London many times since then but always had hotels booked for me. I arranged to go to see Jersey Boys(Wonderful Show) at the Prince Edward Theatre last weekend and decided to book in to the Charing Cross with my son. We got a great welcome from the reception girls who were very friendly and welcoming and they looked like they were enjoying their jobs. They offered a room upgrade for 20 and this was a very well appointed and spacious room with a great view of the London Eye. This hotel is in a great location in the exact centre of London with easy access to Theatreland and the West End. It has retained its feel of refinement and quality and the staff are the friendliest and most courteous I have ever encountered. The hotel is also very quiet and the beds are very comfortable.Breakfast is comprehensive and the food quality is very good and the restaurant staff are attentive.It was good to see that the hotel is still excellent after all these years and I will definitely use it on my next London visit."
100,617,"May 23 2008 	A good London base	I stayed at this hotel for a short business trip in May. Overall it was a nice stay. As others have pointed out, the location, convenience to the Underground, and friendly staff are the hotel's strong points. There were a few issues, however. It appeared that they were breaking in a lot of new staff because on several occasions people at the front desk had to check with colleagues before they could answer my questions. The carpeting in my room was very worn. Also, the fridge had only a couple of soft drinks when I checked in, and it was never refilled during my stay. This did not affect me, because I never purchase beverages from hotel rooms, but it showed a lack of attention to detail."
101,617,"May 22 2008 	Excellent location	Excellent location and very beautiful historic building.Although during the booking some months before we asked a room with a view to Thames or London . They didnt promised for that but at least they said they would do their best. Upon arrival the reception said we need to pay 35pounds more for that type of room hence the hotel was not full.I always do my flight check inn by internet and use hotels free of charge internet systems however in Gourman they asked 6 pounds which was not nice.Room was clean and nice and they have an excellent breakfast. Location is perfect, just off Trafalgar Square near the underground."
