IDREVIEW,HOTELID,REVIEW
4,999,"May 3 2009 	It ruined my marathon experience	WE booked this a long time ago and at a very cheap rate. We booked 3 doubles for our family, and the night before (11pm at night) the hotel phoned to say that they had problems with plumbing and could they put us up in another hotel or a family room. I was running the London Marathon the next morning, and so sleeping with my mum, dad and sister was not high on my list of relaxing things to do prior to the marathon. When we arrived at the hotel they said there was no other room in London (which Im sure they were right about being London Marathon weekend) and they made us take the family room for 4 of us. We requested a discount for this and they refused stating that we had a very cheap rate anyway. (They did give us a family room the next night to compensate us) . The staff were very friendly, but there was also no option of me getting breakfast before 7am - again another nightmare before a marathon! Talking about the breakfast, that was appalling, hardly any choice and not enough seats. The Sunday morning I spent 15 minutes sat on the stairs waiting for a table. The receptionist desk is also squashed in this tiny breakfast room, It strikes me that the owners of this hotel are very greedy. The rooms were tiny.To be honest this hotel was really cheap - but I think if it was marketed more as a hostel rather than a hotel we would have been less offended."
5,999,"Apr 8 2008 	not good	We paid an exceptionaly cheap 120 for 2 nights bed and breakfast. A friend of mine booked it last minute but did not check the reviews. Have got to say that the only reason we stayed was not to offend my friend. This is the most tired place I have ever stayed. The receptionist bareley uttered a word then we were given our keys. As the lift only held one person at a time we made our way up the stairs. This was like climbing a mountain. Once we entered the room we were overcome by a damp smell. The bathroom looked like it had not been updated since the 1940s and was in need of replacing. The whole hotel is grey, grey, grey. In the morning we went down for breakfast. Continental?? 10 slices of plastic cheese, toast, tea and coffee.The saving grace was our location. Notting hill is a great location with plenty of nice bars and restaurants. Part of our group stayed in the Comfort inn which is about 10 doors up the road and for an extra 15 per night seemed by far the better option. ."
6,999,"Mar 13 2007 	Nice staff shame about the room	I agree with cornish_pastie's review about the room features... Impossible to close the window as the handle didn't work. In any case as the room was overheated and there was a plumbing problem making the room smell damp, it didn't really matter. On the other hand, the staff are friendly and the breakfast is basic but OK. Check your credit card bill afterwards as they had already charged for the room before arrival!"
7,999,Sep 13 2006 	More Nottinghill Hostel than Hotel	My friend &amp; I stayed here over the Bank Holiday weekend in August as we were attending the Notting Hill Carnival.They put the prices up by 10 due to the fact of it being the Carnival- so we ended up paying 65:00 per room per night.We were quite disappointed with the layout of the hotel - very old fashioned with lots of strairs which were steep- the staff offered us the use of the lift there but it was so tiny and old we decided to use the stairs- as we were afraid that it might break down.The room was poor quality and very small. The beds were soft so I had an uncomfortable nights sleep there. The towels which they provided were old and messy. The bathroom was okay in size but the shower was too small - we both ended up with bruises and I hit my head on the tap a number of times. Room needs to be painted despartely and new furniture needs to be provided. It reminded me of an homeless hostel or bed and breakfast- I have been in a few in my line of work and I can say that this accommodation was on par with what is offered there.If you do go there please expect poor standard of accommodation!The only saving grace of the place was that the staff were very helpful and accommodating.
8,999,Aug 25 2006 	Can only laugh!	Remember the price! I kept saying to myself.....It is surely one of the cheapest stays in central London you'll find.I stayed with my wife and MiL for a couple of nights.The room was oh so tired - not dirty - just tired!The shower room was 'amusing' - it had a false floor in there but the toilet was clearly fixed to the original floor so you had a bit of a 'drop' to sit down and ended up with your knees a lot higher than you might be accustomed too!The bed side lamps were all hard wired so unless it was a bulb gone they couldn't easily sort out a reading light.The wiring generally looked a bit suspect with ceiling roses missing.But it was so bad it was good and we couldn't stop laughing each time some other quick came to light.But to put up 3 people within 5 min walk of the tube at what are basically hostel prices.With more notice you can get modern fresh rooms at something like the Travelodge but without the 'character'.Didn't even see the dining room!
9,999,"May 30 2006	Very Disappointing.	We stayed there May 2006.I know this is a fairly inexpensive hotel but even so; the wash hand basin was broken &amp; patched up, the toilet cistern was hanging off the wall, the curtains were hanging by approx. 4 rings, the bedlinen was grubby, the furniture looked like it was from a 2nd hand shop &amp; the breakfast was a joke!The positives;the staff were helpful and the location was good.We would never stay there again."
10,999,Apr 24 2006	Decent for the money	After a lot of research we believe this hotel was about all we could expect for the money in London. The staff made every attempt to accomodate us and the room was small (aren't they all in London?) but clean and properly made up each day. The location is great - a short walk from the Notting Hill Gate tube station. The only difficulty we encountered during our 6 day stay was from a bunch of noisy people next door who arrived at 2 am. The staff people called them immediatly and the problem was taken care of in reasonable time.
11,999,"Feb 7 2006	quiet nice	stayed there for 3 nights. the service was nice, the room was clear and the hotel was quiet too. the tube station is not far away. the people working there were helpful to give some hints for singhtseein. for 150 pound it was very good ! breakfast was good too !"
12,999,Jan 14 2006	Not that bad	I really don't understand all the people complaining about this hotel. I arrived with my party (of 5 people) in the middle of the night. We were welcomed by a very friendly person in the reception asking if we were hungry offering to order food for us. Our sleeping arrangements were a bit special and the hotel really had taken care that our requests would be met. I've stayed in hotels in London a couple of times before and paid more for rooms with less standard than in this hotel.
13,999,"Jan 2 2006	Nice	Its a nice hotel, friendly staff, clean...For a 2star hotel, and the price that i've paid I was really satisfied with the room and the service"
14,999,"Sep 1 2005	Nightmare hotel	I have stayed in hotels in many parts of the world (first through to third world) and have genuinely never stayed in a hotel so lacking in respect for its patrons. Three years ago, I went to NH carnival and booked in here; it sounded ideal. Whilst I gave my credt card details in good faith (their surety in case I didn't show), it was accepted that I would pay by cheque for my three nights stay - 180-ish pounds? Upon arrival, I was required to pay for my accommodation in advance which I did by cheque - only to find out subsequently that 500 had already been deducted from my credit card on the night I booked. It took my credit card company (Barclaycard) one day short of the three months time limit to recover the money. The hotel itself was awful, a tiny double room where the door banged against the bed so only one person could get into the room at a time, the skirting boards were missing, the toilet seat was on the floor, there were cracked and dirty tiles in the bathroom ... the list could go on. Breakfast for the hardy, was a jar of instant coffee, electric kettle, mugs, electric toaster, set out on a table in the cavern-like basement (ugh!). Ok if you had signed up for a hostel but the Notting Hill Hotel sold itself as better than that.The one point in its favour was the location."
15,999,"Jul 19 2005	Notting Hill - not a good choice...	We decided to save some money when booking this hotel. The pictures on the website looked really nice, but the hotel we found upon arrival was nothing like those pictures.I agree when people say you can't compare 4 and 5 star hotels to a hotel like this hotel, but there are some basic standards (clean, friendly service, a decent breakfast) any hotel should meet up too, especially when you're charged 55 Pounds per night!Rooms were old-fashioned, we looked out of the window straight into a wall, the bathroom was very small, sheets were dirty. The room was small; too small to really be there and feel comfortable.A first also was instant-coffee at breakfast...We were asked to pay for our whole stay upon arrival, which we can understand; if we had had a chance, we would have cancelled our stay within 10 minutes from the moment of arrival...."
16,999,"Jan 26 2005	awful	This hotel is simply terrible. I stayed with 4 friends in two rooms. They were damp, had mould growing, smelt awful. Do not go there even on a tight budget!!!!!"
17,999,"Jun 20 2004	Seven night at Nottin Hill Hotel	I had stayed at Notting Hill Hotel, at first time I was realy worry about coments in this website, but when I arrived I realized Notting Hill Hotel is very friendly, not luxurius, but clean, warm and very nice and safe area, rooms are clean, brights.I would recomend this small hotel if you want to spend holidays traveling around London in a quiet enviroment and reasonable rates at this familiar hotel.Also Iwould like to say I'd travelled a lot I've stay in differents hotels , but I can not understand some people who sayd&quot; we were at Ritz Hotel &quot;how they can even compare a small and friendly hotel with the cold Ritz and then decide stay and on the top insult and ofend on this way. Pedro Martin,Madrid,Spain"
18,999,"Jan 27 2004	Bad bad bad...	This is by far the worst hotel I've ever stayed in. We couldn't get up early enough in the morning so we could get out of the place and stayed out as long as we could in the night. It was damp, dirty, smelly and cold. It was not possible to flush the toilet and it was growing mould in the shower and over the bed!"
19,999,"Jan 10 2004	Disgusting - stay if you're a pyschopath or drug user	I stayed at the Notting Hill Hotel for 4 nights and I have to say it is THE most disgusting, depressing, smoke filled, dirty, unsanitary hotel that I've ever stayed in my entire life. You're talking to a world traveller here that has stayed in many a friend of a friends house, hostel, campgrounds, and the Ritz. The Notting Hill hotel is in a GREAT location, absolute wonderful area of the city - BUT I caught a terrible skin rash from my bed and I still have it to this day to remind me of that gross hotel. The resturant is deep in the basement, it looks like a place that pyschopaths would go to perform killings - it's just one of those &quot;trust me&quot; situations - PLEASE STAY AWAY from this gross hotel. Pay a few dollars (yen, quid, euro, whatever) and have some pride in yourself and stay someplace else."
20,999,Dec 17 2003	Damp and dreary	We stayed at this hotel for 2 days and won't be going back. But what should I expect for 49 quid a night in London. Even though the staff were very friendly it could not save the experience we had there. As soon as I walked into the roon there was a stench that was absolutely awful and could only be escaped by constantly lighting up cigarettes to drown out the smell. There was mould in the shower and we could hear the conversation of our neighbours at all times. I would not recommend this hotel even though the location was ideal!!!!
21,999,Aug 19 2008 	hotel ben situato a londra
22,999,Apr 24 2008 	Pas trs commercial
23,999,Aug 19 2007	No se os ocurra ir all.
24,999,Apr 29 2006	notting hill hotel un viaggio nella londra com'era.....
1,1000,Nov 19 2009 	Nice hotel in a very good location - great for business or pleasure	I stayed here just for one night in November. Got a rate of 175 room only via Late Rooms which I thought was expensive - but this is central London.Hotel is well equipped. Rooms are really nice with a good bathroom/shower and separate toliet. They've done a good job in designing the rooms to maximise space without sacrificing the square footage so the rooms feel spacious.Good in room entertainment and otherr amenities as you'd expect but the clincher really is the location.Good bar (fairly expensive) and restaurant with very impressive communal areas/reception.You are a few minutes from some of the nicest parts of London. Fantastic for tourists and very accessible for business - a five minute walk from Tower Bridge.
2,1000,"Nov 14 2009 	Great location and excellent value	We will be going back, which is surely the best recommendation. The main feature is the location; very near the Tate Modern, Globe, Millenium Bridge, St. Pauls - not far to walk to the Tower of London in the other direction. Round the corner from Clink St, Southwark Cathedral and Borough market - lots of atmosphere in this area.With the Novotel you know what you are going to get; which is a major advantage when trying to source a reasonably proiced hotel in London - there are a lot of dodgy hotels at the lower end of the budget scale. Rooms are well equipped; breakfasts are plentiful and good quality; prices are excellent especially when travelling with kids. OK, the rooms are not excatly spacious when the sofabed is down for the kids - but who wants to come to London with kids and stay in the hotel room?"
3,1000,"Nov 9 2009	Avoid this strange place	I have just returned from this hotel after a leisure weekend in London booked with Edwards Coach tours. What a fiasco! The room booking plainly stated &quot;twin&quot;. When we arrived we found one double bed, so went to reception to ask to change. To say I was met with a response more appropriate from Hitler himelf would be an understatement. The receptionist was abrupt, rude, unhelpful and tried to make me feel grateful that i had accommodation at all never mind the wrong type of room. She spoke to me as if I were a naughty child, and was adamant there was nothing she could do (more like nothing she would do!!) Eventually we got them to make up the sofa bed that was in the room, but again when i raised a question about the rather dubious comfort of this her answer to everything was No! NO! NO! NO! I rather think it was a new word she had used that day and was practising!Taking her out of the equasion the room itself was not really satisfactory. There are no doors on the wardrobe. the toilet is separate from the bathroom, so you have to walk the entire length of the room to wash your hands after using the toilet, and, with no disrespect intended a person of large build would have great difficulty in such a small toilet cubicle. Most unsatisfactory. The rooms do have a safe and iron with ironing board which i suppose is one redeeming feature.Breakfast was tasty and plentiful and the service was good. However, both the tea and the coffee were disgusting. The hotel is close to London Bridge tube but as a frequent traveller to London I have stayed in many hotels in the city. This is postively the worst and i will not be returning. Avoid this at all costs"
4,1000,"Nov 3 2009 	Perfect for viewing fireworks New Years Eve	stopped in this hotel new years eve 2006 and 2007 with 3 kids as its very close to Southwalk Bridge (5mins walk) an ideal viewing spot for the firework display at London Eye. Many families do exactly the same but also the usual crowds celebrating a gather complete with champagne, party poppers etc. Paid part cash part tesco vouchers. The breakfast is self service hot and cold buffet with cerials toast etc Has a pleasant bar who were happy to warm bottles etc for baby. Had complimentary drinks as our room wasnt available until after 2pm and we were disappointed we couldnt get checked in and start sight seeing. Lovely location for Tate Modern, Millenium Bridge etc Had a taxi to British Museum for under a tenner. Parking reasonable considering location, but sometimes barrier is left up and you can come and go for free !!"
5,1000,"Nov 1 2009 	EXCELLENT VALUE 	Stayed here Friday night in October. Booked in advance on a non-refundable tariff and got room for 2 adults and 1 child incl breakfast for 109 which was fantastic value. When we checked in (slightly early, but not a problem) they were only expecting 2 adults. Fortunately our confirmation quoted 2+1 and they put us in a family room, but as the hotel was very busy it was lucky we arrived early. Room had everything you could want or need for both business and pleasure and was very clean, including the carpet (some hotels only seem to vacuum once in a blue moon). Bathroom great, including complimentary toiletries (only need your toothbrush/paste) and a decent sized bathtowel which made a pleasant change. Restaurant was pleasant enough, good service. Excellent value childrens menu although the portions were just ridiculously large for a child - I would have struggled to eat the pasta main course myself. Breakfast was plentiful and lot's of choice, although it paid to get there a bit early as the queue by 9am was long. 20 mins free internet access should you want it, plus some sort of xbox/wii in reception for kids. Only a 5 minute walk from London Bridge tube, and the city was 5 mins away across Southwark Bridge. As London Bridge is on the Jubilee line it was very useful for the 02 (although I'm not sure it's running at weekends at the moment)."
6,1000,Oct 20 2009 	Family friendly but not romantic	We stayed here with our four children for three days in October. There are lots of good points about this hotel and a few negative. The hotel is family friendly (children eat free for breakfast) with a kids menu. The hotel was close to London Bridge tube station(about 10 mins walk). They allowed us to store our luggage in the luggage room on our last day so we could do some more sightseeing. The rooms were cheap considering we had to book two rooms...good value really. However the rooms are SMALL. It is certainly not a hotel to go to if you want a romantic weekend. Our two rooms were not connected and this disappointed us. The reception lady seemed happy that the two rooms were on the same floor!! The other complaint we had was that they came in very early to make the rooms up each day..sometimes at 8am! Overall though it is a good value hotel for families with cheap rooms at a 4 star level.
7,1000,"Oct 19 2009 	Great hotel would definately recommend	After travelling 24 hrs plus I was very excited to check in early. The place is very nice and close to a number of things including London Bridge station, red bus pick etc. The restuarant is great, I can't say a bad thing, we ate there every night as the food and prices were fantastic, kids menu is a plus!! Staff were very friendly and helpful."
8,1000,"Oct 12 2009 	perfect utility accommodation	We needed somewhere convenient to stay the night &amp; have breakfast following an evening wedding reception. Novotel fitted the bill perfectly. The check in, the bar and, the next morning, breakfast, as we experienced them, where quick &amp; efficient &amp; friendly. (We can understand how it could be otherwise as it does seem to be a training hotel for the company - enthusiatic but not necessarily very exprienced staff.) The room itself was quiet and had all we needed. Once served breakfast was so relaxing we nearly missed our checking out time. The hotel is just a couple of minutes walk from the South Bank, in easy walking distance of the Tate Modern and St Paul's. There were families with small children staying but they did not disturb us beyond causing the occasional trip hazard. It is a perfect base for walking the city's sights if your accommodation requirements are purely utility."
9,1000,"Oct 8 2009 	Great design but not well-designed...	I travel to London often on business, but this time was accompanied by my wife and 10-year-old daughter. Most London hotel rooms are small, so was looking for something that could fit 3 reasonably well.Novotel room was tight fit - with double bed and fold-out sofa, barely room for our luggage, so we upgrade to a suite for additional 40 per night (negotiated from 50). the suite was very roomy and came with free internet (regularly 15 per night) and breakfast (30), so it was basically a free upgrade.The pros:- great size suite- convenient location to almost all of London- very modern looking hotelThe cons:- TVs not working - had to call for service twice (eventually fixed)- Internet woes one night (again called for service and fixed)- Not enough outlets - desk had 3 outlets, all in use by TV, cable &amp; router - so couldn't plug in laptop without disconnecting TV- No wireless - had ethernet access to Internet (15 per night) but I like to use Skype on my iPhone for calls, which require wireless. In 2009 no excuse for a hotel not to offer wireless Internet.- The design of the rooms was modern and &quot;looked cool&quot; but not at all practical. Modern sink barely left enough room to place shaving kit. In our initial room (before suite upgrade), the toilet was separate from rest of bathroom, so had to walk to other side of room to wash hands. Just not well laid-out.- Restaurant/room service was mediocre. Plus, one morning asked to buy coffee to take away and they wouldn't do it - could only serve it to eat in.Overall, this was an OK hotel. Once we upgraded to the suite, we were fine and it was reasonably priced for what you get. I'd consider staying here again if they added wireless."
10,1000,"Oct 7 2009 	Nice Hotel Great Location	We stayed at the Novotel in July for a long weekend break to explore the south bank. Hotel was very clean. Staff very helpful and friendly and it was in a great location to get to the places we wanted to visit such as the Tate Modern, Borough Market and the Dali Exhibition. Would definitely stay there again.."
11,1000,"Oct 3 2009 	Lovely hotel with great location	I have absolutely nothing bad to say about this hotel - if you can get a good deal booking on the internet (and I did) it's so worth staying here. Very comfortable, it made my jetlag a breeze when I first arrived in London. The room was huge by London standards, staff were super friendly and helpful, fantastic water pressure in the shower (if you've stayed in London before you may know how rare this can be!), great breakfast with fresh fruit - I'd definitely stay here again!"
12,1000,"Oct 2 2009	City sights in walking distance	Me and my 10 year old son arrived with the Eurostar at London St.Pancras in the afternoon. Tube is possible with two stations nearby, but we had an appointment with the London Eye, so time to check a, no question, black only cab.No time to wait at check-in, a surprise, german girl, nice and friendly secured a room on the 6th floor, immediatelly after weve asked for an upstairs room.Lobby is not that large with a bar and coffee shop and a restaurant on the other side.The room greeted us with a suspicious smell, not really bad, but something like wet and not enough time to go dry again. It was possible to open the windows, we had them open during our city visit and it was ok when were back in the evening.The room itself fitted with well designed modern furniture, carpet floor, what I dont prefer,but spacious enough for the two of us. Also a small working desk with a flat screen TV .Bathroom was fitted with the warm welcomed bathtub, also from the smallish side, but clean and ok so far. The hotel is located near the Riverbank, close to Tate modern and also the London Eye in walking distance. No problems also, when we walked back in the evening. The hotel was fully booked, therefore the breakfast room was to small to cater all the pax, but the buffet style breakfast was ok. There is also a free internet station in the lobby, where we secured seats for the outbound flight on BA.No time to wait at check out, another friendly german girl there, the next tube station reachable within five minutes also with bags."
13,1000,Oct 1 2009 	Great Location - Great Staff	Not a great fan of staying in London but think I have now found a pad that ticks all the right boxes - Great Location 2 minutes from London Bridge an friendly staff. Check in a breeze and a talkative chap from Hungry in the bar. Room good size with Separate Toilet and Bathroom (as in all Novotel's I believe) Breakfast was good with personal TV if you wanted it. I'll be back.
