IDREVIEW,HOTELID,REVIEW
89,1321,"Mar 3 2007 	Avoid this hotel at all costs	The rooms, location etc are irrelevant. The truth about this hotel is that THEY WILL STEAL FROM YOUR CREDIT CARD. We booked on the hotel website with one credit card. They immediately charged the full stay on that card. On checking in and showing another card, they charged that card the full stay too. We are four months into a battle which will probably end up in court to recover the double charge, which they flatly deny in the face of irrefutable evidence from the credit card companies that we have paid twice. As the Aussies in an earlier review found DO NOT BOOK THIS HOTEL because any change you make - even using a different credit card - will be punished with a double charge. The plague still exists in London, at 20 Nevern Square."
90,1321,"Feb 27 2007 	Comfortable stay	great 6 day stay. Staff very pleasant. Breakfast was substantial, but not a hot breakfast. Stayed in rm 14 - 5 days ... for some reason, it was always warm (&amp; this was during Feb) - but with window open, the room was fine. Stayed in rm 9 - 1 day. Room much cooler. Both rooms small --- compared to US hotel rooms, but rm 9 seemed a bit larger - maybe because dresser/cabinent was not as large. Closet in Rm 9 was a bit smaller than in rm 14. For 99 pounds, couldn't ask for much more. Bar only was open until 11pm, and on Sundays, it closed even earlier. My british friend would have liked to have tea service in the room, but I didn't mind not having it. Could always get tea from front desk. Free bottles of water in room. Very clean. Both rooms had only a shower, no bath. Park/square across the street was clean, as was the neighborhood."
91,1321,"Feb 20 2007 	Property satisfied our expectations!!!!	Just returned from five nights at this hotel; excellent location -within walking distance of Earl's Court station. The room was, not unexpectedly, somewhat small for a twin but the breakfast buffet made up for it. The staff were gernerally friendly, although they exhibited limited knowledge of the local area! I particularly enjoyed the free tea/coffee and made the most of this service. The rate of 100 Pounds a night would be at the high end of what this hotel is worth. I would definitely return at a somewhat lower rate."
92,1321,"Feb 14 2007 	Little gem of a hotel	Just a short review for this one. My boyfriend and I travelled down on my birthday last year to stay. This is a lovely little gem of a hotel. The room was a double although quite little but I prefer this to them having disrupted the layout of the building too much as it is a lovely old georgian house. The only thing I would have liked would have been a mini bar and also a safe in the room which we did not have. We stayed down here during the heatwave last summer and without air conditionning it was very hot. We did have a fan in the room but this didnt make much difference. The television was quite old fashionned but I know that you don't go away to watch TV! Literally just around the corner from the tube station so excellent links and some lovely pubs nearby. Looking out of the window, it was nice to see the greenery of the square but there was rubbish strewn everywhere by local residents which detracted from the view slightly! I know that is not the fault of the hotel. Breakfast room and selection of food lovely, reception staff very helpful and friendly. Highly recommended."
93,1321,"Feb 13 2007 	Aussies who had a great time	We are also an Australian family who took two teenage daughters for a stay 1st to 7th January, 2007. We found the staff, the facilities and the location to be excellent. Our daughtrers enjoyed their evening Hot Chocolate (complemetary) and we all appreciated the standard of our rooms and bathrooms. I did not think that the furnishings were of cheap quality. I was saddended to hear that the other Ausiie family did not have the best of stays as we cannot speak highly enough of 20 Nevern Square."
94,1321,Feb 9 2007 	very comfortable enjoyable stay	Booked with londonnights.com where it was featured as &quot;Hotel of the Month&quot;. We checked tripadvisor reviews before we booked and the hotel lived up to its reviews. Beautifully clean room with stylish four poster - Lovely shower and very clean bathroom. There was no tea making facility in the room so when we awoke at 5am (we are early risers) we phoned the night porter who brought down a couple of pots of Earl Grey no charge. Nice breakfast room. Smashing small hotel with lots of character. The manager recommended Zizzi's Italian on Earl's Court Road for dinner by the way - real Italian restaurant and proper Italian food - luverly. Thanks to all of the staff.
95,1321,"Jan 30 2007 	Beautiful hotel!	Wow! I booked a four poster bedroom in this hotel as a birthday treat for my boyfriend, as I thought it would be a little more special than just your standard london hotel room. Let me tell you, I wasn't disappointed! The room was stunning - A few stairs take you down a small corridor, where you'll find a small but very nice marble bathroom. Carry on a little and you'll find a huge four poster bed with plenty of room to walk around. Good facilities too - DVD player, television, cd player and freeview. Nice big wardrobe with plenty of hangers (and a nice big full length mirror for the vain types).Ordered breakfast to the room in the morning and it came within 20 mins with plenty of food! Would thoroughly recommend checking this hotel out next time you stay in London!"
96,1321,"Jan 18 2007	The Pasha Suite Amazing Experience	I booked the pasha suite for 3 nights as a gift for my girlfriend. I spoke to sulai on the phone to arrange certain items, champagne, flowers and a few little extra's... I gave him my budget and he was able to sort it all out for me.. I also i mentioned that I did not want my girlfriend to know costs etc so he let me pay him the next morning. The room was amazing, flat screen tv, dvd player, cd player, marble tiled bathroom, power shower just amazing. Also i read in a previous review &quot;fake wooden floors&quot; let me assure you it is real wooden flooring with amazing furnishings, the bed was a four poster and was very comfortable. We had a great view over-looking the garden and the 24hour room service is top-notch. It's great going to a hotel and you don't have to lift a finger. As for breakfast, I had forgotten to put my breakfast list out, I rang down to reception and within 15minutes of my call Sulai once again sorted me out with a full continental breakfast which I arrived on a basket/tray which was fit for a king. Amazing stay and the girlfriend was very pleased."
97,1321,"Jan 15 2007 	Should It Be Twenty NEVER(AGAI)N Square????	We booked four nights at Twenty Nevern Square in December - two rooms, one for us and one for our daughter and schoolfriend travelling with us from Australia. On arrival, and before checking in, we told Sulai at the desk that we had received a call immediately after arriving from Australia which meant that we had to stay for one night less than planned. He told us that we should have given seven days notice (WE HAD NO IDEA ABOUT THIS) and would be charged anyway...we hesitated about checking in but he said he would check with the management and he thought it would be OK.....so, we checked in, had a reasonable stay..........rooms small but clean......the hotel has been made to look 'trendy' but consists of cheap indonesian furniture made to look like a number of very expensive 'boutique hotels' in London. The floors are extremely slippery 'fake' wood so take care...breakfast very poor, ham smelled 'off', bread and pastries etc. One good thing, tea &amp; coffee was available on demand without charge....and arrived promptly.We eventually did stay for an extra night so the only change to our plans was that one room was not used for one night -which we had advised three days previously - We checked out, signed the credit card slip for the total agreed amount, and left......only to receive an e-mail a few days later saying that in spite of telling us at check-out that we would not be charged for a room we didn't use AND giving them at least three days notice, they had decided to charge our credit card anyway..without any authority or agreement from us....this is completely contradictory to any hotel we have ever stayed in. We travel widely and have never experienced anything like this before....we sent various e-mails back but were told in no uncertain terms that they have a very strict cancellation policy (even though it was not set out prior to our arrival). So, our advice is.......if you don't mind terrible customer service, credit card charges being made without your authority and after your departure, poor breakfast, cheap furnishings, go ahead and stay at Twenty Never(agai)n Square but don't say you weren't warned!!!!! P.S. The beds are also cheap and extremely hard!"
98,1321,"Dec 28 2006 	Small but nice	The room was small but comfortable, nicely furnished and clean. The bathroom was luxurious.The continental breakfast was ample and very good.The staff were friendly, and the Kensington location very pretty and pleasant."
99,1321,"Dec 17 2006 	charming London experience	Like many other previous reviews, we found the hotel exceptionally clean, the staff friendly and helpful, and the location ideal for visits throughout London. During the four day stay, we did not observe anyone eating the &quot;full English breakfast&quot; (which was a 9 pound upcharge per person). The &quot;normal&quot; breakfast buffet included in room rate was quite adequate and included the following: chocolate and plain crossiants, wonderful fresh fruit salad, plate of sliced fresh fruit, 4 types of cheeses, 4 types of meat cold cuts, freshly baked rolls, muslix cereal, corn flakes, packaged wheatabix, strawberry yogurt, sour cream, milk, orange juice, teas, coffee, cappacino, jellies, butter. Complimentary afternoon coffee/tea in the &quot;lounge/bird room&quot; was a nice mid-day break. The lounge normally contained bowls of oranges, apples, crackery snack mix and peanuts.A computer with Internet access is available in the lounge for 2 pounds per hour. We found the room to be quiet and maintained at a comfortable temperature. Space in the room was adequate. There are two grocery stores (1 was Marks &amp; Spencer) and a Boots pharmacy just outside the Earl's Court Tube Station on Earl's Court Road. The Marks &amp; Spencer has packaged food suitable for a nice picnic. For those searching for rapid mediocrity, McDonalds, Burger King, and Benjy's can also be found on Earl's Court Road.Direct train service is available from Gatwick Airport to the West Brompton Station (which is a short walk - a flat third of a mile - from the hotel). This direct train to West Brompton actually transported us from airport to hotel as fast as the Gatwick Express would have, without schlepping luggage around Victoria Station (part of the &quot;Express&quot; experience). Train fee was 9 pounds each way, a little less if you also get an Underground Travel card for zones 1 and 2. The return train (West Brompton to Gatwick) may require a train change or two. Detailed schedules are online.We would definitely return to 20 Nevern Square."
100,1321,"Dec 10 2006 	Great Hotel but could be quiter	Booked the hotel on the basis of the previous reviews and was not disappointed. The hotel is only round the corner from the tube station (Earls Court) and in a lovely square which is very quiet. The place its self was beautifully decorated and the staff were very nice. My only grumble was I booked a single room, which was in the basement level. This was fine until about 6 o'clock in the morning, when you could hear the cleaners moving around. This was because the cuboards with all their cleaning products etc were right outside my door. All in all the hotel is worth the money as you get a continental breakfast included, but I would recommend anybody booking the hotel, request they don't go in the basement level unless you have an early start or you are a heavy sleeper."
101,1321,"Dec 8 2006 	Noisy but Nice	A lovely looking hotel in a good spot, not far from Earls Court Tube and a short ish walk to Exhibition Road. Quite a small room but very nicely decorated. Unfortunately the hotel was quite noisy, just with doors banging shut, the lift and the like but did enough to wake us both up. It was very cold during the night.With strict check out times (must be out by 11am or you will be charged) it was disappointing to be kept waiting for over 20 minutes at breakfast and then when we returned to the room to pack we found we were locked out. It must be said the owners have made a great effort to produce a lovely small hotel, it's just because it was a real treat for us to stay in London that these small disappointments seemed quite a big deal at the time."
102,1321,"Dec 7 2006	Number 1 for London	I booked 3 rooms directly with the hotel for a Business conference my colleagues and I were going to for the weekend , I spoke to Sulai, who is just amazing and made all the arrangements for us.On arrival we were greeted by Sulai and the Porter who made us all feel very welcome, we did not have to l;ift a finger our bags were taken care for us and allocated to each of our rooms. The service was impecable throughout our whole stay. The decor of the hotel was lovely, the breakfast was awesome and the free WI-FI was ideal for all of us to get our work done. One of my Girlfirends summed it up the best bit was waking up in the morning and seeing Sulai's face, very handsome. We all look forward to returning to Twenty Nevern."
103,1321,"Dec 6 2006 	An ok experience	The hotel certainly gives a good first impression. The furnishings are just beautiful and the hotel is in a great central location. Our room (No.15) was probably the smallest hotel room I have ever stayed in, although the decor was lovely and the room clean. On the down side, the room was incredibly hot to the point of being almost unbearable - depsite the heating being turned down and the window open. I was glad to leave the hotel after one night.The continental breakkfast was substantial and the dining room nice - we did however have to wait 20 minutes in order to get a table. At check out I was charged for something I hadn't ordered and had to point out this mistake to the receptionist.Would I stay here again? Probably not."
104,1321,"Dec 1 2006 	Charming B	We stayed at 20 Nevern Square for 3 nights at the beginning of November. We needed a room that would accommodate the two of us and our 12 yr old son. We were told the 4 poster room would be suitable. It was a lovely room, in the basement. With the rollaway in the room there wasn't really any room for suitcases, etc but the room was nicely decorated. The hotel itself is in a great area, because the tube which is a lovely 5 minute walk through a pretty 'area is on the District and the Piccadilly lines so easy to get to the airport and also into the centre of London. On arrival we asked if the room had tea and coffee making, and were told that we didn't but any coffee or tea, either taken in the sitting room, bar, or our room was complimentary, including cappucino, etc. which was really great. Complimentary delicious fresh fruit was provided in our room and available in the sitting room which our 12 yr old who doesn't usually eat alot of fruit said was the best he'd ever had. The breakfast room was a beautiful atrium room and the breakfast was a very nice continental breaky. Overall, a great experience. The hotel is is a typical Victorian semi and beautifully decorated and maintained."
105,1321,"Nov 28 2006 	A Little Gem!!!	I booked this hotel following the reviews I had read on this site so we were looking forward to our stay. Booked direct with the hotel, good communication and good responses to my emails.Went to London to see a show and xmas shop so only needed one nights stay, a bargain I would say at 55 each inc brekkie.We arrived 3 hours earlier than usual check in allowed but without hesitation our bags were whisked away and we were told to enjoy our shopping and our bags would be waiting for us on our return. We had a lovely welcome, lovely entrance hall, very friendly, helpful and very attentive staff they made us feel really special on our girlie shopping extravaganza! We were offered breakfast in our room the next day at no extra cost which we had - wow loads of food and beautifully presented, highly recommended.We had a twin room in the basement, with a small terrace, rm 2. It was a decent size, tv, radio, cd player, hairdryer, bathrobes with a lovely ensuite, fab shower, comfy beds.My only criticism and its only a very very minor one - our room was quite noisy from about 7-8am from hotel staff, they were obviously getting breakfast ready but after a late night it would have been nice to have a bit of a longer lie in.Next time I think we'd request a room on a higher floor.On checking out at 10am, again the staff were exceptional and offered to store our bags - and there were loads of them - till we shopped some more, they were waiting for us on our return late afternoon. Great service.I can highly recommend this hotel, its a little gem, 2 mins from earls court tube station. Now we have found this one we will without doubt recommend twenty nevern square to all our friends. We hope to return again soon."
106,1321,"Nov 10 2006 	Fab hotel!!!!!!	We spent last weekend at the 20 Nevern Square hotel and loved every minute of it!!!! From the moment we arrived until we collected our bags when returning home, we couldn't fault it!We arrived early on the Friday and were unable to check into our room. This was fair enough as it was only midday. We were able to leave our bags and were advised that they would be placed in our room ready for our return. Much better than having to collect them and struggle up to the room ourselves!!!On our return, we went straight to our room, which was number 16, on the 3rd floor. The decor was very suble and it was nice to see quality fixtures and fittings, instead of the usual mdf units!!!! One downside is that there is very little storage space - 1 small cupboard - and nowhere to put suitcases. Only really a problem if you're staying for a week. The bathroom was fine. It was well lit and had a decent shower. No bathrobes though!!!! I admit that the room is very small, even by London standards, however this is a townhouse hotel and not a purpose built chain hotel! The smallness of the room is completely forgotten as soon as you step out of the french doors on the absolutely fantastic decked terrace!!!! If you were to buy a property with this feature in London, it'd cost you thousands!!!!The bed was comfortable and I had no problems sleeping. However, the room was more than a bit warm and it maybe that it's too warm during the hotter summer months. It was one of the coldest nights of the year so far (-4 in London) and we still had to sleep on top of the covers with the french door slightly open! However, not a major problem and it is worth remembering that this is a boutique hotel in an old building so there are no bulky air conditioning units in the room. This would spoil the style of the room way too much!On our first morning, we ordered breakfast in the room (shame it wasn't warm enough to sit outside). This was at no extra charge like it is in most other hotels, which I thought was a great touch. We thought we'd probably get smaller portions, but no chance!!!!! We got everything that was available in the downstairs breakfast room and probably ended up having a far bigger breakfast than normal!All in all, I cannot fault our stay at 20 Nevern Square. The room was fantastic, the staff were really pleasant and helpful and the location was great - only 2 minutes walk from Earls Court tube station. I can't wait to return to 20 Nevern Square in the summer when I can have my excellent breakfast on the fab terrace of room 16!!!!!!"
107,1321,"Nov 9 2006 	Awesome	After reading some reviews about this hotel, I thought that this was my hotel.I wasn't expecting a lot, just a nice little hotel, but when I arrived there I discovered that it wasn't just a nice little hotel. The staff were very very helpful, the porterage came to help me with my luggage (Porterage in a 4 stars hotel in London? Yes - amazing)Then I saw my room, the number 10 (for single use). The room was small but the furniture was really nice. The bed was awesome and the bathroom clean and useful.The quality of the breakfast was also good, however, there was no much choice. Anyway, for the price I paid for the room, this is an awesome hotel, the best price-quality relation I've ever seen, and this, in London, is very very strange.I would really recommend this hotel to everybody."
108,1321,"Nov 1 2006 	A Pleasant Surprise!	I went to London for a conference and decided to stay a few extra days to see the city. After reading reviews, I booked three nights at Twenty Nevern Square.The staff were friendly and very accomodating and even let me check my bags in the morning before check-in time so that I could catch a West End show. While the room was a little on the small side, it was well furnished and had the most amazing little bathroom I've ever seen for such a small hotel. Everything except for the ceiling was clad in beautiful stone tile.The continental breakfast was delicious and hassle-free. I was able to pop in, eat some yummy croissants and cheese on bread, then walk a few blocks to the tube to be anywhere in London in less than an hour.My only complaint was that it was expensive for an American (about $160 a night when you added everything up, including the horrible exchange rate between the dollar and pound) -- but that's actually cheap for London! The quality for that price, relatively speaking compared to other places in London, was great. I would stay here again."
109,1321,"Oct 21 2006 	Amazing Experience- Twenty PERFECT Square	I decided to visit London for a weekend break and to do some much needed shopping. After looking around Twenty caught our attention for its fantastic reviews, my fiance and I have a new name for the hotel, we call it Twenty (Perfect) Square. I made the booking directly, the response time to my email was about 5 minutes, that alone impressed me. I made a booking with Mr. Sulai, a true gentelman. We arrived at the hotel and I was taken back by the Indonesian look (I love the Eastern look). The Receptionist welcomed us, the hotel staff were polite making us feel welcome. The check-in was informative, I liked the Breakfast in bed on trays part the most. We were escorted to our room by the porter carried our Luggage. We stayed in the Courtyard, the room was lovely, it was soo cosy, wooden floors, lovely silk linen, it was very clean. While I was admiring the decor, my fiance was playing around with the flat screen tv and cd player. To the Breakfast, the fresh fruit and yoghurt did it for me. My fiance Greg opted for the Full English for the 2 days we were there. We had a fantastic weekend.All in all I can speak highly enough of this well run establishment. Everyone was soo sweet and helpful and made our stay truly enjoyable. I am inclined not to believe everything I read but what they say about Twenty PERFECT Square is all true."
110,1321,"Oct 21 2006 	Nearly perfect	If you dont need porridge in the morning, Twenty Nevern Square is an extraordinarily nice and affordable place to stay. I was only going to be in London for one day, so I decided to try a new hotel. If it turned out to be awful, it was only one night. In terms of location, Twenty Nevern Square was a good compromise between central London and Heathrow on the Piccadilly line. The Earl's Court Tube station, which has a lift for luggage, is only about two short blocks away. At 79 GBP from LateRooms (including continental breakfast and VAT), Twenty Nevern Square also was a bargain. Yet, the hotel met or exceeded my expectations in nearly every way. I was informed at check-in that I could have breakfast delivered to my room if I wished and complimentary coffee or tea could be delivered at any time. My single room, which overlooked the Square, was spacious and pleasantly decorated, but not too fussy. With the window closed, it was blessedly quiet for sleeping. Amenities included a bathrobe, a safe, bottled water, and an apple. The staff was completely pleasant and helpful. When I wanted to go out to walk about and get dinner, I realized it had begun to rain and I had no umbrella. I asked the employee in reception if the hotel had an umbrella to borrow. It did not, but without a moments hesitation she simply loaned me her own umbrella. That exceeded my expectations. All I had to do was return the umbrella before she went off duty that evening, which was no problem at all. My only quibble with the hotel: no porridge for breakfast (continental or cooked) and I never did figure out how to operate the remote controls for the TV and its appendages."
