IDREVIEW,HOTELID,REVIEW
44,714,"Jul 23 2007 	High Maintenance Travellers Beware	I read all the reviews for the Edward Lear and was pretty nervous about staying here. I heard about some pretty dismal sitautions. When I got there, I realized it may be a result of high maintenance travellers.I don't know about the bug situation, as I have read there are lots in this location. I never experienced any bugs while staying there for four nights. In fact, our room was really pretty clean. I rarely do this, but I even walked around without shoes on. It's definitely clean enough. Another complaint was about the stairs. There is a long walk up the stairs, but it's central London. Every time I've been there I've had the same kind of walk up. It's not a big deal. You can't beat this location... I am not kidding you. Three blocks from the Marble Arch and its tube station. That's an unbeatable location. It's becoming a diverse neighborhood, so there's lots of fun Middle Eastern, Indian, and Japanese restaurants. You're three blocks from Hyde Park and right there on Oxford Street. You get a lot of great sites for this location.My only complaints are fairly superficial. I don't care to share a table at breakfast, which we did one of our mornings... the breakfast room is small so it's going to happen. But that's not a big deal. And the internet is a bit finicky. We were trying to get tickets to Wimbledon and it took over 30 minutes to get some very simple information (the tube stop). If you go expecting the Ritz. Don't stay here. Go stay at the Ritz. If you go expecting a typical central London inn, it's just fine."
45,714,"Jul 5 2007 	Great Location and lots of room in our triple	We stayed in a triple and although we had to hike to the 4th floor, we enjoyed all the room in our place. We did have to share a toliet and shower but we got used to it. The breakfast was delicious. SO much to eat, cereal, eggs, sausage, bacon , beans, tomatos, toast.This area had great shopping very close by. They had an ironing board on the bottom floor for community use. Hairdryer to ask at the desk. We loved the internet. There is a lounge area where the internet is - but it closes at 10 pm. The beds were comfy enough and the room was clean."
46,714,"Jun 15 2007 	Great Location Decent Enough Accommodation if On A Budget	My husband and I stayed here for 4 nights in June. We did not want to spend a ton of money but we did not want to stay in hostel either. This hotels location is AWESOME!!! Very safe and quiet as well. So close to the best shoping in London and minutes from the Marble Arch tube station which is very convenient as well. If you are travelling on the tube for more than 5 days get a 7 day travel card (oyster card), much cheaper and convenient to swipe in and out. The hotel staff were very, very friendly and our room was ready when we checked in early (noon). Be ware of having to carry heavy suitecases up lots of flights of stairs if you are on a high floor as they do not have elevators. Pros of the room: decent size for London, coffee and tea maker, bed was OK, room was quiet. Cons: carpet is old and needs cleaning (bring flip flops or slippers, flip flops for sure if you have a shared shower room). The bedding could use upgrading, pretty shabby. We only had breakfast one day and it was pretty decent. The free internet computer was awesome, always worked and never a long wait.This hotel is a great choice if you are looking for a great location, not too expensive and can over look the run down side of the hotel. I would stay here again for sure."
47,714,"Jun 6 2007 	Reasonable affordable accomodations	Perfectly adequate and reasonably priced accomodations. The pros: its a great location...near a tube and hyde park, but out of the way just enough with lots of (relatively) cheap eats nearby. The room was clean and perfectly livable. The cons: the rooms are small and the beds are hard. We lost hot water in our shower one day and it was quickly fixed."
48,714,"Mar 14 2007 	Good value for money	Great place to rest your head. Not great if you plan to stay in your room, 24 hours a day. I just slept there and had the very good breakfast. Clean and tidy with helpful staff."
49,714,Mar 13 2007 	Horrible	Fifthly!!! I had to kill all the cockroaches before my wife saw them. Do not stay in this hotel.
50,714,"Feb 25 2007 	Good Value	Okay this is not a 4 star hotel! However if u are on a budget and are only going to be in your room for sleeping this place is great! Myself and my sister booked for 9 days this past month. Breakfast was adequate, rooms were clean, bathrooms were clean and we didn't have to wait to use them as we didn't have an ensuite room. Knowing we were going to be there for 9 days they where kind enough to give us a triple room while honoring there price for a twin for us. This was great in that it gave us a bigger room. Yes this place could use some sprucing up but you really can't beat the location. A block from an underground station made it so easy to get around town and even get in the tube station really early in the morning for our Train to Paris and our way back to Heathrow on the tube was quick and easy. Not to mention being a block away from Oxford street and Bond street with all that shopping to do was just great!Staff was fantastic!!! I got sick there and they were kind enough to help me find a walk-in clinic that afternoon!  Also having internet access was such an added plus!  As you can see I was very pleased with this location. Will for sure be coming back and letting friends know about this place. I figure I would just spend more on the town then on my hotel stay and I made a great call there!!"
51,714,"Feb 11 2007 	abysmal	Just had my Worst travel experience EVER staying here! Some of the reviews cannot possibly be talking about the same hotel I stayed in last night. Although the bedrooms are reasonable other areas of the hotel are dirty, discusting and potentially dangerous! Key points for me were: Mice droppings in the hotelReally bad damp and falling apart floors in some of the bathroomsNo late check in, despite letting them know of my late arrival then ending up being stood on the doorstep for half and hour in the rain!No lift and stairway handrails falling apartEquipment broken/not workingThis hotel is very VERY overpriced for what it offers.... we had a choice between this and a three star hotel for 65.00 for the night. We chose this unware of the condition as it looks and sounds nice from the description. Don't be fooled - this place is not worth the money... check out some of the nearby youth hostels, low budget hotels or Laterooms where you can pick up much better for the same price! if you are on a tight budget and want somewhere safe and warm to stay!Although this hotel has history it is in need of some serious TLC.. until then avoid it!"
52,714,"Feb 7 2007 	Not the Ritz but great value	I needed a room near Park Lane for a single night for business. At the price I wasn't expecting anything spectacular, but was pleasantly surprised.The staff were very friendly and welcoming.The room was small by modern standards, but was perfectly adequate. The decor was a bit dull, but the room was clean and the bed comfortable.Having read previous reviews regarding the stairs, I took a small bag. Fortunately, I was only on the first floor. However, I can imagine it would be very difficult to manage a suitcase - the stairs are quite narrow.The breakfast room got quite crowded at about 07:45. I guess a lot of the guests were on business or wanted an early start. It would be more comfortable if you could leave it until later.For an overnight stay in the heart of London, you can't beat this hotel for value."
53,714,"Feb 6 2007	Just what we were looking for	We spend 3 nights at the Edward Lear last October- would stay there again. We arrived in London with no room reservations except for our first night. The Edward Lear was listed in the (less than 50 pounds/ night) section of our travel book- so we set out on foot to find it. Turning the corner on Seymore Street- my girlfriend spotted a B&amp;B that had tons of flowers nearly covering the entire front of the building- she instantly said that we should stay there- it was the Edward Lear. I thought, oh great- this place is going to be all show and no go. Whoops- I was wrong. Next time we will save about 15 L a night and get a room with no shower or toilet. Each floor has about 5 rooms, and a full bathroom down the hall. I never once saw another person in the bathroom (and the B&amp;B was full)- most rooms are en suite- so no need to pay extra. The breakfast was okay- a bit crowded- but we were happy with a few eggs and tea- we wanted to spend our trip on the streets- not in the hotel dining room anyway. Our room was on the 3rd floor- hope you don't mind stairs- it was what you should expect for only 50 L/night- not brand new- but lots of closet and drawer space. The location is very good. The Marble Arch tube station is only 2 blocks away- and there is a mini-mart with chips/beer/soda 1 block away. This B&amp;B is one block off of Oxford Street- very safe to walk home if you are up late at night. The only thing lacking was there were no pubs/cafes (except Pret) within about a 10 minute walk. Also- A bit of street noise and no AC- so if you are a light sleeper during the summer- you'll have to choose between noise or heat."
54,714,"Dec 27 2006 	Perfect locationvery good bargain	I spent my Christmas holiday in Edward Lear hotel and I feel very satisfied with my choice.It is ideal for people that asks for a central place to stay in London but they don't want to spend a fortune for a 4 star hotel.On the other hand if you are used to a luxury hotel service is under your expectations. It's an old traditional english house with many narrow stairs,without elevator.Because of this I highly reccomend to have a room in a lower floor because it is not easy to carry on a heavy suitcase. I stayed with my friends in a quite comfortable room for 4 people,clean and warm.I preffered a room with its own bath and toilet.The room service was very good with the exception of 25th of December. Breakfast included cerials,juices,eggs,sausages,tomatoes etc.Keep in mind that in London many hotels charge extra money for English breakfast. Finally I don't find necessary to say anything about the location.Absolutely perfect.Seymour str.is the second str.behind Oxford str."
55,714,"Dec 22 2006 	Fantasic place to stay!!!	This hotel exceded expectations!!! It had a great atmosphere (old london house) with modern features, and was in a central location (2mins to marble arch, train station and Oxford st shopping). The staff were friendly and the rooms and bathrooms were clean and comfortable (and the stairs gave you a nice, easy work out!). Quite, no traffic, great breakfast!!!!I went there with a family of 5 and we were all very comfortable.I would recommend this hotel to anyone and obviously will be happy to return."
56,714,"Oct 26 2006 	Edward Lear is a bargain!	I have just returned from London, staying five nights at the Edward Lear Hotel. I was looking for a bargain, and this hotel is that. My single room (no bathroom) was very small, almost a broom closet, but I knew that going in. The room was clean; the breakfast each morning absolutely delicious, and the guests interesting and fun to talk to. Many are return customers, liking the bargain and the history attached to the hotel. I was on the second floor, so be mindful that there is no elevator! The bathroom was kept clean, and yes, I did have to wait a few times. The staff was very friendly and helpful, especially when trying to figure out how to make a phone call. I would stay here again; London is an expensive city, and you can't beat the price!!!"
57,714,"Sep 18 2006	Exactly the Deal We Were Looking For	We were looking for a reasonably priced hotel near some friends by the Marble Arch. We wanted one with a full breakfast to cut down on our food costs. You can imagine our delight when we found the listing for the Edward Lear Hotel, just two blocks from the Marble Arch tube station.We would have been willing to pay slightly more to get an ensuite bath, but none were available for our dates, so we went for the shared option. Each floor had a shower room. We were worried at first that we'd have to fight for our turn at the shower, but we never saw another soul the whole three days. The shower room was somewhat dingy, but completely functional. We were amused to discover that the window well on each stairway landing had been converted into a WC. One had a particularly low ceiling, but that just added to the experience, I thought.Our room had a sink and a mirror, so we didn't have to go to the stairwell to brush our teeth or anything. The plumbing is quite old, but everything was functional. The bed was fine and the room was comfortable. The hike up the stairs was a bit intense, but I'd read about that in the Frommers review, so I was prepared. Our room was at the rear of the building and it was perfectly quiet. The TV didn't work, but we hardly spent any time in the room anyway.Breakfast was excellent. Toast, eggs, beans, tomato, bacon, sausage, juice... really filling. The girls running the breakfast room took good care of us. We hardly had to eat lunch. The breakfast room was always busy, but we never had to wait. The placemats with Edward Lear limericks on them were a nice touch.Someone said that this place is like a hostel, but with more privacy. I think that's a fairly good comparison. We knew we had to share some of the resources, but there were no problems. I have already recommended this hotel to friends."
58,714,"Aug 7 2006 	Middle Aged Couple's experience	Just had a 3 day stay at the Edward Lear Hotel, London. On the plus side, the hotel is very convenient for shopping and not too far from theatreland. The breakfast was very good also. Massive problem for us was our room - We booked online and there were no en-suite rooms available for our stay. We were obviously aware of this but because of the convenient location we still made the booking. The shared facilities were dirty. Toilet down one flight, shower room down 2 flights. Our room was at the top of the hotel - 10 flights up with no lift. Maybe OK for young people but carrying our cases up and down 88 narrow stairs was no joke! There was no mention of this on the website. The room had plenty of drawers but hardly any hanging space. The TV reception was poor and being at the top of the hotel the room was unbearably hot. Because of the above I would not recommend this hotel to anybody.Angela - Jersey, Channel Islands"
59,714,"Aug 3 2006 	Perfect Location; Great Breakfast	My husband and I stayed at the Edward Lear in October 2003 and it made our whole London trip. The full English breakfast, with sausage, beans, tomatoes, eggs, tea and toast, served to order in a sunroom, is something we still try to duplicate. The whole Edward Lear theme, and the fact that he actually lived here, was adorable. The building was beautiful - &quot;craggy brown brick&quot; type 6 story building, though the interior reminded me faintly of my college dorm. And the location was perfect, perfect, perfect: 1 block away from the subway, Hyde Park, a major bus stop, and parking, in a VERY central but still residental and relatively safe area of London.Expectations are important, though. It is not an American style commercial hotel. It is not a luxury hotel. Think charming discount european style b&amp;b -- approaching a hostel but with more privacy -- and you'll be pretty close. Many of the rooms do not have private bath - we were on the top floor with a shower and sink directly in the room, but no toilet. It was down the hall and it was perfectly clean. The stair climb (6 stories no elevator) might be a problem for some. Just be aware of what it is and isn't, and enjoy it to the fullest!"
60,714,"Jul 21 2006 	Very Disappointing	Our first trip to London was marred by our hotel stay. It was dirty and lacked charm. We arrived before check-in and asked if there was a bathroom available. They directed us a room just off the breakfast room that looked like it hadn't been cleaned in months (think gas station restroom). Not all rooms have a private bath, so some guests have to use this one. I got a sinking feeling right away. My in-laws ended up with a room right next to the front door with the shower stall located next to the bed. My husband and I had a large bathroom, but no shower stall, just a handheld shower that had a leak, so water sprayed everywhere and the hotel had tried unsuccessfully to fix with tape! I don't believe our tub was ever cleaned during our 5 night stay. We were given small hotel soaps in our room at check-in but not provided with additional soaps until we asked. I also noticed that while the white bath towels appeared to be laundered every day, one day I saw stains on a towel I was about to use. In addition, the decor was last updated sometime in the 1960's, I'm sure. And a couple days we waited for in line for 20 minutes to eat breakfast because the seating is inadequate for the number of guests."
61,714,"Jun 13 2006	Great location friendly staff uncomfortable beds	The Edward Lear is reasonably priced when compared to other hotels in London and the location is perfect. Oxford Street is two blocks away, Marble Arch tube station is right around the corner and Speaker's Corner where many tours stop is close as well.The hotel staff is very friendly and breakfast is included which is a great deal. We took advantage of that every morning.The hotel does not have a lift so if you're lucky like us to stay on the 3rd floor, you will have to carry your bags up and down the narrow stairs. Also, we thought the room was OK but the beds were not very comfortable. There's a plastic lining under the sheet which stuck to me if the sheet came undone.We stayed for three nights and if I were to visit London again, I would not stay here again because of the beds."
62,714,"Apr 20 2006	Great Location but with stairs!	My family stayed 5 nights at the Edward Lear and overall we were very happy with it. Saving some accommodation money meant we had more to spend on other things in London. The showers certainly aren't great, the rooms aren't huge, the beds weren't wonderfully comfortable, but the breakfast is plentiful and the place is clean and tidy. Our biggest problem was being located on the fourth floor without a lift! A long way for my husband to lug all our bags after a long flight! Still, it was very quiet once you got there and the central London location was so convenient. We didn't spend much time in our rooms anyway, so why pay more?"
63,714,"Feb 12 2006	Value for Money	We stayed at the Hotel in January, 2006 on our weekend shopping in London. The hotel was old but quite cute. Great for travellers with a low budget for Hotels and those who do not wish to spend long periods in their room. The rooms are quite small, witht thin walls. There is everything you need to have a shower and sleep, even though you will have to step out of the shower soaked with water in the middle of the room. The breakfast was great with variety of food. One of the only problems with this hotel was that it didn't have a lift and it was fairly frustrating to go up 4 storeys with heavy shopping bags. We will definetly return, but with our room being maximum on the 2nd floor. Afterall you get value for money, cheap hotel close to oxford street."
64,714,"Sep 2 2005	Quaint Clean and at a great price.	This hotel is an OLD house, so don't expect something modern. The rooms were quaint, clean, and comfortable. If you don't know how to pack for a trip (carry huge, heavy suitcases), remember there is no elevator. But, there is free internet access in the lobby area, although it is a slow dialup. Also, the included breakfast is an excellent value. This is an inexpensive hotel in an expensive city. Our beds (wife and daughter) were very comfortable. The hotel is a short two blocks from Marble Arch tube station. There are pubs and restaurants of all varieties within blocks. We highly recommend this hotel for the value conscious. It's like staying in an old mansion. I wouldn't hesitate to book the Edward Lear again. If you're into snobbery, stay at the Hiatt down the street."
65,714,"Aug 6 2005	great staff good value	I've traveled the world and can only do so because I do it on a budget and I love the Edward Lear. My criteria is clean, safe. friendly and economical. I have found this little hotel a great value for the money. My room has always been clean and adequate...not fancy, but not shabby either. Last year was the third time I stayed there and I will take my granddaugter to London in 07 and hope to stay there again. The staff is wonderfully helpful and knowledgeable with any questions about London, getting around etc. I was going to tube it to the airport when they informed me I could cab it for less money (not to mention the hassel!) The first time I stayed was 20 years ago and I must say it has not had much updating since then but the price has not wildly increased either.Great restaurants nearby, felt very safe even as a woman alone in early evening, close to tube and shopping. The breakfast was very good each time I was there, lots of choice and well-prepared. Met interesting people who also choose this little oasis away from home over and over as I do. I've read the bedbug comments and am sure if some tourist brought bugs to the hotel they have rectified the problem. You can't search people as they enter and it can happen to any hotel. Could the carpet use a cleaning? Yes as in most places, but the beds are VERY clean. As for carrying luggage up steps...that is nothing unusual in small hotels in Europe. These are OLD buildings, many are converted homes. If you are looking for elegance and pampering....spend another 100 pounds and go elsewhere....if you are looking for clean, adequate, friendly, safe, Edward Lear is a good value."
66,714,"Jul 20 2005 	Don't believe the bad stuff	I lived at the Ed Lear Hotel for TWO months, due to an unfortunate incident at the flat I was supposed to live in. They gave me an excellent price per night. My room was always clean and bed was always made. I never saw and bugs at all in my room, and I have never even seen a fly come into my room. Being as though the hotel is in an old home, there is no elevator, but I managed to climb to the top floor for my stay there. For the price of this hotel and the location it is at, it is the best. My first week in London I stayed at a four star hotel that was less than four star in my opinion and ridiculously overpriced. The TV is small, but why go to London if you are going to watch TV all the time. The food was okay, and they always allowed me to take ceral up to my room, as much as I wanted. The showers are fine. The toliets are fine. The hotel smelled of cigarettes on the first floor, but people do smoke over here. The internet access was fine, and being as though it was free I wasn't going to comlain about the speed. I never had a problem with hot and cold water, since it isn't too hard to figure out what was hot and what was cold. The location is amazing, and for the price (I only had to pay 33 a night) I think the value is amazing."
67,714,"Jul 18 2005	Charming and affordable	This hotel was one of the few we could find with a central location, a private bath, and less than 100 pounds in July. We were quite happy there, but it isn't for everyone.Good points-Very helpful and friendly desk staff. Decent size room, clean, nice long tub. We asked for a quiet location and that is what we got- a room facing a side street so we could sleep with windows open. About 3 blocks to the tube or bus stops (Marble Arch). Neighborhood feels safe- I could walk to parks and tree-lined streets, also close to shopping/ restaurants. Huge and tasty breakfast included. Free internet (15 minute limit, slow connection, so don't count on doing much more than quick emails).Bad points-Lumpy bed. Bath and walls show age (cracks, etc.- part of the character, nothing functional). Steep stairs.Conclusion-If you don't mind a hotel that shows its age a bit, this is a very good value. If you prefer modern and sleek, you won't like it."
