IDREVIEW,HOTELID,REVIEW
214,2174,Nov 29 2007 	A great place to stay !!!!	My husband and I just came back from vacation in San Francisco . Nov 21-26!We stayed at the Fairmont San Francisco after finding a great deal on line for their 100th anniversary. We loved this hotel. The service was excellent. Upon arrival we were greeted by a wonderful front desk staff member named Jon. He was so nice and so accommodating. He truly made a great first impression for our arrival!!!The hotel room had a wonderful view of the bay. It was big room with lots of space and a great t.v! Couldn't have asked for a better room. Staying on top of Nob hill at first didn't seem like the best idea. The first night we struggled to walk up the enormous hills ( I am 7 mnths pregnant) but the very next day we went across the street to the next hotel gift shop where they sold 3 day passes for the cable cars. This was one of the best investments. Once riding the Cable cars everywhere we soon reliazed how much we loved the location of the Fairmont. It is much quieter and more romantic than staying down in union square and you are just a quick cable ride away from all the attraction. So if you are there for a few days I strongly recommend using the cable cars and buying the pass. Another tip---We were thirsty all the time . The stocked bar in your room is pretty pricey. So we would buy bottle water from the vending machine for only a $1 oppose to the 4.50 at the hotel from the parkade across the street!. Overall the Fairmont has exceptional service. Great Rooms and a quiet nice location. I loved this hotel and I loved our visit to San Francisco.
215,2174,"Nov 26 2007 	Did not enjoy the Fairmont	Just returned from a weekend in SF. The hotel was beautiful and the staff was great. However, all was ruined by the paper thin walls. To anyone thinking they are getting a great deal with this hotel, think again. You can hear everything in the rooms beside you. We stayed on the older part of the hotel, not the tower. We had to change rooms at midnight the first night there. We were in rooms that had adjoining doors. NOT A GOOD IDEA! The hotel moved us to another room without an adjoining door, but the noise was just as loud. We were tempted to change again but decided to tough it out. Our neighbors were not overly loud, but we could hear all the coughing, conversations, and television. The hotel was extremely classic, but I would not advise anyone to stay there. Walk in and take pictures because the quietest place in the hotel was the lobby.If anyone is not sure where to stay, look for hotels in the Union Square area. All the shopping and restaurant choices are located there.Good luck!"
216,2174,"Nov 11 2007 	Forgettable Grande Dame	It's obviously a San Francisco institution. The history of the hotel is hard to beat -- and you are reminded of that wherever you turn. But beyond the lore, it just wasn't memorable.We went to celebrate our anniversary and were happily upgraded to a room in the original part of the hotel. The room itself was huge and had a nice view of the Bay, but the sparse furniture made it feel too spacious and unwelcoming. We joked that the closet was bigger than the kitchens in our first apartments. But why? The Tonga Room didn't feel throwback kitsch; it felt like it was tourist optimized -- like a chain theme restaurant. The bar downstairs had no sense of character or intimacy. A kind of bar that keeps its television tuned to the football game that no one seems to be watching.At $300 for a weekend night, and touting itself as the flagship property for Fairmont, I was expecting more. Truth is the hotel is any well-run Hilton stuffed into a gilded box."
217,2174,"Oct 30 2007 	Gorgeous Hotel Great Service	Positives: The Fairmont is an absolutely gorgeous hotel with great customer service. My room, had a comfortable king size bed, a huge flat screen tv, a solid wood desk with a leather swivel chair, a marble counter top and marble tile in the bathroom and an impeded room was quite large and also featured a large walk in closet. I but decent view from a large window. (I was on the 5th floor). The received excellent, friendly customer service from every employee that I passed or encountered from bellhops to front desk clerks to waiters. Free Wall Street Journals, NY Times, and Financial Times available.Negatives: Gym access is $15 per day. High speed Internet access is $13 per day.The Fairmont is located at the very top of Nob Hill (directly across the street from the Intercontinental Mark Hopkins Hotel) which means that if you walk anywhere from the hotel, your walk back will be a very strenuous uphill hike. Believe me, the hill is extremely steep. So unless you're in good shape, you'll probably want to take the trolley or a cab home. The trolley runs right in front of the hotel.I definitely recommend this hotel and I would definitely stay here again."
218,2174,"Oct 18 2007	Very disappointed with this ""luxury"" hotel	I always dreamed about staying at the Fairmont, so I had high expectations. In reality the airport hotel we stayed at the night before we left SF impressed me more (and I expected less).I checked in and was told I have a room with a view of the buildings around me. I told the desk clerk that it was our wedding anniversary and she offered me an upgraded room - for an additional $60 or a less nice upgrade for $40. That really turned me off - I was already paying a ridiculous amount and if they have the room available why wouldn't they just upgrade me? Particularly since I'm a President's Club member at the Fairmont.Then she said she'd &quot;send something to my room&quot;. Nice touch, right? Nothing was ever sent - which is fine, but don't tease me.When I arrived in my room (actually a decent mini-suite) on the top floor of the old part of the hotel - there was was abosolutely no view - just decorations outside the window that prevented a view of the nearby buildings or the street.. The lobby is lovely, and the bartenders in the lobby bar were nice. The gym was crowded and nothing special. The Tonga Room restaurant was closed for a private party and we had a goof up with the Hertz counter in the hotel. Overall, nothing seemed to go quite right.We had a nice anniversary, but it would have been just as nice elsewhere."
219,2174,"Oct 16 2007 	OK But Don't Overpay	I stayed at the Fairmont San Francisco the nights of October 9-11 while attending a conference at another hotel. I really enjoy the Nob Hill location and thought I would try the Fairmont as an alternative to my usual San Francisco lodging, the Mark Hopkins Interncontinental across the street. The rate at the Fairmont was approximately $60 less per night than the Mark Hopkins. I booked a king bed, non-smoking room in the main building directly through the Fairmont website.I arrived at the Fairmont in the late evening hours and check-in was a breeze. I am a member of Farimont's President's Club and was upgraded to a room with a nice view of downtown San Francisco. The bellman was very pleasant. As I got settled in my room, I called room service and ordered a shrimp caesar salad. My order arrived in good time, however the salad was rather disappointing as the salad dressing was quite overpowering. Disappointing, but not the end of the world. Being a hungry traveler, I was happy to have the salad nonetheless and finished it in short order.My room was clean and housekeeping did a fine job throughout my stay. The bed was fine and was stocked with plenty of comfortable pillows. The downside to the room, however, was (and this is my pet peeve) opening the doors to the lovely entertainment center and finding a rather smallish $199 Zenith tube television. This is 2007 guys, it's time to lose the Wal-Mart special and bring in the flat panel television. Again, disappointing, but not the end of the world.I did not use the hotel health club facilities or any of the other hotel dining options during my stay.The locaton of the hotel is a real plus, especially if you plan to travel using the cable cars, as I did. I bought a three-day MUNI pass at the airport for $18 and had unlimited access during my stay. Two cable car lines intersect at the corner California and Powell streets, right at the hotel. The hotel and my other destinations were on or near the cable car lines so this worked well for me.Even after the fairly recent renovation of the hotel, the Fairmont still seemed a little tired around the edges to me. As with the Mark Hopkins next door, there is a fine line between historic and just plain old. These two hotels both border closely to side of old and at times cross the line. Although my room at the Fairmont was larger than rooms I've had at the Mark Hopkins, my primary decision factor between the two would be price. All things considered, I saw no tangible advantage to one over the other.All in all, a generally positive stay at the Fairmont but I would consider returning only if I was able to get an comparatively attractive room rate."
220,2174,"Oct 3 2007 	Great stay but expensive	I recently stayed at the Fairmont during a conference. The public areas are beautiful. The rooms are nice; bathroom is small but well maintained. I was lucky and got a high floor room with a view of the financial district, Golden Gate, and the bay - beautiful! Hotel staff were friendly and helpful. The location is great - 3 blocks from China town, brief cable car ride to the Wharf, and on the main bus route. I'd stay here again in a heart beat if someone else pays. The discounted conference room rate was $250. San Francisco is gorgeous! Extra tip: Join Fairmont's frequent guest program and you won't be charged for high speed Internet; otherwise, it's $14 per day. Also, if you're visiting for a few days, buy a muni pass. Two day pass costs $11 and is good for all street cars and buses. Otherwise, each street car ride is $5. Consider visiting the Palace of the Legion of Honor. It's about a 30 minute bus ride and a short hike up a hill, but is very easy to find and get to. It's on the bay with a beautiful view and has an excellent collection of Rodin sculptures, including the Thinker. The muni pass will also get you a small discount on admission."
221,2174,Oct 3 2007	This hotel rocks!	My boss took our whole staff for a conference and we LOVED this hotel....exactly what you would envision for San Fran...right in the heart of everything.....ornate and romantic...almost straight out of a movie. Very upscale and large rooms....this hotel was one of the cleanest I had ever been to.The staff was so nice and upgraded us to a better room with panoramic views of the city. The Tonga room was a fun atmosphere with great drinks and great food.This hotel reminded me of a Vegas Hotel cause it was so large in scale and had everything you could need inside it...restaraunts...coffee bar...shops...You can't miss going here if you want to experience San Fran in style.
222,2174,"Sep 30 2007 	Wonderful views and great service	My husband and I stayed for 5 nights at the beginning of Sept 07. We were fortunate enough to have a voucher which entitled us to an upgrade to a suite which we were very happy about. We stayed in the Bangkok Suite which was a real joy, we had lots of space as well as a great balcony to enjoy.We found the service at the hotel to be exceptional and we had room service several times for evening meals as well as breakfasts, all very good with quick service. We found the room service useful as we were often exhausted in the evenings after a full day of sight seeing.We would love to come back again and stay at this hotel, it's in a great location and there is so much to see and do around San Francisco."
223,2174,"Sep 28 2007 	Fabulous Stay in San Francisco	Spent 2 nights recently at the Fairmont in San Francisco. We are members of the Disney Vacation Club and stayed here through an exchange.This was our first trip to SF, so we can't compare this to other hotels, but we enjoyed our stay. We had a deluxe room in the tower with a city view. We were only on the 2nd floor, so we did not have views of the bay. However, our view included the lovely rooftop garden.The room was large with a King-sized bed and high quality furnishings. One bedside table had obviously been damaged and the top needed to be refinished. However, in the scope of things, this was a minor point.The bathroom was large with a separate tub and glass-enclosed shower. There was only a single sink. When checking in, there was a long line. However, as a member of the Fairmont President's Club, we went to that desk and complete check-in promptly.The lobby and common areas are breathtaking. It was fun to read the historic posters and photos lining the hallways. We did not dine in any of the restaurants, but we did have a fruity drink in the Tonga room and listened to the live band floating on the stage. It was fun in a corny sort of way.The location at the top of Nob Hill is fairly convenient. We walked most places and took a cable car when we returned to climb the hill. The valet parking is incredibly expensive at $51.30 per night, but a necessary evil in the city. We also were disappointed there was no coffee maker and just couldn't bring ourselves to pay nearly $20 for a pot of room service coffee !!Overall, it was a very nice hotel. However, since we spent so little time in the hotel, I would not pay over $350 per night to stay again."
224,2174,"Sep 23 2007 	Grand Hotel bit a bit of a disappointment	We have just returned from an around the world trip from Australia, stayed in same standard all the way but standards differed considerably Fairmont San Fran was lacking by comparison. No mention of our Wedding Anniversary, torn bottom sheet on our bed and when room service bought breakfast up the pots of jam had already been opened and used by somebody previously. I did go down the following day and report all this as it was one hotel we really were excited about, but there did not seem to be too much concern from staff. A shame because its the only one from our trip we would not return to next time, lacked special touches, also beds need upgrading. We paid for a Signature room and the view of the bay was spectacular"
225,2174,"Sep 22 2007 	Grand hotel and great location	My wife and I, along with another couple, stayed here for 3 nights on a west coast getaway. We got excellent rates, and aside from the front desk asking us if we wanted to upgrade to an exterior room (vs. courtyard view), we were treated very well by all the staff. Outstanding lobby and huge hallways, the rooms were good sized with all the basics (and a large closet). We did not eat in the hotel, too many other places in the city, but did have drinks in the hotel bar - very nice. Centrally located with an excellent view, would definitely stay her again."
226,2174,"Sep 21 2007 	didn't come close to expectations	This is a hotel with a history - and is very grand inside, but really takes itself too seriously and comes over as rather stuffy. Breakfast was good when taken in the restaurant, but with room service it was often cold. The desk staff were fairly offhand, and offers of help appeared only with much asking. In particular, watching a visitor with a wheelchair struggle and not be offered help by staff was possibly less than optimal. It is, however, a hotel with history and I am glad I visited for that reason - but am not sure I would go back again."
227,2174,"Sep 18 2007 	Unfortunately just mediocre this time	I was really looking forward to my stay but ended up quite underwhelmed. I'm actually writing this from the hotel, where I'm attending a conference. For $250/night, I would expect a room with a coffeemaker at the least, and enough space to move around without bumping into things. Although the closet is huge, the bathroom is very tiny with literally no counter space. The bedroom is like an obstacle course, with the TV positioned to the side of the bed, forcing you to view it by craning your neck to the left. The only window in the room looks across at an inner courtyard of the hotel where the ventilation system is located (i.e., not in the least bit scenic, and the drapes have to be kept closed most of the time since it faces other rooms.) The woman at the front desk during check-in asked whether I preferred a high or low floor and then put me on the second floor. I also asked to be located away from the elevator so she put me directly across from one. (All I can figure is that she was having a very bad day, but she made a horrible first impression for the hotel. She wasn't in the least bit pleasant.) The toiletries in the bathroom were good quality but It seemed that toilet paper was being rationed as I had to ask for an extra roll. I also didn't receive my copy of the Sunday Times on Sunday. Normally this kind of stuff would be overlooked by me, but it all started adding up to a not entirely pleasant stay. The bed comfort was acceptable but not the best.The hotel is within walking distance to Union Square, but keep in mind that it's uphill the whole way back if you walk. The prices in the hotel (from the mini-bar to room service to the restaurants) are all high, so it's worthwhile to check out the groceries and cafes nearby.Since I'm a President's Club member, the fitness center and internet were free of charge, so those were positives. The hotel is very ornate and interesting from a historical perspective and everything is well kept. From what I've heard, I'd ask for a room in the tower vs. in the main building where I stayed. Bottom line: I wouldn't stay here if I were paying the bill unless I got a much nicer room for the price."
228,2174,"Sep 10 2007 	The Fairmont atop Nob Hill	The Fairmont San Francisco is conveniently located atop Nob Hill. It has 2 buildings. The Main Historical Building and the Tower building of 25 floors. Room Accommodations - Deluxe King NS: 5 out of 5 ratingThe view from the Tower building over looks the entire Bay Area. Alcatraz Island is right in front of your eyes with the Bay Bridge to your right. GORGEOUS VIEW! I never closed the blinds the entire trip! Day or night, the view is a site to watch! Restaurants: 3 out of 5 ratingEvery Friday between 5-8pm, they have a night of &quot;Sushi Friday' at The Laurel Court Restaurant &amp; Bar. The sushi was alright to my standards, nothing to brag about. They also have another restaurant with music and a dance floor called &quot;The Tonga Room.&quot; Stopped by to have a drink on a Friday night and there was a good crowd, however, I did not stay for more than 20 minutes as it was a much older crowd for what I was looking for.In-Room Dining: 5 out of 5 ratingGreat service! Victor was my attendant for the first few days and he was excellent! Great food consistency. Breakfast was wonderful. Ordered buttermilk pancakes &amp; bagels. I did find $7.00 for a toasted bagel to be just a bit too pricey as it did taste like any other bagel, but its IRD at a Fine hotel and its expected. Hamburger &amp; penne alredo pasta are excellent. Great quality food products.Housekeeping: 3 out of 5 ratingRoom was serviced consistently on a daily basis, however, I did not receive turn down service as it is something i believe that needs to be requested. I found that to be a bit strange.Spa &amp; Fitness Center: 2 out of 5 ratingHad a 60 minute deep tissue massage. It was not as good as I expected. This Fairmont is lacking their branded &quot;Willow Stream Spa.&quot; It is still being outsourced by a fitness center called &quot;One&quot;"
229,2174,"Aug 28 2007 	Nice Time at the Fairmont	The PackageJust returned from a 2-night stay at the Fairmont San Francisco. Booked the 'Centennial Package' by contacting the hotel directly. The rate was $359.50 per night but included a $100 food &amp; beverage credit, a commemorative hard-cover book highlighting the property's 100-year history, a bottle of champagne &amp; two commemorative toasting glasses. With tax, the 2 night stay was $815.31.The HotelWe stayed on the 19th floor of the recently constructed 'tower'. The view from the room was very nice. The room was not overly large although the bathroom was quite large and nicely appointed with a separate toilet area, separate tub &amp; separate shower. The hotel is very clean with very comfortable beds, nice sheets &amp; pillows. The Fairmont is a beautiful property with a classicly elegant lobby. Check in was extremely smooth. Check out was somewhat delayed as the clerk had trouble applying the $100 food &amp; beverage credit from our package but eventually got it right. The roof top garden was nice (we enjoyed our champagne on the roof). The dining room was nice but pricey (breakfast was $51). Service was fine. We never made it to the Tonga Room but it looked like fun. Parking is pricey ($50 for 24 hours) so we decided to park around the corner for $27 per 24 hours - you're in a major metropolitan area so expect to pay for parking. Rates will be lower on weekends.The ConciergeWe were celebrating our 10-year anniversary and were looking for a restaurant with a view. We asked for a reservation at &quot;Top of the Mark&quot; right across the street at the Intercontinental but the concierge suggested Julius' Castle. The cab ride was an uneventful $5.80 from the hotel but on the way home, the restaurant mentioned cabs were a problem. They called us a Town Car and mentioned it would be $15. Upon arriving on the Fairmont, the driver insisted on $20 - quite a &quot;Mark-up&quot; over the original cab fare and the 'free' walk across to &quot;Top of the Mark&quot;. Restaurant is average with a decent wine list. The outstanding dish was the Osso Bucco. The Steak au Poivre was fair (I've had better). Overall, happy we were assisted with a last-minute reservation on our anniversary and the restaurant served its purpose. The next night we inquired about a close-by restaurant for sushi and the concierge reluctantly suggested one within walking distance. The fare was fine and it met our needs.LocationGreat, great, great location. Walking distance to 3 trolley lines. Close to everything. Very nice area (I never realized how HILLY San Francisco is but it was fun).ValueGreat hotel but expect to pay big city prices... having come from NY, I wasn't blown away by the price - this is typically what you'll pay for a hotel of this caliber in a large US city. Insider TipsIf you're exploring the city, buy the full day transit pass ($11 or so) but worth it. Its fun to ride the trolleys and buses around the city.We kept our car rental in the city despite the high parking fees. We were happy to be able to drive to Golden Gate Park, up to Twin Peaks, etc. Cabs are not cheap so we were glad we had the car to explore outside the reaches of the transit system.Bring something warm for evenings / mornings. Even in August, the morning / evening weather can be cool."
230,2174,"Aug 28 2007 	San Francisco's Finest	This is one of the best hotels in San Franciso that I have stayed in. The lobby is gorgeous, the rooms are luxurious (ask for a high floor! The view is awesome), and the service is great. Brunch at the restaurant was one of the best. 10 minute walk to the bart."
231,2174,"Aug 28 2007 	lovely hotel	Lovely Hotel . Everything one expects from the Fairmont chain. Nice bars and lovely food. Weird coffee shop in the basement,in that its so basic and cash only. Great Kashmiri marketand general gift shop. Beautiful location in really beautiful city. Had good area advice from young restaurant manager who was very sweet and took time to invest in the guest. One issue..dont ask Concierge for Chinese food reccomendations. We were sent to the worst place in San Fransisco and the food in the city is fantastic. Trust your guide book! Overall worth every cent. Thank you Fairmont."
232,2174,"Aug 28 2007	A Great San Fran Hotel!	My wife and I stayed at the Fairmont SF in August 07.When we arrived we were asked if we would like to upgrade for a small fee. ($50.00 more per night) $250.00 per night total) I thought that I had heard that story before but decided to do the upgrade. WOW! What a great room with a view of the Coit Tower, Alcatraz, Angel Island, beautiful roof tops, and blue sky and the beautiful bay.The food prices are steep here. We did eat at other great more reasonably priced places. The Tonga room two floors down was fun at Happy Hour! The service was very good. Several people with attitudes but overall very nice people were found here.This is one classy place to stay and we were glad we picked the Fairmont SF.We checked out the Union Square area and found it was great for people watching and shopping but we preferred our Nob Hill more private location."
233,2174,"Aug 27 2007 	Lovely historic hotel on top of Nob Hill	The lobby and overall setting is luxurious. The rooms in the tower are modern, of adequate size, offer great views of the city, and have large bathrooms with beautiful tiles. In the bathroom, there is a shower and regular-sized bathtub. The bedding is quite comfortable. There is a gym, but it is not free, so I never used it. One drawback for some might be that it is located on top of Nob Hill, so if you need to go to the Convention Center, Fisherman's Wharf, or other tourist spot, you must be in some shape to walk. The hills are unbelievably steep. You can catch a trolley or cab outside of the hotel though."
