IDREVIEW,HOTELID,REVIEW
41,1038,"Jun 30 2009 	great location friendly staff	I have now stayed at this hotel three times in the last two years. My first visit was for a competition I had won with Aussie Hair Care to stay the night and although I had not stayed before, me and my partner had decided to stay an extra night as we felt it would have been a wasted journey otherwise. When we arrived at the hotel I couldn't believe how nice it actually was and looks exactly as it did on their website. Each time that we have stayed the reception staff have always been friendly and booked us in promptly. If the room wasn't ready when we got there, we were able to keep our baggage with the concierge who was very helpful. The rooms are lovely and beds are extremely comfy, and after a long journey on the train, they are good to have a quick nap on before having a wonder round to see the sights. We have been on the London Eye twice whilst staying in London as its approximately 10 minutes walk, and a lovely walk it is too. You get to walk right opposite the houses of parliament and Big Ben and you can take some great photographs. You are also in walking distance of trafalgar square, covent garden and leicester square. You are close to a bus route too which will get you to these places if you don't really like to walk, but as we have stayed in the summer 2/3 times, the walk has been great. There is an amusement arcade, mcdonalds and the aquarium right near the london eye. I would definately recommend this hotel for your stay."
42,1038,Jun 22 2009 	Watch the 'river view' promise	Quite a good hotel with great facilities and super 'executive' package - great breakfast in 'private' club room.The big disappointment was that our 'Special Requirement' of a river view room was totally ignored and changed to 'if available' - that certainly wasn't the consumer expectation - it's this hotel's big differentiator - get them to commit - else don't stay there.
43,1038,Jun 20 2009 	grossly expensive.. tiniest possible rooms	leave aside its name.. its grand lobby area.. and the restaurant.. enter the room n u wl cry ur heart out wondering u have entered a 5 star room or just your regular tiny london hotel room.. like i said.. other than the room everything else is magnifique but then dont we spend most of the time in the room once inside the hotel.. rooms are really nothing much to write home about.. if one has to stay in a tiny room then why pay sooooo much.. better to stay in a 70 GBP room only rather than a 150 GBP one then.. it surely has it pros like its great location with big ben n london eye within 5-10 mnts walking distance... but being the prudent traveller i am.. i would rather recommend a cheaper hotel.. like the local UK brands and not the international ones like this.. 70 GBP for a similar kinda room is what i feel i would pay.. so next time when i was in London.. i stayed in a 70 GBP one for which i am posting a review too... n ws equally satisfied.. extra 70-80 pounds that i paid for this didnt gave me real value.. go for it if you are one of those ' i stay only in 5 stars guy' else move to a cheaper one..
44,1038,"Jun 19 2009 	great hotel fantastic location	the place to stay in London ! across the river from the parlament &amp;view of BIG BEN !!! London eye in walking distance,and so is the imperial war museum &amp;Tate Britain .Did I mentioned the price? 80 euro/room .b y all means ,go there !"
45,1038,"Jun 16 2009 	First Class	Stayed at the Park Plaza on business last week and my first impression was &quot;WOW&quot; I must be in the wrong hotel............knowing the prices of central London hotels and the budget allowance my company allocates, I was sure there had been a mistake!!!But on checking my booking with reception they confirmed I was in the right place!!!!Check in was swift and my room was ready although I was 2 hours earlier than the advertised arrival time.The room was fabulous all dark wood and clean white linen and the bathroom was to die for.The bedroom and bathroom were spotless and the bed was very comfortable.Unfortunately I had a view of a railway line but not a big issue and reasonable double glazing meant I was not disturbed by train noise.My toilet broke, late on the first night of my stay ,but with in 10 mins of reporting the fault a member of staff appeared to fix it. When it couldn't be fixed immediately they offered me an alternative room and moved me with no fuss and lots of apologies. The hotel was conveniently located for me to attend all of my business meetings in the Milbank area, about a 10 minute stroll over Lambeth Bridge, and would be well situated for sight seeing around the Westminster Area for tourists.Breakfasts were good, a self serve buffet of cooked food, including vegetarian options, and a variety of fruits, juices, pastries and cereals. Tea and coffee were served at your table.Overall a first class hotel, with helpful, professional staff and a good London location."
46,1038,"Jun 16 2009 	Hard to beat	Booked through Last Minute.com which, after hours of trawling the net, offered the best price. Rooms were very clean if a little small - but no smaller than you would expect for London if I am being honest. Nice to have a big/deep bath in a spotlessly clean bathroom. Location was good and only a fifteen minute walk to Trafalgar Square. Staff were very good and if I had to gripe about something it would have to be that the bar area was very, very busy in the evenings. Think a lot of people come to eat in the restaurant (which gets extremely crowded at weekends so you need to book even if staying in the hotel). The breakfast (which was definitely the most expensive I have ever eaten) was excellent. If I managed to get another good rate I would go back for sure."
47,1038,"Jun 12 2009 	first class	great hotel,clean,friendly staff,walking distance to main attractions eg trafalgar square,westminster abbey,big ben ect,good breakfast,large rooms.beautiful view house parliament on river thames,quite rooms.good internet/business service,coffee machine and washing machine in room(apartment)restaurant and bar on site"
48,1038,"Jun 3 2009 	Great location and staff are brilliant	stayed here on business since Nov08 to May09 and the staff are great, they make your stay really welcome.The hotel is next to Lambeth Bridge, the one next to Westminster bridge so it's far enough away from Leicester Square / Soho etc, but close enough to walk to it within 15/20 mins. The walk is good anyway as you pass the London Eye, Parliament, Big Ben, Whitehall, Trafalgar Sq etcThe rooms are of a normal size, and beds are really comfortable, as well as the bathroom has bath and seperate shower (very modern)"
49,1038,"Jun 2 2009 	Loved the view towards river Thames	I was on a business trip to London and I stayed for about 50 days at the Park Plaza Riverbank. Mine was a room with a window facing towards River Thames and a clear glimpse of the BIG BEN!! It was so amazing to take a walk at evening along the bank of the river!The room services were extremely efficient and the ambiance was very attractive. Also the lounge experience was fantastic.In terms of connectivity to the nearest tube stations, a bus stop is just outside the main entrance of the hotel. Waterloo station is about 15 mins by bus.Talking of local attractions, London Eye and Big Ben are about 10 minutes walk from the hotel. It was my first visit to London and it would have been a very different experience if I had not stayed in Park Plaza. One of the closest memories that I am going to cherish all my life."
50,1038,"May 26 2009 	The Air conditioning did not work	My wife and I and friends stayed in a so called Superior Room BB on Saturday 24 th May 2009. This room was advertised as having Air conditioning this is the room specification:-This room has 1 double bed or 2 single beds and accommodates 2 persons.These are beautifully designed bedrooms, complete with bespoke furniture; queen sized double / twin bed, plasma screen TV and CD/DVD player, two direct dial telephones, coffee/tea maker, desk and mini bar.All bedrooms are fully air conditioning and offer direct modem link, an iron and ironing board hairdryer and in-room safe. A spacious bathroom offers a separate bath tub and shower.Room facilities: Additional beds upon request, Air-conditioning, Baby cot, Bath, Coffee/Tea Maker, Connecting room, DVD player, Facilities for disabled people, Hairdryer, Heating, Interactive TV, Iron and ironing board, LCD flat screen TV, Maid service, Mini-bar, Non-smoking rooms upon request, Pay-TV, Room Service, Room with view upon request, Safe box, Satellite TV, Shower, Smoke detectors, Smoking Room, Telephone, Telephone in bathroom, Television, Wake-up calls, WiFi Internet connection, Wired Internet, Working Desk, ToiletThe Air conditioning did not work. When we enquired at the reception, the answer was it is still in heating / winter mode. It was 25o C on Saturday and the room was very hotAir conditioning is what is says and should be available 265 days a year or they should say it is not In fact we did intend to stay for 2 nights but checked out after 1.This is not a 4 star hotel in our opinion We would not go back or sample any in the Park Plaza chain in London"
51,1038,"May 18 2009 	great weekend	Hotel and staff really nice,made my first time in london extra special."
52,1038,"May 18 2009 	Good location for a Weekend stay	We stayed at the hotel for one night on 16th May 2009. We haid paid for the upgrade to an executive room for an extra 30. I would say that it was worth the money, but only just. You are promised fruit on arrival, a robe, slippers and a choice of pillow. In reality the fruit was an orange, an apple and a plum. We only had one robe, one pair of slippers and when we ordered a luxury pillow we were told that they did not have any!! Be careful as they promise free internet, but this is not through the TV in room you have to bring your own laptop. The room was very clean with nice fixtures and fittings. It had a great bathroom and a decent sized flatscreen. The use of the executive suite was also part of the package which provided free drinks between 6.30 and 8.30pm. This was a quiet bar on the 11th floor and was ideal to sit and enjoy a few drinks before going out. We also had breakfast in the Chino Latino restaurant which was nice as you did not have to queue. The breakfast was of a good standard although it was self service. The major problem for us was the temperature in the room. It was very warm. We were told that the air conditioning units had not been turned on so I hope they sort this soon. I would reccomend this hotel as our overall experience was good. The location is excellent as within a ten minute walk you are at the London Eye."
53,1038,May 14 2009 	Worst reception staff ever!!!	NOT RECOMMENDED FOR BUSINESS PEOPLE AT ALL. SLOWEST CHECKIN i have ever had. When i arrived to the hotel just after 2.30 pm I was told by the receptionist in a rude german accent that room is not ready and leave your luggage at concierge and come back later or we will call you if you want when your room is ready. I mean what the hell??? why are you advertising 2pm checkin then ???I was helpless and had to attend a meeting so had to go. When i finally came back at 5 pm to checkin at the desk another snobbish german receptionist told me that my handwriting was bad and tore the registration form and gave me a new one and asked to fill it again neatly. i mean rediculous when i asked why did she tear away the form i had already signed she mentioned that it is as per our manager we need to make sure that all forms are filled clearly in a good handwriting. I was like is this receptionst about to teach me calligraphy or is behaving like my school teacher teaching me to write clearly??? not acceptable at all. And then the next thing i was asked to fill in was my email address as a mandatory requirement apparently as per the manager to checkin. to what i said i dont have one just to avoid those junk mails these guys send as promotional marketing and i was told its not possible you dont have one?i can just go on and on anyway this was just the beginning of my stay so dont even ask about the rest and on the checkout i was not even asked how my stay was or any thing no basic manners at all and no customer service. the whole staff there including the manager needs to learn some english hospitality and culture and a thorough customer service training. not recommended!!!!
54,1038,"Apr 29 2009 	We'd stay here again	Nice rooms, nice restaurant (kind of an Asian fusion), pretty good location on the riverbank at the Thames. You can walk if the weather permits to Buckingham Palace, and Piccadilly Circus. If you buy their exclusive premium (whatever it's called) the breakfast is pretty good and the evening beer/wine/snacks are too, I'd recommend it if it's in your budget.The service at the lounge can be a bit spotty (and I'm probably being kind). Also, they've got a little cafe in the basement with hours that didn't really make sense to me.Lots of jazz/smooth music throughout the lobby and restaurant/lounge which I like. There's one computer for internet in the lobby, kind of hidden close to the elevators which came in handy.Hey, I'd stay here again!"
55,1038,"Apr 27 2009 	The usual good Park Plaza standards	After arriving back into the the UK from a trip in Paris we opted to stay in london for one night. We book the hotel through there own website was a bit more expensive but i was short on time on the internet access in Paris. We got a good rate for a no cancelation fee. of 130 for one night, for a 4 star slap bang on the thames i didn't think seemed to bad. On arrival at St Pancras station we got the tube to the closest station it said on there website, Vauxhall station, 10minutes walk which isn't bad but we had a lot of cases and seemed an eternity till we arrived. When we arrived at the hotel our bags were taken when checking in which then i was charged for my room not when i booked it like i thought, no worries but it didn't state that.We had been upgraded to a River view room, same room as we book but just with a view. The room was very spacious, Clean and well maintained.The Views it offered were excellent even though it was lashing it down outside.The bathroom was Massive, Bath and a shower.The extra you get from these rooms are as follows (off there official website) :-Executive Rooms with river view and Suites at our London lodging feature the following additional amenities:Bose CD/DVD playerComplimentary morning newspaperExclusive access to the Executive LoungeFruit and water on arrival Luxury bathrobe and slippersOne hour complimentary in-room Internet accessPlasma screen TV with surround soundTwo telephonesUpgraded bathroom amenitiesYour choice of pillowWhich was a definite plus as it was free.It was a bit of a walk (15-20minutes) up to the London eye but that was only thing that i could find fault with.I didn't get to try the restaurant that was located in the hotel so i can't really comment.Would i return....??For a one night break in london defiantly. For a longer stay in london, if i got a good deal i would."
56,1038,Apr 23 2009 	Excellent location!	The first thing that strikes you is the location of the hotel..It is on the Albert embankment on Thames just across the westminster parliament.. Also a stone's throw from London eye and waterloo stationTry getting the rooms that are facing the riverOne thing in which the hotel can be better is in internet access. There is NO free internet. This can turn off business usersBut overall a nice place to be!
57,1038,"Apr 21 2009 	the best week end away ever	Stayed in this fab hotel for two nights ,as our son was taking part in changing of the guard at buckingham palace..Prime location to all tourist spots.We took a taxi to oxford st, and walked very easily to regent st, leicester square,picadilly circus,trafalgar square, whitehall,parliament st, and westminster,then we walked along waterloo pier where the london eye is and there was an array of street performers and buzzing with tourists etc,loved it ,by10 o clock we walked back to hotel amazed at what we d covered in 1 day!! get a map from reception ,as we did ,theyre free too ! this is a must to getting around yourself and an experience we ll never forget.theres a mini supermarket right next to the hotel for any essentials also,taxi fares can be cheaper than tube as we found out,and quicker.Going back home the victoria line was out of use ,so get a bus from vauxhall to victoria station then tube on the circle line ,which takes about 15 to 20 mins to kings cross."
58,1038,Apr 14 2009 	Huge wonderful rooms! Great location!	This was a great hotel! The staff was wonderful and very helpful. The location is hard to beat...right across the river from Westminster and Big Ben! The rooms were very clean and comfortable. Only draw back was it's about a 10 min walk to an Underground station.
59,1038,"Apr 14 2009 	An affordable modern Park Plaza but a little out of the way	For those of us who live in Euroland, London is as cheap as it has ever been. Now's the time to go! When booking, I was delighted to find a truly affordable room at the Park Plaza Riverbank. To me, &quot;Park Plaza&quot; has always been an upscale brand. And this would be my first experience with this chain. I suppose my impression of this hotel is based somewhat on the expectation that we would be getting a luxury experience.The hotel is located just south of Lambeth Bridge and Lambeth Palace, on the south side of the Thames. The hotel is on a nondescript stretch of Albert Embankment lying between Lambeth and Vauxhall. The hotel is sandwiched between the Thames and the wide multiple-track railway line leading into Waterloo. Vauxhall tube station is about a 5-10 minute walk south. Going north it takes about 10-15 minutes to walk to Westminster Bridge (London Eye, Parliament, etc.). The closest tube station up this way is Waterloo. Vauxhall is the closest tube stop. It's walkable for most people with moderately light bags.The hotel makes a nice first impression, as you might expect from a Park Plaza. Intriguing art in the lobby. The reception was efficient enough. This is a modern, well furnished hotel of about 10 storeys. The room we got was modern, upscale and very clean, but not a &quot;wow&quot; kind of room. Flatscreen TV. Lots of closet space. The designer bathroom with black tiles was spacious and modern. Here was a bit of luxury.This hotel is roughly in the shape of a hollow hexagon. Of the six sides, it seems that only one or two sides face NW toward Parliament and have the spectacular views of Parliament. If I remember correctly, these were the rooms on each floor ending in -41, -43, -45 and -47. The doors on this side look better than those for the rest of the hotel. Clearly these are the nicer rooms.I didn't see the view from these rooms or the rooms on the other side, but from what I could see most of the outside rooms on the other sides did not have views. We had a room on the inside (an even numbered room). These rooms are supposedly quieter because they look onto the courtyard in the middle of the hotel. But this courtyard is rather small and the other rooms are not far way. The view we had was of other rooms, and they had a similar view of our room. I can't remember every staying in a hotel (of any quality) where I could actually see the other guests lying in bed. We ended up having to keep our drapes closed much of the time. If you value privacy, try not to get one of these courtyard rooms. I really value my privacy, so this detracted seriously from the enjoyment of the hotel. I should have said something immediately, but it took a day or two before it really started bothering me.Before long I understood why we got such a good deal on this room. The really great rooms with the views (the &quot;executive rooms&quot; or whatever they call them) are not going at these prices. It's the rooms on the other sides (without great views; not so quiet) or the courtyard rooms (lacking privacy) that are going at these great prices.This is a hotel that is designed to make the best of a strange location. It tries to be two things at once: a very upscale hotel offering great rooms for those willing to pay; combined with a standard hotel with rather problematic rooms for the rest.This dual mission is reinforced by the two breakfasts on offer. The spacious breakfast place in the Chino restaurant was empty and had salmon on offer. Needless to say, the punctilious Polish youth shooed me away from his little empire. I was to dine with the rest of the plebes in the overcrowded basement. And here they served a delicious, competent breakfast. They had the usual things you would expect at a breakfast buffet. Scrambled eggs were laid out in the buffet, but a sign said that you could ask for other eggs if you wanted it. The sausages were delicious. It was not a luxury breakfast and it was not extraordinary. Sorry to the nice people there who really provided great service, but I'm calling it as I see it. It was not the kind of breakfast I expected to get at a Park Plaza.London was absolutely packed with tourists. You couldn't really get away from it. Unfortunately we weren't the only ones with the bright idea of taking advantage of the cheap pound. Or is London always like this on a holiday weekend?This also applied to this hotel. Italians in particular seemed to be travelling in large groups of families and young people, and couldn't stop nattering excitedly, even at breakfast. After a while it got to me. It all became too slick, too international, for me. There seemed to be no British people around. Not the staff. Not the guests. It was not a quiet, upscale crowd, which is sort of what I expected at a Park Plaza. By the end, it didn't feel like a London hotel. Or even like London. However, as I said, it was tourist hell the weekend we were there. Perhaps it was like this in every hotel.There's not much in the immediate area of the Park Plaza Riverbank. A few restaurants towards Vauxhall. (And a few gay places I think.) Thankfully there is a wonderful, fully supplied corner shop about 25 metres away from the hotel. I've been to London many, many times before, and I see now that I prefer to stay somewhere that gives me easy access to some London street life, pubs, shops, restaurants, the tube, etc. This hotel doesn't really have that. As close as it is to Westminster Bridge, this hotel felt sort of isolated. There is not an awful lot in the immediate vicinity of the hotel. Getting anywhere required a walk or a bus trip. A few quick points about the hotel amenities. The bar was huge and the Chino restaurant offered an intriguing pasta buffet for 8.50, although we didn't personally enjoy either. The internet is free. It's fast too, especially in the business centre in the basement. There is no pool, no sauna, no wellness area. The gym on the 5th floor has about 8-10 modern-looking cardio machines of various kinds. No weights and no weight-training machines at all.The staff here were clearly professionally trained and provided great service. I must say there was a problem with minibar items and breakfasts wrongly added to my account, but you see that kind of thing everywhere. I'm giving this place 4/5 mainly because of the price-quality ratio. What else can I say about this place? It is a very proper hotel - a Park Plaza no less - offering comfortable rooms at a great price. That's not always easy to find in London. If you're just looking for an affordable, modern hotel somewhere in London, this might be the right place for you. I would pay particular attention to the room you get. You may need to switch rooms a few times until you find something suitably quiet and private. I am also sure that the atmosphere of this hotel probably changes completely during the week. I saw it on a busy holiday weekend."
