IDREVIEW,HOTELID,REVIEW
274,2142,"Oct 23 2005	Very nice hotel in a great location.	We just returned from a four night stay at the Radisson-Fisherman's Wharf. Overall, we enjoyed the stay at this hotel. We had a room on the third floor with a balcony and king sized bed. We did have a nice view of the bay but also of the top level of their parking lot. Our room was very clean and nice, but the inefficient use of space made the room smaller than it really is. For example the front edge of the TV cabinet is about a foot from the edge of the bed. We had to use this &quot;walkway&quot; quite often to get from the bathroom side of the room to the balcony and desk side. There is decent space once you enter the room but you really can't put any luggage there because the bathroom door swings out and takes up that space. The room had a safe, coffee maker, iron and board, hair dryer, extra pillow and blanket. The room was cleaned very well every day by their housekeeping staff. The climate control unit worked very well and was quiet. We did like the bed and thought the number control settings worked well. The water pressure was very good and had no problems with the water temperature. At certain times of the day, the elevator was slow. Quite suprisingly, when using the two main elevators (adjacent to each other), we had to press their own respective buttons. So if you're in the lobby waiting for the elevator, you need to press the &quot;up&quot; button for each of the two elevators individually (same for when you are on an upper floor, you need to &quot;call&quot; for each of the two elevators to go down). I used their fitness center 3 out of the 4 morinings. It's not a full facility, but rather one long narrow room consisting of cardiovascular machines and a multi-station weight lifting machine. It served it's purpose well but if there's more than 3 people in there it definitely will feel crowded. Although we didn't really need the concierge for anything major, more often than not we couldn't find him/her. Convenience to the Wharf area is the hotel's strong point. There is an IHOP on the street level where we had breakfast on a couple of mornings. The deli/tequeria around the other corner is a good (and cheaper) alternative for breakfast. Overall, we did enjoy our stay - clean room, comfortable bed and bedding, nice bath accessories, great view of the bay. A few quirks kept this from being a totally excellent experience. We flew into SFO earlier in the week, rented a car from Hertz to drive out to Yosemite for a couple of days, returned the car at the Hertz about three blocks away from the hotel. You won't need a car in the city, besides the hotel charges approximately $30/day for parking."
275,2142,"Oct 16 2005	Smelly dirty overpriced	The location of this motel is the only thing we found positive. My husband smokes and we could tell where the smoking rooms were immediately upon leaving the elevator. They do not neutralize or make any effort to fight the smell. The room was dirty, the air conditioner vent was clogged with dust, cobwebs and smoke residue. The smell was so strong, I walked 4 blocks to buy Fabreeze. The smoking rooms also were not given the sleep number mattresses that the motel brags they have in all rooms. Very disappointed in this overpriced motel. On site parking was expensive, especially when staying 4 nights, $30 a night. What a racket. they also do not respond to complaints, If you are staying in San Francisco-stay away from this motel. Or at the very least, don't admit to being a smoker."
276,2142,"Oct 12 2005	Can't wait to go back!!!!	We stayed at the Radisson for two nights in September. What a wonderful stay. The rooms were clean and comfortable. They weren't really big, but who cares. We were out sight-seeing, shopping and having fun. Why would you want to spend all your time in your room when you are in San Francisco? What was even better then the clean comfortable rooms, the great staff and the wonderful location was the view. I got to wake up each morning to a straight shot out to Alcatraz. I would stay at this hotel again because of several reasons, the most being the convient location to anywhere you would want to go in the city."
277,2142,"Oct 11 2005	Really Dissapointed	We kicked off our honeymoon here, we wanted the location and a really nice hotel. The website looked great- Raddison have a good reputation- However I think this must be the worst hotel in their chain. The rooms are old, wallpaper falling off the walls, the cupboard doors broken and the general decor of the room was depressing. If I was to return I'd look at the holiday inn express about 100m down the road. Avoid this hotel."
278,2142,"Oct 8 2005	Do a Renovation NOW	The desk staff save one member, their manager are stroppy and very terse with guests. The hotel is so old it doesn't deserve to have the Radisson name UNLESS they renovate the room -- SOON!! It is like a 1960's dive hotel you'd see on the Streets of San Francisco -- basic room, bed chair, no free internet. Avoid and stay at a slightly better property a bit more into towne."
279,2142,"Oct 3 2005	Not crazy about this hotel	This is an old, somewhat dumpy hotel. The lobby is very plain, our room was very small and the hallways smelled kind of musty. And it really wasn't cheap. I checked several sources and could not find a great deal. I ended up paying about 170/night - I should have spent more $ to stay in Union Square. There was one super-nice staff member who gave us a night of free parking. The concierge was good, too.But honestly, the company could dig into their pockets and remodel this place a bit. I would not stay there again.By the way, if you go to North Beach, do NOT go to Trattoria Pinocchio (or Cafe Pinocchio, or whatever it was called). The food was terrible. I can't believe these places that tout their great chefs, but then they don't use fresh ingredients or season their food! Total waste of $."
280,2142,"Sep 28 2005	Radisson Fisherman's Wharf - Great location Great Value	We just got back from a week in San Francisco and had a wonderful time despite the cool weather. The Radisson, Fisherman's Wharf is an excellent value. If you're looking for 'touristy' then this is perfect. It's located right in the middle of the Fisherman's Wharf area. If you want to go on a city tour the departure point is right across the street. If you want to go to Alcatraz you only have to walk about 200 yards. Pier 39, complete with sea lions, is about a 5 minute walk, there are two cable car turn arounds within a 5 minute walk and the F-line street cars go right by the door.The Radisson isn't fancy but the rooms are clean and the staff is exceptionally friendly. Try to get a bay view room on an upper floor if possible. The noise from the street at the front of the hotel is significant especially when a bus pulls up and idles while letting passengers on and off. We know, we had one, we asked to be moved and were.Lots of reviewers have raved about the beds. They are air beds which you can inflate or deflate to your personal comfort. They do take a little getting used to though. Your first night might not be great.There's no restaurant or dining room in the hotel but there is lots of food within a short walk. The concierge at the hotel is very friendly and knowledgeable when it comes to booking tours or any other need that you may have.As this isn't intended to be a travelogue on San Fran but a review of the Radisson all I would like to say about SF is that a tour of the city is a great way to start, the trip to Alcatraz is very worthwhile and if you're going to be in town for a few days and will be relying of public transit, buy a 3 day pass for the MUNI system. The pass covers everything - cable cars (which are $5 per ride if you pay the single fare), the F-line, buses and subway. It's worth the $18 for the three day pass.I'd like to thank all the other Tripadvisor[-] reviewers who posted their remarks which greatly helped me decide on the Radisson Fisherman's Wharf. I'll happily receive and respond to emails inquiring about specific topics."
281,2142,"Sep 12 2005	Great location	We stayed at the Radisson for four nights at the beginning of september. The location is great, just across the road from the harbour, piers etc, and various food outlets. Only a short walk to the cable cars. The hotel staff on reception were helpful, the room adequate but nothing special. Our room had a balcony from where we had a view of the pool, harbour and Alcatraz. The location was excellent but the hotel average."
282,2142,"Sep 8 2005	Great location nice hotel helpful staff	we staed at the Radisson for 4 nights at the end of august.Chose it because of Fishermans Wharf location and it was really great. You cannot beat the location, whenver we came back from downtown or tours we loved the area.Fishermans Whard, Pier 39 and ferryboats are just across the street.Staff was always very helpful. Rooms are Ok if you do not expect 5 star quality, hotel is more of Motel style.Make sure you get a room with a pool view, because they have a nice view towards Bay and alcatraz. There are also rooms with street view (must be loud) and rooms with a view to the innercourt with parking lot (there you hear cars moving all day).We had a great room with Bay view.The pool in the innercourt is heated and nice. Cafes and reataurant just around the corner."
283,2142,"Aug 27 2005	Perfect location and great service	We just returned from a 6 night stay at the Radisson Fisherman's Wharf.Location was the selling point of this hotel. The back entrance led us right into all the activities of the piers. The front entrance and we were steps away from IHOP and right on Beach street. Exit by the pool and we were in Johnny Rockets or Ben and Jerrys Ice cream shop. Stairs at the side entrance(next to our room) led to a 7Eleven for morning coffee and newspaper. Just a perfect location for getting to the piers, the Cannery, Giradelli square.We walked alot (to burn calories from all the food!)easy walk to China town, lil Italy,Fort Mason park and Lombard Street from the hotel. Service was exceptional at the hotel. Had requested a refridg. in the room when I booked the trip. At checkin I asked if we had one, they had not put one in the room. By the time we got checked in and to the room with our luggage someone was there with refridg.ALL hotel employees were friendly and helpful. One night we had a problem with the shower. Called the front desk and under 5 minutes they were there and fixed the shower. Had room service, but we never used it. Maid service was excellent. Only negative I can think of was the carpet in the room seemed a little worn and stained. Besides that the room was clean and adequate size.Only time we were in the room was to shower or sleep so a worn carpet really made no difference. I'd say the main plus was the location. Would absolutely stay there again!"
284,2142,"Aug 24 2005	Can't Beat This Hotel in SF	Just returned from a 3 night stay at this hotel. Originally booked at another location, but got a last minute deal on this hotel on the Radisson website. Excellent choice. Location directly across from Alcatraz ticket booth and Pier 39 is unrivaled! Rooms were great - clean, roomy, comfortable . . . and most have a bayview. Parking was also great. Staff at this hotel were exceptional. They were able to meet all of our requests and were very helpful. Highly recommend this Radisson. Have fun!!!"
285,2142,"Aug 23 2005	Fabulous hotel... wonderful location!	My fiance and I just returned from a wonderful weekend getaway in San Francisco. The hotel staff members at the Radisson were very friendly and helpful. The rooms were very clean, and the decor was cute and modern. The bed was the most comfortable bed that I have ever slept in... it was a Sleep Number bed. The location of the hotel could not have been any more perfect... the wharf is 1/2 a block from the hotel, &quot;Little Italy&quot; is a few blocks away, Ghiradelli Square is a short walk, and the cable car stations are close as well. Be sure to bring warm clothes though... average temp. year-round is around 63 degrees."
286,2142,"Aug 23 2005	A nice hotel in an excellent location	This hotel was in an ideal location if you want to visit Fisherman's Wharf in San Francisco. This area is ideal for all ages and has plenty of activities to fill your trip.The hotel is rather basic. The rooms are quite small (we were in a quad) and decor rather plain. However the hotel was clean and had facilities such as a swimming pool. Staff are pleasant and willing to offer assistance.We arrived at the hotel at 4pm-check in time. There were long queues from new guests and many of the rooms still were not ready. We did get a room within half an hour though.It is located right on the front, s is perfect for visiting Pier 39, Alcatraz and the chocolate factory. Two of the tram lines are nearby, so it is very easy to visit Union Square and the Grey Line terminal is across the road, so if you want to take a trip out of the city then you don't need to go far to catch a bus!This is a good hotel if you are on a budget and want to see SF. Do not expect any luxuries- but the location helps you get over that."
287,2142,"Aug 21 2005	Stay was most pleasant	Just returned from SFO and staying at the Radisson- our room was a good size however the double beds were quite uncomfortable. When checking out the agent said we should have tried a king room as they have the new, adjustable ones.Location is great- close to shopping and attractions. We couldn't get confirmed tickets for Alcatraz so stood by for the 0930 departure and got on!! Overall- hotel was excellent and good value for what you pay."
288,2142,"Aug 17 2005	Good Hotel Excellent Wharf area location	Stayed in the hotel for 3 nights, the rooms with king size bed were nice, although a little small and with limited closet space. Everything was clean and of reasonable quality, and the sleep number beds were interesting. Our first night we had adjoining rooms with two double beds and a balcony, these rooms were not as nice as the king size rooms the next two nights, they seemed a little older and of lesser quality. For tourists interested in the Fisherman's Wharf area, the location is great, plus its really not that hard to get around the city. We took a cable car (the line was silly long) to Chinatown and walked back, drove to Golden Gate Bridge and Golden Gate Park, and drove to a couple other locations in town (though parking was a little difficult in a few places). With so many restaurants within short walking distance, Im not sure why people cared that the hotel has no restaurant. Our kids enjoyed the pool, go in with them or you'll freeze watching them, only complaint about the pool was that it closed at 9:00 PM. We had limited luck with their concierge, they were ok at telling you the basics, but weren't the best at getting restaurant reservations and they weren't there after 7:00 PM. All in all, the hotel was good, its not luxurious but the overall condition was good and of above average quality."
289,2142,Aug 4 2005	Pleasantly suprised	I used this sight before booking and once I saw some of the hotels in person that get higher ratings I was amazed. I was SO glad I booked at the Radisson and not somewhere else. The hotel is in a great location. We could see Alcatraz and the bay from our balconey. Everything was either closeby or a short walk. There is even a grocery store 2 blocks away. We stayed in SF for 4 days before heading over to Monterey and rented a car for the trip there. The car rental place was 3 blocks away which was great since you really don't need a car in SF. It was nice to be able to pick it up so close to the hotel and then return it to the airport. The hotel was very clean and quiet. We had a wonderful time and I would definately stay in this hotel again. I highly recommend it!
290,2142,"Aug 4 2005	Can't beat the location	Stayed here two nights and found the hotel very good. The biggest plus point is the location, but it had everything we needed for a great stay. The room was very comfortable with a fridge, huge bathroom - no complaints. The pool is quite small but adequate with a seating area outside on the terrace. It's a shame there's no restaurant inside the hotel but there is a coffee cart in the lobby which was open from 6.00am to 12 noon selling drinks, muffins, pastries and some fantastic donuts which the kids loved. There are lots of restaurants near the hotel, so the lack of restaurant isn't really a problem. The best aspect of the hotel is the location - yes, there are a few homeless people in Fishermans Wharf but there is also great street theatre, a lively atmosphere and all the amenities are close by, including the ferries to Alcatraz and the cable car stops."
291,2142,"Jul 31 2005	Great location Great stay	I have traveled to SF before, always on business. So I have a preference for classy boutique hotels when I do business travel. But this trip was with my family, so I was a bit more budget conscious, but I still wanted some place cool.Boy did we luck out at the Radisson. We read dozens of reviews of various hotels in the city. My wife spotted the Radisson. I was very wary of staying near the Wharf. But the reviews sounded good. So we booked.On arrival we were not disappointed. Lobby was very small. But clean. Small coffee/danish bar (not free). Staff friendly. We checked in to a room on the top floor. Outside our window was a perfect view of the bay and Alcatraz! Room was small (never stayed in a big on in SF!) and clean. Hotel has wireless internet if you have to do business. The location could not be better, if you want to do touristy SF stuff. As someone has noted, IHOP was on same block, as was Johnny Rockets and a McDonalds, not to mention a hundred other places a few blocks away.Right in the middle of all the shops, stores. Ghiradelli Square four blocks away. Just look at where it is on a map and you'll see. I don't think I ever did so much with so little walking in our lives. When kids got cranky we could easily go back to the hotel to get recharged then hit the city again.I felt bad for families that stayed over the hill in the center of the city. They had to endure long lines for the cable cars and a long haul back and forth from the Wharf.Pier 39 was two blocks away. But if you want to do Alcatraz, get your tickets a few days before you want to go cause they were sold out each day we were there. Three car rental places within three blocks. Weather was actually cool (in July!). So we didn't think we'd use the pool. But the kids insisted and we're glad we did. It was heated. Like bath water. I wholeheartedly recommend the Radisson on the Wharf. I thank all the previous posters for helping steer us correctly."
292,2142,Jun 5 2005	Enjoyed the stay	My family and i stayed at this hotel in May of 2005 for 3 nights. Upon arrival we had been allocated a room with no view and asked about availability of change. The staff were more than happy to accomodate us. We were unable to have a front view but were given a room to the side but still with a good view of Fishermans Wharf. We found the staff - from the front desk to the cleaning staff all to be extremely friendly and helpful. IHOP was a great cafe for breakfast and you are lost for choice for eating places at Pier 39 etc. We were not bothered about the fact that the hotel did not have a restaurant as there are plenty of places to eat within easy walking distance. The location was fantastic and the room was very comfortable. We would definately stay there again.
293,2142,"Jun 5 2005	Radisson Fisherman's Wharf... Lucky Find	We just returned from San Fancisco Radisson Hotel Fisherman's Wharf and were very pleased with the hotel and the location. The room had an excellent direct view of the bay and Alcatraz. We were in the smoking section which is on the forth floor directly facing the water ( no extra charge) and we could open the window for fresh air. The room was large and was nicely decorated (not old and shabby) The lobby is marble tiled and somewhat classy and the hotel staff was wonderful. We asked for a mini fridge and they brought it up in 3 minutes, you can also get a microwave if you need it. The pool is heated and surrounded by palm trees. There is a 7-11, a Safeway and a Trader Joes arround the corner for buying wine, beer and snacks.  The location is just can't be beat. Short walking distance (no steep hills) to 2 cable cars locations, Ghiraldi Square, The Cannery, Pier 39, Blue &amp; Gold fleet to Sausilito &amp; Alcatraz,The Embarcadero, North Beach and China Town. The F trolly car passes in front of the hotel and you can hop on for $1.50 and take anywhere. Great seafood surrounds you and all with in walking distance, in particular Scoma's and The Crab House. Also within walking distance is The Buena Vista (c. 1890's) by the Hyde St Cable car turn arround which offers wonderful food, breakfast all day &amp; nite, Bay &amp; Golden Gate Bridge views and is famous for Irish Coffee. You can rent a car at Dollar rent a car with is directly across the street at the Sheraton, weekdays when booked online is $20.99 with unlimited miles and take day trips north over the Golden Gate Bridge to Muir Woods, Nappa and Samoma Valleys. Or take a picturesque costal drive south on Route 1 to Santa Cruz, Montaray &amp; Carmel by the Sea. Drop the car off after hours to avoid overnight parking fees and just walk across the street to the Radisson.  We would not hesitate to reccomend this hotel and would return to the Radisson in a heart beat."
294,2142,"Jun 1 2005	great location and sleep number bed	Spent memorial day weekend (May 26-31) at the Radisson without complaint. However, I will point out a few several pro's and con's of the experience. The location was excellent. It is the ONLY hotel (noteworthy) on embarcadero st. facing the waterfront. The sleep number bed was perrfect. Average size rooms. Basically nothing bad to say. We were pleased. The next time, we will try an elegant hotel, perhaps the one across the street. Otherwise, the price and location were fine."
295,2142,"May 29 2005	Prime Real Estate ...	We planned a trip to Alaska, cruising out of San Francisco on May 16th.We wanted to attach a 3 day stay before the cruise. We chose Priceline, and what luck in getting the Radisson. The location was perfect. We used public transportation, walked many, many miles, bike the bridge and took a taxis to the ship ... all with the assistance of a well informed hotel staff at the Radisson, even during very busy moments in the small lobby area.Food of all prices and variety was available everywhere and with the convenient hotel entrance next to Pier 39, we could return quickly to the hotel room for a sweater, camera batteries, or the typical needs of a traveler enjoying fabulous seafood.We have used Priceline many times and always got excellent results, some hotels add a 'fee', not the Radisson ... we expected to be in a room somewhere near a storage closet. We were not surprised when our window opened to the second floor parking lot but beyond the parking facility was a spectacular view of Alcatraz ... we were happy.We had to wait for the cruise ship to get our beds turned down and get chocolates on our pillows but the Radisson offered SleepNumber beds ... first time we have had this luxury in a hotel!Why did we give this hotel an excellent rating? Dollar value, of course, but bottom line is: When we return to San Francisco, we will book directly to the Radisson, resisting the temptation to save a few dollars with Priceline and giving up the priceless value of location."
