IDREVIEW,HOTELID,REVIEW
7,1338,Oct 4 2009 	sub standard for the price	I spent one night at this hotel. Check in was efficient although a request for a reduced breakfast rate was turned down! My room was tiny and quite cramped for one person even though it was a superior double. Bathroom is unbelievably tiny and NO Molton Brown toiletries as mentioned in some other reviews. The sound proofing is not very good and I could hear the conversation of the American tourist in the next room. Bar staff lacked the CAN DO attitude seen at other 5 star establishments and my request for a drink at 12 55 in the morning was met with a resounding &quot; sorry the bar is closed.&quot; Overall not an unpleasant stay but for the money I paid I expected alot more. You would be better off looking at the Radisson chain which offers 5 star hotels in central locations with free wifi and good breakfast deals. Some public areas at this hotel including lifts are quite tired.
8,1338,"Sep 27 2009 	Great location - Very cozy hotel - Go for the large rooms	I booked at the Westbury through booking.com a superior room. When we arrived at the hotel and entered the room i was just shocked with its small size. I immediately asked for an upgrade and paid an extra charge to move to a Deluxe King which was really beautiful. If you can afford to go for the larger rooms, this hotel is really really good. Perfect central location at the heart of Mayfair, it gives you access to shopping &amp; dining at some of London's hot spots. I cannot comment about dining as we were nearly all day out of the hotel. My experience from the front office staff &amp; the cleanliness of the room was very good."
9,1338,"Sep 19 2009 	Conveniently located - nice stay	Just spent 4 nights at The Westbury in Mayfair with my husband who was thereon business. Had a great stay and would recommend this hotel to anyone visiting for business or leisure. Location is convenient for so much...5 minute walk to Piccadilly which is a main thoroughfare...Fortnum &amp; Mason, coffee/snack places, restaurants, and 2 tube stations nearby (Green Park and Picadilly). About a 10 minute walk to Hyde Park were I went jogging in the morning. Gym at the hotel is tiny (2 treadmills, 1 elyptical, 1 tv, set of weights, one machine)...but since Sept weather was mostly nice, I used Hyde Park. Area is up-market and similar to Upper East Side of NYC...luxury brand stores, etc. But, Regent Street isjust around the corner and they have all sorts of stores - luxury and H&amp;M, Top SHop, etc. Concierge booked us tickets prompty for a play one morning for that evening's performance. Hotel reception and concierge were great...everything professional and quick. Doormen always sweeping open the doors, never had to wait for a taxi, room was on the small side, but served its purpose...comfortable queen bed, nice marbled bathroom w/Molton Brown toiletries. Room service for breakfast was quick and delicious. Quiet sleeping.Clean, comfortable...priced better than other luxury hotels where we've stayed before(The Berkeley and Mandarin Oriental). Only drawback was the fitness center...but I believe they can recommend health clubs near hotel if that is an issue.Dinner one night (without reservation - went on early side) at The Wolsey on Piccadilly...grand space that housed a bank and a car showroom - lively, great food.Another night drinks at nearby Browns Hotel Bar...elegant scene. Definitely would stay there again."
10,1338,Sep 19 2009 	Nightmare	We had originally booked 2 nights at the Kingsway hotel and were relocated (&quot;upgraded&quot;) to this nightmare. I find it hard to believe that we didn't get to stay in the hotel we had booked in the first place - what the heck is going on? The room in the Westbury was minute by any standards and pretty basic in terms of facilities. Worst thing was at 10.00 pm a work crew arrived opposite to take-down or erect scaffolding and this went on until 3 pm the next morning. On the second night after the work commenced again we were relocated to a room at the back. About 10 minutes later when in bed someone entered our room. Shortly after I could hear the telephone ringing in the room next door - the walls must be paper thin. All in all a wretched experience. My advice would be to steer clear of the Westbury - and for that matter - the Kingsway. And yes - the staff were hopeless.
11,1338,"Sep 5 2009 	3 star hotel with 5 star pretentions	Our &quot;superior&quot; room looked out on a blank wall. No reading light for one of the beds. 4 captive hangers per closet. No coffee machine. Tissues and toilet paper not replaced until requested. Good location but long walk to nearest tube stop.Mike S., New York City"
12,1338,"Aug 27 2009 	Over priced cramped rooms and rude staff.	This hotel did not help a four-night business trip with a tough agenda. Although the room (a 'standard') was clean and quite comfortable it was tiny. But you can live with this, especially if you are out at meetings more than you are in the hotel, as I was. But it was the general lack of service that blew it for me. The staff were generally uninterested, to the point of being rude or dismissive. Room service was appalling - orders failed to show up and when they did housekeeping would leave the plates and cups lying around until you were forced to ask them to remove them. Virtually every request of any staff member, from 'can I have some more toast' at breakfast (over priced at nearly 30) to 'is there a post office near here' was met with a heavenwards look and an audible tut. Bottom line - I won't be going back. There are much better hotels in central London."
13,1338,"Aug 27 2009 	Poor Hotel	Westbury Mayfair- a great disappointment: expensive, tiny rooms and bathrooms, practically there are no closets, asking for breakfast in the room was a torture since the breakfast table/tray did not entered in the room, several broken accessories, poor amenities, etc....Service indifferent. Not at all a 5 star, We stayed there for 8 days and it was very unpleasant, try somewhere else!"
14,1338,"Aug 23 2009 	1st wedding anniversary to remember	Our 1st wedding anniversary will always be remembered and this is largely to do with the fantastic time we spent at the Westbury Mayfair. The location is perfect for the West End and well worth paying a little more for. The staff were all extremely attentive, friendly and helpfull. Our room was lovely with lots of Molton Brown product to enjoy. The breakfast was 5 star. Thank you to the Westbury Mayfair."
15,1338,Aug 11 2009 	Really nice hotel inspite of..............	Good things. Location to Bond street. Deluxe king room was beautiful .A pot of tea in our room was very reasonable and folks were nice every morning. View was ok. Great shower.Bad things: One out of two elevators never worked for 4 day stay. Lights in the fancy closet wouldn't go out unless stuffed tissue on the button; too funny. There were a lot of 'celebrities' in the hotel; so us 'peons' were tolerated. They charged me for internet when it didn't work.
16,1338,"Aug 1 2009 	Excellent location but tiny rooms and rude service don't give good value for money	I stayed in this very centrally located hotel recently for a long weekend. I was looking forward to some luxury and pampering. The reception staff were most pleasant and I could'nt have been happier with the close proximity to Oxford, Regent and Bond Streets. However, the room was tiny - so small in fact that the room service trolley couldn't fit inside! There was no room to walk or store two cases of luggage and certainly no where to sit or relax. I also visited the Polo Bar twice during my stay and on the second occasion found certain members of staff very slow and quite rude and unprofessional. This is not what I expected and is certainly not acceptable from a so called five star establishment. I have stayed in quite a few five star hotels in London and elsewhere, this is not one of them!"
17,1338,"Jul 22 2009 	Overrated and disappointing much better value elsewhere	We stayed for a weekend to explore the city. Although the reviews on Tripadvisor were mixed, I was expecting alot more than what we discovered:Rooms - Very small and cramped. Enough for one person but for two it really did feel quite squashed. Although, the bed was very comfortable. Hotel amenities - appeared somewhat dated and lacking. There are only 2 lifts for 222 rooms which means you have to wait a long time to use them and always packed and they are old. the lobby was smallish for such a big hotel and did not appear 5 star at all. Service - There appeared to be a staff shortage because we had to wait a long time for assistance at the reception desk. Concierge was very unhelpful. Only knew of restaurants within walking distance of the hotel. Couldn't really give suggestions of places to go and see around the city or even tell us where the Indian/Pakistan quarter of the city was so that we could whet our appetite trying different foods. Price - very expensive for what you get. Much better value can be found at other hotels in London."
18,1338,"Jun 30 2009 	5 stars all the way	This was our first time traveling aboard w/ our toddler son. The staff of the hotel could not do more for you, they were excellent. The staff there is incredible, I really miss the hotel and London. The amenities on the room and the pillows are fluffy and the bed was sooo comfortable!! The best sleep I had outside of my house in a longtime!!! I want to go back to the Westbury Mayfair. The tube is about a 10minute walk and the bus are not far at all and it takes you to all the attractions. The location could not be better in Mayfair, I always felt safe in London it is one of the best cities in my opinion; Piccadilly, Oxford and Regent Streets are with in walking distance from the Westbury hotel. Room service was the best . Of course I will stay here, again."
19,1338,"Jun 25 2009 	Great Location Only Slightly Above Average Hotel	Stayed here 3 nights for business. I've stayed in many 5-star hotels, and this is not a 5 star hotel by any means. Good Points:The caliber of the staff suits a 5-star hotel - doormen are prompt and helpful and check-in and out were uncomplicated with pleasant front desk service. You cant beat the location if you want to shop. Molton Brown products in the bathroom are wonderful.Bad Points:The room was shabby at best. I stayed in what was probably the lowest class of room. The furniture and capeting was dated and uncomfortable. The bedding was unimpressive, and I am still scratching bumps on my body from either from the sheets and/or bugs in the bed. Not pleasant! There is no iron in ther room, instead there is a pants press in the closet that looks like it's been there for 30 years and doesnt even work. The hairdryer in the bathroom also looks like it's from the 1980's and didn't work, instead, I stumbled upon a hairdryer that was plugged into the desk somehow and was in the desk drawer...so you had to dry your hair with the desk drawer open to get the cord to reach your head, in an already cramped space. The TV had about 5 english channels, all of which were news channels and made for incredibly boring watching when all you want to do is relax. You have to pay for internet access for each 24 hour period, so you have to keep paying each day when your 24 hours is up, very annoying. In this day, internet access should be free and any hotel that still charges is just being cheap. Overall I dont think I would stay here again or recommend it to anyone. Instead, I would warn them about potential bedbugs!!!"
20,1338,"Jun 13 2009 	Location LocationLocation!! 5 stars!!	I stayed at this lovely hotel the end of May and from start to finish it was AMAZING!!! The rooms are fantastic, the restaurant was 5 star and the Polo bar was fun and the head bartender makes the best Pomegranate Martinis!! I want to go back for the martinis, it left me wanting more. The staff of the hotel could not do more for you, they were excellent. The staff there is incredible, I really miss the hotel and London. The amenities on the room and the pillows are fluffy and the bed was sooo comfortable!! The best sleep I had outside of my house in a longtime!!! I cant want to go back to the Westbury, is all I ever talk about. The tube is about a 10minute walk and the 23 or the 3 bus are not far at all and it takes you to all the attractions. The location could not be better in Mayfair, I always felt safe in London it is one of the best cities in my opinion, I've been to Paris and its pretty close between the 2 of them. Piccadilly, Oxford and Regent Streets are with in walking distance from the Westbury hotel. OK, so it pretty obvious I will be staying at this hotel from all the wonderful comments. 5 STARS all the way and I've stayed at the best hotels in the world, Ritz Carlton Maui, Four Seasons Maui, Kea Lani, Grand Wailea, St Regis NYC and to me the Westbury was very close to scale in services and staff, from the hotels that I just mentioned!! IMO!! Cant wait to return, already planning the dates for my next visit!!"
21,1338,"Jun 5 2009 	Good enough but probably only stay if you need to be in the area	The hotel staff is very friendly and attentive. Check-in and check-out is always easy and comfortable. The rooms are typical for upscale London - small, quaint, classy. Not much more than that. I would prefer a larger space and better views. Most people stay here for the location - it is truly in the heart of the Mayfair district, making it especially well-suited for high-end shoppers, but less ideal as it's about 10 minute walk from the nearest tube stations (Picadilly, Oxford and Green Park). Prices in the restaurants and bar are high."
22,1338,"May 29 2009 	Luxury tranquility class.	Perfect stay at the Westbury Mayfair, having been badly letdown by the Waldorf Hilton. Booked Lastminute literally, and dashed across in a taxi. Had to wait 15 minutes for them to prepare the room but the rest of the two night stay was brilliant. We had breakfast in our room on the second day - very nice, will do this again.Stayed in a Deluxe King Room, the bed was huge! Nice sitting area with sofa, chair and coffee table."
23,1338,"May 27 2009 	Absolutely perfect	My mum and I stayed for 4 nights from 21st - 24th May and I can't fault this hotel. my only critcisim is that they should have tea making facilities in the room. Didn't bother me but my mum needs her morning coffee on waking! We had a deluxe kingsize room which was huge and luxurious. Enormous bed, lovely bathrooom with bathrobes and a large sitting area with sofa, chair and desk.We were very impressed with the level of service in the hotel and liked the fact that staff rang the doorbell at least once a day to ask if we needed anything extra like towels or toiletries. We also recieved a nice turn down service each night when the maid would close curtains, turn on lamps, turn down the bed and lay our nightwear out for us. We had room service twice - one breakfast and one dinner and this was excellent. Prompt, hot tasty food and a lovely table set up in our rooom for us. The concierge service was excellent and the bar staff were prompt and polite - although 12 for a G&amp;T and a 2.50 service charge is a bit on the expensive side!the location is PERFECT - a five minute walk in various diections takes you to piccadilly, the palace, oxford street etc and bond street is on your doorstep.All in all we loved the hotel and will stay there again on our next trip!"
24,1338,"May 17 2009 	Great service with a stellar location	My husband and I stayed here recently and we were very pleased with the concierge service. They enabled us to get soccer tickets for a hotly contested Chelsea/Fulham game--- very pricy but totally worth it. We also enlisted their help for mapping out directions and public transport to restaurants we had booked on-line. They could not have been more helpful. The room (superior double) was plenty roomy with lovely plush and comfortable beds. I got a great deal on-line ($220 a night) so all of this was a bargain as well. Not sure if my review would be as glowing if paying rack rate (around $500 a night posted at check-in). For the price we paid, this was a real winner!"
25,1338,"May 11 2009 	Good location!	The Westbury ,Mayfair has a fantastic location &amp; the rooms are of a good standard too."
26,1338,"Apr 27 2009 	Very Very Nice	Stayed here in the beginning of March for three nights. Nothing even remotely bad or dissappointing to report. Everything very nice - staff, room, comfy bed and pillows, clean bathroom. Nice touch to have a cappucino and a croissant in the lobby bar for breakfast if you're in a hurry. Woth the money - if you have it!"
27,1338,"Apr 13 2009 	Great location for shopping small rooms!	We stayed at the Westbury for Valentines night,Pleased with the location as it was a few minutes stroll from Tiffanys and just under 10 minutes from Fortnum and Mason on Picadilly.The lobby was impressive, the staff on duty very friendly. Check in very smooth. The only thing I would say is that I had enquired about getting a bottle of champagne in the room as a suprise for my partner and the reception asked if I still wanted this when I checked in! - Suprise ruined! The room was fairly compact, however had all the needed facilities. My partner had also arranged for some flowers to be in the room which were stunning so very pleased with that factor.We attempted to use the conceirge. I called down to ask if they could find us a bar showing the football - quite a feat as England were also playing rugby. The man on duty never called back. We called about an hour later and were apologised to by the man now on duty and he attempted to assist us on the phone.We did not use the hotel restaurant or bar as we had reservations elsewhere. We also did not use room service as the prices were expensive.The room was comfortable. We checked out the following morning and used the left luggage facility which was fine.All in all an average stay... the hotel was pleasant but not as great as some of the 5* hotels I have stayed in.There is nothing that sets the Westbury aside from other 5*'s in London."
28,1338,Mar 1 2009 	Over rated 5* but great location	stayed at Westbury for week end trip 28/2.Hotel is well located.Reception and lobby staff very good.We stayed in a standard room which for a 5* hotel is small.My partner continually bumped her leg on the furniture at the end of the bed where there was a gap of no more than 25cm.No tea and coffee making facilities in the room - even an average 2* hotel would offer this.Bed squeaked and staff service doors could be heard slamming late into the night.Good restaurant-food quality good.Bathroom matched the room-good decor but very small-single basin and one bathrobe between two persons.Molton Brown toiletries but enough for one bath or shower only.Much better 5* hotels in London.
29,1338,"Feb 20 2009 	fabulous hotel of bond street	me and my husband loved this hotel!! it was so fancy and stylish. although the our room was a standard dbl and a little small, we loved it anyway. in europe it's very common to stay in small hotel rooms, the thing is to be clean, nice and comfortable. this hotel had all of it! the lobby was very chic, and I can't remember it's name but the bar of the hotel was awesome! I strongly recommend you to stay there. by the way the location was great too! it's only a few mins away from piccadilly circus or oxford street. it was very central."
30,1338,"Feb 19 2009 	Great location quality rooms and service but a little dated.	Stayed here for 3 nights with the wife and our 1 year old son on a very good deal (staff rate roughly 90 per night, breakfast and room upgrade). The hotel is brilliantly located and the rooms were very generously proportioned. Our room had a separate living and sleeping area which is very handy with a baby and also makes hanging out in the room much more pleasant. The only downside to our room was that the two flatscreen TV's were very close to one another which meant that the remote on one also controlled the other (the living room TV would turn on when we changed the channel for the one in the bedroom) but that is a very minor complaint. The rooms were luxuriously appointed and befitting of a 5-star hotel, along with the courteous and professional staff. The styling veered at times on the tacky but that would probably suit the clientele who in the main wore over sized sunglasses and fur coats. The buffet breakfast was as expected and we ate some nibbles (Eastern mix, satay, pancake rolls, etc;) at the restaurant which was very nicely cooked. Have absolutely no complaints about the hotel considering the price we paid, don't think it is marketed at a couple in their late 20's (saying that we did bumped into Liz McLarnon of Atomic Kitten fame in the lobby) but we still had a enjoyable stay and left feeling much more relaxed than when we arrived."
31,1338,"Jan 27 2009 	Location is not everything	We stayed at the Westbury as a change from our normal London hotel, booking a deluxe room. This has to be the smallest deluxe room in the hotel industry, with barely 12 space between the bottom of the bed and the furniture and the same on one side. When we asked at Reception what is the difference between a standard and a deluxe room  we were told it was the size of the bed. So there you have it a king sized bed crammed into a standard sized room. Due to concert times we used room service twice. Both times the waiter looked around for somewhere he could reach to put the tray. On that side, room service is good. Expensive (but where isnt it?) but good hot food delivered within the time stated. The staff are all very pleasant but it is very superficial. They do not really listen to you or notice you, not what I have come to expect from other 5* London hotels. Motto of this  stay at the Westbury for its good Location, but unless you want a King sized bed, save your money and do not pay the extra for a deluxe room. At 5* the rating is higher than the hotel really deserves."
32,1338,"Dec 23 2008 	Nice but tired	Nice hotel in a perfect location  within a short distance from a busy Oxford street for shopping but situated on a quiet side street, drown in luxury boutiques. Very stylish lobby and helpful stuff. Tasty room service dinner, you should try prawn risotto. However the whole property is pretty old. Be prepared for tired dcor details. However, I had a good impression of Westbury Mayfair and would probably recommend the place."
33,1338,"Nov 25 2008 	Great location but hotel lacks a lot...	Great hotel and nice staff, especially the wonderful doormen. Wonderful location (just a short stroll from Regent Street, Bond Street and Oxford Street)But in my personal opinion, the hotel lacked on a few points.Bath towels were poor, scratchy and past their best. The bathrobe was the same... had seen much better days!Keep the Molton Brown goodies, a complimentary bottle of water would be a much better idea! Nicely stocked minibar but no tea/coffee making facilities (but is available on request) Its almost as the hotel just hasn't thought it through properly. Not worth the money in my opinion."
34,1338,"Oct 30 2008	Lovely hotel good location	Stayed here for a night in October with my wife. Arrived just before noon and we got the keys straight away after signing in, which took abot 5 minutes, staff all very friendly, 5 minute walk from Green park tube station, weather was lovely, so worth a walk, or cab from waterloo was 10, you're right on bond street , so all of the fashion houses are there, with the price tags to match, Leicester square / shaftesbury av is about a 10/15 min stroll . very easy to walk around, room was nice, we had a free bottle of red wine and toiletries while we were there. Not the biggest of bathrooms but more than adequate , never had an evening meal there, only breakfast. which was plentiful, visited their bar at night, a rich set of people is how i would describe the people in there, just one look at their bar menu says it all , a bottle of champagne was 35k .. can't see many of them getting drunk, the cheap plonk was a lot less than that, but a bottle of peroni was 6.. all in all a good hotel .."
35,1338,"Sep 29 2008 	Great location	We enjoyed our stay at the Westbury Mayfair. I was surprised by some of the negative reviews of the rooms. Our room was spacious and looked nearly new. The furnishings were very stylish and comfortable. The staff was friendly and attentive.However, the bathroom does need some updating, moreso the shower and bathtub but still in good condition.Considering the prices of hotels in London, especially central hotels I found the price to be reasonable. ."
36,1338,"Sep 2 2008 	Very nice Hotel	This was a great hotel. The location is perfect for the Westend. We stayed in the hotel for only 1 night, we were going to see the Sound of Music, and the hotel is only 5 minutes walk away.The hotel reception is very posh, and it feels like a 5* hotel. You are greeted by the doorman with a smile. The reception staff are very friendly and polite.We booked a Queen room, which was very nice and clean. The bed was very comfortable and the linen had a feel of luxury.Bathroom was very clean, and had Molton Brown goodies to wash with (or take home). The shower was very powerful.We didn't eat in the hotel so cannot comment on that.Overall, great hotel in a superb location."
