IDREVIEW,HOTELID,REVIEW
39,1298,"Mar 23 2007 	Cheap Hotel near the Tower of London	I stayed in this hotel because it was the cheapest option near the tower of london. The subway tracks are directly behind the hotel so if you are a light sleeper I would not recommend this property. Also I would recommend asking for a room in the front of the building to minimize the noise. For the price, I thought it was a good value. The tower of london, tower bridge and subway stop is less than a mile."
40,1298,"Jan 5 2007 	A below standard hotel. Do not stay here.	Hotel rooms are small and crampt. Staff were extremely unhelpful. I was told I would have a room with a bath but only twin rooms come with baths. doubles only have a shower so I had to make do. Bed was hard, i am suffering from back ache as a result of this. The head board shook every time a train went past on the very near by track, making it difficult to sleep. There were marks that looked like make up on the carpet. Large yellow and orange blobs. Very strange. Egg shell that had been dropped in the hallway took an entire day to be tidied up. Our breakfast order came late and was not what we ordered. During the time we were out and the room was being cleaned one of the key cards for our door was removed from our room, for no good reason and we were left with only one big towel between me and my fiance. When I rang down for another, the receptionist made sure I knew what a hassle it was for her to get another towel so it was a surprise when it turned up five minutes later. Last but not least beams jut out of the wall in the rooms which me and my fiance both bumped into. I now have a huge bump on my head and a aching shoulder. Not suitable at all for children. paid a large amount of money for a sub-standard hotel. I also stayed at the hesperia in london which is much nicer. Go there instead."
41,1298,"Dec 22 2006 	Good value for money	Stayed in London many times with varrying standards of accommodation and price. This hotel was very good value for money so i was a bit dubious. When i first arrived at the hotel i was a bit surprised by the location. Only 5 mins from the tube/tower of London etc but the hotel was down a dark dingy street and the hotel looked like an office block from the outside (obviously been converted) however once in the hotel found it to be very comfortable. Nice clean room with a great bathroom. Although the room overlooked the railway line, it wasn't any problem. In fact it was quite nice to wave to all the commuters first thing in the morning. All n all a nice comfy stay and would go back."
42,1298,Oct 22 2006 	dream room	the location of the hotel was very dissapointing for the hotel. it wasnt a really good look. i had to walk down a very dark alley way which was pretty frightening. other than that the hotel was good the room service was ok. loved the room and it was in really good condition. me and my boyfriend really enjoed and might even come back just has long has we dont have to walk down that dark road.
43,1298,"Sep 15 2006 	Very nice hotel	We stayed here for 3 nights earlier this month and enjoyed our stay. This hotel is conveniently located close to the Tower Hill and Aldgate East Tube station. The room was nice, clean and contemporary. There were a bunch of good restaurants close by. I wish the hotel offered free continental breakfast. I would definitely stay there again."
44,1298,"Sep 13 2006	Very good	Good clean place and location for the price, also in zone one for the undergroundwould stay again as is very new as well"
45,1298,"Aug 3 2006 	Excellent Accommodation!	I could not have gotten a better deal... The room was lovely, the service impeccable, and the price amazing. Stayed 4 nights and had the best sleep despite our room being next to the railway; I did not hear a thing. No, the hotel isn't in central London, but it's only a 5 min walk from the nearest Tube station and just a couple of stops away from all the sights. I had a blast and would definitely stay here again! ~A Traveller from Edinburgh"
46,1298,"Jun 21 2006	Unbeatable value nice hotel	We stayed at the Comfort Tower of London for 3 nights this past May and had an outstanding experience.First, we found an unbelievable rate of 85$/night on Expedia- yes, that is in US dollars, not pounds!This rate was for a King room and included a hearty breakfast every day.The room was fine - it was fairly new and a little small, but that was to be expected to London's standard. I must say that I found the king bed to be a luxury in London. The decor is modern and the bathroom very clean and more than adequate.Compared to all the other options, we felt we got an excellent deal. The hotel is nice, new and modern and the breakfast was definitely several notches above the usual continental fare - there was hot eggs, ham, pastries, yogurt.The only slight downside is the location. It is a bit hard to find and is in a somewhat isolated area. I will emphasize that we found the location to be safe, but if you are looking for a hotel that is on a busy street or lively square, this is not the place. On the plus side, it is located only 2 minutes from the Tower Gateway tube station.Overall, we were extremely satisfied and would stay here again."
47,1298,"Jun 19 2006	Good location good value	Nice hotel, new, clean, big room (contrary to what you hear of European hotels, and not what we found in Athens and Rome), right next to train tracks, but we didn't hear them, ever (sound-proof windows and walls?), lift was broken during our visit. Not the nicest neighborhood (a little run down), but we never felt unsafe walking to and from the Tower Hill underground station (3 blocks away) or the bus stops (2 blocks away, for several major buses). We had a King with a rollaway (for our son) for 62.73 euros a night (booked through their website using the &quot;Internet rate&quot;). Breakfast was not included, but available for 12 euros each in the hotel restaurant. (We choose to do other things with our 12 euros!) Nice curry restaurant down the block - Red Chili."
48,1298,"Jun 15 2006	Not as central as you'd think	I thought it would be better having read the reviews on tripadvisor before I went.It was much further from the Tower of London than I thought which meant a good 10-15 minute walk down some deserted streets. The hotel itself is down an alleyway next door to a garage and with some kind of fish processing place on the same alley.We were there for 3 days on the 8th of June and the lift was out of order for that whole time. I am interested to see if it wil still be broken in future postings. We had the impression they had no intention of fixing it. The walk up three flights of stairs with our suitcases in the heat wasn't much fun but at least the air conditioning in the room was very good. The bedrooms were nicely decorated but the drainage in the shower wasn't the best and they had a notice up saying to be careful because the steam can set off the fire alarm. There is a lot of noise from the train station at the back of the hotel and it woke us early every morning, even though we were up on the third floor. Also beware of the goldy bedspread. I flung myself onto the bed after a hard days shopping and got carpet-burn from it i thought bedspreads were supposed to be soft! :-("
49,1298,"Jun 12 2006	Not much comfort in this hotel	Taxi driver had no idea where the hotel was. When we eventually arrived the receptionist said it was a common problem. The lift was not working so had to carry bags to the second floor, no assistance was offered. The room was clean and adequate but was beside a noisy street so could not open the windows. The air conditioning which was modern simply didn't work. A fan was offered once the staff checked the unit. Breakfast was cold even though I was there when the opened for serving. The internet which was advertised as free on the company booking system was not free either at 3 an hour.Overall an average hotel that is charging above its worth as it is in a poor location with poorly maintained facilities."
50,1298,"Jun 2 2006	Loved the hotel	A great new hotel. It is within walking distance of the Tower Bridge and offers real value for money, if not more. It is very very close to all the London attractions and was a perfect base for our stay in the city. The rooms are very chic and modern with great furnishings and a big shower. The buffet breakfast is superb and the bar service is great as well."
51,1298,"Apr 26 2006	Great hotel	disadvantages if the hotel:# it was fairly hard to find, but by popping into a local sandwich shop we were able to find it. # not that wide varitey on the diner menu (however there are many restraunts localy).# view from our room was the train track. this however was not a problem as the walls were soundproof and you could only hear them if you opened the windows. (trains going past approximately every 15 minutes (but please note this really wasnt a problem, as they were unheard).advantages:# great welcoming to the hotel and we managed to check in 1 hour early. thy were very helpful we gave them the surname and we were in our room within 2 minutes. we took the lift upstairs.# easy access with a modern entrance type swipe card to get into the room.# the hotel room was big enough for 2 which was great, plenty of space for clothes and sky tv with film and msic channels really made the difference. # the beds were slightly uncomfortable (firm) but i was so tired form sightseeing that i fell asleep immediately anyway!# room service was available at 3, which is always a plus (you could even get a paper of your choice delivered to your room after 7 am (anytime wanted) great).# breakfast was included within our price, so much choice. 5 different drinks, cereals, cooked breakfast, toast, baguetts, croissants, fresh fruit. as result of this breakfast i couldnt manage lunch so a good saving of money lol. a real bonus of breakfast was that it was served between 7-10 (mon-fri) and you find a table (always a spare one) and serve yourself everything is up on the table and you cna pick (including cooked breakfast). # the decor throughout the hotel was very modern and clean i could not fault them upon this. # checkout was simple handed back the swipe card and that was it. overall i am very pleased with the hotels good service and for giving me such an enjoyable stay. all the staff were pleasent, and i would strongly recommend this cheap brilliant hotel to anybody."
52,1298,"Mar 16 2006 	Hidden gem	This practically new (7 months in operation) hotel sits just three blocks from Tower Hill underground station and just a short walk from The City, yet its rates are half of what one would expect to pay in that area.This hotel is on a clearly industrial street next to the train tracks and is virtually unknown to most cabbies. Part of the problem is the lack of an external sign, coupled with a noticeable lack of advertising. Nevertheless, we found it without difficulty and we were quite pleased with the hotel itself.This is not the hotel for you if you are looking for Olde English elegance and culture, luxury service or stunning views from your windows. The hotel is part of the Comfort Hotel chain and it delivers budget accomodations that are comfortable and much better than average.Rooms are modern and being new, clean and bright, as were the nicely-tiled bathrooms. For the price, the rooms were bigger than we expected. To our surprise, the walls are apparently sound-proofed, as we never heard out neighbors even though the hotel was mostly filled.Breakfast was more than adequate and the staff were extremely courteous and helpful. We were on a business trip and the location was perfect for us. It would likely suit tourists as well, given the proximity of the Tower of London and the Underground. Our only complaint were the beds, which we found to be overly-firm. If you like that type of mattress, you will have no complaints.Considering that we paid less than $200.00 a night (even less on the weekend) it is hard to imagine finding a better value in that part of London. We will be returning in the future."
53,1298,"Mar 6 2006	Towering value	Went to this hotel expecting little for the 60 rate that I understood to include only continental breakfast.It is located 10 min walk from Tower Hill tube but suffers from an approach down a rather dingy darkish alley that luckliy quickly turns into a better lit street. Could easily go a little bit further on and approach it down a better lit main street.The back of the hotel looks onto rail track intersection so there was some noise from passing trains, but cant say I found this too much of a problem.All that said the experience inside the hotel was much better.Helpful staff, nice good sized clean room, modern decor and good breakfast - not just continental but also full english. We were also able to leave our luggage in the hotel after checking out whilst we spent a few hours going round the Tower of London.For the money and location I thought it was very good value and would recommend it."
54,1298,Oct 27 2009 	RAS hormis l'emplacement
55,1298,Jun 3 2009 	Fr eine Nacht okay Lage nicht gerade die Beste
56,1298,Jan 14 2008 	N'y allez surtout pas!
57,1298,Oct 16 2007 	Como dormir en la estacin
1,1301,Nov 23 2009 	Good value	Me and my partner have just stayed at this Travelodge whilst visiting the tennis at the o2.I was a bit weary about leaving my mini in the hotel carpark after reading previous reviews about carpark secruity and having walked to the all night shop around the corner I can see that the carpark could be better protected by a fence.We parked outside the front widow of the reception and had no problems.When we got to our room it was very clean and the bed was comfortable though take your earplugs due to the aircraft taking off.Overall the staff where helpfull and its very convenient for the o2 arena.
2,1301,"Nov 10 2009 	Avoid if possible	Arrived at 2pm to be charged an extra GBP10 for ''early check-in''. Room okay and clean, certainly devoid of any toiletries, shampoo etc... The lead in price of GBP19 rocketed to GBP99 as there was a conference on at Excel, which was my only reason to stay there.There are plenty of other hotels in the area so if you get the chance, stay somewhere else."
3,1301,"Oct 18 2009 	Comfortable value	We stayed here on 29th August, having booked their 19 room deal, which is fantastic value for London. The bedroom and bathroom was clean, the bed was comfortable and there were Tea/Coffee facilities in the room. This Travelodge also has a bar/restaurant and although we didnt use it looked good value  full English costing about 7. We wondered if it was a bit out of the way, wanting to visit the West End, but really the DLR makes it so easy. We experienced none of the rowdiness that you may get from late night clubbers in the city and being a weekend there were no planes from the small airport to disturb the peace either.The next night we stayed at Travelodge Tower Bridge and found the room there more cramped - no bedside table, just a cup size slot in the headboard and the desk/dressing table was much smaller - and a bit more down at heal. In preference, Id definitely choose to stay at Travelodge London City Airport."
4,1301,"Sep 9 2009 	Surprisingly good!	We were a bit worried having read the previous recent reviews, but from the moment we arrived all staff from reception to the bar to the chambermaids were great - very friendly and professional.We parked our car, which is not posh I should add(!), in view of reception, under a light, and it remained intact throughout our 2 night stay at a weekend.10 minutes walk to City Airport DLR station which connects pretty well with central London lines, but the underground does seem to have a lot of closures/works, so be prepared for thinking on your feet with regards to changes of lines etc.Hotel comfortable, bed ok, clean room and bathroom - request for more T bags was no problem, so all in all for 50 for 2 nights at a weekend, you can't really ask for more."
5,1301,"Aug 25 2009 	What a stay! Not Impressed!	After arriving at 3.30am, we booked in to only find that we were ignored as there was a pizza delivery for the reception staff. The wrong info given to us about the pay and display car park out side and no help with getting change for this.Woke up to find out our friends car had beeen broken into and on inspection, found inadequate CCTV covering the car park (my husbands a fire/security expert so he was not impressed) and broken glas all ove the car park from previous break in's. Their plight was not helped when we found out several cars had been broken into in that car park over the week. Totally unimpressed with the breakfast as I later found the I had food poisoning from the breakfast which just set it in stone never to return there again.We had a family room which didn't have the bed made up for our son and not enough towels or pillows let alone sheets!I'll never be booking this hotel again and will not reccommend it to anyone else and will make an official complaint to Travel Lodge office."
6,1301,"Aug 24 2009 	Vandalism Ignorance blind staff unhelpful	Recent 4 night stay, accommodation usual Travelodge standard, staff unhelpful and in no hurry to serve either at reception or at the bar. Car parked in car park with security camera costing 5 per 24hours. Second morning car found to have passenger side front window smashed and glove box open( very stupidley left sat nav in there) sat nav gone!! Reported to Travelodge reception said it was not thier problem car park managed by a company, company unhelpful as said they had offered Travelodge same security as at sister Travelodge in London Docklands but Travelodge had refused! Our's not the only car to have had this happen another family had suffered the same. Police and Autoglass repair man both said that it was a regular occourance that there are at least 3+ in this car park a week and more in the surrounding &quot;traveller&quot;hotels. Police had set decoy cars with tracker sat navs as bait found the the perpitraitors only to have another &quot;gang&quot; start on the area. Staff asked why there were no warning signs of problem, regarded it as not a travelodge problem. I am also led to belive that the marks on your windscreen attaract these thieves along with any identifcation that you are &quot;just passing through&quot; eg. country car stickers, hire car stickers, permits from your home town, car trinkets that sit on your dash board. Regardless of the sat nav being taken they would have smashed the glass anyway hoping to strike lucky and they did. Will never stay in this area again, be very aware if you are planning to stay here."
7,1301,"Aug 24 2009 	CRIME CENTRAL-Budget Hotel with Serious Security Issues	This is a typical Travelodge -Cheap value accomodation.The location next to the City Airport and DLR station is convenient for travelling to the hotel and into central London.Travelodge need to do something about staff training as attitude is less than helpful in most cases.DO NOT STAY AT THIS HOTEL IF YOU ARE PARKING A CAR!!!!!!The most serious issue with this hotel is security in the car park at night.We went down to our car at 5am in the morning with the intention to drive to Alton Towers with the kids. We found our car and another had been broken into- Smashed passenger window and contents of glove box removed in search of Sat Navs. Reported to staff at reception who stated that it was a regular occurrence. &quot;it always happens to the parts of the car park which can't be seen from reception.&quot; CSI attended scene several hours later reported that this was a regular stop for him. The Autoglass guy told us that this car park generated a huge amount of work for the company. &quot;look around the car park and you can see the evidence yourself-fragments of glass from the numerous incidents&quot; Don't let the camera fool you into thinking that this is secure.This issue could be resolved by having a fence around the edge of the grounds to limit access to the main entrance which could be monitored from reception and until this happens stay away from this hotel if you are parking a car. It cost us 50 excess on our insurance, 114 for forfeited prepaid tickets for Alton Towers, A nasty 5hr journey up the M6 on a Friday afternoon with a piece of plastic in the window and four distraught children."
8,1301,"Aug 24 2009 	Regular car break-ins - window smashed. Not impressed!!	We stayed at this Travelodge as we were working at Indigo2 on the Saturday night. Checked in at 3.15am Sunday morning after telling the hotel by phone we would be late - no problem and excellent service at that time of morning.Problem was that my car was broken into at 5.30am, the passenger door window was smashed. After informing the hotel management - it was a case of embarassed acceptance that it had happened many times before, its now a case of when next and they even know who the culprits are (read young hoodies) that come regularly on their pushbikes at that time of morning, seems they are after SatNavs - mines built in. The hotel security cameras are useless and do not cover the whole car park - guess where they target cars?.We waited five hours for the glass repairers - very busy as they had six similar cases that morning in the area at the budget hotels. I detect a theme here....... and the broken glass seen in daylight all over the car park tells a story - even in front of reception.Back to the hotel - grubby bar/breakfast area - the chairs and carpet were stained and there was some long term filth on the worktops. The stale smell turned out to be the guys use of a filthy mop on the serving area floor - not once did he wash it or use hot water/soap for the whole place!! The tables had that dirty cloth wiped look to them.Not impressed!!"
9,1301,"Jul 27 2009 	Second-rate	My sole purpose was in having a night stopover before taking an early business flight the next day from the nearby airport. It is not a 5 minute walk, more like 15 minutes, which makes a difference if it is raining, which it was. Poorly signposted for a pedestrian, if at all. The dreary, middle-aged woman at the desk was sulky, harrassed and rude. I was just a piece of meat to be processed as quickly as possible. I tried to crack a joke - no response whatsoever. Nearby, there was a young, black member of staff flicking coins monotonously into a drawer. After a long, stressful day, I found this really irritating. I was then given directions at 2000 miles an hour as to where to go, &quot;to the end and then right&quot;. I thought I caught the gist of it, but she was already engrossed in the next customer in the queue. I headed off, but was then bellowed at by some of the idle staff standing by - &quot;Heellllooooooo!!!!!!!!&quot;. No, excuse me, sir, this is the way to the lifts.Yes, no frills, but blimey surely a bare minimum degree of customer service is needed????"
10,1301,"Jul 25 2009 	Vandalism Microwave Food Un-proffesional Staff Attitude	Arrived at the lodge after a simple trip by car, enter the street name and city into Tom Tom as the postcode takes you on a lovely view of the Thames Barrier. The receptionist was ignorant, arrogant and was more interested in her mobile phone than the people waiting to check in. The room was adequate and of the normal Travelodge standard, TV picture was very weak but the sound levels were ok to drown out the DLR railway outside of my window. After a relaxing shower, very good, I ventured to the bar and ordered my food, soup and a burger, both microwaved, luke warm and very bland. I asked politely if the food could be warmed up and it was returned with boiling hot salad..... A good nights sleep was had and ready for the next day I returned to my car to find the passenger window knocked out and my glove box turned over (nothing of value left in the car overnight) as well as 4 other cars in the well lit car park, 5.00 for 24hrs. I returned to reception to be told that &quot;its happening all the time, there is nothing we can do&quot;. The police were called at 2am and I have a crime number, what I find amazing is that my car was in view of the reception but nothing was seen by the on duty receptionist ???? it was only the car alarms which alerted staff. I asked would it not be prudent to alert customers to the ongoing situation so at least steps could be taken to minimise the chance of break ins, ie: cleaning windscreens of Tom Tom bracket marks etc and to my amazement to receive the comment &quot;if we tell customers they won't stay again&quot; not wrong there einstein. To top off my day I was late for my meeting, did not win the contract and drove north with a plastic window in torrential rain for company and have a replacement bill of over 250.00 for the window. I WOULD NOT RECOMMEND THIS HOTEL TO MY WORST ENEMY."
11,1301,"Jul 24 2009 	Nice and convenient	Usual Travelodge experience - very reasonably priced with basic, clean rooms. It is really easy to catch the DLR from this hotel at just a short 10 minute walk to the nearest station, London City Airport. Convenient for the 02 Arena and other attractions near London Docklands. Costs 5 per day to park just outside the hotel. OverallI would recommend this hotel if you want no frills and a cheap night in London."
12,1301,"Jul 13 2009	Would never stay here again	Where to begin? First of all, too far out of the city. The DLR is in walking distance, but still a pain to get into the city. Second, no phones in the room, no alarms and none of the staff knew how to set the alarms on the tv (the remotes did not synch with the tvs), so kind of a pain getting up in the morning when you don't have your own alarm. It was clean and decent, but the staff was rude and everything was very bare and sparse. Not good for London tourists."
